{
  "document_metadata": {
    "title": "KICPA 심사·감리 지적사례",
    "document_type": "감리지적사례",
    "source": "한국공인회계사회(KICPA)",
    "subtitle": "2020년, 2021년, 2024년, 2025년 심사·감리결과 및 주요 지적사례",
    "total_cases": 80,
    "years_covered": [
      "2020",
      "2025"
    ],
    "created_date": "2025-01-08"
  },
  "cases": [
    {
      "paragraph_id": "KICPA-2020-01",
      "case_id": "KICPA-2020-01",
      "case_title": "수익 인식기준 적용 오류",
      "metadata": {
        "decision_year": "2020",
        "accounting_period": "’14.1.1.∼’15.12.31.\n1. 회사의 회계처리\n회사가 대리점에 공급한 제품 중 기말에 대리점이 보관중인 제품은 재고의 위험과 보상이\n대리점에게 이전되지 아니하였음에도 동 제품을 대리점에 공급한 시점에 매출로 잘못\n인식하여 자기자본 등을 과대계상함\n2. 회계기준 위반 지적 내용\n회사는 ‘15년도까지 대리점 등에 제품을 공급할 때 대리점수수료를 제외한 가격(도매\n가격)으로 수익을 인식하고 반품가능액을 추정하여 반품충당부채를 계상하는 회계처리를\n수행하다가\n- ‘16년에 대리점과의 판매 계약서를 ‘15년 이전 계약서에 있던 “매매일자를 대리점에\n상품을 발송한 날짜로 한다”는 조항을 제외하고 대신 “상품의 소유권이 회사에 있음”과\n“위탁판매 대금의 전반적인 소유는 회사에 있음”을 추가하는 것으로 변경하고\n- ‘15.1.1.을 K-IFRS 전환일로 하여 비교표시 된 전기 재무제표를 재작성하였고, 상기\n계약서 변경내용에 따라 수익인식 시기를 대리점 공급기준에서 최종소비자 판매기준\n으로 변경(회계정책의 변경으로 판단)하고 누적효과(소급적용) 등을 K-IFRS 도입\n효과의 일부인 것으로 공시함\n그러나 두 계약서를 비교한 결과 모두 재고관련 내용이 동일(재고의 통제권 및 재고의\n소유에 따른 위험과 보상이 회사에 있어 경제적 실질이 동일)하여 ‘16년 계약서의 변경\n전에도 대리점 매출에 대한 수익인식 시기를 대리점 공급기준이 아닌 최종 소비자 판매\n기준으로 했어야 함\n- 4 -\n즉, 거래의 경제적 실질을 고려하면 재화의 소유에 따른 위험과 보상 및 통제권이\n구매자에게 이전되었다고 볼 수 없으므로 최종소비자에게 판매하는 시점에 수익을\n인식하였어야 함에도 대리점에 공급한 시점에 수익을 인식함으로써 발생한 오류임\n3. 지적 근거 및 판단 내용\n일반기업회계기준 제16장(수익) 문단 16.10과 결16.7에 따르면 재화의 판매로 인한\n수익은 재화의 소유에 따른 위험과 보상이 구매자에게 이전될 때 인식하여야 하고,\n거래의 법적 형식보다는 경제적 실질에 따라 결정하도록 규정하고 있음\n4. 감사절차 미흡사항\n동 지적사례는 재무제표에 대한 심사로 종결되어 감사보고서 감리는 실시하지 아니함\n5. 시사점\n회사는 대리점 등을 통하여 최종소비자에게 판매하는 경우 대리점 등과 체결한 계약서의\n형식보다는 거래의 실질(재고의 위험을 누가 부담 하는가 등)에 따라 수익을 대리점에\n공급하는 시점에 인식할지 아니면 대리점이 최종소비자에게 판매하는 시점에 인식할지를\n판단하여야 함",
        "issue_fields": [
          "수익인식(본인 또는 대리인)"
        ],
        "related_standards": [
          "일반기업회계기준 제16장(수익)"
        ],
        "case_type": "회계감리지적사례",
        "source": "KICPA 심사·감리 지적사례"
      },
      "content": {
        "section_1_company_accounting": {
          "section_title": "회사의 회계처리",
          "content": "회사가 대리점에 공급한 제품 중 기말에 대리점이 보관중인 제품은 재고의 위험과 보상이\n대리점에게 이전되지 아니하였음에도 동 제품을 대리점에 공급한 시점에 매출로 잘못\n인식하여 자기자본 등을 과대계상함"
        },
        "section_2_violation_details": {
          "section_title": "회계기준 위반 지적 내용",
          "content": "회사는 ‘15년도까지 대리점 등에 제품을 공급할 때 대리점수수료를 제외한 가격(도매\n가격)으로 수익을 인식하고 반품가능액을 추정하여 반품충당부채를 계상하는 회계처리를\n수행하다가\n- ‘16년에 대리점과의 판매 계약서를 ‘15년 이전 계약서에 있던 “매매일자를 대리점에\n상품을 발송한 날짜로 한다”는 조항을 제외하고 대신 “상품의 소유권이 회사에 있음”과\n“위탁판매 대금의 전반적인 소유는 회사에 있음”을 추가하는 것으로 변경하고\n- ‘15.1.1.을 K-IFRS 전환일로 하여 비교표시 된 전기 재무제표를 재작성하였고, 상기\n계약서 변경내용에 따라 수익인식 시기를 대리점 공급기준에서 최종소비자 판매기준\n으로 변경(회계정책의 변경으로 판단)하고 누적효과(소급적용) 등을 K-IFRS 도입\n효과의 일부인 것으로 공시함\n그러나 두 계약서를 비교한 결과 모두 재고관련 내용이 동일(재고의 통제권 및 재고의\n소유에 따른 위험과 보상이 회사에 있어 경제적 실질이 동일)하여 ‘16년 계약서의 변경\n전에도 대리점 매출에 대한 수익인식 시기를 대리점 공급기준이 아닌 최종 소비자 판매\n기준으로 했어야 함\n- 4 -\n즉, 거래의 경제적 실질을 고려하면 재화의 소유에 따른 위험과 보상 및 통제권이\n구매자에게 이전되었다고 볼 수 없으므로 최종소비자에게 판매하는 시점에 수익을\n인식하였어야 함에도 대리점에 공급한 시점에 수익을 인식함으로써 발생한 오류임"
        },
        "section_3_basis_judgment": {
          "section_title": "지적 근거 및 판단 내용",
          "content": "일반기업회계기준 제16장(수익) 문단 16.10과 결16.7에 따르면 재화의 판매로 인한\n수익은 재화의 소유에 따른 위험과 보상이 구매자에게 이전될 때 인식하여야 하고,\n거래의 법적 형식보다는 경제적 실질에 따라 결정하도록 규정하고 있음"
        },
        "section_4_audit_procedure": {
          "section_title": "감사절차 미흡사항",
          "content": "동 지적사례는 재무제표에 대한 심사로 종결되어 감사보고서 감리는 실시하지 아니함"
        },
        "section_5_implications": {
          "section_title": "시사점",
          "content": "회사는 대리점 등을 통하여 최종소비자에게 판매하는 경우 대리점 등과 체결한 계약서의\n형식보다는 거래의 실질(재고의 위험을 누가 부담 하는가 등)에 따라 수익을 대리점에\n공급하는 시점에 인식할지 아니면 대리점이 최종소비자에게 판매하는 시점에 인식할지를\n판단하여야 함"
        }
      },
      "indexed_content": "케이스 ID: KICPA-2020-01\n제목: 수익 인식기준 적용 오류\n결정연도: 2020년\n회계결산일: ’14.1.1.∼’15.12.31.\n1. 회사의 회계처리\n회사가 대리점에 공급한 제품 중 기말에 대리점이 보관중인 제품은 재고의 위험과 보상이\n대리점에게 이전되지 아니하였음에도 동 제품을 대리점에 공급한 시점에 매출로 잘못\n인식하여 자기자본 등을 과대계상함\n2. 회계기준 위반 지적 내용\n회사는 ‘15년도까지 대리점 등에 제품을 공급할 때 대리점수수료를 제외한 가격(도매\n가격)으로 수익을 인식하고 반품가능액을 추정하여 반품충당부채를 계상하는 회계처리를\n수행하다가\n- ‘16년에 대리점과의 판매 계약서를 ‘15년 이전 계약서에 있던 “매매일자를 대리점에\n상품을 발송한 날짜로 한다”는 조항을 제외하고 대신 “상품의 소유권이 회사에 있음”과\n“위탁판매 대금의 전반적인 소유는 회사에 있음”을 추가하는 것으로 변경하고\n- ‘15.1.1.을 K-IFRS 전환일로 하여 비교표시 된 전기 재무제표를 재작성하였고, 상기\n계약서 변경내용에 따라 수익인식 시기를 대리점 공급기준에서 최종소비자 판매기준\n으로 변경(회계정책의 변경으로 판단)하고 누적효과(소급적용) 등을 K-IFRS 도입\n효과의 일부인 것으로 공시함\n그러나 두 계약서를 비교한 결과 모두 재고관련 내용이 동일(재고의 통제권 및 재고의\n소유에 따른 위험과 보상이 회사에 있어 경제적 실질이 동일)하여 ‘16년 계약서의 변경\n전에도 대리점 매출에 대한 수익인식 시기를 대리점 공급기준이 아닌 최종 소비자 판매\n기준으로 했어야 함\n- 4 -\n즉, 거래의 경제적 실질을 고려하면 재화의 소유에 따른 위험과 보상 및 통제권이\n구매자에게 이전되었다고 볼 수 없으므로 최종소비자에게 판매하는 시점에 수익을\n인식하였어야 함에도 대리점에 공급한 시점에 수익을 인식함으로써 발생한 오류임\n3. 지적 근거 및 판단 내용\n일반기업회계기준 제16장(수익) 문단 16.10과 결16.7에 따르면 재화의 판매로 인한\n수익은 재화의 소유에 따른 위험과 보상이 구매자에게 이전될 때 인식하여야 하고,\n거래의 법적 형식보다는 경제적 실질에 따라 결정하도록 규정하고 있음\n4. 감사절차 미흡사항\n동 지적사례는 재무제표에 대한 심사로 종결되어 감사보고서 감리는 실시하지 아니함\n5. 시사점\n회사는 대리점 등을 통하여 최종소비자에게 판매하는 경우 대리점 등과 체결한 계약서의\n형식보다는 거래의 실질(재고의 위험을 누가 부담 하는가 등)에 따라 수익을 대리점에\n공급하는 시점에 인식할지 아니면 대리점이 최종소비자에게 판매하는 시점에 인식할지를\n판단하여야 함\n쟁점분야: 수익인식(본인 또는 대리인)\n관련기준: 일반기업회계기준 제16장(수익)\n\n회사의 회계처리:\n회사가 대리점에 공급한 제품 중 기말에 대리점이 보관중인 제품은 재고의 위험과 보상이\n대리점에게 이전되지 아니하였음에도 동 제품을 대리점에 공급한 시점에 매출로 잘못\n인식하여 자기자본 등을 과대계상함\n\n회계기준 위반 지적 내용:\n회사는 ‘15년도까지 대리점 등에 제품을 공급할 때 대리점수수료를 제외한 가격(도매\n가격)으로 수익을 인식하고 반품가능액을 추정하여 반품충당부채를 계상하는 회계처리를\n수행하다가\n- ‘16년에 대리점과의 판매 계약서를 ‘15년 이전 계약서에 있던 “매매일자를 대리점에\n상품을 발송한 날짜로 한다”는 조항을 제외하고 대신 “상품의 소유권이 회사에 있음”과\n“위탁판매 대금의 전반적인 소유는 회사에 있음”을 추가하는 것으로 변경하고\n- ‘15.1.1.을 K-IFRS 전환일로 하여 비교표시 된 전기 재무제표를 재작성하였고, 상기\n계약서 변경내용에 따라 수익인식 시기를 대리점 공급기준에서 최종소비자 판매기준\n으로 변경(회계정책의 변경으로 판단)하고 누적효과(소급적용) 등을 K-IFRS 도입\n효과의 일부인 것으로 공시함\n그러나 두 계약서를 비교한 결과 모두 재고관련 내용이 동일(재고의 통제권 및 재고의\n소유에 따른 위험과 보상이 회사에 있어 경제적 실질이 동일)하여 ‘16년 계약서의 변경\n전에도 대리점 매출에 대한 수익인식 시기를 대리점 공급기준이 아닌 최종 소비자 판매\n기준으로 했어야 함\n- 4 -\n즉, 거래의 경제적 실질을 고려하면 재화의 소유에 따른 위험과 보상 및 통제권이\n구매자에게 이전되었다고 볼 수 없으므로 최종소비자에게 판매하는 시점에 수익을\n인식하였어야 함에도 대리점에 공급한 시점에 수익을 인식함으로써 발생한 오류임\n\n지적 근거 및 판단 내용:\n일반기업회계기준 제16장(수익) 문단 16.10과 결16.7에 따르면 재화의 판매로 인한\n수익은 재화의 소유에 따른 위험과 보상이 구매자에게 이전될 때 인식하여야 하고,\n거래의 법적 형식보다는 경제적 실질에 따라 결정하도록 규정하고 있음\n\n감사절차 미흡사항:\n동 지적사례는 재무제표에 대한 심사로 종결되어 감사보고서 감리는 실시하지 아니함\n\n시사점:\n회사는 대리점 등을 통하여 최종소비자에게 판매하는 경우 대리점 등과 체결한 계약서의\n형식보다는 거래의 실질(재고의 위험을 누가 부담 하는가 등)에 따라 수익을 대리점에\n공급하는 시점에 인식할지 아니면 대리점이 최종소비자에게 판매하는 시점에 인식할지를\n판단하여야 함"
    },
    {
      "paragraph_id": "KICPA-2020-02",
      "case_id": "KICPA-2020-02",
      "case_title": "매출채권 대손충당금 과소계상",
      "metadata": {
        "decision_year": "2020",
        "accounting_period": "’17.1.1.∼’17.12.31.\n1. 회사의 회계처리\n회사는 매출거래처가 폐업하거나 매출채권 발생이후 3년 이상 거래가 중지되어 사실상\n회수가 불가능한 것으로 판단되는 매출채권에 대하여 세법상 소멸시효가 경과하지\n않았다는 이유로 대손충당금을 계상하지 아니함\n- 5 -\n2. 회계기준 위반 지적 내용\n회사는 매출거래처의 부도 및 폐업 등으로 인하여 회수가 불확실한 채권에 대하여\n회수노력을 지속하고 있고, 과거 경험에 따르면 부도 및 폐업의 경우에도 거래처 상황에\n따라 관계사를 통하여 회수하기도 한다는 이유로 부실채권의 30%만을 대손충당금으로\n설정하고, 세법상 채권소멸시효 3년이 완성되는 시점에 전액 대손충당금을 설정함으로써\n매출채권 대손충당금을 과소계상함\n3. 지적 근거 및 판단 내용\n일반기업회계기준 제6장(금융자산·금융부채) 문단 6.17의2에 따르면 회수가 불확실한\n금융자산은 합리적이고 객관적인 기준에 따라 산출한 대손추산액을 대손충당금으로\n설정하도록 규정하고 있음\n4. 감사절차 미흡사항\n회계감사기준 200(독립된 감사인의 전반목적 및 감사기준에 따른 감사의 수행), 500\n(감사증거)과 700(재무제표에 대한 의견형성과 보고) 등에 따르면 감사인은 재무제표를\n중요하게 왜곡표시 시킬 수 있는 상황이 존재할 수 있다는 전문가적인 의구심을 가지고\n감사업무를 계획하고 수행하여야 하며, 감사인은 감사의견 형성의 기초가 될 합리적인\n감사결론을 도출할 수 있도록 충분하고 적합한 감사증거를 확보하여야 하고, 재무제표가\n일반적으로 인정된 회계처리기준에 따라 중요성의 관점에서 적정하게 표시되고 있다고\n판단했을 경우에만 적정의견을 표명하도록 규정되어 있는바,\n감사인은 회사가 주장하는 내용 외에 매출거래처의 폐업, 담보설정 여부 등을 추가적\n으로 확인하였어야 함에도, 이를 소홀히 하여 매출채권 대손충당금 과소계상을 발견\n하지 못함\n5. 시사점\n회사는 매출채권 대손충당금에 대한 구체적인 회계정책을 수립하고 매출채권 연령\n분석표 작성 등을 통해 장기미회수 채권에 대한 사유(매출처의 폐업과 재무적 곤경,\n채권회수기간의 경과, 향후 회수 계획 등)를 면밀히 검토하여 회수가능성을 평가하여야 함\n감사인은 장기 매출채권에 대하여 연령분석 등을 통하여 연체채권이 식별될 경우 매출\n거래처의 신용정보 및 국세청 휴·폐업조회 등을 통하여 거래처의 휴·폐업유무와 연체\n사유, 담보설정 여부 등을 확인하여 회수가능액의 적정성에 대한 감사절차를 실시하여야 함\n- 6 -",
        "issue_fields": [
          "채권의 회수가능성 평가"
        ],
        "related_standards": [
          "일반기업회계기준 제6장(금융자산·금융부채)"
        ],
        "case_type": "회계감리지적사례",
        "source": "KICPA 심사·감리 지적사례"
      },
      "content": {
        "section_1_company_accounting": {
          "section_title": "회사의 회계처리",
          "content": "회사는 매출거래처가 폐업하거나 매출채권 발생이후 3년 이상 거래가 중지되어 사실상\n회수가 불가능한 것으로 판단되는 매출채권에 대하여 세법상 소멸시효가 경과하지\n않았다는 이유로 대손충당금을 계상하지 아니함\n- 5 -"
        },
        "section_2_violation_details": {
          "section_title": "회계기준 위반 지적 내용",
          "content": "회사는 매출거래처의 부도 및 폐업 등으로 인하여 회수가 불확실한 채권에 대하여\n회수노력을 지속하고 있고, 과거 경험에 따르면 부도 및 폐업의 경우에도 거래처 상황에\n따라 관계사를 통하여 회수하기도 한다는 이유로 부실채권의 30%만을 대손충당금으로\n설정하고, 세법상 채권소멸시효 3년이 완성되는 시점에 전액 대손충당금을 설정함으로써\n매출채권 대손충당금을 과소계상함"
        },
        "section_3_basis_judgment": {
          "section_title": "지적 근거 및 판단 내용",
          "content": "일반기업회계기준 제6장(금융자산·금융부채) 문단 6.17의2에 따르면 회수가 불확실한\n금융자산은 합리적이고 객관적인 기준에 따라 산출한 대손추산액을 대손충당금으로\n설정하도록 규정하고 있음"
        },
        "section_4_audit_procedure": {
          "section_title": "감사절차 미흡사항",
          "content": "회계감사기준 200(독립된 감사인의 전반목적 및 감사기준에 따른 감사의 수행), 500\n(감사증거)과 700(재무제표에 대한 의견형성과 보고) 등에 따르면 감사인은 재무제표를\n중요하게 왜곡표시 시킬 수 있는 상황이 존재할 수 있다는 전문가적인 의구심을 가지고\n감사업무를 계획하고 수행하여야 하며, 감사인은 감사의견 형성의 기초가 될 합리적인\n감사결론을 도출할 수 있도록 충분하고 적합한 감사증거를 확보하여야 하고, 재무제표가\n일반적으로 인정된 회계처리기준에 따라 중요성의 관점에서 적정하게 표시되고 있다고\n판단했을 경우에만 적정의견을 표명하도록 규정되어 있는바,\n감사인은 회사가 주장하는 내용 외에 매출거래처의 폐업, 담보설정 여부 등을 추가적\n으로 확인하였어야 함에도, 이를 소홀히 하여 매출채권 대손충당금 과소계상을 발견\n하지 못함"
        },
        "section_5_implications": {
          "section_title": "시사점",
          "content": "회사는 매출채권 대손충당금에 대한 구체적인 회계정책을 수립하고 매출채권 연령\n분석표 작성 등을 통해 장기미회수 채권에 대한 사유(매출처의 폐업과 재무적 곤경,\n채권회수기간의 경과, 향후 회수 계획 등)를 면밀히 검토하여 회수가능성을 평가하여야 함\n감사인은 장기 매출채권에 대하여 연령분석 등을 통하여 연체채권이 식별될 경우 매출\n거래처의 신용정보 및 국세청 휴·폐업조회 등을 통하여 거래처의 휴·폐업유무와 연체\n사유, 담보설정 여부 등을 확인하여 회수가능액의 적정성에 대한 감사절차를 실시하여야 함\n- 6 -"
        }
      },
      "indexed_content": "케이스 ID: KICPA-2020-02\n제목: 매출채권 대손충당금 과소계상\n결정연도: 2020년\n회계결산일: ’17.1.1.∼’17.12.31.\n1. 회사의 회계처리\n회사는 매출거래처가 폐업하거나 매출채권 발생이후 3년 이상 거래가 중지되어 사실상\n회수가 불가능한 것으로 판단되는 매출채권에 대하여 세법상 소멸시효가 경과하지\n않았다는 이유로 대손충당금을 계상하지 아니함\n- 5 -\n2. 회계기준 위반 지적 내용\n회사는 매출거래처의 부도 및 폐업 등으로 인하여 회수가 불확실한 채권에 대하여\n회수노력을 지속하고 있고, 과거 경험에 따르면 부도 및 폐업의 경우에도 거래처 상황에\n따라 관계사를 통하여 회수하기도 한다는 이유로 부실채권의 30%만을 대손충당금으로\n설정하고, 세법상 채권소멸시효 3년이 완성되는 시점에 전액 대손충당금을 설정함으로써\n매출채권 대손충당금을 과소계상함\n3. 지적 근거 및 판단 내용\n일반기업회계기준 제6장(금융자산·금융부채) 문단 6.17의2에 따르면 회수가 불확실한\n금융자산은 합리적이고 객관적인 기준에 따라 산출한 대손추산액을 대손충당금으로\n설정하도록 규정하고 있음\n4. 감사절차 미흡사항\n회계감사기준 200(독립된 감사인의 전반목적 및 감사기준에 따른 감사의 수행), 500\n(감사증거)과 700(재무제표에 대한 의견형성과 보고) 등에 따르면 감사인은 재무제표를\n중요하게 왜곡표시 시킬 수 있는 상황이 존재할 수 있다는 전문가적인 의구심을 가지고\n감사업무를 계획하고 수행하여야 하며, 감사인은 감사의견 형성의 기초가 될 합리적인\n감사결론을 도출할 수 있도록 충분하고 적합한 감사증거를 확보하여야 하고, 재무제표가\n일반적으로 인정된 회계처리기준에 따라 중요성의 관점에서 적정하게 표시되고 있다고\n판단했을 경우에만 적정의견을 표명하도록 규정되어 있는바,\n감사인은 회사가 주장하는 내용 외에 매출거래처의 폐업, 담보설정 여부 등을 추가적\n으로 확인하였어야 함에도, 이를 소홀히 하여 매출채권 대손충당금 과소계상을 발견\n하지 못함\n5. 시사점\n회사는 매출채권 대손충당금에 대한 구체적인 회계정책을 수립하고 매출채권 연령\n분석표 작성 등을 통해 장기미회수 채권에 대한 사유(매출처의 폐업과 재무적 곤경,\n채권회수기간의 경과, 향후 회수 계획 등)를 면밀히 검토하여 회수가능성을 평가하여야 함\n감사인은 장기 매출채권에 대하여 연령분석 등을 통하여 연체채권이 식별될 경우 매출\n거래처의 신용정보 및 국세청 휴·폐업조회 등을 통하여 거래처의 휴·폐업유무와 연체\n사유, 담보설정 여부 등을 확인하여 회수가능액의 적정성에 대한 감사절차를 실시하여야 함\n- 6 -\n쟁점분야: 채권의 회수가능성 평가\n관련기준: 일반기업회계기준 제6장(금융자산·금융부채)\n\n회사의 회계처리:\n회사는 매출거래처가 폐업하거나 매출채권 발생이후 3년 이상 거래가 중지되어 사실상\n회수가 불가능한 것으로 판단되는 매출채권에 대하여 세법상 소멸시효가 경과하지\n않았다는 이유로 대손충당금을 계상하지 아니함\n- 5 -\n\n회계기준 위반 지적 내용:\n회사는 매출거래처의 부도 및 폐업 등으로 인하여 회수가 불확실한 채권에 대하여\n회수노력을 지속하고 있고, 과거 경험에 따르면 부도 및 폐업의 경우에도 거래처 상황에\n따라 관계사를 통하여 회수하기도 한다는 이유로 부실채권의 30%만을 대손충당금으로\n설정하고, 세법상 채권소멸시효 3년이 완성되는 시점에 전액 대손충당금을 설정함으로써\n매출채권 대손충당금을 과소계상함\n\n지적 근거 및 판단 내용:\n일반기업회계기준 제6장(금융자산·금융부채) 문단 6.17의2에 따르면 회수가 불확실한\n금융자산은 합리적이고 객관적인 기준에 따라 산출한 대손추산액을 대손충당금으로\n설정하도록 규정하고 있음\n\n감사절차 미흡사항:\n회계감사기준 200(독립된 감사인의 전반목적 및 감사기준에 따른 감사의 수행), 500\n(감사증거)과 700(재무제표에 대한 의견형성과 보고) 등에 따르면 감사인은 재무제표를\n중요하게 왜곡표시 시킬 수 있는 상황이 존재할 수 있다는 전문가적인 의구심을 가지고\n감사업무를 계획하고 수행하여야 하며, 감사인은 감사의견 형성의 기초가 될 합리적인\n감사결론을 도출할 수 있도록 충분하고 적합한 감사증거를 확보하여야 하고, 재무제표가\n일반적으로 인정된 회계처리기준에 따라 중요성의 관점에서 적정하게 표시되고 있다고\n판단했을 경우에만 적정의견을 표명하도록 규정되어 있는바,\n감사인은 회사가 주장하는 내용 외에 매출거래처의 폐업, 담보설정 여부 등을 추가적\n으로 확인하였어야 함에도, 이를 소홀히 하여 매출채권 대손충당금 과소계상을 발견\n하지 못함\n\n시사점:\n회사는 매출채권 대손충당금에 대한 구체적인 회계정책을 수립하고 매출채권 연령\n분석표 작성 등을 통해 장기미회수 채권에 대한 사유(매출처의 폐업과 재무적 곤경,\n채권회수기간의 경과, 향후 회수 계획 등)를 면밀히 검토하여 회수가능성을 평가하여야 함\n감사인은 장기 매출채권에 대하여 연령분석 등을 통하여 연체채권이 식별될 경우 매출\n거래처의 신용정보 및 국세청 휴·폐업조회 등을 통하여 거래처의 휴·폐업유무와 연체\n사유, 담보설정 여부 등을 확인하여 회수가능액의 적정성에 대한 감사절차를 실시하여야 함\n- 6 -"
    },
    {
      "paragraph_id": "KICPA-2020-03",
      "case_id": "KICPA-2020-03",
      "case_title": "매출채권 등 대손충당금 과소계상",
      "metadata": {
        "decision_year": "2020",
        "accounting_period": "’16.1.1.∼’17.12.31.\n1. 회사의 회계처리\n회사가 매출채권 등에 대한 회수가능성을 평가하면서 미회수 기간에 대응하는 적절한\n대손율을 반영하지 아니하고, 또한 계열사의 장기 미회수 채권의 경우 개별 회수가능성을\n고려하지 않아 대손충당금을 과소계상함\n2. 회계기준 위반 지적 내용\n회사는 매출채권에 대한 회수가능성을 평가하면서\n- 총 매출채권을 일반채권과 해외종속회사 채권으로 분류한 후, 일반채권을 정상거래처\n채권과 부도거래처 채권으로 구분하여, 정상거래처 채권에 일률적으로 과거 5년간의\n실제 대손경험률을 적용하여 평가한 금액에 부도난 거래처 채권(100%)을 더하여 대손\n충당금을 설정하였고,\n- 종속회사 채권의 경우 1년 미만 채권은 과거 5년간의 실제 대손경험률을 적용하고,\n1년 이상된 채권은 50%의 대손율을 적용하는 등 단일의 대손설정률을 적용함으로써\n결과적으로 대손충당금을 과소계상함\n3. 지적 근거 및 판단 내용\n일반기업회계기준 제6장(금융자산, 금융부채) 문단 6.17의2에 따르면 회수가 불확실한\n금융자산은 합리적이고 객관적인 기준에 따라 산출한 대손추산액을 대손충당금으로\n설정하도록 규정하고 있음\n4. 감사절차 미흡사항\n동 지적사례는 재무제표에 대한 심사로 종결되어 감사보고서 감리는 실시하지 아니함\n- 7 -\n5. 시사점\n회사는 회수가 불확실한 채권에 대하여 합리적이고 객관적인 기준을 적용하여 산출한\n대손추산액을 대손충당금으로 설정하여야 하고, 종속회사채권의 경우에도 자본잠식 등\n재무구조가 악화된 경우 채권의 회수가능성을 객관적으로 평가하여 대손추산액을 설정\n하여야 함",
        "issue_fields": [
          "채권의 회수가능성 평가"
        ],
        "related_standards": [
          "일반기업회계기준 제6장(금융자산",
          "금융부채)"
        ],
        "case_type": "회계감리지적사례",
        "source": "KICPA 심사·감리 지적사례"
      },
      "content": {
        "section_1_company_accounting": {
          "section_title": "회사의 회계처리",
          "content": "회사가 매출채권 등에 대한 회수가능성을 평가하면서 미회수 기간에 대응하는 적절한\n대손율을 반영하지 아니하고, 또한 계열사의 장기 미회수 채권의 경우 개별 회수가능성을\n고려하지 않아 대손충당금을 과소계상함"
        },
        "section_2_violation_details": {
          "section_title": "회계기준 위반 지적 내용",
          "content": "회사는 매출채권에 대한 회수가능성을 평가하면서\n- 총 매출채권을 일반채권과 해외종속회사 채권으로 분류한 후, 일반채권을 정상거래처\n채권과 부도거래처 채권으로 구분하여, 정상거래처 채권에 일률적으로 과거 5년간의\n실제 대손경험률을 적용하여 평가한 금액에 부도난 거래처 채권(100%)을 더하여 대손\n충당금을 설정하였고,\n- 종속회사 채권의 경우 1년 미만 채권은 과거 5년간의 실제 대손경험률을 적용하고,\n1년 이상된 채권은 50%의 대손율을 적용하는 등 단일의 대손설정률을 적용함으로써\n결과적으로 대손충당금을 과소계상함"
        },
        "section_3_basis_judgment": {
          "section_title": "지적 근거 및 판단 내용",
          "content": "일반기업회계기준 제6장(금융자산, 금융부채) 문단 6.17의2에 따르면 회수가 불확실한\n금융자산은 합리적이고 객관적인 기준에 따라 산출한 대손추산액을 대손충당금으로\n설정하도록 규정하고 있음"
        },
        "section_4_audit_procedure": {
          "section_title": "감사절차 미흡사항",
          "content": "동 지적사례는 재무제표에 대한 심사로 종결되어 감사보고서 감리는 실시하지 아니함\n- 7 -"
        },
        "section_5_implications": {
          "section_title": "시사점",
          "content": "회사는 회수가 불확실한 채권에 대하여 합리적이고 객관적인 기준을 적용하여 산출한\n대손추산액을 대손충당금으로 설정하여야 하고, 종속회사채권의 경우에도 자본잠식 등\n재무구조가 악화된 경우 채권의 회수가능성을 객관적으로 평가하여 대손추산액을 설정\n하여야 함"
        }
      },
      "indexed_content": "케이스 ID: KICPA-2020-03\n제목: 매출채권 등 대손충당금 과소계상\n결정연도: 2020년\n회계결산일: ’16.1.1.∼’17.12.31.\n1. 회사의 회계처리\n회사가 매출채권 등에 대한 회수가능성을 평가하면서 미회수 기간에 대응하는 적절한\n대손율을 반영하지 아니하고, 또한 계열사의 장기 미회수 채권의 경우 개별 회수가능성을\n고려하지 않아 대손충당금을 과소계상함\n2. 회계기준 위반 지적 내용\n회사는 매출채권에 대한 회수가능성을 평가하면서\n- 총 매출채권을 일반채권과 해외종속회사 채권으로 분류한 후, 일반채권을 정상거래처\n채권과 부도거래처 채권으로 구분하여, 정상거래처 채권에 일률적으로 과거 5년간의\n실제 대손경험률을 적용하여 평가한 금액에 부도난 거래처 채권(100%)을 더하여 대손\n충당금을 설정하였고,\n- 종속회사 채권의 경우 1년 미만 채권은 과거 5년간의 실제 대손경험률을 적용하고,\n1년 이상된 채권은 50%의 대손율을 적용하는 등 단일의 대손설정률을 적용함으로써\n결과적으로 대손충당금을 과소계상함\n3. 지적 근거 및 판단 내용\n일반기업회계기준 제6장(금융자산, 금융부채) 문단 6.17의2에 따르면 회수가 불확실한\n금융자산은 합리적이고 객관적인 기준에 따라 산출한 대손추산액을 대손충당금으로\n설정하도록 규정하고 있음\n4. 감사절차 미흡사항\n동 지적사례는 재무제표에 대한 심사로 종결되어 감사보고서 감리는 실시하지 아니함\n- 7 -\n5. 시사점\n회사는 회수가 불확실한 채권에 대하여 합리적이고 객관적인 기준을 적용하여 산출한\n대손추산액을 대손충당금으로 설정하여야 하고, 종속회사채권의 경우에도 자본잠식 등\n재무구조가 악화된 경우 채권의 회수가능성을 객관적으로 평가하여 대손추산액을 설정\n하여야 함\n쟁점분야: 채권의 회수가능성 평가\n관련기준: 일반기업회계기준 제6장(금융자산, 금융부채)\n\n회사의 회계처리:\n회사가 매출채권 등에 대한 회수가능성을 평가하면서 미회수 기간에 대응하는 적절한\n대손율을 반영하지 아니하고, 또한 계열사의 장기 미회수 채권의 경우 개별 회수가능성을\n고려하지 않아 대손충당금을 과소계상함\n\n회계기준 위반 지적 내용:\n회사는 매출채권에 대한 회수가능성을 평가하면서\n- 총 매출채권을 일반채권과 해외종속회사 채권으로 분류한 후, 일반채권을 정상거래처\n채권과 부도거래처 채권으로 구분하여, 정상거래처 채권에 일률적으로 과거 5년간의\n실제 대손경험률을 적용하여 평가한 금액에 부도난 거래처 채권(100%)을 더하여 대손\n충당금을 설정하였고,\n- 종속회사 채권의 경우 1년 미만 채권은 과거 5년간의 실제 대손경험률을 적용하고,\n1년 이상된 채권은 50%의 대손율을 적용하는 등 단일의 대손설정률을 적용함으로써\n결과적으로 대손충당금을 과소계상함\n\n지적 근거 및 판단 내용:\n일반기업회계기준 제6장(금융자산, 금융부채) 문단 6.17의2에 따르면 회수가 불확실한\n금융자산은 합리적이고 객관적인 기준에 따라 산출한 대손추산액을 대손충당금으로\n설정하도록 규정하고 있음\n\n감사절차 미흡사항:\n동 지적사례는 재무제표에 대한 심사로 종결되어 감사보고서 감리는 실시하지 아니함\n- 7 -\n\n시사점:\n회사는 회수가 불확실한 채권에 대하여 합리적이고 객관적인 기준을 적용하여 산출한\n대손추산액을 대손충당금으로 설정하여야 하고, 종속회사채권의 경우에도 자본잠식 등\n재무구조가 악화된 경우 채권의 회수가능성을 객관적으로 평가하여 대손추산액을 설정\n하여야 함"
    },
    {
      "paragraph_id": "KICPA-2020-04",
      "case_id": "KICPA-2020-04",
      "case_title": "매출채권 대손충당금 과소계상",
      "metadata": {
        "decision_year": "2020",
        "accounting_period": "’16.10.1.∼’18.9.30.\n1. 회사의 회계처리\n회사는 해외현지법인의 청산으로 회수가 불가능한 것으로 판단되는 매출채권에 대하여\n세법상 소멸시효기간이 경과하지 않았다는 이유로 대손충당금을 과소계상함\n2. 회계기준 위반 지적 내용\n회사는 주요 매출 거래처인 OO전자㈜가 중국에 공장을 신설하는 등 투자를 확대함에\n따라 해외현지법인을 06년에 설립하였으나, 해외현지법인은 OO전자㈜에 대한 수주경쟁\n에서 중국현지업체에 가격경쟁력에 밀려 실적감소에 따라 재무구조가 악화되어 ‘17년\n1월에 청산함. 회사는 해외현지법인에 대한 채권에 대하여 해외현지법인의 청산으로\n회수가 불가능함에도 불구하고 세법상 소멸시효기간이 경과되지 않았다는 이유만으로\n세법상 대손율 1%설정 이외 추가적으로 설정하지 아니하여 대손충당금을 과소계상함\n3. 지적 근거 및 판단 내용\n일반기업회계기준 제6장(금융자산·금융부채) 문단 6.17의2에 따르면 회수가 불확실한\n금융자산은 합리적이고 객관적인 기준에 따라 산출한 대손추산액을 대손충당금으로\n설정하도록 규정하고 있음\n- 8 -\n4. 감사절차 미흡사항\n회계감사기준 200(독립된 감사인의 전반목적 및 감사기준에 따른 감사의 수행), 500\n(감사증거)과 700(재무제표에 대한 의견형성과 보고) 등에 따르면 감사인은 재무제표를\n중요하게 왜곡표시 시킬 수 있는 상황이 존재할 수 있다는 전문가적인 의구심을 가지고\n감사업무를 계획하고 수행하여야 하며, 감사인은 감사의견 형성의 기초가 될 합리적인\n감사결론을 도출할 수 있도록 충분하고 적합한 감사증거를 확보하여야 하고, 재무제표가\n일반적으로 인정된 회계처리기준에 따라 중요성의 관점에서 적정하게 표시되고 있다고\n판단했을 경우에만 적정의견을 표명하도록 규정되어 있는바,\n감사인은 회사가 주장하는 내용 외에 매출거래처의 폐업, 담보설정 여부 등을 추가적\n으로 확인하였어야 함에도, 이를 소홀히 하여 매출채권 등 대손충당금 과소계상을\n발견하지 못함\n5. 시사점\n회사는 매출채권 대손충당금에 대한 구체적인 회계정책을 수립하고 매출채권 연령 분석표\n작성 등을 통해 장기미회수 채권에 대한 회수지연현황과 그 사유(매출처의 폐업과 재무적\n곤경, 채권회수기간의 경과, 향후 회수 계획 등)를 면밀히 검토하여 회수가능성을 평가\n하여야 함\n감사인은 장기 매출채권에 대하여 연령분석 등을 통하여 연체채권이 식별될 경우 매출\n거래처의 신용정보 및 국세청 휴·폐업조회 등을 통하여 거래처의 휴·폐업유무와 연체\n사유, 담보설정 여부 등을 확인하여 회수가능액의 적정성에 대한 감사절차를 실시하여야 함\n- 9 -",
        "issue_fields": [
          "채권의 회수가능성 평가"
        ],
        "related_standards": [
          "일반기업회계기준 제6장(금융자산·금융부채)"
        ],
        "case_type": "회계감리지적사례",
        "source": "KICPA 심사·감리 지적사례"
      },
      "content": {
        "section_1_company_accounting": {
          "section_title": "회사의 회계처리",
          "content": "회사는 해외현지법인의 청산으로 회수가 불가능한 것으로 판단되는 매출채권에 대하여\n세법상 소멸시효기간이 경과하지 않았다는 이유로 대손충당금을 과소계상함"
        },
        "section_2_violation_details": {
          "section_title": "회계기준 위반 지적 내용",
          "content": "회사는 주요 매출 거래처인 OO전자㈜가 중국에 공장을 신설하는 등 투자를 확대함에\n따라 해외현지법인을 06년에 설립하였으나, 해외현지법인은 OO전자㈜에 대한 수주경쟁\n에서 중국현지업체에 가격경쟁력에 밀려 실적감소에 따라 재무구조가 악화되어 ‘17년\n1월에 청산함. 회사는 해외현지법인에 대한 채권에 대하여 해외현지법인의 청산으로\n회수가 불가능함에도 불구하고 세법상 소멸시효기간이 경과되지 않았다는 이유만으로\n세법상 대손율 1%설정 이외 추가적으로 설정하지 아니하여 대손충당금을 과소계상함"
        },
        "section_3_basis_judgment": {
          "section_title": "지적 근거 및 판단 내용",
          "content": "일반기업회계기준 제6장(금융자산·금융부채) 문단 6.17의2에 따르면 회수가 불확실한\n금융자산은 합리적이고 객관적인 기준에 따라 산출한 대손추산액을 대손충당금으로\n설정하도록 규정하고 있음\n- 8 -"
        },
        "section_4_audit_procedure": {
          "section_title": "감사절차 미흡사항",
          "content": "회계감사기준 200(독립된 감사인의 전반목적 및 감사기준에 따른 감사의 수행), 500\n(감사증거)과 700(재무제표에 대한 의견형성과 보고) 등에 따르면 감사인은 재무제표를\n중요하게 왜곡표시 시킬 수 있는 상황이 존재할 수 있다는 전문가적인 의구심을 가지고\n감사업무를 계획하고 수행하여야 하며, 감사인은 감사의견 형성의 기초가 될 합리적인\n감사결론을 도출할 수 있도록 충분하고 적합한 감사증거를 확보하여야 하고, 재무제표가\n일반적으로 인정된 회계처리기준에 따라 중요성의 관점에서 적정하게 표시되고 있다고\n판단했을 경우에만 적정의견을 표명하도록 규정되어 있는바,\n감사인은 회사가 주장하는 내용 외에 매출거래처의 폐업, 담보설정 여부 등을 추가적\n으로 확인하였어야 함에도, 이를 소홀히 하여 매출채권 등 대손충당금 과소계상을\n발견하지 못함"
        },
        "section_5_implications": {
          "section_title": "시사점",
          "content": "회사는 매출채권 대손충당금에 대한 구체적인 회계정책을 수립하고 매출채권 연령 분석표\n작성 등을 통해 장기미회수 채권에 대한 회수지연현황과 그 사유(매출처의 폐업과 재무적\n곤경, 채권회수기간의 경과, 향후 회수 계획 등)를 면밀히 검토하여 회수가능성을 평가\n하여야 함\n감사인은 장기 매출채권에 대하여 연령분석 등을 통하여 연체채권이 식별될 경우 매출\n거래처의 신용정보 및 국세청 휴·폐업조회 등을 통하여 거래처의 휴·폐업유무와 연체\n사유, 담보설정 여부 등을 확인하여 회수가능액의 적정성에 대한 감사절차를 실시하여야 함\n- 9 -"
        }
      },
      "indexed_content": "케이스 ID: KICPA-2020-04\n제목: 매출채권 대손충당금 과소계상\n결정연도: 2020년\n회계결산일: ’16.10.1.∼’18.9.30.\n1. 회사의 회계처리\n회사는 해외현지법인의 청산으로 회수가 불가능한 것으로 판단되는 매출채권에 대하여\n세법상 소멸시효기간이 경과하지 않았다는 이유로 대손충당금을 과소계상함\n2. 회계기준 위반 지적 내용\n회사는 주요 매출 거래처인 OO전자㈜가 중국에 공장을 신설하는 등 투자를 확대함에\n따라 해외현지법인을 06년에 설립하였으나, 해외현지법인은 OO전자㈜에 대한 수주경쟁\n에서 중국현지업체에 가격경쟁력에 밀려 실적감소에 따라 재무구조가 악화되어 ‘17년\n1월에 청산함. 회사는 해외현지법인에 대한 채권에 대하여 해외현지법인의 청산으로\n회수가 불가능함에도 불구하고 세법상 소멸시효기간이 경과되지 않았다는 이유만으로\n세법상 대손율 1%설정 이외 추가적으로 설정하지 아니하여 대손충당금을 과소계상함\n3. 지적 근거 및 판단 내용\n일반기업회계기준 제6장(금융자산·금융부채) 문단 6.17의2에 따르면 회수가 불확실한\n금융자산은 합리적이고 객관적인 기준에 따라 산출한 대손추산액을 대손충당금으로\n설정하도록 규정하고 있음\n- 8 -\n4. 감사절차 미흡사항\n회계감사기준 200(독립된 감사인의 전반목적 및 감사기준에 따른 감사의 수행), 500\n(감사증거)과 700(재무제표에 대한 의견형성과 보고) 등에 따르면 감사인은 재무제표를\n중요하게 왜곡표시 시킬 수 있는 상황이 존재할 수 있다는 전문가적인 의구심을 가지고\n감사업무를 계획하고 수행하여야 하며, 감사인은 감사의견 형성의 기초가 될 합리적인\n감사결론을 도출할 수 있도록 충분하고 적합한 감사증거를 확보하여야 하고, 재무제표가\n일반적으로 인정된 회계처리기준에 따라 중요성의 관점에서 적정하게 표시되고 있다고\n판단했을 경우에만 적정의견을 표명하도록 규정되어 있는바,\n감사인은 회사가 주장하는 내용 외에 매출거래처의 폐업, 담보설정 여부 등을 추가적\n으로 확인하였어야 함에도, 이를 소홀히 하여 매출채권 등 대손충당금 과소계상을\n발견하지 못함\n5. 시사점\n회사는 매출채권 대손충당금에 대한 구체적인 회계정책을 수립하고 매출채권 연령 분석표\n작성 등을 통해 장기미회수 채권에 대한 회수지연현황과 그 사유(매출처의 폐업과 재무적\n곤경, 채권회수기간의 경과, 향후 회수 계획 등)를 면밀히 검토하여 회수가능성을 평가\n하여야 함\n감사인은 장기 매출채권에 대하여 연령분석 등을 통하여 연체채권이 식별될 경우 매출\n거래처의 신용정보 및 국세청 휴·폐업조회 등을 통하여 거래처의 휴·폐업유무와 연체\n사유, 담보설정 여부 등을 확인하여 회수가능액의 적정성에 대한 감사절차를 실시하여야 함\n- 9 -\n쟁점분야: 채권의 회수가능성 평가\n관련기준: 일반기업회계기준 제6장(금융자산·금융부채)\n\n회사의 회계처리:\n회사는 해외현지법인의 청산으로 회수가 불가능한 것으로 판단되는 매출채권에 대하여\n세법상 소멸시효기간이 경과하지 않았다는 이유로 대손충당금을 과소계상함\n\n회계기준 위반 지적 내용:\n회사는 주요 매출 거래처인 OO전자㈜가 중국에 공장을 신설하는 등 투자를 확대함에\n따라 해외현지법인을 06년에 설립하였으나, 해외현지법인은 OO전자㈜에 대한 수주경쟁\n에서 중국현지업체에 가격경쟁력에 밀려 실적감소에 따라 재무구조가 악화되어 ‘17년\n1월에 청산함. 회사는 해외현지법인에 대한 채권에 대하여 해외현지법인의 청산으로\n회수가 불가능함에도 불구하고 세법상 소멸시효기간이 경과되지 않았다는 이유만으로\n세법상 대손율 1%설정 이외 추가적으로 설정하지 아니하여 대손충당금을 과소계상함\n\n지적 근거 및 판단 내용:\n일반기업회계기준 제6장(금융자산·금융부채) 문단 6.17의2에 따르면 회수가 불확실한\n금융자산은 합리적이고 객관적인 기준에 따라 산출한 대손추산액을 대손충당금으로\n설정하도록 규정하고 있음\n- 8 -\n\n감사절차 미흡사항:\n회계감사기준 200(독립된 감사인의 전반목적 및 감사기준에 따른 감사의 수행), 500\n(감사증거)과 700(재무제표에 대한 의견형성과 보고) 등에 따르면 감사인은 재무제표를\n중요하게 왜곡표시 시킬 수 있는 상황이 존재할 수 있다는 전문가적인 의구심을 가지고\n감사업무를 계획하고 수행하여야 하며, 감사인은 감사의견 형성의 기초가 될 합리적인\n감사결론을 도출할 수 있도록 충분하고 적합한 감사증거를 확보하여야 하고, 재무제표가\n일반적으로 인정된 회계처리기준에 따라 중요성의 관점에서 적정하게 표시되고 있다고\n판단했을 경우에만 적정의견을 표명하도록 규정되어 있는바,\n감사인은 회사가 주장하는 내용 외에 매출거래처의 폐업, 담보설정 여부 등을 추가적\n으로 확인하였어야 함에도, 이를 소홀히 하여 매출채권 등 대손충당금 과소계상을\n발견하지 못함\n\n시사점:\n회사는 매출채권 대손충당금에 대한 구체적인 회계정책을 수립하고 매출채권 연령 분석표\n작성 등을 통해 장기미회수 채권에 대한 회수지연현황과 그 사유(매출처의 폐업과 재무적\n곤경, 채권회수기간의 경과, 향후 회수 계획 등)를 면밀히 검토하여 회수가능성을 평가\n하여야 함\n감사인은 장기 매출채권에 대하여 연령분석 등을 통하여 연체채권이 식별될 경우 매출\n거래처의 신용정보 및 국세청 휴·폐업조회 등을 통하여 거래처의 휴·폐업유무와 연체\n사유, 담보설정 여부 등을 확인하여 회수가능액의 적정성에 대한 감사절차를 실시하여야 함\n- 9 -"
    },
    {
      "paragraph_id": "KICPA-2020-05",
      "case_id": "KICPA-2020-05",
      "case_title": "매출채권 등 대손충당금 과소계상",
      "metadata": {
        "decision_year": "2020",
        "accounting_period": "’17.1.1.∼’17.12.31.\n1. 회사의 회계처리\n회사는 채권에 대한 회수가능성을 평가하고 회수가능가액으로 채권을 재무제표에 표시\n하여야 하나, 부실채권에 대해 세법상 대손설정률(1%)을 일괄적으로 적용하여 대손\n충당금을 계상함으로써 채권을 과대 표시함\n2. 회계기준 위반 지적 내용\n회사는 매출채권과 단기대여금 등에 대한 대손충당금을 인식함에 있어서 매출거래처\n와의 소송진행, 폐업, 장기미회수 사유 등 채권 회수가 불확실한 상황을 채권의 회수\n가능성 평가에 반영하지 않고, 세법상의 대손설정률(1%)을 일괄적으로 적용함에 따라\n대손충당금을 과소계상함\n3. 지적 근거 및 판단 내용\n일반기업회계기준 제6장(금융자산·금융부채) 문단 6.17의2에 의하면 회수가 불확실한\n금융자산은 합리적이고 객관적인 기준에 따라 산출한 대손추산액을 대손충당금으로\n설정하도록 규정되어 있음\n4. 감사절차 미흡사항\n회계감사기준 200(독립된 감사인의 전반목적 및 감사기준에 따른 감사의 수행), 500\n(감사증거)과 700(재무제표에 대한 의견형성과 보고) 등에 따르면 감사인은 재무제표\n를 중요하게 왜곡표시 시킬 수 있는 상황이 존재할 수 있다는 전문가적인 의구심을\n가지고 감사업무를 계획하고 수행하여야 하며, 감사인은 감사의견 형성의 기초가 될\n합리적인 감사결론을 도출할 수 있도록 충분하고 적합한 감사증거를 확보하여야 하고,\n재무제표가 일반적으로 인정된 회계처리기준에 따라 중요성의 관점에서 적정하게 표시\n되고 있다고 판단했을 경우에만 적정의견을 표명하도록 규정되어 있는바,\n- 10 -\n감사인은 회사가 주장하는 내용 외에 매출거래처의 폐업, 담보설정 여부 등을 추가적\n으로 확인하였어야 함에도, 이를 소홀히 하여 매출채권 대손충당금 과소계상을 발견\n하지 못함\n5. 시사점\n회사는 기계적으로 세법상 대손설정률(1%)를 적용하여 대손충당금을 설정하지 말고 매출\n거래처와의 소송진행, 폐업, 장기미회수 사유 등 채권 회수가 불확실한 상황을 채권의\n회수가능성 평가에 충실히 반영함으로써 합리적이고 객관적으로 대손충당금을 설정하여야 함\n감사인은 회사가 기계적으로 대손충당금을 설정하는 실무 관행이 있는지 여부를 파악\n하고 회사의 채권에 대한 연령분석표 등을 징구하여 그 신뢰성을 검증하고 회사의\n대손정책의 적정성을 검토 후, 회사의 대손충당금 설정이 그 정책에 따라 적정히 이루어\n졌는지에 대한 검토가 필요함",
        "issue_fields": [
          "채권의 회수가능성 평가"
        ],
        "related_standards": [
          "일반기업회계기준 제6장(금융자산·금융부채)"
        ],
        "case_type": "회계감리지적사례",
        "source": "KICPA 심사·감리 지적사례"
      },
      "content": {
        "section_1_company_accounting": {
          "section_title": "회사의 회계처리",
          "content": "회사는 채권에 대한 회수가능성을 평가하고 회수가능가액으로 채권을 재무제표에 표시\n하여야 하나, 부실채권에 대해 세법상 대손설정률(1%)을 일괄적으로 적용하여 대손\n충당금을 계상함으로써 채권을 과대 표시함"
        },
        "section_2_violation_details": {
          "section_title": "회계기준 위반 지적 내용",
          "content": "회사는 매출채권과 단기대여금 등에 대한 대손충당금을 인식함에 있어서 매출거래처\n와의 소송진행, 폐업, 장기미회수 사유 등 채권 회수가 불확실한 상황을 채권의 회수\n가능성 평가에 반영하지 않고, 세법상의 대손설정률(1%)을 일괄적으로 적용함에 따라\n대손충당금을 과소계상함"
        },
        "section_3_basis_judgment": {
          "section_title": "지적 근거 및 판단 내용",
          "content": "일반기업회계기준 제6장(금융자산·금융부채) 문단 6.17의2에 의하면 회수가 불확실한\n금융자산은 합리적이고 객관적인 기준에 따라 산출한 대손추산액을 대손충당금으로\n설정하도록 규정되어 있음"
        },
        "section_4_audit_procedure": {
          "section_title": "감사절차 미흡사항",
          "content": "회계감사기준 200(독립된 감사인의 전반목적 및 감사기준에 따른 감사의 수행), 500\n(감사증거)과 700(재무제표에 대한 의견형성과 보고) 등에 따르면 감사인은 재무제표\n를 중요하게 왜곡표시 시킬 수 있는 상황이 존재할 수 있다는 전문가적인 의구심을\n가지고 감사업무를 계획하고 수행하여야 하며, 감사인은 감사의견 형성의 기초가 될\n합리적인 감사결론을 도출할 수 있도록 충분하고 적합한 감사증거를 확보하여야 하고,\n재무제표가 일반적으로 인정된 회계처리기준에 따라 중요성의 관점에서 적정하게 표시\n되고 있다고 판단했을 경우에만 적정의견을 표명하도록 규정되어 있는바,\n- 10 -\n감사인은 회사가 주장하는 내용 외에 매출거래처의 폐업, 담보설정 여부 등을 추가적\n으로 확인하였어야 함에도, 이를 소홀히 하여 매출채권 대손충당금 과소계상을 발견\n하지 못함"
        },
        "section_5_implications": {
          "section_title": "시사점",
          "content": "회사는 기계적으로 세법상 대손설정률(1%)를 적용하여 대손충당금을 설정하지 말고 매출\n거래처와의 소송진행, 폐업, 장기미회수 사유 등 채권 회수가 불확실한 상황을 채권의\n회수가능성 평가에 충실히 반영함으로써 합리적이고 객관적으로 대손충당금을 설정하여야 함\n감사인은 회사가 기계적으로 대손충당금을 설정하는 실무 관행이 있는지 여부를 파악\n하고 회사의 채권에 대한 연령분석표 등을 징구하여 그 신뢰성을 검증하고 회사의\n대손정책의 적정성을 검토 후, 회사의 대손충당금 설정이 그 정책에 따라 적정히 이루어\n졌는지에 대한 검토가 필요함"
        }
      },
      "indexed_content": "케이스 ID: KICPA-2020-05\n제목: 매출채권 등 대손충당금 과소계상\n결정연도: 2020년\n회계결산일: ’17.1.1.∼’17.12.31.\n1. 회사의 회계처리\n회사는 채권에 대한 회수가능성을 평가하고 회수가능가액으로 채권을 재무제표에 표시\n하여야 하나, 부실채권에 대해 세법상 대손설정률(1%)을 일괄적으로 적용하여 대손\n충당금을 계상함으로써 채권을 과대 표시함\n2. 회계기준 위반 지적 내용\n회사는 매출채권과 단기대여금 등에 대한 대손충당금을 인식함에 있어서 매출거래처\n와의 소송진행, 폐업, 장기미회수 사유 등 채권 회수가 불확실한 상황을 채권의 회수\n가능성 평가에 반영하지 않고, 세법상의 대손설정률(1%)을 일괄적으로 적용함에 따라\n대손충당금을 과소계상함\n3. 지적 근거 및 판단 내용\n일반기업회계기준 제6장(금융자산·금융부채) 문단 6.17의2에 의하면 회수가 불확실한\n금융자산은 합리적이고 객관적인 기준에 따라 산출한 대손추산액을 대손충당금으로\n설정하도록 규정되어 있음\n4. 감사절차 미흡사항\n회계감사기준 200(독립된 감사인의 전반목적 및 감사기준에 따른 감사의 수행), 500\n(감사증거)과 700(재무제표에 대한 의견형성과 보고) 등에 따르면 감사인은 재무제표\n를 중요하게 왜곡표시 시킬 수 있는 상황이 존재할 수 있다는 전문가적인 의구심을\n가지고 감사업무를 계획하고 수행하여야 하며, 감사인은 감사의견 형성의 기초가 될\n합리적인 감사결론을 도출할 수 있도록 충분하고 적합한 감사증거를 확보하여야 하고,\n재무제표가 일반적으로 인정된 회계처리기준에 따라 중요성의 관점에서 적정하게 표시\n되고 있다고 판단했을 경우에만 적정의견을 표명하도록 규정되어 있는바,\n- 10 -\n감사인은 회사가 주장하는 내용 외에 매출거래처의 폐업, 담보설정 여부 등을 추가적\n으로 확인하였어야 함에도, 이를 소홀히 하여 매출채권 대손충당금 과소계상을 발견\n하지 못함\n5. 시사점\n회사는 기계적으로 세법상 대손설정률(1%)를 적용하여 대손충당금을 설정하지 말고 매출\n거래처와의 소송진행, 폐업, 장기미회수 사유 등 채권 회수가 불확실한 상황을 채권의\n회수가능성 평가에 충실히 반영함으로써 합리적이고 객관적으로 대손충당금을 설정하여야 함\n감사인은 회사가 기계적으로 대손충당금을 설정하는 실무 관행이 있는지 여부를 파악\n하고 회사의 채권에 대한 연령분석표 등을 징구하여 그 신뢰성을 검증하고 회사의\n대손정책의 적정성을 검토 후, 회사의 대손충당금 설정이 그 정책에 따라 적정히 이루어\n졌는지에 대한 검토가 필요함\n쟁점분야: 채권의 회수가능성 평가\n관련기준: 일반기업회계기준 제6장(금융자산·금융부채)\n\n회사의 회계처리:\n회사는 채권에 대한 회수가능성을 평가하고 회수가능가액으로 채권을 재무제표에 표시\n하여야 하나, 부실채권에 대해 세법상 대손설정률(1%)을 일괄적으로 적용하여 대손\n충당금을 계상함으로써 채권을 과대 표시함\n\n회계기준 위반 지적 내용:\n회사는 매출채권과 단기대여금 등에 대한 대손충당금을 인식함에 있어서 매출거래처\n와의 소송진행, 폐업, 장기미회수 사유 등 채권 회수가 불확실한 상황을 채권의 회수\n가능성 평가에 반영하지 않고, 세법상의 대손설정률(1%)을 일괄적으로 적용함에 따라\n대손충당금을 과소계상함\n\n지적 근거 및 판단 내용:\n일반기업회계기준 제6장(금융자산·금융부채) 문단 6.17의2에 의하면 회수가 불확실한\n금융자산은 합리적이고 객관적인 기준에 따라 산출한 대손추산액을 대손충당금으로\n설정하도록 규정되어 있음\n\n감사절차 미흡사항:\n회계감사기준 200(독립된 감사인의 전반목적 및 감사기준에 따른 감사의 수행), 500\n(감사증거)과 700(재무제표에 대한 의견형성과 보고) 등에 따르면 감사인은 재무제표\n를 중요하게 왜곡표시 시킬 수 있는 상황이 존재할 수 있다는 전문가적인 의구심을\n가지고 감사업무를 계획하고 수행하여야 하며, 감사인은 감사의견 형성의 기초가 될\n합리적인 감사결론을 도출할 수 있도록 충분하고 적합한 감사증거를 확보하여야 하고,\n재무제표가 일반적으로 인정된 회계처리기준에 따라 중요성의 관점에서 적정하게 표시\n되고 있다고 판단했을 경우에만 적정의견을 표명하도록 규정되어 있는바,\n- 10 -\n감사인은 회사가 주장하는 내용 외에 매출거래처의 폐업, 담보설정 여부 등을 추가적\n으로 확인하였어야 함에도, 이를 소홀히 하여 매출채권 대손충당금 과소계상을 발견\n하지 못함\n\n시사점:\n회사는 기계적으로 세법상 대손설정률(1%)를 적용하여 대손충당금을 설정하지 말고 매출\n거래처와의 소송진행, 폐업, 장기미회수 사유 등 채권 회수가 불확실한 상황을 채권의\n회수가능성 평가에 충실히 반영함으로써 합리적이고 객관적으로 대손충당금을 설정하여야 함\n감사인은 회사가 기계적으로 대손충당금을 설정하는 실무 관행이 있는지 여부를 파악\n하고 회사의 채권에 대한 연령분석표 등을 징구하여 그 신뢰성을 검증하고 회사의\n대손정책의 적정성을 검토 후, 회사의 대손충당금 설정이 그 정책에 따라 적정히 이루어\n졌는지에 대한 검토가 필요함"
    },
    {
      "paragraph_id": "KICPA-2020-06",
      "case_id": "KICPA-2020-06",
      "case_title": "재고자산 평가충당금 과소계상",
      "metadata": {
        "decision_year": "2020",
        "accounting_period": "’16.1.1.∼’17.12.31.\n1. 회사의 회계처리\n회사가 재고자산에 저가법을 적용하면서 1년이상∼2년미만 변동이 없는 재고는 평가\n대상에 누락하였고, 순실현가능가치 평가대상에 일부 재고를 누락하여 재고자산 평가\n충당금을 과소계상함\n2. 회계기준 위반 지적 내용\n회사는 재고자산의 시가(순실현가능가치)가 취득원가보다 하락하여 저가법을 적용하여\n장부금액을 결정함에 있어서\n- 11 -\n- 1년 이상 입출고가 없거나 매출 발생빈도가 현저히 낮아 정상적인 판매로 판단\n하기 어려운 재고에 대해 경제적 실질을 반영하여 평가충당금을 계상하여야 함에도\n이를 누락하였고, 일부 사업부의 재고자산에 대하여는 원가율이 낮다는 이유로 순실현\n가능가치 평가에서 제외하여 재고자산 평가충당금을 과소계상함\n3. 지적 근거 및 판단 내용\n일반기업회계기준(제7장 문단 7.16)에 따르면 재고자산의 시가가 취득원가보다 하락한\n경우에는 저가법을 사용하여 재고자산의 장부금액을 결정하여야 하고, 보고기간말로부터\n1년 또는 정상영업주기 내에 판매되지 않았거나 생산에 투입할 수 없어 장기체화된\n재고의 경우 원가 이하로 하락할 수 있으므로 저가법 적용시 유의해야 함\n4. 감사절차 미흡사항\n동 지적사례는 재무제표에 대한 심사로 종결되어 감사보고서 감리는 실시하지 아니함\n5. 시사점\n재고자산의 시가가 취득원가보다 하락한 경우에는 저가법을 사용하여 재고자산의 장부\n금액을 결정하도록 하고 있으며 보고기간말로부터 1년 또는 정상영업주기 내에 판매되지\n않았거나 생산에 투입할 수 없어 장기체화 된 경우는 재고자산 시가가 원가 이하로 하락\n할 수 있음을 유의해야 함. 또한, 재고자산 평가를 위한 저가법은 항목별로 적용해야 함",
        "issue_fields": [
          "재고자산 평가"
        ],
        "related_standards": [
          "일반기업회계기준 제7장(재고자산)"
        ],
        "case_type": "회계감리지적사례",
        "source": "KICPA 심사·감리 지적사례"
      },
      "content": {
        "section_1_company_accounting": {
          "section_title": "회사의 회계처리",
          "content": "회사가 재고자산에 저가법을 적용하면서 1년이상∼2년미만 변동이 없는 재고는 평가\n대상에 누락하였고, 순실현가능가치 평가대상에 일부 재고를 누락하여 재고자산 평가\n충당금을 과소계상함"
        },
        "section_2_violation_details": {
          "section_title": "회계기준 위반 지적 내용",
          "content": "회사는 재고자산의 시가(순실현가능가치)가 취득원가보다 하락하여 저가법을 적용하여\n장부금액을 결정함에 있어서\n- 11 -\n- 1년 이상 입출고가 없거나 매출 발생빈도가 현저히 낮아 정상적인 판매로 판단\n하기 어려운 재고에 대해 경제적 실질을 반영하여 평가충당금을 계상하여야 함에도\n이를 누락하였고, 일부 사업부의 재고자산에 대하여는 원가율이 낮다는 이유로 순실현\n가능가치 평가에서 제외하여 재고자산 평가충당금을 과소계상함"
        },
        "section_3_basis_judgment": {
          "section_title": "지적 근거 및 판단 내용",
          "content": "일반기업회계기준(제7장 문단 7.16)에 따르면 재고자산의 시가가 취득원가보다 하락한\n경우에는 저가법을 사용하여 재고자산의 장부금액을 결정하여야 하고, 보고기간말로부터\n1년 또는 정상영업주기 내에 판매되지 않았거나 생산에 투입할 수 없어 장기체화된\n재고의 경우 원가 이하로 하락할 수 있으므로 저가법 적용시 유의해야 함"
        },
        "section_4_audit_procedure": {
          "section_title": "감사절차 미흡사항",
          "content": "동 지적사례는 재무제표에 대한 심사로 종결되어 감사보고서 감리는 실시하지 아니함"
        },
        "section_5_implications": {
          "section_title": "시사점",
          "content": "재고자산의 시가가 취득원가보다 하락한 경우에는 저가법을 사용하여 재고자산의 장부\n금액을 결정하도록 하고 있으며 보고기간말로부터 1년 또는 정상영업주기 내에 판매되지\n않았거나 생산에 투입할 수 없어 장기체화 된 경우는 재고자산 시가가 원가 이하로 하락\n할 수 있음을 유의해야 함. 또한, 재고자산 평가를 위한 저가법은 항목별로 적용해야 함"
        }
      },
      "indexed_content": "케이스 ID: KICPA-2020-06\n제목: 재고자산 평가충당금 과소계상\n결정연도: 2020년\n회계결산일: ’16.1.1.∼’17.12.31.\n1. 회사의 회계처리\n회사가 재고자산에 저가법을 적용하면서 1년이상∼2년미만 변동이 없는 재고는 평가\n대상에 누락하였고, 순실현가능가치 평가대상에 일부 재고를 누락하여 재고자산 평가\n충당금을 과소계상함\n2. 회계기준 위반 지적 내용\n회사는 재고자산의 시가(순실현가능가치)가 취득원가보다 하락하여 저가법을 적용하여\n장부금액을 결정함에 있어서\n- 11 -\n- 1년 이상 입출고가 없거나 매출 발생빈도가 현저히 낮아 정상적인 판매로 판단\n하기 어려운 재고에 대해 경제적 실질을 반영하여 평가충당금을 계상하여야 함에도\n이를 누락하였고, 일부 사업부의 재고자산에 대하여는 원가율이 낮다는 이유로 순실현\n가능가치 평가에서 제외하여 재고자산 평가충당금을 과소계상함\n3. 지적 근거 및 판단 내용\n일반기업회계기준(제7장 문단 7.16)에 따르면 재고자산의 시가가 취득원가보다 하락한\n경우에는 저가법을 사용하여 재고자산의 장부금액을 결정하여야 하고, 보고기간말로부터\n1년 또는 정상영업주기 내에 판매되지 않았거나 생산에 투입할 수 없어 장기체화된\n재고의 경우 원가 이하로 하락할 수 있으므로 저가법 적용시 유의해야 함\n4. 감사절차 미흡사항\n동 지적사례는 재무제표에 대한 심사로 종결되어 감사보고서 감리는 실시하지 아니함\n5. 시사점\n재고자산의 시가가 취득원가보다 하락한 경우에는 저가법을 사용하여 재고자산의 장부\n금액을 결정하도록 하고 있으며 보고기간말로부터 1년 또는 정상영업주기 내에 판매되지\n않았거나 생산에 투입할 수 없어 장기체화 된 경우는 재고자산 시가가 원가 이하로 하락\n할 수 있음을 유의해야 함. 또한, 재고자산 평가를 위한 저가법은 항목별로 적용해야 함\n쟁점분야: 재고자산 평가\n관련기준: 일반기업회계기준 제7장(재고자산)\n\n회사의 회계처리:\n회사가 재고자산에 저가법을 적용하면서 1년이상∼2년미만 변동이 없는 재고는 평가\n대상에 누락하였고, 순실현가능가치 평가대상에 일부 재고를 누락하여 재고자산 평가\n충당금을 과소계상함\n\n회계기준 위반 지적 내용:\n회사는 재고자산의 시가(순실현가능가치)가 취득원가보다 하락하여 저가법을 적용하여\n장부금액을 결정함에 있어서\n- 11 -\n- 1년 이상 입출고가 없거나 매출 발생빈도가 현저히 낮아 정상적인 판매로 판단\n하기 어려운 재고에 대해 경제적 실질을 반영하여 평가충당금을 계상하여야 함에도\n이를 누락하였고, 일부 사업부의 재고자산에 대하여는 원가율이 낮다는 이유로 순실현\n가능가치 평가에서 제외하여 재고자산 평가충당금을 과소계상함\n\n지적 근거 및 판단 내용:\n일반기업회계기준(제7장 문단 7.16)에 따르면 재고자산의 시가가 취득원가보다 하락한\n경우에는 저가법을 사용하여 재고자산의 장부금액을 결정하여야 하고, 보고기간말로부터\n1년 또는 정상영업주기 내에 판매되지 않았거나 생산에 투입할 수 없어 장기체화된\n재고의 경우 원가 이하로 하락할 수 있으므로 저가법 적용시 유의해야 함\n\n감사절차 미흡사항:\n동 지적사례는 재무제표에 대한 심사로 종결되어 감사보고서 감리는 실시하지 아니함\n\n시사점:\n재고자산의 시가가 취득원가보다 하락한 경우에는 저가법을 사용하여 재고자산의 장부\n금액을 결정하도록 하고 있으며 보고기간말로부터 1년 또는 정상영업주기 내에 판매되지\n않았거나 생산에 투입할 수 없어 장기체화 된 경우는 재고자산 시가가 원가 이하로 하락\n할 수 있음을 유의해야 함. 또한, 재고자산 평가를 위한 저가법은 항목별로 적용해야 함"
    },
    {
      "paragraph_id": "KICPA-2020-07",
      "case_id": "KICPA-2020-07",
      "case_title": "매출원가 과소계상",
      "metadata": {
        "decision_year": "2020",
        "accounting_period": "’16.1.1.∼’16.12.31.\n1. 회사의 회계처리\n회사는 특수관계가 있는 법인 등을 통해 조달한 자금을 부채가 아닌 생산보조금으로\n계상하고 이를 매출원가에서 차감함으로써 매출원가를 과소계상함\n- 12 -\n2. 회계기준 위반 지적 내용\n회사는 신규사업 진출을 위해 태국소재 A사의 지분을 전량 인수(15년 10월)한 후 A사의\n핵심기술을 응용한 제품의 개발을 위해 대만 상장업체인 B사와 협의를 시작하였으며,\n협상초기에는 제품을 B사에 독점공급하는 조건으로 B사로부터 생산보조금(약 500만불)을\n지원받기로 하였으나 최종적으로는 초기개발비 일부(40만불)를 지원받는 것으로 최종\n확정되었음(16년 10월)\n당기순이익을 증가시키기 위해 16년 6월말 결산 시 생산보조금 예상액을 매출원가에서\n차감하고 상대계정은 외상매입금으로 회계처리[(차변) 외상매입금 5,735백만원 (대변)\n매출원가 5,735백만원]하였고, 16년 12월말 결산 시 B사가 아닌 회사 대표이사의 친인척이\n대표이사로 있는 C사로부터 회사로 자금을 이체 받은 후 동 금액의 상대계정을 외상\n매입금으로 회계처리하여 B사로부터 생산보조금이 회수된 것으로 처리함으로써 동액의\n매출원가와 선수금(부채)이 과소 계상됨\n3. 지적 근거 및 판단 내용\n기업회계기준서 제1001호(재무제표 표시) 문단 15에 따르면 재무제표는 기업의 재무상태,\n재무성과 및 현금흐름을 공정하게 표시해야 하고, 공정한 표시를 위해서는 ‘개념체계’\n에서 정한 자산, 부채, 수익 및 비용에 대한 정의와 인식요건에 따라 거래, 그 밖의 사건과\n상황의 효과를 충실하게 표현하도록 규정하고 있음\n4. 감사절차 미흡사항\n회계감사기준 200(독립된 감사인의 전반목적 및 감사기준에 따른 감사의 수행), 500\n(감사증거)과 700(재무제표에 대한 의견형성과 보고) 등에 따르면 감사인은 재무제표를\n중요하게 왜곡표시 시킬 수 있는 상황이 존재할 수 있다는 전문가적인 의구심을 가지고\n감사업무를 계획하고 수행하여야 하며, 감사인은 감사의견 형성의 기초가 될 합리적인\n감사결론을 도출할 수 있도록 충분하고 적합한 감사증거를 확보하여야 하고, 재무제표가\n일반적으로 인정된 회계처리기준에 따라 중요성의 관점에서 적정하게 표시되고 있다고\n판단했을 경우에만 적정의견을 표명하도록 규정되어 있음에도,\n감사인은 제조경비의 월별 발생내역에 대한 검토 과정에서 생산보조금이 제조경비에서\n차감된 내역을 확인하였으나, 타 회사로부터의 생산보조금 지원 관련 진행상황에 대한\n회사담당자의 설명만으로 검토절차를 종결하고 관련 계약서와 입금증빙을 확인하지\n않아 회사의 회계처리 오류를 지적하지 못함\n- 13 -\n5. 시사점\n회사는 특수관계자 등과의 자금거래가 있을 경우, 그 사유 및 관련증빙 확인을 위한 내부\n통제를 강화해야 하며 결산시 원가율의 변동 등 주요재무비율의 변동사유를 확인하는\n결산통제절차를 수립할 필요가 있음\n감사인은 회계처리 관련 계약서 검토 시 서명된 최종 계약서를 징구해야 하고 특수\n관계자와의 자금거래가 있는 경우 그 거래 사유 등을 면밀히 검토할 필요가 있음",
        "issue_fields": [
          "매출원가 과소계상"
        ],
        "related_standards": [
          "기업회계기준서 제1001호(재무제표 표시)"
        ],
        "case_type": "회계감리지적사례",
        "source": "KICPA 심사·감리 지적사례"
      },
      "content": {
        "section_1_company_accounting": {
          "section_title": "회사의 회계처리",
          "content": "회사는 특수관계가 있는 법인 등을 통해 조달한 자금을 부채가 아닌 생산보조금으로\n계상하고 이를 매출원가에서 차감함으로써 매출원가를 과소계상함\n- 12 -"
        },
        "section_2_violation_details": {
          "section_title": "회계기준 위반 지적 내용",
          "content": "회사는 신규사업 진출을 위해 태국소재 A사의 지분을 전량 인수(15년 10월)한 후 A사의\n핵심기술을 응용한 제품의 개발을 위해 대만 상장업체인 B사와 협의를 시작하였으며,\n협상초기에는 제품을 B사에 독점공급하는 조건으로 B사로부터 생산보조금(약 500만불)을\n지원받기로 하였으나 최종적으로는 초기개발비 일부(40만불)를 지원받는 것으로 최종\n확정되었음(16년 10월)\n당기순이익을 증가시키기 위해 16년 6월말 결산 시 생산보조금 예상액을 매출원가에서\n차감하고 상대계정은 외상매입금으로 회계처리[(차변) 외상매입금 5,735백만원 (대변)\n매출원가 5,735백만원]하였고, 16년 12월말 결산 시 B사가 아닌 회사 대표이사의 친인척이\n대표이사로 있는 C사로부터 회사로 자금을 이체 받은 후 동 금액의 상대계정을 외상\n매입금으로 회계처리하여 B사로부터 생산보조금이 회수된 것으로 처리함으로써 동액의\n매출원가와 선수금(부채)이 과소 계상됨"
        },
        "section_3_basis_judgment": {
          "section_title": "지적 근거 및 판단 내용",
          "content": "기업회계기준서 제1001호(재무제표 표시) 문단 15에 따르면 재무제표는 기업의 재무상태,\n재무성과 및 현금흐름을 공정하게 표시해야 하고, 공정한 표시를 위해서는 ‘개념체계’\n에서 정한 자산, 부채, 수익 및 비용에 대한 정의와 인식요건에 따라 거래, 그 밖의 사건과\n상황의 효과를 충실하게 표현하도록 규정하고 있음"
        },
        "section_4_audit_procedure": {
          "section_title": "감사절차 미흡사항",
          "content": "회계감사기준 200(독립된 감사인의 전반목적 및 감사기준에 따른 감사의 수행), 500\n(감사증거)과 700(재무제표에 대한 의견형성과 보고) 등에 따르면 감사인은 재무제표를\n중요하게 왜곡표시 시킬 수 있는 상황이 존재할 수 있다는 전문가적인 의구심을 가지고\n감사업무를 계획하고 수행하여야 하며, 감사인은 감사의견 형성의 기초가 될 합리적인\n감사결론을 도출할 수 있도록 충분하고 적합한 감사증거를 확보하여야 하고, 재무제표가\n일반적으로 인정된 회계처리기준에 따라 중요성의 관점에서 적정하게 표시되고 있다고\n판단했을 경우에만 적정의견을 표명하도록 규정되어 있음에도,\n감사인은 제조경비의 월별 발생내역에 대한 검토 과정에서 생산보조금이 제조경비에서\n차감된 내역을 확인하였으나, 타 회사로부터의 생산보조금 지원 관련 진행상황에 대한\n회사담당자의 설명만으로 검토절차를 종결하고 관련 계약서와 입금증빙을 확인하지\n않아 회사의 회계처리 오류를 지적하지 못함\n- 13 -"
        },
        "section_5_implications": {
          "section_title": "시사점",
          "content": "회사는 특수관계자 등과의 자금거래가 있을 경우, 그 사유 및 관련증빙 확인을 위한 내부\n통제를 강화해야 하며 결산시 원가율의 변동 등 주요재무비율의 변동사유를 확인하는\n결산통제절차를 수립할 필요가 있음\n감사인은 회계처리 관련 계약서 검토 시 서명된 최종 계약서를 징구해야 하고 특수\n관계자와의 자금거래가 있는 경우 그 거래 사유 등을 면밀히 검토할 필요가 있음"
        }
      },
      "indexed_content": "케이스 ID: KICPA-2020-07\n제목: 매출원가 과소계상\n결정연도: 2020년\n회계결산일: ’16.1.1.∼’16.12.31.\n1. 회사의 회계처리\n회사는 특수관계가 있는 법인 등을 통해 조달한 자금을 부채가 아닌 생산보조금으로\n계상하고 이를 매출원가에서 차감함으로써 매출원가를 과소계상함\n- 12 -\n2. 회계기준 위반 지적 내용\n회사는 신규사업 진출을 위해 태국소재 A사의 지분을 전량 인수(15년 10월)한 후 A사의\n핵심기술을 응용한 제품의 개발을 위해 대만 상장업체인 B사와 협의를 시작하였으며,\n협상초기에는 제품을 B사에 독점공급하는 조건으로 B사로부터 생산보조금(약 500만불)을\n지원받기로 하였으나 최종적으로는 초기개발비 일부(40만불)를 지원받는 것으로 최종\n확정되었음(16년 10월)\n당기순이익을 증가시키기 위해 16년 6월말 결산 시 생산보조금 예상액을 매출원가에서\n차감하고 상대계정은 외상매입금으로 회계처리[(차변) 외상매입금 5,735백만원 (대변)\n매출원가 5,735백만원]하였고, 16년 12월말 결산 시 B사가 아닌 회사 대표이사의 친인척이\n대표이사로 있는 C사로부터 회사로 자금을 이체 받은 후 동 금액의 상대계정을 외상\n매입금으로 회계처리하여 B사로부터 생산보조금이 회수된 것으로 처리함으로써 동액의\n매출원가와 선수금(부채)이 과소 계상됨\n3. 지적 근거 및 판단 내용\n기업회계기준서 제1001호(재무제표 표시) 문단 15에 따르면 재무제표는 기업의 재무상태,\n재무성과 및 현금흐름을 공정하게 표시해야 하고, 공정한 표시를 위해서는 ‘개념체계’\n에서 정한 자산, 부채, 수익 및 비용에 대한 정의와 인식요건에 따라 거래, 그 밖의 사건과\n상황의 효과를 충실하게 표현하도록 규정하고 있음\n4. 감사절차 미흡사항\n회계감사기준 200(독립된 감사인의 전반목적 및 감사기준에 따른 감사의 수행), 500\n(감사증거)과 700(재무제표에 대한 의견형성과 보고) 등에 따르면 감사인은 재무제표를\n중요하게 왜곡표시 시킬 수 있는 상황이 존재할 수 있다는 전문가적인 의구심을 가지고\n감사업무를 계획하고 수행하여야 하며, 감사인은 감사의견 형성의 기초가 될 합리적인\n감사결론을 도출할 수 있도록 충분하고 적합한 감사증거를 확보하여야 하고, 재무제표가\n일반적으로 인정된 회계처리기준에 따라 중요성의 관점에서 적정하게 표시되고 있다고\n판단했을 경우에만 적정의견을 표명하도록 규정되어 있음에도,\n감사인은 제조경비의 월별 발생내역에 대한 검토 과정에서 생산보조금이 제조경비에서\n차감된 내역을 확인하였으나, 타 회사로부터의 생산보조금 지원 관련 진행상황에 대한\n회사담당자의 설명만으로 검토절차를 종결하고 관련 계약서와 입금증빙을 확인하지\n않아 회사의 회계처리 오류를 지적하지 못함\n- 13 -\n5. 시사점\n회사는 특수관계자 등과의 자금거래가 있을 경우, 그 사유 및 관련증빙 확인을 위한 내부\n통제를 강화해야 하며 결산시 원가율의 변동 등 주요재무비율의 변동사유를 확인하는\n결산통제절차를 수립할 필요가 있음\n감사인은 회계처리 관련 계약서 검토 시 서명된 최종 계약서를 징구해야 하고 특수\n관계자와의 자금거래가 있는 경우 그 거래 사유 등을 면밀히 검토할 필요가 있음\n쟁점분야: 매출원가 과소계상\n관련기준: 기업회계기준서 제1001호(재무제표 표시)\n\n회사의 회계처리:\n회사는 특수관계가 있는 법인 등을 통해 조달한 자금을 부채가 아닌 생산보조금으로\n계상하고 이를 매출원가에서 차감함으로써 매출원가를 과소계상함\n- 12 -\n\n회계기준 위반 지적 내용:\n회사는 신규사업 진출을 위해 태국소재 A사의 지분을 전량 인수(15년 10월)한 후 A사의\n핵심기술을 응용한 제품의 개발을 위해 대만 상장업체인 B사와 협의를 시작하였으며,\n협상초기에는 제품을 B사에 독점공급하는 조건으로 B사로부터 생산보조금(약 500만불)을\n지원받기로 하였으나 최종적으로는 초기개발비 일부(40만불)를 지원받는 것으로 최종\n확정되었음(16년 10월)\n당기순이익을 증가시키기 위해 16년 6월말 결산 시 생산보조금 예상액을 매출원가에서\n차감하고 상대계정은 외상매입금으로 회계처리[(차변) 외상매입금 5,735백만원 (대변)\n매출원가 5,735백만원]하였고, 16년 12월말 결산 시 B사가 아닌 회사 대표이사의 친인척이\n대표이사로 있는 C사로부터 회사로 자금을 이체 받은 후 동 금액의 상대계정을 외상\n매입금으로 회계처리하여 B사로부터 생산보조금이 회수된 것으로 처리함으로써 동액의\n매출원가와 선수금(부채)이 과소 계상됨\n\n지적 근거 및 판단 내용:\n기업회계기준서 제1001호(재무제표 표시) 문단 15에 따르면 재무제표는 기업의 재무상태,\n재무성과 및 현금흐름을 공정하게 표시해야 하고, 공정한 표시를 위해서는 ‘개념체계’\n에서 정한 자산, 부채, 수익 및 비용에 대한 정의와 인식요건에 따라 거래, 그 밖의 사건과\n상황의 효과를 충실하게 표현하도록 규정하고 있음\n\n감사절차 미흡사항:\n회계감사기준 200(독립된 감사인의 전반목적 및 감사기준에 따른 감사의 수행), 500\n(감사증거)과 700(재무제표에 대한 의견형성과 보고) 등에 따르면 감사인은 재무제표를\n중요하게 왜곡표시 시킬 수 있는 상황이 존재할 수 있다는 전문가적인 의구심을 가지고\n감사업무를 계획하고 수행하여야 하며, 감사인은 감사의견 형성의 기초가 될 합리적인\n감사결론을 도출할 수 있도록 충분하고 적합한 감사증거를 확보하여야 하고, 재무제표가\n일반적으로 인정된 회계처리기준에 따라 중요성의 관점에서 적정하게 표시되고 있다고\n판단했을 경우에만 적정의견을 표명하도록 규정되어 있음에도,\n감사인은 제조경비의 월별 발생내역에 대한 검토 과정에서 생산보조금이 제조경비에서\n차감된 내역을 확인하였으나, 타 회사로부터의 생산보조금 지원 관련 진행상황에 대한\n회사담당자의 설명만으로 검토절차를 종결하고 관련 계약서와 입금증빙을 확인하지\n않아 회사의 회계처리 오류를 지적하지 못함\n- 13 -\n\n시사점:\n회사는 특수관계자 등과의 자금거래가 있을 경우, 그 사유 및 관련증빙 확인을 위한 내부\n통제를 강화해야 하며 결산시 원가율의 변동 등 주요재무비율의 변동사유를 확인하는\n결산통제절차를 수립할 필요가 있음\n감사인은 회계처리 관련 계약서 검토 시 서명된 최종 계약서를 징구해야 하고 특수\n관계자와의 자금거래가 있는 경우 그 거래 사유 등을 면밀히 검토할 필요가 있음"
    },
    {
      "paragraph_id": "KICPA-2020-08",
      "case_id": "KICPA-2020-08",
      "case_title": "유형자산 등 과대계상",
      "metadata": {
        "decision_year": "2020",
        "accounting_period": "’10.1.1.∼’14.12.31.\n1. 회사의 회계처리\n회사는 제품제조 목적으로 사용하는 원·부재료 등 제조원가를 매출이 발생한 시점에\n비용으로 계상하지 아니하고 유형자산과 개발비로 임의 대체하여 유형자산 등을 과대\n계상함\n2. 회계기준 위반 지적 내용\n회사는 자동차 제조업체인 A사 등에 자동차 부품을 납품하는 회사로 다량의 수주를 예측\n하여 공장을 증설하였으나, 화재 및 수주물량 미달 등으로 손실이 발생하여 재무상태가\n악화되자 금리인상 및 차입금 상환요구 회피와 거래업체와의 거래관계 유지 등을 위하여\n수년간 외주가공비, 원·부재료비 등 제조원가를 해당연도의 비용으로 인식하지 아니하고\n유형자산과 개발비로 임의 대체함\n3. 지적 근거 및 판단 내용\n일반기업회계기준 제2장(재무제표의 작성과 표시Ⅰ) 문단 2.7과 2.48에 따르면, 재무제표는\n경제적 사실과 거래의 실질을 반영하여 기업의 재무상태, 경영성과, 현금흐름 및 자본\n- 14 -\n변동을 공정하게 표시하여야 하고, 매출원가는 제품, 상품 등의 매출액에 대응되는 원가\n로서 판매된 제품이나 상품 등에 대한 제조원가 또는 매입원가로 규정하고 있음\n4. 감사절차 미흡사항\n회계감사기준 200(독립된 감사인의 전반목적 및 감사기준에 따른 감사의 수행), 500\n(감사증거)과 700(재무제표에 대한 의견형성과 보고) 등에 따르면 감사인은 재무제표를\n중요하게 왜곡표시 시킬 수 있는 상황이 존재할 수 있다는 전문가적인 의구심을 가지고\n감사업무를 계획하고 수행하여야 하며, 감사인은 감사의견 형성의 기초가 될 합리적인\n감사결론을 도출할 수 있도록 충분하고 적합한 감사증거를 확보하여야 하고, 재무제표가\n일반적으로 인정된 회계처리기준에 따라 중요성의 관점에서 적정하게 표시되고 있다고\n판단했을 경우에만 적정의견을 표명하도록 규정되어 있는바,\n감사인은 회사의 매출규모나 거래처에 중요한 변동이 없음에도 유형자산이 매년\n거액씩 증가하는 예외적인 상황이 발생하였으나 유형자산의 증가사유와 취득의 발생사실\n확인 등의 절차를 소홀히 하였고,\n특정연도에 회사의 과거 평균 개발비의 10배 이상이 증가하는 예외적인 상황이 발생\n하였음에도 증가사유, 수행하고 있는 프로젝트 내용, 개발비 인식의 적정성 등의 검토\n절차를 소홀하여 회사의 회계처리 오류를 발견하지 못함\n5. 시사점\n회사는 매출과 관련하여 생산된 제품의 원·부재료비, 외주가공비는 매출에 대응하는 원가\n로서 당기비용(매출원가)로 계상하여야 함\n감사인은 회사의 매출규모나 영업환경 등에 특별한 변동이 없음에도 유형자산이나 개발비\n등 특정 계정금액이 큰폭으로 증가한 경우, 그 사유를 파악하고 취득사실 확인 등의 절차를\n반드시 수행하여야 함\n- 15 -",
        "issue_fields": [
          "유형자산 등 과대계상"
        ],
        "related_standards": [
          "일반기업회계기준 제2장(재무제표의 작성과 표시Ⅰ)"
        ],
        "case_type": "회계감리지적사례",
        "source": "KICPA 심사·감리 지적사례"
      },
      "content": {
        "section_1_company_accounting": {
          "section_title": "회사의 회계처리",
          "content": "회사는 제품제조 목적으로 사용하는 원·부재료 등 제조원가를 매출이 발생한 시점에\n비용으로 계상하지 아니하고 유형자산과 개발비로 임의 대체하여 유형자산 등을 과대\n계상함"
        },
        "section_2_violation_details": {
          "section_title": "회계기준 위반 지적 내용",
          "content": "회사는 자동차 제조업체인 A사 등에 자동차 부품을 납품하는 회사로 다량의 수주를 예측\n하여 공장을 증설하였으나, 화재 및 수주물량 미달 등으로 손실이 발생하여 재무상태가\n악화되자 금리인상 및 차입금 상환요구 회피와 거래업체와의 거래관계 유지 등을 위하여\n수년간 외주가공비, 원·부재료비 등 제조원가를 해당연도의 비용으로 인식하지 아니하고\n유형자산과 개발비로 임의 대체함"
        },
        "section_3_basis_judgment": {
          "section_title": "지적 근거 및 판단 내용",
          "content": "일반기업회계기준 제2장(재무제표의 작성과 표시Ⅰ) 문단 2.7과 2.48에 따르면, 재무제표는\n경제적 사실과 거래의 실질을 반영하여 기업의 재무상태, 경영성과, 현금흐름 및 자본\n- 14 -\n변동을 공정하게 표시하여야 하고, 매출원가는 제품, 상품 등의 매출액에 대응되는 원가\n로서 판매된 제품이나 상품 등에 대한 제조원가 또는 매입원가로 규정하고 있음"
        },
        "section_4_audit_procedure": {
          "section_title": "감사절차 미흡사항",
          "content": "회계감사기준 200(독립된 감사인의 전반목적 및 감사기준에 따른 감사의 수행), 500\n(감사증거)과 700(재무제표에 대한 의견형성과 보고) 등에 따르면 감사인은 재무제표를\n중요하게 왜곡표시 시킬 수 있는 상황이 존재할 수 있다는 전문가적인 의구심을 가지고\n감사업무를 계획하고 수행하여야 하며, 감사인은 감사의견 형성의 기초가 될 합리적인\n감사결론을 도출할 수 있도록 충분하고 적합한 감사증거를 확보하여야 하고, 재무제표가\n일반적으로 인정된 회계처리기준에 따라 중요성의 관점에서 적정하게 표시되고 있다고\n판단했을 경우에만 적정의견을 표명하도록 규정되어 있는바,\n감사인은 회사의 매출규모나 거래처에 중요한 변동이 없음에도 유형자산이 매년\n거액씩 증가하는 예외적인 상황이 발생하였으나 유형자산의 증가사유와 취득의 발생사실\n확인 등의 절차를 소홀히 하였고,\n특정연도에 회사의 과거 평균 개발비의 10배 이상이 증가하는 예외적인 상황이 발생\n하였음에도 증가사유, 수행하고 있는 프로젝트 내용, 개발비 인식의 적정성 등의 검토\n절차를 소홀하여 회사의 회계처리 오류를 발견하지 못함"
        },
        "section_5_implications": {
          "section_title": "시사점",
          "content": "회사는 매출과 관련하여 생산된 제품의 원·부재료비, 외주가공비는 매출에 대응하는 원가\n로서 당기비용(매출원가)로 계상하여야 함\n감사인은 회사의 매출규모나 영업환경 등에 특별한 변동이 없음에도 유형자산이나 개발비\n등 특정 계정금액이 큰폭으로 증가한 경우, 그 사유를 파악하고 취득사실 확인 등의 절차를\n반드시 수행하여야 함\n- 15 -"
        }
      },
      "indexed_content": "케이스 ID: KICPA-2020-08\n제목: 유형자산 등 과대계상\n결정연도: 2020년\n회계결산일: ’10.1.1.∼’14.12.31.\n1. 회사의 회계처리\n회사는 제품제조 목적으로 사용하는 원·부재료 등 제조원가를 매출이 발생한 시점에\n비용으로 계상하지 아니하고 유형자산과 개발비로 임의 대체하여 유형자산 등을 과대\n계상함\n2. 회계기준 위반 지적 내용\n회사는 자동차 제조업체인 A사 등에 자동차 부품을 납품하는 회사로 다량의 수주를 예측\n하여 공장을 증설하였으나, 화재 및 수주물량 미달 등으로 손실이 발생하여 재무상태가\n악화되자 금리인상 및 차입금 상환요구 회피와 거래업체와의 거래관계 유지 등을 위하여\n수년간 외주가공비, 원·부재료비 등 제조원가를 해당연도의 비용으로 인식하지 아니하고\n유형자산과 개발비로 임의 대체함\n3. 지적 근거 및 판단 내용\n일반기업회계기준 제2장(재무제표의 작성과 표시Ⅰ) 문단 2.7과 2.48에 따르면, 재무제표는\n경제적 사실과 거래의 실질을 반영하여 기업의 재무상태, 경영성과, 현금흐름 및 자본\n- 14 -\n변동을 공정하게 표시하여야 하고, 매출원가는 제품, 상품 등의 매출액에 대응되는 원가\n로서 판매된 제품이나 상품 등에 대한 제조원가 또는 매입원가로 규정하고 있음\n4. 감사절차 미흡사항\n회계감사기준 200(독립된 감사인의 전반목적 및 감사기준에 따른 감사의 수행), 500\n(감사증거)과 700(재무제표에 대한 의견형성과 보고) 등에 따르면 감사인은 재무제표를\n중요하게 왜곡표시 시킬 수 있는 상황이 존재할 수 있다는 전문가적인 의구심을 가지고\n감사업무를 계획하고 수행하여야 하며, 감사인은 감사의견 형성의 기초가 될 합리적인\n감사결론을 도출할 수 있도록 충분하고 적합한 감사증거를 확보하여야 하고, 재무제표가\n일반적으로 인정된 회계처리기준에 따라 중요성의 관점에서 적정하게 표시되고 있다고\n판단했을 경우에만 적정의견을 표명하도록 규정되어 있는바,\n감사인은 회사의 매출규모나 거래처에 중요한 변동이 없음에도 유형자산이 매년\n거액씩 증가하는 예외적인 상황이 발생하였으나 유형자산의 증가사유와 취득의 발생사실\n확인 등의 절차를 소홀히 하였고,\n특정연도에 회사의 과거 평균 개발비의 10배 이상이 증가하는 예외적인 상황이 발생\n하였음에도 증가사유, 수행하고 있는 프로젝트 내용, 개발비 인식의 적정성 등의 검토\n절차를 소홀하여 회사의 회계처리 오류를 발견하지 못함\n5. 시사점\n회사는 매출과 관련하여 생산된 제품의 원·부재료비, 외주가공비는 매출에 대응하는 원가\n로서 당기비용(매출원가)로 계상하여야 함\n감사인은 회사의 매출규모나 영업환경 등에 특별한 변동이 없음에도 유형자산이나 개발비\n등 특정 계정금액이 큰폭으로 증가한 경우, 그 사유를 파악하고 취득사실 확인 등의 절차를\n반드시 수행하여야 함\n- 15 -\n쟁점분야: 유형자산 등 과대계상\n관련기준: 일반기업회계기준 제2장(재무제표의 작성과 표시Ⅰ)\n\n회사의 회계처리:\n회사는 제품제조 목적으로 사용하는 원·부재료 등 제조원가를 매출이 발생한 시점에\n비용으로 계상하지 아니하고 유형자산과 개발비로 임의 대체하여 유형자산 등을 과대\n계상함\n\n회계기준 위반 지적 내용:\n회사는 자동차 제조업체인 A사 등에 자동차 부품을 납품하는 회사로 다량의 수주를 예측\n하여 공장을 증설하였으나, 화재 및 수주물량 미달 등으로 손실이 발생하여 재무상태가\n악화되자 금리인상 및 차입금 상환요구 회피와 거래업체와의 거래관계 유지 등을 위하여\n수년간 외주가공비, 원·부재료비 등 제조원가를 해당연도의 비용으로 인식하지 아니하고\n유형자산과 개발비로 임의 대체함\n\n지적 근거 및 판단 내용:\n일반기업회계기준 제2장(재무제표의 작성과 표시Ⅰ) 문단 2.7과 2.48에 따르면, 재무제표는\n경제적 사실과 거래의 실질을 반영하여 기업의 재무상태, 경영성과, 현금흐름 및 자본\n- 14 -\n변동을 공정하게 표시하여야 하고, 매출원가는 제품, 상품 등의 매출액에 대응되는 원가\n로서 판매된 제품이나 상품 등에 대한 제조원가 또는 매입원가로 규정하고 있음\n\n감사절차 미흡사항:\n회계감사기준 200(독립된 감사인의 전반목적 및 감사기준에 따른 감사의 수행), 500\n(감사증거)과 700(재무제표에 대한 의견형성과 보고) 등에 따르면 감사인은 재무제표를\n중요하게 왜곡표시 시킬 수 있는 상황이 존재할 수 있다는 전문가적인 의구심을 가지고\n감사업무를 계획하고 수행하여야 하며, 감사인은 감사의견 형성의 기초가 될 합리적인\n감사결론을 도출할 수 있도록 충분하고 적합한 감사증거를 확보하여야 하고, 재무제표가\n일반적으로 인정된 회계처리기준에 따라 중요성의 관점에서 적정하게 표시되고 있다고\n판단했을 경우에만 적정의견을 표명하도록 규정되어 있는바,\n감사인은 회사의 매출규모나 거래처에 중요한 변동이 없음에도 유형자산이 매년\n거액씩 증가하는 예외적인 상황이 발생하였으나 유형자산의 증가사유와 취득의 발생사실\n확인 등의 절차를 소홀히 하였고,\n특정연도에 회사의 과거 평균 개발비의 10배 이상이 증가하는 예외적인 상황이 발생\n하였음에도 증가사유, 수행하고 있는 프로젝트 내용, 개발비 인식의 적정성 등의 검토\n절차를 소홀하여 회사의 회계처리 오류를 발견하지 못함\n\n시사점:\n회사는 매출과 관련하여 생산된 제품의 원·부재료비, 외주가공비는 매출에 대응하는 원가\n로서 당기비용(매출원가)로 계상하여야 함\n감사인은 회사의 매출규모나 영업환경 등에 특별한 변동이 없음에도 유형자산이나 개발비\n등 특정 계정금액이 큰폭으로 증가한 경우, 그 사유를 파악하고 취득사실 확인 등의 절차를\n반드시 수행하여야 함\n- 15 -"
    },
    {
      "paragraph_id": "KICPA-2020-09",
      "case_id": "KICPA-2020-09",
      "case_title": "유형자산 과대계상",
      "metadata": {
        "decision_year": "2020",
        "accounting_period": "’16.1.1.∼’16.12.31.\n1. 회사의 회계처리\n회사는 사업결합 이전에 종속회사에서 발생한 손상차손은 사업결합 이후 연결재무제표 상\n환입할 수 없음에도, 손상차손환입을 인식함에 따라 연결재무제표 상 유형자산을 과대\n계상함\n2. 회계기준 위반 지적 내용\n회사는 신규사업 진출을 목적으로 ‘15년 10월 태국소재 A사의 지분을 전량 인수하였으며\n인수 당시 피투자회사 유형자산의 장부가액과 공정가액이 차이가 발생하였는바 그 내역은\n다음과 같음\n(단위 : 백만원)\n구분 장부가액 공정가액 차이\n- 토지 1,892 1,892 -\n- 건물/구축물 20,004 20,004 -\n- 기계장치 11,686 5,155 6,531*1\n- 공기구/비품 등*2 1 1 -\n- 건설중인자산 14,848 14,848 -\n합계 48,431 41,900 6,531\n*1 실사과정에서 사용가능성이 높지 않은 기계장치에 대해 장부가액 보다 낮은 금액으로 평가하여\n인수함\n*2 공기구비품과 차량운반구로 취득일 전 A사에서 이미 4,580백만원의 손상차손을 인식하였음\n회사는 ‘15년 연결재무제표 작성시 A사의 유형자산을 공정가액으로 계상하여 A사의 개별\n재무제표의 유형자산 장부금액과 회사 연결재무제표의 유형자산 장부금액이 차이가 발생함\n회사는 ‘16년 결산시 ’16년 4월초에 발행된 ‘15년 A사의 감사보고서의 기말 유형자산\n장부금액과 회사 연결재무제표의 기초 유형자산금액이 6,531백만원 차이가 있음을 확인\n- 16 -\n하고 이를 연결재무제표상 손상차손환입으로 인식*하였고\n* 회사는 동 차이금액을 A사가 기계장치와 관련하여 인식했던 손상차손을 환입한 것으로 판단하고\nA사의 개별재무제표의 유형자산금액과 회사 연결재무제표의 유형자산금액을 일치시키는 회계처리를\n수행\n또한 ‘16년 A사가 개별재무제표에서 공기구비품 등과 관련하여 손상차손환입 4,580백만원을\n인식하였고, 동 금액이 연결재무제표에서 제거되지 않고 전이 되었으며, 그 결과 ‘16년 연결\n재무제표상 총 11,111백만원의 유형자산 손상차손환입이 계상됨\n한편, 회사가 연결재무제표상 인식한 손상차손환입 11,111백만원은 ‘15년 10월 지배권을\n취득한 A사의 유형자산과 관련된 것으로 사업결합 이전 발생한 손상차손은 연결재무\n제표상 환입할 수 없는바, 이로 인해 감가상각효과를 고려한 후 10,305백만원의 유형자산이\n과대 계상됨\n3. 지적 근거 및 판단 내용\n기업회계기준서 제1036호(자산손상) 문단 114와 117에 따르면 영업권을 제외한 자산에\n대하여 과거 기간에 인식한 손상차손은 직전 손상차손을 인식한 이후 회수가능액을\n산정하기 위해 사용한 추정치가 달라진 경우에만 환입하고, 손상차손환입으로 증액된\n장부금액은 과거에 손상차손을 인식하기 전의 장부금액의 감가상각 또는 상각 후 남은\n금액을 초과할 수 없도록 규정하고 있음\n4. 감사절차 미흡사항\n회계감사기준 200(독립된 감사인의 전반목적 및 감사기준에 따른 감사의 수행), 500\n(감사증거)과 700(재무제표에 대한 의견형성과 보고) 등에 따르면 감사인은 재무제표를\n중요하게 왜곡표시 시킬 수 있는 상황이 존재할 수 있다는 전문가적인 의구심을 가지고\n감사업무를 계획하고 수행하여야 하며, 감사인은 감사의견 형성의 기초가 될 합리적\n인 감사결론을 도출할 수 있도록 충분하고 적합한 감사증거를 확보하여야 하고, 재무\n제표가 일반적으로 인정된 회계처리기준에 따라 중요성의 관점에서 적정하게 표시되고\n있다고 판단했을 경우에만 적정의견을 표명하도록 규정되어 있는바,\n감사인은 회사가 타법인의 지분을 취득하고 이와 관련한 사업결합 회계처리를 수행한\n직후에 피취득법인의 개별재무제표에서 유형자산과 관련한 거액의 손상차손환입이\n발생하였음에도, 연결재무제표 검토과정에서 손상차손환입의 발생사유에 대한 검토\n절차를 누락하여 회사의 회계처리 오류를 지적하지 못함\n- 17 -\n5. 시사점\n회사는 사업결합발생시 취득시점 이후 종속회사의 자산 및 부채의 회계처리가 연결\n재무제표에 미치는 영향을 분석하는 결산관련 내부통제를 강화하여야 하며 사업결합\n관련 기준서를 숙지하여야 함\n감사인은 사업결합 회계처리 시 공정가액평가 등으로 인해 피투자회사의 개별재무제표상\n자산의 장부금액과 취득회사의 연결재무제표상 자산의 장부금액이 차이가 있는 경우\n차이원인 및 차이로 인한 발생효과 등을 면밀히 검토하여야 함",
        "issue_fields": [
          "유형자산 손상차손환입"
        ],
        "related_standards": [
          "기업회계기준서 제1036호(자산손상)"
        ],
        "case_type": "회계감리지적사례",
        "source": "KICPA 심사·감리 지적사례"
      },
      "content": {
        "section_1_company_accounting": {
          "section_title": "회사의 회계처리",
          "content": "회사는 사업결합 이전에 종속회사에서 발생한 손상차손은 사업결합 이후 연결재무제표 상\n환입할 수 없음에도, 손상차손환입을 인식함에 따라 연결재무제표 상 유형자산을 과대\n계상함"
        },
        "section_2_violation_details": {
          "section_title": "회계기준 위반 지적 내용",
          "content": "회사는 신규사업 진출을 목적으로 ‘15년 10월 태국소재 A사의 지분을 전량 인수하였으며\n인수 당시 피투자회사 유형자산의 장부가액과 공정가액이 차이가 발생하였는바 그 내역은\n다음과 같음\n(단위 : 백만원)\n구분 장부가액 공정가액 차이\n- 토지 1,892 1,892 -\n- 건물/구축물 20,004 20,004 -\n- 기계장치 11,686 5,155 6,531*1\n- 공기구/비품 등*2 1 1 -\n- 건설중인자산 14,848 14,848 -\n합계 48,431 41,900 6,531\n*1 실사과정에서 사용가능성이 높지 않은 기계장치에 대해 장부가액 보다 낮은 금액으로 평가하여\n인수함\n*2 공기구비품과 차량운반구로 취득일 전 A사에서 이미 4,580백만원의 손상차손을 인식하였음\n회사는 ‘15년 연결재무제표 작성시 A사의 유형자산을 공정가액으로 계상하여 A사의 개별\n재무제표의 유형자산 장부금액과 회사 연결재무제표의 유형자산 장부금액이 차이가 발생함\n회사는 ‘16년 결산시 ’16년 4월초에 발행된 ‘15년 A사의 감사보고서의 기말 유형자산\n장부금액과 회사 연결재무제표의 기초 유형자산금액이 6,531백만원 차이가 있음을 확인\n- 16 -\n하고 이를 연결재무제표상 손상차손환입으로 인식*하였고\n* 회사는 동 차이금액을 A사가 기계장치와 관련하여 인식했던 손상차손을 환입한 것으로 판단하고\nA사의 개별재무제표의 유형자산금액과 회사 연결재무제표의 유형자산금액을 일치시키는 회계처리를\n수행\n또한 ‘16년 A사가 개별재무제표에서 공기구비품 등과 관련하여 손상차손환입 4,580백만원을\n인식하였고, 동 금액이 연결재무제표에서 제거되지 않고 전이 되었으며, 그 결과 ‘16년 연결\n재무제표상 총 11,111백만원의 유형자산 손상차손환입이 계상됨\n한편, 회사가 연결재무제표상 인식한 손상차손환입 11,111백만원은 ‘15년 10월 지배권을\n취득한 A사의 유형자산과 관련된 것으로 사업결합 이전 발생한 손상차손은 연결재무\n제표상 환입할 수 없는바, 이로 인해 감가상각효과를 고려한 후 10,305백만원의 유형자산이\n과대 계상됨"
        },
        "section_3_basis_judgment": {
          "section_title": "지적 근거 및 판단 내용",
          "content": "기업회계기준서 제1036호(자산손상) 문단 114와 117에 따르면 영업권을 제외한 자산에\n대하여 과거 기간에 인식한 손상차손은 직전 손상차손을 인식한 이후 회수가능액을\n산정하기 위해 사용한 추정치가 달라진 경우에만 환입하고, 손상차손환입으로 증액된\n장부금액은 과거에 손상차손을 인식하기 전의 장부금액의 감가상각 또는 상각 후 남은\n금액을 초과할 수 없도록 규정하고 있음"
        },
        "section_4_audit_procedure": {
          "section_title": "감사절차 미흡사항",
          "content": "회계감사기준 200(독립된 감사인의 전반목적 및 감사기준에 따른 감사의 수행), 500\n(감사증거)과 700(재무제표에 대한 의견형성과 보고) 등에 따르면 감사인은 재무제표를\n중요하게 왜곡표시 시킬 수 있는 상황이 존재할 수 있다는 전문가적인 의구심을 가지고\n감사업무를 계획하고 수행하여야 하며, 감사인은 감사의견 형성의 기초가 될 합리적\n인 감사결론을 도출할 수 있도록 충분하고 적합한 감사증거를 확보하여야 하고, 재무\n제표가 일반적으로 인정된 회계처리기준에 따라 중요성의 관점에서 적정하게 표시되고\n있다고 판단했을 경우에만 적정의견을 표명하도록 규정되어 있는바,\n감사인은 회사가 타법인의 지분을 취득하고 이와 관련한 사업결합 회계처리를 수행한\n직후에 피취득법인의 개별재무제표에서 유형자산과 관련한 거액의 손상차손환입이\n발생하였음에도, 연결재무제표 검토과정에서 손상차손환입의 발생사유에 대한 검토\n절차를 누락하여 회사의 회계처리 오류를 지적하지 못함\n- 17 -"
        },
        "section_5_implications": {
          "section_title": "시사점",
          "content": "회사는 사업결합발생시 취득시점 이후 종속회사의 자산 및 부채의 회계처리가 연결\n재무제표에 미치는 영향을 분석하는 결산관련 내부통제를 강화하여야 하며 사업결합\n관련 기준서를 숙지하여야 함\n감사인은 사업결합 회계처리 시 공정가액평가 등으로 인해 피투자회사의 개별재무제표상\n자산의 장부금액과 취득회사의 연결재무제표상 자산의 장부금액이 차이가 있는 경우\n차이원인 및 차이로 인한 발생효과 등을 면밀히 검토하여야 함"
        }
      },
      "indexed_content": "케이스 ID: KICPA-2020-09\n제목: 유형자산 과대계상\n결정연도: 2020년\n회계결산일: ’16.1.1.∼’16.12.31.\n1. 회사의 회계처리\n회사는 사업결합 이전에 종속회사에서 발생한 손상차손은 사업결합 이후 연결재무제표 상\n환입할 수 없음에도, 손상차손환입을 인식함에 따라 연결재무제표 상 유형자산을 과대\n계상함\n2. 회계기준 위반 지적 내용\n회사는 신규사업 진출을 목적으로 ‘15년 10월 태국소재 A사의 지분을 전량 인수하였으며\n인수 당시 피투자회사 유형자산의 장부가액과 공정가액이 차이가 발생하였는바 그 내역은\n다음과 같음\n(단위 : 백만원)\n구분 장부가액 공정가액 차이\n- 토지 1,892 1,892 -\n- 건물/구축물 20,004 20,004 -\n- 기계장치 11,686 5,155 6,531*1\n- 공기구/비품 등*2 1 1 -\n- 건설중인자산 14,848 14,848 -\n합계 48,431 41,900 6,531\n*1 실사과정에서 사용가능성이 높지 않은 기계장치에 대해 장부가액 보다 낮은 금액으로 평가하여\n인수함\n*2 공기구비품과 차량운반구로 취득일 전 A사에서 이미 4,580백만원의 손상차손을 인식하였음\n회사는 ‘15년 연결재무제표 작성시 A사의 유형자산을 공정가액으로 계상하여 A사의 개별\n재무제표의 유형자산 장부금액과 회사 연결재무제표의 유형자산 장부금액이 차이가 발생함\n회사는 ‘16년 결산시 ’16년 4월초에 발행된 ‘15년 A사의 감사보고서의 기말 유형자산\n장부금액과 회사 연결재무제표의 기초 유형자산금액이 6,531백만원 차이가 있음을 확인\n- 16 -\n하고 이를 연결재무제표상 손상차손환입으로 인식*하였고\n* 회사는 동 차이금액을 A사가 기계장치와 관련하여 인식했던 손상차손을 환입한 것으로 판단하고\nA사의 개별재무제표의 유형자산금액과 회사 연결재무제표의 유형자산금액을 일치시키는 회계처리를\n수행\n또한 ‘16년 A사가 개별재무제표에서 공기구비품 등과 관련하여 손상차손환입 4,580백만원을\n인식하였고, 동 금액이 연결재무제표에서 제거되지 않고 전이 되었으며, 그 결과 ‘16년 연결\n재무제표상 총 11,111백만원의 유형자산 손상차손환입이 계상됨\n한편, 회사가 연결재무제표상 인식한 손상차손환입 11,111백만원은 ‘15년 10월 지배권을\n취득한 A사의 유형자산과 관련된 것으로 사업결합 이전 발생한 손상차손은 연결재무\n제표상 환입할 수 없는바, 이로 인해 감가상각효과를 고려한 후 10,305백만원의 유형자산이\n과대 계상됨\n3. 지적 근거 및 판단 내용\n기업회계기준서 제1036호(자산손상) 문단 114와 117에 따르면 영업권을 제외한 자산에\n대하여 과거 기간에 인식한 손상차손은 직전 손상차손을 인식한 이후 회수가능액을\n산정하기 위해 사용한 추정치가 달라진 경우에만 환입하고, 손상차손환입으로 증액된\n장부금액은 과거에 손상차손을 인식하기 전의 장부금액의 감가상각 또는 상각 후 남은\n금액을 초과할 수 없도록 규정하고 있음\n4. 감사절차 미흡사항\n회계감사기준 200(독립된 감사인의 전반목적 및 감사기준에 따른 감사의 수행), 500\n(감사증거)과 700(재무제표에 대한 의견형성과 보고) 등에 따르면 감사인은 재무제표를\n중요하게 왜곡표시 시킬 수 있는 상황이 존재할 수 있다는 전문가적인 의구심을 가지고\n감사업무를 계획하고 수행하여야 하며, 감사인은 감사의견 형성의 기초가 될 합리적\n인 감사결론을 도출할 수 있도록 충분하고 적합한 감사증거를 확보하여야 하고, 재무\n제표가 일반적으로 인정된 회계처리기준에 따라 중요성의 관점에서 적정하게 표시되고\n있다고 판단했을 경우에만 적정의견을 표명하도록 규정되어 있는바,\n감사인은 회사가 타법인의 지분을 취득하고 이와 관련한 사업결합 회계처리를 수행한\n직후에 피취득법인의 개별재무제표에서 유형자산과 관련한 거액의 손상차손환입이\n발생하였음에도, 연결재무제표 검토과정에서 손상차손환입의 발생사유에 대한 검토\n절차를 누락하여 회사의 회계처리 오류를 지적하지 못함\n- 17 -\n5. 시사점\n회사는 사업결합발생시 취득시점 이후 종속회사의 자산 및 부채의 회계처리가 연결\n재무제표에 미치는 영향을 분석하는 결산관련 내부통제를 강화하여야 하며 사업결합\n관련 기준서를 숙지하여야 함\n감사인은 사업결합 회계처리 시 공정가액평가 등으로 인해 피투자회사의 개별재무제표상\n자산의 장부금액과 취득회사의 연결재무제표상 자산의 장부금액이 차이가 있는 경우\n차이원인 및 차이로 인한 발생효과 등을 면밀히 검토하여야 함\n쟁점분야: 유형자산 손상차손환입\n관련기준: 기업회계기준서 제1036호(자산손상)\n\n회사의 회계처리:\n회사는 사업결합 이전에 종속회사에서 발생한 손상차손은 사업결합 이후 연결재무제표 상\n환입할 수 없음에도, 손상차손환입을 인식함에 따라 연결재무제표 상 유형자산을 과대\n계상함\n\n회계기준 위반 지적 내용:\n회사는 신규사업 진출을 목적으로 ‘15년 10월 태국소재 A사의 지분을 전량 인수하였으며\n인수 당시 피투자회사 유형자산의 장부가액과 공정가액이 차이가 발생하였는바 그 내역은\n다음과 같음\n(단위 : 백만원)\n구분 장부가액 공정가액 차이\n- 토지 1,892 1,892 -\n- 건물/구축물 20,004 20,004 -\n- 기계장치 11,686 5,155 6,531*1\n- 공기구/비품 등*2 1 1 -\n- 건설중인자산 14,848 14,848 -\n합계 48,431 41,900 6,531\n*1 실사과정에서 사용가능성이 높지 않은 기계장치에 대해 장부가액 보다 낮은 금액으로 평가하여\n인수함\n*2 공기구비품과 차량운반구로 취득일 전 A사에서 이미 4,580백만원의 손상차손을 인식하였음\n회사는 ‘15년 연결재무제표 작성시 A사의 유형자산을 공정가액으로 계상하여 A사의 개별\n재무제표의 유형자산 장부금액과 회사 연결재무제표의 유형자산 장부금액이 차이가 발생함\n회사는 ‘16년 결산시 ’16년 4월초에 발행된 ‘15년 A사의 감사보고서의 기말 유형자산\n장부금액과 회사 연결재무제표의 기초 유형자산금액이 6,531백만원 차이가 있음을 확인\n- 16 -\n하고 이를 연결재무제표상 손상차손환입으로 인식*하였고\n* 회사는 동 차이금액을 A사가 기계장치와 관련하여 인식했던 손상차손을 환입한 것으로 판단하고\nA사의 개별재무제표의 유형자산금액과 회사 연결재무제표의 유형자산금액을 일치시키는 회계처리를\n수행\n또한 ‘16년 A사가 개별재무제표에서 공기구비품 등과 관련하여 손상차손환입 4,580백만원을\n인식하였고, 동 금액이 연결재무제표에서 제거되지 않고 전이 되었으며, 그 결과 ‘16년 연결\n재무제표상 총 11,111백만원의 유형자산 손상차손환입이 계상됨\n한편, 회사가 연결재무제표상 인식한 손상차손환입 11,111백만원은 ‘15년 10월 지배권을\n취득한 A사의 유형자산과 관련된 것으로 사업결합 이전 발생한 손상차손은 연결재무\n제표상 환입할 수 없는바, 이로 인해 감가상각효과를 고려한 후 10,305백만원의 유형자산이\n과대 계상됨\n\n지적 근거 및 판단 내용:\n기업회계기준서 제1036호(자산손상) 문단 114와 117에 따르면 영업권을 제외한 자산에\n대하여 과거 기간에 인식한 손상차손은 직전 손상차손을 인식한 이후 회수가능액을\n산정하기 위해 사용한 추정치가 달라진 경우에만 환입하고, 손상차손환입으로 증액된\n장부금액은 과거에 손상차손을 인식하기 전의 장부금액의 감가상각 또는 상각 후 남은\n금액을 초과할 수 없도록 규정하고 있음\n\n감사절차 미흡사항:\n회계감사기준 200(독립된 감사인의 전반목적 및 감사기준에 따른 감사의 수행), 500\n(감사증거)과 700(재무제표에 대한 의견형성과 보고) 등에 따르면 감사인은 재무제표를\n중요하게 왜곡표시 시킬 수 있는 상황이 존재할 수 있다는 전문가적인 의구심을 가지고\n감사업무를 계획하고 수행하여야 하며, 감사인은 감사의견 형성의 기초가 될 합리적\n인 감사결론을 도출할 수 있도록 충분하고 적합한 감사증거를 확보하여야 하고, 재무\n제표가 일반적으로 인정된 회계처리기준에 따라 중요성의 관점에서 적정하게 표시되고\n있다고 판단했을 경우에만 적정의견을 표명하도록 규정되어 있는바,\n감사인은 회사가 타법인의 지분을 취득하고 이와 관련한 사업결합 회계처리를 수행한\n직후에 피취득법인의 개별재무제표에서 유형자산과 관련한 거액의 손상차손환입이\n발생하였음에도, 연결재무제표 검토과정에서 손상차손환입의 발생사유에 대한 검토\n절차를 누락하여 회사의 회계처리 오류를 지적하지 못함\n- 17 -\n\n시사점:\n회사는 사업결합발생시 취득시점 이후 종속회사의 자산 및 부채의 회계처리가 연결\n재무제표에 미치는 영향을 분석하는 결산관련 내부통제를 강화하여야 하며 사업결합\n관련 기준서를 숙지하여야 함\n감사인은 사업결합 회계처리 시 공정가액평가 등으로 인해 피투자회사의 개별재무제표상\n자산의 장부금액과 취득회사의 연결재무제표상 자산의 장부금액이 차이가 있는 경우\n차이원인 및 차이로 인한 발생효과 등을 면밀히 검토하여야 함"
    },
    {
      "paragraph_id": "KICPA-2020-10",
      "case_id": "KICPA-2020-10",
      "case_title": "무형자산(개발비) 과대계상",
      "metadata": {
        "decision_year": "2020",
        "accounting_period": "’16.1.1.∼’17.12.31.\n1. 회사의 회계처리\n회사는 개발비를 자산화하는 과정에서 개발부서 이외 부서에서 발생한 급여를 개발비로\n배부하고, 당기발생 감가상각비를 개발비에 배부하여야 하나 감가상각누계액을 배부\n하여 개발비를 과대계상함\n2. 회계기준 위반 지적 내용\n회사는 신제품의 개발을 위한 프로젝트를 진행 중에, 시간입력시스템과 전담인력 등을\n갖추지 못한 상태에서 개발과 직접 관련된 급여의 범위를 잘못 추정하여 개발부서가\n아닌 타부서의 급여를 자산화하고, 단순 착오에 의하여 당기발생 감가상각비를 개발비에\n배부하지 않고, 감가상각누계액을 배부함에 따라 개발비를 과대계상함\n3. 지적 근거 및 판단 내용\n기업회계기준서 제1038호(무형자산) 문단 57, 66과 67에 따르면 개발과정에서 발생한\n무형자산 관련 지출을 신뢰성 있게 측정할 수 있는 기업의 능력을 제시할 수 있는\n경우에 개발활동(또는 내부프로젝트의 개발단계)에서 발생한 무형자산을 인식할 수 있고\n- 18 -\n내부적으로 창출한 무형자산의 원가는 그 자산의 창출, 제조 및 경영자가 의도하는\n방식으로 운영될 수 있게 준비하는데 필요한 직접 관련된 모든 원가를 포함할 수 있으나,\n자산을 의도한 용도로 사용할 수 있도록 준비하는데 직접 관련된 경우를 제외한 판매비,\n관리비 및 기타 일반경비 지출은 내부적으로 창출한 무형자산의 원가에 포함하지 않도록\n규정하고 있음\n4. 감사절차 미흡사항\n회계감사기준 200(독립된 감사인의 전반목적 및 감사기준에 따른 감사의 수행), 500\n(감사증거)과 700(재무제표에 대한 의견형성과 보고) 등에 따르면 감사인은 재무제표를\n중요하게 왜곡표시 시킬 수 있는 상황이 존재할 수 있다는 전문가적인 의구심을 가지고\n감사업무를 계획하고 수행하여야 하며, 감사인은 감사의견 형성의 기초가 될 합리적인\n감사결론을 도출할 수 있도록 충분하고 적합한 감사증거를 확보하여야 하고, 재무제표가\n일반적으로 인정된 회계처리기준에 따라 중요성의 관점에서 적정하게 표시되고 있다고\n판단했을 경우에만 적정의견을 표명하도록 규정되어 있음에도,\n감사인은 개발비의 자산성 검토, 손상검토 및 개발비 집계내역의 검토 등의 감사절차를\n수행하였으나,\n감가상각비 자산화 관련 오류의 경우 개발비 배부금액의 적정성에 대한 검토절차를\n누락하였고, 개발비로 자산화한 급여에 개발부서 이외 부서의 급여가 대부분을 차지\n하고 있음에도 회사의 개발 프로세스 상 개발부서 이외 타부서의 참여가 필수적이라는\n회사의 주장만을 신뢰하여 추가적인 검토절차를 수행하지 않아 회사의 회계처리\n오류를 지적하지 못함\n5. 시사점\n회사는 개발 프로젝트별 투입시간을 기록할 수 있는 시간입력시스템을 구축하고 이에\n근거하여 자산화할 인건비를 산출할 필요가 있고 인건비를 제외한 기타간접비의 경우\n합리적인 배부기준을 설정하여 개발프로젝트에 배부할 수 있도록 관련 내부통제절차를\n강화하여야 하며, 개발비 관련 기준서를 숙지하여야 함\n감사인은 개발비의 자산성에 대한 검토 시 시간집계자료 등 회사의 주장을 확인할 수\n있는 자료를 징구하고, 개발프로젝트에 대응하는 직접비와 간접경비의 집계방법 및\n간접경비 배분기준의 타당성을 검토하는 절차를 수행하여야 함\n- 19 -",
        "issue_fields": [
          "무형자산 과대계상"
        ],
        "related_standards": [
          "기업회계기준서 제1038호(무형자산)"
        ],
        "case_type": "회계감리지적사례",
        "source": "KICPA 심사·감리 지적사례"
      },
      "content": {
        "section_1_company_accounting": {
          "section_title": "회사의 회계처리",
          "content": "회사는 개발비를 자산화하는 과정에서 개발부서 이외 부서에서 발생한 급여를 개발비로\n배부하고, 당기발생 감가상각비를 개발비에 배부하여야 하나 감가상각누계액을 배부\n하여 개발비를 과대계상함"
        },
        "section_2_violation_details": {
          "section_title": "회계기준 위반 지적 내용",
          "content": "회사는 신제품의 개발을 위한 프로젝트를 진행 중에, 시간입력시스템과 전담인력 등을\n갖추지 못한 상태에서 개발과 직접 관련된 급여의 범위를 잘못 추정하여 개발부서가\n아닌 타부서의 급여를 자산화하고, 단순 착오에 의하여 당기발생 감가상각비를 개발비에\n배부하지 않고, 감가상각누계액을 배부함에 따라 개발비를 과대계상함"
        },
        "section_3_basis_judgment": {
          "section_title": "지적 근거 및 판단 내용",
          "content": "기업회계기준서 제1038호(무형자산) 문단 57, 66과 67에 따르면 개발과정에서 발생한\n무형자산 관련 지출을 신뢰성 있게 측정할 수 있는 기업의 능력을 제시할 수 있는\n경우에 개발활동(또는 내부프로젝트의 개발단계)에서 발생한 무형자산을 인식할 수 있고\n- 18 -\n내부적으로 창출한 무형자산의 원가는 그 자산의 창출, 제조 및 경영자가 의도하는\n방식으로 운영될 수 있게 준비하는데 필요한 직접 관련된 모든 원가를 포함할 수 있으나,\n자산을 의도한 용도로 사용할 수 있도록 준비하는데 직접 관련된 경우를 제외한 판매비,\n관리비 및 기타 일반경비 지출은 내부적으로 창출한 무형자산의 원가에 포함하지 않도록\n규정하고 있음"
        },
        "section_4_audit_procedure": {
          "section_title": "감사절차 미흡사항",
          "content": "회계감사기준 200(독립된 감사인의 전반목적 및 감사기준에 따른 감사의 수행), 500\n(감사증거)과 700(재무제표에 대한 의견형성과 보고) 등에 따르면 감사인은 재무제표를\n중요하게 왜곡표시 시킬 수 있는 상황이 존재할 수 있다는 전문가적인 의구심을 가지고\n감사업무를 계획하고 수행하여야 하며, 감사인은 감사의견 형성의 기초가 될 합리적인\n감사결론을 도출할 수 있도록 충분하고 적합한 감사증거를 확보하여야 하고, 재무제표가\n일반적으로 인정된 회계처리기준에 따라 중요성의 관점에서 적정하게 표시되고 있다고\n판단했을 경우에만 적정의견을 표명하도록 규정되어 있음에도,\n감사인은 개발비의 자산성 검토, 손상검토 및 개발비 집계내역의 검토 등의 감사절차를\n수행하였으나,\n감가상각비 자산화 관련 오류의 경우 개발비 배부금액의 적정성에 대한 검토절차를\n누락하였고, 개발비로 자산화한 급여에 개발부서 이외 부서의 급여가 대부분을 차지\n하고 있음에도 회사의 개발 프로세스 상 개발부서 이외 타부서의 참여가 필수적이라는\n회사의 주장만을 신뢰하여 추가적인 검토절차를 수행하지 않아 회사의 회계처리\n오류를 지적하지 못함"
        },
        "section_5_implications": {
          "section_title": "시사점",
          "content": "회사는 개발 프로젝트별 투입시간을 기록할 수 있는 시간입력시스템을 구축하고 이에\n근거하여 자산화할 인건비를 산출할 필요가 있고 인건비를 제외한 기타간접비의 경우\n합리적인 배부기준을 설정하여 개발프로젝트에 배부할 수 있도록 관련 내부통제절차를\n강화하여야 하며, 개발비 관련 기준서를 숙지하여야 함\n감사인은 개발비의 자산성에 대한 검토 시 시간집계자료 등 회사의 주장을 확인할 수\n있는 자료를 징구하고, 개발프로젝트에 대응하는 직접비와 간접경비의 집계방법 및\n간접경비 배분기준의 타당성을 검토하는 절차를 수행하여야 함\n- 19 -"
        }
      },
      "indexed_content": "케이스 ID: KICPA-2020-10\n제목: 무형자산(개발비) 과대계상\n결정연도: 2020년\n회계결산일: ’16.1.1.∼’17.12.31.\n1. 회사의 회계처리\n회사는 개발비를 자산화하는 과정에서 개발부서 이외 부서에서 발생한 급여를 개발비로\n배부하고, 당기발생 감가상각비를 개발비에 배부하여야 하나 감가상각누계액을 배부\n하여 개발비를 과대계상함\n2. 회계기준 위반 지적 내용\n회사는 신제품의 개발을 위한 프로젝트를 진행 중에, 시간입력시스템과 전담인력 등을\n갖추지 못한 상태에서 개발과 직접 관련된 급여의 범위를 잘못 추정하여 개발부서가\n아닌 타부서의 급여를 자산화하고, 단순 착오에 의하여 당기발생 감가상각비를 개발비에\n배부하지 않고, 감가상각누계액을 배부함에 따라 개발비를 과대계상함\n3. 지적 근거 및 판단 내용\n기업회계기준서 제1038호(무형자산) 문단 57, 66과 67에 따르면 개발과정에서 발생한\n무형자산 관련 지출을 신뢰성 있게 측정할 수 있는 기업의 능력을 제시할 수 있는\n경우에 개발활동(또는 내부프로젝트의 개발단계)에서 발생한 무형자산을 인식할 수 있고\n- 18 -\n내부적으로 창출한 무형자산의 원가는 그 자산의 창출, 제조 및 경영자가 의도하는\n방식으로 운영될 수 있게 준비하는데 필요한 직접 관련된 모든 원가를 포함할 수 있으나,\n자산을 의도한 용도로 사용할 수 있도록 준비하는데 직접 관련된 경우를 제외한 판매비,\n관리비 및 기타 일반경비 지출은 내부적으로 창출한 무형자산의 원가에 포함하지 않도록\n규정하고 있음\n4. 감사절차 미흡사항\n회계감사기준 200(독립된 감사인의 전반목적 및 감사기준에 따른 감사의 수행), 500\n(감사증거)과 700(재무제표에 대한 의견형성과 보고) 등에 따르면 감사인은 재무제표를\n중요하게 왜곡표시 시킬 수 있는 상황이 존재할 수 있다는 전문가적인 의구심을 가지고\n감사업무를 계획하고 수행하여야 하며, 감사인은 감사의견 형성의 기초가 될 합리적인\n감사결론을 도출할 수 있도록 충분하고 적합한 감사증거를 확보하여야 하고, 재무제표가\n일반적으로 인정된 회계처리기준에 따라 중요성의 관점에서 적정하게 표시되고 있다고\n판단했을 경우에만 적정의견을 표명하도록 규정되어 있음에도,\n감사인은 개발비의 자산성 검토, 손상검토 및 개발비 집계내역의 검토 등의 감사절차를\n수행하였으나,\n감가상각비 자산화 관련 오류의 경우 개발비 배부금액의 적정성에 대한 검토절차를\n누락하였고, 개발비로 자산화한 급여에 개발부서 이외 부서의 급여가 대부분을 차지\n하고 있음에도 회사의 개발 프로세스 상 개발부서 이외 타부서의 참여가 필수적이라는\n회사의 주장만을 신뢰하여 추가적인 검토절차를 수행하지 않아 회사의 회계처리\n오류를 지적하지 못함\n5. 시사점\n회사는 개발 프로젝트별 투입시간을 기록할 수 있는 시간입력시스템을 구축하고 이에\n근거하여 자산화할 인건비를 산출할 필요가 있고 인건비를 제외한 기타간접비의 경우\n합리적인 배부기준을 설정하여 개발프로젝트에 배부할 수 있도록 관련 내부통제절차를\n강화하여야 하며, 개발비 관련 기준서를 숙지하여야 함\n감사인은 개발비의 자산성에 대한 검토 시 시간집계자료 등 회사의 주장을 확인할 수\n있는 자료를 징구하고, 개발프로젝트에 대응하는 직접비와 간접경비의 집계방법 및\n간접경비 배분기준의 타당성을 검토하는 절차를 수행하여야 함\n- 19 -\n쟁점분야: 무형자산 과대계상\n관련기준: 기업회계기준서 제1038호(무형자산)\n\n회사의 회계처리:\n회사는 개발비를 자산화하는 과정에서 개발부서 이외 부서에서 발생한 급여를 개발비로\n배부하고, 당기발생 감가상각비를 개발비에 배부하여야 하나 감가상각누계액을 배부\n하여 개발비를 과대계상함\n\n회계기준 위반 지적 내용:\n회사는 신제품의 개발을 위한 프로젝트를 진행 중에, 시간입력시스템과 전담인력 등을\n갖추지 못한 상태에서 개발과 직접 관련된 급여의 범위를 잘못 추정하여 개발부서가\n아닌 타부서의 급여를 자산화하고, 단순 착오에 의하여 당기발생 감가상각비를 개발비에\n배부하지 않고, 감가상각누계액을 배부함에 따라 개발비를 과대계상함\n\n지적 근거 및 판단 내용:\n기업회계기준서 제1038호(무형자산) 문단 57, 66과 67에 따르면 개발과정에서 발생한\n무형자산 관련 지출을 신뢰성 있게 측정할 수 있는 기업의 능력을 제시할 수 있는\n경우에 개발활동(또는 내부프로젝트의 개발단계)에서 발생한 무형자산을 인식할 수 있고\n- 18 -\n내부적으로 창출한 무형자산의 원가는 그 자산의 창출, 제조 및 경영자가 의도하는\n방식으로 운영될 수 있게 준비하는데 필요한 직접 관련된 모든 원가를 포함할 수 있으나,\n자산을 의도한 용도로 사용할 수 있도록 준비하는데 직접 관련된 경우를 제외한 판매비,\n관리비 및 기타 일반경비 지출은 내부적으로 창출한 무형자산의 원가에 포함하지 않도록\n규정하고 있음\n\n감사절차 미흡사항:\n회계감사기준 200(독립된 감사인의 전반목적 및 감사기준에 따른 감사의 수행), 500\n(감사증거)과 700(재무제표에 대한 의견형성과 보고) 등에 따르면 감사인은 재무제표를\n중요하게 왜곡표시 시킬 수 있는 상황이 존재할 수 있다는 전문가적인 의구심을 가지고\n감사업무를 계획하고 수행하여야 하며, 감사인은 감사의견 형성의 기초가 될 합리적인\n감사결론을 도출할 수 있도록 충분하고 적합한 감사증거를 확보하여야 하고, 재무제표가\n일반적으로 인정된 회계처리기준에 따라 중요성의 관점에서 적정하게 표시되고 있다고\n판단했을 경우에만 적정의견을 표명하도록 규정되어 있음에도,\n감사인은 개발비의 자산성 검토, 손상검토 및 개발비 집계내역의 검토 등의 감사절차를\n수행하였으나,\n감가상각비 자산화 관련 오류의 경우 개발비 배부금액의 적정성에 대한 검토절차를\n누락하였고, 개발비로 자산화한 급여에 개발부서 이외 부서의 급여가 대부분을 차지\n하고 있음에도 회사의 개발 프로세스 상 개발부서 이외 타부서의 참여가 필수적이라는\n회사의 주장만을 신뢰하여 추가적인 검토절차를 수행하지 않아 회사의 회계처리\n오류를 지적하지 못함\n\n시사점:\n회사는 개발 프로젝트별 투입시간을 기록할 수 있는 시간입력시스템을 구축하고 이에\n근거하여 자산화할 인건비를 산출할 필요가 있고 인건비를 제외한 기타간접비의 경우\n합리적인 배부기준을 설정하여 개발프로젝트에 배부할 수 있도록 관련 내부통제절차를\n강화하여야 하며, 개발비 관련 기준서를 숙지하여야 함\n감사인은 개발비의 자산성에 대한 검토 시 시간집계자료 등 회사의 주장을 확인할 수\n있는 자료를 징구하고, 개발프로젝트에 대응하는 직접비와 간접경비의 집계방법 및\n간접경비 배분기준의 타당성을 검토하는 절차를 수행하여야 함\n- 19 -"
    },
    {
      "paragraph_id": "KICPA-2020-11",
      "case_id": "KICPA-2020-11",
      "case_title": "무형자산(개발비 등) 과대계상",
      "metadata": {
        "decision_year": "2020",
        "accounting_period": "’17.1.1.∼’17.12.31.\n1. 회사의 회계처리\n회사는 연구개발비로 계상한 비용이 개발단계가 아닌 연구단계에 해당하는 비용임에도,\n회계처리기준에 따른 구체적인 검토와 관련 문서와 증빙 등을 확인하지 않고 단순히\n해당 기술이 상용화가 가능하다고 판단하여 개발비로 잘못 계상하였으며, 경영악화\n등으로 해당 프로젝트 관련 사업중단이 예상되어 관련 개발비를 손상인식하여야 함에도\n손상회계처리 하지 아니함\n2. 회계기준 위반 지적 내용\n회사는 무형자산 인식요건을 충족하지 못하는 개발 비용*1을 무형자산(개발비)으로 잘못\n인식하였으며, 또한 손상요건*2을 만족하는 무형자산(산업재산권 등)을 적절한 시기에 손상\n처리하지 않아 관련 무형자산을 과대계상함\n*1 회사는 회계처리기준에 따른 구체적인 검토와 관련 문서와 증빙 등을 확인하지 않고 단순히 해당\n기술이 상용화가 가능하다고 판단하여 연구단계에서 발생한 비용을 무형자산으로 잘못 인식함\n*2 기술이전계약 체결 후 회사의 자금악화로 기술료 납부를 완료하지 못하였고, 경영악화 등으로 전기차충전\n사업의 중단 등의 결과가 초래되어 기술이전의 효과를 낼 수 없는 상황 발생\n3. 지적 근거 및 판단 내용\n일반기업회계기준 제11장(무형자산) 문단 11.20에 따르면 연구개발비 중 개발단계의\n요건을 만족하는 지출로 기준서의 기술적 실현가능성 등 해당 무형자산 인식요건을\n모두 충족하는 경우에만 연구개발비 등 무형자산으로 인식하여야 하며, 일반기업회계\n기준 제20장(자산손상) 문단 20에 따르면 자산의 진부화 및 시장가치의 급격한 하락\n등으로 인하여 자산의 회수가능액이 장부금액에 중요하게 미달하게 되는 경우에는\n장부금액을 회수가능액으로 조정하고 그 차액을 손상차손으로 처리하도록 규정되어\n있음\n- 20 -\n4. 감사절차 미흡사항\n회계감사기준 200(독립된 감사인의 전반목적 및 감사기준에 따른 감사의 수행), 500\n(감사증거)과 700(재무제표에 대한 의견형성과 보고) 등에 따르면 감사인은 재무제표\n를 중요하게 왜곡표시 시킬 수 있는 상황이 존재할 수 있다는 전문가적인 의구심을\n가지고 감사업무를 계획하고 수행하여야 하며, 감사인은 감사의견 형성의 기초가 될\n합리적인 감사결론을 도출할 수 있도록 충분하고 적합한 감사증거를 확보하여야 하고,\n재무제표가 일반적으로 인정된 회계처리기준에 따라 중요성의 관점에서 적정하게 표시\n되고 있다고 판단했을 경우에만 적정의견을 표명하도록 규정되어 있음에도,\n감사인은 개발비 인식요건의 충족여부, 프로젝트의 개발 진행현황 등의 파악을 통한\n손상인식 가능성에 대한 검토절차를 소홀히 하여 회사의 회계처리 오류를 지적하지\n못함\n5. 시사점\n회사는 개발비를 인식함에 있어 단순하게 해당 기술이 상용화가 가능하다고 판단하여\n자산화하는 실무적인 경향이 있는데 회계기준상의 (1) 연구단계와 개발단계로 구분하여\n연구단계에 해당되는 비용은 즉시 당기비용으로 비용처리하고 개발단계에 해당되는\n비용은 (2) 회계기준상의 ①기술적 실현가능성, ②사용판매의 회사 의도, ③사용판매의\n회사 능력, ④미래경제적효익의 창출가능성, ⑤기술적 금전적 자원의 확보 및 ⑥비용의\n신뢰성 있는 측정의 요건을 취득시와 프로젝트별 연구의 진행에 따라 매 회계기간 말에\n계속 충족하는지 검토할 필요가 있음\n감사인은 개발비의 자산성과 손상가능성에 대한 감사절차를 수행할 때 통상 회사가\n제시한 수준의 검토결과를 수용하여 감사의견을 잘못 형성하는 경향이 있으므로 상기의\n설명과 같이 개발비의 연구 및 개발단계별 구분, 개발단계의 비용이 회계기준의 6가지\n요건을 모두 충족하는지에 대한 회사의 검토자료를 징구하여 독립적으로 요건 충족\n여부를 검토할 필요가 있음\n- 21 -",
        "issue_fields": [
          "무형자산 과대계상"
        ],
        "related_standards": [
          "일반기업회계기준 제11장(무형자산)·제20장(자산손상)"
        ],
        "case_type": "회계감리지적사례",
        "source": "KICPA 심사·감리 지적사례"
      },
      "content": {
        "section_1_company_accounting": {
          "section_title": "회사의 회계처리",
          "content": "회사는 연구개발비로 계상한 비용이 개발단계가 아닌 연구단계에 해당하는 비용임에도,\n회계처리기준에 따른 구체적인 검토와 관련 문서와 증빙 등을 확인하지 않고 단순히\n해당 기술이 상용화가 가능하다고 판단하여 개발비로 잘못 계상하였으며, 경영악화\n등으로 해당 프로젝트 관련 사업중단이 예상되어 관련 개발비를 손상인식하여야 함에도\n손상회계처리 하지 아니함"
        },
        "section_2_violation_details": {
          "section_title": "회계기준 위반 지적 내용",
          "content": "회사는 무형자산 인식요건을 충족하지 못하는 개발 비용*1을 무형자산(개발비)으로 잘못\n인식하였으며, 또한 손상요건*2을 만족하는 무형자산(산업재산권 등)을 적절한 시기에 손상\n처리하지 않아 관련 무형자산을 과대계상함\n*1 회사는 회계처리기준에 따른 구체적인 검토와 관련 문서와 증빙 등을 확인하지 않고 단순히 해당\n기술이 상용화가 가능하다고 판단하여 연구단계에서 발생한 비용을 무형자산으로 잘못 인식함\n*2 기술이전계약 체결 후 회사의 자금악화로 기술료 납부를 완료하지 못하였고, 경영악화 등으로 전기차충전\n사업의 중단 등의 결과가 초래되어 기술이전의 효과를 낼 수 없는 상황 발생"
        },
        "section_3_basis_judgment": {
          "section_title": "지적 근거 및 판단 내용",
          "content": "일반기업회계기준 제11장(무형자산) 문단 11.20에 따르면 연구개발비 중 개발단계의\n요건을 만족하는 지출로 기준서의 기술적 실현가능성 등 해당 무형자산 인식요건을\n모두 충족하는 경우에만 연구개발비 등 무형자산으로 인식하여야 하며, 일반기업회계\n기준 제20장(자산손상) 문단 20에 따르면 자산의 진부화 및 시장가치의 급격한 하락\n등으로 인하여 자산의 회수가능액이 장부금액에 중요하게 미달하게 되는 경우에는\n장부금액을 회수가능액으로 조정하고 그 차액을 손상차손으로 처리하도록 규정되어\n있음\n- 20 -"
        },
        "section_4_audit_procedure": {
          "section_title": "감사절차 미흡사항",
          "content": "회계감사기준 200(독립된 감사인의 전반목적 및 감사기준에 따른 감사의 수행), 500\n(감사증거)과 700(재무제표에 대한 의견형성과 보고) 등에 따르면 감사인은 재무제표\n를 중요하게 왜곡표시 시킬 수 있는 상황이 존재할 수 있다는 전문가적인 의구심을\n가지고 감사업무를 계획하고 수행하여야 하며, 감사인은 감사의견 형성의 기초가 될\n합리적인 감사결론을 도출할 수 있도록 충분하고 적합한 감사증거를 확보하여야 하고,\n재무제표가 일반적으로 인정된 회계처리기준에 따라 중요성의 관점에서 적정하게 표시\n되고 있다고 판단했을 경우에만 적정의견을 표명하도록 규정되어 있음에도,\n감사인은 개발비 인식요건의 충족여부, 프로젝트의 개발 진행현황 등의 파악을 통한\n손상인식 가능성에 대한 검토절차를 소홀히 하여 회사의 회계처리 오류를 지적하지\n못함"
        },
        "section_5_implications": {
          "section_title": "시사점",
          "content": "회사는 개발비를 인식함에 있어 단순하게 해당 기술이 상용화가 가능하다고 판단하여\n자산화하는 실무적인 경향이 있는데 회계기준상의 (1) 연구단계와 개발단계로 구분하여\n연구단계에 해당되는 비용은 즉시 당기비용으로 비용처리하고 개발단계에 해당되는\n비용은 (2) 회계기준상의 ①기술적 실현가능성, ②사용판매의 회사 의도, ③사용판매의\n회사 능력, ④미래경제적효익의 창출가능성, ⑤기술적 금전적 자원의 확보 및 ⑥비용의\n신뢰성 있는 측정의 요건을 취득시와 프로젝트별 연구의 진행에 따라 매 회계기간 말에\n계속 충족하는지 검토할 필요가 있음\n감사인은 개발비의 자산성과 손상가능성에 대한 감사절차를 수행할 때 통상 회사가\n제시한 수준의 검토결과를 수용하여 감사의견을 잘못 형성하는 경향이 있으므로 상기의\n설명과 같이 개발비의 연구 및 개발단계별 구분, 개발단계의 비용이 회계기준의 6가지\n요건을 모두 충족하는지에 대한 회사의 검토자료를 징구하여 독립적으로 요건 충족\n여부를 검토할 필요가 있음\n- 21 -"
        }
      },
      "indexed_content": "케이스 ID: KICPA-2020-11\n제목: 무형자산(개발비 등) 과대계상\n결정연도: 2020년\n회계결산일: ’17.1.1.∼’17.12.31.\n1. 회사의 회계처리\n회사는 연구개발비로 계상한 비용이 개발단계가 아닌 연구단계에 해당하는 비용임에도,\n회계처리기준에 따른 구체적인 검토와 관련 문서와 증빙 등을 확인하지 않고 단순히\n해당 기술이 상용화가 가능하다고 판단하여 개발비로 잘못 계상하였으며, 경영악화\n등으로 해당 프로젝트 관련 사업중단이 예상되어 관련 개발비를 손상인식하여야 함에도\n손상회계처리 하지 아니함\n2. 회계기준 위반 지적 내용\n회사는 무형자산 인식요건을 충족하지 못하는 개발 비용*1을 무형자산(개발비)으로 잘못\n인식하였으며, 또한 손상요건*2을 만족하는 무형자산(산업재산권 등)을 적절한 시기에 손상\n처리하지 않아 관련 무형자산을 과대계상함\n*1 회사는 회계처리기준에 따른 구체적인 검토와 관련 문서와 증빙 등을 확인하지 않고 단순히 해당\n기술이 상용화가 가능하다고 판단하여 연구단계에서 발생한 비용을 무형자산으로 잘못 인식함\n*2 기술이전계약 체결 후 회사의 자금악화로 기술료 납부를 완료하지 못하였고, 경영악화 등으로 전기차충전\n사업의 중단 등의 결과가 초래되어 기술이전의 효과를 낼 수 없는 상황 발생\n3. 지적 근거 및 판단 내용\n일반기업회계기준 제11장(무형자산) 문단 11.20에 따르면 연구개발비 중 개발단계의\n요건을 만족하는 지출로 기준서의 기술적 실현가능성 등 해당 무형자산 인식요건을\n모두 충족하는 경우에만 연구개발비 등 무형자산으로 인식하여야 하며, 일반기업회계\n기준 제20장(자산손상) 문단 20에 따르면 자산의 진부화 및 시장가치의 급격한 하락\n등으로 인하여 자산의 회수가능액이 장부금액에 중요하게 미달하게 되는 경우에는\n장부금액을 회수가능액으로 조정하고 그 차액을 손상차손으로 처리하도록 규정되어\n있음\n- 20 -\n4. 감사절차 미흡사항\n회계감사기준 200(독립된 감사인의 전반목적 및 감사기준에 따른 감사의 수행), 500\n(감사증거)과 700(재무제표에 대한 의견형성과 보고) 등에 따르면 감사인은 재무제표\n를 중요하게 왜곡표시 시킬 수 있는 상황이 존재할 수 있다는 전문가적인 의구심을\n가지고 감사업무를 계획하고 수행하여야 하며, 감사인은 감사의견 형성의 기초가 될\n합리적인 감사결론을 도출할 수 있도록 충분하고 적합한 감사증거를 확보하여야 하고,\n재무제표가 일반적으로 인정된 회계처리기준에 따라 중요성의 관점에서 적정하게 표시\n되고 있다고 판단했을 경우에만 적정의견을 표명하도록 규정되어 있음에도,\n감사인은 개발비 인식요건의 충족여부, 프로젝트의 개발 진행현황 등의 파악을 통한\n손상인식 가능성에 대한 검토절차를 소홀히 하여 회사의 회계처리 오류를 지적하지\n못함\n5. 시사점\n회사는 개발비를 인식함에 있어 단순하게 해당 기술이 상용화가 가능하다고 판단하여\n자산화하는 실무적인 경향이 있는데 회계기준상의 (1) 연구단계와 개발단계로 구분하여\n연구단계에 해당되는 비용은 즉시 당기비용으로 비용처리하고 개발단계에 해당되는\n비용은 (2) 회계기준상의 ①기술적 실현가능성, ②사용판매의 회사 의도, ③사용판매의\n회사 능력, ④미래경제적효익의 창출가능성, ⑤기술적 금전적 자원의 확보 및 ⑥비용의\n신뢰성 있는 측정의 요건을 취득시와 프로젝트별 연구의 진행에 따라 매 회계기간 말에\n계속 충족하는지 검토할 필요가 있음\n감사인은 개발비의 자산성과 손상가능성에 대한 감사절차를 수행할 때 통상 회사가\n제시한 수준의 검토결과를 수용하여 감사의견을 잘못 형성하는 경향이 있으므로 상기의\n설명과 같이 개발비의 연구 및 개발단계별 구분, 개발단계의 비용이 회계기준의 6가지\n요건을 모두 충족하는지에 대한 회사의 검토자료를 징구하여 독립적으로 요건 충족\n여부를 검토할 필요가 있음\n- 21 -\n쟁점분야: 무형자산 과대계상\n관련기준: 일반기업회계기준 제11장(무형자산)·제20장(자산손상)\n\n회사의 회계처리:\n회사는 연구개발비로 계상한 비용이 개발단계가 아닌 연구단계에 해당하는 비용임에도,\n회계처리기준에 따른 구체적인 검토와 관련 문서와 증빙 등을 확인하지 않고 단순히\n해당 기술이 상용화가 가능하다고 판단하여 개발비로 잘못 계상하였으며, 경영악화\n등으로 해당 프로젝트 관련 사업중단이 예상되어 관련 개발비를 손상인식하여야 함에도\n손상회계처리 하지 아니함\n\n회계기준 위반 지적 내용:\n회사는 무형자산 인식요건을 충족하지 못하는 개발 비용*1을 무형자산(개발비)으로 잘못\n인식하였으며, 또한 손상요건*2을 만족하는 무형자산(산업재산권 등)을 적절한 시기에 손상\n처리하지 않아 관련 무형자산을 과대계상함\n*1 회사는 회계처리기준에 따른 구체적인 검토와 관련 문서와 증빙 등을 확인하지 않고 단순히 해당\n기술이 상용화가 가능하다고 판단하여 연구단계에서 발생한 비용을 무형자산으로 잘못 인식함\n*2 기술이전계약 체결 후 회사의 자금악화로 기술료 납부를 완료하지 못하였고, 경영악화 등으로 전기차충전\n사업의 중단 등의 결과가 초래되어 기술이전의 효과를 낼 수 없는 상황 발생\n\n지적 근거 및 판단 내용:\n일반기업회계기준 제11장(무형자산) 문단 11.20에 따르면 연구개발비 중 개발단계의\n요건을 만족하는 지출로 기준서의 기술적 실현가능성 등 해당 무형자산 인식요건을\n모두 충족하는 경우에만 연구개발비 등 무형자산으로 인식하여야 하며, 일반기업회계\n기준 제20장(자산손상) 문단 20에 따르면 자산의 진부화 및 시장가치의 급격한 하락\n등으로 인하여 자산의 회수가능액이 장부금액에 중요하게 미달하게 되는 경우에는\n장부금액을 회수가능액으로 조정하고 그 차액을 손상차손으로 처리하도록 규정되어\n있음\n- 20 -\n\n감사절차 미흡사항:\n회계감사기준 200(독립된 감사인의 전반목적 및 감사기준에 따른 감사의 수행), 500\n(감사증거)과 700(재무제표에 대한 의견형성과 보고) 등에 따르면 감사인은 재무제표\n를 중요하게 왜곡표시 시킬 수 있는 상황이 존재할 수 있다는 전문가적인 의구심을\n가지고 감사업무를 계획하고 수행하여야 하며, 감사인은 감사의견 형성의 기초가 될\n합리적인 감사결론을 도출할 수 있도록 충분하고 적합한 감사증거를 확보하여야 하고,\n재무제표가 일반적으로 인정된 회계처리기준에 따라 중요성의 관점에서 적정하게 표시\n되고 있다고 판단했을 경우에만 적정의견을 표명하도록 규정되어 있음에도,\n감사인은 개발비 인식요건의 충족여부, 프로젝트의 개발 진행현황 등의 파악을 통한\n손상인식 가능성에 대한 검토절차를 소홀히 하여 회사의 회계처리 오류를 지적하지\n못함\n\n시사점:\n회사는 개발비를 인식함에 있어 단순하게 해당 기술이 상용화가 가능하다고 판단하여\n자산화하는 실무적인 경향이 있는데 회계기준상의 (1) 연구단계와 개발단계로 구분하여\n연구단계에 해당되는 비용은 즉시 당기비용으로 비용처리하고 개발단계에 해당되는\n비용은 (2) 회계기준상의 ①기술적 실현가능성, ②사용판매의 회사 의도, ③사용판매의\n회사 능력, ④미래경제적효익의 창출가능성, ⑤기술적 금전적 자원의 확보 및 ⑥비용의\n신뢰성 있는 측정의 요건을 취득시와 프로젝트별 연구의 진행에 따라 매 회계기간 말에\n계속 충족하는지 검토할 필요가 있음\n감사인은 개발비의 자산성과 손상가능성에 대한 감사절차를 수행할 때 통상 회사가\n제시한 수준의 검토결과를 수용하여 감사의견을 잘못 형성하는 경향이 있으므로 상기의\n설명과 같이 개발비의 연구 및 개발단계별 구분, 개발단계의 비용이 회계기준의 6가지\n요건을 모두 충족하는지에 대한 회사의 검토자료를 징구하여 독립적으로 요건 충족\n여부를 검토할 필요가 있음\n- 21 -"
    },
    {
      "paragraph_id": "KICPA-2020-12",
      "case_id": "KICPA-2020-12",
      "case_title": "합병 회계처리 오류",
      "metadata": {
        "decision_year": "2020",
        "accounting_period": "’17.1.1.∼’17.12.31.\n1. 회사의 회계처리\n회사는 기중에 A사의 지분(100%)을 취득하고 같은 해에 동 사와 합병함에 있어 합병시\n산출된 투자차액을 사업결합 회계기준에 따라 영업권 등으로 회계처리하고 동 영업권에\n대한 손상금액을 비용으로 인식했어야 하나, 동 투자차액을 동일지배거래 회계기준에\n따라 산출된 차액으로 잘못 판단함에 따라 자본잉여금의 감소로 회계 처리함\n2. 회계기준 위반 지적 내용\n회사의 경우 경제적 실질관점에서 보면 지배력 취득 시 지배·종속관계가 성립되었으나\n지배력 취득시점에서는 투자회사의 지분변동이 유의적이지 않아 투자유가증권으로\n회계처리 한바, 동 합병거래는 일반기업회계기준 ‘동일지배거래’ 규정을 적용하여 회계\n처리 할 수 없음에도 회사는 이를 착오하여 동 규정을 적용하여 회계처리 오류가 발생함\n3. 지적 근거 및 판단 내용\n일반기업회계기준 제12장(사업결합) 문단 12.7, 12.8 및 제20장(자산손상) 문단 20.13과\n20.15에 의하면 사업결합 시 취득법을 적용하며, 결산기에 사업결합 시에 인식한 영업권\n에서 자산손상을 시사하는 징후가 있다면 회수가능액을 평가하여 장부금액에 미달하는\n금액을 손상차손으로 인식하도록 규정되어 있음\n4. 감사절차 미흡사항\n회계감사기준 200(독립된 감사인의 전반목적 및 감사기준에 따른 감사의 수행), 500\n(감사증거)과 700(재무제표에 대한 의견형성과 보고) 등에 따르면 감사인은 재무제표를\n중요하게 왜곡표시 시킬 수 있는 상황이 존재할 수 있다는 전문가적인 의구심을 가지고\n감사업무를 계획하고 수행하여야 하며, 감사인은 감사의견 형성의 기초가 될 합리적인\n감사결론을 도출할 수 있도록 충분하고 적합한 감사증거를 확보하여야 하고, 재무제표가\n일반적으로 인정된 회계처리기준에 따라 중요성의 관점에서 적정하게 표시되고 있다고\n- 22 -\n판단했을 경우에만 적정의견을 표명하도록 규정되어 있음에도,\n감사인은 회사의 종속회사 주식 취득 및 합병거래에 대한 검토 등 통상의 감사절차를\n수행하였지만 ‘사업결합, ‘동일지배거래’ 등 관련 회계처리기준을 숙지하지 못하여\n회사의 회계처리 오류를 발견하지 못함\n5. 시사점\n회사는 연결실체의 지배력 범위에 포함되고 합병이 같은 해에 이루어진 거래가 발생한\n경우 ‘지분법’, ‘사업결합’, ‘동일지배거래’ 등 관련 회계처리 기준에 대해 면밀히 검토를\n하여야 함\n‘동일지배거래’로 회계처리시 ‘동일지배거래’가 아닌 경우에 비해 실무적으로 회계처리\n및 사후 관리가 간편하나, 동일지배거래의 엄격한 요건을 만족하여야 하므로 최초\n사업결합이나 종속회사에 지분투자 등의 거래가 발생했을 때 동일지배거래의 요건에\n대한 엄격한 검토가 필요함\n감사인은 ‘지분법’, ‘사업결합’, ‘동일지배거래’ 등 실무적으로 익숙지 않은 복잡한 거래에\n대해 회사가 충분한 검토 없이 회계처리 하는 경향이 있음을 숙지하고 이러한 비경상\n적인 거래에 대한 검토를 면밀히 수행할 필요가 있음\n상기의 복잡한 거래에 대해서는 회사가 진행한 거래의 진행상황을 상세히 검토하여\n각 단계별 또는 각 절차별로 그 단계 또는 절차가 회계처리를 하여야 할 사건인지를\n검토해야 함. 또한, 각 단계 또는 절차에 대해 적용되는 회계기준의 완전성을 확인하고\n각 회계처리에 사용될 기초 정보(예, 종속회사의 해당시점의 재무제표 등)의 정확성과\n신뢰성에 대한 확인 이후 지분법 조정분개, 연결 조정분개 등의 회계처리에 대해 면밀히\n검토하여야 함\n- 23 -",
        "issue_fields": [
          "합병 회계처리"
        ],
        "related_standards": [
          "일반기업회계기준 제12장(사업결합) · 제20장(자산손상)"
        ],
        "case_type": "회계감리지적사례",
        "source": "KICPA 심사·감리 지적사례"
      },
      "content": {
        "section_1_company_accounting": {
          "section_title": "회사의 회계처리",
          "content": "회사는 기중에 A사의 지분(100%)을 취득하고 같은 해에 동 사와 합병함에 있어 합병시\n산출된 투자차액을 사업결합 회계기준에 따라 영업권 등으로 회계처리하고 동 영업권에\n대한 손상금액을 비용으로 인식했어야 하나, 동 투자차액을 동일지배거래 회계기준에\n따라 산출된 차액으로 잘못 판단함에 따라 자본잉여금의 감소로 회계 처리함"
        },
        "section_2_violation_details": {
          "section_title": "회계기준 위반 지적 내용",
          "content": "회사의 경우 경제적 실질관점에서 보면 지배력 취득 시 지배·종속관계가 성립되었으나\n지배력 취득시점에서는 투자회사의 지분변동이 유의적이지 않아 투자유가증권으로\n회계처리 한바, 동 합병거래는 일반기업회계기준 ‘동일지배거래’ 규정을 적용하여 회계\n처리 할 수 없음에도 회사는 이를 착오하여 동 규정을 적용하여 회계처리 오류가 발생함"
        },
        "section_3_basis_judgment": {
          "section_title": "지적 근거 및 판단 내용",
          "content": "일반기업회계기준 제12장(사업결합) 문단 12.7, 12.8 및 제20장(자산손상) 문단 20.13과\n20.15에 의하면 사업결합 시 취득법을 적용하며, 결산기에 사업결합 시에 인식한 영업권\n에서 자산손상을 시사하는 징후가 있다면 회수가능액을 평가하여 장부금액에 미달하는\n금액을 손상차손으로 인식하도록 규정되어 있음"
        },
        "section_4_audit_procedure": {
          "section_title": "감사절차 미흡사항",
          "content": "회계감사기준 200(독립된 감사인의 전반목적 및 감사기준에 따른 감사의 수행), 500\n(감사증거)과 700(재무제표에 대한 의견형성과 보고) 등에 따르면 감사인은 재무제표를\n중요하게 왜곡표시 시킬 수 있는 상황이 존재할 수 있다는 전문가적인 의구심을 가지고\n감사업무를 계획하고 수행하여야 하며, 감사인은 감사의견 형성의 기초가 될 합리적인\n감사결론을 도출할 수 있도록 충분하고 적합한 감사증거를 확보하여야 하고, 재무제표가\n일반적으로 인정된 회계처리기준에 따라 중요성의 관점에서 적정하게 표시되고 있다고\n- 22 -\n판단했을 경우에만 적정의견을 표명하도록 규정되어 있음에도,\n감사인은 회사의 종속회사 주식 취득 및 합병거래에 대한 검토 등 통상의 감사절차를\n수행하였지만 ‘사업결합, ‘동일지배거래’ 등 관련 회계처리기준을 숙지하지 못하여\n회사의 회계처리 오류를 발견하지 못함"
        },
        "section_5_implications": {
          "section_title": "시사점",
          "content": "회사는 연결실체의 지배력 범위에 포함되고 합병이 같은 해에 이루어진 거래가 발생한\n경우 ‘지분법’, ‘사업결합’, ‘동일지배거래’ 등 관련 회계처리 기준에 대해 면밀히 검토를\n하여야 함\n‘동일지배거래’로 회계처리시 ‘동일지배거래’가 아닌 경우에 비해 실무적으로 회계처리\n및 사후 관리가 간편하나, 동일지배거래의 엄격한 요건을 만족하여야 하므로 최초\n사업결합이나 종속회사에 지분투자 등의 거래가 발생했을 때 동일지배거래의 요건에\n대한 엄격한 검토가 필요함\n감사인은 ‘지분법’, ‘사업결합’, ‘동일지배거래’ 등 실무적으로 익숙지 않은 복잡한 거래에\n대해 회사가 충분한 검토 없이 회계처리 하는 경향이 있음을 숙지하고 이러한 비경상\n적인 거래에 대한 검토를 면밀히 수행할 필요가 있음\n상기의 복잡한 거래에 대해서는 회사가 진행한 거래의 진행상황을 상세히 검토하여\n각 단계별 또는 각 절차별로 그 단계 또는 절차가 회계처리를 하여야 할 사건인지를\n검토해야 함. 또한, 각 단계 또는 절차에 대해 적용되는 회계기준의 완전성을 확인하고\n각 회계처리에 사용될 기초 정보(예, 종속회사의 해당시점의 재무제표 등)의 정확성과\n신뢰성에 대한 확인 이후 지분법 조정분개, 연결 조정분개 등의 회계처리에 대해 면밀히\n검토하여야 함\n- 23 -"
        }
      },
      "indexed_content": "케이스 ID: KICPA-2020-12\n제목: 합병 회계처리 오류\n결정연도: 2020년\n회계결산일: ’17.1.1.∼’17.12.31.\n1. 회사의 회계처리\n회사는 기중에 A사의 지분(100%)을 취득하고 같은 해에 동 사와 합병함에 있어 합병시\n산출된 투자차액을 사업결합 회계기준에 따라 영업권 등으로 회계처리하고 동 영업권에\n대한 손상금액을 비용으로 인식했어야 하나, 동 투자차액을 동일지배거래 회계기준에\n따라 산출된 차액으로 잘못 판단함에 따라 자본잉여금의 감소로 회계 처리함\n2. 회계기준 위반 지적 내용\n회사의 경우 경제적 실질관점에서 보면 지배력 취득 시 지배·종속관계가 성립되었으나\n지배력 취득시점에서는 투자회사의 지분변동이 유의적이지 않아 투자유가증권으로\n회계처리 한바, 동 합병거래는 일반기업회계기준 ‘동일지배거래’ 규정을 적용하여 회계\n처리 할 수 없음에도 회사는 이를 착오하여 동 규정을 적용하여 회계처리 오류가 발생함\n3. 지적 근거 및 판단 내용\n일반기업회계기준 제12장(사업결합) 문단 12.7, 12.8 및 제20장(자산손상) 문단 20.13과\n20.15에 의하면 사업결합 시 취득법을 적용하며, 결산기에 사업결합 시에 인식한 영업권\n에서 자산손상을 시사하는 징후가 있다면 회수가능액을 평가하여 장부금액에 미달하는\n금액을 손상차손으로 인식하도록 규정되어 있음\n4. 감사절차 미흡사항\n회계감사기준 200(독립된 감사인의 전반목적 및 감사기준에 따른 감사의 수행), 500\n(감사증거)과 700(재무제표에 대한 의견형성과 보고) 등에 따르면 감사인은 재무제표를\n중요하게 왜곡표시 시킬 수 있는 상황이 존재할 수 있다는 전문가적인 의구심을 가지고\n감사업무를 계획하고 수행하여야 하며, 감사인은 감사의견 형성의 기초가 될 합리적인\n감사결론을 도출할 수 있도록 충분하고 적합한 감사증거를 확보하여야 하고, 재무제표가\n일반적으로 인정된 회계처리기준에 따라 중요성의 관점에서 적정하게 표시되고 있다고\n- 22 -\n판단했을 경우에만 적정의견을 표명하도록 규정되어 있음에도,\n감사인은 회사의 종속회사 주식 취득 및 합병거래에 대한 검토 등 통상의 감사절차를\n수행하였지만 ‘사업결합, ‘동일지배거래’ 등 관련 회계처리기준을 숙지하지 못하여\n회사의 회계처리 오류를 발견하지 못함\n5. 시사점\n회사는 연결실체의 지배력 범위에 포함되고 합병이 같은 해에 이루어진 거래가 발생한\n경우 ‘지분법’, ‘사업결합’, ‘동일지배거래’ 등 관련 회계처리 기준에 대해 면밀히 검토를\n하여야 함\n‘동일지배거래’로 회계처리시 ‘동일지배거래’가 아닌 경우에 비해 실무적으로 회계처리\n및 사후 관리가 간편하나, 동일지배거래의 엄격한 요건을 만족하여야 하므로 최초\n사업결합이나 종속회사에 지분투자 등의 거래가 발생했을 때 동일지배거래의 요건에\n대한 엄격한 검토가 필요함\n감사인은 ‘지분법’, ‘사업결합’, ‘동일지배거래’ 등 실무적으로 익숙지 않은 복잡한 거래에\n대해 회사가 충분한 검토 없이 회계처리 하는 경향이 있음을 숙지하고 이러한 비경상\n적인 거래에 대한 검토를 면밀히 수행할 필요가 있음\n상기의 복잡한 거래에 대해서는 회사가 진행한 거래의 진행상황을 상세히 검토하여\n각 단계별 또는 각 절차별로 그 단계 또는 절차가 회계처리를 하여야 할 사건인지를\n검토해야 함. 또한, 각 단계 또는 절차에 대해 적용되는 회계기준의 완전성을 확인하고\n각 회계처리에 사용될 기초 정보(예, 종속회사의 해당시점의 재무제표 등)의 정확성과\n신뢰성에 대한 확인 이후 지분법 조정분개, 연결 조정분개 등의 회계처리에 대해 면밀히\n검토하여야 함\n- 23 -\n쟁점분야: 합병 회계처리\n관련기준: 일반기업회계기준 제12장(사업결합) · 제20장(자산손상)\n\n회사의 회계처리:\n회사는 기중에 A사의 지분(100%)을 취득하고 같은 해에 동 사와 합병함에 있어 합병시\n산출된 투자차액을 사업결합 회계기준에 따라 영업권 등으로 회계처리하고 동 영업권에\n대한 손상금액을 비용으로 인식했어야 하나, 동 투자차액을 동일지배거래 회계기준에\n따라 산출된 차액으로 잘못 판단함에 따라 자본잉여금의 감소로 회계 처리함\n\n회계기준 위반 지적 내용:\n회사의 경우 경제적 실질관점에서 보면 지배력 취득 시 지배·종속관계가 성립되었으나\n지배력 취득시점에서는 투자회사의 지분변동이 유의적이지 않아 투자유가증권으로\n회계처리 한바, 동 합병거래는 일반기업회계기준 ‘동일지배거래’ 규정을 적용하여 회계\n처리 할 수 없음에도 회사는 이를 착오하여 동 규정을 적용하여 회계처리 오류가 발생함\n\n지적 근거 및 판단 내용:\n일반기업회계기준 제12장(사업결합) 문단 12.7, 12.8 및 제20장(자산손상) 문단 20.13과\n20.15에 의하면 사업결합 시 취득법을 적용하며, 결산기에 사업결합 시에 인식한 영업권\n에서 자산손상을 시사하는 징후가 있다면 회수가능액을 평가하여 장부금액에 미달하는\n금액을 손상차손으로 인식하도록 규정되어 있음\n\n감사절차 미흡사항:\n회계감사기준 200(독립된 감사인의 전반목적 및 감사기준에 따른 감사의 수행), 500\n(감사증거)과 700(재무제표에 대한 의견형성과 보고) 등에 따르면 감사인은 재무제표를\n중요하게 왜곡표시 시킬 수 있는 상황이 존재할 수 있다는 전문가적인 의구심을 가지고\n감사업무를 계획하고 수행하여야 하며, 감사인은 감사의견 형성의 기초가 될 합리적인\n감사결론을 도출할 수 있도록 충분하고 적합한 감사증거를 확보하여야 하고, 재무제표가\n일반적으로 인정된 회계처리기준에 따라 중요성의 관점에서 적정하게 표시되고 있다고\n- 22 -\n판단했을 경우에만 적정의견을 표명하도록 규정되어 있음에도,\n감사인은 회사의 종속회사 주식 취득 및 합병거래에 대한 검토 등 통상의 감사절차를\n수행하였지만 ‘사업결합, ‘동일지배거래’ 등 관련 회계처리기준을 숙지하지 못하여\n회사의 회계처리 오류를 발견하지 못함\n\n시사점:\n회사는 연결실체의 지배력 범위에 포함되고 합병이 같은 해에 이루어진 거래가 발생한\n경우 ‘지분법’, ‘사업결합’, ‘동일지배거래’ 등 관련 회계처리 기준에 대해 면밀히 검토를\n하여야 함\n‘동일지배거래’로 회계처리시 ‘동일지배거래’가 아닌 경우에 비해 실무적으로 회계처리\n및 사후 관리가 간편하나, 동일지배거래의 엄격한 요건을 만족하여야 하므로 최초\n사업결합이나 종속회사에 지분투자 등의 거래가 발생했을 때 동일지배거래의 요건에\n대한 엄격한 검토가 필요함\n감사인은 ‘지분법’, ‘사업결합’, ‘동일지배거래’ 등 실무적으로 익숙지 않은 복잡한 거래에\n대해 회사가 충분한 검토 없이 회계처리 하는 경향이 있음을 숙지하고 이러한 비경상\n적인 거래에 대한 검토를 면밀히 수행할 필요가 있음\n상기의 복잡한 거래에 대해서는 회사가 진행한 거래의 진행상황을 상세히 검토하여\n각 단계별 또는 각 절차별로 그 단계 또는 절차가 회계처리를 하여야 할 사건인지를\n검토해야 함. 또한, 각 단계 또는 절차에 대해 적용되는 회계기준의 완전성을 확인하고\n각 회계처리에 사용될 기초 정보(예, 종속회사의 해당시점의 재무제표 등)의 정확성과\n신뢰성에 대한 확인 이후 지분법 조정분개, 연결 조정분개 등의 회계처리에 대해 면밀히\n검토하여야 함\n- 23 -"
    },
    {
      "paragraph_id": "KICPA-2020-13",
      "case_id": "KICPA-2020-13",
      "case_title": "지분법적용투자주식 계상오류",
      "metadata": {
        "decision_year": "2020",
        "accounting_period": "‘11.1.1.~’17.12.31.\n1. 회사의 회계처리\n회사는 2008년부터 지분법을 적용하여 평가해오던 투자주식(100%)과 관련하여 2011년\n일반기업회계기준 도입 시 ‘중소기업 회계처리 특례’ 적용여부에 대한 판단을 착오하여\n지분법 적용을 중단함으로써 자기자본 등을 과대(과소)계상함\n2. 회계기준 위반 지적 내용\n회사는 중소기업기본법에 의한 중소기업으로 중국 주요거래처에 자재를 생산·납품할\n목적으로 중국소재 종속회사 A사(100%)를 설립하고, A사 투자주식은 종전의 기업회계\n기준서 제14호 ‘중소기업 회계처리 특례’의 적용대상임에도 불구하고 동 특례사항을\n선택하지 아니하고 2008년부터 지분법을 적용하여 평가해 옴\n한편, 회사는 2011년 제정·도입된 일반기업회계기준을 적용하면서 A사 투자주식 평가와\n관련하여 일반기업회계기준 제31장 ‘중소기업 회계처리 특례’가 새로이 적용 가능하다고\n판단하여 지분법 적용을 중단함\n3. 지적 근거 및 판단 내용\n일반기업회계기준 시행일 및 경과규정 문단 10에 따르면, 일반기업회계기준 시행일\n이후 최초로 개시하는 회계연도 전에 종전의 기업회계기준서 제14호 ‘중소기업 회계\n처리 특례’에 따라 적용한 특례사항은 계속 적용하고, 적용하지 아니한 특례사항은\n새로이 적용할 수 없으며, 다만 과거에 발생한 경우가 없는 새로운 사건이나 거래가\n발생한 경우에는 일반기업회계기준 제31장 ‘중소기업 회계처리 특례’를 적용할 수 있다고\n규정하고 있음\n- 24 -\n4. 감사절차 미흡사항\n감사인은 관련 회계기준(회계정책, 회계추정의 변경 및 오류, 중소기업 회계처리 특례)을\n검토하는 등 일반적인 감사절차를 수행하고, 회사가 설립 이래 지속적으로 중소기업\n특례 적용범위에 해당하는 소규모 중소기업으로서 회사의 회계처리능력과 특례규정의\n취지(중소기업 회계처리부담 완화)를 고려하여 회사의 회계처리를 수용하였으나,\n과거에 발생한 경우가 없는 새로운 사건이나 거래가 발생한 경우가 아니면 종전의\n기업회계기준서에 따라 선택한 ‘중소기업 회계처리 특례’사항을 계속 적용하도록 규정한\n‘시행일 및 경과규정’ 기준서를 간과하여 회사의 회계처리 오류를 발견하지 못함\n5. 시사점\n일반기업회계기준 개정시 ‘시행일 및 경과규정’이라는 별도의 장에서 개별 기준의 시행과\n적용에 대한 내용을 명확히 규정하고 있으므로 개정된 회계기준 적용시에는 ‘시행일\n및 경과규정’을 반드시 검토할 필요가 있음",
        "issue_fields": [
          "지분법 회계처리와 중소기업특례 적용"
        ],
        "related_standards": [
          "일반기업회계기준 제31장(중소기업 회계처리 특례)과 시행일 및 경과규정"
        ],
        "case_type": "회계감리지적사례",
        "source": "KICPA 심사·감리 지적사례"
      },
      "content": {
        "section_1_company_accounting": {
          "section_title": "회사의 회계처리",
          "content": "회사는 2008년부터 지분법을 적용하여 평가해오던 투자주식(100%)과 관련하여 2011년\n일반기업회계기준 도입 시 ‘중소기업 회계처리 특례’ 적용여부에 대한 판단을 착오하여\n지분법 적용을 중단함으로써 자기자본 등을 과대(과소)계상함"
        },
        "section_2_violation_details": {
          "section_title": "회계기준 위반 지적 내용",
          "content": "회사는 중소기업기본법에 의한 중소기업으로 중국 주요거래처에 자재를 생산·납품할\n목적으로 중국소재 종속회사 A사(100%)를 설립하고, A사 투자주식은 종전의 기업회계\n기준서 제14호 ‘중소기업 회계처리 특례’의 적용대상임에도 불구하고 동 특례사항을\n선택하지 아니하고 2008년부터 지분법을 적용하여 평가해 옴\n한편, 회사는 2011년 제정·도입된 일반기업회계기준을 적용하면서 A사 투자주식 평가와\n관련하여 일반기업회계기준 제31장 ‘중소기업 회계처리 특례’가 새로이 적용 가능하다고\n판단하여 지분법 적용을 중단함"
        },
        "section_3_basis_judgment": {
          "section_title": "지적 근거 및 판단 내용",
          "content": "일반기업회계기준 시행일 및 경과규정 문단 10에 따르면, 일반기업회계기준 시행일\n이후 최초로 개시하는 회계연도 전에 종전의 기업회계기준서 제14호 ‘중소기업 회계\n처리 특례’에 따라 적용한 특례사항은 계속 적용하고, 적용하지 아니한 특례사항은\n새로이 적용할 수 없으며, 다만 과거에 발생한 경우가 없는 새로운 사건이나 거래가\n발생한 경우에는 일반기업회계기준 제31장 ‘중소기업 회계처리 특례’를 적용할 수 있다고\n규정하고 있음\n- 24 -"
        },
        "section_4_audit_procedure": {
          "section_title": "감사절차 미흡사항",
          "content": "감사인은 관련 회계기준(회계정책, 회계추정의 변경 및 오류, 중소기업 회계처리 특례)을\n검토하는 등 일반적인 감사절차를 수행하고, 회사가 설립 이래 지속적으로 중소기업\n특례 적용범위에 해당하는 소규모 중소기업으로서 회사의 회계처리능력과 특례규정의\n취지(중소기업 회계처리부담 완화)를 고려하여 회사의 회계처리를 수용하였으나,\n과거에 발생한 경우가 없는 새로운 사건이나 거래가 발생한 경우가 아니면 종전의\n기업회계기준서에 따라 선택한 ‘중소기업 회계처리 특례’사항을 계속 적용하도록 규정한\n‘시행일 및 경과규정’ 기준서를 간과하여 회사의 회계처리 오류를 발견하지 못함"
        },
        "section_5_implications": {
          "section_title": "시사점",
          "content": "일반기업회계기준 개정시 ‘시행일 및 경과규정’이라는 별도의 장에서 개별 기준의 시행과\n적용에 대한 내용을 명확히 규정하고 있으므로 개정된 회계기준 적용시에는 ‘시행일\n및 경과규정’을 반드시 검토할 필요가 있음"
        }
      },
      "indexed_content": "케이스 ID: KICPA-2020-13\n제목: 지분법적용투자주식 계상오류\n결정연도: 2020년\n회계결산일: ‘11.1.1.~’17.12.31.\n1. 회사의 회계처리\n회사는 2008년부터 지분법을 적용하여 평가해오던 투자주식(100%)과 관련하여 2011년\n일반기업회계기준 도입 시 ‘중소기업 회계처리 특례’ 적용여부에 대한 판단을 착오하여\n지분법 적용을 중단함으로써 자기자본 등을 과대(과소)계상함\n2. 회계기준 위반 지적 내용\n회사는 중소기업기본법에 의한 중소기업으로 중국 주요거래처에 자재를 생산·납품할\n목적으로 중국소재 종속회사 A사(100%)를 설립하고, A사 투자주식은 종전의 기업회계\n기준서 제14호 ‘중소기업 회계처리 특례’의 적용대상임에도 불구하고 동 특례사항을\n선택하지 아니하고 2008년부터 지분법을 적용하여 평가해 옴\n한편, 회사는 2011년 제정·도입된 일반기업회계기준을 적용하면서 A사 투자주식 평가와\n관련하여 일반기업회계기준 제31장 ‘중소기업 회계처리 특례’가 새로이 적용 가능하다고\n판단하여 지분법 적용을 중단함\n3. 지적 근거 및 판단 내용\n일반기업회계기준 시행일 및 경과규정 문단 10에 따르면, 일반기업회계기준 시행일\n이후 최초로 개시하는 회계연도 전에 종전의 기업회계기준서 제14호 ‘중소기업 회계\n처리 특례’에 따라 적용한 특례사항은 계속 적용하고, 적용하지 아니한 특례사항은\n새로이 적용할 수 없으며, 다만 과거에 발생한 경우가 없는 새로운 사건이나 거래가\n발생한 경우에는 일반기업회계기준 제31장 ‘중소기업 회계처리 특례’를 적용할 수 있다고\n규정하고 있음\n- 24 -\n4. 감사절차 미흡사항\n감사인은 관련 회계기준(회계정책, 회계추정의 변경 및 오류, 중소기업 회계처리 특례)을\n검토하는 등 일반적인 감사절차를 수행하고, 회사가 설립 이래 지속적으로 중소기업\n특례 적용범위에 해당하는 소규모 중소기업으로서 회사의 회계처리능력과 특례규정의\n취지(중소기업 회계처리부담 완화)를 고려하여 회사의 회계처리를 수용하였으나,\n과거에 발생한 경우가 없는 새로운 사건이나 거래가 발생한 경우가 아니면 종전의\n기업회계기준서에 따라 선택한 ‘중소기업 회계처리 특례’사항을 계속 적용하도록 규정한\n‘시행일 및 경과규정’ 기준서를 간과하여 회사의 회계처리 오류를 발견하지 못함\n5. 시사점\n일반기업회계기준 개정시 ‘시행일 및 경과규정’이라는 별도의 장에서 개별 기준의 시행과\n적용에 대한 내용을 명확히 규정하고 있으므로 개정된 회계기준 적용시에는 ‘시행일\n및 경과규정’을 반드시 검토할 필요가 있음\n쟁점분야: 지분법 회계처리와 중소기업특례 적용\n관련기준: 일반기업회계기준 제31장(중소기업 회계처리 특례)과 시행일 및 경과규정\n\n회사의 회계처리:\n회사는 2008년부터 지분법을 적용하여 평가해오던 투자주식(100%)과 관련하여 2011년\n일반기업회계기준 도입 시 ‘중소기업 회계처리 특례’ 적용여부에 대한 판단을 착오하여\n지분법 적용을 중단함으로써 자기자본 등을 과대(과소)계상함\n\n회계기준 위반 지적 내용:\n회사는 중소기업기본법에 의한 중소기업으로 중국 주요거래처에 자재를 생산·납품할\n목적으로 중국소재 종속회사 A사(100%)를 설립하고, A사 투자주식은 종전의 기업회계\n기준서 제14호 ‘중소기업 회계처리 특례’의 적용대상임에도 불구하고 동 특례사항을\n선택하지 아니하고 2008년부터 지분법을 적용하여 평가해 옴\n한편, 회사는 2011년 제정·도입된 일반기업회계기준을 적용하면서 A사 투자주식 평가와\n관련하여 일반기업회계기준 제31장 ‘중소기업 회계처리 특례’가 새로이 적용 가능하다고\n판단하여 지분법 적용을 중단함\n\n지적 근거 및 판단 내용:\n일반기업회계기준 시행일 및 경과규정 문단 10에 따르면, 일반기업회계기준 시행일\n이후 최초로 개시하는 회계연도 전에 종전의 기업회계기준서 제14호 ‘중소기업 회계\n처리 특례’에 따라 적용한 특례사항은 계속 적용하고, 적용하지 아니한 특례사항은\n새로이 적용할 수 없으며, 다만 과거에 발생한 경우가 없는 새로운 사건이나 거래가\n발생한 경우에는 일반기업회계기준 제31장 ‘중소기업 회계처리 특례’를 적용할 수 있다고\n규정하고 있음\n- 24 -\n\n감사절차 미흡사항:\n감사인은 관련 회계기준(회계정책, 회계추정의 변경 및 오류, 중소기업 회계처리 특례)을\n검토하는 등 일반적인 감사절차를 수행하고, 회사가 설립 이래 지속적으로 중소기업\n특례 적용범위에 해당하는 소규모 중소기업으로서 회사의 회계처리능력과 특례규정의\n취지(중소기업 회계처리부담 완화)를 고려하여 회사의 회계처리를 수용하였으나,\n과거에 발생한 경우가 없는 새로운 사건이나 거래가 발생한 경우가 아니면 종전의\n기업회계기준서에 따라 선택한 ‘중소기업 회계처리 특례’사항을 계속 적용하도록 규정한\n‘시행일 및 경과규정’ 기준서를 간과하여 회사의 회계처리 오류를 발견하지 못함\n\n시사점:\n일반기업회계기준 개정시 ‘시행일 및 경과규정’이라는 별도의 장에서 개별 기준의 시행과\n적용에 대한 내용을 명확히 규정하고 있으므로 개정된 회계기준 적용시에는 ‘시행일\n및 경과규정’을 반드시 검토할 필요가 있음"
    },
    {
      "paragraph_id": "KICPA-2020-14",
      "case_id": "KICPA-2020-14",
      "case_title": "종속기업 투자주식에 대한 지분법 미적용 및 연결재무제표 미작성",
      "metadata": {
        "decision_year": "2020",
        "accounting_period": "’17.1.1.∼’17.12.31.\n1. 회사의 회계처리\n회사는 연결재무제표 작성대상의 범위에 해당하는 종속기업 투자주식의 경우 개별재무\n제표 작성 시 지분법적용투자주식으로 분류하여 지분법을 적용하여야 하고 연결재무\n제표도 작성하여야 함에도, 회사는 매도가능증권으로 잘못 분류하고 연결재무제표도\n작성하지 아니함\n2. 회계기준 위반 지적 내용\n회사는 섬유제조업체로서 해외진출 목적으로 ‘11년 인도네시아에 현지법인을 설립\n- 25 -\n하였으며, 취득시점부터 ‘중소기업 회계처리 특례’에 따라 투자지분을 매도가능증권\n으로 분류하고 지분법을 적용하지 아니함\n한편 ‘14년말 종속기업의 자산·부채 규모가 외부감사법 적용대상 기준금액 이상이 되어\n’15년부터 투자지분에 대하여 지분법 평가를 실시하고, 연결재무제표를 작성하여야\n함에도, ‘15년 결산시 이를 간과하여 매도가능증권으로 계속 분류하고 취득원가로 평가\n하였으며, 연결재무제표도 작성하지 아니함\n3. 지적 근거 및 판단 내용\n일반기업회계기준 제8장(지분법) 문단 8.3과 8.4에 따르면 ‘지분법피투자기업’은\n투자기업이 유의적인 영향력을 갖는 지분법적용대상 피투자기업이고, ‘유의적인 영향력’은\n투자기업이 피투자기업의 재무정책과 영업정책에 관한 의사결정에 참여할 수 있는 능력임\n일반기업회계기준 제31장(중소기업 회계처리 특례) 문단 31.6에 따르면 유의적인 영향력을\n행사할 수 있는 지분증권에 대하여는 지분법을 적용하지 아니할 수 있으나, 연결재무\n제표 작성대상의 범위에 해당하는 종속기업에 대하여는 지분법을 적용하도록 규정하고\n있음\n4. 감사절차 미흡사항\n회계감사기준 200(독립된 감사인의 전반목적 및 감사기준에 따른 감사의 수행), 500\n(감사증거)과 700(재무제표에 대한 의견형성과 보고) 등에 따르면 감사인은 재무제표를\n중요하게 왜곡표시 시킬 수 있는 상황이 존재할 수 있다는 전문가적인 의구심을 가지고\n감사업무를 계획하고 수행하여야 하며, 감사인은 감사의견 형성의 기초가 될 합리적인\n감사결론을 도출할 수 있도록 충분하고 적합한 감사증거를 확보하여야 하고, 재무제표가\n일반적으로 인정된 회계처리기준에 따라 중요성의 관점에서 적정하게 표시되고 있다고\n판단했을 경우에만 적정의견을 표명하도록 규정되어 있는바,\n감사인은 중소기업회계처리 특례를 적용하여 매도가능증권으로 분류한 피투자회사가\n종속회사인 경우 매년 연결재무제표 작성대상에 해당하는지 여부와 중소기업 회계처리\n특례 관련 규정을 면밀히 검토하였어야 함에도, 이를 간과하여 회사의 회계처리 오류를\n발견하지 못함\n5. 시사점\n회사는 매년 피투자회사의 지분율 및 자산·부채 규모를 파악하고 지분법 및 연결재무\n- 26 -\n제표 작성 대상인지 여부를 면밀히 검토할 필요가 있으며, 지분법 및 연결재무제표\n관련 기준서를 숙지하여야 함\n감사인은 매년 피투자회사의 지분율 및 자산·부채 규모를 파악하고 지분법 및 연결\n재무제표 작성 대상인지 여부에 대해 회사가 판단한 근거와 관련 자료를 면밀히 검토\n할 필요가 있으며, 연결감사계약을 별도로 체결하지 않았다 하더라도, 연결재무제표를\n작성할 의무가 있다고 판단되면 연결감사보고서를 발행해야 함",
        "issue_fields": [
          "지분법 회계처리와 연결재무제표 작성"
        ],
        "related_standards": [
          "일반기업회계기준 제8장(지분법)",
          "제31장(중소기업 회계처리 특례)"
        ],
        "case_type": "회계감리지적사례",
        "source": "KICPA 심사·감리 지적사례"
      },
      "content": {
        "section_1_company_accounting": {
          "section_title": "회사의 회계처리",
          "content": "회사는 연결재무제표 작성대상의 범위에 해당하는 종속기업 투자주식의 경우 개별재무\n제표 작성 시 지분법적용투자주식으로 분류하여 지분법을 적용하여야 하고 연결재무\n제표도 작성하여야 함에도, 회사는 매도가능증권으로 잘못 분류하고 연결재무제표도\n작성하지 아니함"
        },
        "section_2_violation_details": {
          "section_title": "회계기준 위반 지적 내용",
          "content": "회사는 섬유제조업체로서 해외진출 목적으로 ‘11년 인도네시아에 현지법인을 설립\n- 25 -\n하였으며, 취득시점부터 ‘중소기업 회계처리 특례’에 따라 투자지분을 매도가능증권\n으로 분류하고 지분법을 적용하지 아니함\n한편 ‘14년말 종속기업의 자산·부채 규모가 외부감사법 적용대상 기준금액 이상이 되어\n’15년부터 투자지분에 대하여 지분법 평가를 실시하고, 연결재무제표를 작성하여야\n함에도, ‘15년 결산시 이를 간과하여 매도가능증권으로 계속 분류하고 취득원가로 평가\n하였으며, 연결재무제표도 작성하지 아니함"
        },
        "section_3_basis_judgment": {
          "section_title": "지적 근거 및 판단 내용",
          "content": "일반기업회계기준 제8장(지분법) 문단 8.3과 8.4에 따르면 ‘지분법피투자기업’은\n투자기업이 유의적인 영향력을 갖는 지분법적용대상 피투자기업이고, ‘유의적인 영향력’은\n투자기업이 피투자기업의 재무정책과 영업정책에 관한 의사결정에 참여할 수 있는 능력임\n일반기업회계기준 제31장(중소기업 회계처리 특례) 문단 31.6에 따르면 유의적인 영향력을\n행사할 수 있는 지분증권에 대하여는 지분법을 적용하지 아니할 수 있으나, 연결재무\n제표 작성대상의 범위에 해당하는 종속기업에 대하여는 지분법을 적용하도록 규정하고\n있음"
        },
        "section_4_audit_procedure": {
          "section_title": "감사절차 미흡사항",
          "content": "회계감사기준 200(독립된 감사인의 전반목적 및 감사기준에 따른 감사의 수행), 500\n(감사증거)과 700(재무제표에 대한 의견형성과 보고) 등에 따르면 감사인은 재무제표를\n중요하게 왜곡표시 시킬 수 있는 상황이 존재할 수 있다는 전문가적인 의구심을 가지고\n감사업무를 계획하고 수행하여야 하며, 감사인은 감사의견 형성의 기초가 될 합리적인\n감사결론을 도출할 수 있도록 충분하고 적합한 감사증거를 확보하여야 하고, 재무제표가\n일반적으로 인정된 회계처리기준에 따라 중요성의 관점에서 적정하게 표시되고 있다고\n판단했을 경우에만 적정의견을 표명하도록 규정되어 있는바,\n감사인은 중소기업회계처리 특례를 적용하여 매도가능증권으로 분류한 피투자회사가\n종속회사인 경우 매년 연결재무제표 작성대상에 해당하는지 여부와 중소기업 회계처리\n특례 관련 규정을 면밀히 검토하였어야 함에도, 이를 간과하여 회사의 회계처리 오류를\n발견하지 못함"
        },
        "section_5_implications": {
          "section_title": "시사점",
          "content": "회사는 매년 피투자회사의 지분율 및 자산·부채 규모를 파악하고 지분법 및 연결재무\n- 26 -\n제표 작성 대상인지 여부를 면밀히 검토할 필요가 있으며, 지분법 및 연결재무제표\n관련 기준서를 숙지하여야 함\n감사인은 매년 피투자회사의 지분율 및 자산·부채 규모를 파악하고 지분법 및 연결\n재무제표 작성 대상인지 여부에 대해 회사가 판단한 근거와 관련 자료를 면밀히 검토\n할 필요가 있으며, 연결감사계약을 별도로 체결하지 않았다 하더라도, 연결재무제표를\n작성할 의무가 있다고 판단되면 연결감사보고서를 발행해야 함"
        }
      },
      "indexed_content": "케이스 ID: KICPA-2020-14\n제목: 종속기업 투자주식에 대한 지분법 미적용 및 연결재무제표 미작성\n결정연도: 2020년\n회계결산일: ’17.1.1.∼’17.12.31.\n1. 회사의 회계처리\n회사는 연결재무제표 작성대상의 범위에 해당하는 종속기업 투자주식의 경우 개별재무\n제표 작성 시 지분법적용투자주식으로 분류하여 지분법을 적용하여야 하고 연결재무\n제표도 작성하여야 함에도, 회사는 매도가능증권으로 잘못 분류하고 연결재무제표도\n작성하지 아니함\n2. 회계기준 위반 지적 내용\n회사는 섬유제조업체로서 해외진출 목적으로 ‘11년 인도네시아에 현지법인을 설립\n- 25 -\n하였으며, 취득시점부터 ‘중소기업 회계처리 특례’에 따라 투자지분을 매도가능증권\n으로 분류하고 지분법을 적용하지 아니함\n한편 ‘14년말 종속기업의 자산·부채 규모가 외부감사법 적용대상 기준금액 이상이 되어\n’15년부터 투자지분에 대하여 지분법 평가를 실시하고, 연결재무제표를 작성하여야\n함에도, ‘15년 결산시 이를 간과하여 매도가능증권으로 계속 분류하고 취득원가로 평가\n하였으며, 연결재무제표도 작성하지 아니함\n3. 지적 근거 및 판단 내용\n일반기업회계기준 제8장(지분법) 문단 8.3과 8.4에 따르면 ‘지분법피투자기업’은\n투자기업이 유의적인 영향력을 갖는 지분법적용대상 피투자기업이고, ‘유의적인 영향력’은\n투자기업이 피투자기업의 재무정책과 영업정책에 관한 의사결정에 참여할 수 있는 능력임\n일반기업회계기준 제31장(중소기업 회계처리 특례) 문단 31.6에 따르면 유의적인 영향력을\n행사할 수 있는 지분증권에 대하여는 지분법을 적용하지 아니할 수 있으나, 연결재무\n제표 작성대상의 범위에 해당하는 종속기업에 대하여는 지분법을 적용하도록 규정하고\n있음\n4. 감사절차 미흡사항\n회계감사기준 200(독립된 감사인의 전반목적 및 감사기준에 따른 감사의 수행), 500\n(감사증거)과 700(재무제표에 대한 의견형성과 보고) 등에 따르면 감사인은 재무제표를\n중요하게 왜곡표시 시킬 수 있는 상황이 존재할 수 있다는 전문가적인 의구심을 가지고\n감사업무를 계획하고 수행하여야 하며, 감사인은 감사의견 형성의 기초가 될 합리적인\n감사결론을 도출할 수 있도록 충분하고 적합한 감사증거를 확보하여야 하고, 재무제표가\n일반적으로 인정된 회계처리기준에 따라 중요성의 관점에서 적정하게 표시되고 있다고\n판단했을 경우에만 적정의견을 표명하도록 규정되어 있는바,\n감사인은 중소기업회계처리 특례를 적용하여 매도가능증권으로 분류한 피투자회사가\n종속회사인 경우 매년 연결재무제표 작성대상에 해당하는지 여부와 중소기업 회계처리\n특례 관련 규정을 면밀히 검토하였어야 함에도, 이를 간과하여 회사의 회계처리 오류를\n발견하지 못함\n5. 시사점\n회사는 매년 피투자회사의 지분율 및 자산·부채 규모를 파악하고 지분법 및 연결재무\n- 26 -\n제표 작성 대상인지 여부를 면밀히 검토할 필요가 있으며, 지분법 및 연결재무제표\n관련 기준서를 숙지하여야 함\n감사인은 매년 피투자회사의 지분율 및 자산·부채 규모를 파악하고 지분법 및 연결\n재무제표 작성 대상인지 여부에 대해 회사가 판단한 근거와 관련 자료를 면밀히 검토\n할 필요가 있으며, 연결감사계약을 별도로 체결하지 않았다 하더라도, 연결재무제표를\n작성할 의무가 있다고 판단되면 연결감사보고서를 발행해야 함\n쟁점분야: 지분법 회계처리와 연결재무제표 작성\n관련기준: 일반기업회계기준 제8장(지분법), 제31장(중소기업 회계처리 특례)\n\n회사의 회계처리:\n회사는 연결재무제표 작성대상의 범위에 해당하는 종속기업 투자주식의 경우 개별재무\n제표 작성 시 지분법적용투자주식으로 분류하여 지분법을 적용하여야 하고 연결재무\n제표도 작성하여야 함에도, 회사는 매도가능증권으로 잘못 분류하고 연결재무제표도\n작성하지 아니함\n\n회계기준 위반 지적 내용:\n회사는 섬유제조업체로서 해외진출 목적으로 ‘11년 인도네시아에 현지법인을 설립\n- 25 -\n하였으며, 취득시점부터 ‘중소기업 회계처리 특례’에 따라 투자지분을 매도가능증권\n으로 분류하고 지분법을 적용하지 아니함\n한편 ‘14년말 종속기업의 자산·부채 규모가 외부감사법 적용대상 기준금액 이상이 되어\n’15년부터 투자지분에 대하여 지분법 평가를 실시하고, 연결재무제표를 작성하여야\n함에도, ‘15년 결산시 이를 간과하여 매도가능증권으로 계속 분류하고 취득원가로 평가\n하였으며, 연결재무제표도 작성하지 아니함\n\n지적 근거 및 판단 내용:\n일반기업회계기준 제8장(지분법) 문단 8.3과 8.4에 따르면 ‘지분법피투자기업’은\n투자기업이 유의적인 영향력을 갖는 지분법적용대상 피투자기업이고, ‘유의적인 영향력’은\n투자기업이 피투자기업의 재무정책과 영업정책에 관한 의사결정에 참여할 수 있는 능력임\n일반기업회계기준 제31장(중소기업 회계처리 특례) 문단 31.6에 따르면 유의적인 영향력을\n행사할 수 있는 지분증권에 대하여는 지분법을 적용하지 아니할 수 있으나, 연결재무\n제표 작성대상의 범위에 해당하는 종속기업에 대하여는 지분법을 적용하도록 규정하고\n있음\n\n감사절차 미흡사항:\n회계감사기준 200(독립된 감사인의 전반목적 및 감사기준에 따른 감사의 수행), 500\n(감사증거)과 700(재무제표에 대한 의견형성과 보고) 등에 따르면 감사인은 재무제표를\n중요하게 왜곡표시 시킬 수 있는 상황이 존재할 수 있다는 전문가적인 의구심을 가지고\n감사업무를 계획하고 수행하여야 하며, 감사인은 감사의견 형성의 기초가 될 합리적인\n감사결론을 도출할 수 있도록 충분하고 적합한 감사증거를 확보하여야 하고, 재무제표가\n일반적으로 인정된 회계처리기준에 따라 중요성의 관점에서 적정하게 표시되고 있다고\n판단했을 경우에만 적정의견을 표명하도록 규정되어 있는바,\n감사인은 중소기업회계처리 특례를 적용하여 매도가능증권으로 분류한 피투자회사가\n종속회사인 경우 매년 연결재무제표 작성대상에 해당하는지 여부와 중소기업 회계처리\n특례 관련 규정을 면밀히 검토하였어야 함에도, 이를 간과하여 회사의 회계처리 오류를\n발견하지 못함\n\n시사점:\n회사는 매년 피투자회사의 지분율 및 자산·부채 규모를 파악하고 지분법 및 연결재무\n- 26 -\n제표 작성 대상인지 여부를 면밀히 검토할 필요가 있으며, 지분법 및 연결재무제표\n관련 기준서를 숙지하여야 함\n감사인은 매년 피투자회사의 지분율 및 자산·부채 규모를 파악하고 지분법 및 연결\n재무제표 작성 대상인지 여부에 대해 회사가 판단한 근거와 관련 자료를 면밀히 검토\n할 필요가 있으며, 연결감사계약을 별도로 체결하지 않았다 하더라도, 연결재무제표를\n작성할 의무가 있다고 판단되면 연결감사보고서를 발행해야 함"
    },
    {
      "paragraph_id": "KICPA-2020-15",
      "case_id": "KICPA-2020-15",
      "case_title": "지분법이익 기간귀속 오류",
      "metadata": {
        "decision_year": "2020",
        "accounting_period": "’17.1.1.∼’17.12.31.\n1. 회사의 회계처리\n회사는 ‘16년 이전까지는 외부감사법 감사대상 및 연결재무제표 공시대상에 해당되지\n않아 연결대상 종속회사 투자주식을「중소기업 회계처리 특례」기준에 따라 취득\n원가로 계상하고, 외부감사법 감사대상 및 연결재무제표 공시대상에 해당하게 된\n‘17년도에 최초로 지분법을 적용하면서 관련 염가매수차익을 ‘17년 당기이익(지분법이익)\n으로 인식함\n2. 회계기준 위반 지적 내용\n회사는 ‘17년 최초 외부감사법 감사대상 및 연결재무제표 공시대상에 해당됨\n「중소기업 회계처리 특례」기준 문단 31.6에 따르면, 유의적 영향력을 행사할 수 있는\n지분증권에 대해 지분법적용을 하지 아니할 수 있으나, 연결재무제표 작성대상 범위에\n해당하는 종속기업에 대해서는 동 특례규정을 적용하지 아니하여 지분법을 적용하도록\n하고 있음\n- 27 -\n회사는 ‘16년 이전 연결재무제표에 대한 공시의무가 없어, 연결재무제표 작성대상\n범위에 해당하는 종속기업 주식을 연결대상에 해당하지 않는 것으로 잘못 판단하여\n원가법을 적용하였으며, ’17년 연결재무제표 공시의무가 발생하면서 동 종속기업이\n‘17년에 연결재무제표 작성대상에 포함되는 것으로 보아 지분법을 전진 적용하면서,\n취득일이 속하는 회계연도인 ‘15년에 투자차액을 인식하지 아니하고, 회사가 최초\n외부감사법 감사대상 및 연결재무제표 공시대상 회계연도가 된 ’17년에 투자차액을\n인식함으로써, 취득일 이후 증가한 종속기업의 순자산지분을 해당연도의 지분법이익이\n아닌 ’17년도의 지분법이익(염가매수차익)으로 잘못 계상하여 당기순이익을 과대계상함\n3. 지적 근거 및 판단 내용\n일반기업회계기준 제12장(사업결합) 문단 12.32, 12.33에 따르면 피투자기업의 식별\n가능한 순자산(취득자산과 인수부채의 순액)과 이전대가의 차액을 취득일에 인식하도록\n규정하고 있음\n4. 감사절차 미흡사항\n회계감사기준 200(독립된 감사인의 전반목적 및 감사기준에 따른 감사의 수행), 500\n(감사증거)과 700(재무제표에 대한 의견형성과 보고) 등에 따르면 감사인은 재무제표를\n중요하게 왜곡표시 시킬 수 있는 상황이 존재할 수 있다는 전문가적인 의구심을 가지고\n감사업무를 계획하고 수행하여야 하며, 감사인은 감사의견 형성의 기초가 될 합리적인\n감사결론을 도출할 수 있도록 충분하고 적합한 감사증거를 확보하여야 하고, 재무제표가\n일반적으로 인정된 회계처리기준에 따라 중요성의 관점에서 적정하게 표시되고 있다고\n판단했을 경우에만 적정의견을 표명하도록 규정되어 있음에도,\n감사인은 회사가 ‘16년 이전까지는 외부감사법 감사대상 및 연결재무제표 공시대상에\n해당되지 않아 연결대상 종속회사 투자주식을 「중소기업 회계처리 특례」기준에\n따라 취득원가로 계상하고, 외부감사법 감사대상 및 연결재무제표 공시대상에 해당하게 된\n‘17년도에 최초로 지분법을 적용하면서 관련 염가매수차익을 ‘17년 당기이익(지분법이익)\n으로 인식하는 것이 적정한 회계처리인 것으로 잘못 판단하여, 회사의 회계처리 오류를\n발견하지 못함\n5. 시사점\n「중소기업 회계처리 특례」기준 문단 31.6에 따르면, 유의적 영향력을 행사할 수 있는\n- 28 -\n지분증권에 대해 지분법적용을 하지 아니할 수 있으나, 연결재무제표 작성대상 범위에\n해당하는 종속기업에 대해서는 동 특례규정을 적용하지 아니한다고 규정되어 있음.\n동 규정에 따라 연결재무제표 작성대상 범위에 해당하는 종속기업에 대한 판단은 회사의\n연결재무제표 공시의무와는 관련이 없음에 주의해야 하며, 회사가 최초 외부감사법\n감사대상 및 연결재무제표 공시대상에 해당하는 경우, 지분법 및 연결효과를 소급하여\n재무제표를 비교표시해야 함",
        "issue_fields": [
          "지분법 회계처리"
        ],
        "related_standards": [
          "일반기업회계기준 제12장(사업결합)"
        ],
        "case_type": "회계감리지적사례",
        "source": "KICPA 심사·감리 지적사례"
      },
      "content": {
        "section_1_company_accounting": {
          "section_title": "회사의 회계처리",
          "content": "회사는 ‘16년 이전까지는 외부감사법 감사대상 및 연결재무제표 공시대상에 해당되지\n않아 연결대상 종속회사 투자주식을「중소기업 회계처리 특례」기준에 따라 취득\n원가로 계상하고, 외부감사법 감사대상 및 연결재무제표 공시대상에 해당하게 된\n‘17년도에 최초로 지분법을 적용하면서 관련 염가매수차익을 ‘17년 당기이익(지분법이익)\n으로 인식함"
        },
        "section_2_violation_details": {
          "section_title": "회계기준 위반 지적 내용",
          "content": "회사는 ‘17년 최초 외부감사법 감사대상 및 연결재무제표 공시대상에 해당됨\n「중소기업 회계처리 특례」기준 문단 31.6에 따르면, 유의적 영향력을 행사할 수 있는\n지분증권에 대해 지분법적용을 하지 아니할 수 있으나, 연결재무제표 작성대상 범위에\n해당하는 종속기업에 대해서는 동 특례규정을 적용하지 아니하여 지분법을 적용하도록\n하고 있음\n- 27 -\n회사는 ‘16년 이전 연결재무제표에 대한 공시의무가 없어, 연결재무제표 작성대상\n범위에 해당하는 종속기업 주식을 연결대상에 해당하지 않는 것으로 잘못 판단하여\n원가법을 적용하였으며, ’17년 연결재무제표 공시의무가 발생하면서 동 종속기업이\n‘17년에 연결재무제표 작성대상에 포함되는 것으로 보아 지분법을 전진 적용하면서,\n취득일이 속하는 회계연도인 ‘15년에 투자차액을 인식하지 아니하고, 회사가 최초\n외부감사법 감사대상 및 연결재무제표 공시대상 회계연도가 된 ’17년에 투자차액을\n인식함으로써, 취득일 이후 증가한 종속기업의 순자산지분을 해당연도의 지분법이익이\n아닌 ’17년도의 지분법이익(염가매수차익)으로 잘못 계상하여 당기순이익을 과대계상함"
        },
        "section_3_basis_judgment": {
          "section_title": "지적 근거 및 판단 내용",
          "content": "일반기업회계기준 제12장(사업결합) 문단 12.32, 12.33에 따르면 피투자기업의 식별\n가능한 순자산(취득자산과 인수부채의 순액)과 이전대가의 차액을 취득일에 인식하도록\n규정하고 있음"
        },
        "section_4_audit_procedure": {
          "section_title": "감사절차 미흡사항",
          "content": "회계감사기준 200(독립된 감사인의 전반목적 및 감사기준에 따른 감사의 수행), 500\n(감사증거)과 700(재무제표에 대한 의견형성과 보고) 등에 따르면 감사인은 재무제표를\n중요하게 왜곡표시 시킬 수 있는 상황이 존재할 수 있다는 전문가적인 의구심을 가지고\n감사업무를 계획하고 수행하여야 하며, 감사인은 감사의견 형성의 기초가 될 합리적인\n감사결론을 도출할 수 있도록 충분하고 적합한 감사증거를 확보하여야 하고, 재무제표가\n일반적으로 인정된 회계처리기준에 따라 중요성의 관점에서 적정하게 표시되고 있다고\n판단했을 경우에만 적정의견을 표명하도록 규정되어 있음에도,\n감사인은 회사가 ‘16년 이전까지는 외부감사법 감사대상 및 연결재무제표 공시대상에\n해당되지 않아 연결대상 종속회사 투자주식을 「중소기업 회계처리 특례」기준에\n따라 취득원가로 계상하고, 외부감사법 감사대상 및 연결재무제표 공시대상에 해당하게 된\n‘17년도에 최초로 지분법을 적용하면서 관련 염가매수차익을 ‘17년 당기이익(지분법이익)\n으로 인식하는 것이 적정한 회계처리인 것으로 잘못 판단하여, 회사의 회계처리 오류를\n발견하지 못함"
        },
        "section_5_implications": {
          "section_title": "시사점",
          "content": "「중소기업 회계처리 특례」기준 문단 31.6에 따르면, 유의적 영향력을 행사할 수 있는\n- 28 -\n지분증권에 대해 지분법적용을 하지 아니할 수 있으나, 연결재무제표 작성대상 범위에\n해당하는 종속기업에 대해서는 동 특례규정을 적용하지 아니한다고 규정되어 있음.\n동 규정에 따라 연결재무제표 작성대상 범위에 해당하는 종속기업에 대한 판단은 회사의\n연결재무제표 공시의무와는 관련이 없음에 주의해야 하며, 회사가 최초 외부감사법\n감사대상 및 연결재무제표 공시대상에 해당하는 경우, 지분법 및 연결효과를 소급하여\n재무제표를 비교표시해야 함"
        }
      },
      "indexed_content": "케이스 ID: KICPA-2020-15\n제목: 지분법이익 기간귀속 오류\n결정연도: 2020년\n회계결산일: ’17.1.1.∼’17.12.31.\n1. 회사의 회계처리\n회사는 ‘16년 이전까지는 외부감사법 감사대상 및 연결재무제표 공시대상에 해당되지\n않아 연결대상 종속회사 투자주식을「중소기업 회계처리 특례」기준에 따라 취득\n원가로 계상하고, 외부감사법 감사대상 및 연결재무제표 공시대상에 해당하게 된\n‘17년도에 최초로 지분법을 적용하면서 관련 염가매수차익을 ‘17년 당기이익(지분법이익)\n으로 인식함\n2. 회계기준 위반 지적 내용\n회사는 ‘17년 최초 외부감사법 감사대상 및 연결재무제표 공시대상에 해당됨\n「중소기업 회계처리 특례」기준 문단 31.6에 따르면, 유의적 영향력을 행사할 수 있는\n지분증권에 대해 지분법적용을 하지 아니할 수 있으나, 연결재무제표 작성대상 범위에\n해당하는 종속기업에 대해서는 동 특례규정을 적용하지 아니하여 지분법을 적용하도록\n하고 있음\n- 27 -\n회사는 ‘16년 이전 연결재무제표에 대한 공시의무가 없어, 연결재무제표 작성대상\n범위에 해당하는 종속기업 주식을 연결대상에 해당하지 않는 것으로 잘못 판단하여\n원가법을 적용하였으며, ’17년 연결재무제표 공시의무가 발생하면서 동 종속기업이\n‘17년에 연결재무제표 작성대상에 포함되는 것으로 보아 지분법을 전진 적용하면서,\n취득일이 속하는 회계연도인 ‘15년에 투자차액을 인식하지 아니하고, 회사가 최초\n외부감사법 감사대상 및 연결재무제표 공시대상 회계연도가 된 ’17년에 투자차액을\n인식함으로써, 취득일 이후 증가한 종속기업의 순자산지분을 해당연도의 지분법이익이\n아닌 ’17년도의 지분법이익(염가매수차익)으로 잘못 계상하여 당기순이익을 과대계상함\n3. 지적 근거 및 판단 내용\n일반기업회계기준 제12장(사업결합) 문단 12.32, 12.33에 따르면 피투자기업의 식별\n가능한 순자산(취득자산과 인수부채의 순액)과 이전대가의 차액을 취득일에 인식하도록\n규정하고 있음\n4. 감사절차 미흡사항\n회계감사기준 200(독립된 감사인의 전반목적 및 감사기준에 따른 감사의 수행), 500\n(감사증거)과 700(재무제표에 대한 의견형성과 보고) 등에 따르면 감사인은 재무제표를\n중요하게 왜곡표시 시킬 수 있는 상황이 존재할 수 있다는 전문가적인 의구심을 가지고\n감사업무를 계획하고 수행하여야 하며, 감사인은 감사의견 형성의 기초가 될 합리적인\n감사결론을 도출할 수 있도록 충분하고 적합한 감사증거를 확보하여야 하고, 재무제표가\n일반적으로 인정된 회계처리기준에 따라 중요성의 관점에서 적정하게 표시되고 있다고\n판단했을 경우에만 적정의견을 표명하도록 규정되어 있음에도,\n감사인은 회사가 ‘16년 이전까지는 외부감사법 감사대상 및 연결재무제표 공시대상에\n해당되지 않아 연결대상 종속회사 투자주식을 「중소기업 회계처리 특례」기준에\n따라 취득원가로 계상하고, 외부감사법 감사대상 및 연결재무제표 공시대상에 해당하게 된\n‘17년도에 최초로 지분법을 적용하면서 관련 염가매수차익을 ‘17년 당기이익(지분법이익)\n으로 인식하는 것이 적정한 회계처리인 것으로 잘못 판단하여, 회사의 회계처리 오류를\n발견하지 못함\n5. 시사점\n「중소기업 회계처리 특례」기준 문단 31.6에 따르면, 유의적 영향력을 행사할 수 있는\n- 28 -\n지분증권에 대해 지분법적용을 하지 아니할 수 있으나, 연결재무제표 작성대상 범위에\n해당하는 종속기업에 대해서는 동 특례규정을 적용하지 아니한다고 규정되어 있음.\n동 규정에 따라 연결재무제표 작성대상 범위에 해당하는 종속기업에 대한 판단은 회사의\n연결재무제표 공시의무와는 관련이 없음에 주의해야 하며, 회사가 최초 외부감사법\n감사대상 및 연결재무제표 공시대상에 해당하는 경우, 지분법 및 연결효과를 소급하여\n재무제표를 비교표시해야 함\n쟁점분야: 지분법 회계처리\n관련기준: 일반기업회계기준 제12장(사업결합)\n\n회사의 회계처리:\n회사는 ‘16년 이전까지는 외부감사법 감사대상 및 연결재무제표 공시대상에 해당되지\n않아 연결대상 종속회사 투자주식을「중소기업 회계처리 특례」기준에 따라 취득\n원가로 계상하고, 외부감사법 감사대상 및 연결재무제표 공시대상에 해당하게 된\n‘17년도에 최초로 지분법을 적용하면서 관련 염가매수차익을 ‘17년 당기이익(지분법이익)\n으로 인식함\n\n회계기준 위반 지적 내용:\n회사는 ‘17년 최초 외부감사법 감사대상 및 연결재무제표 공시대상에 해당됨\n「중소기업 회계처리 특례」기준 문단 31.6에 따르면, 유의적 영향력을 행사할 수 있는\n지분증권에 대해 지분법적용을 하지 아니할 수 있으나, 연결재무제표 작성대상 범위에\n해당하는 종속기업에 대해서는 동 특례규정을 적용하지 아니하여 지분법을 적용하도록\n하고 있음\n- 27 -\n회사는 ‘16년 이전 연결재무제표에 대한 공시의무가 없어, 연결재무제표 작성대상\n범위에 해당하는 종속기업 주식을 연결대상에 해당하지 않는 것으로 잘못 판단하여\n원가법을 적용하였으며, ’17년 연결재무제표 공시의무가 발생하면서 동 종속기업이\n‘17년에 연결재무제표 작성대상에 포함되는 것으로 보아 지분법을 전진 적용하면서,\n취득일이 속하는 회계연도인 ‘15년에 투자차액을 인식하지 아니하고, 회사가 최초\n외부감사법 감사대상 및 연결재무제표 공시대상 회계연도가 된 ’17년에 투자차액을\n인식함으로써, 취득일 이후 증가한 종속기업의 순자산지분을 해당연도의 지분법이익이\n아닌 ’17년도의 지분법이익(염가매수차익)으로 잘못 계상하여 당기순이익을 과대계상함\n\n지적 근거 및 판단 내용:\n일반기업회계기준 제12장(사업결합) 문단 12.32, 12.33에 따르면 피투자기업의 식별\n가능한 순자산(취득자산과 인수부채의 순액)과 이전대가의 차액을 취득일에 인식하도록\n규정하고 있음\n\n감사절차 미흡사항:\n회계감사기준 200(독립된 감사인의 전반목적 및 감사기준에 따른 감사의 수행), 500\n(감사증거)과 700(재무제표에 대한 의견형성과 보고) 등에 따르면 감사인은 재무제표를\n중요하게 왜곡표시 시킬 수 있는 상황이 존재할 수 있다는 전문가적인 의구심을 가지고\n감사업무를 계획하고 수행하여야 하며, 감사인은 감사의견 형성의 기초가 될 합리적인\n감사결론을 도출할 수 있도록 충분하고 적합한 감사증거를 확보하여야 하고, 재무제표가\n일반적으로 인정된 회계처리기준에 따라 중요성의 관점에서 적정하게 표시되고 있다고\n판단했을 경우에만 적정의견을 표명하도록 규정되어 있음에도,\n감사인은 회사가 ‘16년 이전까지는 외부감사법 감사대상 및 연결재무제표 공시대상에\n해당되지 않아 연결대상 종속회사 투자주식을 「중소기업 회계처리 특례」기준에\n따라 취득원가로 계상하고, 외부감사법 감사대상 및 연결재무제표 공시대상에 해당하게 된\n‘17년도에 최초로 지분법을 적용하면서 관련 염가매수차익을 ‘17년 당기이익(지분법이익)\n으로 인식하는 것이 적정한 회계처리인 것으로 잘못 판단하여, 회사의 회계처리 오류를\n발견하지 못함\n\n시사점:\n「중소기업 회계처리 특례」기준 문단 31.6에 따르면, 유의적 영향력을 행사할 수 있는\n- 28 -\n지분증권에 대해 지분법적용을 하지 아니할 수 있으나, 연결재무제표 작성대상 범위에\n해당하는 종속기업에 대해서는 동 특례규정을 적용하지 아니한다고 규정되어 있음.\n동 규정에 따라 연결재무제표 작성대상 범위에 해당하는 종속기업에 대한 판단은 회사의\n연결재무제표 공시의무와는 관련이 없음에 주의해야 하며, 회사가 최초 외부감사법\n감사대상 및 연결재무제표 공시대상에 해당하는 경우, 지분법 및 연결효과를 소급하여\n재무제표를 비교표시해야 함"
    },
    {
      "paragraph_id": "KICPA-2020-16",
      "case_id": "KICPA-2020-16",
      "case_title": "선급공사원가 등 허위계상",
      "metadata": {
        "decision_year": "2020",
        "accounting_period": "‘10.1.1.∼’17.12.31.\n1. 회사의 회계처리\n회사의 대표이사 및 회사에 대하여 실질적인 영향력을 행사하는 특수관계자가 공모\n하여 허위의 공사(용역)계약을 체결한 후 관련 공사비 등을 횡령하는 방식으로 선급\n공사원가를 과대계상 하였으며, 공사비(평균지출액) 과다산정에 따라 차입원가를 과다\n하게 자본화하여 관련 자산(부채) 및 수익(비용)을 과대(과소)계상함\n2. 회계기준 위반 지적 내용\n회사는 관광리조트 개발사업을 영위할 목적으로 설립된 시행사로, 09년부터 12년까지\n대표이사 및 특수관계자가 건설·설계와 컨설팅용역 명목으로 허위의 계약을 체결하여\n관련 금액을 지출한 후 빼돌리는 수법으로 불법행위(횡령)를 자행함으로써 회계처리\n오류가 발생함\n3. 지적 근거 및 판단 내용\n일반기업회계기준 제2장(재무제표의 작성과 표시Ⅰ) 문단 2.7에 따르면, 재무제표는\n경제적 사실과 거래의 실질을 반영하여 기업의 재무상태, 경영성과, 현금흐름 및 자본\n변동을 공정하게 표시하여야 함\n- 29 -\n4. 감사절차 미흡사항\n회사가 단독으로 또는 외부와 공모하여 핵심적인 증거가 되는 문서를 위․변조하는\n등 조직적으로 위법사실을 은폐하여 다른 감사절차에 의하여도 위법가능성을 전혀\n의심할 수 없었거나, 회사의 진술에 의하지 아니하고는 당해 위법사실을 알 수 없는\n사항이라고 인정되는 경우에 해당하여 면책함\n5. 시사점\n회사는 대표이사의 횡령 등으로 수사가 진행중인 경우, 재무제표에 미치는 영향을\n고려하여 관련 사실을 정보이용자가 인지할 수 있도록 충분하게 주석에 공시하여야 함\n감사인은 (선급)공사원가의 발생사실, 실재성 등의 확인을 위한 기본 감사절차 이외에\n거래의 실질이 의심될 경우에는 회사제시자료에 대한 검토 외에 용역제공 계약자에\n대한 외부조회 등 거래의 실질을 확인하기 위한 추가적인 감사절차를 실시하여야 함\n(해당 회사의 감사인은 상기 절차를 실시하여 면책함)",
        "issue_fields": [
          "기타자산 등 과소(과대)계상"
        ],
        "related_standards": [
          "일반기업회계기준 제2장(재무제표의 작성과 표시Ⅰ)"
        ],
        "case_type": "회계감리지적사례",
        "source": "KICPA 심사·감리 지적사례"
      },
      "content": {
        "section_1_company_accounting": {
          "section_title": "회사의 회계처리",
          "content": "회사의 대표이사 및 회사에 대하여 실질적인 영향력을 행사하는 특수관계자가 공모\n하여 허위의 공사(용역)계약을 체결한 후 관련 공사비 등을 횡령하는 방식으로 선급\n공사원가를 과대계상 하였으며, 공사비(평균지출액) 과다산정에 따라 차입원가를 과다\n하게 자본화하여 관련 자산(부채) 및 수익(비용)을 과대(과소)계상함"
        },
        "section_2_violation_details": {
          "section_title": "회계기준 위반 지적 내용",
          "content": "회사는 관광리조트 개발사업을 영위할 목적으로 설립된 시행사로, 09년부터 12년까지\n대표이사 및 특수관계자가 건설·설계와 컨설팅용역 명목으로 허위의 계약을 체결하여\n관련 금액을 지출한 후 빼돌리는 수법으로 불법행위(횡령)를 자행함으로써 회계처리\n오류가 발생함"
        },
        "section_3_basis_judgment": {
          "section_title": "지적 근거 및 판단 내용",
          "content": "일반기업회계기준 제2장(재무제표의 작성과 표시Ⅰ) 문단 2.7에 따르면, 재무제표는\n경제적 사실과 거래의 실질을 반영하여 기업의 재무상태, 경영성과, 현금흐름 및 자본\n변동을 공정하게 표시하여야 함\n- 29 -"
        },
        "section_4_audit_procedure": {
          "section_title": "감사절차 미흡사항",
          "content": "회사가 단독으로 또는 외부와 공모하여 핵심적인 증거가 되는 문서를 위․변조하는\n등 조직적으로 위법사실을 은폐하여 다른 감사절차에 의하여도 위법가능성을 전혀\n의심할 수 없었거나, 회사의 진술에 의하지 아니하고는 당해 위법사실을 알 수 없는\n사항이라고 인정되는 경우에 해당하여 면책함"
        },
        "section_5_implications": {
          "section_title": "시사점",
          "content": "회사는 대표이사의 횡령 등으로 수사가 진행중인 경우, 재무제표에 미치는 영향을\n고려하여 관련 사실을 정보이용자가 인지할 수 있도록 충분하게 주석에 공시하여야 함\n감사인은 (선급)공사원가의 발생사실, 실재성 등의 확인을 위한 기본 감사절차 이외에\n거래의 실질이 의심될 경우에는 회사제시자료에 대한 검토 외에 용역제공 계약자에\n대한 외부조회 등 거래의 실질을 확인하기 위한 추가적인 감사절차를 실시하여야 함\n(해당 회사의 감사인은 상기 절차를 실시하여 면책함)"
        }
      },
      "indexed_content": "케이스 ID: KICPA-2020-16\n제목: 선급공사원가 등 허위계상\n결정연도: 2020년\n회계결산일: ‘10.1.1.∼’17.12.31.\n1. 회사의 회계처리\n회사의 대표이사 및 회사에 대하여 실질적인 영향력을 행사하는 특수관계자가 공모\n하여 허위의 공사(용역)계약을 체결한 후 관련 공사비 등을 횡령하는 방식으로 선급\n공사원가를 과대계상 하였으며, 공사비(평균지출액) 과다산정에 따라 차입원가를 과다\n하게 자본화하여 관련 자산(부채) 및 수익(비용)을 과대(과소)계상함\n2. 회계기준 위반 지적 내용\n회사는 관광리조트 개발사업을 영위할 목적으로 설립된 시행사로, 09년부터 12년까지\n대표이사 및 특수관계자가 건설·설계와 컨설팅용역 명목으로 허위의 계약을 체결하여\n관련 금액을 지출한 후 빼돌리는 수법으로 불법행위(횡령)를 자행함으로써 회계처리\n오류가 발생함\n3. 지적 근거 및 판단 내용\n일반기업회계기준 제2장(재무제표의 작성과 표시Ⅰ) 문단 2.7에 따르면, 재무제표는\n경제적 사실과 거래의 실질을 반영하여 기업의 재무상태, 경영성과, 현금흐름 및 자본\n변동을 공정하게 표시하여야 함\n- 29 -\n4. 감사절차 미흡사항\n회사가 단독으로 또는 외부와 공모하여 핵심적인 증거가 되는 문서를 위․변조하는\n등 조직적으로 위법사실을 은폐하여 다른 감사절차에 의하여도 위법가능성을 전혀\n의심할 수 없었거나, 회사의 진술에 의하지 아니하고는 당해 위법사실을 알 수 없는\n사항이라고 인정되는 경우에 해당하여 면책함\n5. 시사점\n회사는 대표이사의 횡령 등으로 수사가 진행중인 경우, 재무제표에 미치는 영향을\n고려하여 관련 사실을 정보이용자가 인지할 수 있도록 충분하게 주석에 공시하여야 함\n감사인은 (선급)공사원가의 발생사실, 실재성 등의 확인을 위한 기본 감사절차 이외에\n거래의 실질이 의심될 경우에는 회사제시자료에 대한 검토 외에 용역제공 계약자에\n대한 외부조회 등 거래의 실질을 확인하기 위한 추가적인 감사절차를 실시하여야 함\n(해당 회사의 감사인은 상기 절차를 실시하여 면책함)\n쟁점분야: 기타자산 등 과소(과대)계상\n관련기준: 일반기업회계기준 제2장(재무제표의 작성과 표시Ⅰ)\n\n회사의 회계처리:\n회사의 대표이사 및 회사에 대하여 실질적인 영향력을 행사하는 특수관계자가 공모\n하여 허위의 공사(용역)계약을 체결한 후 관련 공사비 등을 횡령하는 방식으로 선급\n공사원가를 과대계상 하였으며, 공사비(평균지출액) 과다산정에 따라 차입원가를 과다\n하게 자본화하여 관련 자산(부채) 및 수익(비용)을 과대(과소)계상함\n\n회계기준 위반 지적 내용:\n회사는 관광리조트 개발사업을 영위할 목적으로 설립된 시행사로, 09년부터 12년까지\n대표이사 및 특수관계자가 건설·설계와 컨설팅용역 명목으로 허위의 계약을 체결하여\n관련 금액을 지출한 후 빼돌리는 수법으로 불법행위(횡령)를 자행함으로써 회계처리\n오류가 발생함\n\n지적 근거 및 판단 내용:\n일반기업회계기준 제2장(재무제표의 작성과 표시Ⅰ) 문단 2.7에 따르면, 재무제표는\n경제적 사실과 거래의 실질을 반영하여 기업의 재무상태, 경영성과, 현금흐름 및 자본\n변동을 공정하게 표시하여야 함\n- 29 -\n\n감사절차 미흡사항:\n회사가 단독으로 또는 외부와 공모하여 핵심적인 증거가 되는 문서를 위․변조하는\n등 조직적으로 위법사실을 은폐하여 다른 감사절차에 의하여도 위법가능성을 전혀\n의심할 수 없었거나, 회사의 진술에 의하지 아니하고는 당해 위법사실을 알 수 없는\n사항이라고 인정되는 경우에 해당하여 면책함\n\n시사점:\n회사는 대표이사의 횡령 등으로 수사가 진행중인 경우, 재무제표에 미치는 영향을\n고려하여 관련 사실을 정보이용자가 인지할 수 있도록 충분하게 주석에 공시하여야 함\n감사인은 (선급)공사원가의 발생사실, 실재성 등의 확인을 위한 기본 감사절차 이외에\n거래의 실질이 의심될 경우에는 회사제시자료에 대한 검토 외에 용역제공 계약자에\n대한 외부조회 등 거래의 실질을 확인하기 위한 추가적인 감사절차를 실시하여야 함\n(해당 회사의 감사인은 상기 절차를 실시하여 면책함)"
    },
    {
      "paragraph_id": "KICPA-2020-17",
      "case_id": "KICPA-2020-17",
      "case_title": "반품충당부채 과소계상",
      "metadata": {
        "decision_year": "2020",
        "accounting_period": "’16.1.1.∼’17.12.31.\n1. 회사의 회계처리\n회사가 반품충당부채를 설정함에 있어 과거 반품경험률 산정시 실제 반품처리된 거래만\n고려하고 이종제품의 교환거래는 경제적 실질에 미치는 영향이 없는 단순교환(재고자산\n단순 대체거래)으로 판단하여 반품경험률 산정에서 제외함에 따라 반품충당부채를\n과소계상함\n2. 회계기준 위반 지적 내용\n회사는 매출 중 상당부분이 반품ㆍ교환되고 있음에 따라 반품충당부채 인식을 위한\n- 30 -\n과거 반품경험률 산정시 순수하게 반품으로 처리된 부분만을 고려하여 반품충당부채를\n계상하고\n- 이종제품으로 교환되는 부분은 경제적 실질에 영향을 미치지 않는 단순교환(재고\n자산 단순 대체거래)으로 잘못 판단하여 반품경험률 산정에서 제외하였으나\n- 교환거래가 빈번하게 발생하고 있고 교환되는 제품의 금액도 서로 상이할 수 있으며\n교환시점도 매출발생 시점과 다를 수 있어 수익인식의 기간귀속을 왜곡시킬 수 있으\n므로 동일제품 교환을 제외한 이종제품(유형, 품질, 가격 등이 다른 제품) 교환은 반품\n으로 보아 반품경험률 산정에 반영하였어야 함에도 이를 누락하여 반품충당부채를\n과소계상함\n3. 지적 근거 및 판단 내용\n일반기업회계기준 제14장(충당부채, 우발부채 및 우발자산) 문단 14.3, 14.7에 따르면\n충당부채는 과거사건이나 거래의 결과에 의한 현재의무로서, 지출의 시기 또는 금액이\n불확실하지만 그 의무를 이행하기 위하여 자원이 유출될 가능성이 매우 높고 또한\n당해 금액을 신뢰성 있게 측정할 수 있는 의무를 말하며 충당부채로 인식하는 금액은\n현재의무의 이행에 소요되는 지출에 대한 보고기간말 현재 최선의 추정치이어야 한다고\n규정하고 있음\n4. 감사절차 미흡사항\n동 지적사례는 재무제표에 대한 심사로 종결되어 감사보고서 감리는 실시하지 아니함\n5. 시사점\n회사는 반품충당부채 인식을 위한 과거 반품경험률 산정시 순수 반품되는 부분뿐만\n아니라 이종제품(유형, 품질, 가격 등이 다른 제품)간 교환도 실질적으로 반품에 해당\n하므로 반품경험률 산정에 반영하여야 함\n- 31 -",
        "issue_fields": [
          "반품충당부채"
        ],
        "related_standards": [
          "일반기업회계기준 제14장(충당부채",
          "우발부채 및 우발자산)"
        ],
        "case_type": "회계감리지적사례",
        "source": "KICPA 심사·감리 지적사례"
      },
      "content": {
        "section_1_company_accounting": {
          "section_title": "회사의 회계처리",
          "content": "회사가 반품충당부채를 설정함에 있어 과거 반품경험률 산정시 실제 반품처리된 거래만\n고려하고 이종제품의 교환거래는 경제적 실질에 미치는 영향이 없는 단순교환(재고자산\n단순 대체거래)으로 판단하여 반품경험률 산정에서 제외함에 따라 반품충당부채를\n과소계상함"
        },
        "section_2_violation_details": {
          "section_title": "회계기준 위반 지적 내용",
          "content": "회사는 매출 중 상당부분이 반품ㆍ교환되고 있음에 따라 반품충당부채 인식을 위한\n- 30 -\n과거 반품경험률 산정시 순수하게 반품으로 처리된 부분만을 고려하여 반품충당부채를\n계상하고\n- 이종제품으로 교환되는 부분은 경제적 실질에 영향을 미치지 않는 단순교환(재고\n자산 단순 대체거래)으로 잘못 판단하여 반품경험률 산정에서 제외하였으나\n- 교환거래가 빈번하게 발생하고 있고 교환되는 제품의 금액도 서로 상이할 수 있으며\n교환시점도 매출발생 시점과 다를 수 있어 수익인식의 기간귀속을 왜곡시킬 수 있으\n므로 동일제품 교환을 제외한 이종제품(유형, 품질, 가격 등이 다른 제품) 교환은 반품\n으로 보아 반품경험률 산정에 반영하였어야 함에도 이를 누락하여 반품충당부채를\n과소계상함"
        },
        "section_3_basis_judgment": {
          "section_title": "지적 근거 및 판단 내용",
          "content": "일반기업회계기준 제14장(충당부채, 우발부채 및 우발자산) 문단 14.3, 14.7에 따르면\n충당부채는 과거사건이나 거래의 결과에 의한 현재의무로서, 지출의 시기 또는 금액이\n불확실하지만 그 의무를 이행하기 위하여 자원이 유출될 가능성이 매우 높고 또한\n당해 금액을 신뢰성 있게 측정할 수 있는 의무를 말하며 충당부채로 인식하는 금액은\n현재의무의 이행에 소요되는 지출에 대한 보고기간말 현재 최선의 추정치이어야 한다고\n규정하고 있음"
        },
        "section_4_audit_procedure": {
          "section_title": "감사절차 미흡사항",
          "content": "동 지적사례는 재무제표에 대한 심사로 종결되어 감사보고서 감리는 실시하지 아니함"
        },
        "section_5_implications": {
          "section_title": "시사점",
          "content": "회사는 반품충당부채 인식을 위한 과거 반품경험률 산정시 순수 반품되는 부분뿐만\n아니라 이종제품(유형, 품질, 가격 등이 다른 제품)간 교환도 실질적으로 반품에 해당\n하므로 반품경험률 산정에 반영하여야 함\n- 31 -"
        }
      },
      "indexed_content": "케이스 ID: KICPA-2020-17\n제목: 반품충당부채 과소계상\n결정연도: 2020년\n회계결산일: ’16.1.1.∼’17.12.31.\n1. 회사의 회계처리\n회사가 반품충당부채를 설정함에 있어 과거 반품경험률 산정시 실제 반품처리된 거래만\n고려하고 이종제품의 교환거래는 경제적 실질에 미치는 영향이 없는 단순교환(재고자산\n단순 대체거래)으로 판단하여 반품경험률 산정에서 제외함에 따라 반품충당부채를\n과소계상함\n2. 회계기준 위반 지적 내용\n회사는 매출 중 상당부분이 반품ㆍ교환되고 있음에 따라 반품충당부채 인식을 위한\n- 30 -\n과거 반품경험률 산정시 순수하게 반품으로 처리된 부분만을 고려하여 반품충당부채를\n계상하고\n- 이종제품으로 교환되는 부분은 경제적 실질에 영향을 미치지 않는 단순교환(재고\n자산 단순 대체거래)으로 잘못 판단하여 반품경험률 산정에서 제외하였으나\n- 교환거래가 빈번하게 발생하고 있고 교환되는 제품의 금액도 서로 상이할 수 있으며\n교환시점도 매출발생 시점과 다를 수 있어 수익인식의 기간귀속을 왜곡시킬 수 있으\n므로 동일제품 교환을 제외한 이종제품(유형, 품질, 가격 등이 다른 제품) 교환은 반품\n으로 보아 반품경험률 산정에 반영하였어야 함에도 이를 누락하여 반품충당부채를\n과소계상함\n3. 지적 근거 및 판단 내용\n일반기업회계기준 제14장(충당부채, 우발부채 및 우발자산) 문단 14.3, 14.7에 따르면\n충당부채는 과거사건이나 거래의 결과에 의한 현재의무로서, 지출의 시기 또는 금액이\n불확실하지만 그 의무를 이행하기 위하여 자원이 유출될 가능성이 매우 높고 또한\n당해 금액을 신뢰성 있게 측정할 수 있는 의무를 말하며 충당부채로 인식하는 금액은\n현재의무의 이행에 소요되는 지출에 대한 보고기간말 현재 최선의 추정치이어야 한다고\n규정하고 있음\n4. 감사절차 미흡사항\n동 지적사례는 재무제표에 대한 심사로 종결되어 감사보고서 감리는 실시하지 아니함\n5. 시사점\n회사는 반품충당부채 인식을 위한 과거 반품경험률 산정시 순수 반품되는 부분뿐만\n아니라 이종제품(유형, 품질, 가격 등이 다른 제품)간 교환도 실질적으로 반품에 해당\n하므로 반품경험률 산정에 반영하여야 함\n- 31 -\n쟁점분야: 반품충당부채\n관련기준: 일반기업회계기준 제14장(충당부채, 우발부채 및 우발자산)\n\n회사의 회계처리:\n회사가 반품충당부채를 설정함에 있어 과거 반품경험률 산정시 실제 반품처리된 거래만\n고려하고 이종제품의 교환거래는 경제적 실질에 미치는 영향이 없는 단순교환(재고자산\n단순 대체거래)으로 판단하여 반품경험률 산정에서 제외함에 따라 반품충당부채를\n과소계상함\n\n회계기준 위반 지적 내용:\n회사는 매출 중 상당부분이 반품ㆍ교환되고 있음에 따라 반품충당부채 인식을 위한\n- 30 -\n과거 반품경험률 산정시 순수하게 반품으로 처리된 부분만을 고려하여 반품충당부채를\n계상하고\n- 이종제품으로 교환되는 부분은 경제적 실질에 영향을 미치지 않는 단순교환(재고\n자산 단순 대체거래)으로 잘못 판단하여 반품경험률 산정에서 제외하였으나\n- 교환거래가 빈번하게 발생하고 있고 교환되는 제품의 금액도 서로 상이할 수 있으며\n교환시점도 매출발생 시점과 다를 수 있어 수익인식의 기간귀속을 왜곡시킬 수 있으\n므로 동일제품 교환을 제외한 이종제품(유형, 품질, 가격 등이 다른 제품) 교환은 반품\n으로 보아 반품경험률 산정에 반영하였어야 함에도 이를 누락하여 반품충당부채를\n과소계상함\n\n지적 근거 및 판단 내용:\n일반기업회계기준 제14장(충당부채, 우발부채 및 우발자산) 문단 14.3, 14.7에 따르면\n충당부채는 과거사건이나 거래의 결과에 의한 현재의무로서, 지출의 시기 또는 금액이\n불확실하지만 그 의무를 이행하기 위하여 자원이 유출될 가능성이 매우 높고 또한\n당해 금액을 신뢰성 있게 측정할 수 있는 의무를 말하며 충당부채로 인식하는 금액은\n현재의무의 이행에 소요되는 지출에 대한 보고기간말 현재 최선의 추정치이어야 한다고\n규정하고 있음\n\n감사절차 미흡사항:\n동 지적사례는 재무제표에 대한 심사로 종결되어 감사보고서 감리는 실시하지 아니함\n\n시사점:\n회사는 반품충당부채 인식을 위한 과거 반품경험률 산정시 순수 반품되는 부분뿐만\n아니라 이종제품(유형, 품질, 가격 등이 다른 제품)간 교환도 실질적으로 반품에 해당\n하므로 반품경험률 산정에 반영하여야 함\n- 31 -"
    },
    {
      "paragraph_id": "KICPA-2020-18",
      "case_id": "KICPA-2020-18",
      "case_title": "경상연구개발비 회계처리 오류",
      "metadata": {
        "decision_year": "2020",
        "accounting_period": "’15.1.1.∼’18.12.31.\n1. 회사의 회계처리\n회사는 경상연구개발비를 미국내 임상용역비용 등이 발생한 시점에 인식하지 아니\n하고, 임상용역을 수탁 관리하는 자회사가 청구한 시점에 인식함으로써 경상연구\n개발비를 과소(대)계상함\n2. 회계기준 위반 지적 내용\n회사는 신약을 연구개발하는 업체로서\n- 임상시험은 미국의 임상용역업체에 의뢰하고, 회사의 미국 자회사는 임상용역업체가\n수행하는 용역을 수탁관리하고 있음. 임상용역업체가 주요계약단계 완료시점에\nInvoice를 발행하면 자회사가 회사에 동 비용을 청구하며, 회사는 자회사의 비용\n청구시점에 경상연구개발비로 인식함\n- 임상용역비용은 결산시점 임상용역업체의 진행률을 확인하여 기간비용(경상연구개발비)\n으로 인식하여야 함에도 임상용역업체의 주요계약단계 완료시점에 인식함으로써\n회계처리오류가 발생함\n3. 지적 근거 및 판단 내용\n기업회계기준서 제1001호(재무제표 표시) 문단 27에 따르면, 기업은 발생기준 회계를\n사용하여 재무제표를 작성하고, 각 항목이 ‘개념체계’의 정의와 인식요건을 충족할 때\n자산, 부채, 자본, 광의의 수익 및 비용(재무제표의 요소)으로 인식하도록 규정하고\n있음\n4. 감사절차 미흡사항\n동 지적사례는 재무제표에 대한 심사로 종결되어 감사보고서 감리는 실시하지 아니함\n- 32 -\n5. 시사점\n회사는 임상용역비를 인식함에 있어 계약서상 형식적인 요건이 아니라 경제적 실질에\n따라 발생한 시점에 비용을 인식하여야 하며 관련 회계처리기준을 숙지하여야 함",
        "issue_fields": [
          "경상연구개발비 인식시기"
        ],
        "related_standards": [
          "기업회계기준서 제1001호(재무제표 표시)"
        ],
        "case_type": "회계감리지적사례",
        "source": "KICPA 심사·감리 지적사례"
      },
      "content": {
        "section_1_company_accounting": {
          "section_title": "회사의 회계처리",
          "content": "회사는 경상연구개발비를 미국내 임상용역비용 등이 발생한 시점에 인식하지 아니\n하고, 임상용역을 수탁 관리하는 자회사가 청구한 시점에 인식함으로써 경상연구\n개발비를 과소(대)계상함"
        },
        "section_2_violation_details": {
          "section_title": "회계기준 위반 지적 내용",
          "content": "회사는 신약을 연구개발하는 업체로서\n- 임상시험은 미국의 임상용역업체에 의뢰하고, 회사의 미국 자회사는 임상용역업체가\n수행하는 용역을 수탁관리하고 있음. 임상용역업체가 주요계약단계 완료시점에\nInvoice를 발행하면 자회사가 회사에 동 비용을 청구하며, 회사는 자회사의 비용\n청구시점에 경상연구개발비로 인식함\n- 임상용역비용은 결산시점 임상용역업체의 진행률을 확인하여 기간비용(경상연구개발비)\n으로 인식하여야 함에도 임상용역업체의 주요계약단계 완료시점에 인식함으로써\n회계처리오류가 발생함"
        },
        "section_3_basis_judgment": {
          "section_title": "지적 근거 및 판단 내용",
          "content": "기업회계기준서 제1001호(재무제표 표시) 문단 27에 따르면, 기업은 발생기준 회계를\n사용하여 재무제표를 작성하고, 각 항목이 ‘개념체계’의 정의와 인식요건을 충족할 때\n자산, 부채, 자본, 광의의 수익 및 비용(재무제표의 요소)으로 인식하도록 규정하고\n있음"
        },
        "section_4_audit_procedure": {
          "section_title": "감사절차 미흡사항",
          "content": "동 지적사례는 재무제표에 대한 심사로 종결되어 감사보고서 감리는 실시하지 아니함\n- 32 -"
        },
        "section_5_implications": {
          "section_title": "시사점",
          "content": "회사는 임상용역비를 인식함에 있어 계약서상 형식적인 요건이 아니라 경제적 실질에\n따라 발생한 시점에 비용을 인식하여야 하며 관련 회계처리기준을 숙지하여야 함"
        }
      },
      "indexed_content": "케이스 ID: KICPA-2020-18\n제목: 경상연구개발비 회계처리 오류\n결정연도: 2020년\n회계결산일: ’15.1.1.∼’18.12.31.\n1. 회사의 회계처리\n회사는 경상연구개발비를 미국내 임상용역비용 등이 발생한 시점에 인식하지 아니\n하고, 임상용역을 수탁 관리하는 자회사가 청구한 시점에 인식함으로써 경상연구\n개발비를 과소(대)계상함\n2. 회계기준 위반 지적 내용\n회사는 신약을 연구개발하는 업체로서\n- 임상시험은 미국의 임상용역업체에 의뢰하고, 회사의 미국 자회사는 임상용역업체가\n수행하는 용역을 수탁관리하고 있음. 임상용역업체가 주요계약단계 완료시점에\nInvoice를 발행하면 자회사가 회사에 동 비용을 청구하며, 회사는 자회사의 비용\n청구시점에 경상연구개발비로 인식함\n- 임상용역비용은 결산시점 임상용역업체의 진행률을 확인하여 기간비용(경상연구개발비)\n으로 인식하여야 함에도 임상용역업체의 주요계약단계 완료시점에 인식함으로써\n회계처리오류가 발생함\n3. 지적 근거 및 판단 내용\n기업회계기준서 제1001호(재무제표 표시) 문단 27에 따르면, 기업은 발생기준 회계를\n사용하여 재무제표를 작성하고, 각 항목이 ‘개념체계’의 정의와 인식요건을 충족할 때\n자산, 부채, 자본, 광의의 수익 및 비용(재무제표의 요소)으로 인식하도록 규정하고\n있음\n4. 감사절차 미흡사항\n동 지적사례는 재무제표에 대한 심사로 종결되어 감사보고서 감리는 실시하지 아니함\n- 32 -\n5. 시사점\n회사는 임상용역비를 인식함에 있어 계약서상 형식적인 요건이 아니라 경제적 실질에\n따라 발생한 시점에 비용을 인식하여야 하며 관련 회계처리기준을 숙지하여야 함\n쟁점분야: 경상연구개발비 인식시기\n관련기준: 기업회계기준서 제1001호(재무제표 표시)\n\n회사의 회계처리:\n회사는 경상연구개발비를 미국내 임상용역비용 등이 발생한 시점에 인식하지 아니\n하고, 임상용역을 수탁 관리하는 자회사가 청구한 시점에 인식함으로써 경상연구\n개발비를 과소(대)계상함\n\n회계기준 위반 지적 내용:\n회사는 신약을 연구개발하는 업체로서\n- 임상시험은 미국의 임상용역업체에 의뢰하고, 회사의 미국 자회사는 임상용역업체가\n수행하는 용역을 수탁관리하고 있음. 임상용역업체가 주요계약단계 완료시점에\nInvoice를 발행하면 자회사가 회사에 동 비용을 청구하며, 회사는 자회사의 비용\n청구시점에 경상연구개발비로 인식함\n- 임상용역비용은 결산시점 임상용역업체의 진행률을 확인하여 기간비용(경상연구개발비)\n으로 인식하여야 함에도 임상용역업체의 주요계약단계 완료시점에 인식함으로써\n회계처리오류가 발생함\n\n지적 근거 및 판단 내용:\n기업회계기준서 제1001호(재무제표 표시) 문단 27에 따르면, 기업은 발생기준 회계를\n사용하여 재무제표를 작성하고, 각 항목이 ‘개념체계’의 정의와 인식요건을 충족할 때\n자산, 부채, 자본, 광의의 수익 및 비용(재무제표의 요소)으로 인식하도록 규정하고\n있음\n\n감사절차 미흡사항:\n동 지적사례는 재무제표에 대한 심사로 종결되어 감사보고서 감리는 실시하지 아니함\n- 32 -\n\n시사점:\n회사는 임상용역비를 인식함에 있어 계약서상 형식적인 요건이 아니라 경제적 실질에\n따라 발생한 시점에 비용을 인식하여야 하며 관련 회계처리기준을 숙지하여야 함"
    },
    {
      "paragraph_id": "KICPA-2020-19",
      "case_id": "KICPA-2020-19",
      "case_title": "연결재무제표 미작성",
      "metadata": {
        "decision_year": "2020",
        "accounting_period": "’17.1.1.∼’17.12.31.\n1. 회사의 회계처리\n회사는 연결재무제표 작성대상의 범위에 해당하는 종속기업(A회사, 86.6% 지분소유)을\n연결한 연결재무제표를 작성․공시하지 아니하여, 자산․부채 및 연결당기순이익을 과소\n계상함\n2. 회계기준 위반 지적 내용\n회사는 ‘17년 8월에 대여금의 출자전환을 통하여 피투자회사인 A회사의 발행주식\n1,170,000주를 추가취득하여 동 피투자회사에 대한 회사의 지분율이 50%에서 86.6%로\n증가하였으며,\nA회사는 ‘16년 말 자산총액이 151억으로 ‘17년 말 기준 회사의 연결대상 종속기업에\n해당함에도 회사는 ‘17년 중 A회사에 대한 지분을 추가로 취득한 사실을 간과하여\n피투자회사가 연결대상 종속기업이 된다는 사실을 인지하여 못하여 연결재무제표를\n작성․공시하지 아니함\n3. 지적 근거 및 판단 내용\n일반기업회계기준 제4장(연결재무제표) 문단 4.2에 따르면 지배기업은 종속기업투자를\n연결한 연결재무제표를 작성해야하며 연결재무제표는 지배기업의 모든 종속기업을\n포함하도록 규정하고 있음\n- 33 -\n4. 감사절차 미흡사항\n회계감사기준 200(독립된 감사인의 전반목적 및 감사기준에 따른 감사의 수행), 500\n(감사증거)과 700(재무제표에 대한 의견형성과 보고) 등에 따르면 감사인은 재무제표\n를 중요하게 왜곡표시 시킬 수 있는 상황이 존재할 수 있다는 전문가적인 의구심을\n가지고 감사업무를 계획하고 수행하여야 하며, 감사인은 감사의견 형성의 기초가 될\n합리적인 감사결론을 도출할 수 있도록 충분하고 적합한 감사증거를 확보하여야 하고,\n재무제표가 일반적으로 인정된 회계처리기준에 따라 중요성의 관점에서 적정하게 표시\n되고 있다고 판단했을 경우에만 적정의견을 표명하도록 규정되어 있음에도,\n감사인은 당기중 대여금의 출자전환을 통하여 지분법적용 피투자회사에 대한 지분을\n추가로 취득한 사실을 간과하여 피투자회사가 연결대상종속회사에 해당한다는 사실을\n인지하지 못하는 등 연결재무제표 작성대상여부에 대한 감사절차를 소홀히 하여 회사의\n회계처리 오류를 지적하지 못함\n5. 시사점\n회사는 종속기업의 지분변동현황을 관리하여 매년도말 연결대상여부를 확인할 수\n있는 내부통제절차를 강화할 필요가 있고 연결재무제표 관련 기준서를 숙지하여야 함\n감사인은 종속기업투자 및 지분법적용투자회사들에 대한 당기지분변동과 관련한 증빙을\n확인하고 연결대상종속기업의 해당여부에 대한 검토절차를 면밀히 수행하여야 함",
        "issue_fields": [
          "연결재무제표 작성"
        ],
        "related_standards": [
          "일반기업회계기준 제4장(연결재무제표)"
        ],
        "case_type": "회계감리지적사례",
        "source": "KICPA 심사·감리 지적사례"
      },
      "content": {
        "section_1_company_accounting": {
          "section_title": "회사의 회계처리",
          "content": "회사는 연결재무제표 작성대상의 범위에 해당하는 종속기업(A회사, 86.6% 지분소유)을\n연결한 연결재무제표를 작성․공시하지 아니하여, 자산․부채 및 연결당기순이익을 과소\n계상함"
        },
        "section_2_violation_details": {
          "section_title": "회계기준 위반 지적 내용",
          "content": "회사는 ‘17년 8월에 대여금의 출자전환을 통하여 피투자회사인 A회사의 발행주식\n1,170,000주를 추가취득하여 동 피투자회사에 대한 회사의 지분율이 50%에서 86.6%로\n증가하였으며,\nA회사는 ‘16년 말 자산총액이 151억으로 ‘17년 말 기준 회사의 연결대상 종속기업에\n해당함에도 회사는 ‘17년 중 A회사에 대한 지분을 추가로 취득한 사실을 간과하여\n피투자회사가 연결대상 종속기업이 된다는 사실을 인지하여 못하여 연결재무제표를\n작성․공시하지 아니함"
        },
        "section_3_basis_judgment": {
          "section_title": "지적 근거 및 판단 내용",
          "content": "일반기업회계기준 제4장(연결재무제표) 문단 4.2에 따르면 지배기업은 종속기업투자를\n연결한 연결재무제표를 작성해야하며 연결재무제표는 지배기업의 모든 종속기업을\n포함하도록 규정하고 있음\n- 33 -"
        },
        "section_4_audit_procedure": {
          "section_title": "감사절차 미흡사항",
          "content": "회계감사기준 200(독립된 감사인의 전반목적 및 감사기준에 따른 감사의 수행), 500\n(감사증거)과 700(재무제표에 대한 의견형성과 보고) 등에 따르면 감사인은 재무제표\n를 중요하게 왜곡표시 시킬 수 있는 상황이 존재할 수 있다는 전문가적인 의구심을\n가지고 감사업무를 계획하고 수행하여야 하며, 감사인은 감사의견 형성의 기초가 될\n합리적인 감사결론을 도출할 수 있도록 충분하고 적합한 감사증거를 확보하여야 하고,\n재무제표가 일반적으로 인정된 회계처리기준에 따라 중요성의 관점에서 적정하게 표시\n되고 있다고 판단했을 경우에만 적정의견을 표명하도록 규정되어 있음에도,\n감사인은 당기중 대여금의 출자전환을 통하여 지분법적용 피투자회사에 대한 지분을\n추가로 취득한 사실을 간과하여 피투자회사가 연결대상종속회사에 해당한다는 사실을\n인지하지 못하는 등 연결재무제표 작성대상여부에 대한 감사절차를 소홀히 하여 회사의\n회계처리 오류를 지적하지 못함"
        },
        "section_5_implications": {
          "section_title": "시사점",
          "content": "회사는 종속기업의 지분변동현황을 관리하여 매년도말 연결대상여부를 확인할 수\n있는 내부통제절차를 강화할 필요가 있고 연결재무제표 관련 기준서를 숙지하여야 함\n감사인은 종속기업투자 및 지분법적용투자회사들에 대한 당기지분변동과 관련한 증빙을\n확인하고 연결대상종속기업의 해당여부에 대한 검토절차를 면밀히 수행하여야 함"
        }
      },
      "indexed_content": "케이스 ID: KICPA-2020-19\n제목: 연결재무제표 미작성\n결정연도: 2020년\n회계결산일: ’17.1.1.∼’17.12.31.\n1. 회사의 회계처리\n회사는 연결재무제표 작성대상의 범위에 해당하는 종속기업(A회사, 86.6% 지분소유)을\n연결한 연결재무제표를 작성․공시하지 아니하여, 자산․부채 및 연결당기순이익을 과소\n계상함\n2. 회계기준 위반 지적 내용\n회사는 ‘17년 8월에 대여금의 출자전환을 통하여 피투자회사인 A회사의 발행주식\n1,170,000주를 추가취득하여 동 피투자회사에 대한 회사의 지분율이 50%에서 86.6%로\n증가하였으며,\nA회사는 ‘16년 말 자산총액이 151억으로 ‘17년 말 기준 회사의 연결대상 종속기업에\n해당함에도 회사는 ‘17년 중 A회사에 대한 지분을 추가로 취득한 사실을 간과하여\n피투자회사가 연결대상 종속기업이 된다는 사실을 인지하여 못하여 연결재무제표를\n작성․공시하지 아니함\n3. 지적 근거 및 판단 내용\n일반기업회계기준 제4장(연결재무제표) 문단 4.2에 따르면 지배기업은 종속기업투자를\n연결한 연결재무제표를 작성해야하며 연결재무제표는 지배기업의 모든 종속기업을\n포함하도록 규정하고 있음\n- 33 -\n4. 감사절차 미흡사항\n회계감사기준 200(독립된 감사인의 전반목적 및 감사기준에 따른 감사의 수행), 500\n(감사증거)과 700(재무제표에 대한 의견형성과 보고) 등에 따르면 감사인은 재무제표\n를 중요하게 왜곡표시 시킬 수 있는 상황이 존재할 수 있다는 전문가적인 의구심을\n가지고 감사업무를 계획하고 수행하여야 하며, 감사인은 감사의견 형성의 기초가 될\n합리적인 감사결론을 도출할 수 있도록 충분하고 적합한 감사증거를 확보하여야 하고,\n재무제표가 일반적으로 인정된 회계처리기준에 따라 중요성의 관점에서 적정하게 표시\n되고 있다고 판단했을 경우에만 적정의견을 표명하도록 규정되어 있음에도,\n감사인은 당기중 대여금의 출자전환을 통하여 지분법적용 피투자회사에 대한 지분을\n추가로 취득한 사실을 간과하여 피투자회사가 연결대상종속회사에 해당한다는 사실을\n인지하지 못하는 등 연결재무제표 작성대상여부에 대한 감사절차를 소홀히 하여 회사의\n회계처리 오류를 지적하지 못함\n5. 시사점\n회사는 종속기업의 지분변동현황을 관리하여 매년도말 연결대상여부를 확인할 수\n있는 내부통제절차를 강화할 필요가 있고 연결재무제표 관련 기준서를 숙지하여야 함\n감사인은 종속기업투자 및 지분법적용투자회사들에 대한 당기지분변동과 관련한 증빙을\n확인하고 연결대상종속기업의 해당여부에 대한 검토절차를 면밀히 수행하여야 함\n쟁점분야: 연결재무제표 작성\n관련기준: 일반기업회계기준 제4장(연결재무제표)\n\n회사의 회계처리:\n회사는 연결재무제표 작성대상의 범위에 해당하는 종속기업(A회사, 86.6% 지분소유)을\n연결한 연결재무제표를 작성․공시하지 아니하여, 자산․부채 및 연결당기순이익을 과소\n계상함\n\n회계기준 위반 지적 내용:\n회사는 ‘17년 8월에 대여금의 출자전환을 통하여 피투자회사인 A회사의 발행주식\n1,170,000주를 추가취득하여 동 피투자회사에 대한 회사의 지분율이 50%에서 86.6%로\n증가하였으며,\nA회사는 ‘16년 말 자산총액이 151억으로 ‘17년 말 기준 회사의 연결대상 종속기업에\n해당함에도 회사는 ‘17년 중 A회사에 대한 지분을 추가로 취득한 사실을 간과하여\n피투자회사가 연결대상 종속기업이 된다는 사실을 인지하여 못하여 연결재무제표를\n작성․공시하지 아니함\n\n지적 근거 및 판단 내용:\n일반기업회계기준 제4장(연결재무제표) 문단 4.2에 따르면 지배기업은 종속기업투자를\n연결한 연결재무제표를 작성해야하며 연결재무제표는 지배기업의 모든 종속기업을\n포함하도록 규정하고 있음\n- 33 -\n\n감사절차 미흡사항:\n회계감사기준 200(독립된 감사인의 전반목적 및 감사기준에 따른 감사의 수행), 500\n(감사증거)과 700(재무제표에 대한 의견형성과 보고) 등에 따르면 감사인은 재무제표\n를 중요하게 왜곡표시 시킬 수 있는 상황이 존재할 수 있다는 전문가적인 의구심을\n가지고 감사업무를 계획하고 수행하여야 하며, 감사인은 감사의견 형성의 기초가 될\n합리적인 감사결론을 도출할 수 있도록 충분하고 적합한 감사증거를 확보하여야 하고,\n재무제표가 일반적으로 인정된 회계처리기준에 따라 중요성의 관점에서 적정하게 표시\n되고 있다고 판단했을 경우에만 적정의견을 표명하도록 규정되어 있음에도,\n감사인은 당기중 대여금의 출자전환을 통하여 지분법적용 피투자회사에 대한 지분을\n추가로 취득한 사실을 간과하여 피투자회사가 연결대상종속회사에 해당한다는 사실을\n인지하지 못하는 등 연결재무제표 작성대상여부에 대한 감사절차를 소홀히 하여 회사의\n회계처리 오류를 지적하지 못함\n\n시사점:\n회사는 종속기업의 지분변동현황을 관리하여 매년도말 연결대상여부를 확인할 수\n있는 내부통제절차를 강화할 필요가 있고 연결재무제표 관련 기준서를 숙지하여야 함\n감사인은 종속기업투자 및 지분법적용투자회사들에 대한 당기지분변동과 관련한 증빙을\n확인하고 연결대상종속기업의 해당여부에 대한 검토절차를 면밀히 수행하여야 함"
    },
    {
      "paragraph_id": "KICPA-2020-20",
      "case_id": "KICPA-2020-20",
      "case_title": "종속기업 회계기준위반에 따른 연결재무제표 오류",
      "metadata": {
        "decision_year": "2020",
        "accounting_period": "’09.1.1.∼’13.12.31.\n1. 회사의 회계처리\n회사는 종속기업인 A법인이 유형자산을 허위로 계상하고 이에 대한 감가상각비를\n- 34 -\n잘못 인식한 재무제표를 기초로 연결재무제표를 작성함으로써 자기자본 등을 과대계상함\n2. 회계기준 위반 지적 내용\n회사의 종속기업인 A법인은 해외 건설공사를 수주하여 진행중 발주처 사정으로 공사\n일정이 지연되면서 ‘08년 중 추진한 차량운반구와 건설용장비(266억원 규모) 매입을 ’09년\n중 취소하였으나,\n- 매입한 자산의 취득이 완료되지 아니하여 유형자산으로 계상할 수 없었음에도 A\n법인은 기지급한 금액을 유형자산으로 계상하고 관련 감가상각비를 비용으로 인식\n하였으며 구매가 취소되어 입금된 금액을 외상매입금으로 처리함\n- A법인은 ‘10년 중 구매취소된 유형자산(181억원)이 자산으로 계상된 사실을 발견\n하고 이에 대해 정정 회계처리를 하였으나 이를 구매자산의 취소가 아닌 기존자산의\n매각으로 처리하였으며, 구매취소분 중 일부는 발견하지 못하여 이에 대해 정정하지\n않음으로써 A법인의 재무제표상 유형자산 및 관련 자산․부채가 과대 계상됨\nA법인 임직원들에 의해 재무제표 관련 회계처리가 이루어지는 과정에서 잘못 작성된\nA법인의 재무제표의 오류가 회사의 연결재무제표로 전이되었으며 그 결과 회사의 연결\n재무제표에 동일한 오류가 발생하였음\n3. 지적 근거 및 판단 내용\n기업회계기준서 제1001호(재무제표 표시) 문단 15에 따르면 재무제표는 기업의 재무\n상태, 재무성과 및 현금흐름을 공정하게 표시해야 하고, 공정한 표시를 위해서는 ‘개념\n체계’에서 정한 자산, 부채, 수익 및 비용에 대한 정의와 인식요건에 따라 거래, 그 밖의\n사건과 상황의 효과를 충실하게 표현하도록 규정하고 있으며,\n기업회계기준서 제1016호(유형자산) 문단 7에 따르면 유형자산으로 인식되기 위해서는\n(1) 자산으로부터 발생하는 미래경제적효익이 기업에 유입될 가능성이 높고 (2) 자산의\n원가를 신뢰성 있게 측정할 수 있는 경우에만 인식하도록 규정하고 있음\n4. 감사절차 미흡사항\n회계감사기준 200(독립된 감사인의 전반목적 및 감사기준에 따른 감사의 수행), 500\n(감사증거)과 700(재무제표에 대한 의견형성과 보고) 등에 따르면 감사인은 재무제표를\n중요하게 왜곡표시 시킬 수 있는 상황이 존재할 수 있다는 전문가적인 의구심을 가지고\n- 35 -\n감사업무를 계획하고 수행하여야 하며, 감사인은 감사의견 형성의 기초가 될 합리적인\n감사결론을 도출할 수 있도록 충분하고 적합한 감사증거를 확보하여야 하고, 재무제표가\n일반적으로 인정된 회계처리기준에 따라 중요성의 관점에서 적정하게 표시되고 있다고\n판단했을 경우에만 적정의견을 표명하도록 규정되어 있음에도,\n감사인은 종속기업인 A법인과 동일한 감사인으로, A법인에 대한 감사시 ‘08년 유형자산\n취득의 발생사실 확인을 위한 선적서류 등을 확인하지 않았고, ‘10년 유형자산의 매각과\n관련하여 매각증빙확인 및 관련 추가적인 감사절차를 수행하지 않아 종속기업 재무제표\n및 회사 연결재무제표의 회계처리오류를 지적하지 못함\n5. 시사점\n회사는 종속법인이 작성한 재무제표의 신뢰성 검증을 위한 내부통제를 강화할 필요가\n있고 결산시 종속기업재무제표의 유의적인 변동내역을 확인하는 결산절차를 수립\n하여야 함\n감사인은 해외거래의 경우 유형자산 취득의 발생사실 확인을 위해 선적서류 등의 증빙을\n확인할 필요가 있고 유형자산 매각과 관련한 매각계약서 및 입금증빙의 자료를 면밀히\n검토할 필요가 있음\n- 36 -\n2 자산‧부채, 수익‧비용, 영업현금흐름 과대(소)계상(B유형)",
        "issue_fields": [
          "연결재무제표 작성"
        ],
        "related_standards": [
          "기업회계기준서 제1001호(재무제표 표시)",
          "제1016호(유형자산)"
        ],
        "case_type": "회계감리지적사례",
        "source": "KICPA 심사·감리 지적사례"
      },
      "content": {
        "section_1_company_accounting": {
          "section_title": "회사의 회계처리",
          "content": "회사는 종속기업인 A법인이 유형자산을 허위로 계상하고 이에 대한 감가상각비를\n- 34 -\n잘못 인식한 재무제표를 기초로 연결재무제표를 작성함으로써 자기자본 등을 과대계상함"
        },
        "section_2_violation_details": {
          "section_title": "회계기준 위반 지적 내용",
          "content": "회사의 종속기업인 A법인은 해외 건설공사를 수주하여 진행중 발주처 사정으로 공사\n일정이 지연되면서 ‘08년 중 추진한 차량운반구와 건설용장비(266억원 규모) 매입을 ’09년\n중 취소하였으나,\n- 매입한 자산의 취득이 완료되지 아니하여 유형자산으로 계상할 수 없었음에도 A\n법인은 기지급한 금액을 유형자산으로 계상하고 관련 감가상각비를 비용으로 인식\n하였으며 구매가 취소되어 입금된 금액을 외상매입금으로 처리함\n- A법인은 ‘10년 중 구매취소된 유형자산(181억원)이 자산으로 계상된 사실을 발견\n하고 이에 대해 정정 회계처리를 하였으나 이를 구매자산의 취소가 아닌 기존자산의\n매각으로 처리하였으며, 구매취소분 중 일부는 발견하지 못하여 이에 대해 정정하지\n않음으로써 A법인의 재무제표상 유형자산 및 관련 자산․부채가 과대 계상됨\nA법인 임직원들에 의해 재무제표 관련 회계처리가 이루어지는 과정에서 잘못 작성된\nA법인의 재무제표의 오류가 회사의 연결재무제표로 전이되었으며 그 결과 회사의 연결\n재무제표에 동일한 오류가 발생하였음"
        },
        "section_3_basis_judgment": {
          "section_title": "지적 근거 및 판단 내용",
          "content": "기업회계기준서 제1001호(재무제표 표시) 문단 15에 따르면 재무제표는 기업의 재무\n상태, 재무성과 및 현금흐름을 공정하게 표시해야 하고, 공정한 표시를 위해서는 ‘개념\n체계’에서 정한 자산, 부채, 수익 및 비용에 대한 정의와 인식요건에 따라 거래, 그 밖의\n사건과 상황의 효과를 충실하게 표현하도록 규정하고 있으며,\n기업회계기준서 제1016호(유형자산) 문단 7에 따르면 유형자산으로 인식되기 위해서는\n(1) 자산으로부터 발생하는 미래경제적효익이 기업에 유입될 가능성이 높고 (2) 자산의\n원가를 신뢰성 있게 측정할 수 있는 경우에만 인식하도록 규정하고 있음"
        },
        "section_4_audit_procedure": {
          "section_title": "감사절차 미흡사항",
          "content": "회계감사기준 200(독립된 감사인의 전반목적 및 감사기준에 따른 감사의 수행), 500\n(감사증거)과 700(재무제표에 대한 의견형성과 보고) 등에 따르면 감사인은 재무제표를\n중요하게 왜곡표시 시킬 수 있는 상황이 존재할 수 있다는 전문가적인 의구심을 가지고\n- 35 -\n감사업무를 계획하고 수행하여야 하며, 감사인은 감사의견 형성의 기초가 될 합리적인\n감사결론을 도출할 수 있도록 충분하고 적합한 감사증거를 확보하여야 하고, 재무제표가\n일반적으로 인정된 회계처리기준에 따라 중요성의 관점에서 적정하게 표시되고 있다고\n판단했을 경우에만 적정의견을 표명하도록 규정되어 있음에도,\n감사인은 종속기업인 A법인과 동일한 감사인으로, A법인에 대한 감사시 ‘08년 유형자산\n취득의 발생사실 확인을 위한 선적서류 등을 확인하지 않았고, ‘10년 유형자산의 매각과\n관련하여 매각증빙확인 및 관련 추가적인 감사절차를 수행하지 않아 종속기업 재무제표\n및 회사 연결재무제표의 회계처리오류를 지적하지 못함"
        },
        "section_5_implications": {
          "section_title": "시사점",
          "content": "회사는 종속법인이 작성한 재무제표의 신뢰성 검증을 위한 내부통제를 강화할 필요가\n있고 결산시 종속기업재무제표의 유의적인 변동내역을 확인하는 결산절차를 수립\n하여야 함\n감사인은 해외거래의 경우 유형자산 취득의 발생사실 확인을 위해 선적서류 등의 증빙을\n확인할 필요가 있고 유형자산 매각과 관련한 매각계약서 및 입금증빙의 자료를 면밀히\n검토할 필요가 있음\n- 36 -\n2 자산‧부채, 수익‧비용, 영업현금흐름 과대(소)계상(B유형)"
        }
      },
      "indexed_content": "케이스 ID: KICPA-2020-20\n제목: 종속기업 회계기준위반에 따른 연결재무제표 오류\n결정연도: 2020년\n회계결산일: ’09.1.1.∼’13.12.31.\n1. 회사의 회계처리\n회사는 종속기업인 A법인이 유형자산을 허위로 계상하고 이에 대한 감가상각비를\n- 34 -\n잘못 인식한 재무제표를 기초로 연결재무제표를 작성함으로써 자기자본 등을 과대계상함\n2. 회계기준 위반 지적 내용\n회사의 종속기업인 A법인은 해외 건설공사를 수주하여 진행중 발주처 사정으로 공사\n일정이 지연되면서 ‘08년 중 추진한 차량운반구와 건설용장비(266억원 규모) 매입을 ’09년\n중 취소하였으나,\n- 매입한 자산의 취득이 완료되지 아니하여 유형자산으로 계상할 수 없었음에도 A\n법인은 기지급한 금액을 유형자산으로 계상하고 관련 감가상각비를 비용으로 인식\n하였으며 구매가 취소되어 입금된 금액을 외상매입금으로 처리함\n- A법인은 ‘10년 중 구매취소된 유형자산(181억원)이 자산으로 계상된 사실을 발견\n하고 이에 대해 정정 회계처리를 하였으나 이를 구매자산의 취소가 아닌 기존자산의\n매각으로 처리하였으며, 구매취소분 중 일부는 발견하지 못하여 이에 대해 정정하지\n않음으로써 A법인의 재무제표상 유형자산 및 관련 자산․부채가 과대 계상됨\nA법인 임직원들에 의해 재무제표 관련 회계처리가 이루어지는 과정에서 잘못 작성된\nA법인의 재무제표의 오류가 회사의 연결재무제표로 전이되었으며 그 결과 회사의 연결\n재무제표에 동일한 오류가 발생하였음\n3. 지적 근거 및 판단 내용\n기업회계기준서 제1001호(재무제표 표시) 문단 15에 따르면 재무제표는 기업의 재무\n상태, 재무성과 및 현금흐름을 공정하게 표시해야 하고, 공정한 표시를 위해서는 ‘개념\n체계’에서 정한 자산, 부채, 수익 및 비용에 대한 정의와 인식요건에 따라 거래, 그 밖의\n사건과 상황의 효과를 충실하게 표현하도록 규정하고 있으며,\n기업회계기준서 제1016호(유형자산) 문단 7에 따르면 유형자산으로 인식되기 위해서는\n(1) 자산으로부터 발생하는 미래경제적효익이 기업에 유입될 가능성이 높고 (2) 자산의\n원가를 신뢰성 있게 측정할 수 있는 경우에만 인식하도록 규정하고 있음\n4. 감사절차 미흡사항\n회계감사기준 200(독립된 감사인의 전반목적 및 감사기준에 따른 감사의 수행), 500\n(감사증거)과 700(재무제표에 대한 의견형성과 보고) 등에 따르면 감사인은 재무제표를\n중요하게 왜곡표시 시킬 수 있는 상황이 존재할 수 있다는 전문가적인 의구심을 가지고\n- 35 -\n감사업무를 계획하고 수행하여야 하며, 감사인은 감사의견 형성의 기초가 될 합리적인\n감사결론을 도출할 수 있도록 충분하고 적합한 감사증거를 확보하여야 하고, 재무제표가\n일반적으로 인정된 회계처리기준에 따라 중요성의 관점에서 적정하게 표시되고 있다고\n판단했을 경우에만 적정의견을 표명하도록 규정되어 있음에도,\n감사인은 종속기업인 A법인과 동일한 감사인으로, A법인에 대한 감사시 ‘08년 유형자산\n취득의 발생사실 확인을 위한 선적서류 등을 확인하지 않았고, ‘10년 유형자산의 매각과\n관련하여 매각증빙확인 및 관련 추가적인 감사절차를 수행하지 않아 종속기업 재무제표\n및 회사 연결재무제표의 회계처리오류를 지적하지 못함\n5. 시사점\n회사는 종속법인이 작성한 재무제표의 신뢰성 검증을 위한 내부통제를 강화할 필요가\n있고 결산시 종속기업재무제표의 유의적인 변동내역을 확인하는 결산절차를 수립\n하여야 함\n감사인은 해외거래의 경우 유형자산 취득의 발생사실 확인을 위해 선적서류 등의 증빙을\n확인할 필요가 있고 유형자산 매각과 관련한 매각계약서 및 입금증빙의 자료를 면밀히\n검토할 필요가 있음\n- 36 -\n2 자산‧부채, 수익‧비용, 영업현금흐름 과대(소)계상(B유형)\n쟁점분야: 연결재무제표 작성\n관련기준: 기업회계기준서 제1001호(재무제표 표시), 제1016호(유형자산)\n\n회사의 회계처리:\n회사는 종속기업인 A법인이 유형자산을 허위로 계상하고 이에 대한 감가상각비를\n- 34 -\n잘못 인식한 재무제표를 기초로 연결재무제표를 작성함으로써 자기자본 등을 과대계상함\n\n회계기준 위반 지적 내용:\n회사의 종속기업인 A법인은 해외 건설공사를 수주하여 진행중 발주처 사정으로 공사\n일정이 지연되면서 ‘08년 중 추진한 차량운반구와 건설용장비(266억원 규모) 매입을 ’09년\n중 취소하였으나,\n- 매입한 자산의 취득이 완료되지 아니하여 유형자산으로 계상할 수 없었음에도 A\n법인은 기지급한 금액을 유형자산으로 계상하고 관련 감가상각비를 비용으로 인식\n하였으며 구매가 취소되어 입금된 금액을 외상매입금으로 처리함\n- A법인은 ‘10년 중 구매취소된 유형자산(181억원)이 자산으로 계상된 사실을 발견\n하고 이에 대해 정정 회계처리를 하였으나 이를 구매자산의 취소가 아닌 기존자산의\n매각으로 처리하였으며, 구매취소분 중 일부는 발견하지 못하여 이에 대해 정정하지\n않음으로써 A법인의 재무제표상 유형자산 및 관련 자산․부채가 과대 계상됨\nA법인 임직원들에 의해 재무제표 관련 회계처리가 이루어지는 과정에서 잘못 작성된\nA법인의 재무제표의 오류가 회사의 연결재무제표로 전이되었으며 그 결과 회사의 연결\n재무제표에 동일한 오류가 발생하였음\n\n지적 근거 및 판단 내용:\n기업회계기준서 제1001호(재무제표 표시) 문단 15에 따르면 재무제표는 기업의 재무\n상태, 재무성과 및 현금흐름을 공정하게 표시해야 하고, 공정한 표시를 위해서는 ‘개념\n체계’에서 정한 자산, 부채, 수익 및 비용에 대한 정의와 인식요건에 따라 거래, 그 밖의\n사건과 상황의 효과를 충실하게 표현하도록 규정하고 있으며,\n기업회계기준서 제1016호(유형자산) 문단 7에 따르면 유형자산으로 인식되기 위해서는\n(1) 자산으로부터 발생하는 미래경제적효익이 기업에 유입될 가능성이 높고 (2) 자산의\n원가를 신뢰성 있게 측정할 수 있는 경우에만 인식하도록 규정하고 있음\n\n감사절차 미흡사항:\n회계감사기준 200(독립된 감사인의 전반목적 및 감사기준에 따른 감사의 수행), 500\n(감사증거)과 700(재무제표에 대한 의견형성과 보고) 등에 따르면 감사인은 재무제표를\n중요하게 왜곡표시 시킬 수 있는 상황이 존재할 수 있다는 전문가적인 의구심을 가지고\n- 35 -\n감사업무를 계획하고 수행하여야 하며, 감사인은 감사의견 형성의 기초가 될 합리적인\n감사결론을 도출할 수 있도록 충분하고 적합한 감사증거를 확보하여야 하고, 재무제표가\n일반적으로 인정된 회계처리기준에 따라 중요성의 관점에서 적정하게 표시되고 있다고\n판단했을 경우에만 적정의견을 표명하도록 규정되어 있음에도,\n감사인은 종속기업인 A법인과 동일한 감사인으로, A법인에 대한 감사시 ‘08년 유형자산\n취득의 발생사실 확인을 위한 선적서류 등을 확인하지 않았고, ‘10년 유형자산의 매각과\n관련하여 매각증빙확인 및 관련 추가적인 감사절차를 수행하지 않아 종속기업 재무제표\n및 회사 연결재무제표의 회계처리오류를 지적하지 못함\n\n시사점:\n회사는 종속법인이 작성한 재무제표의 신뢰성 검증을 위한 내부통제를 강화할 필요가\n있고 결산시 종속기업재무제표의 유의적인 변동내역을 확인하는 결산절차를 수립\n하여야 함\n감사인은 해외거래의 경우 유형자산 취득의 발생사실 확인을 위해 선적서류 등의 증빙을\n확인할 필요가 있고 유형자산 매각과 관련한 매각계약서 및 입금증빙의 자료를 면밀히\n검토할 필요가 있음\n- 36 -\n2 자산‧부채, 수익‧비용, 영업현금흐름 과대(소)계상(B유형)"
    },
    {
      "paragraph_id": "KICPA-2020-21",
      "case_id": "KICPA-2020-21",
      "case_title": "재고자산과 유형자산의 계정분류 오류 등",
      "metadata": {
        "decision_year": "2020",
        "accounting_period": "’17.1.1.∼’18.12.31.\n1. 회사의 회계처리\n회사는 장기간 임대중인 공동주택을 유형자산이 아닌 재고자산으로 잘못 분류하고\n임대건물에 대한 감가상각비를 계상하지 아니함\n2. 회계기준 위반 지적 내용\n회사는 공동주택을 리모델링하여 재판매하는 사업을 하고 있으며,\n- ‘13년에 공동주택을 완공하였으나, 판매가 계획대로 이루어지지 않아 미판매된 주택\n중 일부를 장기간 임대로 사용하였음에도, 임대로 사용한 공동주택을 재고자산에서\n유형자산으로 계정재분류하지 아니하고 임대건물에 대한 감가상각비를 계상하지\n아니함으로써 회계처리오류가 발생함\n3. 지적 근거 및 판단 내용\n일반기업회계기준 제10장(유형자산) 문단 10.4 및 문단 10.32에 따르면 ‘유형자산’은\n재화의 생산, 용역의 제공, 타인에 대한 임대 또는 자체적으로 사용할 목적으로 보유\n하는 물리적 형체가 있는 자산으로서, 1년을 초과하여 사용할 것으로 예상되는 자산을\n말하며, 유형자산의 감가상각대상금액은 내용연수에 걸쳐 합리적이고 체계적인 방법\n으로 배분하고 각 기간의 감가상각액은 다른 자산의 장부금액에 포함되는 경우가 아니\n라면 당기손익으로 인식도록 규정하고 있음\n4. 감사절차 미흡사항\n동 지적사례는 재무제표에 대한 심사로 종결되어 감사보고서 감리는 실시하지 아니함\n- 37 -\n5. 시사점\n회사는 판매를 목적으로 완공한 부동산이더라도 미분양되어 임대용으로 사용하는 경우\n에는 유형자산으로 재분류하고 관련 감가상각비를 계상하여야 하며, 관련 기준서를\n숙지하여야 함",
        "issue_fields": [
          "임대중인 미분양 건물의 계정분류"
        ],
        "related_standards": [
          "일반기업회계기준 제10장(유형자산)"
        ],
        "case_type": "회계감리지적사례",
        "source": "KICPA 심사·감리 지적사례"
      },
      "content": {
        "section_1_company_accounting": {
          "section_title": "회사의 회계처리",
          "content": "회사는 장기간 임대중인 공동주택을 유형자산이 아닌 재고자산으로 잘못 분류하고\n임대건물에 대한 감가상각비를 계상하지 아니함"
        },
        "section_2_violation_details": {
          "section_title": "회계기준 위반 지적 내용",
          "content": "회사는 공동주택을 리모델링하여 재판매하는 사업을 하고 있으며,\n- ‘13년에 공동주택을 완공하였으나, 판매가 계획대로 이루어지지 않아 미판매된 주택\n중 일부를 장기간 임대로 사용하였음에도, 임대로 사용한 공동주택을 재고자산에서\n유형자산으로 계정재분류하지 아니하고 임대건물에 대한 감가상각비를 계상하지\n아니함으로써 회계처리오류가 발생함"
        },
        "section_3_basis_judgment": {
          "section_title": "지적 근거 및 판단 내용",
          "content": "일반기업회계기준 제10장(유형자산) 문단 10.4 및 문단 10.32에 따르면 ‘유형자산’은\n재화의 생산, 용역의 제공, 타인에 대한 임대 또는 자체적으로 사용할 목적으로 보유\n하는 물리적 형체가 있는 자산으로서, 1년을 초과하여 사용할 것으로 예상되는 자산을\n말하며, 유형자산의 감가상각대상금액은 내용연수에 걸쳐 합리적이고 체계적인 방법\n으로 배분하고 각 기간의 감가상각액은 다른 자산의 장부금액에 포함되는 경우가 아니\n라면 당기손익으로 인식도록 규정하고 있음"
        },
        "section_4_audit_procedure": {
          "section_title": "감사절차 미흡사항",
          "content": "동 지적사례는 재무제표에 대한 심사로 종결되어 감사보고서 감리는 실시하지 아니함\n- 37 -"
        },
        "section_5_implications": {
          "section_title": "시사점",
          "content": "회사는 판매를 목적으로 완공한 부동산이더라도 미분양되어 임대용으로 사용하는 경우\n에는 유형자산으로 재분류하고 관련 감가상각비를 계상하여야 하며, 관련 기준서를\n숙지하여야 함"
        }
      },
      "indexed_content": "케이스 ID: KICPA-2020-21\n제목: 재고자산과 유형자산의 계정분류 오류 등\n결정연도: 2020년\n회계결산일: ’17.1.1.∼’18.12.31.\n1. 회사의 회계처리\n회사는 장기간 임대중인 공동주택을 유형자산이 아닌 재고자산으로 잘못 분류하고\n임대건물에 대한 감가상각비를 계상하지 아니함\n2. 회계기준 위반 지적 내용\n회사는 공동주택을 리모델링하여 재판매하는 사업을 하고 있으며,\n- ‘13년에 공동주택을 완공하였으나, 판매가 계획대로 이루어지지 않아 미판매된 주택\n중 일부를 장기간 임대로 사용하였음에도, 임대로 사용한 공동주택을 재고자산에서\n유형자산으로 계정재분류하지 아니하고 임대건물에 대한 감가상각비를 계상하지\n아니함으로써 회계처리오류가 발생함\n3. 지적 근거 및 판단 내용\n일반기업회계기준 제10장(유형자산) 문단 10.4 및 문단 10.32에 따르면 ‘유형자산’은\n재화의 생산, 용역의 제공, 타인에 대한 임대 또는 자체적으로 사용할 목적으로 보유\n하는 물리적 형체가 있는 자산으로서, 1년을 초과하여 사용할 것으로 예상되는 자산을\n말하며, 유형자산의 감가상각대상금액은 내용연수에 걸쳐 합리적이고 체계적인 방법\n으로 배분하고 각 기간의 감가상각액은 다른 자산의 장부금액에 포함되는 경우가 아니\n라면 당기손익으로 인식도록 규정하고 있음\n4. 감사절차 미흡사항\n동 지적사례는 재무제표에 대한 심사로 종결되어 감사보고서 감리는 실시하지 아니함\n- 37 -\n5. 시사점\n회사는 판매를 목적으로 완공한 부동산이더라도 미분양되어 임대용으로 사용하는 경우\n에는 유형자산으로 재분류하고 관련 감가상각비를 계상하여야 하며, 관련 기준서를\n숙지하여야 함\n쟁점분야: 임대중인 미분양 건물의 계정분류\n관련기준: 일반기업회계기준 제10장(유형자산)\n\n회사의 회계처리:\n회사는 장기간 임대중인 공동주택을 유형자산이 아닌 재고자산으로 잘못 분류하고\n임대건물에 대한 감가상각비를 계상하지 아니함\n\n회계기준 위반 지적 내용:\n회사는 공동주택을 리모델링하여 재판매하는 사업을 하고 있으며,\n- ‘13년에 공동주택을 완공하였으나, 판매가 계획대로 이루어지지 않아 미판매된 주택\n중 일부를 장기간 임대로 사용하였음에도, 임대로 사용한 공동주택을 재고자산에서\n유형자산으로 계정재분류하지 아니하고 임대건물에 대한 감가상각비를 계상하지\n아니함으로써 회계처리오류가 발생함\n\n지적 근거 및 판단 내용:\n일반기업회계기준 제10장(유형자산) 문단 10.4 및 문단 10.32에 따르면 ‘유형자산’은\n재화의 생산, 용역의 제공, 타인에 대한 임대 또는 자체적으로 사용할 목적으로 보유\n하는 물리적 형체가 있는 자산으로서, 1년을 초과하여 사용할 것으로 예상되는 자산을\n말하며, 유형자산의 감가상각대상금액은 내용연수에 걸쳐 합리적이고 체계적인 방법\n으로 배분하고 각 기간의 감가상각액은 다른 자산의 장부금액에 포함되는 경우가 아니\n라면 당기손익으로 인식도록 규정하고 있음\n\n감사절차 미흡사항:\n동 지적사례는 재무제표에 대한 심사로 종결되어 감사보고서 감리는 실시하지 아니함\n- 37 -\n\n시사점:\n회사는 판매를 목적으로 완공한 부동산이더라도 미분양되어 임대용으로 사용하는 경우\n에는 유형자산으로 재분류하고 관련 감가상각비를 계상하여야 하며, 관련 기준서를\n숙지하여야 함"
    },
    {
      "paragraph_id": "KICPA-2020-22",
      "case_id": "KICPA-2020-22",
      "case_title": "재고자산과 유형자산의 계정분류 오류 등",
      "metadata": {
        "decision_year": "2020",
        "accounting_period": "’15.1.1.∼’18.12.31.\n1. 회사의 회계처리\n회사는 장기간 임대중인 미분양 상가와 연립공동주택을 유형자산이 아닌 재고자산으로\n잘못 분류하고 동 건물에 대한 감가상각비를 계상하지 아니함\n2. 회계기준 위반 지적 내용\n회사는 상가와 공동주택 등을 신축·분양하는 업체로서\n- 상가건물과 연립공동주택을 준공하였으나, 분양이 계획대로 이루어지지 않아 상가\n건물 미분양 호실 전부와 연립공동주택 일부를 각각 장기간 임대로 사용하였음에도,\n- 회계전문지식의 부족 등으로 임대용으로 사용한 이후에도 분양의 의도가 있는 상태\n에서 지속적으로 판매를 위한 활동과 노력을 하고 있어 재고자산으로 분류하는 것이\n옳은 것으로 판단함으로써 임대중인 미분양 상가와 연립공동주택을 유형자산이 아닌\n재고자산으로 잘못 분류하고 동 건물에 대한 감가상각비를 계상하지 아니함\n3. 지적 근거 및 판단 내용\n일반기업회계기준 제7장(재고자산) 문단 7.3 및 제10장(유형자산) 문단 10.4와 10.32에\n따르면 정상적인 영업과정에서 판매를 위하여 보유하는 자산은 재고자산으로 분류하고,\n- 38 -\n타인에 대한 임대 목적으로 보유하는 물리적 형체가 있는 자산으로서 1년을 초과하여\n사용할 것이 예상되는 자산은 유형자산으로 표시하고 내용연수에 걸쳐 감가상각 하도록\n규정하고 있음\n4. 감사절차 미흡사항\n동 지적사례는 재무제표에 대한 심사로 종결되어 감사보고서 감리는 실시하지 아니함\n5. 시사점\n회사는 분양을 목적으로 건물을 신축하였다 하더라도 부동산시장의 여건 등으로 완성\n건물의 전부 또는 일부를 임대용으로 사용하게 되어 경제적 실질이 변경된 경우 준공\n당시의 계정과목인 재고자산을 사후적으로 유형자산으로 변경하고 감가상각비를 계상할\n필요가 있는지 여부에 대하여 관련 회계처리기준을 검토하여야 함\n- 39 -\n3 특수관계자거래, 우발부채 관련 사항 등 주석미기재(C유형)",
        "issue_fields": [
          "임대중인 미분양 건물의 계정분류"
        ],
        "related_standards": [
          "일반기업회계기준 제7장(재고자산)",
          "제10장(유형자산)"
        ],
        "case_type": "회계감리지적사례",
        "source": "KICPA 심사·감리 지적사례"
      },
      "content": {
        "section_1_company_accounting": {
          "section_title": "회사의 회계처리",
          "content": "회사는 장기간 임대중인 미분양 상가와 연립공동주택을 유형자산이 아닌 재고자산으로\n잘못 분류하고 동 건물에 대한 감가상각비를 계상하지 아니함"
        },
        "section_2_violation_details": {
          "section_title": "회계기준 위반 지적 내용",
          "content": "회사는 상가와 공동주택 등을 신축·분양하는 업체로서\n- 상가건물과 연립공동주택을 준공하였으나, 분양이 계획대로 이루어지지 않아 상가\n건물 미분양 호실 전부와 연립공동주택 일부를 각각 장기간 임대로 사용하였음에도,\n- 회계전문지식의 부족 등으로 임대용으로 사용한 이후에도 분양의 의도가 있는 상태\n에서 지속적으로 판매를 위한 활동과 노력을 하고 있어 재고자산으로 분류하는 것이\n옳은 것으로 판단함으로써 임대중인 미분양 상가와 연립공동주택을 유형자산이 아닌\n재고자산으로 잘못 분류하고 동 건물에 대한 감가상각비를 계상하지 아니함"
        },
        "section_3_basis_judgment": {
          "section_title": "지적 근거 및 판단 내용",
          "content": "일반기업회계기준 제7장(재고자산) 문단 7.3 및 제10장(유형자산) 문단 10.4와 10.32에\n따르면 정상적인 영업과정에서 판매를 위하여 보유하는 자산은 재고자산으로 분류하고,\n- 38 -\n타인에 대한 임대 목적으로 보유하는 물리적 형체가 있는 자산으로서 1년을 초과하여\n사용할 것이 예상되는 자산은 유형자산으로 표시하고 내용연수에 걸쳐 감가상각 하도록\n규정하고 있음"
        },
        "section_4_audit_procedure": {
          "section_title": "감사절차 미흡사항",
          "content": "동 지적사례는 재무제표에 대한 심사로 종결되어 감사보고서 감리는 실시하지 아니함"
        },
        "section_5_implications": {
          "section_title": "시사점",
          "content": "회사는 분양을 목적으로 건물을 신축하였다 하더라도 부동산시장의 여건 등으로 완성\n건물의 전부 또는 일부를 임대용으로 사용하게 되어 경제적 실질이 변경된 경우 준공\n당시의 계정과목인 재고자산을 사후적으로 유형자산으로 변경하고 감가상각비를 계상할\n필요가 있는지 여부에 대하여 관련 회계처리기준을 검토하여야 함\n- 39 -\n3 특수관계자거래, 우발부채 관련 사항 등 주석미기재(C유형)"
        }
      },
      "indexed_content": "케이스 ID: KICPA-2020-22\n제목: 재고자산과 유형자산의 계정분류 오류 등\n결정연도: 2020년\n회계결산일: ’15.1.1.∼’18.12.31.\n1. 회사의 회계처리\n회사는 장기간 임대중인 미분양 상가와 연립공동주택을 유형자산이 아닌 재고자산으로\n잘못 분류하고 동 건물에 대한 감가상각비를 계상하지 아니함\n2. 회계기준 위반 지적 내용\n회사는 상가와 공동주택 등을 신축·분양하는 업체로서\n- 상가건물과 연립공동주택을 준공하였으나, 분양이 계획대로 이루어지지 않아 상가\n건물 미분양 호실 전부와 연립공동주택 일부를 각각 장기간 임대로 사용하였음에도,\n- 회계전문지식의 부족 등으로 임대용으로 사용한 이후에도 분양의 의도가 있는 상태\n에서 지속적으로 판매를 위한 활동과 노력을 하고 있어 재고자산으로 분류하는 것이\n옳은 것으로 판단함으로써 임대중인 미분양 상가와 연립공동주택을 유형자산이 아닌\n재고자산으로 잘못 분류하고 동 건물에 대한 감가상각비를 계상하지 아니함\n3. 지적 근거 및 판단 내용\n일반기업회계기준 제7장(재고자산) 문단 7.3 및 제10장(유형자산) 문단 10.4와 10.32에\n따르면 정상적인 영업과정에서 판매를 위하여 보유하는 자산은 재고자산으로 분류하고,\n- 38 -\n타인에 대한 임대 목적으로 보유하는 물리적 형체가 있는 자산으로서 1년을 초과하여\n사용할 것이 예상되는 자산은 유형자산으로 표시하고 내용연수에 걸쳐 감가상각 하도록\n규정하고 있음\n4. 감사절차 미흡사항\n동 지적사례는 재무제표에 대한 심사로 종결되어 감사보고서 감리는 실시하지 아니함\n5. 시사점\n회사는 분양을 목적으로 건물을 신축하였다 하더라도 부동산시장의 여건 등으로 완성\n건물의 전부 또는 일부를 임대용으로 사용하게 되어 경제적 실질이 변경된 경우 준공\n당시의 계정과목인 재고자산을 사후적으로 유형자산으로 변경하고 감가상각비를 계상할\n필요가 있는지 여부에 대하여 관련 회계처리기준을 검토하여야 함\n- 39 -\n3 특수관계자거래, 우발부채 관련 사항 등 주석미기재(C유형)\n쟁점분야: 임대중인 미분양 건물의 계정분류\n관련기준: 일반기업회계기준 제7장(재고자산), 제10장(유형자산)\n\n회사의 회계처리:\n회사는 장기간 임대중인 미분양 상가와 연립공동주택을 유형자산이 아닌 재고자산으로\n잘못 분류하고 동 건물에 대한 감가상각비를 계상하지 아니함\n\n회계기준 위반 지적 내용:\n회사는 상가와 공동주택 등을 신축·분양하는 업체로서\n- 상가건물과 연립공동주택을 준공하였으나, 분양이 계획대로 이루어지지 않아 상가\n건물 미분양 호실 전부와 연립공동주택 일부를 각각 장기간 임대로 사용하였음에도,\n- 회계전문지식의 부족 등으로 임대용으로 사용한 이후에도 분양의 의도가 있는 상태\n에서 지속적으로 판매를 위한 활동과 노력을 하고 있어 재고자산으로 분류하는 것이\n옳은 것으로 판단함으로써 임대중인 미분양 상가와 연립공동주택을 유형자산이 아닌\n재고자산으로 잘못 분류하고 동 건물에 대한 감가상각비를 계상하지 아니함\n\n지적 근거 및 판단 내용:\n일반기업회계기준 제7장(재고자산) 문단 7.3 및 제10장(유형자산) 문단 10.4와 10.32에\n따르면 정상적인 영업과정에서 판매를 위하여 보유하는 자산은 재고자산으로 분류하고,\n- 38 -\n타인에 대한 임대 목적으로 보유하는 물리적 형체가 있는 자산으로서 1년을 초과하여\n사용할 것이 예상되는 자산은 유형자산으로 표시하고 내용연수에 걸쳐 감가상각 하도록\n규정하고 있음\n\n감사절차 미흡사항:\n동 지적사례는 재무제표에 대한 심사로 종결되어 감사보고서 감리는 실시하지 아니함\n\n시사점:\n회사는 분양을 목적으로 건물을 신축하였다 하더라도 부동산시장의 여건 등으로 완성\n건물의 전부 또는 일부를 임대용으로 사용하게 되어 경제적 실질이 변경된 경우 준공\n당시의 계정과목인 재고자산을 사후적으로 유형자산으로 변경하고 감가상각비를 계상할\n필요가 있는지 여부에 대하여 관련 회계처리기준을 검토하여야 함\n- 39 -\n3 특수관계자거래, 우발부채 관련 사항 등 주석미기재(C유형)"
    },
    {
      "paragraph_id": "KICPA-2020-23",
      "case_id": "KICPA-2020-23",
      "case_title": "특수관계자 거래(지급보증) 주석 미기재",
      "metadata": {
        "decision_year": "2020",
        "accounting_period": "’17.1.1.∼’17.12.31.\n1. 회사의 회계처리\n회사는 특수관계자의 단기차입금에 대하여 금융기관에 지급보증을 제공하였음에도 이를\n주석에 기재하지 아니함\n2. 회계기준 위반 지적 내용\n회사의 종속회사인 A사는 ‘17년 5월에 물류단지 개발사업 관련 사업비 조달을 위해\nB저축은행 등 5개 금융기관으로부터 총 140억원을 차입하였으며, 회사는 동 단기차입금에\n대하여 지급보증을 제공하였으나,\n회사는 보증현황 목록 및 관련 문서(이사회입보결의서) 등의 관리가 부실하였고, 지급\n보증 주석기재에 대한 회계처리기준도 정확히 인식하지 못하여 ‘17년 재무제표를 작성·\n공시함에 있어 해당 지급보증의 제공 내용을 주석에 기재하지 아니함\n3. 지적 근거 및 판단 내용\n일반기업회계기준 제25장(특수관계자 공시) 문단 25.9에 따르면 특수관계자에게 제공한\n보증은 공시하도록 규정하고 있음\n4. 감사절차 미흡사항\n회계감사기준 200(독립된 감사인의 전반목적 및 감사기준에 따른 감사의 수행), 500\n(감사증거)과 700(재무제표에 대한 의견형성과 보고) 등에 따르면 감사인은 재무제표를\n중요하게 왜곡표시 시킬 수 있는 상황이 존재할 수 있다는 전문가적인 의구심을 가지고\n감사업무를 계획하고 수행하여야 하며, 감사인은 감사의견 형성의 기초가 될 합리적인\n- 40 -\n감사결론을 도출할 수 있도록 충분하고 적합한 감사증거를 확보하여야 하고, 재무제표가\n일반적으로 인정된 회계처리기준에 따라 중요성의 관점에서 적정하게 표시되고 있다고\n판단했을 경우에만 적정의견을 표명하도록 규정되어 있음에도,\n감사인은 은행연합회 신용정보자료 등에 대한 검토절차를 소홀히 하여 회사의 회계처리\n오류를 지적하지 못함\n5. 시사점\n회사는 지급보증제공시 작성한 이사회의사록 등을 체계적으로 관리하는 내부통제\n절차를 강화할 필요가 있고 지급보증 관련 회계처리 기준서를 숙지하여야 함\n감사인은 은행연합회 신용정보자료에 조회되는 타법인 지급보증내역에 대한 검토절차를\n면밀히 수행하여야 함",
        "issue_fields": [
          "특수관계자 거래 주석공시"
        ],
        "related_standards": [
          "일반기업회계기준 제25장(특수관계자 공시)"
        ],
        "case_type": "회계감리지적사례",
        "source": "KICPA 심사·감리 지적사례"
      },
      "content": {
        "section_1_company_accounting": {
          "section_title": "회사의 회계처리",
          "content": "회사는 특수관계자의 단기차입금에 대하여 금융기관에 지급보증을 제공하였음에도 이를\n주석에 기재하지 아니함"
        },
        "section_2_violation_details": {
          "section_title": "회계기준 위반 지적 내용",
          "content": "회사의 종속회사인 A사는 ‘17년 5월에 물류단지 개발사업 관련 사업비 조달을 위해\nB저축은행 등 5개 금융기관으로부터 총 140억원을 차입하였으며, 회사는 동 단기차입금에\n대하여 지급보증을 제공하였으나,\n회사는 보증현황 목록 및 관련 문서(이사회입보결의서) 등의 관리가 부실하였고, 지급\n보증 주석기재에 대한 회계처리기준도 정확히 인식하지 못하여 ‘17년 재무제표를 작성·\n공시함에 있어 해당 지급보증의 제공 내용을 주석에 기재하지 아니함"
        },
        "section_3_basis_judgment": {
          "section_title": "지적 근거 및 판단 내용",
          "content": "일반기업회계기준 제25장(특수관계자 공시) 문단 25.9에 따르면 특수관계자에게 제공한\n보증은 공시하도록 규정하고 있음"
        },
        "section_4_audit_procedure": {
          "section_title": "감사절차 미흡사항",
          "content": "회계감사기준 200(독립된 감사인의 전반목적 및 감사기준에 따른 감사의 수행), 500\n(감사증거)과 700(재무제표에 대한 의견형성과 보고) 등에 따르면 감사인은 재무제표를\n중요하게 왜곡표시 시킬 수 있는 상황이 존재할 수 있다는 전문가적인 의구심을 가지고\n감사업무를 계획하고 수행하여야 하며, 감사인은 감사의견 형성의 기초가 될 합리적인\n- 40 -\n감사결론을 도출할 수 있도록 충분하고 적합한 감사증거를 확보하여야 하고, 재무제표가\n일반적으로 인정된 회계처리기준에 따라 중요성의 관점에서 적정하게 표시되고 있다고\n판단했을 경우에만 적정의견을 표명하도록 규정되어 있음에도,\n감사인은 은행연합회 신용정보자료 등에 대한 검토절차를 소홀히 하여 회사의 회계처리\n오류를 지적하지 못함"
        },
        "section_5_implications": {
          "section_title": "시사점",
          "content": "회사는 지급보증제공시 작성한 이사회의사록 등을 체계적으로 관리하는 내부통제\n절차를 강화할 필요가 있고 지급보증 관련 회계처리 기준서를 숙지하여야 함\n감사인은 은행연합회 신용정보자료에 조회되는 타법인 지급보증내역에 대한 검토절차를\n면밀히 수행하여야 함"
        }
      },
      "indexed_content": "케이스 ID: KICPA-2020-23\n제목: 특수관계자 거래(지급보증) 주석 미기재\n결정연도: 2020년\n회계결산일: ’17.1.1.∼’17.12.31.\n1. 회사의 회계처리\n회사는 특수관계자의 단기차입금에 대하여 금융기관에 지급보증을 제공하였음에도 이를\n주석에 기재하지 아니함\n2. 회계기준 위반 지적 내용\n회사의 종속회사인 A사는 ‘17년 5월에 물류단지 개발사업 관련 사업비 조달을 위해\nB저축은행 등 5개 금융기관으로부터 총 140억원을 차입하였으며, 회사는 동 단기차입금에\n대하여 지급보증을 제공하였으나,\n회사는 보증현황 목록 및 관련 문서(이사회입보결의서) 등의 관리가 부실하였고, 지급\n보증 주석기재에 대한 회계처리기준도 정확히 인식하지 못하여 ‘17년 재무제표를 작성·\n공시함에 있어 해당 지급보증의 제공 내용을 주석에 기재하지 아니함\n3. 지적 근거 및 판단 내용\n일반기업회계기준 제25장(특수관계자 공시) 문단 25.9에 따르면 특수관계자에게 제공한\n보증은 공시하도록 규정하고 있음\n4. 감사절차 미흡사항\n회계감사기준 200(독립된 감사인의 전반목적 및 감사기준에 따른 감사의 수행), 500\n(감사증거)과 700(재무제표에 대한 의견형성과 보고) 등에 따르면 감사인은 재무제표를\n중요하게 왜곡표시 시킬 수 있는 상황이 존재할 수 있다는 전문가적인 의구심을 가지고\n감사업무를 계획하고 수행하여야 하며, 감사인은 감사의견 형성의 기초가 될 합리적인\n- 40 -\n감사결론을 도출할 수 있도록 충분하고 적합한 감사증거를 확보하여야 하고, 재무제표가\n일반적으로 인정된 회계처리기준에 따라 중요성의 관점에서 적정하게 표시되고 있다고\n판단했을 경우에만 적정의견을 표명하도록 규정되어 있음에도,\n감사인은 은행연합회 신용정보자료 등에 대한 검토절차를 소홀히 하여 회사의 회계처리\n오류를 지적하지 못함\n5. 시사점\n회사는 지급보증제공시 작성한 이사회의사록 등을 체계적으로 관리하는 내부통제\n절차를 강화할 필요가 있고 지급보증 관련 회계처리 기준서를 숙지하여야 함\n감사인은 은행연합회 신용정보자료에 조회되는 타법인 지급보증내역에 대한 검토절차를\n면밀히 수행하여야 함\n쟁점분야: 특수관계자 거래 주석공시\n관련기준: 일반기업회계기준 제25장(특수관계자 공시)\n\n회사의 회계처리:\n회사는 특수관계자의 단기차입금에 대하여 금융기관에 지급보증을 제공하였음에도 이를\n주석에 기재하지 아니함\n\n회계기준 위반 지적 내용:\n회사의 종속회사인 A사는 ‘17년 5월에 물류단지 개발사업 관련 사업비 조달을 위해\nB저축은행 등 5개 금융기관으로부터 총 140억원을 차입하였으며, 회사는 동 단기차입금에\n대하여 지급보증을 제공하였으나,\n회사는 보증현황 목록 및 관련 문서(이사회입보결의서) 등의 관리가 부실하였고, 지급\n보증 주석기재에 대한 회계처리기준도 정확히 인식하지 못하여 ‘17년 재무제표를 작성·\n공시함에 있어 해당 지급보증의 제공 내용을 주석에 기재하지 아니함\n\n지적 근거 및 판단 내용:\n일반기업회계기준 제25장(특수관계자 공시) 문단 25.9에 따르면 특수관계자에게 제공한\n보증은 공시하도록 규정하고 있음\n\n감사절차 미흡사항:\n회계감사기준 200(독립된 감사인의 전반목적 및 감사기준에 따른 감사의 수행), 500\n(감사증거)과 700(재무제표에 대한 의견형성과 보고) 등에 따르면 감사인은 재무제표를\n중요하게 왜곡표시 시킬 수 있는 상황이 존재할 수 있다는 전문가적인 의구심을 가지고\n감사업무를 계획하고 수행하여야 하며, 감사인은 감사의견 형성의 기초가 될 합리적인\n- 40 -\n감사결론을 도출할 수 있도록 충분하고 적합한 감사증거를 확보하여야 하고, 재무제표가\n일반적으로 인정된 회계처리기준에 따라 중요성의 관점에서 적정하게 표시되고 있다고\n판단했을 경우에만 적정의견을 표명하도록 규정되어 있음에도,\n감사인은 은행연합회 신용정보자료 등에 대한 검토절차를 소홀히 하여 회사의 회계처리\n오류를 지적하지 못함\n\n시사점:\n회사는 지급보증제공시 작성한 이사회의사록 등을 체계적으로 관리하는 내부통제\n절차를 강화할 필요가 있고 지급보증 관련 회계처리 기준서를 숙지하여야 함\n감사인은 은행연합회 신용정보자료에 조회되는 타법인 지급보증내역에 대한 검토절차를\n면밀히 수행하여야 함"
    },
    {
      "paragraph_id": "KICPA-2020-24",
      "case_id": "KICPA-2020-24",
      "case_title": "지급보증 주석 미기재",
      "metadata": {
        "decision_year": "2020",
        "accounting_period": "’17.1.1.∼’17.12.31.\n1. 회사의 회계처리\n회사는 연결재무제표 작성시 종속기업이 장비 매출을 위하여 매출거래처의 장비구매\n관련 금융기관 차입금에 대하여 지급보증 제공한 사실을 주석으로 기재하지 아니함\n2. 회계기준 위반 지적 내용\n종속기업이 지급보증 내용을 누락한 채로 회사에 재무자료를 제출하였으나 회사는 별도의\n검토절차 없이 연결재무제표를 작성하였고, 종속기업이 회사에 자료를 제출한 이후에\n지급보증 관련 일부 금액을 주석에 반영하여 재무제표를 확정하였음에도 회사는 이를\n반영하지 아니함\n- 41 -\n3. 지적 근거 및 판단 내용\n기업회계기준서(제1107호 문단 36 및 B10)에 따르면, 보고기간말 현재 신용위험의 최대\n익스포저를 가장 잘 나타내는 금액을 공시하도록 규정하고 있음\n4. 감사절차 미흡사항\n회계감사기준 200(독립된 감사인의 전반목적 및 감사기준에 따른 감사의 수행), 500\n(감사증거)과 700(재무제표에 대한 의견형성과 보고) 등에 따르면 감사인은 재무제표를\n중요하게 왜곡표시 시킬 수 있는 상황이 존재할 수 있다는 전문가적인 의구심을 가지고\n감사업무를 계획하고 수행하여야 하며, 감사인은 감사의견 형성의 기초가 될 합리적인\n감사결론을 도출할 수 있도록 충분하고 적합한 감사증거를 확보하여야 하고, 재무제표가\n일반적으로 인정된 회계처리기준에 따라 중요성의 관점에서 적정하게 표시되고 있다고\n판단했을 경우에만 적정의견을 표명하도록 규정되어 있는바,\n종속기업이 장비 매출을 위하여 매출거래처의 장비구매자금 관련 차입금에 대한 지급보증을\n제공하는 영업정책을 운영하고 있음에도 지급보증의 공시를 중요왜곡표시위험으로\n식별·평가하지 아니하였고, 종속기업의 전기 재무제표 주석에 지급보증 내용이 공시되어\n있음에도 ‘부문감사인 보고서’에 첨부된 당기 재무제표에 지급보증 내용이 기재되어 있지\n아니한 것에 관한 추가적인 감사절차를 수행하지 아니하였으며, ‘부문감사인 보고서’를\n제공받은 이후에 종속기업이 지급보증 관련 일부 금액을 주석에 반영하여 재무제표를\n확정하였음에도 확정된 재무제표를 확인하지 않는 등 감사보고서일 또는 감사보고서일과\n가장 가까운 실행가능한 일자까지의 감사증거 입수를 소홀히 하여 회사의 회계처리 오류를\n지적하지 못하였음\n5. 시사점\n회사는 연결재무제표 작성을 위하여 종속기업으로 제출받은 주석의 완전성을 검증\n하는 절차를 추가하는 등 내부통제를 강화하여야 함\n감사인은 주요 공시사항을 연결재무제표의 중요왜곡표시위험으로 식별하고, 전기 재무\n제표 주석에 기재된 지급보증 내용이 당기에 누락되었다면 추가적인 감사절차를 수행\n하고, 감사보고서일 또는 감사보고서일과 가장 가까운 실행가능한 일자까지의 감사\n증거 입수를 소홀히 하지 아니하여야 함\n- 42 -",
        "issue_fields": [
          "지급보증 주석공시"
        ],
        "related_standards": [
          "기업회계기준서 제1107호(금융상품: 공시)"
        ],
        "case_type": "회계감리지적사례",
        "source": "KICPA 심사·감리 지적사례"
      },
      "content": {
        "section_1_company_accounting": {
          "section_title": "회사의 회계처리",
          "content": "회사는 연결재무제표 작성시 종속기업이 장비 매출을 위하여 매출거래처의 장비구매\n관련 금융기관 차입금에 대하여 지급보증 제공한 사실을 주석으로 기재하지 아니함"
        },
        "section_2_violation_details": {
          "section_title": "회계기준 위반 지적 내용",
          "content": "종속기업이 지급보증 내용을 누락한 채로 회사에 재무자료를 제출하였으나 회사는 별도의\n검토절차 없이 연결재무제표를 작성하였고, 종속기업이 회사에 자료를 제출한 이후에\n지급보증 관련 일부 금액을 주석에 반영하여 재무제표를 확정하였음에도 회사는 이를\n반영하지 아니함\n- 41 -"
        },
        "section_3_basis_judgment": {
          "section_title": "지적 근거 및 판단 내용",
          "content": "기업회계기준서(제1107호 문단 36 및 B10)에 따르면, 보고기간말 현재 신용위험의 최대\n익스포저를 가장 잘 나타내는 금액을 공시하도록 규정하고 있음"
        },
        "section_4_audit_procedure": {
          "section_title": "감사절차 미흡사항",
          "content": "회계감사기준 200(독립된 감사인의 전반목적 및 감사기준에 따른 감사의 수행), 500\n(감사증거)과 700(재무제표에 대한 의견형성과 보고) 등에 따르면 감사인은 재무제표를\n중요하게 왜곡표시 시킬 수 있는 상황이 존재할 수 있다는 전문가적인 의구심을 가지고\n감사업무를 계획하고 수행하여야 하며, 감사인은 감사의견 형성의 기초가 될 합리적인\n감사결론을 도출할 수 있도록 충분하고 적합한 감사증거를 확보하여야 하고, 재무제표가\n일반적으로 인정된 회계처리기준에 따라 중요성의 관점에서 적정하게 표시되고 있다고\n판단했을 경우에만 적정의견을 표명하도록 규정되어 있는바,\n종속기업이 장비 매출을 위하여 매출거래처의 장비구매자금 관련 차입금에 대한 지급보증을\n제공하는 영업정책을 운영하고 있음에도 지급보증의 공시를 중요왜곡표시위험으로\n식별·평가하지 아니하였고, 종속기업의 전기 재무제표 주석에 지급보증 내용이 공시되어\n있음에도 ‘부문감사인 보고서’에 첨부된 당기 재무제표에 지급보증 내용이 기재되어 있지\n아니한 것에 관한 추가적인 감사절차를 수행하지 아니하였으며, ‘부문감사인 보고서’를\n제공받은 이후에 종속기업이 지급보증 관련 일부 금액을 주석에 반영하여 재무제표를\n확정하였음에도 확정된 재무제표를 확인하지 않는 등 감사보고서일 또는 감사보고서일과\n가장 가까운 실행가능한 일자까지의 감사증거 입수를 소홀히 하여 회사의 회계처리 오류를\n지적하지 못하였음"
        },
        "section_5_implications": {
          "section_title": "시사점",
          "content": "회사는 연결재무제표 작성을 위하여 종속기업으로 제출받은 주석의 완전성을 검증\n하는 절차를 추가하는 등 내부통제를 강화하여야 함\n감사인은 주요 공시사항을 연결재무제표의 중요왜곡표시위험으로 식별하고, 전기 재무\n제표 주석에 기재된 지급보증 내용이 당기에 누락되었다면 추가적인 감사절차를 수행\n하고, 감사보고서일 또는 감사보고서일과 가장 가까운 실행가능한 일자까지의 감사\n증거 입수를 소홀히 하지 아니하여야 함\n- 42 -"
        }
      },
      "indexed_content": "케이스 ID: KICPA-2020-24\n제목: 지급보증 주석 미기재\n결정연도: 2020년\n회계결산일: ’17.1.1.∼’17.12.31.\n1. 회사의 회계처리\n회사는 연결재무제표 작성시 종속기업이 장비 매출을 위하여 매출거래처의 장비구매\n관련 금융기관 차입금에 대하여 지급보증 제공한 사실을 주석으로 기재하지 아니함\n2. 회계기준 위반 지적 내용\n종속기업이 지급보증 내용을 누락한 채로 회사에 재무자료를 제출하였으나 회사는 별도의\n검토절차 없이 연결재무제표를 작성하였고, 종속기업이 회사에 자료를 제출한 이후에\n지급보증 관련 일부 금액을 주석에 반영하여 재무제표를 확정하였음에도 회사는 이를\n반영하지 아니함\n- 41 -\n3. 지적 근거 및 판단 내용\n기업회계기준서(제1107호 문단 36 및 B10)에 따르면, 보고기간말 현재 신용위험의 최대\n익스포저를 가장 잘 나타내는 금액을 공시하도록 규정하고 있음\n4. 감사절차 미흡사항\n회계감사기준 200(독립된 감사인의 전반목적 및 감사기준에 따른 감사의 수행), 500\n(감사증거)과 700(재무제표에 대한 의견형성과 보고) 등에 따르면 감사인은 재무제표를\n중요하게 왜곡표시 시킬 수 있는 상황이 존재할 수 있다는 전문가적인 의구심을 가지고\n감사업무를 계획하고 수행하여야 하며, 감사인은 감사의견 형성의 기초가 될 합리적인\n감사결론을 도출할 수 있도록 충분하고 적합한 감사증거를 확보하여야 하고, 재무제표가\n일반적으로 인정된 회계처리기준에 따라 중요성의 관점에서 적정하게 표시되고 있다고\n판단했을 경우에만 적정의견을 표명하도록 규정되어 있는바,\n종속기업이 장비 매출을 위하여 매출거래처의 장비구매자금 관련 차입금에 대한 지급보증을\n제공하는 영업정책을 운영하고 있음에도 지급보증의 공시를 중요왜곡표시위험으로\n식별·평가하지 아니하였고, 종속기업의 전기 재무제표 주석에 지급보증 내용이 공시되어\n있음에도 ‘부문감사인 보고서’에 첨부된 당기 재무제표에 지급보증 내용이 기재되어 있지\n아니한 것에 관한 추가적인 감사절차를 수행하지 아니하였으며, ‘부문감사인 보고서’를\n제공받은 이후에 종속기업이 지급보증 관련 일부 금액을 주석에 반영하여 재무제표를\n확정하였음에도 확정된 재무제표를 확인하지 않는 등 감사보고서일 또는 감사보고서일과\n가장 가까운 실행가능한 일자까지의 감사증거 입수를 소홀히 하여 회사의 회계처리 오류를\n지적하지 못하였음\n5. 시사점\n회사는 연결재무제표 작성을 위하여 종속기업으로 제출받은 주석의 완전성을 검증\n하는 절차를 추가하는 등 내부통제를 강화하여야 함\n감사인은 주요 공시사항을 연결재무제표의 중요왜곡표시위험으로 식별하고, 전기 재무\n제표 주석에 기재된 지급보증 내용이 당기에 누락되었다면 추가적인 감사절차를 수행\n하고, 감사보고서일 또는 감사보고서일과 가장 가까운 실행가능한 일자까지의 감사\n증거 입수를 소홀히 하지 아니하여야 함\n- 42 -\n쟁점분야: 지급보증 주석공시\n관련기준: 기업회계기준서 제1107호(금융상품: 공시)\n\n회사의 회계처리:\n회사는 연결재무제표 작성시 종속기업이 장비 매출을 위하여 매출거래처의 장비구매\n관련 금융기관 차입금에 대하여 지급보증 제공한 사실을 주석으로 기재하지 아니함\n\n회계기준 위반 지적 내용:\n종속기업이 지급보증 내용을 누락한 채로 회사에 재무자료를 제출하였으나 회사는 별도의\n검토절차 없이 연결재무제표를 작성하였고, 종속기업이 회사에 자료를 제출한 이후에\n지급보증 관련 일부 금액을 주석에 반영하여 재무제표를 확정하였음에도 회사는 이를\n반영하지 아니함\n- 41 -\n\n지적 근거 및 판단 내용:\n기업회계기준서(제1107호 문단 36 및 B10)에 따르면, 보고기간말 현재 신용위험의 최대\n익스포저를 가장 잘 나타내는 금액을 공시하도록 규정하고 있음\n\n감사절차 미흡사항:\n회계감사기준 200(독립된 감사인의 전반목적 및 감사기준에 따른 감사의 수행), 500\n(감사증거)과 700(재무제표에 대한 의견형성과 보고) 등에 따르면 감사인은 재무제표를\n중요하게 왜곡표시 시킬 수 있는 상황이 존재할 수 있다는 전문가적인 의구심을 가지고\n감사업무를 계획하고 수행하여야 하며, 감사인은 감사의견 형성의 기초가 될 합리적인\n감사결론을 도출할 수 있도록 충분하고 적합한 감사증거를 확보하여야 하고, 재무제표가\n일반적으로 인정된 회계처리기준에 따라 중요성의 관점에서 적정하게 표시되고 있다고\n판단했을 경우에만 적정의견을 표명하도록 규정되어 있는바,\n종속기업이 장비 매출을 위하여 매출거래처의 장비구매자금 관련 차입금에 대한 지급보증을\n제공하는 영업정책을 운영하고 있음에도 지급보증의 공시를 중요왜곡표시위험으로\n식별·평가하지 아니하였고, 종속기업의 전기 재무제표 주석에 지급보증 내용이 공시되어\n있음에도 ‘부문감사인 보고서’에 첨부된 당기 재무제표에 지급보증 내용이 기재되어 있지\n아니한 것에 관한 추가적인 감사절차를 수행하지 아니하였으며, ‘부문감사인 보고서’를\n제공받은 이후에 종속기업이 지급보증 관련 일부 금액을 주석에 반영하여 재무제표를\n확정하였음에도 확정된 재무제표를 확인하지 않는 등 감사보고서일 또는 감사보고서일과\n가장 가까운 실행가능한 일자까지의 감사증거 입수를 소홀히 하여 회사의 회계처리 오류를\n지적하지 못하였음\n\n시사점:\n회사는 연결재무제표 작성을 위하여 종속기업으로 제출받은 주석의 완전성을 검증\n하는 절차를 추가하는 등 내부통제를 강화하여야 함\n감사인은 주요 공시사항을 연결재무제표의 중요왜곡표시위험으로 식별하고, 전기 재무\n제표 주석에 기재된 지급보증 내용이 당기에 누락되었다면 추가적인 감사절차를 수행\n하고, 감사보고서일 또는 감사보고서일과 가장 가까운 실행가능한 일자까지의 감사\n증거 입수를 소홀히 하지 아니하여야 함\n- 42 -"
    },
    {
      "paragraph_id": "KICPA-2020-25",
      "case_id": "KICPA-2020-25",
      "case_title": "지급보증 주석 과소기재",
      "metadata": {
        "decision_year": "2020",
        "accounting_period": "’17.1.1.∼’17.12.31.\n1. 회사의 회계처리\n회사는 장비 매출을 위하여 매출거래처의 장비구매 관련 금융기관 차입금에 대하여\n지급보증을 제공하였음에도 제공한 대부분의 지급보증을 누락하여 과소하게 주석 공시함\n2. 회계기준 위반 지적 내용\n회사의 영업부서에서 일부 금융기관에 대한 지급보증 정보를 누락한 채로 재무회계팀에\n자료를 전달하였으나, 재무회계팀은 영업부서가 제출한 지급보증 주석의 완전성을 검토\n하는 절차 없이 재무제표를 작성함에 따라 지급보증을 과소 공시함\n3. 지적 근거 및 판단 내용\n기업회계기준서(제1107호 문단 36 및 B10)에 따르면, 보고기간말 현재 신용위험의 최대\n익스포저를 가장 잘 나타내는 금액을 공시하도록 규정하고 있음\n4. 감사절차 미흡사항\n회계감사기준 200(독립된 감사인의 전반목적 및 감사기준에 따른 감사의 수행), 500\n(감사증거)과 700(재무제표에 대한 의견형성과 보고) 등에 따르면 감사인은 재무제표를\n중요하게 왜곡표시 시킬 수 있는 상황이 존재할 수 있다는 전문가적인 의구심을 가지고\n감사업무를 계획하고 수행하여야 하며, 감사인은 감사의견 형성의 기초가 될 합리적인\n감사결론을 도출할 수 있도록 충분하고 적합한 감사증거를 확보하여야 하고, 재무제표가\n일반적으로 인정된 회계처리기준에 따라 중요성의 관점에서 적정하게 표시되고 있다고\n판단했을 경우에만 적정의견을 표명하도록 규정되어 있는바,\n감사인은 은행연합회의 신용정보 자료와 금융기관 조회서를 통하여 관련 지급보증금액을\n확인하였으나 금융기관 조회서에 회신된 일부 지급보증금액의 대조확인 절차를 소홀히\n하였고, 회사가 매출거래처의 장비 매입을 위하여 매출거래처의 차입금에 대해서 지급\n- 43 -\n보증을 제공하는 영업정책을 운영하고 있으며 전기 재무제표 주석에 지급보증 내용이 공시\n되어 있는 상황에서 전기 대비 매출이 증가한 반면, 지급보증 금액은 감소하였음에도\n지급보증의 완전성에 대한 전문가적 의구심을 가지고 감소원인을 파악하기 위한 추가\n적인 감사절차를 소홀히 하여 회사의 회계처리 오류를 지적하지 못하였음\n5. 시사점\n회사는 재무제표 작성을 위하여 영업부서 등으로부터 제출받은 주석의 완전성을 검증\n하는 절차를 추가하는 등 내부통제를 강화하여야 함\n감사인은 금융기관 조회서에 회신된 지급보증금액의 대조확인 절차를 수행하고, 매출\n거래처에 지급보증을 제공하는 것과 같은 회사의 영업정책을 이해하여야 하며, 전기\n재무제표 주석에 지급보증 내용이 공시되어 있는 상황에서 전기 대비 매출이 증가하\n였음에도 지급보증 금액은 감소한 경우, 지급보증의 완전성에 대한 전문가적 의구심을\n가지고 감소원인을 파악하기 위한 추가적인 감사절차를 수행하여야 함\n- 44 -\n4 계정과목 분류 오류 등(D유형)",
        "issue_fields": [
          "지급보증 주석공시"
        ],
        "related_standards": [
          "기업회계기준서 제1107호(금융상품: 공시)"
        ],
        "case_type": "회계감리지적사례",
        "source": "KICPA 심사·감리 지적사례"
      },
      "content": {
        "section_1_company_accounting": {
          "section_title": "회사의 회계처리",
          "content": "회사는 장비 매출을 위하여 매출거래처의 장비구매 관련 금융기관 차입금에 대하여\n지급보증을 제공하였음에도 제공한 대부분의 지급보증을 누락하여 과소하게 주석 공시함"
        },
        "section_2_violation_details": {
          "section_title": "회계기준 위반 지적 내용",
          "content": "회사의 영업부서에서 일부 금융기관에 대한 지급보증 정보를 누락한 채로 재무회계팀에\n자료를 전달하였으나, 재무회계팀은 영업부서가 제출한 지급보증 주석의 완전성을 검토\n하는 절차 없이 재무제표를 작성함에 따라 지급보증을 과소 공시함"
        },
        "section_3_basis_judgment": {
          "section_title": "지적 근거 및 판단 내용",
          "content": "기업회계기준서(제1107호 문단 36 및 B10)에 따르면, 보고기간말 현재 신용위험의 최대\n익스포저를 가장 잘 나타내는 금액을 공시하도록 규정하고 있음"
        },
        "section_4_audit_procedure": {
          "section_title": "감사절차 미흡사항",
          "content": "회계감사기준 200(독립된 감사인의 전반목적 및 감사기준에 따른 감사의 수행), 500\n(감사증거)과 700(재무제표에 대한 의견형성과 보고) 등에 따르면 감사인은 재무제표를\n중요하게 왜곡표시 시킬 수 있는 상황이 존재할 수 있다는 전문가적인 의구심을 가지고\n감사업무를 계획하고 수행하여야 하며, 감사인은 감사의견 형성의 기초가 될 합리적인\n감사결론을 도출할 수 있도록 충분하고 적합한 감사증거를 확보하여야 하고, 재무제표가\n일반적으로 인정된 회계처리기준에 따라 중요성의 관점에서 적정하게 표시되고 있다고\n판단했을 경우에만 적정의견을 표명하도록 규정되어 있는바,\n감사인은 은행연합회의 신용정보 자료와 금융기관 조회서를 통하여 관련 지급보증금액을\n확인하였으나 금융기관 조회서에 회신된 일부 지급보증금액의 대조확인 절차를 소홀히\n하였고, 회사가 매출거래처의 장비 매입을 위하여 매출거래처의 차입금에 대해서 지급\n- 43 -\n보증을 제공하는 영업정책을 운영하고 있으며 전기 재무제표 주석에 지급보증 내용이 공시\n되어 있는 상황에서 전기 대비 매출이 증가한 반면, 지급보증 금액은 감소하였음에도\n지급보증의 완전성에 대한 전문가적 의구심을 가지고 감소원인을 파악하기 위한 추가\n적인 감사절차를 소홀히 하여 회사의 회계처리 오류를 지적하지 못하였음"
        },
        "section_5_implications": {
          "section_title": "시사점",
          "content": "회사는 재무제표 작성을 위하여 영업부서 등으로부터 제출받은 주석의 완전성을 검증\n하는 절차를 추가하는 등 내부통제를 강화하여야 함\n감사인은 금융기관 조회서에 회신된 지급보증금액의 대조확인 절차를 수행하고, 매출\n거래처에 지급보증을 제공하는 것과 같은 회사의 영업정책을 이해하여야 하며, 전기\n재무제표 주석에 지급보증 내용이 공시되어 있는 상황에서 전기 대비 매출이 증가하\n였음에도 지급보증 금액은 감소한 경우, 지급보증의 완전성에 대한 전문가적 의구심을\n가지고 감소원인을 파악하기 위한 추가적인 감사절차를 수행하여야 함\n- 44 -\n4 계정과목 분류 오류 등(D유형)"
        }
      },
      "indexed_content": "케이스 ID: KICPA-2020-25\n제목: 지급보증 주석 과소기재\n결정연도: 2020년\n회계결산일: ’17.1.1.∼’17.12.31.\n1. 회사의 회계처리\n회사는 장비 매출을 위하여 매출거래처의 장비구매 관련 금융기관 차입금에 대하여\n지급보증을 제공하였음에도 제공한 대부분의 지급보증을 누락하여 과소하게 주석 공시함\n2. 회계기준 위반 지적 내용\n회사의 영업부서에서 일부 금융기관에 대한 지급보증 정보를 누락한 채로 재무회계팀에\n자료를 전달하였으나, 재무회계팀은 영업부서가 제출한 지급보증 주석의 완전성을 검토\n하는 절차 없이 재무제표를 작성함에 따라 지급보증을 과소 공시함\n3. 지적 근거 및 판단 내용\n기업회계기준서(제1107호 문단 36 및 B10)에 따르면, 보고기간말 현재 신용위험의 최대\n익스포저를 가장 잘 나타내는 금액을 공시하도록 규정하고 있음\n4. 감사절차 미흡사항\n회계감사기준 200(독립된 감사인의 전반목적 및 감사기준에 따른 감사의 수행), 500\n(감사증거)과 700(재무제표에 대한 의견형성과 보고) 등에 따르면 감사인은 재무제표를\n중요하게 왜곡표시 시킬 수 있는 상황이 존재할 수 있다는 전문가적인 의구심을 가지고\n감사업무를 계획하고 수행하여야 하며, 감사인은 감사의견 형성의 기초가 될 합리적인\n감사결론을 도출할 수 있도록 충분하고 적합한 감사증거를 확보하여야 하고, 재무제표가\n일반적으로 인정된 회계처리기준에 따라 중요성의 관점에서 적정하게 표시되고 있다고\n판단했을 경우에만 적정의견을 표명하도록 규정되어 있는바,\n감사인은 은행연합회의 신용정보 자료와 금융기관 조회서를 통하여 관련 지급보증금액을\n확인하였으나 금융기관 조회서에 회신된 일부 지급보증금액의 대조확인 절차를 소홀히\n하였고, 회사가 매출거래처의 장비 매입을 위하여 매출거래처의 차입금에 대해서 지급\n- 43 -\n보증을 제공하는 영업정책을 운영하고 있으며 전기 재무제표 주석에 지급보증 내용이 공시\n되어 있는 상황에서 전기 대비 매출이 증가한 반면, 지급보증 금액은 감소하였음에도\n지급보증의 완전성에 대한 전문가적 의구심을 가지고 감소원인을 파악하기 위한 추가\n적인 감사절차를 소홀히 하여 회사의 회계처리 오류를 지적하지 못하였음\n5. 시사점\n회사는 재무제표 작성을 위하여 영업부서 등으로부터 제출받은 주석의 완전성을 검증\n하는 절차를 추가하는 등 내부통제를 강화하여야 함\n감사인은 금융기관 조회서에 회신된 지급보증금액의 대조확인 절차를 수행하고, 매출\n거래처에 지급보증을 제공하는 것과 같은 회사의 영업정책을 이해하여야 하며, 전기\n재무제표 주석에 지급보증 내용이 공시되어 있는 상황에서 전기 대비 매출이 증가하\n였음에도 지급보증 금액은 감소한 경우, 지급보증의 완전성에 대한 전문가적 의구심을\n가지고 감소원인을 파악하기 위한 추가적인 감사절차를 수행하여야 함\n- 44 -\n4 계정과목 분류 오류 등(D유형)\n쟁점분야: 지급보증 주석공시\n관련기준: 기업회계기준서 제1107호(금융상품: 공시)\n\n회사의 회계처리:\n회사는 장비 매출을 위하여 매출거래처의 장비구매 관련 금융기관 차입금에 대하여\n지급보증을 제공하였음에도 제공한 대부분의 지급보증을 누락하여 과소하게 주석 공시함\n\n회계기준 위반 지적 내용:\n회사의 영업부서에서 일부 금융기관에 대한 지급보증 정보를 누락한 채로 재무회계팀에\n자료를 전달하였으나, 재무회계팀은 영업부서가 제출한 지급보증 주석의 완전성을 검토\n하는 절차 없이 재무제표를 작성함에 따라 지급보증을 과소 공시함\n\n지적 근거 및 판단 내용:\n기업회계기준서(제1107호 문단 36 및 B10)에 따르면, 보고기간말 현재 신용위험의 최대\n익스포저를 가장 잘 나타내는 금액을 공시하도록 규정하고 있음\n\n감사절차 미흡사항:\n회계감사기준 200(독립된 감사인의 전반목적 및 감사기준에 따른 감사의 수행), 500\n(감사증거)과 700(재무제표에 대한 의견형성과 보고) 등에 따르면 감사인은 재무제표를\n중요하게 왜곡표시 시킬 수 있는 상황이 존재할 수 있다는 전문가적인 의구심을 가지고\n감사업무를 계획하고 수행하여야 하며, 감사인은 감사의견 형성의 기초가 될 합리적인\n감사결론을 도출할 수 있도록 충분하고 적합한 감사증거를 확보하여야 하고, 재무제표가\n일반적으로 인정된 회계처리기준에 따라 중요성의 관점에서 적정하게 표시되고 있다고\n판단했을 경우에만 적정의견을 표명하도록 규정되어 있는바,\n감사인은 은행연합회의 신용정보 자료와 금융기관 조회서를 통하여 관련 지급보증금액을\n확인하였으나 금융기관 조회서에 회신된 일부 지급보증금액의 대조확인 절차를 소홀히\n하였고, 회사가 매출거래처의 장비 매입을 위하여 매출거래처의 차입금에 대해서 지급\n- 43 -\n보증을 제공하는 영업정책을 운영하고 있으며 전기 재무제표 주석에 지급보증 내용이 공시\n되어 있는 상황에서 전기 대비 매출이 증가한 반면, 지급보증 금액은 감소하였음에도\n지급보증의 완전성에 대한 전문가적 의구심을 가지고 감소원인을 파악하기 위한 추가\n적인 감사절차를 소홀히 하여 회사의 회계처리 오류를 지적하지 못하였음\n\n시사점:\n회사는 재무제표 작성을 위하여 영업부서 등으로부터 제출받은 주석의 완전성을 검증\n하는 절차를 추가하는 등 내부통제를 강화하여야 함\n감사인은 금융기관 조회서에 회신된 지급보증금액의 대조확인 절차를 수행하고, 매출\n거래처에 지급보증을 제공하는 것과 같은 회사의 영업정책을 이해하여야 하며, 전기\n재무제표 주석에 지급보증 내용이 공시되어 있는 상황에서 전기 대비 매출이 증가하\n였음에도 지급보증 금액은 감소한 경우, 지급보증의 완전성에 대한 전문가적 의구심을\n가지고 감소원인을 파악하기 위한 추가적인 감사절차를 수행하여야 함\n- 44 -\n4 계정과목 분류 오류 등(D유형)"
    },
    {
      "paragraph_id": "KICPA-2020-26",
      "case_id": "KICPA-2020-26",
      "case_title": "자기를 위하여 제공한 담보자산 주석 미기재",
      "metadata": {
        "decision_year": "2020",
        "accounting_period": "’17.1.1.∼’17.12.31.\n1. 회사의 회계처리\n회사는 차입금과 관련하여 차입처에 담보로 제공한 부동산담보신탁 1순위 우선수익권증서\n및 사업부지매매대금반환채권, 소유권이전등기청구권의 내역을 주석으로 기재하지 아니함\n2. 회계기준 위반 지적 내용\n회사는 OO시 OO지구 공동주택 신축공사 시행을 위한 사업부지 매입자금 대출과 관련\n하여 OO캐피탈에 부동산담보신탁 1순위 우선수익권증서(차입금액의 130%), 사업\n부지매매대금반환채권, 소유권이전등기청구권을 담보로 제공하였음에도, 관련 내용이\n공시대상이라는 사실을 인지하지 못하여 이를 주석으로 기재하지 못한 사실이 있음\n3. 지적 근거 및 판단 내용\n일반기업회계기준 제2장(재무제표의 작성과 표시Ⅰ) 문단 2.85, 실무지침 2.20에 의하면\n자기를 위하여 제공하고 있는 담보의 내용을 주석으로 기재하도록 규정하고 있음\n4. 감사절차 미흡사항\n회계감사기준 200(독립된 감사인의 전반목적 및 감사기준에 따른 감사의 수행), 500\n(감사증거)과 700(재무제표에 대한 의견형성과 보고) 등에 따르면 감사인은 재무제표를\n중요하게 왜곡표시 시킬 수 있는 상황이 존재할 수 있다는 전문가적인 의구심을 가지고\n감사업무를 계획하고 수행하여야 하며, 감사인은 감사의견 형성의 기초가 될 합리적인\n감사결론을 도출할 수 있도록 충분하고 적합한 감사증거를 확보하여야 하고, 재무제표가\n일반적으로 인정된 회계처리기준에 따라 중요성의 관점에서 적정하게 표시되고 있다고\n판단했을 경우에만 적정의견을 표명하도록 규정되어 있음에도,\n- 45 -\n차입금 관련 담보제공내역이 재무제표 주석에 적절히 기재되어 있는지 은행연합회 신용\n정보자료 및 은행조회서와 대사하는 검토절차를 수행하지 않아 회사의 회계처리 오류를\n지적하지 못하였음\n5. 시사점\n회사는 차입금 등 자신의 채무를 위하여 보유 중인 자산을 담보로 제공하는 경우에\n제공하는 자산의 장부가액뿐 아니라 질권설정 한도액을 주석으로 기재하여야 함\n감사인은 회사가 차입금에 대해 담보를 제공한 경우 은행연합회 및 은행조회서, 차입\n약정서 등을 통해 담보제공 내역을 파악하고 회사의 주석기재 누락여부에 대해 면밀히\n검토해야 함",
        "issue_fields": [
          "자기차입금 담보제공 등 주석공시"
        ],
        "related_standards": [
          "일반기업회계기준 제2장(재무제표의 작성과 표시Ⅰ)"
        ],
        "case_type": "회계감리지적사례",
        "source": "KICPA 심사·감리 지적사례"
      },
      "content": {
        "section_1_company_accounting": {
          "section_title": "회사의 회계처리",
          "content": "회사는 차입금과 관련하여 차입처에 담보로 제공한 부동산담보신탁 1순위 우선수익권증서\n및 사업부지매매대금반환채권, 소유권이전등기청구권의 내역을 주석으로 기재하지 아니함"
        },
        "section_2_violation_details": {
          "section_title": "회계기준 위반 지적 내용",
          "content": "회사는 OO시 OO지구 공동주택 신축공사 시행을 위한 사업부지 매입자금 대출과 관련\n하여 OO캐피탈에 부동산담보신탁 1순위 우선수익권증서(차입금액의 130%), 사업\n부지매매대금반환채권, 소유권이전등기청구권을 담보로 제공하였음에도, 관련 내용이\n공시대상이라는 사실을 인지하지 못하여 이를 주석으로 기재하지 못한 사실이 있음"
        },
        "section_3_basis_judgment": {
          "section_title": "지적 근거 및 판단 내용",
          "content": "일반기업회계기준 제2장(재무제표의 작성과 표시Ⅰ) 문단 2.85, 실무지침 2.20에 의하면\n자기를 위하여 제공하고 있는 담보의 내용을 주석으로 기재하도록 규정하고 있음"
        },
        "section_4_audit_procedure": {
          "section_title": "감사절차 미흡사항",
          "content": "회계감사기준 200(독립된 감사인의 전반목적 및 감사기준에 따른 감사의 수행), 500\n(감사증거)과 700(재무제표에 대한 의견형성과 보고) 등에 따르면 감사인은 재무제표를\n중요하게 왜곡표시 시킬 수 있는 상황이 존재할 수 있다는 전문가적인 의구심을 가지고\n감사업무를 계획하고 수행하여야 하며, 감사인은 감사의견 형성의 기초가 될 합리적인\n감사결론을 도출할 수 있도록 충분하고 적합한 감사증거를 확보하여야 하고, 재무제표가\n일반적으로 인정된 회계처리기준에 따라 중요성의 관점에서 적정하게 표시되고 있다고\n판단했을 경우에만 적정의견을 표명하도록 규정되어 있음에도,\n- 45 -\n차입금 관련 담보제공내역이 재무제표 주석에 적절히 기재되어 있는지 은행연합회 신용\n정보자료 및 은행조회서와 대사하는 검토절차를 수행하지 않아 회사의 회계처리 오류를\n지적하지 못하였음"
        },
        "section_5_implications": {
          "section_title": "시사점",
          "content": "회사는 차입금 등 자신의 채무를 위하여 보유 중인 자산을 담보로 제공하는 경우에\n제공하는 자산의 장부가액뿐 아니라 질권설정 한도액을 주석으로 기재하여야 함\n감사인은 회사가 차입금에 대해 담보를 제공한 경우 은행연합회 및 은행조회서, 차입\n약정서 등을 통해 담보제공 내역을 파악하고 회사의 주석기재 누락여부에 대해 면밀히\n검토해야 함"
        }
      },
      "indexed_content": "케이스 ID: KICPA-2020-26\n제목: 자기를 위하여 제공한 담보자산 주석 미기재\n결정연도: 2020년\n회계결산일: ’17.1.1.∼’17.12.31.\n1. 회사의 회계처리\n회사는 차입금과 관련하여 차입처에 담보로 제공한 부동산담보신탁 1순위 우선수익권증서\n및 사업부지매매대금반환채권, 소유권이전등기청구권의 내역을 주석으로 기재하지 아니함\n2. 회계기준 위반 지적 내용\n회사는 OO시 OO지구 공동주택 신축공사 시행을 위한 사업부지 매입자금 대출과 관련\n하여 OO캐피탈에 부동산담보신탁 1순위 우선수익권증서(차입금액의 130%), 사업\n부지매매대금반환채권, 소유권이전등기청구권을 담보로 제공하였음에도, 관련 내용이\n공시대상이라는 사실을 인지하지 못하여 이를 주석으로 기재하지 못한 사실이 있음\n3. 지적 근거 및 판단 내용\n일반기업회계기준 제2장(재무제표의 작성과 표시Ⅰ) 문단 2.85, 실무지침 2.20에 의하면\n자기를 위하여 제공하고 있는 담보의 내용을 주석으로 기재하도록 규정하고 있음\n4. 감사절차 미흡사항\n회계감사기준 200(독립된 감사인의 전반목적 및 감사기준에 따른 감사의 수행), 500\n(감사증거)과 700(재무제표에 대한 의견형성과 보고) 등에 따르면 감사인은 재무제표를\n중요하게 왜곡표시 시킬 수 있는 상황이 존재할 수 있다는 전문가적인 의구심을 가지고\n감사업무를 계획하고 수행하여야 하며, 감사인은 감사의견 형성의 기초가 될 합리적인\n감사결론을 도출할 수 있도록 충분하고 적합한 감사증거를 확보하여야 하고, 재무제표가\n일반적으로 인정된 회계처리기준에 따라 중요성의 관점에서 적정하게 표시되고 있다고\n판단했을 경우에만 적정의견을 표명하도록 규정되어 있음에도,\n- 45 -\n차입금 관련 담보제공내역이 재무제표 주석에 적절히 기재되어 있는지 은행연합회 신용\n정보자료 및 은행조회서와 대사하는 검토절차를 수행하지 않아 회사의 회계처리 오류를\n지적하지 못하였음\n5. 시사점\n회사는 차입금 등 자신의 채무를 위하여 보유 중인 자산을 담보로 제공하는 경우에\n제공하는 자산의 장부가액뿐 아니라 질권설정 한도액을 주석으로 기재하여야 함\n감사인은 회사가 차입금에 대해 담보를 제공한 경우 은행연합회 및 은행조회서, 차입\n약정서 등을 통해 담보제공 내역을 파악하고 회사의 주석기재 누락여부에 대해 면밀히\n검토해야 함\n쟁점분야: 자기차입금 담보제공 등 주석공시\n관련기준: 일반기업회계기준 제2장(재무제표의 작성과 표시Ⅰ)\n\n회사의 회계처리:\n회사는 차입금과 관련하여 차입처에 담보로 제공한 부동산담보신탁 1순위 우선수익권증서\n및 사업부지매매대금반환채권, 소유권이전등기청구권의 내역을 주석으로 기재하지 아니함\n\n회계기준 위반 지적 내용:\n회사는 OO시 OO지구 공동주택 신축공사 시행을 위한 사업부지 매입자금 대출과 관련\n하여 OO캐피탈에 부동산담보신탁 1순위 우선수익권증서(차입금액의 130%), 사업\n부지매매대금반환채권, 소유권이전등기청구권을 담보로 제공하였음에도, 관련 내용이\n공시대상이라는 사실을 인지하지 못하여 이를 주석으로 기재하지 못한 사실이 있음\n\n지적 근거 및 판단 내용:\n일반기업회계기준 제2장(재무제표의 작성과 표시Ⅰ) 문단 2.85, 실무지침 2.20에 의하면\n자기를 위하여 제공하고 있는 담보의 내용을 주석으로 기재하도록 규정하고 있음\n\n감사절차 미흡사항:\n회계감사기준 200(독립된 감사인의 전반목적 및 감사기준에 따른 감사의 수행), 500\n(감사증거)과 700(재무제표에 대한 의견형성과 보고) 등에 따르면 감사인은 재무제표를\n중요하게 왜곡표시 시킬 수 있는 상황이 존재할 수 있다는 전문가적인 의구심을 가지고\n감사업무를 계획하고 수행하여야 하며, 감사인은 감사의견 형성의 기초가 될 합리적인\n감사결론을 도출할 수 있도록 충분하고 적합한 감사증거를 확보하여야 하고, 재무제표가\n일반적으로 인정된 회계처리기준에 따라 중요성의 관점에서 적정하게 표시되고 있다고\n판단했을 경우에만 적정의견을 표명하도록 규정되어 있음에도,\n- 45 -\n차입금 관련 담보제공내역이 재무제표 주석에 적절히 기재되어 있는지 은행연합회 신용\n정보자료 및 은행조회서와 대사하는 검토절차를 수행하지 않아 회사의 회계처리 오류를\n지적하지 못하였음\n\n시사점:\n회사는 차입금 등 자신의 채무를 위하여 보유 중인 자산을 담보로 제공하는 경우에\n제공하는 자산의 장부가액뿐 아니라 질권설정 한도액을 주석으로 기재하여야 함\n감사인은 회사가 차입금에 대해 담보를 제공한 경우 은행연합회 및 은행조회서, 차입\n약정서 등을 통해 담보제공 내역을 파악하고 회사의 주석기재 누락여부에 대해 면밀히\n검토해야 함"
    },
    {
      "paragraph_id": "KICPA-2020-27",
      "case_id": "KICPA-2020-27",
      "case_title": "지배지분의 과대계상",
      "metadata": {
        "decision_year": "2020",
        "accounting_period": "’13.1.1.∼’14.12.31.\n1. 회사의 회계처리\n회사는 종속기업의 자기주식 취득과 처분 등으로 인해 회사의 종속기업에 대한 유효\n지분율이 변동되었음에도 지배지분과 비지배지분 배분 시 이를 고려하지 아니하여\n지배지분을 과대계상함\n2. 회계기준 위반 지적 내용\n회사는 지주회사로서 13년말 현재 B사 등 5개회사를 종속기업으로 보유하고 있으며\n각 연도 말 회사의 종속기업에 대한 투자지분율은 다음과 같음\n- 46 -\n<연도별 종속기업 투자지분율>\n구 분 B사 C사 D사 E사 F사\n지분율(%) 55.18*1 48.33*2 55.18*2 57.13*2 55.18*2\n*1 회사의 B사에 대한 투자지분율로 B사가 보유한 자기주식을 차감한 후 산정한 유효지분율임.\n회사의 B사에 대한 유효지분율은 B사의 자기주식처분으로 인해 12년말 78.6%에서 13년말\n55.18%로 하락하였음\n*2 C사,D사,E사,F사 등 4개사는 B사의 종속기업으로 B사가 각각 57.5%, 100%, 95.65%, 100%를\n보유하고 있으나 상기 지분율은 회사의 B사에 대한 지분율을 고려하여 산정한 종속기업에 대한 유효\n지분율임\n회사는 연결재무제표 작성 시 종속기업의 자본을 지배지분과 비지배지분으로 배분\n하는 과정에서 종속기업의 유효지분율 변동을 고려하지 않거나, 종속기업 자본의 변동액을\n비지배지분에 배분하지 않고 전액 지배지분에 배분함으로써 지배지분을 과대계상함\n3. 지적 근거 및 판단 내용\n기업회계기준서 제1110호(연결재무제표) 문단 22와 B96에 따르면 지배기업은 비지배\n지분을 연결재무상태표에서 자본에 포함하되 지배기업의 소유지분과는 구분하여\n별도로 표시해야 하고, 비지배지분이 보유한 자본의 비율이 변동된 경우 종속기업에\n대한 상대적 지분변동을 반영하여 지배지분과 비지배지분의 장부가액을 조정하도록\n규정하고 있음\n4. 감사절차 미흡사항\n회계감사기준 200(독립된 감사인의 전반목적 및 감사기준에 따른 감사의 수행), 500\n(감사증거)과 700(재무제표에 대한 의견형성과 보고) 등에 따르면 감사인은 재무제표를\n중요하게 왜곡표시 시킬 수 있는 상황이 존재할 수 있다는 전문가적인 의구심을 가지고\n감사업무를 계획하고 수행하여야 하며, 감사인은 감사의견 형성의 기초가 될 합리적인\n감사결론을 도출할 수 있도록 충분하고 적합한 감사증거를 확보하여야 하고, 재무제표가\n일반적으로 인정된 회계처리기준에 따라 중요성의 관점에서 적정하게 표시되고 있다고\n판단했을 경우에만 적정의견을 표명하도록 규정되어 있는바,\n감사인은 연결재무제표 감사시 지배기업의 종속기업에 대한 유효지분율의 변동을 확인\n하여야 하고 매년말 유효지분율을 적용하여 종속기업의 자본이 지배지분과 비지배지분에\n적정하게 배분되었는지에 대한 검토절차를 수행하여야 하나, 이를 간과하여 회사의\n회계처리 오류를 발견하지 못함\n- 47 -\n5. 시사점\n회사는 연결재무제표 작성시 종속기업지분변동에 대한 자료를 적시에 업데이트 해야\n하며 종속기업지분변동이 연결재무제표에 미치는 영향을 검증할 수 있는 연결시스템\n및 관련 내부통제절차를 수립해야 함\n감사인은 연결재무제표 감사시 지배기업이 종속기업의 지분을 100% 소유하지 못한\n경우에 종속기업에 대한 유효지분율의 변동을 확인하여야 하고, 매년말 유효지분율을\n적용하여 종속기업의 자본이 지배지분과 비지배지분에 적정하게 배분되었는지에 검토\n하여야 함\n- 48 -\n5 법규 위반사항",
        "issue_fields": [
          "연결재무제표 작성"
        ],
        "related_standards": [
          "기업회계기준서 제1110호(연결재무제표)"
        ],
        "case_type": "회계감리지적사례",
        "source": "KICPA 심사·감리 지적사례"
      },
      "content": {
        "section_1_company_accounting": {
          "section_title": "회사의 회계처리",
          "content": "회사는 종속기업의 자기주식 취득과 처분 등으로 인해 회사의 종속기업에 대한 유효\n지분율이 변동되었음에도 지배지분과 비지배지분 배분 시 이를 고려하지 아니하여\n지배지분을 과대계상함"
        },
        "section_2_violation_details": {
          "section_title": "회계기준 위반 지적 내용",
          "content": "회사는 지주회사로서 13년말 현재 B사 등 5개회사를 종속기업으로 보유하고 있으며\n각 연도 말 회사의 종속기업에 대한 투자지분율은 다음과 같음\n- 46 -\n<연도별 종속기업 투자지분율>\n구 분 B사 C사 D사 E사 F사\n지분율(%) 55.18*1 48.33*2 55.18*2 57.13*2 55.18*2\n*1 회사의 B사에 대한 투자지분율로 B사가 보유한 자기주식을 차감한 후 산정한 유효지분율임.\n회사의 B사에 대한 유효지분율은 B사의 자기주식처분으로 인해 12년말 78.6%에서 13년말\n55.18%로 하락하였음\n*2 C사,D사,E사,F사 등 4개사는 B사의 종속기업으로 B사가 각각 57.5%, 100%, 95.65%, 100%를\n보유하고 있으나 상기 지분율은 회사의 B사에 대한 지분율을 고려하여 산정한 종속기업에 대한 유효\n지분율임\n회사는 연결재무제표 작성 시 종속기업의 자본을 지배지분과 비지배지분으로 배분\n하는 과정에서 종속기업의 유효지분율 변동을 고려하지 않거나, 종속기업 자본의 변동액을\n비지배지분에 배분하지 않고 전액 지배지분에 배분함으로써 지배지분을 과대계상함"
        },
        "section_3_basis_judgment": {
          "section_title": "지적 근거 및 판단 내용",
          "content": "기업회계기준서 제1110호(연결재무제표) 문단 22와 B96에 따르면 지배기업은 비지배\n지분을 연결재무상태표에서 자본에 포함하되 지배기업의 소유지분과는 구분하여\n별도로 표시해야 하고, 비지배지분이 보유한 자본의 비율이 변동된 경우 종속기업에\n대한 상대적 지분변동을 반영하여 지배지분과 비지배지분의 장부가액을 조정하도록\n규정하고 있음"
        },
        "section_4_audit_procedure": {
          "section_title": "감사절차 미흡사항",
          "content": "회계감사기준 200(독립된 감사인의 전반목적 및 감사기준에 따른 감사의 수행), 500\n(감사증거)과 700(재무제표에 대한 의견형성과 보고) 등에 따르면 감사인은 재무제표를\n중요하게 왜곡표시 시킬 수 있는 상황이 존재할 수 있다는 전문가적인 의구심을 가지고\n감사업무를 계획하고 수행하여야 하며, 감사인은 감사의견 형성의 기초가 될 합리적인\n감사결론을 도출할 수 있도록 충분하고 적합한 감사증거를 확보하여야 하고, 재무제표가\n일반적으로 인정된 회계처리기준에 따라 중요성의 관점에서 적정하게 표시되고 있다고\n판단했을 경우에만 적정의견을 표명하도록 규정되어 있는바,\n감사인은 연결재무제표 감사시 지배기업의 종속기업에 대한 유효지분율의 변동을 확인\n하여야 하고 매년말 유효지분율을 적용하여 종속기업의 자본이 지배지분과 비지배지분에\n적정하게 배분되었는지에 대한 검토절차를 수행하여야 하나, 이를 간과하여 회사의\n회계처리 오류를 발견하지 못함\n- 47 -"
        },
        "section_5_implications": {
          "section_title": "시사점",
          "content": "회사는 연결재무제표 작성시 종속기업지분변동에 대한 자료를 적시에 업데이트 해야\n하며 종속기업지분변동이 연결재무제표에 미치는 영향을 검증할 수 있는 연결시스템\n및 관련 내부통제절차를 수립해야 함\n감사인은 연결재무제표 감사시 지배기업이 종속기업의 지분을 100% 소유하지 못한\n경우에 종속기업에 대한 유효지분율의 변동을 확인하여야 하고, 매년말 유효지분율을\n적용하여 종속기업의 자본이 지배지분과 비지배지분에 적정하게 배분되었는지에 검토\n하여야 함\n- 48 -\n5 법규 위반사항"
        }
      },
      "indexed_content": "케이스 ID: KICPA-2020-27\n제목: 지배지분의 과대계상\n결정연도: 2020년\n회계결산일: ’13.1.1.∼’14.12.31.\n1. 회사의 회계처리\n회사는 종속기업의 자기주식 취득과 처분 등으로 인해 회사의 종속기업에 대한 유효\n지분율이 변동되었음에도 지배지분과 비지배지분 배분 시 이를 고려하지 아니하여\n지배지분을 과대계상함\n2. 회계기준 위반 지적 내용\n회사는 지주회사로서 13년말 현재 B사 등 5개회사를 종속기업으로 보유하고 있으며\n각 연도 말 회사의 종속기업에 대한 투자지분율은 다음과 같음\n- 46 -\n<연도별 종속기업 투자지분율>\n구 분 B사 C사 D사 E사 F사\n지분율(%) 55.18*1 48.33*2 55.18*2 57.13*2 55.18*2\n*1 회사의 B사에 대한 투자지분율로 B사가 보유한 자기주식을 차감한 후 산정한 유효지분율임.\n회사의 B사에 대한 유효지분율은 B사의 자기주식처분으로 인해 12년말 78.6%에서 13년말\n55.18%로 하락하였음\n*2 C사,D사,E사,F사 등 4개사는 B사의 종속기업으로 B사가 각각 57.5%, 100%, 95.65%, 100%를\n보유하고 있으나 상기 지분율은 회사의 B사에 대한 지분율을 고려하여 산정한 종속기업에 대한 유효\n지분율임\n회사는 연결재무제표 작성 시 종속기업의 자본을 지배지분과 비지배지분으로 배분\n하는 과정에서 종속기업의 유효지분율 변동을 고려하지 않거나, 종속기업 자본의 변동액을\n비지배지분에 배분하지 않고 전액 지배지분에 배분함으로써 지배지분을 과대계상함\n3. 지적 근거 및 판단 내용\n기업회계기준서 제1110호(연결재무제표) 문단 22와 B96에 따르면 지배기업은 비지배\n지분을 연결재무상태표에서 자본에 포함하되 지배기업의 소유지분과는 구분하여\n별도로 표시해야 하고, 비지배지분이 보유한 자본의 비율이 변동된 경우 종속기업에\n대한 상대적 지분변동을 반영하여 지배지분과 비지배지분의 장부가액을 조정하도록\n규정하고 있음\n4. 감사절차 미흡사항\n회계감사기준 200(독립된 감사인의 전반목적 및 감사기준에 따른 감사의 수행), 500\n(감사증거)과 700(재무제표에 대한 의견형성과 보고) 등에 따르면 감사인은 재무제표를\n중요하게 왜곡표시 시킬 수 있는 상황이 존재할 수 있다는 전문가적인 의구심을 가지고\n감사업무를 계획하고 수행하여야 하며, 감사인은 감사의견 형성의 기초가 될 합리적인\n감사결론을 도출할 수 있도록 충분하고 적합한 감사증거를 확보하여야 하고, 재무제표가\n일반적으로 인정된 회계처리기준에 따라 중요성의 관점에서 적정하게 표시되고 있다고\n판단했을 경우에만 적정의견을 표명하도록 규정되어 있는바,\n감사인은 연결재무제표 감사시 지배기업의 종속기업에 대한 유효지분율의 변동을 확인\n하여야 하고 매년말 유효지분율을 적용하여 종속기업의 자본이 지배지분과 비지배지분에\n적정하게 배분되었는지에 대한 검토절차를 수행하여야 하나, 이를 간과하여 회사의\n회계처리 오류를 발견하지 못함\n- 47 -\n5. 시사점\n회사는 연결재무제표 작성시 종속기업지분변동에 대한 자료를 적시에 업데이트 해야\n하며 종속기업지분변동이 연결재무제표에 미치는 영향을 검증할 수 있는 연결시스템\n및 관련 내부통제절차를 수립해야 함\n감사인은 연결재무제표 감사시 지배기업이 종속기업의 지분을 100% 소유하지 못한\n경우에 종속기업에 대한 유효지분율의 변동을 확인하여야 하고, 매년말 유효지분율을\n적용하여 종속기업의 자본이 지배지분과 비지배지분에 적정하게 배분되었는지에 검토\n하여야 함\n- 48 -\n5 법규 위반사항\n쟁점분야: 연결재무제표 작성\n관련기준: 기업회계기준서 제1110호(연결재무제표)\n\n회사의 회계처리:\n회사는 종속기업의 자기주식 취득과 처분 등으로 인해 회사의 종속기업에 대한 유효\n지분율이 변동되었음에도 지배지분과 비지배지분 배분 시 이를 고려하지 아니하여\n지배지분을 과대계상함\n\n회계기준 위반 지적 내용:\n회사는 지주회사로서 13년말 현재 B사 등 5개회사를 종속기업으로 보유하고 있으며\n각 연도 말 회사의 종속기업에 대한 투자지분율은 다음과 같음\n- 46 -\n<연도별 종속기업 투자지분율>\n구 분 B사 C사 D사 E사 F사\n지분율(%) 55.18*1 48.33*2 55.18*2 57.13*2 55.18*2\n*1 회사의 B사에 대한 투자지분율로 B사가 보유한 자기주식을 차감한 후 산정한 유효지분율임.\n회사의 B사에 대한 유효지분율은 B사의 자기주식처분으로 인해 12년말 78.6%에서 13년말\n55.18%로 하락하였음\n*2 C사,D사,E사,F사 등 4개사는 B사의 종속기업으로 B사가 각각 57.5%, 100%, 95.65%, 100%를\n보유하고 있으나 상기 지분율은 회사의 B사에 대한 지분율을 고려하여 산정한 종속기업에 대한 유효\n지분율임\n회사는 연결재무제표 작성 시 종속기업의 자본을 지배지분과 비지배지분으로 배분\n하는 과정에서 종속기업의 유효지분율 변동을 고려하지 않거나, 종속기업 자본의 변동액을\n비지배지분에 배분하지 않고 전액 지배지분에 배분함으로써 지배지분을 과대계상함\n\n지적 근거 및 판단 내용:\n기업회계기준서 제1110호(연결재무제표) 문단 22와 B96에 따르면 지배기업은 비지배\n지분을 연결재무상태표에서 자본에 포함하되 지배기업의 소유지분과는 구분하여\n별도로 표시해야 하고, 비지배지분이 보유한 자본의 비율이 변동된 경우 종속기업에\n대한 상대적 지분변동을 반영하여 지배지분과 비지배지분의 장부가액을 조정하도록\n규정하고 있음\n\n감사절차 미흡사항:\n회계감사기준 200(독립된 감사인의 전반목적 및 감사기준에 따른 감사의 수행), 500\n(감사증거)과 700(재무제표에 대한 의견형성과 보고) 등에 따르면 감사인은 재무제표를\n중요하게 왜곡표시 시킬 수 있는 상황이 존재할 수 있다는 전문가적인 의구심을 가지고\n감사업무를 계획하고 수행하여야 하며, 감사인은 감사의견 형성의 기초가 될 합리적인\n감사결론을 도출할 수 있도록 충분하고 적합한 감사증거를 확보하여야 하고, 재무제표가\n일반적으로 인정된 회계처리기준에 따라 중요성의 관점에서 적정하게 표시되고 있다고\n판단했을 경우에만 적정의견을 표명하도록 규정되어 있는바,\n감사인은 연결재무제표 감사시 지배기업의 종속기업에 대한 유효지분율의 변동을 확인\n하여야 하고 매년말 유효지분율을 적용하여 종속기업의 자본이 지배지분과 비지배지분에\n적정하게 배분되었는지에 대한 검토절차를 수행하여야 하나, 이를 간과하여 회사의\n회계처리 오류를 발견하지 못함\n- 47 -\n\n시사점:\n회사는 연결재무제표 작성시 종속기업지분변동에 대한 자료를 적시에 업데이트 해야\n하며 종속기업지분변동이 연결재무제표에 미치는 영향을 검증할 수 있는 연결시스템\n및 관련 내부통제절차를 수립해야 함\n감사인은 연결재무제표 감사시 지배기업이 종속기업의 지분을 100% 소유하지 못한\n경우에 종속기업에 대한 유효지분율의 변동을 확인하여야 하고, 매년말 유효지분율을\n적용하여 종속기업의 자본이 지배지분과 비지배지분에 적정하게 배분되었는지에 검토\n하여야 함\n- 48 -\n5 법규 위반사항"
    },
    {
      "paragraph_id": "KICPA-2020-28",
      "case_id": "KICPA-2020-28",
      "case_title": "독립성의무 위반 [동일이사 연속감사제한 규정 위반]",
      "metadata": {
        "decision_year": "2020",
        "accounting_period": "",
        "issue_fields": [
          "외부감사법(독립성의무)위반"
        ],
        "related_standards": [
          "외부감사법"
        ],
        "case_type": "회계감리지적사례",
        "source": "KICPA 심사·감리 지적사례"
      },
      "content": {
        "section_1_company_accounting": {
          "section_title": "회사의 회계처리",
          "content": ""
        },
        "section_2_violation_details": {
          "section_title": "회계기준 위반 지적 내용",
          "content": ""
        },
        "section_3_basis_judgment": {
          "section_title": "지적 근거 및 판단 내용",
          "content": "외부감사법 제9조제5항에 따르면 감사인은 동일한 이사에게 회사의 연속하는 6개 사업\n연도(주권상장법인·대형비상장회사·금융회사의 경우에는 4개 사업연도)에 대한 감사업무를\n하게 할 수 없도록 규정되어 있음"
        },
        "section_4_audit_procedure": {
          "section_title": "감사절차 미흡사항",
          "content": ""
        },
        "section_5_implications": {
          "section_title": "시사점",
          "content": ""
        }
      },
      "indexed_content": "케이스 ID: KICPA-2020-28\n제목: 독립성의무 위반 [동일이사 연속감사제한 규정 위반]\n결정연도: 2020년\n회계결산일: \n쟁점분야: 외부감사법(독립성의무)위반\n관련기준: 외부감사법\n\n회사의 회계처리:\n\n\n회계기준 위반 지적 내용:\n\n\n지적 근거 및 판단 내용:\n외부감사법 제9조제5항에 따르면 감사인은 동일한 이사에게 회사의 연속하는 6개 사업\n연도(주권상장법인·대형비상장회사·금융회사의 경우에는 4개 사업연도)에 대한 감사업무를\n하게 할 수 없도록 규정되어 있음\n\n감사절차 미흡사항:\n\n\n시사점:\n"
    },
    {
      "paragraph_id": "KICPA-2020-29",
      "case_id": "KICPA-2020-29",
      "case_title": "독립성의무 위반 [동일이사 연속감사제한 규정 위반]",
      "metadata": {
        "decision_year": "2020",
        "accounting_period": "",
        "issue_fields": [
          "외부감사법(독립성의무)위반"
        ],
        "related_standards": [
          "외부감사법"
        ],
        "case_type": "회계감리지적사례",
        "source": "KICPA 심사·감리 지적사례"
      },
      "content": {
        "section_1_company_accounting": {
          "section_title": "회사의 회계처리",
          "content": ""
        },
        "section_2_violation_details": {
          "section_title": "회계기준 위반 지적 내용",
          "content": ""
        },
        "section_3_basis_judgment": {
          "section_title": "지적 근거 및 판단 내용",
          "content": "舊외부감사법 제3조제4항에 따르면 회계법인인 감사인은 동일한 이사에게 회사의 연속\n하는 6개 사업연도에 대한 감사업무를 하게 할 수 없도록 규정하고 있음"
        },
        "section_4_audit_procedure": {
          "section_title": "감사절차 미흡사항",
          "content": ""
        },
        "section_5_implications": {
          "section_title": "시사점",
          "content": ""
        }
      },
      "indexed_content": "케이스 ID: KICPA-2020-29\n제목: 독립성의무 위반 [동일이사 연속감사제한 규정 위반]\n결정연도: 2020년\n회계결산일: \n쟁점분야: 외부감사법(독립성의무)위반\n관련기준: 외부감사법\n\n회사의 회계처리:\n\n\n회계기준 위반 지적 내용:\n\n\n지적 근거 및 판단 내용:\n舊외부감사법 제3조제4항에 따르면 회계법인인 감사인은 동일한 이사에게 회사의 연속\n하는 6개 사업연도에 대한 감사업무를 하게 할 수 없도록 규정하고 있음\n\n감사절차 미흡사항:\n\n\n시사점:\n"
    },
    {
      "paragraph_id": "KICPA-2020-30",
      "case_id": "KICPA-2020-30",
      "case_title": "독립성의무 위반 [재무제표 작성지원금지 규정 위반]",
      "metadata": {
        "decision_year": "2020",
        "accounting_period": "",
        "issue_fields": [
          "외부감사법(독립성의무)위반"
        ],
        "related_standards": [
          "외부감사법",
          "공인회계사법"
        ],
        "case_type": "회계감리지적사례",
        "source": "KICPA 심사·감리 지적사례"
      },
      "content": {
        "section_1_company_accounting": {
          "section_title": "회사의 회계처리",
          "content": ""
        },
        "section_2_violation_details": {
          "section_title": "회계기준 위반 지적 내용",
          "content": ""
        },
        "section_3_basis_judgment": {
          "section_title": "지적 근거 및 판단 내용",
          "content": "舊외부감사법 제7조제4항(新외부감사법 제6조제6항), 동법 시행령 제6조제5항 및\n공인회계사법 제21조제2항과 제33조제2항에 따르면 회사의 재무제표를 대표이사와\n회계담당 이사를 대신하여 작성하거나 재무제표 작성과 관련된 회계처리에 대한 자문에\n응하는 등의 행위를 하지 못하도록 규정하고 있음"
        },
        "section_4_audit_procedure": {
          "section_title": "감사절차 미흡사항",
          "content": ""
        },
        "section_5_implications": {
          "section_title": "시사점",
          "content": ""
        }
      },
      "indexed_content": "케이스 ID: KICPA-2020-30\n제목: 독립성의무 위반 [재무제표 작성지원금지 규정 위반]\n결정연도: 2020년\n회계결산일: \n쟁점분야: 외부감사법(독립성의무)위반\n관련기준: 외부감사법, 공인회계사법\n\n회사의 회계처리:\n\n\n회계기준 위반 지적 내용:\n\n\n지적 근거 및 판단 내용:\n舊외부감사법 제7조제4항(新외부감사법 제6조제6항), 동법 시행령 제6조제5항 및\n공인회계사법 제21조제2항과 제33조제2항에 따르면 회사의 재무제표를 대표이사와\n회계담당 이사를 대신하여 작성하거나 재무제표 작성과 관련된 회계처리에 대한 자문에\n응하는 등의 행위를 하지 못하도록 규정하고 있음\n\n감사절차 미흡사항:\n\n\n시사점:\n"
    },
    {
      "paragraph_id": "KICPA-2020-31",
      "case_id": "KICPA-2020-31",
      "case_title": "독립성의무 위반 [재무제표 작성지원금지 규정 위반]",
      "metadata": {
        "decision_year": "2020",
        "accounting_period": "",
        "issue_fields": [
          "외부감사법(독립성의무)위반"
        ],
        "related_standards": [
          "외부감사법",
          "공인회계사법"
        ],
        "case_type": "회계감리지적사례",
        "source": "KICPA 심사·감리 지적사례"
      },
      "content": {
        "section_1_company_accounting": {
          "section_title": "회사의 회계처리",
          "content": ""
        },
        "section_2_violation_details": {
          "section_title": "회계기준 위반 지적 내용",
          "content": ""
        },
        "section_3_basis_judgment": {
          "section_title": "지적 근거 및 판단 내용",
          "content": "舊외부감사법 제7조제4항(新외부감사법 제6조제6항), 동법 시행령 제6조제5항 및\n공인회계사법 제21조제2항과 제33조제2항에 따르면 회사의 재무제표를 대표이사와\n회계담당 이사를 대신하여 작성하거나 재무제표 작성과 관련된 회계처리에 대한 자문에\n응하는 등의 행위를 하지 못하도록 규정하고 있음"
        },
        "section_4_audit_procedure": {
          "section_title": "감사절차 미흡사항",
          "content": ""
        },
        "section_5_implications": {
          "section_title": "시사점",
          "content": ""
        }
      },
      "indexed_content": "케이스 ID: KICPA-2020-31\n제목: 독립성의무 위반 [재무제표 작성지원금지 규정 위반]\n결정연도: 2020년\n회계결산일: \n쟁점분야: 외부감사법(독립성의무)위반\n관련기준: 외부감사법, 공인회계사법\n\n회사의 회계처리:\n\n\n회계기준 위반 지적 내용:\n\n\n지적 근거 및 판단 내용:\n舊외부감사법 제7조제4항(新외부감사법 제6조제6항), 동법 시행령 제6조제5항 및\n공인회계사법 제21조제2항과 제33조제2항에 따르면 회사의 재무제표를 대표이사와\n회계담당 이사를 대신하여 작성하거나 재무제표 작성과 관련된 회계처리에 대한 자문에\n응하는 등의 행위를 하지 못하도록 규정하고 있음\n\n감사절차 미흡사항:\n\n\n시사점:\n"
    },
    {
      "paragraph_id": "KICPA-2020-32",
      "case_id": "KICPA-2020-32",
      "case_title": "독립성의무 위반 [직무제한 규정 위반]",
      "metadata": {
        "decision_year": "2020",
        "accounting_period": "",
        "issue_fields": [
          "외부감사법(독립성의무)위반"
        ],
        "related_standards": [
          "외부감사법",
          "공인회계사법"
        ],
        "case_type": "회계감리지적사례",
        "source": "KICPA 심사·감리 지적사례"
      },
      "content": {
        "section_1_company_accounting": {
          "section_title": "회사의 회계처리",
          "content": "회사는 반도체유해가스처리장치 및 자동차매연저감장치를 제조 납품하는 업체로 매출\n매입 거래처의 임직원 등과 공모하여 재고자산의 이동이 없이 매출 매입 계약서를\n허위로 작성하고 매출 매입대금이 회수 지급된 것으로 꾸며 매출 및 매출원가를 과대\n계상함"
        },
        "section_2_violation_details": {
          "section_title": "회계기준 위반 지적 내용",
          "content": "회사는 매출 매입 거래처의 임직원 등과 공모하여 증빙위조 등을 통해 경제적 사실과\n거래의 실질이 없는 매출 및 매출원가를 과대 계상함"
        },
        "section_3_basis_judgment": {
          "section_title": "지적 근거 및 판단 내용",
          "content": "舊외부감사법 제3조제3항, 舊 공인회계사법 제21조제1항, 제33조제1항에 따르면 공인\n회계사는 자기 또는 감사인 소속 사원이 임원이나 그에 준하는 직위에 있는 회사의 재무\n제표를 감사하거나 증명하는 직무를 행할 수 없도록 규정하고 있음"
        },
        "section_4_audit_procedure": {
          "section_title": "감사절차 미흡사항",
          "content": "회계감사기준 200(독립된 감사인의 전반목적 및 감사기준에 따른 감사의 수행), 500\n(감사증거)과 700(재무제표에 대한 의견형성과 보고) 등에 따르면 감사인은 재무제표를\n중요하게 왜곡표시 시킬 수 있는 상황이 존재할 수 있다는 전문가적인 의구심을 가지고\n감사업무를 계획하고 수행하여야 하며, 감사인은 감사의견 형성의 기초가 될 합리적인\n감사결론을 도출할 수 있도록 충분하고 적합한 감사증거를 확보하여야 하고, 재무제표가\n- 4 -\n일반적으로 인정된 회계처리기준에 따라 중요성의 관점에서 적정하게 표시되고 있다고\n판단했을 경우에만 적정의견을 표명하도록 규정되어 있는 바,\n감사인은 매출액의 상당부분에 대해 세금계산서가 미발행 누적매출액의 되어 손익\n계산서 상의 매출액과 부가세신고서 상의 매출액에 차이가 발생하는 상황이므로 전문가적\n의구심을 가지고 매출의 발생사실을 확인하기 위해 계약서 및 대금회수 증빙 이외에 제품의\n실물이동을 확인하는 감사절차를 추가적으로 수행하여야 했음에도 이를 소홀히 하여\n허위의 매출 및 매출원가를 발견하지 못함"
        },
        "section_5_implications": {
          "section_title": "시사점",
          "content": "회사는 회계업무를 독립적으로 분리하고 장기간 동일인이 수행하지 않도록 방지할 필요가\n있으며 경영진 및 회계부정에 대한 내부 신고 절차가 작동되도록 감시기구를 활성화 할\n필요가 존재함 또한 대표이사의 횡령 등으로 수사가 진행 중인 경우 재무제표에 미치는\n영향을 고려하여 관련 사실을 정보이용자가 인지할 수 있도록 충분하게 주석에 공시하여야 함\n감사인은 매출의 발생사실 및 수익인식의 적정성을 확인하기 위해 매출 매입 를\n검토하고 거래처와의 계약서 대금의 회수 지급내역을 확인하는 감사절차 외에도 제품의\n실물이동과 관련한 입 출고 운송관련 서류를 검토하는 등의 감사절차를 종합적으로 실시\n해야 함\n심사 감리지적사례\n매출 및 매출원가 과대계상\n 쟁점분야 매출 및 매출원가 과대계상\n 관련기준 구 기업회계기준서 제 호 재무제표의 작성과 표시\n 결정연도 년\n 회계결산일"
        }
      },
      "indexed_content": "케이스 ID: KICPA-2020-32\n제목: 독립성의무 위반 [직무제한 규정 위반]\n결정연도: 2020년\n회계결산일: \n쟁점분야: 외부감사법(독립성의무)위반\n관련기준: 외부감사법, 공인회계사법\n\n회사의 회계처리:\n회사는 반도체유해가스처리장치 및 자동차매연저감장치를 제조 납품하는 업체로 매출\n매입 거래처의 임직원 등과 공모하여 재고자산의 이동이 없이 매출 매입 계약서를\n허위로 작성하고 매출 매입대금이 회수 지급된 것으로 꾸며 매출 및 매출원가를 과대\n계상함\n\n회계기준 위반 지적 내용:\n회사는 매출 매입 거래처의 임직원 등과 공모하여 증빙위조 등을 통해 경제적 사실과\n거래의 실질이 없는 매출 및 매출원가를 과대 계상함\n\n지적 근거 및 판단 내용:\n舊외부감사법 제3조제3항, 舊 공인회계사법 제21조제1항, 제33조제1항에 따르면 공인\n회계사는 자기 또는 감사인 소속 사원이 임원이나 그에 준하는 직위에 있는 회사의 재무\n제표를 감사하거나 증명하는 직무를 행할 수 없도록 규정하고 있음\n\n감사절차 미흡사항:\n회계감사기준 200(독립된 감사인의 전반목적 및 감사기준에 따른 감사의 수행), 500\n(감사증거)과 700(재무제표에 대한 의견형성과 보고) 등에 따르면 감사인은 재무제표를\n중요하게 왜곡표시 시킬 수 있는 상황이 존재할 수 있다는 전문가적인 의구심을 가지고\n감사업무를 계획하고 수행하여야 하며, 감사인은 감사의견 형성의 기초가 될 합리적인\n감사결론을 도출할 수 있도록 충분하고 적합한 감사증거를 확보하여야 하고, 재무제표가\n- 4 -\n일반적으로 인정된 회계처리기준에 따라 중요성의 관점에서 적정하게 표시되고 있다고\n판단했을 경우에만 적정의견을 표명하도록 규정되어 있는 바,\n감사인은 매출액의 상당부분에 대해 세금계산서가 미발행 누적매출액의 되어 손익\n계산서 상의 매출액과 부가세신고서 상의 매출액에 차이가 발생하는 상황이므로 전문가적\n의구심을 가지고 매출의 발생사실을 확인하기 위해 계약서 및 대금회수 증빙 이외에 제품의\n실물이동을 확인하는 감사절차를 추가적으로 수행하여야 했음에도 이를 소홀히 하여\n허위의 매출 및 매출원가를 발견하지 못함\n\n시사점:\n회사는 회계업무를 독립적으로 분리하고 장기간 동일인이 수행하지 않도록 방지할 필요가\n있으며 경영진 및 회계부정에 대한 내부 신고 절차가 작동되도록 감시기구를 활성화 할\n필요가 존재함 또한 대표이사의 횡령 등으로 수사가 진행 중인 경우 재무제표에 미치는\n영향을 고려하여 관련 사실을 정보이용자가 인지할 수 있도록 충분하게 주석에 공시하여야 함\n감사인은 매출의 발생사실 및 수익인식의 적정성을 확인하기 위해 매출 매입 를\n검토하고 거래처와의 계약서 대금의 회수 지급내역을 확인하는 감사절차 외에도 제품의\n실물이동과 관련한 입 출고 운송관련 서류를 검토하는 등의 감사절차를 종합적으로 실시\n해야 함\n심사 감리지적사례\n매출 및 매출원가 과대계상\n 쟁점분야 매출 및 매출원가 과대계상\n 관련기준 구 기업회계기준서 제 호 재무제표의 작성과 표시\n 결정연도 년\n 회계결산일"
    },
    {
      "paragraph_id": "KICPA-2025-01",
      "case_id": "KICPA-2025-01",
      "case_title": "공사수익과 공사원가 오류",
      "metadata": {
        "decision_year": "2025",
        "accounting_period": "’19.1.1.∼’22.12.31.\n1. 회사의 회계처리\n회사는 프레스 금형을 제작하여 완성차업체에 납품하는 회사로 제품은 고객사의 요청에\n따라 주문생산방식으로 생산되며 통상적으로 생산기간이 장기간(15~24개월) 소요됨.\n회사는 금형 매출의 수익인식과 관련하여 공사진행기준을 적용하지 않고 국내매출에\n대해서는 세금계산서 발행기준, 해외매출에 대해서는 인도기준(선적일)을 적용하였음\n또한, 회사는 공사진행기준 적용시 당기 발생원가 전액을 공사원가로 대체해야 하나\n발생원가 중 세금계산서 발행비율에 따라 안분한 금액만을 공사원가로 인식하고, 발생\n원가와 공사원가와의 차이는 기말 재고자산(재공품)으로 계상함\n2. 회계기준 위반 지적 내용\n회사는 금형매출과 관련한 공사계약의 결과를 신뢰성있게 추정할 수 있으므로 공사\n진행기준을 적용하여 수익을 인식하여야 하나 세금계산서 발행기준(국내거래)과 인도\n기준(해외거래)으로 잘못 적용하였고, 당기 발생 총공사비용을 전액 공사원가로 계상해야\n함에도 세금계산서 발행 비율에 대해서만 공사원가로 계상함으로써 연도별 공사수익,\n공사원가 및 재고자산 등을 과대(과소) 계상함\n3. 지적 근거 및 판단 내용\n일반기업회계기준 제16장(수익) 문단 16.39, 16.40, 16.41 및 16.44에 의하면 공사결과를\n신뢰성 있게 추정할 수 있을 때는 진행기준을 적용하여 공사수익을 인식하여야 하며,\n공사원가는 공사가 수행된 회계기간에 실제로 발생한 총공사비용으로 인식하도록 규정\n하고 있음\n- 5 -\n한국공인회계사회는 상기 회계기준 등을 고려하여, 회사가 금형매출의 수익인식과\n관련하여 공사진행기준을 적용하지 않아 공사수익, 공사원가 및 재고자산 등을 과대\n(과소) 계상하였다고 판단함\n4. 감사절차 미흡사항\n회계감사기준 200(독립된 감사인의 전반목적 및 감사기준에 따른 감사의 수행), 500\n(감사증거)과 700(재무제표에 대한 의견형성과 보고) 등에 따르면 감사인은 재무제표를\n중요하게 왜곡표시 시킬 수 있는 상황이 존재할 수 있다는 전문가적인 의구심을 가지고\n감사업무를 계획하고 수행하여야 하며, 감사인은 감사의견 형성의 기초가 될 합리적인\n감사결론을 도출할 수 있도록 충분하고 적합한 감사증거를 확보하여야 하고, 재무제표가\n일반적으로 인정된 회계처리기준에 따라 중요성의 관점에서 적정하게 표시되고 있다고\n판단했을 경우에만 적정의견을 표명하도록 규정되어 있음\n감사인은 회사가 동일한 성격의 국내 매출과 해외 매출에 대해 상이한 수익인식 기준을\n적용하고 있었음에도 이에 대한 전문가적 의구심 없이 회사의 회계처리를 수용하였\n으며, 주문생산방식으로 제품을 제작하는 업종의 특성을 감안할 때 장기간에 걸쳐 수행\n되는 주요 계약에 대해 공사진행기준 적용여부 등을 면밀히 검토해야 함에도 불구하고,\n관련 절차를 소홀히 하여 위반행위가 발생함\n5. 시사점\n회사는 수주산업의 특성을 고려시 기업회계기준에 따라 공사진행기준 적용여부를\n판단하여 수익인식의 적정성을 검토할 수 있는 내부통제절차를 갖출 필요가 있음\n감사인은 회사의 수익인식 관련 내부통제절차를 이해하고, 이를 고려하여 감사절차를\n수행하여야 함. 특히, 수익인식과 관련하여 결산담당자의 진술에만 의존하지 않고 현업\n담당자와의 면담을 수행할 필요가 있고 관련한 매출계약서를 면밀히 검토하여야 함\n- 6 -",
        "issue_fields": [
          "공사진행률"
        ],
        "related_standards": [
          "일반기업회계기준 제16장(수익)"
        ],
        "case_type": "회계감리지적사례",
        "source": "KICPA 심사·감리 지적사례"
      },
      "content": {
        "section_1_company_accounting": {
          "section_title": "회사의 회계처리",
          "content": "회사는 프레스 금형을 제작하여 완성차업체에 납품하는 회사로 제품은 고객사의 요청에\n따라 주문생산방식으로 생산되며 통상적으로 생산기간이 장기간(15~24개월) 소요됨.\n회사는 금형 매출의 수익인식과 관련하여 공사진행기준을 적용하지 않고 국내매출에\n대해서는 세금계산서 발행기준, 해외매출에 대해서는 인도기준(선적일)을 적용하였음\n또한, 회사는 공사진행기준 적용시 당기 발생원가 전액을 공사원가로 대체해야 하나\n발생원가 중 세금계산서 발행비율에 따라 안분한 금액만을 공사원가로 인식하고, 발생\n원가와 공사원가와의 차이는 기말 재고자산(재공품)으로 계상함"
        },
        "section_2_violation_details": {
          "section_title": "회계기준 위반 지적 내용",
          "content": "회사는 금형매출과 관련한 공사계약의 결과를 신뢰성있게 추정할 수 있으므로 공사\n진행기준을 적용하여 수익을 인식하여야 하나 세금계산서 발행기준(국내거래)과 인도\n기준(해외거래)으로 잘못 적용하였고, 당기 발생 총공사비용을 전액 공사원가로 계상해야\n함에도 세금계산서 발행 비율에 대해서만 공사원가로 계상함으로써 연도별 공사수익,\n공사원가 및 재고자산 등을 과대(과소) 계상함"
        },
        "section_3_basis_judgment": {
          "section_title": "지적 근거 및 판단 내용",
          "content": "일반기업회계기준 제16장(수익) 문단 16.39, 16.40, 16.41 및 16.44에 의하면 공사결과를\n신뢰성 있게 추정할 수 있을 때는 진행기준을 적용하여 공사수익을 인식하여야 하며,\n공사원가는 공사가 수행된 회계기간에 실제로 발생한 총공사비용으로 인식하도록 규정\n하고 있음\n- 5 -\n한국공인회계사회는 상기 회계기준 등을 고려하여, 회사가 금형매출의 수익인식과\n관련하여 공사진행기준을 적용하지 않아 공사수익, 공사원가 및 재고자산 등을 과대\n(과소) 계상하였다고 판단함"
        },
        "section_4_audit_procedure": {
          "section_title": "감사절차 미흡사항",
          "content": "회계감사기준 200(독립된 감사인의 전반목적 및 감사기준에 따른 감사의 수행), 500\n(감사증거)과 700(재무제표에 대한 의견형성과 보고) 등에 따르면 감사인은 재무제표를\n중요하게 왜곡표시 시킬 수 있는 상황이 존재할 수 있다는 전문가적인 의구심을 가지고\n감사업무를 계획하고 수행하여야 하며, 감사인은 감사의견 형성의 기초가 될 합리적인\n감사결론을 도출할 수 있도록 충분하고 적합한 감사증거를 확보하여야 하고, 재무제표가\n일반적으로 인정된 회계처리기준에 따라 중요성의 관점에서 적정하게 표시되고 있다고\n판단했을 경우에만 적정의견을 표명하도록 규정되어 있음\n감사인은 회사가 동일한 성격의 국내 매출과 해외 매출에 대해 상이한 수익인식 기준을\n적용하고 있었음에도 이에 대한 전문가적 의구심 없이 회사의 회계처리를 수용하였\n으며, 주문생산방식으로 제품을 제작하는 업종의 특성을 감안할 때 장기간에 걸쳐 수행\n되는 주요 계약에 대해 공사진행기준 적용여부 등을 면밀히 검토해야 함에도 불구하고,\n관련 절차를 소홀히 하여 위반행위가 발생함"
        },
        "section_5_implications": {
          "section_title": "시사점",
          "content": "회사는 수주산업의 특성을 고려시 기업회계기준에 따라 공사진행기준 적용여부를\n판단하여 수익인식의 적정성을 검토할 수 있는 내부통제절차를 갖출 필요가 있음\n감사인은 회사의 수익인식 관련 내부통제절차를 이해하고, 이를 고려하여 감사절차를\n수행하여야 함. 특히, 수익인식과 관련하여 결산담당자의 진술에만 의존하지 않고 현업\n담당자와의 면담을 수행할 필요가 있고 관련한 매출계약서를 면밀히 검토하여야 함\n- 6 -"
        }
      },
      "indexed_content": "케이스 ID: KICPA-2025-01\n제목: 공사수익과 공사원가 오류\n결정연도: 2025년\n회계결산일: ’19.1.1.∼’22.12.31.\n1. 회사의 회계처리\n회사는 프레스 금형을 제작하여 완성차업체에 납품하는 회사로 제품은 고객사의 요청에\n따라 주문생산방식으로 생산되며 통상적으로 생산기간이 장기간(15~24개월) 소요됨.\n회사는 금형 매출의 수익인식과 관련하여 공사진행기준을 적용하지 않고 국내매출에\n대해서는 세금계산서 발행기준, 해외매출에 대해서는 인도기준(선적일)을 적용하였음\n또한, 회사는 공사진행기준 적용시 당기 발생원가 전액을 공사원가로 대체해야 하나\n발생원가 중 세금계산서 발행비율에 따라 안분한 금액만을 공사원가로 인식하고, 발생\n원가와 공사원가와의 차이는 기말 재고자산(재공품)으로 계상함\n2. 회계기준 위반 지적 내용\n회사는 금형매출과 관련한 공사계약의 결과를 신뢰성있게 추정할 수 있으므로 공사\n진행기준을 적용하여 수익을 인식하여야 하나 세금계산서 발행기준(국내거래)과 인도\n기준(해외거래)으로 잘못 적용하였고, 당기 발생 총공사비용을 전액 공사원가로 계상해야\n함에도 세금계산서 발행 비율에 대해서만 공사원가로 계상함으로써 연도별 공사수익,\n공사원가 및 재고자산 등을 과대(과소) 계상함\n3. 지적 근거 및 판단 내용\n일반기업회계기준 제16장(수익) 문단 16.39, 16.40, 16.41 및 16.44에 의하면 공사결과를\n신뢰성 있게 추정할 수 있을 때는 진행기준을 적용하여 공사수익을 인식하여야 하며,\n공사원가는 공사가 수행된 회계기간에 실제로 발생한 총공사비용으로 인식하도록 규정\n하고 있음\n- 5 -\n한국공인회계사회는 상기 회계기준 등을 고려하여, 회사가 금형매출의 수익인식과\n관련하여 공사진행기준을 적용하지 않아 공사수익, 공사원가 및 재고자산 등을 과대\n(과소) 계상하였다고 판단함\n4. 감사절차 미흡사항\n회계감사기준 200(독립된 감사인의 전반목적 및 감사기준에 따른 감사의 수행), 500\n(감사증거)과 700(재무제표에 대한 의견형성과 보고) 등에 따르면 감사인은 재무제표를\n중요하게 왜곡표시 시킬 수 있는 상황이 존재할 수 있다는 전문가적인 의구심을 가지고\n감사업무를 계획하고 수행하여야 하며, 감사인은 감사의견 형성의 기초가 될 합리적인\n감사결론을 도출할 수 있도록 충분하고 적합한 감사증거를 확보하여야 하고, 재무제표가\n일반적으로 인정된 회계처리기준에 따라 중요성의 관점에서 적정하게 표시되고 있다고\n판단했을 경우에만 적정의견을 표명하도록 규정되어 있음\n감사인은 회사가 동일한 성격의 국내 매출과 해외 매출에 대해 상이한 수익인식 기준을\n적용하고 있었음에도 이에 대한 전문가적 의구심 없이 회사의 회계처리를 수용하였\n으며, 주문생산방식으로 제품을 제작하는 업종의 특성을 감안할 때 장기간에 걸쳐 수행\n되는 주요 계약에 대해 공사진행기준 적용여부 등을 면밀히 검토해야 함에도 불구하고,\n관련 절차를 소홀히 하여 위반행위가 발생함\n5. 시사점\n회사는 수주산업의 특성을 고려시 기업회계기준에 따라 공사진행기준 적용여부를\n판단하여 수익인식의 적정성을 검토할 수 있는 내부통제절차를 갖출 필요가 있음\n감사인은 회사의 수익인식 관련 내부통제절차를 이해하고, 이를 고려하여 감사절차를\n수행하여야 함. 특히, 수익인식과 관련하여 결산담당자의 진술에만 의존하지 않고 현업\n담당자와의 면담을 수행할 필요가 있고 관련한 매출계약서를 면밀히 검토하여야 함\n- 6 -\n쟁점분야: 공사진행률\n관련기준: 일반기업회계기준 제16장(수익)\n\n회사의 회계처리:\n회사는 프레스 금형을 제작하여 완성차업체에 납품하는 회사로 제품은 고객사의 요청에\n따라 주문생산방식으로 생산되며 통상적으로 생산기간이 장기간(15~24개월) 소요됨.\n회사는 금형 매출의 수익인식과 관련하여 공사진행기준을 적용하지 않고 국내매출에\n대해서는 세금계산서 발행기준, 해외매출에 대해서는 인도기준(선적일)을 적용하였음\n또한, 회사는 공사진행기준 적용시 당기 발생원가 전액을 공사원가로 대체해야 하나\n발생원가 중 세금계산서 발행비율에 따라 안분한 금액만을 공사원가로 인식하고, 발생\n원가와 공사원가와의 차이는 기말 재고자산(재공품)으로 계상함\n\n회계기준 위반 지적 내용:\n회사는 금형매출과 관련한 공사계약의 결과를 신뢰성있게 추정할 수 있으므로 공사\n진행기준을 적용하여 수익을 인식하여야 하나 세금계산서 발행기준(국내거래)과 인도\n기준(해외거래)으로 잘못 적용하였고, 당기 발생 총공사비용을 전액 공사원가로 계상해야\n함에도 세금계산서 발행 비율에 대해서만 공사원가로 계상함으로써 연도별 공사수익,\n공사원가 및 재고자산 등을 과대(과소) 계상함\n\n지적 근거 및 판단 내용:\n일반기업회계기준 제16장(수익) 문단 16.39, 16.40, 16.41 및 16.44에 의하면 공사결과를\n신뢰성 있게 추정할 수 있을 때는 진행기준을 적용하여 공사수익을 인식하여야 하며,\n공사원가는 공사가 수행된 회계기간에 실제로 발생한 총공사비용으로 인식하도록 규정\n하고 있음\n- 5 -\n한국공인회계사회는 상기 회계기준 등을 고려하여, 회사가 금형매출의 수익인식과\n관련하여 공사진행기준을 적용하지 않아 공사수익, 공사원가 및 재고자산 등을 과대\n(과소) 계상하였다고 판단함\n\n감사절차 미흡사항:\n회계감사기준 200(독립된 감사인의 전반목적 및 감사기준에 따른 감사의 수행), 500\n(감사증거)과 700(재무제표에 대한 의견형성과 보고) 등에 따르면 감사인은 재무제표를\n중요하게 왜곡표시 시킬 수 있는 상황이 존재할 수 있다는 전문가적인 의구심을 가지고\n감사업무를 계획하고 수행하여야 하며, 감사인은 감사의견 형성의 기초가 될 합리적인\n감사결론을 도출할 수 있도록 충분하고 적합한 감사증거를 확보하여야 하고, 재무제표가\n일반적으로 인정된 회계처리기준에 따라 중요성의 관점에서 적정하게 표시되고 있다고\n판단했을 경우에만 적정의견을 표명하도록 규정되어 있음\n감사인은 회사가 동일한 성격의 국내 매출과 해외 매출에 대해 상이한 수익인식 기준을\n적용하고 있었음에도 이에 대한 전문가적 의구심 없이 회사의 회계처리를 수용하였\n으며, 주문생산방식으로 제품을 제작하는 업종의 특성을 감안할 때 장기간에 걸쳐 수행\n되는 주요 계약에 대해 공사진행기준 적용여부 등을 면밀히 검토해야 함에도 불구하고,\n관련 절차를 소홀히 하여 위반행위가 발생함\n\n시사점:\n회사는 수주산업의 특성을 고려시 기업회계기준에 따라 공사진행기준 적용여부를\n판단하여 수익인식의 적정성을 검토할 수 있는 내부통제절차를 갖출 필요가 있음\n감사인은 회사의 수익인식 관련 내부통제절차를 이해하고, 이를 고려하여 감사절차를\n수행하여야 함. 특히, 수익인식과 관련하여 결산담당자의 진술에만 의존하지 않고 현업\n담당자와의 면담을 수행할 필요가 있고 관련한 매출계약서를 면밀히 검토하여야 함\n- 6 -"
    },
    {
      "paragraph_id": "KICPA-2025-02",
      "case_id": "KICPA-2025-02",
      "case_title": "분양수익과 분양원가 오류",
      "metadata": {
        "decision_year": "2025",
        "accounting_period": "’22.1.1.∼’23.12.31.\n1. 회사의 회계처리\n회사는 오피스텔 분양사업에 시행사로 참여하고 있음. 회사는 분양수익을 진행기준에\n따라 수익을 인식하면서 자본화대상 금융비용을 포함하여 공사진행률을 산정하거나,\n분양수수료와 중도금 대출이자 등을 공사원가로 분류하였음. 또한, 분양원가 계산시\n일부 공사원가에 분양률이 아닌 공사진행률을 적용하여 원가를 산정하였음\n2. 회계기준 위반 지적 내용\n회사는 공사진행률 산정 시 제외되어야 할 자본화 대상 금융비용 등을 포함하여 공사\n진행률을 잘못 계산함으로써 분양수익과 분양원가를 과소(과대)계상하였으며, 판매비와\n관리비로 인식해야 할 분양수수료와 중도금 대출이자 대납액 등을 공사원가로 계상\n하고 분양원가 계산 시 분양률이 아닌 공사진행률을 잘못 적용함에 따라 재고자산\n(미성공사)과 분양원가를 각각 잘못 계산하여 재고자산과 자기자본을 과대계상하였음\n3. 지적 근거 및 판단 내용\n일반기업회계기준 제2장(재무제표의 작성과 표시Ⅰ) 문단 2.7 및 문단 2.49에 따르면 재무\n제표는 경제적 사실과 거래의 실질을 반영하여 기업의 재무상태, 경영성과, 현금흐름 및\n자본변동을 공정하게 표시하여야 하고, 판매비와관리비는 제품, 상품, 용역 등의 판매\n활동과 기업의 관리활동에서 발생하는 비용으로서 매출원가에 속하지 아니하는 모든 영업\n비용을 포함하여야 하며,\n일반기업회계기준 제16장(수익) 문단 16.47에 따르면 공사진행률은 실제공사비 발생액을\n토지의 취득원가와 자본화대상 금융비용 등을 제외한 총공사예정원가로 나눈 비율로 계\n산하도록 규정하고 있음\n한국공인회계사회는 상기 회계기준을 고려하여, 자본화대상 금융비용은 진행률 산정시\n제외하여야 하며, 중도금 대출 이자 대납액 등은 공사원가가 아닌 판매비와 관리비로\n- 7 -\n회계처리하여야 한다고 판단함\n4. 감사절차 미흡사항\n동 지적사례는 재무제표에 대한 심사로 종결되어 감사보고서 감리는 실시하지 아니함\n5. 시사점\n회사는 공사진행률, 공사원가 및 분양 원가 계산시 오류가 발생할 수 있으므로 관련\n회계처리기준을 숙지하고 이에 대한 검토절차를 강화하여 재무정보가 정보이용자에게\n적정하게 제공될 수 있도록 하여야함",
        "issue_fields": [
          "공사진행률"
        ],
        "related_standards": [
          "일반기업회계기준 제2장(재무제표의 작성과 표시Ⅰ) 및 제16장(수익)"
        ],
        "case_type": "회계감리지적사례",
        "source": "KICPA 심사·감리 지적사례"
      },
      "content": {
        "section_1_company_accounting": {
          "section_title": "회사의 회계처리",
          "content": "회사는 오피스텔 분양사업에 시행사로 참여하고 있음. 회사는 분양수익을 진행기준에\n따라 수익을 인식하면서 자본화대상 금융비용을 포함하여 공사진행률을 산정하거나,\n분양수수료와 중도금 대출이자 등을 공사원가로 분류하였음. 또한, 분양원가 계산시\n일부 공사원가에 분양률이 아닌 공사진행률을 적용하여 원가를 산정하였음"
        },
        "section_2_violation_details": {
          "section_title": "회계기준 위반 지적 내용",
          "content": "회사는 공사진행률 산정 시 제외되어야 할 자본화 대상 금융비용 등을 포함하여 공사\n진행률을 잘못 계산함으로써 분양수익과 분양원가를 과소(과대)계상하였으며, 판매비와\n관리비로 인식해야 할 분양수수료와 중도금 대출이자 대납액 등을 공사원가로 계상\n하고 분양원가 계산 시 분양률이 아닌 공사진행률을 잘못 적용함에 따라 재고자산\n(미성공사)과 분양원가를 각각 잘못 계산하여 재고자산과 자기자본을 과대계상하였음"
        },
        "section_3_basis_judgment": {
          "section_title": "지적 근거 및 판단 내용",
          "content": "일반기업회계기준 제2장(재무제표의 작성과 표시Ⅰ) 문단 2.7 및 문단 2.49에 따르면 재무\n제표는 경제적 사실과 거래의 실질을 반영하여 기업의 재무상태, 경영성과, 현금흐름 및\n자본변동을 공정하게 표시하여야 하고, 판매비와관리비는 제품, 상품, 용역 등의 판매\n활동과 기업의 관리활동에서 발생하는 비용으로서 매출원가에 속하지 아니하는 모든 영업\n비용을 포함하여야 하며,\n일반기업회계기준 제16장(수익) 문단 16.47에 따르면 공사진행률은 실제공사비 발생액을\n토지의 취득원가와 자본화대상 금융비용 등을 제외한 총공사예정원가로 나눈 비율로 계\n산하도록 규정하고 있음\n한국공인회계사회는 상기 회계기준을 고려하여, 자본화대상 금융비용은 진행률 산정시\n제외하여야 하며, 중도금 대출 이자 대납액 등은 공사원가가 아닌 판매비와 관리비로\n- 7 -\n회계처리하여야 한다고 판단함"
        },
        "section_4_audit_procedure": {
          "section_title": "감사절차 미흡사항",
          "content": "동 지적사례는 재무제표에 대한 심사로 종결되어 감사보고서 감리는 실시하지 아니함"
        },
        "section_5_implications": {
          "section_title": "시사점",
          "content": "회사는 공사진행률, 공사원가 및 분양 원가 계산시 오류가 발생할 수 있으므로 관련\n회계처리기준을 숙지하고 이에 대한 검토절차를 강화하여 재무정보가 정보이용자에게\n적정하게 제공될 수 있도록 하여야함"
        }
      },
      "indexed_content": "케이스 ID: KICPA-2025-02\n제목: 분양수익과 분양원가 오류\n결정연도: 2025년\n회계결산일: ’22.1.1.∼’23.12.31.\n1. 회사의 회계처리\n회사는 오피스텔 분양사업에 시행사로 참여하고 있음. 회사는 분양수익을 진행기준에\n따라 수익을 인식하면서 자본화대상 금융비용을 포함하여 공사진행률을 산정하거나,\n분양수수료와 중도금 대출이자 등을 공사원가로 분류하였음. 또한, 분양원가 계산시\n일부 공사원가에 분양률이 아닌 공사진행률을 적용하여 원가를 산정하였음\n2. 회계기준 위반 지적 내용\n회사는 공사진행률 산정 시 제외되어야 할 자본화 대상 금융비용 등을 포함하여 공사\n진행률을 잘못 계산함으로써 분양수익과 분양원가를 과소(과대)계상하였으며, 판매비와\n관리비로 인식해야 할 분양수수료와 중도금 대출이자 대납액 등을 공사원가로 계상\n하고 분양원가 계산 시 분양률이 아닌 공사진행률을 잘못 적용함에 따라 재고자산\n(미성공사)과 분양원가를 각각 잘못 계산하여 재고자산과 자기자본을 과대계상하였음\n3. 지적 근거 및 판단 내용\n일반기업회계기준 제2장(재무제표의 작성과 표시Ⅰ) 문단 2.7 및 문단 2.49에 따르면 재무\n제표는 경제적 사실과 거래의 실질을 반영하여 기업의 재무상태, 경영성과, 현금흐름 및\n자본변동을 공정하게 표시하여야 하고, 판매비와관리비는 제품, 상품, 용역 등의 판매\n활동과 기업의 관리활동에서 발생하는 비용으로서 매출원가에 속하지 아니하는 모든 영업\n비용을 포함하여야 하며,\n일반기업회계기준 제16장(수익) 문단 16.47에 따르면 공사진행률은 실제공사비 발생액을\n토지의 취득원가와 자본화대상 금융비용 등을 제외한 총공사예정원가로 나눈 비율로 계\n산하도록 규정하고 있음\n한국공인회계사회는 상기 회계기준을 고려하여, 자본화대상 금융비용은 진행률 산정시\n제외하여야 하며, 중도금 대출 이자 대납액 등은 공사원가가 아닌 판매비와 관리비로\n- 7 -\n회계처리하여야 한다고 판단함\n4. 감사절차 미흡사항\n동 지적사례는 재무제표에 대한 심사로 종결되어 감사보고서 감리는 실시하지 아니함\n5. 시사점\n회사는 공사진행률, 공사원가 및 분양 원가 계산시 오류가 발생할 수 있으므로 관련\n회계처리기준을 숙지하고 이에 대한 검토절차를 강화하여 재무정보가 정보이용자에게\n적정하게 제공될 수 있도록 하여야함\n쟁점분야: 공사진행률\n관련기준: 일반기업회계기준 제2장(재무제표의 작성과 표시Ⅰ) 및 제16장(수익)\n\n회사의 회계처리:\n회사는 오피스텔 분양사업에 시행사로 참여하고 있음. 회사는 분양수익을 진행기준에\n따라 수익을 인식하면서 자본화대상 금융비용을 포함하여 공사진행률을 산정하거나,\n분양수수료와 중도금 대출이자 등을 공사원가로 분류하였음. 또한, 분양원가 계산시\n일부 공사원가에 분양률이 아닌 공사진행률을 적용하여 원가를 산정하였음\n\n회계기준 위반 지적 내용:\n회사는 공사진행률 산정 시 제외되어야 할 자본화 대상 금융비용 등을 포함하여 공사\n진행률을 잘못 계산함으로써 분양수익과 분양원가를 과소(과대)계상하였으며, 판매비와\n관리비로 인식해야 할 분양수수료와 중도금 대출이자 대납액 등을 공사원가로 계상\n하고 분양원가 계산 시 분양률이 아닌 공사진행률을 잘못 적용함에 따라 재고자산\n(미성공사)과 분양원가를 각각 잘못 계산하여 재고자산과 자기자본을 과대계상하였음\n\n지적 근거 및 판단 내용:\n일반기업회계기준 제2장(재무제표의 작성과 표시Ⅰ) 문단 2.7 및 문단 2.49에 따르면 재무\n제표는 경제적 사실과 거래의 실질을 반영하여 기업의 재무상태, 경영성과, 현금흐름 및\n자본변동을 공정하게 표시하여야 하고, 판매비와관리비는 제품, 상품, 용역 등의 판매\n활동과 기업의 관리활동에서 발생하는 비용으로서 매출원가에 속하지 아니하는 모든 영업\n비용을 포함하여야 하며,\n일반기업회계기준 제16장(수익) 문단 16.47에 따르면 공사진행률은 실제공사비 발생액을\n토지의 취득원가와 자본화대상 금융비용 등을 제외한 총공사예정원가로 나눈 비율로 계\n산하도록 규정하고 있음\n한국공인회계사회는 상기 회계기준을 고려하여, 자본화대상 금융비용은 진행률 산정시\n제외하여야 하며, 중도금 대출 이자 대납액 등은 공사원가가 아닌 판매비와 관리비로\n- 7 -\n회계처리하여야 한다고 판단함\n\n감사절차 미흡사항:\n동 지적사례는 재무제표에 대한 심사로 종결되어 감사보고서 감리는 실시하지 아니함\n\n시사점:\n회사는 공사진행률, 공사원가 및 분양 원가 계산시 오류가 발생할 수 있으므로 관련\n회계처리기준을 숙지하고 이에 대한 검토절차를 강화하여 재무정보가 정보이용자에게\n적정하게 제공될 수 있도록 하여야함"
    },
    {
      "paragraph_id": "KICPA-2025-03",
      "case_id": "KICPA-2025-03",
      "case_title": "분양수익과 분양원가 오류",
      "metadata": {
        "decision_year": "2025",
        "accounting_period": "’21.1.1.∼’23.12.31.\n1. 회사의 회계처리\n회사는 부동산개발과 주택건설 분양사업 등을 영위하고 있으며, 공사진행률 산정 시,\n자본화대상 금융비용과 건물 철거비를 총예정원가와 발생원가에 포함하여 계산하였고,\n해당 진행률을 적용하여 각 연도별 분양수익 및 원가를 인식하였음\n2. 회계기준 위반 지적 내용\n회사는 공사진행률 계산 시 제외하여야 하는 자본화대상 금융비용을 공사비로 보아\n공사진행률 산정 시 이를 공사예정원가와 발생원가에 잘못 포함하였고, 공사 착수 후\n투입된 건물 철거비를 용지 취득원가가 아닌 공사원가로 분류함으로써, 결과적으로\n‘21년부터 ’23년까지의 분양수익과 분양원가 등을 각각 과대(과소) 계상하였음\n3. 지적 근거 및 판단 내용\n일반기업회계기준 제10장(유형자산) 문단 10.13에 의하면, 건물 신축을 위하여 기존\n건물을 철거하는 경우, 관련 철거비용은 토지의 취득원가에 포함하도록 규정하고 있고,\n일반기업회계기준 제16장(수익) 문단 16.47과 16.48에 의하면 공사진행률은 실제공사비\n- 8 -\n발생액을 자본화대상 금융비용을 제외한 총공사예정원가로 나눈 비율로 계산하도록\n규정하고 있음\n한국공인회계사회는 공사진행률 산정에 포함하지 않도록 명시되어 있고 공사 진행정도\n(진척)와는 무관한 자본화대상 금융비용과 토지 취득원가에 해당하는 건물 철거비를\n진행률 계산에 포함한 것은 오류라고 판단함\n4. 감사절차 미흡사항\n회계감사기준 200(독립된 감사인의 전반목적 및 감사기준에 따른 감사의 수행), 500(감사\n증거)과 700(재무제표에 대한 의견형성과 보고) 등에 따르면 감사인은 재무제표를 중요\n하게 왜곡표시 시킬 수 있는 상황이 존재할 수 있다는 전문가적인 의구심을 가지고 감사\n업무를 계획하고 수행하여야 하며, 감사인은 감사의견 형성의 기초가 될 합리적인 감사\n결론을 도출할 수 있도록 충분하고 적합한 감사증거를 확보하여야 하고, 재무제표가\n일반적으로 인정된 회계처리기준에 따라 중요성의 관점에서 적정하게 표시되고 있다고\n판단했을 경우에만 적정의견을 표명하도록 규정되어 있음\n감사인은 분양수익과 분양원가와 관련하여 진행기준 적용 여부 검토, 계약의 실재성 확인,\n실증적 분석적 절차 수행, 외주공사비 등 비용 발생 사실 확인, 관련 계산검증 등의\n통상적인 감사절차는 수행하였으나, 자본화대상 금융비용이 누적발생원가의 상당부분에\n해당하여 회사 제시 공사진행률이 실제 진행률과 다를 수 있음을 의심할 수 있는 상황임\n에도, 회사가 제시한 진행률 계산에 포함된 발생원가 세부내역 확인과 검증, 계정분류\n적정성 검토 등의 감사절차를 소홀히 하였음\n5. 시사점\n회사는 진행률 산정 시 토지 취득원가 또는 자본화한 금융비용 등 공사 진행(진척)과는\n직접적인 관련이 없는 원가가 포함되지 않도록 하여야 하며,\n감사인은 회사 제시 공사진행률의 계산의 적정성을 검토할 때, 총예정원가와 누적\n발생원가의 세부 구성내역을 면밀히 검토하여 진행률 산정 제외 대상(토지의 취득원가,\n자본화대상 금융비용 등)이 포함되었는지 확인해야 하며, 공사 초기에 공사진행률이\n비경상적으로 높거나 특정 비용 비중이 높은 경우, 전문가적 의구심을 가지고 더 면밀\n하게 발생원가 세부내역 확인과 검증, 계정분류 적정성 검토 등의 감사절차를 수행할\n필요가 있음\n- 9 -",
        "issue_fields": [
          "공사진행률"
        ],
        "related_standards": [
          "일반기업회계기준 제16장(수익)",
          "제10장(유형자산)"
        ],
        "case_type": "회계감리지적사례",
        "source": "KICPA 심사·감리 지적사례"
      },
      "content": {
        "section_1_company_accounting": {
          "section_title": "회사의 회계처리",
          "content": "회사는 부동산개발과 주택건설 분양사업 등을 영위하고 있으며, 공사진행률 산정 시,\n자본화대상 금융비용과 건물 철거비를 총예정원가와 발생원가에 포함하여 계산하였고,\n해당 진행률을 적용하여 각 연도별 분양수익 및 원가를 인식하였음"
        },
        "section_2_violation_details": {
          "section_title": "회계기준 위반 지적 내용",
          "content": "회사는 공사진행률 계산 시 제외하여야 하는 자본화대상 금융비용을 공사비로 보아\n공사진행률 산정 시 이를 공사예정원가와 발생원가에 잘못 포함하였고, 공사 착수 후\n투입된 건물 철거비를 용지 취득원가가 아닌 공사원가로 분류함으로써, 결과적으로\n‘21년부터 ’23년까지의 분양수익과 분양원가 등을 각각 과대(과소) 계상하였음"
        },
        "section_3_basis_judgment": {
          "section_title": "지적 근거 및 판단 내용",
          "content": "일반기업회계기준 제10장(유형자산) 문단 10.13에 의하면, 건물 신축을 위하여 기존\n건물을 철거하는 경우, 관련 철거비용은 토지의 취득원가에 포함하도록 규정하고 있고,\n일반기업회계기준 제16장(수익) 문단 16.47과 16.48에 의하면 공사진행률은 실제공사비\n- 8 -\n발생액을 자본화대상 금융비용을 제외한 총공사예정원가로 나눈 비율로 계산하도록\n규정하고 있음\n한국공인회계사회는 공사진행률 산정에 포함하지 않도록 명시되어 있고 공사 진행정도\n(진척)와는 무관한 자본화대상 금융비용과 토지 취득원가에 해당하는 건물 철거비를\n진행률 계산에 포함한 것은 오류라고 판단함"
        },
        "section_4_audit_procedure": {
          "section_title": "감사절차 미흡사항",
          "content": "회계감사기준 200(독립된 감사인의 전반목적 및 감사기준에 따른 감사의 수행), 500(감사\n증거)과 700(재무제표에 대한 의견형성과 보고) 등에 따르면 감사인은 재무제표를 중요\n하게 왜곡표시 시킬 수 있는 상황이 존재할 수 있다는 전문가적인 의구심을 가지고 감사\n업무를 계획하고 수행하여야 하며, 감사인은 감사의견 형성의 기초가 될 합리적인 감사\n결론을 도출할 수 있도록 충분하고 적합한 감사증거를 확보하여야 하고, 재무제표가\n일반적으로 인정된 회계처리기준에 따라 중요성의 관점에서 적정하게 표시되고 있다고\n판단했을 경우에만 적정의견을 표명하도록 규정되어 있음\n감사인은 분양수익과 분양원가와 관련하여 진행기준 적용 여부 검토, 계약의 실재성 확인,\n실증적 분석적 절차 수행, 외주공사비 등 비용 발생 사실 확인, 관련 계산검증 등의\n통상적인 감사절차는 수행하였으나, 자본화대상 금융비용이 누적발생원가의 상당부분에\n해당하여 회사 제시 공사진행률이 실제 진행률과 다를 수 있음을 의심할 수 있는 상황임\n에도, 회사가 제시한 진행률 계산에 포함된 발생원가 세부내역 확인과 검증, 계정분류\n적정성 검토 등의 감사절차를 소홀히 하였음"
        },
        "section_5_implications": {
          "section_title": "시사점",
          "content": "회사는 진행률 산정 시 토지 취득원가 또는 자본화한 금융비용 등 공사 진행(진척)과는\n직접적인 관련이 없는 원가가 포함되지 않도록 하여야 하며,\n감사인은 회사 제시 공사진행률의 계산의 적정성을 검토할 때, 총예정원가와 누적\n발생원가의 세부 구성내역을 면밀히 검토하여 진행률 산정 제외 대상(토지의 취득원가,\n자본화대상 금융비용 등)이 포함되었는지 확인해야 하며, 공사 초기에 공사진행률이\n비경상적으로 높거나 특정 비용 비중이 높은 경우, 전문가적 의구심을 가지고 더 면밀\n하게 발생원가 세부내역 확인과 검증, 계정분류 적정성 검토 등의 감사절차를 수행할\n필요가 있음\n- 9 -"
        }
      },
      "indexed_content": "케이스 ID: KICPA-2025-03\n제목: 분양수익과 분양원가 오류\n결정연도: 2025년\n회계결산일: ’21.1.1.∼’23.12.31.\n1. 회사의 회계처리\n회사는 부동산개발과 주택건설 분양사업 등을 영위하고 있으며, 공사진행률 산정 시,\n자본화대상 금융비용과 건물 철거비를 총예정원가와 발생원가에 포함하여 계산하였고,\n해당 진행률을 적용하여 각 연도별 분양수익 및 원가를 인식하였음\n2. 회계기준 위반 지적 내용\n회사는 공사진행률 계산 시 제외하여야 하는 자본화대상 금융비용을 공사비로 보아\n공사진행률 산정 시 이를 공사예정원가와 발생원가에 잘못 포함하였고, 공사 착수 후\n투입된 건물 철거비를 용지 취득원가가 아닌 공사원가로 분류함으로써, 결과적으로\n‘21년부터 ’23년까지의 분양수익과 분양원가 등을 각각 과대(과소) 계상하였음\n3. 지적 근거 및 판단 내용\n일반기업회계기준 제10장(유형자산) 문단 10.13에 의하면, 건물 신축을 위하여 기존\n건물을 철거하는 경우, 관련 철거비용은 토지의 취득원가에 포함하도록 규정하고 있고,\n일반기업회계기준 제16장(수익) 문단 16.47과 16.48에 의하면 공사진행률은 실제공사비\n- 8 -\n발생액을 자본화대상 금융비용을 제외한 총공사예정원가로 나눈 비율로 계산하도록\n규정하고 있음\n한국공인회계사회는 공사진행률 산정에 포함하지 않도록 명시되어 있고 공사 진행정도\n(진척)와는 무관한 자본화대상 금융비용과 토지 취득원가에 해당하는 건물 철거비를\n진행률 계산에 포함한 것은 오류라고 판단함\n4. 감사절차 미흡사항\n회계감사기준 200(독립된 감사인의 전반목적 및 감사기준에 따른 감사의 수행), 500(감사\n증거)과 700(재무제표에 대한 의견형성과 보고) 등에 따르면 감사인은 재무제표를 중요\n하게 왜곡표시 시킬 수 있는 상황이 존재할 수 있다는 전문가적인 의구심을 가지고 감사\n업무를 계획하고 수행하여야 하며, 감사인은 감사의견 형성의 기초가 될 합리적인 감사\n결론을 도출할 수 있도록 충분하고 적합한 감사증거를 확보하여야 하고, 재무제표가\n일반적으로 인정된 회계처리기준에 따라 중요성의 관점에서 적정하게 표시되고 있다고\n판단했을 경우에만 적정의견을 표명하도록 규정되어 있음\n감사인은 분양수익과 분양원가와 관련하여 진행기준 적용 여부 검토, 계약의 실재성 확인,\n실증적 분석적 절차 수행, 외주공사비 등 비용 발생 사실 확인, 관련 계산검증 등의\n통상적인 감사절차는 수행하였으나, 자본화대상 금융비용이 누적발생원가의 상당부분에\n해당하여 회사 제시 공사진행률이 실제 진행률과 다를 수 있음을 의심할 수 있는 상황임\n에도, 회사가 제시한 진행률 계산에 포함된 발생원가 세부내역 확인과 검증, 계정분류\n적정성 검토 등의 감사절차를 소홀히 하였음\n5. 시사점\n회사는 진행률 산정 시 토지 취득원가 또는 자본화한 금융비용 등 공사 진행(진척)과는\n직접적인 관련이 없는 원가가 포함되지 않도록 하여야 하며,\n감사인은 회사 제시 공사진행률의 계산의 적정성을 검토할 때, 총예정원가와 누적\n발생원가의 세부 구성내역을 면밀히 검토하여 진행률 산정 제외 대상(토지의 취득원가,\n자본화대상 금융비용 등)이 포함되었는지 확인해야 하며, 공사 초기에 공사진행률이\n비경상적으로 높거나 특정 비용 비중이 높은 경우, 전문가적 의구심을 가지고 더 면밀\n하게 발생원가 세부내역 확인과 검증, 계정분류 적정성 검토 등의 감사절차를 수행할\n필요가 있음\n- 9 -\n쟁점분야: 공사진행률\n관련기준: 일반기업회계기준 제16장(수익), 제10장(유형자산)\n\n회사의 회계처리:\n회사는 부동산개발과 주택건설 분양사업 등을 영위하고 있으며, 공사진행률 산정 시,\n자본화대상 금융비용과 건물 철거비를 총예정원가와 발생원가에 포함하여 계산하였고,\n해당 진행률을 적용하여 각 연도별 분양수익 및 원가를 인식하였음\n\n회계기준 위반 지적 내용:\n회사는 공사진행률 계산 시 제외하여야 하는 자본화대상 금융비용을 공사비로 보아\n공사진행률 산정 시 이를 공사예정원가와 발생원가에 잘못 포함하였고, 공사 착수 후\n투입된 건물 철거비를 용지 취득원가가 아닌 공사원가로 분류함으로써, 결과적으로\n‘21년부터 ’23년까지의 분양수익과 분양원가 등을 각각 과대(과소) 계상하였음\n\n지적 근거 및 판단 내용:\n일반기업회계기준 제10장(유형자산) 문단 10.13에 의하면, 건물 신축을 위하여 기존\n건물을 철거하는 경우, 관련 철거비용은 토지의 취득원가에 포함하도록 규정하고 있고,\n일반기업회계기준 제16장(수익) 문단 16.47과 16.48에 의하면 공사진행률은 실제공사비\n- 8 -\n발생액을 자본화대상 금융비용을 제외한 총공사예정원가로 나눈 비율로 계산하도록\n규정하고 있음\n한국공인회계사회는 공사진행률 산정에 포함하지 않도록 명시되어 있고 공사 진행정도\n(진척)와는 무관한 자본화대상 금융비용과 토지 취득원가에 해당하는 건물 철거비를\n진행률 계산에 포함한 것은 오류라고 판단함\n\n감사절차 미흡사항:\n회계감사기준 200(독립된 감사인의 전반목적 및 감사기준에 따른 감사의 수행), 500(감사\n증거)과 700(재무제표에 대한 의견형성과 보고) 등에 따르면 감사인은 재무제표를 중요\n하게 왜곡표시 시킬 수 있는 상황이 존재할 수 있다는 전문가적인 의구심을 가지고 감사\n업무를 계획하고 수행하여야 하며, 감사인은 감사의견 형성의 기초가 될 합리적인 감사\n결론을 도출할 수 있도록 충분하고 적합한 감사증거를 확보하여야 하고, 재무제표가\n일반적으로 인정된 회계처리기준에 따라 중요성의 관점에서 적정하게 표시되고 있다고\n판단했을 경우에만 적정의견을 표명하도록 규정되어 있음\n감사인은 분양수익과 분양원가와 관련하여 진행기준 적용 여부 검토, 계약의 실재성 확인,\n실증적 분석적 절차 수행, 외주공사비 등 비용 발생 사실 확인, 관련 계산검증 등의\n통상적인 감사절차는 수행하였으나, 자본화대상 금융비용이 누적발생원가의 상당부분에\n해당하여 회사 제시 공사진행률이 실제 진행률과 다를 수 있음을 의심할 수 있는 상황임\n에도, 회사가 제시한 진행률 계산에 포함된 발생원가 세부내역 확인과 검증, 계정분류\n적정성 검토 등의 감사절차를 소홀히 하였음\n\n시사점:\n회사는 진행률 산정 시 토지 취득원가 또는 자본화한 금융비용 등 공사 진행(진척)과는\n직접적인 관련이 없는 원가가 포함되지 않도록 하여야 하며,\n감사인은 회사 제시 공사진행률의 계산의 적정성을 검토할 때, 총예정원가와 누적\n발생원가의 세부 구성내역을 면밀히 검토하여 진행률 산정 제외 대상(토지의 취득원가,\n자본화대상 금융비용 등)이 포함되었는지 확인해야 하며, 공사 초기에 공사진행률이\n비경상적으로 높거나 특정 비용 비중이 높은 경우, 전문가적 의구심을 가지고 더 면밀\n하게 발생원가 세부내역 확인과 검증, 계정분류 적정성 검토 등의 감사절차를 수행할\n필요가 있음\n- 9 -"
    },
    {
      "paragraph_id": "KICPA-2025-04",
      "case_id": "KICPA-2025-04",
      "case_title": "용역매출 수익인식 오류",
      "metadata": {
        "decision_year": "2025",
        "accounting_period": "’22.1.1.∼’23.12.31.\n1. 회사의 회계처리\n회사는 외부 거래처로부터 연구용역을 의뢰받아 수행하고 발생한 연구비에 일정 이윤을\n가산한 금액을 대가로 수령하고 이를 용역매출로 인식하고 있음. 개발용역의 경우,\n이미 발생한 원가는 식별 가능하나 개발과정에서의 인원 변동 및 참여율 변동 등으로\n인해 용역 완료를 위해 투입해야 할 총예정원가를 신뢰성 있게 측정할 수 없는 상황임.\n회사는 연구용역과 관련하여 세금계산서 발행기준으로 매출을 인식하였음\n2. 회계기준 위반 지적 내용\n회사는 개발용역과 관련한 총 예정원가를 신뢰성 있게 측정할 수 없는 경우 발생한 비용의\n범위내에서 회수가능한 금액을 수익으로 인식하여야 함에도 세금계산서 기준으로 매출을\n인식하여 매출을 과대계상함\n3. 지적 근거 및 판단 내용\n일반기업회계기준 제16장(수익) 문단 16.13에 따르면 용역제공거래의 성과를 신뢰성\n있게 추정할 수 없는 경우에는 발생한 비용의 범위 내에서 회수가능한 금액을 수익으로\n인식하도록 규정되어 있음\n한국공인회계사회는 상기 회계기준 등을 고려하여, 회사가 용역매출의 수익인식과\n관련하여 발생한 비용의 범위내에서 회수가능한 금액을 수익으로 인식하여야 함에도\n세금계산서 기준으로 매출을 잘못 인식하여 매출액을 과대계상한 것으로 판단함\n4. 감사절차 미흡사항\n동 지적사례는 재무제표에 대한 심사로 종결되어 감사보고서 감리는 실시하지 아니함\n5. 시사점\n회사는 용역의 제공으로 인한 수익인식과 관련하여 총 예정원가 등 용역제공거래의\n- 10 -\n결과를 신뢰성 있게 측정할 수 있는지 여부 등을 종합적으로 검토한 후 공사진행\n기준을 적용하거나 발생한 비용의 범위내에서 회수가능한 금액을 인식하는 등의 수익\n인식방법을 결정하여야 함",
        "issue_fields": [
          "수익의 기간귀속"
        ],
        "related_standards": [
          "일반기업회계기준 제16장(수익)"
        ],
        "case_type": "회계감리지적사례",
        "source": "KICPA 심사·감리 지적사례"
      },
      "content": {
        "section_1_company_accounting": {
          "section_title": "회사의 회계처리",
          "content": "회사는 외부 거래처로부터 연구용역을 의뢰받아 수행하고 발생한 연구비에 일정 이윤을\n가산한 금액을 대가로 수령하고 이를 용역매출로 인식하고 있음. 개발용역의 경우,\n이미 발생한 원가는 식별 가능하나 개발과정에서의 인원 변동 및 참여율 변동 등으로\n인해 용역 완료를 위해 투입해야 할 총예정원가를 신뢰성 있게 측정할 수 없는 상황임.\n회사는 연구용역과 관련하여 세금계산서 발행기준으로 매출을 인식하였음"
        },
        "section_2_violation_details": {
          "section_title": "회계기준 위반 지적 내용",
          "content": "회사는 개발용역과 관련한 총 예정원가를 신뢰성 있게 측정할 수 없는 경우 발생한 비용의\n범위내에서 회수가능한 금액을 수익으로 인식하여야 함에도 세금계산서 기준으로 매출을\n인식하여 매출을 과대계상함"
        },
        "section_3_basis_judgment": {
          "section_title": "지적 근거 및 판단 내용",
          "content": "일반기업회계기준 제16장(수익) 문단 16.13에 따르면 용역제공거래의 성과를 신뢰성\n있게 추정할 수 없는 경우에는 발생한 비용의 범위 내에서 회수가능한 금액을 수익으로\n인식하도록 규정되어 있음\n한국공인회계사회는 상기 회계기준 등을 고려하여, 회사가 용역매출의 수익인식과\n관련하여 발생한 비용의 범위내에서 회수가능한 금액을 수익으로 인식하여야 함에도\n세금계산서 기준으로 매출을 잘못 인식하여 매출액을 과대계상한 것으로 판단함"
        },
        "section_4_audit_procedure": {
          "section_title": "감사절차 미흡사항",
          "content": "동 지적사례는 재무제표에 대한 심사로 종결되어 감사보고서 감리는 실시하지 아니함"
        },
        "section_5_implications": {
          "section_title": "시사점",
          "content": "회사는 용역의 제공으로 인한 수익인식과 관련하여 총 예정원가 등 용역제공거래의\n- 10 -\n결과를 신뢰성 있게 측정할 수 있는지 여부 등을 종합적으로 검토한 후 공사진행\n기준을 적용하거나 발생한 비용의 범위내에서 회수가능한 금액을 인식하는 등의 수익\n인식방법을 결정하여야 함"
        }
      },
      "indexed_content": "케이스 ID: KICPA-2025-04\n제목: 용역매출 수익인식 오류\n결정연도: 2025년\n회계결산일: ’22.1.1.∼’23.12.31.\n1. 회사의 회계처리\n회사는 외부 거래처로부터 연구용역을 의뢰받아 수행하고 발생한 연구비에 일정 이윤을\n가산한 금액을 대가로 수령하고 이를 용역매출로 인식하고 있음. 개발용역의 경우,\n이미 발생한 원가는 식별 가능하나 개발과정에서의 인원 변동 및 참여율 변동 등으로\n인해 용역 완료를 위해 투입해야 할 총예정원가를 신뢰성 있게 측정할 수 없는 상황임.\n회사는 연구용역과 관련하여 세금계산서 발행기준으로 매출을 인식하였음\n2. 회계기준 위반 지적 내용\n회사는 개발용역과 관련한 총 예정원가를 신뢰성 있게 측정할 수 없는 경우 발생한 비용의\n범위내에서 회수가능한 금액을 수익으로 인식하여야 함에도 세금계산서 기준으로 매출을\n인식하여 매출을 과대계상함\n3. 지적 근거 및 판단 내용\n일반기업회계기준 제16장(수익) 문단 16.13에 따르면 용역제공거래의 성과를 신뢰성\n있게 추정할 수 없는 경우에는 발생한 비용의 범위 내에서 회수가능한 금액을 수익으로\n인식하도록 규정되어 있음\n한국공인회계사회는 상기 회계기준 등을 고려하여, 회사가 용역매출의 수익인식과\n관련하여 발생한 비용의 범위내에서 회수가능한 금액을 수익으로 인식하여야 함에도\n세금계산서 기준으로 매출을 잘못 인식하여 매출액을 과대계상한 것으로 판단함\n4. 감사절차 미흡사항\n동 지적사례는 재무제표에 대한 심사로 종결되어 감사보고서 감리는 실시하지 아니함\n5. 시사점\n회사는 용역의 제공으로 인한 수익인식과 관련하여 총 예정원가 등 용역제공거래의\n- 10 -\n결과를 신뢰성 있게 측정할 수 있는지 여부 등을 종합적으로 검토한 후 공사진행\n기준을 적용하거나 발생한 비용의 범위내에서 회수가능한 금액을 인식하는 등의 수익\n인식방법을 결정하여야 함\n쟁점분야: 수익의 기간귀속\n관련기준: 일반기업회계기준 제16장(수익)\n\n회사의 회계처리:\n회사는 외부 거래처로부터 연구용역을 의뢰받아 수행하고 발생한 연구비에 일정 이윤을\n가산한 금액을 대가로 수령하고 이를 용역매출로 인식하고 있음. 개발용역의 경우,\n이미 발생한 원가는 식별 가능하나 개발과정에서의 인원 변동 및 참여율 변동 등으로\n인해 용역 완료를 위해 투입해야 할 총예정원가를 신뢰성 있게 측정할 수 없는 상황임.\n회사는 연구용역과 관련하여 세금계산서 발행기준으로 매출을 인식하였음\n\n회계기준 위반 지적 내용:\n회사는 개발용역과 관련한 총 예정원가를 신뢰성 있게 측정할 수 없는 경우 발생한 비용의\n범위내에서 회수가능한 금액을 수익으로 인식하여야 함에도 세금계산서 기준으로 매출을\n인식하여 매출을 과대계상함\n\n지적 근거 및 판단 내용:\n일반기업회계기준 제16장(수익) 문단 16.13에 따르면 용역제공거래의 성과를 신뢰성\n있게 추정할 수 없는 경우에는 발생한 비용의 범위 내에서 회수가능한 금액을 수익으로\n인식하도록 규정되어 있음\n한국공인회계사회는 상기 회계기준 등을 고려하여, 회사가 용역매출의 수익인식과\n관련하여 발생한 비용의 범위내에서 회수가능한 금액을 수익으로 인식하여야 함에도\n세금계산서 기준으로 매출을 잘못 인식하여 매출액을 과대계상한 것으로 판단함\n\n감사절차 미흡사항:\n동 지적사례는 재무제표에 대한 심사로 종결되어 감사보고서 감리는 실시하지 아니함\n\n시사점:\n회사는 용역의 제공으로 인한 수익인식과 관련하여 총 예정원가 등 용역제공거래의\n- 10 -\n결과를 신뢰성 있게 측정할 수 있는지 여부 등을 종합적으로 검토한 후 공사진행\n기준을 적용하거나 발생한 비용의 범위내에서 회수가능한 금액을 인식하는 등의 수익\n인식방법을 결정하여야 함"
    },
    {
      "paragraph_id": "KICPA-2025-05",
      "case_id": "KICPA-2025-05",
      "case_title": "수익의 기간귀속 오류",
      "metadata": {
        "decision_year": "2025",
        "accounting_period": "’23.1.1.∼’23.12.31.\n1. 회사의 회계처리\n회사는 발주처에 공사기간 연장에 따른 공사비용 등의 증가와 관련하여 계약금액 조정을\n요청하였으나, 발주처에서 조정이 불가하다고 회신하였고, 이에 회사는 공사계약금액\n조정 청구 소송을 제기함\n회사는 ‘20년 1심 판결 시 수령한 추가공사대금을 ‘20년말 부채(공사선수금)로 계상하였고,\n‘21년 대법원 판결(3심)로 회사의 승소가 확정되었으나, 동 사실이 회계팀에 ‘23년 전달\n됨에 따라 회계팀은 이를 ‘23년의 매출로 인식함\n2. 회계기준 위반 지적 내용\n회사는 공사대금 청구소송과 관련하여 수익인식과 관련된 모든 불확실성이 해소된 대법원\n판결시점인 ‘21년에 매출을 인식하여야 함에도 ‘23년 매출로 잘못 인식함\n3. 지적 근거 및 판단 내용\n일반기업회계기준 제16장(수익) 문단 16.29에 따르면 공사수익은 수취하였거나 수취할\n대가의 공정가치로 측정하되 공사수익의 측정치는 원래의 계약이 합의된 회계연도 후에\n발생한 공사내용의 변경 등의 사건이 발생하거나 측정 당시의 불확실성이 해소되면\n수정되어야 한다고 규정하고 있음\n한국공인회계사회는 상기 회계기준 등을 고려하여, 대법원판결 시점에 수익인식요건을\n충족하여 대법원 판결 시점인 ‘21년의 매출로 수익을 인식하여야 한다고 판단함\n- 11 -\n4. 감사절차 미흡사항\n동 지적사례는 재무제표에 대한 심사로 종결되어 감사보고서 감리는 실시하지 아니함\n5. 시사점\n회사는 소송 등 수익인식에 중대한 영향을 미치는 사항에 대해 판결 결과와 관련\n정보를 회계부서에 적시에 공유할 수 있는 내부 절차를 마련하여야 하고, 회계팀은\n수익인식과 관련된 불확실성이 해소되는 시점을 정확히 식별하여 해당 회계기간에\n적정하게 수익을 인식할 수 있도록 하여야 함",
        "issue_fields": [
          "수익의 기간귀속"
        ],
        "related_standards": [
          "일반기업회계기준 제16장(수익)"
        ],
        "case_type": "회계감리지적사례",
        "source": "KICPA 심사·감리 지적사례"
      },
      "content": {
        "section_1_company_accounting": {
          "section_title": "회사의 회계처리",
          "content": "회사는 발주처에 공사기간 연장에 따른 공사비용 등의 증가와 관련하여 계약금액 조정을\n요청하였으나, 발주처에서 조정이 불가하다고 회신하였고, 이에 회사는 공사계약금액\n조정 청구 소송을 제기함\n회사는 ‘20년 1심 판결 시 수령한 추가공사대금을 ‘20년말 부채(공사선수금)로 계상하였고,\n‘21년 대법원 판결(3심)로 회사의 승소가 확정되었으나, 동 사실이 회계팀에 ‘23년 전달\n됨에 따라 회계팀은 이를 ‘23년의 매출로 인식함"
        },
        "section_2_violation_details": {
          "section_title": "회계기준 위반 지적 내용",
          "content": "회사는 공사대금 청구소송과 관련하여 수익인식과 관련된 모든 불확실성이 해소된 대법원\n판결시점인 ‘21년에 매출을 인식하여야 함에도 ‘23년 매출로 잘못 인식함"
        },
        "section_3_basis_judgment": {
          "section_title": "지적 근거 및 판단 내용",
          "content": "일반기업회계기준 제16장(수익) 문단 16.29에 따르면 공사수익은 수취하였거나 수취할\n대가의 공정가치로 측정하되 공사수익의 측정치는 원래의 계약이 합의된 회계연도 후에\n발생한 공사내용의 변경 등의 사건이 발생하거나 측정 당시의 불확실성이 해소되면\n수정되어야 한다고 규정하고 있음\n한국공인회계사회는 상기 회계기준 등을 고려하여, 대법원판결 시점에 수익인식요건을\n충족하여 대법원 판결 시점인 ‘21년의 매출로 수익을 인식하여야 한다고 판단함\n- 11 -"
        },
        "section_4_audit_procedure": {
          "section_title": "감사절차 미흡사항",
          "content": "동 지적사례는 재무제표에 대한 심사로 종결되어 감사보고서 감리는 실시하지 아니함"
        },
        "section_5_implications": {
          "section_title": "시사점",
          "content": "회사는 소송 등 수익인식에 중대한 영향을 미치는 사항에 대해 판결 결과와 관련\n정보를 회계부서에 적시에 공유할 수 있는 내부 절차를 마련하여야 하고, 회계팀은\n수익인식과 관련된 불확실성이 해소되는 시점을 정확히 식별하여 해당 회계기간에\n적정하게 수익을 인식할 수 있도록 하여야 함"
        }
      },
      "indexed_content": "케이스 ID: KICPA-2025-05\n제목: 수익의 기간귀속 오류\n결정연도: 2025년\n회계결산일: ’23.1.1.∼’23.12.31.\n1. 회사의 회계처리\n회사는 발주처에 공사기간 연장에 따른 공사비용 등의 증가와 관련하여 계약금액 조정을\n요청하였으나, 발주처에서 조정이 불가하다고 회신하였고, 이에 회사는 공사계약금액\n조정 청구 소송을 제기함\n회사는 ‘20년 1심 판결 시 수령한 추가공사대금을 ‘20년말 부채(공사선수금)로 계상하였고,\n‘21년 대법원 판결(3심)로 회사의 승소가 확정되었으나, 동 사실이 회계팀에 ‘23년 전달\n됨에 따라 회계팀은 이를 ‘23년의 매출로 인식함\n2. 회계기준 위반 지적 내용\n회사는 공사대금 청구소송과 관련하여 수익인식과 관련된 모든 불확실성이 해소된 대법원\n판결시점인 ‘21년에 매출을 인식하여야 함에도 ‘23년 매출로 잘못 인식함\n3. 지적 근거 및 판단 내용\n일반기업회계기준 제16장(수익) 문단 16.29에 따르면 공사수익은 수취하였거나 수취할\n대가의 공정가치로 측정하되 공사수익의 측정치는 원래의 계약이 합의된 회계연도 후에\n발생한 공사내용의 변경 등의 사건이 발생하거나 측정 당시의 불확실성이 해소되면\n수정되어야 한다고 규정하고 있음\n한국공인회계사회는 상기 회계기준 등을 고려하여, 대법원판결 시점에 수익인식요건을\n충족하여 대법원 판결 시점인 ‘21년의 매출로 수익을 인식하여야 한다고 판단함\n- 11 -\n4. 감사절차 미흡사항\n동 지적사례는 재무제표에 대한 심사로 종결되어 감사보고서 감리는 실시하지 아니함\n5. 시사점\n회사는 소송 등 수익인식에 중대한 영향을 미치는 사항에 대해 판결 결과와 관련\n정보를 회계부서에 적시에 공유할 수 있는 내부 절차를 마련하여야 하고, 회계팀은\n수익인식과 관련된 불확실성이 해소되는 시점을 정확히 식별하여 해당 회계기간에\n적정하게 수익을 인식할 수 있도록 하여야 함\n쟁점분야: 수익의 기간귀속\n관련기준: 일반기업회계기준 제16장(수익)\n\n회사의 회계처리:\n회사는 발주처에 공사기간 연장에 따른 공사비용 등의 증가와 관련하여 계약금액 조정을\n요청하였으나, 발주처에서 조정이 불가하다고 회신하였고, 이에 회사는 공사계약금액\n조정 청구 소송을 제기함\n회사는 ‘20년 1심 판결 시 수령한 추가공사대금을 ‘20년말 부채(공사선수금)로 계상하였고,\n‘21년 대법원 판결(3심)로 회사의 승소가 확정되었으나, 동 사실이 회계팀에 ‘23년 전달\n됨에 따라 회계팀은 이를 ‘23년의 매출로 인식함\n\n회계기준 위반 지적 내용:\n회사는 공사대금 청구소송과 관련하여 수익인식과 관련된 모든 불확실성이 해소된 대법원\n판결시점인 ‘21년에 매출을 인식하여야 함에도 ‘23년 매출로 잘못 인식함\n\n지적 근거 및 판단 내용:\n일반기업회계기준 제16장(수익) 문단 16.29에 따르면 공사수익은 수취하였거나 수취할\n대가의 공정가치로 측정하되 공사수익의 측정치는 원래의 계약이 합의된 회계연도 후에\n발생한 공사내용의 변경 등의 사건이 발생하거나 측정 당시의 불확실성이 해소되면\n수정되어야 한다고 규정하고 있음\n한국공인회계사회는 상기 회계기준 등을 고려하여, 대법원판결 시점에 수익인식요건을\n충족하여 대법원 판결 시점인 ‘21년의 매출로 수익을 인식하여야 한다고 판단함\n- 11 -\n\n감사절차 미흡사항:\n동 지적사례는 재무제표에 대한 심사로 종결되어 감사보고서 감리는 실시하지 아니함\n\n시사점:\n회사는 소송 등 수익인식에 중대한 영향을 미치는 사항에 대해 판결 결과와 관련\n정보를 회계부서에 적시에 공유할 수 있는 내부 절차를 마련하여야 하고, 회계팀은\n수익인식과 관련된 불확실성이 해소되는 시점을 정확히 식별하여 해당 회계기간에\n적정하게 수익을 인식할 수 있도록 하여야 함"
    },
    {
      "paragraph_id": "KICPA-2025-06",
      "case_id": "KICPA-2025-06",
      "case_title": "수익의 기간귀속 오류(수출재화)",
      "metadata": {
        "decision_year": "2025",
        "accounting_period": "’22.1.1.∼’23.12.31.\n1. 회사의 회계처리\n회사의 주업은 자동차 엔진 부품의 제조·판매업으로, 전체 제품 매출 중 수출이 ‘22년\n약 92%, ‘23년 약 95%를 차지할 정도로 수출의존도가 높은 기업이며, 수출 거래 시 주로\nDDP(Delivered Duty Paid)·DAP(Delivered at Place) 조건으로 거래하면서 실무적으로 도착일을\n추적하여 매출을 인식하는 것이 어렵다는 등의 사유로 선적일에 매출을 인식함\n2. 회계기준 위반 지적 내용\n도착지 인도조건의 수출 거래 시 재화의 소유에 따른 유의적인 위험과 보상은 도착일에\n구매자에게 이전됨에도 선적일에 수익을 잘못 인식하여 매출 및 매출원가 등을 과대\n계상함\n3. 지적 근거 및 판단 내용\n일반기업회계기준 제16장(수익) 문단 16.10에 따르면 재화의 판매로 인한 수익은 재화의\n소유에 따른 유의적인 위험과 보상이 구매자에게 이전되고 판매자는 판매한 재화에\n대하여 소유권이 있을 때 통상적으로 행사하는 정도의 관리나 효과적인 통제를 할 수\n없는 등의 수익 인식 요건이 모두 충족될 때 인식하도록 규정하고 있음\n- 12 -\n한국공인회계사회는 상기 회계기준 등을 고려하여, DDP·DAP조건의 수출 거래는\n제품이 도착지에 도달하였을 때 수출자(판매자)에게서 수입자(구매자)에게 재고 위험이\n이전되는 바, 도착일에 수익인식요건을 충족하는 것으로 판단함\n4. 감사절차 미흡사항\n동 지적사례는 재무제표에 대한 심사로 종결되어 감사보고서 감리는 실시하지 아니함\n5. 시사점\n회사는 매출거래의 계약조건 등을 면밀히 파악하여, 재화의 소유에 따른 유의적인\n위험과 보상이 실질적으로 이전되는 시점에 수익을 인식하도록 구체적인 회계정책을\n수립하고 적용할 필요가 있음",
        "issue_fields": [
          "수익의 기간귀속"
        ],
        "related_standards": [
          "일반기업회계기준 제16장(수익)"
        ],
        "case_type": "회계감리지적사례",
        "source": "KICPA 심사·감리 지적사례"
      },
      "content": {
        "section_1_company_accounting": {
          "section_title": "회사의 회계처리",
          "content": "회사의 주업은 자동차 엔진 부품의 제조·판매업으로, 전체 제품 매출 중 수출이 ‘22년\n약 92%, ‘23년 약 95%를 차지할 정도로 수출의존도가 높은 기업이며, 수출 거래 시 주로\nDDP(Delivered Duty Paid)·DAP(Delivered at Place) 조건으로 거래하면서 실무적으로 도착일을\n추적하여 매출을 인식하는 것이 어렵다는 등의 사유로 선적일에 매출을 인식함"
        },
        "section_2_violation_details": {
          "section_title": "회계기준 위반 지적 내용",
          "content": "도착지 인도조건의 수출 거래 시 재화의 소유에 따른 유의적인 위험과 보상은 도착일에\n구매자에게 이전됨에도 선적일에 수익을 잘못 인식하여 매출 및 매출원가 등을 과대\n계상함"
        },
        "section_3_basis_judgment": {
          "section_title": "지적 근거 및 판단 내용",
          "content": "일반기업회계기준 제16장(수익) 문단 16.10에 따르면 재화의 판매로 인한 수익은 재화의\n소유에 따른 유의적인 위험과 보상이 구매자에게 이전되고 판매자는 판매한 재화에\n대하여 소유권이 있을 때 통상적으로 행사하는 정도의 관리나 효과적인 통제를 할 수\n없는 등의 수익 인식 요건이 모두 충족될 때 인식하도록 규정하고 있음\n- 12 -\n한국공인회계사회는 상기 회계기준 등을 고려하여, DDP·DAP조건의 수출 거래는\n제품이 도착지에 도달하였을 때 수출자(판매자)에게서 수입자(구매자)에게 재고 위험이\n이전되는 바, 도착일에 수익인식요건을 충족하는 것으로 판단함"
        },
        "section_4_audit_procedure": {
          "section_title": "감사절차 미흡사항",
          "content": "동 지적사례는 재무제표에 대한 심사로 종결되어 감사보고서 감리는 실시하지 아니함"
        },
        "section_5_implications": {
          "section_title": "시사점",
          "content": "회사는 매출거래의 계약조건 등을 면밀히 파악하여, 재화의 소유에 따른 유의적인\n위험과 보상이 실질적으로 이전되는 시점에 수익을 인식하도록 구체적인 회계정책을\n수립하고 적용할 필요가 있음"
        }
      },
      "indexed_content": "케이스 ID: KICPA-2025-06\n제목: 수익의 기간귀속 오류(수출재화)\n결정연도: 2025년\n회계결산일: ’22.1.1.∼’23.12.31.\n1. 회사의 회계처리\n회사의 주업은 자동차 엔진 부품의 제조·판매업으로, 전체 제품 매출 중 수출이 ‘22년\n약 92%, ‘23년 약 95%를 차지할 정도로 수출의존도가 높은 기업이며, 수출 거래 시 주로\nDDP(Delivered Duty Paid)·DAP(Delivered at Place) 조건으로 거래하면서 실무적으로 도착일을\n추적하여 매출을 인식하는 것이 어렵다는 등의 사유로 선적일에 매출을 인식함\n2. 회계기준 위반 지적 내용\n도착지 인도조건의 수출 거래 시 재화의 소유에 따른 유의적인 위험과 보상은 도착일에\n구매자에게 이전됨에도 선적일에 수익을 잘못 인식하여 매출 및 매출원가 등을 과대\n계상함\n3. 지적 근거 및 판단 내용\n일반기업회계기준 제16장(수익) 문단 16.10에 따르면 재화의 판매로 인한 수익은 재화의\n소유에 따른 유의적인 위험과 보상이 구매자에게 이전되고 판매자는 판매한 재화에\n대하여 소유권이 있을 때 통상적으로 행사하는 정도의 관리나 효과적인 통제를 할 수\n없는 등의 수익 인식 요건이 모두 충족될 때 인식하도록 규정하고 있음\n- 12 -\n한국공인회계사회는 상기 회계기준 등을 고려하여, DDP·DAP조건의 수출 거래는\n제품이 도착지에 도달하였을 때 수출자(판매자)에게서 수입자(구매자)에게 재고 위험이\n이전되는 바, 도착일에 수익인식요건을 충족하는 것으로 판단함\n4. 감사절차 미흡사항\n동 지적사례는 재무제표에 대한 심사로 종결되어 감사보고서 감리는 실시하지 아니함\n5. 시사점\n회사는 매출거래의 계약조건 등을 면밀히 파악하여, 재화의 소유에 따른 유의적인\n위험과 보상이 실질적으로 이전되는 시점에 수익을 인식하도록 구체적인 회계정책을\n수립하고 적용할 필요가 있음\n쟁점분야: 수익의 기간귀속\n관련기준: 일반기업회계기준 제16장(수익)\n\n회사의 회계처리:\n회사의 주업은 자동차 엔진 부품의 제조·판매업으로, 전체 제품 매출 중 수출이 ‘22년\n약 92%, ‘23년 약 95%를 차지할 정도로 수출의존도가 높은 기업이며, 수출 거래 시 주로\nDDP(Delivered Duty Paid)·DAP(Delivered at Place) 조건으로 거래하면서 실무적으로 도착일을\n추적하여 매출을 인식하는 것이 어렵다는 등의 사유로 선적일에 매출을 인식함\n\n회계기준 위반 지적 내용:\n도착지 인도조건의 수출 거래 시 재화의 소유에 따른 유의적인 위험과 보상은 도착일에\n구매자에게 이전됨에도 선적일에 수익을 잘못 인식하여 매출 및 매출원가 등을 과대\n계상함\n\n지적 근거 및 판단 내용:\n일반기업회계기준 제16장(수익) 문단 16.10에 따르면 재화의 판매로 인한 수익은 재화의\n소유에 따른 유의적인 위험과 보상이 구매자에게 이전되고 판매자는 판매한 재화에\n대하여 소유권이 있을 때 통상적으로 행사하는 정도의 관리나 효과적인 통제를 할 수\n없는 등의 수익 인식 요건이 모두 충족될 때 인식하도록 규정하고 있음\n- 12 -\n한국공인회계사회는 상기 회계기준 등을 고려하여, DDP·DAP조건의 수출 거래는\n제품이 도착지에 도달하였을 때 수출자(판매자)에게서 수입자(구매자)에게 재고 위험이\n이전되는 바, 도착일에 수익인식요건을 충족하는 것으로 판단함\n\n감사절차 미흡사항:\n동 지적사례는 재무제표에 대한 심사로 종결되어 감사보고서 감리는 실시하지 아니함\n\n시사점:\n회사는 매출거래의 계약조건 등을 면밀히 파악하여, 재화의 소유에 따른 유의적인\n위험과 보상이 실질적으로 이전되는 시점에 수익을 인식하도록 구체적인 회계정책을\n수립하고 적용할 필요가 있음"
    },
    {
      "paragraph_id": "KICPA-2025-07",
      "case_id": "KICPA-2025-07",
      "case_title": "수익·비용의 기간귀속 오류(용역)",
      "metadata": {
        "decision_year": "2025",
        "accounting_period": "’23.1.1.∼’23.12.31.\n1. 회사의 회계처리\n회사의 주업은 방위산업 관련 특수 목적용 기계 제조·판매 및 군용 장비의 정밀정비 등임.\n회사는 통상 장기간(1년 이상) 고객이 소유한 전차 등 군용 장비의 수리, 소모된 장비\n교체, 성능 개선, 정밀 점검 등을 수행함에 따른 ‘창정비 매출’을 인식하면서, 고객에\n대한 수행의무가 종료되는 시점(목적물의 인도시점)에 관련 수익과 원가를 인식함\n2. 회계기준 위반 지적 내용\n회사가 제공하는 창정비는 기간에 걸쳐 이행하는 수행의무로서 진행기준 적용 요건을\n충족하므로 창정비 업무를 수행하는 기간에 걸쳐 진행기준으로 수익을 인식하여야\n함에도, 관련 자산을 고객에게 인도한 시점에 수익을 인식함으로써 매출 및 매출원가\n등을 과소(과대)계상함\n- 13 -\n3. 지적 근거 및 판단 내용\n기업회계기준서 제1115호(고객과의 계약에서 생기는 수익) 문단 35에 의하면, 기업이\n수행하여 만들어지거나 가치가 높아지는 대로 고객이 통제하는 자산을 기업이 만들거나\n그 자산 가치를 높이는 경우(문단 35.⑵) 또는 기업이 수행하여 만든 자산이 기업 자체에는\n대체 용도가 없고, 수행을 완료한 부분에 대해 집행 가능한 지급청구권이 기업에게 있는\n경우(문단 35.⑶) 등에 해당한다면, 기간에 걸쳐 수익을 인식하도록 규정하고 있음\n한국공인회계사회는 상기 회계기준과 관련 계약서 등에 따라 고객이 성능 개선 대상\n군용자산을 통제하고 있고, 회사가 점검, 수리, 부품 교체 등을 수행하는 대로, 고객이\n통제하는 자산의 가치를 높이는 등, 기간에 걸쳐 이행하는 수행의무의 요건을 충족\n하므로 기간에 걸쳐 진행기준으로 수익을 인식함이 타당하다고 판단함\n4. 감사절차 미흡사항\n동 지적사례는 재무제표에 대한 심사로 종결되어 감사보고서 감리는 실시하지 아니함\n5. 시사점\n회사는 매출과 관련하여 재화나 용역에 대한 통제가 언제 이전되었는지를 판단하기\n위해 관련 계약서 및 경제적 실질 등을 종합적으로 검토한 후 수익인식 시점을 결정\n하여야 함",
        "issue_fields": [
          "수익·비용 기간귀속"
        ],
        "related_standards": [
          "기업회계기준서 제1115호(고객과의 계약에서 생기는 수익)"
        ],
        "case_type": "회계감리지적사례",
        "source": "KICPA 심사·감리 지적사례"
      },
      "content": {
        "section_1_company_accounting": {
          "section_title": "회사의 회계처리",
          "content": "회사의 주업은 방위산업 관련 특수 목적용 기계 제조·판매 및 군용 장비의 정밀정비 등임.\n회사는 통상 장기간(1년 이상) 고객이 소유한 전차 등 군용 장비의 수리, 소모된 장비\n교체, 성능 개선, 정밀 점검 등을 수행함에 따른 ‘창정비 매출’을 인식하면서, 고객에\n대한 수행의무가 종료되는 시점(목적물의 인도시점)에 관련 수익과 원가를 인식함"
        },
        "section_2_violation_details": {
          "section_title": "회계기준 위반 지적 내용",
          "content": "회사가 제공하는 창정비는 기간에 걸쳐 이행하는 수행의무로서 진행기준 적용 요건을\n충족하므로 창정비 업무를 수행하는 기간에 걸쳐 진행기준으로 수익을 인식하여야\n함에도, 관련 자산을 고객에게 인도한 시점에 수익을 인식함으로써 매출 및 매출원가\n등을 과소(과대)계상함\n- 13 -"
        },
        "section_3_basis_judgment": {
          "section_title": "지적 근거 및 판단 내용",
          "content": "기업회계기준서 제1115호(고객과의 계약에서 생기는 수익) 문단 35에 의하면, 기업이\n수행하여 만들어지거나 가치가 높아지는 대로 고객이 통제하는 자산을 기업이 만들거나\n그 자산 가치를 높이는 경우(문단 35.⑵) 또는 기업이 수행하여 만든 자산이 기업 자체에는\n대체 용도가 없고, 수행을 완료한 부분에 대해 집행 가능한 지급청구권이 기업에게 있는\n경우(문단 35.⑶) 등에 해당한다면, 기간에 걸쳐 수익을 인식하도록 규정하고 있음\n한국공인회계사회는 상기 회계기준과 관련 계약서 등에 따라 고객이 성능 개선 대상\n군용자산을 통제하고 있고, 회사가 점검, 수리, 부품 교체 등을 수행하는 대로, 고객이\n통제하는 자산의 가치를 높이는 등, 기간에 걸쳐 이행하는 수행의무의 요건을 충족\n하므로 기간에 걸쳐 진행기준으로 수익을 인식함이 타당하다고 판단함"
        },
        "section_4_audit_procedure": {
          "section_title": "감사절차 미흡사항",
          "content": "동 지적사례는 재무제표에 대한 심사로 종결되어 감사보고서 감리는 실시하지 아니함"
        },
        "section_5_implications": {
          "section_title": "시사점",
          "content": "회사는 매출과 관련하여 재화나 용역에 대한 통제가 언제 이전되었는지를 판단하기\n위해 관련 계약서 및 경제적 실질 등을 종합적으로 검토한 후 수익인식 시점을 결정\n하여야 함"
        }
      },
      "indexed_content": "케이스 ID: KICPA-2025-07\n제목: 수익·비용의 기간귀속 오류(용역)\n결정연도: 2025년\n회계결산일: ’23.1.1.∼’23.12.31.\n1. 회사의 회계처리\n회사의 주업은 방위산업 관련 특수 목적용 기계 제조·판매 및 군용 장비의 정밀정비 등임.\n회사는 통상 장기간(1년 이상) 고객이 소유한 전차 등 군용 장비의 수리, 소모된 장비\n교체, 성능 개선, 정밀 점검 등을 수행함에 따른 ‘창정비 매출’을 인식하면서, 고객에\n대한 수행의무가 종료되는 시점(목적물의 인도시점)에 관련 수익과 원가를 인식함\n2. 회계기준 위반 지적 내용\n회사가 제공하는 창정비는 기간에 걸쳐 이행하는 수행의무로서 진행기준 적용 요건을\n충족하므로 창정비 업무를 수행하는 기간에 걸쳐 진행기준으로 수익을 인식하여야\n함에도, 관련 자산을 고객에게 인도한 시점에 수익을 인식함으로써 매출 및 매출원가\n등을 과소(과대)계상함\n- 13 -\n3. 지적 근거 및 판단 내용\n기업회계기준서 제1115호(고객과의 계약에서 생기는 수익) 문단 35에 의하면, 기업이\n수행하여 만들어지거나 가치가 높아지는 대로 고객이 통제하는 자산을 기업이 만들거나\n그 자산 가치를 높이는 경우(문단 35.⑵) 또는 기업이 수행하여 만든 자산이 기업 자체에는\n대체 용도가 없고, 수행을 완료한 부분에 대해 집행 가능한 지급청구권이 기업에게 있는\n경우(문단 35.⑶) 등에 해당한다면, 기간에 걸쳐 수익을 인식하도록 규정하고 있음\n한국공인회계사회는 상기 회계기준과 관련 계약서 등에 따라 고객이 성능 개선 대상\n군용자산을 통제하고 있고, 회사가 점검, 수리, 부품 교체 등을 수행하는 대로, 고객이\n통제하는 자산의 가치를 높이는 등, 기간에 걸쳐 이행하는 수행의무의 요건을 충족\n하므로 기간에 걸쳐 진행기준으로 수익을 인식함이 타당하다고 판단함\n4. 감사절차 미흡사항\n동 지적사례는 재무제표에 대한 심사로 종결되어 감사보고서 감리는 실시하지 아니함\n5. 시사점\n회사는 매출과 관련하여 재화나 용역에 대한 통제가 언제 이전되었는지를 판단하기\n위해 관련 계약서 및 경제적 실질 등을 종합적으로 검토한 후 수익인식 시점을 결정\n하여야 함\n쟁점분야: 수익·비용 기간귀속\n관련기준: 기업회계기준서 제1115호(고객과의 계약에서 생기는 수익)\n\n회사의 회계처리:\n회사의 주업은 방위산업 관련 특수 목적용 기계 제조·판매 및 군용 장비의 정밀정비 등임.\n회사는 통상 장기간(1년 이상) 고객이 소유한 전차 등 군용 장비의 수리, 소모된 장비\n교체, 성능 개선, 정밀 점검 등을 수행함에 따른 ‘창정비 매출’을 인식하면서, 고객에\n대한 수행의무가 종료되는 시점(목적물의 인도시점)에 관련 수익과 원가를 인식함\n\n회계기준 위반 지적 내용:\n회사가 제공하는 창정비는 기간에 걸쳐 이행하는 수행의무로서 진행기준 적용 요건을\n충족하므로 창정비 업무를 수행하는 기간에 걸쳐 진행기준으로 수익을 인식하여야\n함에도, 관련 자산을 고객에게 인도한 시점에 수익을 인식함으로써 매출 및 매출원가\n등을 과소(과대)계상함\n- 13 -\n\n지적 근거 및 판단 내용:\n기업회계기준서 제1115호(고객과의 계약에서 생기는 수익) 문단 35에 의하면, 기업이\n수행하여 만들어지거나 가치가 높아지는 대로 고객이 통제하는 자산을 기업이 만들거나\n그 자산 가치를 높이는 경우(문단 35.⑵) 또는 기업이 수행하여 만든 자산이 기업 자체에는\n대체 용도가 없고, 수행을 완료한 부분에 대해 집행 가능한 지급청구권이 기업에게 있는\n경우(문단 35.⑶) 등에 해당한다면, 기간에 걸쳐 수익을 인식하도록 규정하고 있음\n한국공인회계사회는 상기 회계기준과 관련 계약서 등에 따라 고객이 성능 개선 대상\n군용자산을 통제하고 있고, 회사가 점검, 수리, 부품 교체 등을 수행하는 대로, 고객이\n통제하는 자산의 가치를 높이는 등, 기간에 걸쳐 이행하는 수행의무의 요건을 충족\n하므로 기간에 걸쳐 진행기준으로 수익을 인식함이 타당하다고 판단함\n\n감사절차 미흡사항:\n동 지적사례는 재무제표에 대한 심사로 종결되어 감사보고서 감리는 실시하지 아니함\n\n시사점:\n회사는 매출과 관련하여 재화나 용역에 대한 통제가 언제 이전되었는지를 판단하기\n위해 관련 계약서 및 경제적 실질 등을 종합적으로 검토한 후 수익인식 시점을 결정\n하여야 함"
    },
    {
      "paragraph_id": "KICPA-2025-08",
      "case_id": "KICPA-2025-08",
      "case_title": "수익·비용의 기간귀속 오류(로열티 수익)",
      "metadata": {
        "decision_year": "2025",
        "accounting_period": "’24.1.1.∼’24.12.31.\n1. 회사의 회계처리\n회사는 소프트웨어 판권 보유자로부터 라이선스를 매입하여 고객사에 판매하고 있으며,\n라이선스 공급계약(통상 1년) 동안 고객사에 대해 소프트웨어 설치, 가동, 기술지원 및\n유지보수 의무 등을 부담하면서, 발생기준이 아닌 계약상 지급조건에 따른 세금계산서\n발행일에 매출과 매출원가를 인식함\n- 14 -\n2. 회계기준 위반 지적 내용\n회사는 약정기간 동안 사용할 수 있는 소프트웨어 라이선스 계약과 관련하여 발생기준\n으로 수익과 비용을 인식하여야 함에도, 이를 세금계산서 기준으로 잘못 인식하여 매출과\n매출원가를 과대(과소)계상함\n3. 지적 근거 및 판단 내용\n일반기업회계기준 제16장(수익) 문단 16.15와 16.16에 따르면 자산을 타인에게 사용하게\n함으로써 발생하는 로열티수익은 관련된 계약의 경제적 실질을 반영하여 발생기준에\n따라 인식하도록 규정하고 있음\n한국공인회계사회는 상기 회계기준 등을 고려하여, 약정기간 동안 사용할 수 있는 소프트\n웨어 라이선스 계약에 따른 수익과 비용은 발생기준에 따라 인식하여야 한다고 판단함\n4. 감사절차 미흡사항\n동 지적사례는 재무제표에 대한 심사로 종결되어 감사보고서 감리는 실시하지 아니함\n5. 시사점\n회사는 관련 회계기준을 숙지하고, 매출 및 매입 거래의 계약 조건 및 경제적 실질\n등을 종합적으로 검토하여 수익과 비용 인식 시점을 결정하여야 함",
        "issue_fields": [
          "수익·비용 기간귀속"
        ],
        "related_standards": [
          "일반기업회계기준 제16장(수익)"
        ],
        "case_type": "회계감리지적사례",
        "source": "KICPA 심사·감리 지적사례"
      },
      "content": {
        "section_1_company_accounting": {
          "section_title": "회사의 회계처리",
          "content": "회사는 소프트웨어 판권 보유자로부터 라이선스를 매입하여 고객사에 판매하고 있으며,\n라이선스 공급계약(통상 1년) 동안 고객사에 대해 소프트웨어 설치, 가동, 기술지원 및\n유지보수 의무 등을 부담하면서, 발생기준이 아닌 계약상 지급조건에 따른 세금계산서\n발행일에 매출과 매출원가를 인식함\n- 14 -"
        },
        "section_2_violation_details": {
          "section_title": "회계기준 위반 지적 내용",
          "content": "회사는 약정기간 동안 사용할 수 있는 소프트웨어 라이선스 계약과 관련하여 발생기준\n으로 수익과 비용을 인식하여야 함에도, 이를 세금계산서 기준으로 잘못 인식하여 매출과\n매출원가를 과대(과소)계상함"
        },
        "section_3_basis_judgment": {
          "section_title": "지적 근거 및 판단 내용",
          "content": "일반기업회계기준 제16장(수익) 문단 16.15와 16.16에 따르면 자산을 타인에게 사용하게\n함으로써 발생하는 로열티수익은 관련된 계약의 경제적 실질을 반영하여 발생기준에\n따라 인식하도록 규정하고 있음\n한국공인회계사회는 상기 회계기준 등을 고려하여, 약정기간 동안 사용할 수 있는 소프트\n웨어 라이선스 계약에 따른 수익과 비용은 발생기준에 따라 인식하여야 한다고 판단함"
        },
        "section_4_audit_procedure": {
          "section_title": "감사절차 미흡사항",
          "content": "동 지적사례는 재무제표에 대한 심사로 종결되어 감사보고서 감리는 실시하지 아니함"
        },
        "section_5_implications": {
          "section_title": "시사점",
          "content": "회사는 관련 회계기준을 숙지하고, 매출 및 매입 거래의 계약 조건 및 경제적 실질\n등을 종합적으로 검토하여 수익과 비용 인식 시점을 결정하여야 함"
        }
      },
      "indexed_content": "케이스 ID: KICPA-2025-08\n제목: 수익·비용의 기간귀속 오류(로열티 수익)\n결정연도: 2025년\n회계결산일: ’24.1.1.∼’24.12.31.\n1. 회사의 회계처리\n회사는 소프트웨어 판권 보유자로부터 라이선스를 매입하여 고객사에 판매하고 있으며,\n라이선스 공급계약(통상 1년) 동안 고객사에 대해 소프트웨어 설치, 가동, 기술지원 및\n유지보수 의무 등을 부담하면서, 발생기준이 아닌 계약상 지급조건에 따른 세금계산서\n발행일에 매출과 매출원가를 인식함\n- 14 -\n2. 회계기준 위반 지적 내용\n회사는 약정기간 동안 사용할 수 있는 소프트웨어 라이선스 계약과 관련하여 발생기준\n으로 수익과 비용을 인식하여야 함에도, 이를 세금계산서 기준으로 잘못 인식하여 매출과\n매출원가를 과대(과소)계상함\n3. 지적 근거 및 판단 내용\n일반기업회계기준 제16장(수익) 문단 16.15와 16.16에 따르면 자산을 타인에게 사용하게\n함으로써 발생하는 로열티수익은 관련된 계약의 경제적 실질을 반영하여 발생기준에\n따라 인식하도록 규정하고 있음\n한국공인회계사회는 상기 회계기준 등을 고려하여, 약정기간 동안 사용할 수 있는 소프트\n웨어 라이선스 계약에 따른 수익과 비용은 발생기준에 따라 인식하여야 한다고 판단함\n4. 감사절차 미흡사항\n동 지적사례는 재무제표에 대한 심사로 종결되어 감사보고서 감리는 실시하지 아니함\n5. 시사점\n회사는 관련 회계기준을 숙지하고, 매출 및 매입 거래의 계약 조건 및 경제적 실질\n등을 종합적으로 검토하여 수익과 비용 인식 시점을 결정하여야 함\n쟁점분야: 수익·비용 기간귀속\n관련기준: 일반기업회계기준 제16장(수익)\n\n회사의 회계처리:\n회사는 소프트웨어 판권 보유자로부터 라이선스를 매입하여 고객사에 판매하고 있으며,\n라이선스 공급계약(통상 1년) 동안 고객사에 대해 소프트웨어 설치, 가동, 기술지원 및\n유지보수 의무 등을 부담하면서, 발생기준이 아닌 계약상 지급조건에 따른 세금계산서\n발행일에 매출과 매출원가를 인식함\n- 14 -\n\n회계기준 위반 지적 내용:\n회사는 약정기간 동안 사용할 수 있는 소프트웨어 라이선스 계약과 관련하여 발생기준\n으로 수익과 비용을 인식하여야 함에도, 이를 세금계산서 기준으로 잘못 인식하여 매출과\n매출원가를 과대(과소)계상함\n\n지적 근거 및 판단 내용:\n일반기업회계기준 제16장(수익) 문단 16.15와 16.16에 따르면 자산을 타인에게 사용하게\n함으로써 발생하는 로열티수익은 관련된 계약의 경제적 실질을 반영하여 발생기준에\n따라 인식하도록 규정하고 있음\n한국공인회계사회는 상기 회계기준 등을 고려하여, 약정기간 동안 사용할 수 있는 소프트\n웨어 라이선스 계약에 따른 수익과 비용은 발생기준에 따라 인식하여야 한다고 판단함\n\n감사절차 미흡사항:\n동 지적사례는 재무제표에 대한 심사로 종결되어 감사보고서 감리는 실시하지 아니함\n\n시사점:\n회사는 관련 회계기준을 숙지하고, 매출 및 매입 거래의 계약 조건 및 경제적 실질\n등을 종합적으로 검토하여 수익과 비용 인식 시점을 결정하여야 함"
    },
    {
      "paragraph_id": "KICPA-2025-09",
      "case_id": "KICPA-2025-09",
      "case_title": "매출채권 대손충당금 과소계상",
      "metadata": {
        "decision_year": "2025",
        "accounting_period": "’20.1.1.∼’23.12.31.\n1. 회사의 회계처리\n회사는 구매자의 요구에 따라 다품종소량 생산방식으로 제품을 제조하여 판매하고 있으며,\n매출부터 대금 회수까지 영업부서에 일임하고, 관리부서에서는 세무상 인정되는 대손상각\n금액을 기말 대손충당금으로 계상하거나, 과거 수준의 대손충당금 설정률을 적용하는 등\n회계처리를 담당한 당시 회계실무담당자의 판단에 의존하여 처리할 뿐 대손상각비용의\n산출근거가 없고, 대손충당금 설정에 대한 정책이 마련되어 있지 아니하여 결과적으로 각\n- 15 -\n개별채권의 회수가능성 등에 대한 검토 없이 대손충당금을 설정함\n2. 회계기준 위반 지적 내용\n회사는 폐업하거나 소재 불명된 거래처의 매출채권 및 거래관계가 중단된 거래처에 대한\n장기(상법상의 소멸시효 경과) 매출채권 등 회수가 불확실한 매출채권에 대하여 합리적이고\n객관적인 기준으로 대손충당금을 설정하지 아니함\n3. 지적 근거 및 판단 내용\n일반기업회계기준 제6장(금융자산·금융부채) 문단 6.17의2에 따르면 회수가 불확실한 금융\n자산(제2절 ‘유가증권’ 적용대상 금융자산은 제외)은 합리적이고 객관적인 기준에 따라\n산출한 대손추산액을 대손충당금으로 설정해야 한다고 규정하고 있음\n한국공인회계사회는 매출채권에 대하여 폐업·거래처 소재 불명·거래관계 중단 등을 고려\n하여 회수가능성을 평가하여 대손충당금을 설정하여야 함에도, 회사가 각 거래처의 개별\n적인 상황에 대한 검토 없이 과거 수준의 대손설정률을 일률적으로 적용함으로써 대손\n충당금이 과소계상되었다고 판단함\n4. 감사절차 미흡사항\n회계감사기준서 330(평가된 위험에 대한 감사인의 대응) 및 505(외부조회)에 따르면 실증\n감사절차로 외부조회절차를 수행할지 여부를 고려하고, 외부조회를 미실시하는 경우 대체적\n감사절차로부터 관련성이 있고 신뢰할 수 있는 감사증거를 입수하도록 규정하고 있으며,\n또한, 동 기준서 540(공정가치 등 회계추정치와 관련 공시에 대한 감사)에 따르면 유의적\n위험이 유발되는 회계추정치 중 하나인 매출채권의 대손충당금의 경우 해당 재무보고\n체계의 관점에서 합리적인지 또는 왜곡표시 되었는지 여부를 평가하도록 규정하고 있음\n감사인은 외부조회 절차를 수행하였으나, 미회신 매출채권에 대한 재무제표일 이후 대금\n회수 내역 확인 등의 대체적 감사절차 및 매출채권의 회수가능성 평가를 위한 대손충당금\n검토 절차 등 감사절차를 소홀히 함\n5. 시사점\n회사는 장기미회수채권, 휴·폐업거래처 채권의 대손충당금에 대한 구체적인 회계정책을\n수립하여 운영하고, 완전자본잠식 여부, 연체채권 식별 여부, 휴·폐업 여부, 담보설정 여부\n등을 확인하여 금융자산에 대한 손상차손이 불필요하다는 명백한 반증이 없는 한, 회수\n가능액을 추정하여 손상차손을 인식(당기손익에 반영)해야 함\n- 16 -\n감사인은 구성원에게 관련 교육 등을 강화하여 회계감사기준에서 규정하고 있는 매출\n채권에 대한 감사절차를 숙지하도록 하고, 회계감사기준에 따라 매출채권의 실재성 및\n평가의 적정성을 확인하기 위한 외부조회(대체적 감사절차 포함) 및 회수가능성에 대한\n평가절차 등 충분하고 적합한 감사절차를 수행하도록 하여야 함",
        "issue_fields": [
          "대손충당금"
        ],
        "related_standards": [
          "일반기업회계기준 제6장(금융자산·금융부채)"
        ],
        "case_type": "회계감리지적사례",
        "source": "KICPA 심사·감리 지적사례"
      },
      "content": {
        "section_1_company_accounting": {
          "section_title": "회사의 회계처리",
          "content": "회사는 구매자의 요구에 따라 다품종소량 생산방식으로 제품을 제조하여 판매하고 있으며,\n매출부터 대금 회수까지 영업부서에 일임하고, 관리부서에서는 세무상 인정되는 대손상각\n금액을 기말 대손충당금으로 계상하거나, 과거 수준의 대손충당금 설정률을 적용하는 등\n회계처리를 담당한 당시 회계실무담당자의 판단에 의존하여 처리할 뿐 대손상각비용의\n산출근거가 없고, 대손충당금 설정에 대한 정책이 마련되어 있지 아니하여 결과적으로 각\n- 15 -\n개별채권의 회수가능성 등에 대한 검토 없이 대손충당금을 설정함"
        },
        "section_2_violation_details": {
          "section_title": "회계기준 위반 지적 내용",
          "content": "회사는 폐업하거나 소재 불명된 거래처의 매출채권 및 거래관계가 중단된 거래처에 대한\n장기(상법상의 소멸시효 경과) 매출채권 등 회수가 불확실한 매출채권에 대하여 합리적이고\n객관적인 기준으로 대손충당금을 설정하지 아니함"
        },
        "section_3_basis_judgment": {
          "section_title": "지적 근거 및 판단 내용",
          "content": "일반기업회계기준 제6장(금융자산·금융부채) 문단 6.17의2에 따르면 회수가 불확실한 금융\n자산(제2절 ‘유가증권’ 적용대상 금융자산은 제외)은 합리적이고 객관적인 기준에 따라\n산출한 대손추산액을 대손충당금으로 설정해야 한다고 규정하고 있음\n한국공인회계사회는 매출채권에 대하여 폐업·거래처 소재 불명·거래관계 중단 등을 고려\n하여 회수가능성을 평가하여 대손충당금을 설정하여야 함에도, 회사가 각 거래처의 개별\n적인 상황에 대한 검토 없이 과거 수준의 대손설정률을 일률적으로 적용함으로써 대손\n충당금이 과소계상되었다고 판단함"
        },
        "section_4_audit_procedure": {
          "section_title": "감사절차 미흡사항",
          "content": "회계감사기준서 330(평가된 위험에 대한 감사인의 대응) 및 505(외부조회)에 따르면 실증\n감사절차로 외부조회절차를 수행할지 여부를 고려하고, 외부조회를 미실시하는 경우 대체적\n감사절차로부터 관련성이 있고 신뢰할 수 있는 감사증거를 입수하도록 규정하고 있으며,\n또한, 동 기준서 540(공정가치 등 회계추정치와 관련 공시에 대한 감사)에 따르면 유의적\n위험이 유발되는 회계추정치 중 하나인 매출채권의 대손충당금의 경우 해당 재무보고\n체계의 관점에서 합리적인지 또는 왜곡표시 되었는지 여부를 평가하도록 규정하고 있음\n감사인은 외부조회 절차를 수행하였으나, 미회신 매출채권에 대한 재무제표일 이후 대금\n회수 내역 확인 등의 대체적 감사절차 및 매출채권의 회수가능성 평가를 위한 대손충당금\n검토 절차 등 감사절차를 소홀히 함"
        },
        "section_5_implications": {
          "section_title": "시사점",
          "content": "회사는 장기미회수채권, 휴·폐업거래처 채권의 대손충당금에 대한 구체적인 회계정책을\n수립하여 운영하고, 완전자본잠식 여부, 연체채권 식별 여부, 휴·폐업 여부, 담보설정 여부\n등을 확인하여 금융자산에 대한 손상차손이 불필요하다는 명백한 반증이 없는 한, 회수\n가능액을 추정하여 손상차손을 인식(당기손익에 반영)해야 함\n- 16 -\n감사인은 구성원에게 관련 교육 등을 강화하여 회계감사기준에서 규정하고 있는 매출\n채권에 대한 감사절차를 숙지하도록 하고, 회계감사기준에 따라 매출채권의 실재성 및\n평가의 적정성을 확인하기 위한 외부조회(대체적 감사절차 포함) 및 회수가능성에 대한\n평가절차 등 충분하고 적합한 감사절차를 수행하도록 하여야 함"
        }
      },
      "indexed_content": "케이스 ID: KICPA-2025-09\n제목: 매출채권 대손충당금 과소계상\n결정연도: 2025년\n회계결산일: ’20.1.1.∼’23.12.31.\n1. 회사의 회계처리\n회사는 구매자의 요구에 따라 다품종소량 생산방식으로 제품을 제조하여 판매하고 있으며,\n매출부터 대금 회수까지 영업부서에 일임하고, 관리부서에서는 세무상 인정되는 대손상각\n금액을 기말 대손충당금으로 계상하거나, 과거 수준의 대손충당금 설정률을 적용하는 등\n회계처리를 담당한 당시 회계실무담당자의 판단에 의존하여 처리할 뿐 대손상각비용의\n산출근거가 없고, 대손충당금 설정에 대한 정책이 마련되어 있지 아니하여 결과적으로 각\n- 15 -\n개별채권의 회수가능성 등에 대한 검토 없이 대손충당금을 설정함\n2. 회계기준 위반 지적 내용\n회사는 폐업하거나 소재 불명된 거래처의 매출채권 및 거래관계가 중단된 거래처에 대한\n장기(상법상의 소멸시효 경과) 매출채권 등 회수가 불확실한 매출채권에 대하여 합리적이고\n객관적인 기준으로 대손충당금을 설정하지 아니함\n3. 지적 근거 및 판단 내용\n일반기업회계기준 제6장(금융자산·금융부채) 문단 6.17의2에 따르면 회수가 불확실한 금융\n자산(제2절 ‘유가증권’ 적용대상 금융자산은 제외)은 합리적이고 객관적인 기준에 따라\n산출한 대손추산액을 대손충당금으로 설정해야 한다고 규정하고 있음\n한국공인회계사회는 매출채권에 대하여 폐업·거래처 소재 불명·거래관계 중단 등을 고려\n하여 회수가능성을 평가하여 대손충당금을 설정하여야 함에도, 회사가 각 거래처의 개별\n적인 상황에 대한 검토 없이 과거 수준의 대손설정률을 일률적으로 적용함으로써 대손\n충당금이 과소계상되었다고 판단함\n4. 감사절차 미흡사항\n회계감사기준서 330(평가된 위험에 대한 감사인의 대응) 및 505(외부조회)에 따르면 실증\n감사절차로 외부조회절차를 수행할지 여부를 고려하고, 외부조회를 미실시하는 경우 대체적\n감사절차로부터 관련성이 있고 신뢰할 수 있는 감사증거를 입수하도록 규정하고 있으며,\n또한, 동 기준서 540(공정가치 등 회계추정치와 관련 공시에 대한 감사)에 따르면 유의적\n위험이 유발되는 회계추정치 중 하나인 매출채권의 대손충당금의 경우 해당 재무보고\n체계의 관점에서 합리적인지 또는 왜곡표시 되었는지 여부를 평가하도록 규정하고 있음\n감사인은 외부조회 절차를 수행하였으나, 미회신 매출채권에 대한 재무제표일 이후 대금\n회수 내역 확인 등의 대체적 감사절차 및 매출채권의 회수가능성 평가를 위한 대손충당금\n검토 절차 등 감사절차를 소홀히 함\n5. 시사점\n회사는 장기미회수채권, 휴·폐업거래처 채권의 대손충당금에 대한 구체적인 회계정책을\n수립하여 운영하고, 완전자본잠식 여부, 연체채권 식별 여부, 휴·폐업 여부, 담보설정 여부\n등을 확인하여 금융자산에 대한 손상차손이 불필요하다는 명백한 반증이 없는 한, 회수\n가능액을 추정하여 손상차손을 인식(당기손익에 반영)해야 함\n- 16 -\n감사인은 구성원에게 관련 교육 등을 강화하여 회계감사기준에서 규정하고 있는 매출\n채권에 대한 감사절차를 숙지하도록 하고, 회계감사기준에 따라 매출채권의 실재성 및\n평가의 적정성을 확인하기 위한 외부조회(대체적 감사절차 포함) 및 회수가능성에 대한\n평가절차 등 충분하고 적합한 감사절차를 수행하도록 하여야 함\n쟁점분야: 대손충당금\n관련기준: 일반기업회계기준 제6장(금융자산·금융부채)\n\n회사의 회계처리:\n회사는 구매자의 요구에 따라 다품종소량 생산방식으로 제품을 제조하여 판매하고 있으며,\n매출부터 대금 회수까지 영업부서에 일임하고, 관리부서에서는 세무상 인정되는 대손상각\n금액을 기말 대손충당금으로 계상하거나, 과거 수준의 대손충당금 설정률을 적용하는 등\n회계처리를 담당한 당시 회계실무담당자의 판단에 의존하여 처리할 뿐 대손상각비용의\n산출근거가 없고, 대손충당금 설정에 대한 정책이 마련되어 있지 아니하여 결과적으로 각\n- 15 -\n개별채권의 회수가능성 등에 대한 검토 없이 대손충당금을 설정함\n\n회계기준 위반 지적 내용:\n회사는 폐업하거나 소재 불명된 거래처의 매출채권 및 거래관계가 중단된 거래처에 대한\n장기(상법상의 소멸시효 경과) 매출채권 등 회수가 불확실한 매출채권에 대하여 합리적이고\n객관적인 기준으로 대손충당금을 설정하지 아니함\n\n지적 근거 및 판단 내용:\n일반기업회계기준 제6장(금융자산·금융부채) 문단 6.17의2에 따르면 회수가 불확실한 금융\n자산(제2절 ‘유가증권’ 적용대상 금융자산은 제외)은 합리적이고 객관적인 기준에 따라\n산출한 대손추산액을 대손충당금으로 설정해야 한다고 규정하고 있음\n한국공인회계사회는 매출채권에 대하여 폐업·거래처 소재 불명·거래관계 중단 등을 고려\n하여 회수가능성을 평가하여 대손충당금을 설정하여야 함에도, 회사가 각 거래처의 개별\n적인 상황에 대한 검토 없이 과거 수준의 대손설정률을 일률적으로 적용함으로써 대손\n충당금이 과소계상되었다고 판단함\n\n감사절차 미흡사항:\n회계감사기준서 330(평가된 위험에 대한 감사인의 대응) 및 505(외부조회)에 따르면 실증\n감사절차로 외부조회절차를 수행할지 여부를 고려하고, 외부조회를 미실시하는 경우 대체적\n감사절차로부터 관련성이 있고 신뢰할 수 있는 감사증거를 입수하도록 규정하고 있으며,\n또한, 동 기준서 540(공정가치 등 회계추정치와 관련 공시에 대한 감사)에 따르면 유의적\n위험이 유발되는 회계추정치 중 하나인 매출채권의 대손충당금의 경우 해당 재무보고\n체계의 관점에서 합리적인지 또는 왜곡표시 되었는지 여부를 평가하도록 규정하고 있음\n감사인은 외부조회 절차를 수행하였으나, 미회신 매출채권에 대한 재무제표일 이후 대금\n회수 내역 확인 등의 대체적 감사절차 및 매출채권의 회수가능성 평가를 위한 대손충당금\n검토 절차 등 감사절차를 소홀히 함\n\n시사점:\n회사는 장기미회수채권, 휴·폐업거래처 채권의 대손충당금에 대한 구체적인 회계정책을\n수립하여 운영하고, 완전자본잠식 여부, 연체채권 식별 여부, 휴·폐업 여부, 담보설정 여부\n등을 확인하여 금융자산에 대한 손상차손이 불필요하다는 명백한 반증이 없는 한, 회수\n가능액을 추정하여 손상차손을 인식(당기손익에 반영)해야 함\n- 16 -\n감사인은 구성원에게 관련 교육 등을 강화하여 회계감사기준에서 규정하고 있는 매출\n채권에 대한 감사절차를 숙지하도록 하고, 회계감사기준에 따라 매출채권의 실재성 및\n평가의 적정성을 확인하기 위한 외부조회(대체적 감사절차 포함) 및 회수가능성에 대한\n평가절차 등 충분하고 적합한 감사절차를 수행하도록 하여야 함"
    },
    {
      "paragraph_id": "KICPA-2025-10",
      "case_id": "KICPA-2025-10",
      "case_title": "매출채권 및 대여금 등 손상차손 과소계상",
      "metadata": {
        "decision_year": "2025",
        "accounting_period": "’22.1.1.∼’23.12.31.\n1. 회사의 회계처리\n회사는 해외영업을 위한 거점으로 중국·인도·미국·베트남 등에 해외 종속기업을 설립\n하였으며, 종속기업이 모두 외감규모 미만으로 중소기업 회계처리 특례를 적용하여\n출자금을 매도가능증권으로 분류하고, 종속기업과의 매출 및 자금거래 등에 따라 매출\n채권 및 대여금과 관련 미수수익 등을 인식하였음\n한편, 일부 종속기업은 장기간 매출이 발생하지 않아 완전자본잠식된 상황으로, 이자\n및 대여금 원금 상환도 지연되고 있는 등 손상징후가 있었음에도 회사는 종속기업의\n향후 공사 수주 가능성, 기 완료된 공사 관련 하자이행보증금 회수 가능성 등을 지나\n치게 낙관적으로 평가함에 따라 종속기업에 대한 매출채권 및 대여금, 매도가능증권\n등에 대해 손상차손을 인식하지 아니함\n2. 회계기준 위반 지적 내용\n장기간의 누적손실에 따른 재무상태 악화, 이자 및 원금 상환 지연 등 손상차손이\n발생하였다는 객관적인 증거가 존재하는 해외 종속기업 관련 매출채권 및 대여금,\n매도가능증권 등에 대해 손상차손을 인식하지 아니하여 매출채권 및 대여금, 매도가능\n증권 등을 과대계상함\n3. 지적 근거 및 판단 내용\n일반기업회계기준 제6장(금융자산·금융부채) 문단 6.17의2에 따르면 회수가 불확실한\n금융자산은 합리적이고 객관적인 기준에 따라 산출한 대손추산액을 대손충당금으로\n- 17 -\n설정하도록 규정하고 있고, 문단 6.32와 6.A8에 따르면 유가증권에 대하여 완전자본\n잠식 상태에 있는 경우와 같이 유가증권 발행자의 재무상태가 심각하게 악화된 경우나\n이자 지급과 원금 상환의 지연과 같은 채무불이행이 있는 경우에는 손상차손이 발생\n하였다는 객관적인 증거가 될 수 있고, 이러한 증거가 있는 경우에는 손상차손이 불필요\n하다는 명백한 반증이 없는 한, 회수가능액을 추정하여 손상차손을 인식하여 당기손익에\n반영하도록 규정하고 있음\n한국공인회계사회는 상기 회계기준 등을 고려하여, 해외 종속기업 출자금(매도가능증권)\n및 관련 매출채권과 대여금 등에 손상징후가 발생하였음에도 회사가 관련 회수가능액을\n적절히 추정하지 아니하고 손상차손도 인식하지 아니하여 매도가능증권 등이 과대계상\n되었다고 판단함\n4. 감사절차 미흡사항\n동 지적사례는 재무제표에 대한 심사로 종결되어 감사보고서 감리는 실시하지 아니함\n5. 시사점\n회사는 장기미회수채권, 휴·폐업거래처 채권 등에 대한 대손충당금에 대한 구체적인\n회계정책을 수립하여 운영하고, 완전자본잠식 여부, 연체채권 식별 여부, 휴·폐업 여부,\n담보설정 여부 등을 확인하여 금융자산에 대한 손상차손이 불필요하다는 명백한 반증이\n없는 한, 회수가능액을 추정하여 손상차손을 인식(당기손익에 반영)해야 함",
        "issue_fields": [
          "대손충당금"
        ],
        "related_standards": [
          "일반기업회계기준 제6장(금융자산·금융부채)"
        ],
        "case_type": "회계감리지적사례",
        "source": "KICPA 심사·감리 지적사례"
      },
      "content": {
        "section_1_company_accounting": {
          "section_title": "회사의 회계처리",
          "content": "회사는 해외영업을 위한 거점으로 중국·인도·미국·베트남 등에 해외 종속기업을 설립\n하였으며, 종속기업이 모두 외감규모 미만으로 중소기업 회계처리 특례를 적용하여\n출자금을 매도가능증권으로 분류하고, 종속기업과의 매출 및 자금거래 등에 따라 매출\n채권 및 대여금과 관련 미수수익 등을 인식하였음\n한편, 일부 종속기업은 장기간 매출이 발생하지 않아 완전자본잠식된 상황으로, 이자\n및 대여금 원금 상환도 지연되고 있는 등 손상징후가 있었음에도 회사는 종속기업의\n향후 공사 수주 가능성, 기 완료된 공사 관련 하자이행보증금 회수 가능성 등을 지나\n치게 낙관적으로 평가함에 따라 종속기업에 대한 매출채권 및 대여금, 매도가능증권\n등에 대해 손상차손을 인식하지 아니함"
        },
        "section_2_violation_details": {
          "section_title": "회계기준 위반 지적 내용",
          "content": "장기간의 누적손실에 따른 재무상태 악화, 이자 및 원금 상환 지연 등 손상차손이\n발생하였다는 객관적인 증거가 존재하는 해외 종속기업 관련 매출채권 및 대여금,\n매도가능증권 등에 대해 손상차손을 인식하지 아니하여 매출채권 및 대여금, 매도가능\n증권 등을 과대계상함"
        },
        "section_3_basis_judgment": {
          "section_title": "지적 근거 및 판단 내용",
          "content": "일반기업회계기준 제6장(금융자산·금융부채) 문단 6.17의2에 따르면 회수가 불확실한\n금융자산은 합리적이고 객관적인 기준에 따라 산출한 대손추산액을 대손충당금으로\n- 17 -\n설정하도록 규정하고 있고, 문단 6.32와 6.A8에 따르면 유가증권에 대하여 완전자본\n잠식 상태에 있는 경우와 같이 유가증권 발행자의 재무상태가 심각하게 악화된 경우나\n이자 지급과 원금 상환의 지연과 같은 채무불이행이 있는 경우에는 손상차손이 발생\n하였다는 객관적인 증거가 될 수 있고, 이러한 증거가 있는 경우에는 손상차손이 불필요\n하다는 명백한 반증이 없는 한, 회수가능액을 추정하여 손상차손을 인식하여 당기손익에\n반영하도록 규정하고 있음\n한국공인회계사회는 상기 회계기준 등을 고려하여, 해외 종속기업 출자금(매도가능증권)\n및 관련 매출채권과 대여금 등에 손상징후가 발생하였음에도 회사가 관련 회수가능액을\n적절히 추정하지 아니하고 손상차손도 인식하지 아니하여 매도가능증권 등이 과대계상\n되었다고 판단함"
        },
        "section_4_audit_procedure": {
          "section_title": "감사절차 미흡사항",
          "content": "동 지적사례는 재무제표에 대한 심사로 종결되어 감사보고서 감리는 실시하지 아니함"
        },
        "section_5_implications": {
          "section_title": "시사점",
          "content": "회사는 장기미회수채권, 휴·폐업거래처 채권 등에 대한 대손충당금에 대한 구체적인\n회계정책을 수립하여 운영하고, 완전자본잠식 여부, 연체채권 식별 여부, 휴·폐업 여부,\n담보설정 여부 등을 확인하여 금융자산에 대한 손상차손이 불필요하다는 명백한 반증이\n없는 한, 회수가능액을 추정하여 손상차손을 인식(당기손익에 반영)해야 함"
        }
      },
      "indexed_content": "케이스 ID: KICPA-2025-10\n제목: 매출채권 및 대여금 등 손상차손 과소계상\n결정연도: 2025년\n회계결산일: ’22.1.1.∼’23.12.31.\n1. 회사의 회계처리\n회사는 해외영업을 위한 거점으로 중국·인도·미국·베트남 등에 해외 종속기업을 설립\n하였으며, 종속기업이 모두 외감규모 미만으로 중소기업 회계처리 특례를 적용하여\n출자금을 매도가능증권으로 분류하고, 종속기업과의 매출 및 자금거래 등에 따라 매출\n채권 및 대여금과 관련 미수수익 등을 인식하였음\n한편, 일부 종속기업은 장기간 매출이 발생하지 않아 완전자본잠식된 상황으로, 이자\n및 대여금 원금 상환도 지연되고 있는 등 손상징후가 있었음에도 회사는 종속기업의\n향후 공사 수주 가능성, 기 완료된 공사 관련 하자이행보증금 회수 가능성 등을 지나\n치게 낙관적으로 평가함에 따라 종속기업에 대한 매출채권 및 대여금, 매도가능증권\n등에 대해 손상차손을 인식하지 아니함\n2. 회계기준 위반 지적 내용\n장기간의 누적손실에 따른 재무상태 악화, 이자 및 원금 상환 지연 등 손상차손이\n발생하였다는 객관적인 증거가 존재하는 해외 종속기업 관련 매출채권 및 대여금,\n매도가능증권 등에 대해 손상차손을 인식하지 아니하여 매출채권 및 대여금, 매도가능\n증권 등을 과대계상함\n3. 지적 근거 및 판단 내용\n일반기업회계기준 제6장(금융자산·금융부채) 문단 6.17의2에 따르면 회수가 불확실한\n금융자산은 합리적이고 객관적인 기준에 따라 산출한 대손추산액을 대손충당금으로\n- 17 -\n설정하도록 규정하고 있고, 문단 6.32와 6.A8에 따르면 유가증권에 대하여 완전자본\n잠식 상태에 있는 경우와 같이 유가증권 발행자의 재무상태가 심각하게 악화된 경우나\n이자 지급과 원금 상환의 지연과 같은 채무불이행이 있는 경우에는 손상차손이 발생\n하였다는 객관적인 증거가 될 수 있고, 이러한 증거가 있는 경우에는 손상차손이 불필요\n하다는 명백한 반증이 없는 한, 회수가능액을 추정하여 손상차손을 인식하여 당기손익에\n반영하도록 규정하고 있음\n한국공인회계사회는 상기 회계기준 등을 고려하여, 해외 종속기업 출자금(매도가능증권)\n및 관련 매출채권과 대여금 등에 손상징후가 발생하였음에도 회사가 관련 회수가능액을\n적절히 추정하지 아니하고 손상차손도 인식하지 아니하여 매도가능증권 등이 과대계상\n되었다고 판단함\n4. 감사절차 미흡사항\n동 지적사례는 재무제표에 대한 심사로 종결되어 감사보고서 감리는 실시하지 아니함\n5. 시사점\n회사는 장기미회수채권, 휴·폐업거래처 채권 등에 대한 대손충당금에 대한 구체적인\n회계정책을 수립하여 운영하고, 완전자본잠식 여부, 연체채권 식별 여부, 휴·폐업 여부,\n담보설정 여부 등을 확인하여 금융자산에 대한 손상차손이 불필요하다는 명백한 반증이\n없는 한, 회수가능액을 추정하여 손상차손을 인식(당기손익에 반영)해야 함\n쟁점분야: 대손충당금\n관련기준: 일반기업회계기준 제6장(금융자산·금융부채)\n\n회사의 회계처리:\n회사는 해외영업을 위한 거점으로 중국·인도·미국·베트남 등에 해외 종속기업을 설립\n하였으며, 종속기업이 모두 외감규모 미만으로 중소기업 회계처리 특례를 적용하여\n출자금을 매도가능증권으로 분류하고, 종속기업과의 매출 및 자금거래 등에 따라 매출\n채권 및 대여금과 관련 미수수익 등을 인식하였음\n한편, 일부 종속기업은 장기간 매출이 발생하지 않아 완전자본잠식된 상황으로, 이자\n및 대여금 원금 상환도 지연되고 있는 등 손상징후가 있었음에도 회사는 종속기업의\n향후 공사 수주 가능성, 기 완료된 공사 관련 하자이행보증금 회수 가능성 등을 지나\n치게 낙관적으로 평가함에 따라 종속기업에 대한 매출채권 및 대여금, 매도가능증권\n등에 대해 손상차손을 인식하지 아니함\n\n회계기준 위반 지적 내용:\n장기간의 누적손실에 따른 재무상태 악화, 이자 및 원금 상환 지연 등 손상차손이\n발생하였다는 객관적인 증거가 존재하는 해외 종속기업 관련 매출채권 및 대여금,\n매도가능증권 등에 대해 손상차손을 인식하지 아니하여 매출채권 및 대여금, 매도가능\n증권 등을 과대계상함\n\n지적 근거 및 판단 내용:\n일반기업회계기준 제6장(금융자산·금융부채) 문단 6.17의2에 따르면 회수가 불확실한\n금융자산은 합리적이고 객관적인 기준에 따라 산출한 대손추산액을 대손충당금으로\n- 17 -\n설정하도록 규정하고 있고, 문단 6.32와 6.A8에 따르면 유가증권에 대하여 완전자본\n잠식 상태에 있는 경우와 같이 유가증권 발행자의 재무상태가 심각하게 악화된 경우나\n이자 지급과 원금 상환의 지연과 같은 채무불이행이 있는 경우에는 손상차손이 발생\n하였다는 객관적인 증거가 될 수 있고, 이러한 증거가 있는 경우에는 손상차손이 불필요\n하다는 명백한 반증이 없는 한, 회수가능액을 추정하여 손상차손을 인식하여 당기손익에\n반영하도록 규정하고 있음\n한국공인회계사회는 상기 회계기준 등을 고려하여, 해외 종속기업 출자금(매도가능증권)\n및 관련 매출채권과 대여금 등에 손상징후가 발생하였음에도 회사가 관련 회수가능액을\n적절히 추정하지 아니하고 손상차손도 인식하지 아니하여 매도가능증권 등이 과대계상\n되었다고 판단함\n\n감사절차 미흡사항:\n동 지적사례는 재무제표에 대한 심사로 종결되어 감사보고서 감리는 실시하지 아니함\n\n시사점:\n회사는 장기미회수채권, 휴·폐업거래처 채권 등에 대한 대손충당금에 대한 구체적인\n회계정책을 수립하여 운영하고, 완전자본잠식 여부, 연체채권 식별 여부, 휴·폐업 여부,\n담보설정 여부 등을 확인하여 금융자산에 대한 손상차손이 불필요하다는 명백한 반증이\n없는 한, 회수가능액을 추정하여 손상차손을 인식(당기손익에 반영)해야 함"
    },
    {
      "paragraph_id": "KICPA-2025-11",
      "case_id": "KICPA-2025-11",
      "case_title": "이연법인세부채 과대계상",
      "metadata": {
        "decision_year": "2025",
        "accounting_period": "’23.1.1.∼’23.12.31.\n1. 회사의 회계처리\n회사는 종속기업에게 운영자금 지원을 목적으로 자금을 대여하거나 매출거래 등을 통해\n발생한 채권(장기대여금, 매출채권, 기타채권 등)을 계상하고, 동 채권에 대하여 회수가능액을\n평가하여 대손충당금을 계상하고 있음. 회사는 연결재무제표에서 종속기업 채권에 대한\n대손충당금은 제거되어 법인세효과가 없음에도 불구하고 이연법인세부채를 인식하였으며,\n- 18 -\n개별재무제표에서 지분법 회계처리 시 연결재무제표와 동일하게 종속기업 채권에 대한\n대손충당금의 법인세효과가 없음에도 불구하고 법인세효과를 반영하여 지분법적용투자\n주식을 차감하였음\n2. 회계기준 위반 지적 내용\n회사가 연결재무제표 작성시 종속기업 채권에 대한 대손충당금은 내부거래로 제거\n되고 관련 장부금액과 세무기준액이 동일하여 대손충당금 제거로 인한 법인세효과가\n없음에도 이를 이연법인세부채로 잘못 인식하여 이연법인세부채를 과대계상하였으며,\n개별재무제표에서 지분법 회계처리 시 종속기업 채권에 대한 대손충당금은 연결\n재무제표와 동일하게 법인세효과가 없음에도 이를 지분법적용투자주식에 반영함으로써\n지분법적용투자주식을 과소계상함\n3. 지적 근거 및 판단 내용\n일반기업회계기준 제22장(법인세회계) 문단 22.58에 따르면 연결재무제표를 작성할 때\n연결실체 내 기업간 자산거래에 포함된 미실현손익을 제거할 경우 발생하는 장부금액과\n세무기준액 사이의 일시적 차이에 대하여 이연법인세자산(부채)을 인식하도록 규정하고\n있음\n한국공인회계사회는 상기 회계기준을 고려하여, 장부금액과 세무기준액 사이의 일시적\n차이가 발생하지 아니하여 법인세 효과가 없음에도 연결 회계처리 시 이연법인세부채를\n인식하거나 지분법 회계처리 시 법인세 효과를 반영하여 회계처리 오류가 발생한 것\n으로 판단하였음\n4. 감사절차 미흡사항\n동 지적사례는 재무제표에 대한 심사로 종결되어 감사보고서 감리는 실시하지 아니함\n5. 시사점\n연결재무제표 작성 시 장부금액과 세무기준액 사이의 일시적 차이가 발생하는 지 여부를\n검토하고, 그 결과 확인된 일시적 차이에 대해 이연법인세자산(부채)을 인식하여야 하며,\n개별재무제표에서도 이를 고려하여 장부금액과 세무기준액 사이의 일시적 차이가\n발생하는 경우에만 지분법적용투자주식에 법인세효과를 반영하여 회계처리하여야 함\n- 19 -",
        "issue_fields": [
          "이연법인세, 지분법적용투자주식"
        ],
        "related_standards": [
          "일반기업회계기준 제22장(법인세회계)"
        ],
        "case_type": "회계감리지적사례",
        "source": "KICPA 심사·감리 지적사례"
      },
      "content": {
        "section_1_company_accounting": {
          "section_title": "회사의 회계처리",
          "content": "회사는 종속기업에게 운영자금 지원을 목적으로 자금을 대여하거나 매출거래 등을 통해\n발생한 채권(장기대여금, 매출채권, 기타채권 등)을 계상하고, 동 채권에 대하여 회수가능액을\n평가하여 대손충당금을 계상하고 있음. 회사는 연결재무제표에서 종속기업 채권에 대한\n대손충당금은 제거되어 법인세효과가 없음에도 불구하고 이연법인세부채를 인식하였으며,\n- 18 -\n개별재무제표에서 지분법 회계처리 시 연결재무제표와 동일하게 종속기업 채권에 대한\n대손충당금의 법인세효과가 없음에도 불구하고 법인세효과를 반영하여 지분법적용투자\n주식을 차감하였음"
        },
        "section_2_violation_details": {
          "section_title": "회계기준 위반 지적 내용",
          "content": "회사가 연결재무제표 작성시 종속기업 채권에 대한 대손충당금은 내부거래로 제거\n되고 관련 장부금액과 세무기준액이 동일하여 대손충당금 제거로 인한 법인세효과가\n없음에도 이를 이연법인세부채로 잘못 인식하여 이연법인세부채를 과대계상하였으며,\n개별재무제표에서 지분법 회계처리 시 종속기업 채권에 대한 대손충당금은 연결\n재무제표와 동일하게 법인세효과가 없음에도 이를 지분법적용투자주식에 반영함으로써\n지분법적용투자주식을 과소계상함"
        },
        "section_3_basis_judgment": {
          "section_title": "지적 근거 및 판단 내용",
          "content": "일반기업회계기준 제22장(법인세회계) 문단 22.58에 따르면 연결재무제표를 작성할 때\n연결실체 내 기업간 자산거래에 포함된 미실현손익을 제거할 경우 발생하는 장부금액과\n세무기준액 사이의 일시적 차이에 대하여 이연법인세자산(부채)을 인식하도록 규정하고\n있음\n한국공인회계사회는 상기 회계기준을 고려하여, 장부금액과 세무기준액 사이의 일시적\n차이가 발생하지 아니하여 법인세 효과가 없음에도 연결 회계처리 시 이연법인세부채를\n인식하거나 지분법 회계처리 시 법인세 효과를 반영하여 회계처리 오류가 발생한 것\n으로 판단하였음"
        },
        "section_4_audit_procedure": {
          "section_title": "감사절차 미흡사항",
          "content": "동 지적사례는 재무제표에 대한 심사로 종결되어 감사보고서 감리는 실시하지 아니함"
        },
        "section_5_implications": {
          "section_title": "시사점",
          "content": "연결재무제표 작성 시 장부금액과 세무기준액 사이의 일시적 차이가 발생하는 지 여부를\n검토하고, 그 결과 확인된 일시적 차이에 대해 이연법인세자산(부채)을 인식하여야 하며,\n개별재무제표에서도 이를 고려하여 장부금액과 세무기준액 사이의 일시적 차이가\n발생하는 경우에만 지분법적용투자주식에 법인세효과를 반영하여 회계처리하여야 함\n- 19 -"
        }
      },
      "indexed_content": "케이스 ID: KICPA-2025-11\n제목: 이연법인세부채 과대계상\n결정연도: 2025년\n회계결산일: ’23.1.1.∼’23.12.31.\n1. 회사의 회계처리\n회사는 종속기업에게 운영자금 지원을 목적으로 자금을 대여하거나 매출거래 등을 통해\n발생한 채권(장기대여금, 매출채권, 기타채권 등)을 계상하고, 동 채권에 대하여 회수가능액을\n평가하여 대손충당금을 계상하고 있음. 회사는 연결재무제표에서 종속기업 채권에 대한\n대손충당금은 제거되어 법인세효과가 없음에도 불구하고 이연법인세부채를 인식하였으며,\n- 18 -\n개별재무제표에서 지분법 회계처리 시 연결재무제표와 동일하게 종속기업 채권에 대한\n대손충당금의 법인세효과가 없음에도 불구하고 법인세효과를 반영하여 지분법적용투자\n주식을 차감하였음\n2. 회계기준 위반 지적 내용\n회사가 연결재무제표 작성시 종속기업 채권에 대한 대손충당금은 내부거래로 제거\n되고 관련 장부금액과 세무기준액이 동일하여 대손충당금 제거로 인한 법인세효과가\n없음에도 이를 이연법인세부채로 잘못 인식하여 이연법인세부채를 과대계상하였으며,\n개별재무제표에서 지분법 회계처리 시 종속기업 채권에 대한 대손충당금은 연결\n재무제표와 동일하게 법인세효과가 없음에도 이를 지분법적용투자주식에 반영함으로써\n지분법적용투자주식을 과소계상함\n3. 지적 근거 및 판단 내용\n일반기업회계기준 제22장(법인세회계) 문단 22.58에 따르면 연결재무제표를 작성할 때\n연결실체 내 기업간 자산거래에 포함된 미실현손익을 제거할 경우 발생하는 장부금액과\n세무기준액 사이의 일시적 차이에 대하여 이연법인세자산(부채)을 인식하도록 규정하고\n있음\n한국공인회계사회는 상기 회계기준을 고려하여, 장부금액과 세무기준액 사이의 일시적\n차이가 발생하지 아니하여 법인세 효과가 없음에도 연결 회계처리 시 이연법인세부채를\n인식하거나 지분법 회계처리 시 법인세 효과를 반영하여 회계처리 오류가 발생한 것\n으로 판단하였음\n4. 감사절차 미흡사항\n동 지적사례는 재무제표에 대한 심사로 종결되어 감사보고서 감리는 실시하지 아니함\n5. 시사점\n연결재무제표 작성 시 장부금액과 세무기준액 사이의 일시적 차이가 발생하는 지 여부를\n검토하고, 그 결과 확인된 일시적 차이에 대해 이연법인세자산(부채)을 인식하여야 하며,\n개별재무제표에서도 이를 고려하여 장부금액과 세무기준액 사이의 일시적 차이가\n발생하는 경우에만 지분법적용투자주식에 법인세효과를 반영하여 회계처리하여야 함\n- 19 -\n쟁점분야: 이연법인세, 지분법적용투자주식\n관련기준: 일반기업회계기준 제22장(법인세회계)\n\n회사의 회계처리:\n회사는 종속기업에게 운영자금 지원을 목적으로 자금을 대여하거나 매출거래 등을 통해\n발생한 채권(장기대여금, 매출채권, 기타채권 등)을 계상하고, 동 채권에 대하여 회수가능액을\n평가하여 대손충당금을 계상하고 있음. 회사는 연결재무제표에서 종속기업 채권에 대한\n대손충당금은 제거되어 법인세효과가 없음에도 불구하고 이연법인세부채를 인식하였으며,\n- 18 -\n개별재무제표에서 지분법 회계처리 시 연결재무제표와 동일하게 종속기업 채권에 대한\n대손충당금의 법인세효과가 없음에도 불구하고 법인세효과를 반영하여 지분법적용투자\n주식을 차감하였음\n\n회계기준 위반 지적 내용:\n회사가 연결재무제표 작성시 종속기업 채권에 대한 대손충당금은 내부거래로 제거\n되고 관련 장부금액과 세무기준액이 동일하여 대손충당금 제거로 인한 법인세효과가\n없음에도 이를 이연법인세부채로 잘못 인식하여 이연법인세부채를 과대계상하였으며,\n개별재무제표에서 지분법 회계처리 시 종속기업 채권에 대한 대손충당금은 연결\n재무제표와 동일하게 법인세효과가 없음에도 이를 지분법적용투자주식에 반영함으로써\n지분법적용투자주식을 과소계상함\n\n지적 근거 및 판단 내용:\n일반기업회계기준 제22장(법인세회계) 문단 22.58에 따르면 연결재무제표를 작성할 때\n연결실체 내 기업간 자산거래에 포함된 미실현손익을 제거할 경우 발생하는 장부금액과\n세무기준액 사이의 일시적 차이에 대하여 이연법인세자산(부채)을 인식하도록 규정하고\n있음\n한국공인회계사회는 상기 회계기준을 고려하여, 장부금액과 세무기준액 사이의 일시적\n차이가 발생하지 아니하여 법인세 효과가 없음에도 연결 회계처리 시 이연법인세부채를\n인식하거나 지분법 회계처리 시 법인세 효과를 반영하여 회계처리 오류가 발생한 것\n으로 판단하였음\n\n감사절차 미흡사항:\n동 지적사례는 재무제표에 대한 심사로 종결되어 감사보고서 감리는 실시하지 아니함\n\n시사점:\n연결재무제표 작성 시 장부금액과 세무기준액 사이의 일시적 차이가 발생하는 지 여부를\n검토하고, 그 결과 확인된 일시적 차이에 대해 이연법인세자산(부채)을 인식하여야 하며,\n개별재무제표에서도 이를 고려하여 장부금액과 세무기준액 사이의 일시적 차이가\n발생하는 경우에만 지분법적용투자주식에 법인세효과를 반영하여 회계처리하여야 함\n- 19 -"
    },
    {
      "paragraph_id": "KICPA-2025-12",
      "case_id": "KICPA-2025-12",
      "case_title": "이연법인세부채 과대계상(이중과세 방지제도 간과)",
      "metadata": {
        "decision_year": "2025",
        "accounting_period": "’22.1.1.∼’23.12.31.\n1. 회사의 회계처리\n회사는 국내 관계기업 투자주식에 대한 지분법 평가시 발생한 가산할 일시적차이와 관련\n하여, 지분법적용투자주식을 처분할 계획은 없으나 이익을 배당하지 않는다는 약정 등이\n없고, 과거 배당 이력도 존재하여 해당 일시적차이가 배당으로 실현될 것으로 판단\n하고 이연법인세부채를 계상함. 이때 이중과세를 방지하기 위해 법인세법에서 정하고\n있는 내국법인 수입배당금 익금불산입 규정을 간과하고 예상세율(21%)를 적용하여\n이연법인세부채를 측정함\n2. 회계기준 위반 지적 내용\n법인세법상 이중과세를 방지하기 위해 내국법인 수입배당금 익금불산입 제도를 간과\n하여 이연법인세부채를 과대계상하고 자기자본을 과소계상함\n3. 지적 근거 및 판단 내용\n일반기업회계기준 제22장(법인세회계) 문단 22.39에 따르면 이연법인세부채는 일시적차이의\n소멸 등으로 인하여 미래에 추가적으로 부담할 법인세로 측정하도록 규정하고 있음\n한국공인회계사회는 지분법적용투자주식과 관련한 가산할 일시적차이에 대한 이연법인세\n부채를 인식할 때, 법인세법상 수입배당금 익금불산입 대상이 되는 금액은 과세소득에서\n제외되어 미래에 추가적으로 부담할 법인세가 경감되는 점을 고려했어야 함에도 이를 간과\n하여 이연법인세부채가 과대계상 되었다고 판단함\n4. 감사절차 미흡사항\n동 지적사례는 재무제표에 대한 심사로 종결되어 감사보고서 감리는 실시하지 아니함\n- 20 -\n5. 시사점\n지분법적용투자주식 관련 가산할 일시적차이의 경우 당해 일시적차이의 소멸 방식(처분 혹은\n배당 등)을 고려하여 회사가 미래에 실질적으로 부담할 법인세로 측정하여야 하며,\n배당에 따라 일시적차이가 소멸되는 경우 지분율에 따른 수입배당금 익금불산입률 등을\n고려하여 측정할 필요가 있음",
        "issue_fields": [
          "이연법인세"
        ],
        "related_standards": [
          "일반기업회계기준 제22장(법인세회계)"
        ],
        "case_type": "회계감리지적사례",
        "source": "KICPA 심사·감리 지적사례"
      },
      "content": {
        "section_1_company_accounting": {
          "section_title": "회사의 회계처리",
          "content": "회사는 국내 관계기업 투자주식에 대한 지분법 평가시 발생한 가산할 일시적차이와 관련\n하여, 지분법적용투자주식을 처분할 계획은 없으나 이익을 배당하지 않는다는 약정 등이\n없고, 과거 배당 이력도 존재하여 해당 일시적차이가 배당으로 실현될 것으로 판단\n하고 이연법인세부채를 계상함. 이때 이중과세를 방지하기 위해 법인세법에서 정하고\n있는 내국법인 수입배당금 익금불산입 규정을 간과하고 예상세율(21%)를 적용하여\n이연법인세부채를 측정함"
        },
        "section_2_violation_details": {
          "section_title": "회계기준 위반 지적 내용",
          "content": "법인세법상 이중과세를 방지하기 위해 내국법인 수입배당금 익금불산입 제도를 간과\n하여 이연법인세부채를 과대계상하고 자기자본을 과소계상함"
        },
        "section_3_basis_judgment": {
          "section_title": "지적 근거 및 판단 내용",
          "content": "일반기업회계기준 제22장(법인세회계) 문단 22.39에 따르면 이연법인세부채는 일시적차이의\n소멸 등으로 인하여 미래에 추가적으로 부담할 법인세로 측정하도록 규정하고 있음\n한국공인회계사회는 지분법적용투자주식과 관련한 가산할 일시적차이에 대한 이연법인세\n부채를 인식할 때, 법인세법상 수입배당금 익금불산입 대상이 되는 금액은 과세소득에서\n제외되어 미래에 추가적으로 부담할 법인세가 경감되는 점을 고려했어야 함에도 이를 간과\n하여 이연법인세부채가 과대계상 되었다고 판단함"
        },
        "section_4_audit_procedure": {
          "section_title": "감사절차 미흡사항",
          "content": "동 지적사례는 재무제표에 대한 심사로 종결되어 감사보고서 감리는 실시하지 아니함\n- 20 -"
        },
        "section_5_implications": {
          "section_title": "시사점",
          "content": "지분법적용투자주식 관련 가산할 일시적차이의 경우 당해 일시적차이의 소멸 방식(처분 혹은\n배당 등)을 고려하여 회사가 미래에 실질적으로 부담할 법인세로 측정하여야 하며,\n배당에 따라 일시적차이가 소멸되는 경우 지분율에 따른 수입배당금 익금불산입률 등을\n고려하여 측정할 필요가 있음"
        }
      },
      "indexed_content": "케이스 ID: KICPA-2025-12\n제목: 이연법인세부채 과대계상(이중과세 방지제도 간과)\n결정연도: 2025년\n회계결산일: ’22.1.1.∼’23.12.31.\n1. 회사의 회계처리\n회사는 국내 관계기업 투자주식에 대한 지분법 평가시 발생한 가산할 일시적차이와 관련\n하여, 지분법적용투자주식을 처분할 계획은 없으나 이익을 배당하지 않는다는 약정 등이\n없고, 과거 배당 이력도 존재하여 해당 일시적차이가 배당으로 실현될 것으로 판단\n하고 이연법인세부채를 계상함. 이때 이중과세를 방지하기 위해 법인세법에서 정하고\n있는 내국법인 수입배당금 익금불산입 규정을 간과하고 예상세율(21%)를 적용하여\n이연법인세부채를 측정함\n2. 회계기준 위반 지적 내용\n법인세법상 이중과세를 방지하기 위해 내국법인 수입배당금 익금불산입 제도를 간과\n하여 이연법인세부채를 과대계상하고 자기자본을 과소계상함\n3. 지적 근거 및 판단 내용\n일반기업회계기준 제22장(법인세회계) 문단 22.39에 따르면 이연법인세부채는 일시적차이의\n소멸 등으로 인하여 미래에 추가적으로 부담할 법인세로 측정하도록 규정하고 있음\n한국공인회계사회는 지분법적용투자주식과 관련한 가산할 일시적차이에 대한 이연법인세\n부채를 인식할 때, 법인세법상 수입배당금 익금불산입 대상이 되는 금액은 과세소득에서\n제외되어 미래에 추가적으로 부담할 법인세가 경감되는 점을 고려했어야 함에도 이를 간과\n하여 이연법인세부채가 과대계상 되었다고 판단함\n4. 감사절차 미흡사항\n동 지적사례는 재무제표에 대한 심사로 종결되어 감사보고서 감리는 실시하지 아니함\n- 20 -\n5. 시사점\n지분법적용투자주식 관련 가산할 일시적차이의 경우 당해 일시적차이의 소멸 방식(처분 혹은\n배당 등)을 고려하여 회사가 미래에 실질적으로 부담할 법인세로 측정하여야 하며,\n배당에 따라 일시적차이가 소멸되는 경우 지분율에 따른 수입배당금 익금불산입률 등을\n고려하여 측정할 필요가 있음\n쟁점분야: 이연법인세\n관련기준: 일반기업회계기준 제22장(법인세회계)\n\n회사의 회계처리:\n회사는 국내 관계기업 투자주식에 대한 지분법 평가시 발생한 가산할 일시적차이와 관련\n하여, 지분법적용투자주식을 처분할 계획은 없으나 이익을 배당하지 않는다는 약정 등이\n없고, 과거 배당 이력도 존재하여 해당 일시적차이가 배당으로 실현될 것으로 판단\n하고 이연법인세부채를 계상함. 이때 이중과세를 방지하기 위해 법인세법에서 정하고\n있는 내국법인 수입배당금 익금불산입 규정을 간과하고 예상세율(21%)를 적용하여\n이연법인세부채를 측정함\n\n회계기준 위반 지적 내용:\n법인세법상 이중과세를 방지하기 위해 내국법인 수입배당금 익금불산입 제도를 간과\n하여 이연법인세부채를 과대계상하고 자기자본을 과소계상함\n\n지적 근거 및 판단 내용:\n일반기업회계기준 제22장(법인세회계) 문단 22.39에 따르면 이연법인세부채는 일시적차이의\n소멸 등으로 인하여 미래에 추가적으로 부담할 법인세로 측정하도록 규정하고 있음\n한국공인회계사회는 지분법적용투자주식과 관련한 가산할 일시적차이에 대한 이연법인세\n부채를 인식할 때, 법인세법상 수입배당금 익금불산입 대상이 되는 금액은 과세소득에서\n제외되어 미래에 추가적으로 부담할 법인세가 경감되는 점을 고려했어야 함에도 이를 간과\n하여 이연법인세부채가 과대계상 되었다고 판단함\n\n감사절차 미흡사항:\n동 지적사례는 재무제표에 대한 심사로 종결되어 감사보고서 감리는 실시하지 아니함\n- 20 -\n\n시사점:\n지분법적용투자주식 관련 가산할 일시적차이의 경우 당해 일시적차이의 소멸 방식(처분 혹은\n배당 등)을 고려하여 회사가 미래에 실질적으로 부담할 법인세로 측정하여야 하며,\n배당에 따라 일시적차이가 소멸되는 경우 지분율에 따른 수입배당금 익금불산입률 등을\n고려하여 측정할 필요가 있음"
    },
    {
      "paragraph_id": "KICPA-2025-13",
      "case_id": "KICPA-2025-13",
      "case_title": "파생상품부채 등 과소계상",
      "metadata": {
        "decision_year": "2025",
        "accounting_period": "’23.1.1.∼’23.12.31.\n1. 회사의 회계처리\n회사는 전환상환우선주(RCPS)와 관련된 파생상품부채(전환·상환 옵션)와 주식\n선택권의 공정가치를 측정하는 과정에서, 주요 투입변수인 기초자산(보통주) 가격에\n대해 평가일 기준 이용가능한 제3자 간 장외거래가격을 준용하기로 결정함\n다만, 회사는 제3자 간 장외거래의 당사자들이 회사의 미행사된 주식선택권의 수량\n및 행사가격 등 구체적인 정보를 알 수 없었을 것으로 판단하여, 평가일 기준 전환\n가능성이 높은 주식선택권의 보통주 전환에 따른 잠재적 희석효과를 해당 거래가격에\n추가 반영하였고, 조정된 거래사례가격을 기초자산 가격으로 사용하여 파생상품 및\n주식선택권의 공정가치를 측정함\n2. 회계기준 위반 지적 내용\n기업은 시장참여자가 경제적으로 최선의 행동을 한다는 가정하에, 시장참여자가 자산\n이나 부채의 가격을 결정할 때 사용할 가정에 근거하여 자산이나 부채의 공정가치를\n측정하여야 함에도, 회사는 파생상품부채와 주식선택권의 공정가치를 측정함에 있어, 제\n3자 간 거래사례가격을 그대로 사용하여 공정가치를 측정하는 대신 전환가능성이 높은\n잠재적 보통주의 희석효과를 추가 반영한 조정 거래사례가격을 사용함에 따라, 파생상품\n부채 및 주식선택권을 과소계상하여 당기순이익 및 자기자본을 과대계상함\n- 21 -\n3. 지적 근거 및 판단 내용\n기업회계기준서 제1113호(공정가치 측정) 문단 9, 22에 따르면, 공정가치는 측정일에\n시장참여자 사이의 정상거래에서 자산을 매도할 때 받거나 부채를 이전할 때 지급하게\n될 가격으로 정의하고, 기업은 시장참여자가 경제적으로 최선의 행동을 한다는 가정\n하에, 시장참여자가 자산이나 부채의 가격을 결정할 때 사용할 가정에 근거하여 자산\n이나 부채의 공정가치를 측정하여야 함\n한국공인회계사회는 파생상품부채 및 주식선택권의 공정가치를 측정함에 있어 시장\n참여자가 접근 가능한 제3자 간 거래사례가격을 기초자산 가격으로 사용하여야 하며,\n기업 내부 정보에 해당하는 잠재적 희석효과를 임의로 반영하여 거래사례가격을 조정\n하는 방식은 공정가치의 정의에 부합하지 않으므로, 관련 파생상품부채 및 주식선택권은\n시장참여자 관점에서 결정되는 공정가치를 기준으로 회계처리하여야 한다고 판단함\n4. 감사절차 미흡사항\n동 지적사례는 재무제표에 대한 심사로 종결되어 감사보고서 감리는 실시하지 아니함\n5. 시사점\n회사는 공정가치 측정 시 시장참여자의 관점에서 결정된 거래사례가격을 적용할 때,\n기업 내부의 추정에 기반하여 해당 가격을 임의로 조정하는 방식은 지양하여야 하고,\n공정가치 평가에 내부 정보를 반영하고자 하는 경우, 그 가정의 합리성과 적정성을\n충분히 검증할 수 있는 내부통제와 문서화 절차를 구축하여야 함",
        "issue_fields": [
          "파생상품부채"
        ],
        "related_standards": [
          "기업회계기준서 제1113호(공정가치 측정)"
        ],
        "case_type": "회계감리지적사례",
        "source": "KICPA 심사·감리 지적사례"
      },
      "content": {
        "section_1_company_accounting": {
          "section_title": "회사의 회계처리",
          "content": "회사는 전환상환우선주(RCPS)와 관련된 파생상품부채(전환·상환 옵션)와 주식\n선택권의 공정가치를 측정하는 과정에서, 주요 투입변수인 기초자산(보통주) 가격에\n대해 평가일 기준 이용가능한 제3자 간 장외거래가격을 준용하기로 결정함\n다만, 회사는 제3자 간 장외거래의 당사자들이 회사의 미행사된 주식선택권의 수량\n및 행사가격 등 구체적인 정보를 알 수 없었을 것으로 판단하여, 평가일 기준 전환\n가능성이 높은 주식선택권의 보통주 전환에 따른 잠재적 희석효과를 해당 거래가격에\n추가 반영하였고, 조정된 거래사례가격을 기초자산 가격으로 사용하여 파생상품 및\n주식선택권의 공정가치를 측정함"
        },
        "section_2_violation_details": {
          "section_title": "회계기준 위반 지적 내용",
          "content": "기업은 시장참여자가 경제적으로 최선의 행동을 한다는 가정하에, 시장참여자가 자산\n이나 부채의 가격을 결정할 때 사용할 가정에 근거하여 자산이나 부채의 공정가치를\n측정하여야 함에도, 회사는 파생상품부채와 주식선택권의 공정가치를 측정함에 있어, 제\n3자 간 거래사례가격을 그대로 사용하여 공정가치를 측정하는 대신 전환가능성이 높은\n잠재적 보통주의 희석효과를 추가 반영한 조정 거래사례가격을 사용함에 따라, 파생상품\n부채 및 주식선택권을 과소계상하여 당기순이익 및 자기자본을 과대계상함\n- 21 -"
        },
        "section_3_basis_judgment": {
          "section_title": "지적 근거 및 판단 내용",
          "content": "기업회계기준서 제1113호(공정가치 측정) 문단 9, 22에 따르면, 공정가치는 측정일에\n시장참여자 사이의 정상거래에서 자산을 매도할 때 받거나 부채를 이전할 때 지급하게\n될 가격으로 정의하고, 기업은 시장참여자가 경제적으로 최선의 행동을 한다는 가정\n하에, 시장참여자가 자산이나 부채의 가격을 결정할 때 사용할 가정에 근거하여 자산\n이나 부채의 공정가치를 측정하여야 함\n한국공인회계사회는 파생상품부채 및 주식선택권의 공정가치를 측정함에 있어 시장\n참여자가 접근 가능한 제3자 간 거래사례가격을 기초자산 가격으로 사용하여야 하며,\n기업 내부 정보에 해당하는 잠재적 희석효과를 임의로 반영하여 거래사례가격을 조정\n하는 방식은 공정가치의 정의에 부합하지 않으므로, 관련 파생상품부채 및 주식선택권은\n시장참여자 관점에서 결정되는 공정가치를 기준으로 회계처리하여야 한다고 판단함"
        },
        "section_4_audit_procedure": {
          "section_title": "감사절차 미흡사항",
          "content": "동 지적사례는 재무제표에 대한 심사로 종결되어 감사보고서 감리는 실시하지 아니함"
        },
        "section_5_implications": {
          "section_title": "시사점",
          "content": "회사는 공정가치 측정 시 시장참여자의 관점에서 결정된 거래사례가격을 적용할 때,\n기업 내부의 추정에 기반하여 해당 가격을 임의로 조정하는 방식은 지양하여야 하고,\n공정가치 평가에 내부 정보를 반영하고자 하는 경우, 그 가정의 합리성과 적정성을\n충분히 검증할 수 있는 내부통제와 문서화 절차를 구축하여야 함"
        }
      },
      "indexed_content": "케이스 ID: KICPA-2025-13\n제목: 파생상품부채 등 과소계상\n결정연도: 2025년\n회계결산일: ’23.1.1.∼’23.12.31.\n1. 회사의 회계처리\n회사는 전환상환우선주(RCPS)와 관련된 파생상품부채(전환·상환 옵션)와 주식\n선택권의 공정가치를 측정하는 과정에서, 주요 투입변수인 기초자산(보통주) 가격에\n대해 평가일 기준 이용가능한 제3자 간 장외거래가격을 준용하기로 결정함\n다만, 회사는 제3자 간 장외거래의 당사자들이 회사의 미행사된 주식선택권의 수량\n및 행사가격 등 구체적인 정보를 알 수 없었을 것으로 판단하여, 평가일 기준 전환\n가능성이 높은 주식선택권의 보통주 전환에 따른 잠재적 희석효과를 해당 거래가격에\n추가 반영하였고, 조정된 거래사례가격을 기초자산 가격으로 사용하여 파생상품 및\n주식선택권의 공정가치를 측정함\n2. 회계기준 위반 지적 내용\n기업은 시장참여자가 경제적으로 최선의 행동을 한다는 가정하에, 시장참여자가 자산\n이나 부채의 가격을 결정할 때 사용할 가정에 근거하여 자산이나 부채의 공정가치를\n측정하여야 함에도, 회사는 파생상품부채와 주식선택권의 공정가치를 측정함에 있어, 제\n3자 간 거래사례가격을 그대로 사용하여 공정가치를 측정하는 대신 전환가능성이 높은\n잠재적 보통주의 희석효과를 추가 반영한 조정 거래사례가격을 사용함에 따라, 파생상품\n부채 및 주식선택권을 과소계상하여 당기순이익 및 자기자본을 과대계상함\n- 21 -\n3. 지적 근거 및 판단 내용\n기업회계기준서 제1113호(공정가치 측정) 문단 9, 22에 따르면, 공정가치는 측정일에\n시장참여자 사이의 정상거래에서 자산을 매도할 때 받거나 부채를 이전할 때 지급하게\n될 가격으로 정의하고, 기업은 시장참여자가 경제적으로 최선의 행동을 한다는 가정\n하에, 시장참여자가 자산이나 부채의 가격을 결정할 때 사용할 가정에 근거하여 자산\n이나 부채의 공정가치를 측정하여야 함\n한국공인회계사회는 파생상품부채 및 주식선택권의 공정가치를 측정함에 있어 시장\n참여자가 접근 가능한 제3자 간 거래사례가격을 기초자산 가격으로 사용하여야 하며,\n기업 내부 정보에 해당하는 잠재적 희석효과를 임의로 반영하여 거래사례가격을 조정\n하는 방식은 공정가치의 정의에 부합하지 않으므로, 관련 파생상품부채 및 주식선택권은\n시장참여자 관점에서 결정되는 공정가치를 기준으로 회계처리하여야 한다고 판단함\n4. 감사절차 미흡사항\n동 지적사례는 재무제표에 대한 심사로 종결되어 감사보고서 감리는 실시하지 아니함\n5. 시사점\n회사는 공정가치 측정 시 시장참여자의 관점에서 결정된 거래사례가격을 적용할 때,\n기업 내부의 추정에 기반하여 해당 가격을 임의로 조정하는 방식은 지양하여야 하고,\n공정가치 평가에 내부 정보를 반영하고자 하는 경우, 그 가정의 합리성과 적정성을\n충분히 검증할 수 있는 내부통제와 문서화 절차를 구축하여야 함\n쟁점분야: 파생상품부채\n관련기준: 기업회계기준서 제1113호(공정가치 측정)\n\n회사의 회계처리:\n회사는 전환상환우선주(RCPS)와 관련된 파생상품부채(전환·상환 옵션)와 주식\n선택권의 공정가치를 측정하는 과정에서, 주요 투입변수인 기초자산(보통주) 가격에\n대해 평가일 기준 이용가능한 제3자 간 장외거래가격을 준용하기로 결정함\n다만, 회사는 제3자 간 장외거래의 당사자들이 회사의 미행사된 주식선택권의 수량\n및 행사가격 등 구체적인 정보를 알 수 없었을 것으로 판단하여, 평가일 기준 전환\n가능성이 높은 주식선택권의 보통주 전환에 따른 잠재적 희석효과를 해당 거래가격에\n추가 반영하였고, 조정된 거래사례가격을 기초자산 가격으로 사용하여 파생상품 및\n주식선택권의 공정가치를 측정함\n\n회계기준 위반 지적 내용:\n기업은 시장참여자가 경제적으로 최선의 행동을 한다는 가정하에, 시장참여자가 자산\n이나 부채의 가격을 결정할 때 사용할 가정에 근거하여 자산이나 부채의 공정가치를\n측정하여야 함에도, 회사는 파생상품부채와 주식선택권의 공정가치를 측정함에 있어, 제\n3자 간 거래사례가격을 그대로 사용하여 공정가치를 측정하는 대신 전환가능성이 높은\n잠재적 보통주의 희석효과를 추가 반영한 조정 거래사례가격을 사용함에 따라, 파생상품\n부채 및 주식선택권을 과소계상하여 당기순이익 및 자기자본을 과대계상함\n- 21 -\n\n지적 근거 및 판단 내용:\n기업회계기준서 제1113호(공정가치 측정) 문단 9, 22에 따르면, 공정가치는 측정일에\n시장참여자 사이의 정상거래에서 자산을 매도할 때 받거나 부채를 이전할 때 지급하게\n될 가격으로 정의하고, 기업은 시장참여자가 경제적으로 최선의 행동을 한다는 가정\n하에, 시장참여자가 자산이나 부채의 가격을 결정할 때 사용할 가정에 근거하여 자산\n이나 부채의 공정가치를 측정하여야 함\n한국공인회계사회는 파생상품부채 및 주식선택권의 공정가치를 측정함에 있어 시장\n참여자가 접근 가능한 제3자 간 거래사례가격을 기초자산 가격으로 사용하여야 하며,\n기업 내부 정보에 해당하는 잠재적 희석효과를 임의로 반영하여 거래사례가격을 조정\n하는 방식은 공정가치의 정의에 부합하지 않으므로, 관련 파생상품부채 및 주식선택권은\n시장참여자 관점에서 결정되는 공정가치를 기준으로 회계처리하여야 한다고 판단함\n\n감사절차 미흡사항:\n동 지적사례는 재무제표에 대한 심사로 종결되어 감사보고서 감리는 실시하지 아니함\n\n시사점:\n회사는 공정가치 측정 시 시장참여자의 관점에서 결정된 거래사례가격을 적용할 때,\n기업 내부의 추정에 기반하여 해당 가격을 임의로 조정하는 방식은 지양하여야 하고,\n공정가치 평가에 내부 정보를 반영하고자 하는 경우, 그 가정의 합리성과 적정성을\n충분히 검증할 수 있는 내부통제와 문서화 절차를 구축하여야 함"
    },
    {
      "paragraph_id": "KICPA-2025-14",
      "case_id": "KICPA-2025-14",
      "case_title": "성과상여금 미지급비용 과소계상",
      "metadata": {
        "decision_year": "2025",
        "accounting_period": "’23.1.1.∼’23.12.31.\n1. 회사의 회계처리\n회사는 ‘23년 실적과 연계하여 임직원에게 지급하여야 할 성과상여금을 ‘24년의\n비용으로 인식함\n- 22 -\n2. 회계기준 위반 지적 내용\n회사의 상여규정이 ‘23년 매출 및 영업이익 실적과 연계되도록 규정되어 있고,\n공식적 규약에 상여금 계산 방식이 포함되어 있어, 채무금액을 신뢰성 있게 추정\n할 수 있으므로 ‘23년 상여금을 ‘23년의 비용 및 부채(미지급비용)로 인식하여야\n함에도 이를 인식하지 아니하여 당기순이익 및 자기자본을 과대계상함\n3. 지적 근거 및 판단 내용\n기업회계기준서 제1019호(종업원급여) 문단 19, 22에 따르면, 과거 사건의 결과로\n현재의 지급의무가 생기고, 채무금액을 신뢰성 있게 추정할 수 있는 경우, 상여금의\n예상원가를 인식하도록 규정되어 있음\n또한, 상여금제도에 따라 기업이 부담하는 법적의무나 의제의무는 (1) 제도의 공식적\n규약에 급여계산방식이 포함되어 있거나, (2) 재무제표 발행이 승인되기 전에 지급액이\n산정되거나, (3) 과거 관행에 비추어 볼 때, 기업이 부담하는 의제의무의 금액을 명백히\n결정할 수 있을 때 신뢰성 있게 측정할 수 있다고 규정하고 있음\n한국공인회계사회는 회사가 상여금의 예상원가를 인식할 수 있는 상황이므로,\n상여금 및 부채(미지급비용)를 ‘23년의 비용으로 인식하여야 한다고 판단함\n4. 감사절차 미흡사항\n동 지적사례는 재무제표에 대한 심사로 종결되어 감사보고서 감리는 실시하지 아니함\n5. 시사점\n회사는 상여규정이 당기 실적과 연계되어 있고 채무금액을 합리적으로 추정할 수\n있는 경우, 성과상여금을 그 실적이 발생한 회계기간의 비용 및 부채(미지급비용)로\n인식하여야 하며, 내부 정보나 지급 시점만을 기준으로 비용을 차기로 이연하는\n회계처리는 지양하여야 함\n- 23 -",
        "issue_fields": [
          "종업원급여"
        ],
        "related_standards": [
          "기업회계기준서 제1019호(종업원급여)"
        ],
        "case_type": "회계감리지적사례",
        "source": "KICPA 심사·감리 지적사례"
      },
      "content": {
        "section_1_company_accounting": {
          "section_title": "회사의 회계처리",
          "content": "회사는 ‘23년 실적과 연계하여 임직원에게 지급하여야 할 성과상여금을 ‘24년의\n비용으로 인식함\n- 22 -"
        },
        "section_2_violation_details": {
          "section_title": "회계기준 위반 지적 내용",
          "content": "회사의 상여규정이 ‘23년 매출 및 영업이익 실적과 연계되도록 규정되어 있고,\n공식적 규약에 상여금 계산 방식이 포함되어 있어, 채무금액을 신뢰성 있게 추정\n할 수 있으므로 ‘23년 상여금을 ‘23년의 비용 및 부채(미지급비용)로 인식하여야\n함에도 이를 인식하지 아니하여 당기순이익 및 자기자본을 과대계상함"
        },
        "section_3_basis_judgment": {
          "section_title": "지적 근거 및 판단 내용",
          "content": "기업회계기준서 제1019호(종업원급여) 문단 19, 22에 따르면, 과거 사건의 결과로\n현재의 지급의무가 생기고, 채무금액을 신뢰성 있게 추정할 수 있는 경우, 상여금의\n예상원가를 인식하도록 규정되어 있음\n또한, 상여금제도에 따라 기업이 부담하는 법적의무나 의제의무는 (1) 제도의 공식적\n규약에 급여계산방식이 포함되어 있거나, (2) 재무제표 발행이 승인되기 전에 지급액이\n산정되거나, (3) 과거 관행에 비추어 볼 때, 기업이 부담하는 의제의무의 금액을 명백히\n결정할 수 있을 때 신뢰성 있게 측정할 수 있다고 규정하고 있음\n한국공인회계사회는 회사가 상여금의 예상원가를 인식할 수 있는 상황이므로,\n상여금 및 부채(미지급비용)를 ‘23년의 비용으로 인식하여야 한다고 판단함"
        },
        "section_4_audit_procedure": {
          "section_title": "감사절차 미흡사항",
          "content": "동 지적사례는 재무제표에 대한 심사로 종결되어 감사보고서 감리는 실시하지 아니함"
        },
        "section_5_implications": {
          "section_title": "시사점",
          "content": "회사는 상여규정이 당기 실적과 연계되어 있고 채무금액을 합리적으로 추정할 수\n있는 경우, 성과상여금을 그 실적이 발생한 회계기간의 비용 및 부채(미지급비용)로\n인식하여야 하며, 내부 정보나 지급 시점만을 기준으로 비용을 차기로 이연하는\n회계처리는 지양하여야 함\n- 23 -"
        }
      },
      "indexed_content": "케이스 ID: KICPA-2025-14\n제목: 성과상여금 미지급비용 과소계상\n결정연도: 2025년\n회계결산일: ’23.1.1.∼’23.12.31.\n1. 회사의 회계처리\n회사는 ‘23년 실적과 연계하여 임직원에게 지급하여야 할 성과상여금을 ‘24년의\n비용으로 인식함\n- 22 -\n2. 회계기준 위반 지적 내용\n회사의 상여규정이 ‘23년 매출 및 영업이익 실적과 연계되도록 규정되어 있고,\n공식적 규약에 상여금 계산 방식이 포함되어 있어, 채무금액을 신뢰성 있게 추정\n할 수 있으므로 ‘23년 상여금을 ‘23년의 비용 및 부채(미지급비용)로 인식하여야\n함에도 이를 인식하지 아니하여 당기순이익 및 자기자본을 과대계상함\n3. 지적 근거 및 판단 내용\n기업회계기준서 제1019호(종업원급여) 문단 19, 22에 따르면, 과거 사건의 결과로\n현재의 지급의무가 생기고, 채무금액을 신뢰성 있게 추정할 수 있는 경우, 상여금의\n예상원가를 인식하도록 규정되어 있음\n또한, 상여금제도에 따라 기업이 부담하는 법적의무나 의제의무는 (1) 제도의 공식적\n규약에 급여계산방식이 포함되어 있거나, (2) 재무제표 발행이 승인되기 전에 지급액이\n산정되거나, (3) 과거 관행에 비추어 볼 때, 기업이 부담하는 의제의무의 금액을 명백히\n결정할 수 있을 때 신뢰성 있게 측정할 수 있다고 규정하고 있음\n한국공인회계사회는 회사가 상여금의 예상원가를 인식할 수 있는 상황이므로,\n상여금 및 부채(미지급비용)를 ‘23년의 비용으로 인식하여야 한다고 판단함\n4. 감사절차 미흡사항\n동 지적사례는 재무제표에 대한 심사로 종결되어 감사보고서 감리는 실시하지 아니함\n5. 시사점\n회사는 상여규정이 당기 실적과 연계되어 있고 채무금액을 합리적으로 추정할 수\n있는 경우, 성과상여금을 그 실적이 발생한 회계기간의 비용 및 부채(미지급비용)로\n인식하여야 하며, 내부 정보나 지급 시점만을 기준으로 비용을 차기로 이연하는\n회계처리는 지양하여야 함\n- 23 -\n쟁점분야: 종업원급여\n관련기준: 기업회계기준서 제1019호(종업원급여)\n\n회사의 회계처리:\n회사는 ‘23년 실적과 연계하여 임직원에게 지급하여야 할 성과상여금을 ‘24년의\n비용으로 인식함\n- 22 -\n\n회계기준 위반 지적 내용:\n회사의 상여규정이 ‘23년 매출 및 영업이익 실적과 연계되도록 규정되어 있고,\n공식적 규약에 상여금 계산 방식이 포함되어 있어, 채무금액을 신뢰성 있게 추정\n할 수 있으므로 ‘23년 상여금을 ‘23년의 비용 및 부채(미지급비용)로 인식하여야\n함에도 이를 인식하지 아니하여 당기순이익 및 자기자본을 과대계상함\n\n지적 근거 및 판단 내용:\n기업회계기준서 제1019호(종업원급여) 문단 19, 22에 따르면, 과거 사건의 결과로\n현재의 지급의무가 생기고, 채무금액을 신뢰성 있게 추정할 수 있는 경우, 상여금의\n예상원가를 인식하도록 규정되어 있음\n또한, 상여금제도에 따라 기업이 부담하는 법적의무나 의제의무는 (1) 제도의 공식적\n규약에 급여계산방식이 포함되어 있거나, (2) 재무제표 발행이 승인되기 전에 지급액이\n산정되거나, (3) 과거 관행에 비추어 볼 때, 기업이 부담하는 의제의무의 금액을 명백히\n결정할 수 있을 때 신뢰성 있게 측정할 수 있다고 규정하고 있음\n한국공인회계사회는 회사가 상여금의 예상원가를 인식할 수 있는 상황이므로,\n상여금 및 부채(미지급비용)를 ‘23년의 비용으로 인식하여야 한다고 판단함\n\n감사절차 미흡사항:\n동 지적사례는 재무제표에 대한 심사로 종결되어 감사보고서 감리는 실시하지 아니함\n\n시사점:\n회사는 상여규정이 당기 실적과 연계되어 있고 채무금액을 합리적으로 추정할 수\n있는 경우, 성과상여금을 그 실적이 발생한 회계기간의 비용 및 부채(미지급비용)로\n인식하여야 하며, 내부 정보나 지급 시점만을 기준으로 비용을 차기로 이연하는\n회계처리는 지양하여야 함\n- 23 -"
    },
    {
      "paragraph_id": "KICPA-2025-15",
      "case_id": "KICPA-2025-15",
      "case_title": "지분법 적용 오류(지분법계산, 손상차손)",
      "metadata": {
        "decision_year": "2025",
        "accounting_period": "’21.1.1.∼’22.12.31.\n1. 회사의 회계처리\n회사는 종속기업투자주식에 대해 개별재무제표에서 지분법을 적용하고, 연결재무\n제표를 작성하였으나, 회계실무 담당자의 잦은 변경으로 지분법 및 연결히스토리\n관리가 적절하게 이루어지지 않아, ① 회사와 종속기업의 회계정책일치를 위한\n조정분개에 오류가 발생하였고, ② 종속기업에 손상징후가 있었음에도 종속기업의\n손상평가를 수행하지 않고, 개별재무제표에서만 지분법적용투자주식을 계산근거없이\n0으로 계상하였으며, ③ 개별재무제표에서 종속기업 채권에 대해 대손충당금을 계상하였\n음에도 매년 인식한 대손상각비만큼 지분법적용투자주식과 지분법이익으로 계상\n하지 않음\n2. 회계기준 위반 지적 내용\n회사는 ① 회사와 종속기업 간 회계정책일치를 위한 조정을 수행하는 과정에서 오류가\n있었음에도 이를 인지하지 못하고 지분법을 적용하였고, ② 종속기업의 재무제표 상\n손상징후가 있어, 장부가액을 회수가능가액으로 조정이 필요한 자산항목에 대해 손상\n차손과 평가손실을 추가로 인식해야 함에도 이를 인식하지 않는 등 피투자회사의 재무\n제표에 대한 신뢰성 검토 없이 지분법을 적용하였으며, ③ 종속기업 채권에 대해 대손\n충당금을 계상하였음에도 인식한 대손상각비를 지분법적용투자주식과 지분법이익으로\n계상하지 않아, 결과적으로 개별재무제표에서 지분법적용투자주식을 과소계상하고,\n연결재무제표에서 자기자본을 과대계상함\n3. 지적 근거 및 판단 내용\n일반기업회계기준 제8장(지분법) 문단 8.21, 8.23 및 8.35에 따르면, 지분법은 투자기업의\n보고기간종료일을 기준으로 작성된 신뢰성 있는 재무제표를 사용하고, 동일한 거래나\n사건에 대하여는 관계기업의 회계정책을 투자기업의 회계정책과 일치하도록 적절히\n수정하여 적용하여야 하며, 피투자기업이 종속기업인 경우, 투자기업이 종속기업에\n- 24 -\n대하여 채권을 소유하고 있고 이에 대하여 대손충당금을 설정하였다면, 당해 회계기간에\n인식한 대손상각비는 지분법적용투자주식에 가산하고 당기이익(예: 지분법이익)에 반영\n하여 지배기업 개별재무제표의 당기순손익 및 순자산이 연결재무제표의 당기순손익 및\n순자산에 대한 지배기업의 지분과 일치하게 회계처리를 하도록 규정하고 있음\n일반기업회계기준 제20장(자산손상) 문단 20.8에 따르면, 자산의 진부화 및 시장가치의\n급격한 하락 등으로 인하여 자산의 회수가능가액이 장부금액에 중요하게 미달되는 경우\n에는 장부금액을 회수가능액으로 조정하고, 그 차액을 손상차손으로 처리하도록 규정\n하고 있음\n한국공인회계사회는 지분법을 적용 및 연결재무제표를 작성함에 있어 종속기업 재무\n제표의 신뢰성을 검토하고 회계정책을 일치하도록 조정한 후 이를 사용하여야 하며,\n종속기업의 손상징후가 존재하는 경우에는 회수가능가액을 합리적으로 추정하여 손상\n차손을 인식하고, 종속기업 채권에 대하여 대손충당금을 설정한 경우에는 인식된 대손\n상각비를 지분법적용투자주식과 지분법이익에 반영함으로써, 지배기업 개별재무제표의\n당기순손익 및 순자산이 연결재무제표의 당기순손익 및 순자산에 대한 지배기업의\n지분과 일치하게 회계처리를 해야한다고 판단함\n4. 감사절차 미흡사항\n동 지적사례는 재무제표에 대한 심사로 종결되어 감사보고서 감리는 실시하지 아니함\n5. 시사점\n회사는 개별재무제표에서 지분법 적용 및 연결재무제표 작성 시, 종속기업 재무제표의\n신뢰성 검토와 회계정책 일치 여부를 철저히 확인하여야 하며, 회계정책 일치를 위한\n조정 분개, 연결조정분개 등 지분법 적용과 연결재무제표 작성과정에서 발생할 수\n있는 오류를 방지하기 위해 지분법 및 연결 히스토리를 체계적으로 관리하여야 함\n- 25 -",
        "issue_fields": [
          "지분법적용투자주식, 자산손상"
        ],
        "related_standards": [
          "일반기업회계기준 제8장(지분법)",
          "일반기업회계기준 제20장(자산손상)"
        ],
        "case_type": "회계감리지적사례",
        "source": "KICPA 심사·감리 지적사례"
      },
      "content": {
        "section_1_company_accounting": {
          "section_title": "회사의 회계처리",
          "content": "회사는 종속기업투자주식에 대해 개별재무제표에서 지분법을 적용하고, 연결재무\n제표를 작성하였으나, 회계실무 담당자의 잦은 변경으로 지분법 및 연결히스토리\n관리가 적절하게 이루어지지 않아, ① 회사와 종속기업의 회계정책일치를 위한\n조정분개에 오류가 발생하였고, ② 종속기업에 손상징후가 있었음에도 종속기업의\n손상평가를 수행하지 않고, 개별재무제표에서만 지분법적용투자주식을 계산근거없이\n0으로 계상하였으며, ③ 개별재무제표에서 종속기업 채권에 대해 대손충당금을 계상하였\n음에도 매년 인식한 대손상각비만큼 지분법적용투자주식과 지분법이익으로 계상\n하지 않음"
        },
        "section_2_violation_details": {
          "section_title": "회계기준 위반 지적 내용",
          "content": "회사는 ① 회사와 종속기업 간 회계정책일치를 위한 조정을 수행하는 과정에서 오류가\n있었음에도 이를 인지하지 못하고 지분법을 적용하였고, ② 종속기업의 재무제표 상\n손상징후가 있어, 장부가액을 회수가능가액으로 조정이 필요한 자산항목에 대해 손상\n차손과 평가손실을 추가로 인식해야 함에도 이를 인식하지 않는 등 피투자회사의 재무\n제표에 대한 신뢰성 검토 없이 지분법을 적용하였으며, ③ 종속기업 채권에 대해 대손\n충당금을 계상하였음에도 인식한 대손상각비를 지분법적용투자주식과 지분법이익으로\n계상하지 않아, 결과적으로 개별재무제표에서 지분법적용투자주식을 과소계상하고,\n연결재무제표에서 자기자본을 과대계상함"
        },
        "section_3_basis_judgment": {
          "section_title": "지적 근거 및 판단 내용",
          "content": "일반기업회계기준 제8장(지분법) 문단 8.21, 8.23 및 8.35에 따르면, 지분법은 투자기업의\n보고기간종료일을 기준으로 작성된 신뢰성 있는 재무제표를 사용하고, 동일한 거래나\n사건에 대하여는 관계기업의 회계정책을 투자기업의 회계정책과 일치하도록 적절히\n수정하여 적용하여야 하며, 피투자기업이 종속기업인 경우, 투자기업이 종속기업에\n- 24 -\n대하여 채권을 소유하고 있고 이에 대하여 대손충당금을 설정하였다면, 당해 회계기간에\n인식한 대손상각비는 지분법적용투자주식에 가산하고 당기이익(예: 지분법이익)에 반영\n하여 지배기업 개별재무제표의 당기순손익 및 순자산이 연결재무제표의 당기순손익 및\n순자산에 대한 지배기업의 지분과 일치하게 회계처리를 하도록 규정하고 있음\n일반기업회계기준 제20장(자산손상) 문단 20.8에 따르면, 자산의 진부화 및 시장가치의\n급격한 하락 등으로 인하여 자산의 회수가능가액이 장부금액에 중요하게 미달되는 경우\n에는 장부금액을 회수가능액으로 조정하고, 그 차액을 손상차손으로 처리하도록 규정\n하고 있음\n한국공인회계사회는 지분법을 적용 및 연결재무제표를 작성함에 있어 종속기업 재무\n제표의 신뢰성을 검토하고 회계정책을 일치하도록 조정한 후 이를 사용하여야 하며,\n종속기업의 손상징후가 존재하는 경우에는 회수가능가액을 합리적으로 추정하여 손상\n차손을 인식하고, 종속기업 채권에 대하여 대손충당금을 설정한 경우에는 인식된 대손\n상각비를 지분법적용투자주식과 지분법이익에 반영함으로써, 지배기업 개별재무제표의\n당기순손익 및 순자산이 연결재무제표의 당기순손익 및 순자산에 대한 지배기업의\n지분과 일치하게 회계처리를 해야한다고 판단함"
        },
        "section_4_audit_procedure": {
          "section_title": "감사절차 미흡사항",
          "content": "동 지적사례는 재무제표에 대한 심사로 종결되어 감사보고서 감리는 실시하지 아니함"
        },
        "section_5_implications": {
          "section_title": "시사점",
          "content": "회사는 개별재무제표에서 지분법 적용 및 연결재무제표 작성 시, 종속기업 재무제표의\n신뢰성 검토와 회계정책 일치 여부를 철저히 확인하여야 하며, 회계정책 일치를 위한\n조정 분개, 연결조정분개 등 지분법 적용과 연결재무제표 작성과정에서 발생할 수\n있는 오류를 방지하기 위해 지분법 및 연결 히스토리를 체계적으로 관리하여야 함\n- 25 -"
        }
      },
      "indexed_content": "케이스 ID: KICPA-2025-15\n제목: 지분법 적용 오류(지분법계산, 손상차손)\n결정연도: 2025년\n회계결산일: ’21.1.1.∼’22.12.31.\n1. 회사의 회계처리\n회사는 종속기업투자주식에 대해 개별재무제표에서 지분법을 적용하고, 연결재무\n제표를 작성하였으나, 회계실무 담당자의 잦은 변경으로 지분법 및 연결히스토리\n관리가 적절하게 이루어지지 않아, ① 회사와 종속기업의 회계정책일치를 위한\n조정분개에 오류가 발생하였고, ② 종속기업에 손상징후가 있었음에도 종속기업의\n손상평가를 수행하지 않고, 개별재무제표에서만 지분법적용투자주식을 계산근거없이\n0으로 계상하였으며, ③ 개별재무제표에서 종속기업 채권에 대해 대손충당금을 계상하였\n음에도 매년 인식한 대손상각비만큼 지분법적용투자주식과 지분법이익으로 계상\n하지 않음\n2. 회계기준 위반 지적 내용\n회사는 ① 회사와 종속기업 간 회계정책일치를 위한 조정을 수행하는 과정에서 오류가\n있었음에도 이를 인지하지 못하고 지분법을 적용하였고, ② 종속기업의 재무제표 상\n손상징후가 있어, 장부가액을 회수가능가액으로 조정이 필요한 자산항목에 대해 손상\n차손과 평가손실을 추가로 인식해야 함에도 이를 인식하지 않는 등 피투자회사의 재무\n제표에 대한 신뢰성 검토 없이 지분법을 적용하였으며, ③ 종속기업 채권에 대해 대손\n충당금을 계상하였음에도 인식한 대손상각비를 지분법적용투자주식과 지분법이익으로\n계상하지 않아, 결과적으로 개별재무제표에서 지분법적용투자주식을 과소계상하고,\n연결재무제표에서 자기자본을 과대계상함\n3. 지적 근거 및 판단 내용\n일반기업회계기준 제8장(지분법) 문단 8.21, 8.23 및 8.35에 따르면, 지분법은 투자기업의\n보고기간종료일을 기준으로 작성된 신뢰성 있는 재무제표를 사용하고, 동일한 거래나\n사건에 대하여는 관계기업의 회계정책을 투자기업의 회계정책과 일치하도록 적절히\n수정하여 적용하여야 하며, 피투자기업이 종속기업인 경우, 투자기업이 종속기업에\n- 24 -\n대하여 채권을 소유하고 있고 이에 대하여 대손충당금을 설정하였다면, 당해 회계기간에\n인식한 대손상각비는 지분법적용투자주식에 가산하고 당기이익(예: 지분법이익)에 반영\n하여 지배기업 개별재무제표의 당기순손익 및 순자산이 연결재무제표의 당기순손익 및\n순자산에 대한 지배기업의 지분과 일치하게 회계처리를 하도록 규정하고 있음\n일반기업회계기준 제20장(자산손상) 문단 20.8에 따르면, 자산의 진부화 및 시장가치의\n급격한 하락 등으로 인하여 자산의 회수가능가액이 장부금액에 중요하게 미달되는 경우\n에는 장부금액을 회수가능액으로 조정하고, 그 차액을 손상차손으로 처리하도록 규정\n하고 있음\n한국공인회계사회는 지분법을 적용 및 연결재무제표를 작성함에 있어 종속기업 재무\n제표의 신뢰성을 검토하고 회계정책을 일치하도록 조정한 후 이를 사용하여야 하며,\n종속기업의 손상징후가 존재하는 경우에는 회수가능가액을 합리적으로 추정하여 손상\n차손을 인식하고, 종속기업 채권에 대하여 대손충당금을 설정한 경우에는 인식된 대손\n상각비를 지분법적용투자주식과 지분법이익에 반영함으로써, 지배기업 개별재무제표의\n당기순손익 및 순자산이 연결재무제표의 당기순손익 및 순자산에 대한 지배기업의\n지분과 일치하게 회계처리를 해야한다고 판단함\n4. 감사절차 미흡사항\n동 지적사례는 재무제표에 대한 심사로 종결되어 감사보고서 감리는 실시하지 아니함\n5. 시사점\n회사는 개별재무제표에서 지분법 적용 및 연결재무제표 작성 시, 종속기업 재무제표의\n신뢰성 검토와 회계정책 일치 여부를 철저히 확인하여야 하며, 회계정책 일치를 위한\n조정 분개, 연결조정분개 등 지분법 적용과 연결재무제표 작성과정에서 발생할 수\n있는 오류를 방지하기 위해 지분법 및 연결 히스토리를 체계적으로 관리하여야 함\n- 25 -\n쟁점분야: 지분법적용투자주식, 자산손상\n관련기준: 일반기업회계기준 제8장(지분법), 일반기업회계기준 제20장(자산손상)\n\n회사의 회계처리:\n회사는 종속기업투자주식에 대해 개별재무제표에서 지분법을 적용하고, 연결재무\n제표를 작성하였으나, 회계실무 담당자의 잦은 변경으로 지분법 및 연결히스토리\n관리가 적절하게 이루어지지 않아, ① 회사와 종속기업의 회계정책일치를 위한\n조정분개에 오류가 발생하였고, ② 종속기업에 손상징후가 있었음에도 종속기업의\n손상평가를 수행하지 않고, 개별재무제표에서만 지분법적용투자주식을 계산근거없이\n0으로 계상하였으며, ③ 개별재무제표에서 종속기업 채권에 대해 대손충당금을 계상하였\n음에도 매년 인식한 대손상각비만큼 지분법적용투자주식과 지분법이익으로 계상\n하지 않음\n\n회계기준 위반 지적 내용:\n회사는 ① 회사와 종속기업 간 회계정책일치를 위한 조정을 수행하는 과정에서 오류가\n있었음에도 이를 인지하지 못하고 지분법을 적용하였고, ② 종속기업의 재무제표 상\n손상징후가 있어, 장부가액을 회수가능가액으로 조정이 필요한 자산항목에 대해 손상\n차손과 평가손실을 추가로 인식해야 함에도 이를 인식하지 않는 등 피투자회사의 재무\n제표에 대한 신뢰성 검토 없이 지분법을 적용하였으며, ③ 종속기업 채권에 대해 대손\n충당금을 계상하였음에도 인식한 대손상각비를 지분법적용투자주식과 지분법이익으로\n계상하지 않아, 결과적으로 개별재무제표에서 지분법적용투자주식을 과소계상하고,\n연결재무제표에서 자기자본을 과대계상함\n\n지적 근거 및 판단 내용:\n일반기업회계기준 제8장(지분법) 문단 8.21, 8.23 및 8.35에 따르면, 지분법은 투자기업의\n보고기간종료일을 기준으로 작성된 신뢰성 있는 재무제표를 사용하고, 동일한 거래나\n사건에 대하여는 관계기업의 회계정책을 투자기업의 회계정책과 일치하도록 적절히\n수정하여 적용하여야 하며, 피투자기업이 종속기업인 경우, 투자기업이 종속기업에\n- 24 -\n대하여 채권을 소유하고 있고 이에 대하여 대손충당금을 설정하였다면, 당해 회계기간에\n인식한 대손상각비는 지분법적용투자주식에 가산하고 당기이익(예: 지분법이익)에 반영\n하여 지배기업 개별재무제표의 당기순손익 및 순자산이 연결재무제표의 당기순손익 및\n순자산에 대한 지배기업의 지분과 일치하게 회계처리를 하도록 규정하고 있음\n일반기업회계기준 제20장(자산손상) 문단 20.8에 따르면, 자산의 진부화 및 시장가치의\n급격한 하락 등으로 인하여 자산의 회수가능가액이 장부금액에 중요하게 미달되는 경우\n에는 장부금액을 회수가능액으로 조정하고, 그 차액을 손상차손으로 처리하도록 규정\n하고 있음\n한국공인회계사회는 지분법을 적용 및 연결재무제표를 작성함에 있어 종속기업 재무\n제표의 신뢰성을 검토하고 회계정책을 일치하도록 조정한 후 이를 사용하여야 하며,\n종속기업의 손상징후가 존재하는 경우에는 회수가능가액을 합리적으로 추정하여 손상\n차손을 인식하고, 종속기업 채권에 대하여 대손충당금을 설정한 경우에는 인식된 대손\n상각비를 지분법적용투자주식과 지분법이익에 반영함으로써, 지배기업 개별재무제표의\n당기순손익 및 순자산이 연결재무제표의 당기순손익 및 순자산에 대한 지배기업의\n지분과 일치하게 회계처리를 해야한다고 판단함\n\n감사절차 미흡사항:\n동 지적사례는 재무제표에 대한 심사로 종결되어 감사보고서 감리는 실시하지 아니함\n\n시사점:\n회사는 개별재무제표에서 지분법 적용 및 연결재무제표 작성 시, 종속기업 재무제표의\n신뢰성 검토와 회계정책 일치 여부를 철저히 확인하여야 하며, 회계정책 일치를 위한\n조정 분개, 연결조정분개 등 지분법 적용과 연결재무제표 작성과정에서 발생할 수\n있는 오류를 방지하기 위해 지분법 및 연결 히스토리를 체계적으로 관리하여야 함\n- 25 -"
    },
    {
      "paragraph_id": "KICPA-2025-16",
      "case_id": "KICPA-2025-16",
      "case_title": "지분법 적용 오류(지분법 계산)",
      "metadata": {
        "decision_year": "2025",
        "accounting_period": "’23.1.1.∼’23.12.31.\n1. 회사의 회계처리\n회사가 종속기업으로부터 다른 종속기업의 주식을 양수하는 동일지배거래에서 인수대상 주식을\n연결장부금액으로 인식하고 취득원가와 거래가격의 차이를 거래상대방인 종속기업의 지분법\n적용투자주식 장부금액에서 가감하여야 함에도 이를 자본잉여금으로 회계처리하였고,\n종속기업에게 다른 종속기업의 지분을 양도하는 동일지배거래에서도 장부금액과 거래\n가격의 차이를 거래상대방인 종속기업의 지분법적용투자주식 장부금액에서 가감하여야\n함에도 이를 자본잉여금으로 회계처리하였으며, 지분법적용 시 해외종속기업의 결산\n지연을 이유로 당기 재무제표가 아닌 전기 재무제표를 사용하고, 내부거래미실현손익을\n제거하지 않는 등의 지분법 회계처리 오류가 발생함\n2. 회계기준 위반 지적 내용\n회사는 동일지배거래 시 인수대상 주식 또는 사업의 자산·부채에 대하여 연결장부금액\n으로 인식하고, 인수(인도)대상 주식 또는 사업의 연결장부금액과 그 대가로 지급\n(수령)한 금액의 차이는 거래 상대방인 종속기업에 대한 투자주식에 가감하여야 함에도\n이를 자본잉여금으로 잘못 회계처리하였으며, 지분법적용 시 투자기업의 보고기간\n종료일을 기준으로 작성된 종속기업의 신뢰성 있는 재무제표를 사용하여야 하고, 내부\n거래미실현손익은 지분법적용투자주식에서 가감하여야 함에도, 이를 잘못 회계처리\n하여 결과적으로 지분법적용투자주식 및 자기자본을 과소계상하고, 자본항목간 계정\n재분류 오류가 발생함\n3. 지적 근거 및 판단 내용\n일반기업회계기준 제8장(지분법) 문단 8.20 및 8.21에 따르면, 지분법은 투자기업의\n보고기간종료일을 기준으로 작성된 관계기업의 신뢰성 있는 재무제표를 사용하여야 하며,\n투자기업 및 관계기업의 거래에서 발생한 미실현손익은 지분법적용투자주식에서 가감\n하여야 하고,\n- 26 -\n일반기업회계기준 제32장(동일지배거래) 문단 32.11 및 32.12에 따르면, 동일지배거래 시\n인수자는 인수대상 주식에 대하여 연결장부금액으로 인식하고, 거래 참여자가 지배\n기업인 경우에 인수(인도)대상 주식의 연결장부금액과 그 대가로 지급(수령)한 금액의\n차이는 거래 상대방인 종속기업에 대한 투자주식에 가감하도록 규정하고 있음\n한국공인회계사회는 상기 회계기준 등을 고려하여, 회사가 종속기업과 지분 거래 시\n인수대상 주식을 연결장부금액이 아닌 잘못된 금액으로 인식하고 인수(인도)대상 주식의\n장부금액과 거래가격의 차이를 지분법적용투자주식에 가감하지 아니하고 자본잉여금으로\n잘못 회계처리하였으며, 지분법적용 시 종속기업의 당기재무제표가 아닌 전기재무제표를\n기준으로 지분법을 적용하고 내부거래미실현손익 제거하지 아니하는 등 지분법적용\n투자주식을 잘못 평가하였다고 판단함\n4. 감사절차 미흡사항\n동 지적사례는 재무제표에 대한 심사로 종결되어 감사보고서 감리는 실시하지 아니함\n5. 시사점\n동일지배하에 있는 기업간 거래에서 인수대상 주식은 주식의 연결장부금액으로 인식\n하고, 거래 참여자가 지배기업인 경우에 인수(인도)대상 주식의 연결장부금액과 그\n대가로 지급(수령)한 금액의 차이는 거래 상대방인 종속기업에 대한 투자주식에 가감\n할 수 있도록 회계처리기준을 면밀히 검토하여야 함",
        "issue_fields": [
          "지분법적용투자주식, 동일지배거래"
        ],
        "related_standards": [
          "일반기업회계기준 제8장(지분법)",
          "제32장(동일지배거래)"
        ],
        "case_type": "회계감리지적사례",
        "source": "KICPA 심사·감리 지적사례"
      },
      "content": {
        "section_1_company_accounting": {
          "section_title": "회사의 회계처리",
          "content": "회사가 종속기업으로부터 다른 종속기업의 주식을 양수하는 동일지배거래에서 인수대상 주식을\n연결장부금액으로 인식하고 취득원가와 거래가격의 차이를 거래상대방인 종속기업의 지분법\n적용투자주식 장부금액에서 가감하여야 함에도 이를 자본잉여금으로 회계처리하였고,\n종속기업에게 다른 종속기업의 지분을 양도하는 동일지배거래에서도 장부금액과 거래\n가격의 차이를 거래상대방인 종속기업의 지분법적용투자주식 장부금액에서 가감하여야\n함에도 이를 자본잉여금으로 회계처리하였으며, 지분법적용 시 해외종속기업의 결산\n지연을 이유로 당기 재무제표가 아닌 전기 재무제표를 사용하고, 내부거래미실현손익을\n제거하지 않는 등의 지분법 회계처리 오류가 발생함"
        },
        "section_2_violation_details": {
          "section_title": "회계기준 위반 지적 내용",
          "content": "회사는 동일지배거래 시 인수대상 주식 또는 사업의 자산·부채에 대하여 연결장부금액\n으로 인식하고, 인수(인도)대상 주식 또는 사업의 연결장부금액과 그 대가로 지급\n(수령)한 금액의 차이는 거래 상대방인 종속기업에 대한 투자주식에 가감하여야 함에도\n이를 자본잉여금으로 잘못 회계처리하였으며, 지분법적용 시 투자기업의 보고기간\n종료일을 기준으로 작성된 종속기업의 신뢰성 있는 재무제표를 사용하여야 하고, 내부\n거래미실현손익은 지분법적용투자주식에서 가감하여야 함에도, 이를 잘못 회계처리\n하여 결과적으로 지분법적용투자주식 및 자기자본을 과소계상하고, 자본항목간 계정\n재분류 오류가 발생함"
        },
        "section_3_basis_judgment": {
          "section_title": "지적 근거 및 판단 내용",
          "content": "일반기업회계기준 제8장(지분법) 문단 8.20 및 8.21에 따르면, 지분법은 투자기업의\n보고기간종료일을 기준으로 작성된 관계기업의 신뢰성 있는 재무제표를 사용하여야 하며,\n투자기업 및 관계기업의 거래에서 발생한 미실현손익은 지분법적용투자주식에서 가감\n하여야 하고,\n- 26 -\n일반기업회계기준 제32장(동일지배거래) 문단 32.11 및 32.12에 따르면, 동일지배거래 시\n인수자는 인수대상 주식에 대하여 연결장부금액으로 인식하고, 거래 참여자가 지배\n기업인 경우에 인수(인도)대상 주식의 연결장부금액과 그 대가로 지급(수령)한 금액의\n차이는 거래 상대방인 종속기업에 대한 투자주식에 가감하도록 규정하고 있음\n한국공인회계사회는 상기 회계기준 등을 고려하여, 회사가 종속기업과 지분 거래 시\n인수대상 주식을 연결장부금액이 아닌 잘못된 금액으로 인식하고 인수(인도)대상 주식의\n장부금액과 거래가격의 차이를 지분법적용투자주식에 가감하지 아니하고 자본잉여금으로\n잘못 회계처리하였으며, 지분법적용 시 종속기업의 당기재무제표가 아닌 전기재무제표를\n기준으로 지분법을 적용하고 내부거래미실현손익 제거하지 아니하는 등 지분법적용\n투자주식을 잘못 평가하였다고 판단함"
        },
        "section_4_audit_procedure": {
          "section_title": "감사절차 미흡사항",
          "content": "동 지적사례는 재무제표에 대한 심사로 종결되어 감사보고서 감리는 실시하지 아니함"
        },
        "section_5_implications": {
          "section_title": "시사점",
          "content": "동일지배하에 있는 기업간 거래에서 인수대상 주식은 주식의 연결장부금액으로 인식\n하고, 거래 참여자가 지배기업인 경우에 인수(인도)대상 주식의 연결장부금액과 그\n대가로 지급(수령)한 금액의 차이는 거래 상대방인 종속기업에 대한 투자주식에 가감\n할 수 있도록 회계처리기준을 면밀히 검토하여야 함"
        }
      },
      "indexed_content": "케이스 ID: KICPA-2025-16\n제목: 지분법 적용 오류(지분법 계산)\n결정연도: 2025년\n회계결산일: ’23.1.1.∼’23.12.31.\n1. 회사의 회계처리\n회사가 종속기업으로부터 다른 종속기업의 주식을 양수하는 동일지배거래에서 인수대상 주식을\n연결장부금액으로 인식하고 취득원가와 거래가격의 차이를 거래상대방인 종속기업의 지분법\n적용투자주식 장부금액에서 가감하여야 함에도 이를 자본잉여금으로 회계처리하였고,\n종속기업에게 다른 종속기업의 지분을 양도하는 동일지배거래에서도 장부금액과 거래\n가격의 차이를 거래상대방인 종속기업의 지분법적용투자주식 장부금액에서 가감하여야\n함에도 이를 자본잉여금으로 회계처리하였으며, 지분법적용 시 해외종속기업의 결산\n지연을 이유로 당기 재무제표가 아닌 전기 재무제표를 사용하고, 내부거래미실현손익을\n제거하지 않는 등의 지분법 회계처리 오류가 발생함\n2. 회계기준 위반 지적 내용\n회사는 동일지배거래 시 인수대상 주식 또는 사업의 자산·부채에 대하여 연결장부금액\n으로 인식하고, 인수(인도)대상 주식 또는 사업의 연결장부금액과 그 대가로 지급\n(수령)한 금액의 차이는 거래 상대방인 종속기업에 대한 투자주식에 가감하여야 함에도\n이를 자본잉여금으로 잘못 회계처리하였으며, 지분법적용 시 투자기업의 보고기간\n종료일을 기준으로 작성된 종속기업의 신뢰성 있는 재무제표를 사용하여야 하고, 내부\n거래미실현손익은 지분법적용투자주식에서 가감하여야 함에도, 이를 잘못 회계처리\n하여 결과적으로 지분법적용투자주식 및 자기자본을 과소계상하고, 자본항목간 계정\n재분류 오류가 발생함\n3. 지적 근거 및 판단 내용\n일반기업회계기준 제8장(지분법) 문단 8.20 및 8.21에 따르면, 지분법은 투자기업의\n보고기간종료일을 기준으로 작성된 관계기업의 신뢰성 있는 재무제표를 사용하여야 하며,\n투자기업 및 관계기업의 거래에서 발생한 미실현손익은 지분법적용투자주식에서 가감\n하여야 하고,\n- 26 -\n일반기업회계기준 제32장(동일지배거래) 문단 32.11 및 32.12에 따르면, 동일지배거래 시\n인수자는 인수대상 주식에 대하여 연결장부금액으로 인식하고, 거래 참여자가 지배\n기업인 경우에 인수(인도)대상 주식의 연결장부금액과 그 대가로 지급(수령)한 금액의\n차이는 거래 상대방인 종속기업에 대한 투자주식에 가감하도록 규정하고 있음\n한국공인회계사회는 상기 회계기준 등을 고려하여, 회사가 종속기업과 지분 거래 시\n인수대상 주식을 연결장부금액이 아닌 잘못된 금액으로 인식하고 인수(인도)대상 주식의\n장부금액과 거래가격의 차이를 지분법적용투자주식에 가감하지 아니하고 자본잉여금으로\n잘못 회계처리하였으며, 지분법적용 시 종속기업의 당기재무제표가 아닌 전기재무제표를\n기준으로 지분법을 적용하고 내부거래미실현손익 제거하지 아니하는 등 지분법적용\n투자주식을 잘못 평가하였다고 판단함\n4. 감사절차 미흡사항\n동 지적사례는 재무제표에 대한 심사로 종결되어 감사보고서 감리는 실시하지 아니함\n5. 시사점\n동일지배하에 있는 기업간 거래에서 인수대상 주식은 주식의 연결장부금액으로 인식\n하고, 거래 참여자가 지배기업인 경우에 인수(인도)대상 주식의 연결장부금액과 그\n대가로 지급(수령)한 금액의 차이는 거래 상대방인 종속기업에 대한 투자주식에 가감\n할 수 있도록 회계처리기준을 면밀히 검토하여야 함\n쟁점분야: 지분법적용투자주식, 동일지배거래\n관련기준: 일반기업회계기준 제8장(지분법), 제32장(동일지배거래)\n\n회사의 회계처리:\n회사가 종속기업으로부터 다른 종속기업의 주식을 양수하는 동일지배거래에서 인수대상 주식을\n연결장부금액으로 인식하고 취득원가와 거래가격의 차이를 거래상대방인 종속기업의 지분법\n적용투자주식 장부금액에서 가감하여야 함에도 이를 자본잉여금으로 회계처리하였고,\n종속기업에게 다른 종속기업의 지분을 양도하는 동일지배거래에서도 장부금액과 거래\n가격의 차이를 거래상대방인 종속기업의 지분법적용투자주식 장부금액에서 가감하여야\n함에도 이를 자본잉여금으로 회계처리하였으며, 지분법적용 시 해외종속기업의 결산\n지연을 이유로 당기 재무제표가 아닌 전기 재무제표를 사용하고, 내부거래미실현손익을\n제거하지 않는 등의 지분법 회계처리 오류가 발생함\n\n회계기준 위반 지적 내용:\n회사는 동일지배거래 시 인수대상 주식 또는 사업의 자산·부채에 대하여 연결장부금액\n으로 인식하고, 인수(인도)대상 주식 또는 사업의 연결장부금액과 그 대가로 지급\n(수령)한 금액의 차이는 거래 상대방인 종속기업에 대한 투자주식에 가감하여야 함에도\n이를 자본잉여금으로 잘못 회계처리하였으며, 지분법적용 시 투자기업의 보고기간\n종료일을 기준으로 작성된 종속기업의 신뢰성 있는 재무제표를 사용하여야 하고, 내부\n거래미실현손익은 지분법적용투자주식에서 가감하여야 함에도, 이를 잘못 회계처리\n하여 결과적으로 지분법적용투자주식 및 자기자본을 과소계상하고, 자본항목간 계정\n재분류 오류가 발생함\n\n지적 근거 및 판단 내용:\n일반기업회계기준 제8장(지분법) 문단 8.20 및 8.21에 따르면, 지분법은 투자기업의\n보고기간종료일을 기준으로 작성된 관계기업의 신뢰성 있는 재무제표를 사용하여야 하며,\n투자기업 및 관계기업의 거래에서 발생한 미실현손익은 지분법적용투자주식에서 가감\n하여야 하고,\n- 26 -\n일반기업회계기준 제32장(동일지배거래) 문단 32.11 및 32.12에 따르면, 동일지배거래 시\n인수자는 인수대상 주식에 대하여 연결장부금액으로 인식하고, 거래 참여자가 지배\n기업인 경우에 인수(인도)대상 주식의 연결장부금액과 그 대가로 지급(수령)한 금액의\n차이는 거래 상대방인 종속기업에 대한 투자주식에 가감하도록 규정하고 있음\n한국공인회계사회는 상기 회계기준 등을 고려하여, 회사가 종속기업과 지분 거래 시\n인수대상 주식을 연결장부금액이 아닌 잘못된 금액으로 인식하고 인수(인도)대상 주식의\n장부금액과 거래가격의 차이를 지분법적용투자주식에 가감하지 아니하고 자본잉여금으로\n잘못 회계처리하였으며, 지분법적용 시 종속기업의 당기재무제표가 아닌 전기재무제표를\n기준으로 지분법을 적용하고 내부거래미실현손익 제거하지 아니하는 등 지분법적용\n투자주식을 잘못 평가하였다고 판단함\n\n감사절차 미흡사항:\n동 지적사례는 재무제표에 대한 심사로 종결되어 감사보고서 감리는 실시하지 아니함\n\n시사점:\n동일지배하에 있는 기업간 거래에서 인수대상 주식은 주식의 연결장부금액으로 인식\n하고, 거래 참여자가 지배기업인 경우에 인수(인도)대상 주식의 연결장부금액과 그\n대가로 지급(수령)한 금액의 차이는 거래 상대방인 종속기업에 대한 투자주식에 가감\n할 수 있도록 회계처리기준을 면밀히 검토하여야 함"
    },
    {
      "paragraph_id": "KICPA-2025-17",
      "case_id": "KICPA-2025-17",
      "case_title": "지분법 적용 오류(지분법 계산)",
      "metadata": {
        "decision_year": "2025",
        "accounting_period": "’22.1.1.∼’23.12.31.\n1. 회사의 회계처리\n회사는 전자부품 제조 및 판매를 주요 영업으로 하고 있으며, 베트남 등 해외에 여러\n생산 공장을 설립하여 운영하고 있음. 회사는 개별재무제표상 중소기업 회계처리 특례를\n- 27 -\n적용하여 종속기업 투자주식을 매도가능증권으로 분류하고 취득원가로 평가하였다가\n‘22년 결산시부터 중소기업 회계처리 특례를 적용하지 않는 것으로 결정하여 이를\n지분법적용투자주식으로 변경하고 지분법 회계처리를 적용함\n다만, 베트남 소재 종속기업은 ‘17년말 기준 자산 70억원 이상, 부채 70억원 이상으로\n(舊)외감법상 외부감사대상 규모기준을 충족되어 ‘18년부터 연결대상 종속기업에 해당\n하여 중소기업 회계처리 특례를 적용할 수 없고, 지분법을 적용해야 함에도 이를 인지\n하지 못하여 ‘21년까지 해당 투자지분을 취득원가로 평가하였으며,\n‘22년 결산시부터 모든 종속기업투자주식에 대해 지분법 회계처리를 최초 적용하면서\n기존 매도가능증권 장부금액(취득원가)을 지분법적용투자주식으로 대체하는 방식으로\n회계처리함. 또한, 지분법 평가를 위해 해외 종속기업 재무제표를 원화로 환산하는\n과정에서의 환율 적용 및 미실현손익 계산 등에 오류가 발생하였음\n2. 회계기준 위반 지적 내용\n종속기업이 ‘18년부터 외부감사 대상 규모 이상으로 연결대상 종속기업으로 편입된\n바, 동 종속기업투자주식을 지분법적용투자주식으로 분류하고 지분법을 적용하였어야\n함에도 이를 ’21년까지 매도가능증권으로 잘못 분류하고 취득원가로 평가하였으며,\n‘22년 결산시 모든 종속기업투자주식에 대해 지분법 회계처리를 최초 적용하면서 이전에\n보유하고 있던 투자지분을 취득일의 공정가치로 재측정하지 아니한 채 매도가능증권\n장부금액(취득원가)을 지분법적용투자주식으로 대체하였고, 해외 종속기업 재무제표\n환산시 환율을 잘못 적용하는 등 지분법 회계처리를 잘못하여 지분법적용투자주식 및\n매도가능증권처분이익 등을 과소계상하고, 지분법이익 및 기타포괄손익누계액 등을\n과소(과대)계상함\n3. 지적 근거 및 판단 내용\n일반기업회계기준 제4장(연결재무제표) 문단 4.18에 따르면 지배기업이 개별재무제표를\n작성할 때, 종속기업에 대한 투자자산은 지분법에 따라 회계처리하도록 하고 있으며, 일반\n기업회계기준 제8장(지분법) 문단 8.35에 따르면 종속기업에 속하지 아니하던 피투자\n기업(관계기업 포함)이 투자기업의 지분 추가취득 등으로 인해 종속기업으로 되는 경우\n제12장 ‘사업결합’에 따라 투자차액을 산정하여 지분법을 적용하도록 규정하고 있고,\n일반기업회계기준 제23장(환율변동효과) 문단 23.14 및 23.15에 따르면 해외사업을 연결\n또는 지분법을 적용하여 보고기업의 재무제표에 포함되도록 하기 위하여 해외사업장의\n경영성과와 재무상태를 표시통화로 환산하는 경우에는 (1) (자산과 부채) 보고기간말의\n마감환율이나 (2) (수익과 비용) 거래일의 환율 또는 평균환율로 환산하고, (1)과 (2)의\n환산에서 생기는 외환차이는 기타포괄손익으로 인식하도록 규정하고 있음\n- 28 -\n한국공인회계사회는 상기 회계기준 등을 고려하여, 종속기업이 해외에 소재하더라도,\n국내종속기업에 대한 규모기준을 준용하여 외감규모 이상일 경우 지분법을 적용하여야\n하고, 종속기업에 속하지 아니하던 피투자기업이 종속기업이 되는 경우 사업결합에 따른\n회계처리를 최초로 수행(기존에 이미 지분법을 적용한 경우 제외)하여야 함에도 주식의\n최초 취득원가를 지분법적용투자주식으로 대체하였고, 종속기업 재무제표 환산 및 지분법\n평가 과정에서도 다수의 오류가 발생하여 지분법용투자주식 등이 과소(과대) 계상되었\n다고 판단함\n4. 감사절차 미흡사항\n동 지적사례는 재무제표에 대한 심사로 종결되어 감사보고서 감리는 실시하지 아니함\n5. 시사점\n회사는 지분법 및 연결재무제표 관련 기준서를 숙지하고, 매 결산시 피투자회사의 지분율\n변동 및 자산·부채 규모 등을 종합적으로 검토하여 해당 기업이 지분법 또는 연결범위에\n포함되는지 면밀히 검토해야 함. 또한 해외사업장이나 외화기능통화를 사용하는 피투자\n회사의 재무정보를 반영할 때는 관련 기준서 등에서 정한 적정 환율을 적용하여 환산\n하고, 세부 지분법 회계처리도 적절히 이루어질 수 있도록 주의를 기울일 필요가 있음",
        "issue_fields": [
          "지분법적용투자주식"
        ],
        "related_standards": [
          "일반기업회계기준 제4장(연결재무제표)",
          "제8장(지분법)",
          "제23장(환율변동\n효과)"
        ],
        "case_type": "회계감리지적사례",
        "source": "KICPA 심사·감리 지적사례"
      },
      "content": {
        "section_1_company_accounting": {
          "section_title": "회사의 회계처리",
          "content": "회사는 전자부품 제조 및 판매를 주요 영업으로 하고 있으며, 베트남 등 해외에 여러\n생산 공장을 설립하여 운영하고 있음. 회사는 개별재무제표상 중소기업 회계처리 특례를\n- 27 -\n적용하여 종속기업 투자주식을 매도가능증권으로 분류하고 취득원가로 평가하였다가\n‘22년 결산시부터 중소기업 회계처리 특례를 적용하지 않는 것으로 결정하여 이를\n지분법적용투자주식으로 변경하고 지분법 회계처리를 적용함\n다만, 베트남 소재 종속기업은 ‘17년말 기준 자산 70억원 이상, 부채 70억원 이상으로\n(舊)외감법상 외부감사대상 규모기준을 충족되어 ‘18년부터 연결대상 종속기업에 해당\n하여 중소기업 회계처리 특례를 적용할 수 없고, 지분법을 적용해야 함에도 이를 인지\n하지 못하여 ‘21년까지 해당 투자지분을 취득원가로 평가하였으며,\n‘22년 결산시부터 모든 종속기업투자주식에 대해 지분법 회계처리를 최초 적용하면서\n기존 매도가능증권 장부금액(취득원가)을 지분법적용투자주식으로 대체하는 방식으로\n회계처리함. 또한, 지분법 평가를 위해 해외 종속기업 재무제표를 원화로 환산하는\n과정에서의 환율 적용 및 미실현손익 계산 등에 오류가 발생하였음"
        },
        "section_2_violation_details": {
          "section_title": "회계기준 위반 지적 내용",
          "content": "종속기업이 ‘18년부터 외부감사 대상 규모 이상으로 연결대상 종속기업으로 편입된\n바, 동 종속기업투자주식을 지분법적용투자주식으로 분류하고 지분법을 적용하였어야\n함에도 이를 ’21년까지 매도가능증권으로 잘못 분류하고 취득원가로 평가하였으며,\n‘22년 결산시 모든 종속기업투자주식에 대해 지분법 회계처리를 최초 적용하면서 이전에\n보유하고 있던 투자지분을 취득일의 공정가치로 재측정하지 아니한 채 매도가능증권\n장부금액(취득원가)을 지분법적용투자주식으로 대체하였고, 해외 종속기업 재무제표\n환산시 환율을 잘못 적용하는 등 지분법 회계처리를 잘못하여 지분법적용투자주식 및\n매도가능증권처분이익 등을 과소계상하고, 지분법이익 및 기타포괄손익누계액 등을\n과소(과대)계상함"
        },
        "section_3_basis_judgment": {
          "section_title": "지적 근거 및 판단 내용",
          "content": "일반기업회계기준 제4장(연결재무제표) 문단 4.18에 따르면 지배기업이 개별재무제표를\n작성할 때, 종속기업에 대한 투자자산은 지분법에 따라 회계처리하도록 하고 있으며, 일반\n기업회계기준 제8장(지분법) 문단 8.35에 따르면 종속기업에 속하지 아니하던 피투자\n기업(관계기업 포함)이 투자기업의 지분 추가취득 등으로 인해 종속기업으로 되는 경우\n제12장 ‘사업결합’에 따라 투자차액을 산정하여 지분법을 적용하도록 규정하고 있고,\n일반기업회계기준 제23장(환율변동효과) 문단 23.14 및 23.15에 따르면 해외사업을 연결\n또는 지분법을 적용하여 보고기업의 재무제표에 포함되도록 하기 위하여 해외사업장의\n경영성과와 재무상태를 표시통화로 환산하는 경우에는 (1) (자산과 부채) 보고기간말의\n마감환율이나 (2) (수익과 비용) 거래일의 환율 또는 평균환율로 환산하고, (1)과 (2)의\n환산에서 생기는 외환차이는 기타포괄손익으로 인식하도록 규정하고 있음\n- 28 -\n한국공인회계사회는 상기 회계기준 등을 고려하여, 종속기업이 해외에 소재하더라도,\n국내종속기업에 대한 규모기준을 준용하여 외감규모 이상일 경우 지분법을 적용하여야\n하고, 종속기업에 속하지 아니하던 피투자기업이 종속기업이 되는 경우 사업결합에 따른\n회계처리를 최초로 수행(기존에 이미 지분법을 적용한 경우 제외)하여야 함에도 주식의\n최초 취득원가를 지분법적용투자주식으로 대체하였고, 종속기업 재무제표 환산 및 지분법\n평가 과정에서도 다수의 오류가 발생하여 지분법용투자주식 등이 과소(과대) 계상되었\n다고 판단함"
        },
        "section_4_audit_procedure": {
          "section_title": "감사절차 미흡사항",
          "content": "동 지적사례는 재무제표에 대한 심사로 종결되어 감사보고서 감리는 실시하지 아니함"
        },
        "section_5_implications": {
          "section_title": "시사점",
          "content": "회사는 지분법 및 연결재무제표 관련 기준서를 숙지하고, 매 결산시 피투자회사의 지분율\n변동 및 자산·부채 규모 등을 종합적으로 검토하여 해당 기업이 지분법 또는 연결범위에\n포함되는지 면밀히 검토해야 함. 또한 해외사업장이나 외화기능통화를 사용하는 피투자\n회사의 재무정보를 반영할 때는 관련 기준서 등에서 정한 적정 환율을 적용하여 환산\n하고, 세부 지분법 회계처리도 적절히 이루어질 수 있도록 주의를 기울일 필요가 있음"
        }
      },
      "indexed_content": "케이스 ID: KICPA-2025-17\n제목: 지분법 적용 오류(지분법 계산)\n결정연도: 2025년\n회계결산일: ’22.1.1.∼’23.12.31.\n1. 회사의 회계처리\n회사는 전자부품 제조 및 판매를 주요 영업으로 하고 있으며, 베트남 등 해외에 여러\n생산 공장을 설립하여 운영하고 있음. 회사는 개별재무제표상 중소기업 회계처리 특례를\n- 27 -\n적용하여 종속기업 투자주식을 매도가능증권으로 분류하고 취득원가로 평가하였다가\n‘22년 결산시부터 중소기업 회계처리 특례를 적용하지 않는 것으로 결정하여 이를\n지분법적용투자주식으로 변경하고 지분법 회계처리를 적용함\n다만, 베트남 소재 종속기업은 ‘17년말 기준 자산 70억원 이상, 부채 70억원 이상으로\n(舊)외감법상 외부감사대상 규모기준을 충족되어 ‘18년부터 연결대상 종속기업에 해당\n하여 중소기업 회계처리 특례를 적용할 수 없고, 지분법을 적용해야 함에도 이를 인지\n하지 못하여 ‘21년까지 해당 투자지분을 취득원가로 평가하였으며,\n‘22년 결산시부터 모든 종속기업투자주식에 대해 지분법 회계처리를 최초 적용하면서\n기존 매도가능증권 장부금액(취득원가)을 지분법적용투자주식으로 대체하는 방식으로\n회계처리함. 또한, 지분법 평가를 위해 해외 종속기업 재무제표를 원화로 환산하는\n과정에서의 환율 적용 및 미실현손익 계산 등에 오류가 발생하였음\n2. 회계기준 위반 지적 내용\n종속기업이 ‘18년부터 외부감사 대상 규모 이상으로 연결대상 종속기업으로 편입된\n바, 동 종속기업투자주식을 지분법적용투자주식으로 분류하고 지분법을 적용하였어야\n함에도 이를 ’21년까지 매도가능증권으로 잘못 분류하고 취득원가로 평가하였으며,\n‘22년 결산시 모든 종속기업투자주식에 대해 지분법 회계처리를 최초 적용하면서 이전에\n보유하고 있던 투자지분을 취득일의 공정가치로 재측정하지 아니한 채 매도가능증권\n장부금액(취득원가)을 지분법적용투자주식으로 대체하였고, 해외 종속기업 재무제표\n환산시 환율을 잘못 적용하는 등 지분법 회계처리를 잘못하여 지분법적용투자주식 및\n매도가능증권처분이익 등을 과소계상하고, 지분법이익 및 기타포괄손익누계액 등을\n과소(과대)계상함\n3. 지적 근거 및 판단 내용\n일반기업회계기준 제4장(연결재무제표) 문단 4.18에 따르면 지배기업이 개별재무제표를\n작성할 때, 종속기업에 대한 투자자산은 지분법에 따라 회계처리하도록 하고 있으며, 일반\n기업회계기준 제8장(지분법) 문단 8.35에 따르면 종속기업에 속하지 아니하던 피투자\n기업(관계기업 포함)이 투자기업의 지분 추가취득 등으로 인해 종속기업으로 되는 경우\n제12장 ‘사업결합’에 따라 투자차액을 산정하여 지분법을 적용하도록 규정하고 있고,\n일반기업회계기준 제23장(환율변동효과) 문단 23.14 및 23.15에 따르면 해외사업을 연결\n또는 지분법을 적용하여 보고기업의 재무제표에 포함되도록 하기 위하여 해외사업장의\n경영성과와 재무상태를 표시통화로 환산하는 경우에는 (1) (자산과 부채) 보고기간말의\n마감환율이나 (2) (수익과 비용) 거래일의 환율 또는 평균환율로 환산하고, (1)과 (2)의\n환산에서 생기는 외환차이는 기타포괄손익으로 인식하도록 규정하고 있음\n- 28 -\n한국공인회계사회는 상기 회계기준 등을 고려하여, 종속기업이 해외에 소재하더라도,\n국내종속기업에 대한 규모기준을 준용하여 외감규모 이상일 경우 지분법을 적용하여야\n하고, 종속기업에 속하지 아니하던 피투자기업이 종속기업이 되는 경우 사업결합에 따른\n회계처리를 최초로 수행(기존에 이미 지분법을 적용한 경우 제외)하여야 함에도 주식의\n최초 취득원가를 지분법적용투자주식으로 대체하였고, 종속기업 재무제표 환산 및 지분법\n평가 과정에서도 다수의 오류가 발생하여 지분법용투자주식 등이 과소(과대) 계상되었\n다고 판단함\n4. 감사절차 미흡사항\n동 지적사례는 재무제표에 대한 심사로 종결되어 감사보고서 감리는 실시하지 아니함\n5. 시사점\n회사는 지분법 및 연결재무제표 관련 기준서를 숙지하고, 매 결산시 피투자회사의 지분율\n변동 및 자산·부채 규모 등을 종합적으로 검토하여 해당 기업이 지분법 또는 연결범위에\n포함되는지 면밀히 검토해야 함. 또한 해외사업장이나 외화기능통화를 사용하는 피투자\n회사의 재무정보를 반영할 때는 관련 기준서 등에서 정한 적정 환율을 적용하여 환산\n하고, 세부 지분법 회계처리도 적절히 이루어질 수 있도록 주의를 기울일 필요가 있음\n쟁점분야: 지분법적용투자주식\n관련기준: 일반기업회계기준 제4장(연결재무제표), 제8장(지분법), 제23장(환율변동\n효과)\n\n회사의 회계처리:\n회사는 전자부품 제조 및 판매를 주요 영업으로 하고 있으며, 베트남 등 해외에 여러\n생산 공장을 설립하여 운영하고 있음. 회사는 개별재무제표상 중소기업 회계처리 특례를\n- 27 -\n적용하여 종속기업 투자주식을 매도가능증권으로 분류하고 취득원가로 평가하였다가\n‘22년 결산시부터 중소기업 회계처리 특례를 적용하지 않는 것으로 결정하여 이를\n지분법적용투자주식으로 변경하고 지분법 회계처리를 적용함\n다만, 베트남 소재 종속기업은 ‘17년말 기준 자산 70억원 이상, 부채 70억원 이상으로\n(舊)외감법상 외부감사대상 규모기준을 충족되어 ‘18년부터 연결대상 종속기업에 해당\n하여 중소기업 회계처리 특례를 적용할 수 없고, 지분법을 적용해야 함에도 이를 인지\n하지 못하여 ‘21년까지 해당 투자지분을 취득원가로 평가하였으며,\n‘22년 결산시부터 모든 종속기업투자주식에 대해 지분법 회계처리를 최초 적용하면서\n기존 매도가능증권 장부금액(취득원가)을 지분법적용투자주식으로 대체하는 방식으로\n회계처리함. 또한, 지분법 평가를 위해 해외 종속기업 재무제표를 원화로 환산하는\n과정에서의 환율 적용 및 미실현손익 계산 등에 오류가 발생하였음\n\n회계기준 위반 지적 내용:\n종속기업이 ‘18년부터 외부감사 대상 규모 이상으로 연결대상 종속기업으로 편입된\n바, 동 종속기업투자주식을 지분법적용투자주식으로 분류하고 지분법을 적용하였어야\n함에도 이를 ’21년까지 매도가능증권으로 잘못 분류하고 취득원가로 평가하였으며,\n‘22년 결산시 모든 종속기업투자주식에 대해 지분법 회계처리를 최초 적용하면서 이전에\n보유하고 있던 투자지분을 취득일의 공정가치로 재측정하지 아니한 채 매도가능증권\n장부금액(취득원가)을 지분법적용투자주식으로 대체하였고, 해외 종속기업 재무제표\n환산시 환율을 잘못 적용하는 등 지분법 회계처리를 잘못하여 지분법적용투자주식 및\n매도가능증권처분이익 등을 과소계상하고, 지분법이익 및 기타포괄손익누계액 등을\n과소(과대)계상함\n\n지적 근거 및 판단 내용:\n일반기업회계기준 제4장(연결재무제표) 문단 4.18에 따르면 지배기업이 개별재무제표를\n작성할 때, 종속기업에 대한 투자자산은 지분법에 따라 회계처리하도록 하고 있으며, 일반\n기업회계기준 제8장(지분법) 문단 8.35에 따르면 종속기업에 속하지 아니하던 피투자\n기업(관계기업 포함)이 투자기업의 지분 추가취득 등으로 인해 종속기업으로 되는 경우\n제12장 ‘사업결합’에 따라 투자차액을 산정하여 지분법을 적용하도록 규정하고 있고,\n일반기업회계기준 제23장(환율변동효과) 문단 23.14 및 23.15에 따르면 해외사업을 연결\n또는 지분법을 적용하여 보고기업의 재무제표에 포함되도록 하기 위하여 해외사업장의\n경영성과와 재무상태를 표시통화로 환산하는 경우에는 (1) (자산과 부채) 보고기간말의\n마감환율이나 (2) (수익과 비용) 거래일의 환율 또는 평균환율로 환산하고, (1)과 (2)의\n환산에서 생기는 외환차이는 기타포괄손익으로 인식하도록 규정하고 있음\n- 28 -\n한국공인회계사회는 상기 회계기준 등을 고려하여, 종속기업이 해외에 소재하더라도,\n국내종속기업에 대한 규모기준을 준용하여 외감규모 이상일 경우 지분법을 적용하여야\n하고, 종속기업에 속하지 아니하던 피투자기업이 종속기업이 되는 경우 사업결합에 따른\n회계처리를 최초로 수행(기존에 이미 지분법을 적용한 경우 제외)하여야 함에도 주식의\n최초 취득원가를 지분법적용투자주식으로 대체하였고, 종속기업 재무제표 환산 및 지분법\n평가 과정에서도 다수의 오류가 발생하여 지분법용투자주식 등이 과소(과대) 계상되었\n다고 판단함\n\n감사절차 미흡사항:\n동 지적사례는 재무제표에 대한 심사로 종결되어 감사보고서 감리는 실시하지 아니함\n\n시사점:\n회사는 지분법 및 연결재무제표 관련 기준서를 숙지하고, 매 결산시 피투자회사의 지분율\n변동 및 자산·부채 규모 등을 종합적으로 검토하여 해당 기업이 지분법 또는 연결범위에\n포함되는지 면밀히 검토해야 함. 또한 해외사업장이나 외화기능통화를 사용하는 피투자\n회사의 재무정보를 반영할 때는 관련 기준서 등에서 정한 적정 환율을 적용하여 환산\n하고, 세부 지분법 회계처리도 적절히 이루어질 수 있도록 주의를 기울일 필요가 있음"
    },
    {
      "paragraph_id": "KICPA-2025-18",
      "case_id": "KICPA-2025-18",
      "case_title": "지분법 적용 오류(지분법 계산)",
      "metadata": {
        "decision_year": "2025",
        "accounting_period": "’23.1.1.∼’23.12.31.\n1. 회사의 회계처리\n회사는 국내 소재 관계기업 투자주식(지분율 30.1%)에 대해 지분법을 적용하고 있으며,\n관계기업이 부채비율 완화를 목적으로 ‘23년 결산시 토지 재평가를 실시하여 거액의\n재평가잉여금을 인식하였음. 한편, 회사는 결산 일정 등을 사유로 관계기업의 토지 재평가가\n반영되지 않은 가결산 재무제표를 기준으로 지분법을 적용함\n- 29 -\n2. 회계기준 위반 지적 내용\n관계기업 투자주식에 대한 지분법 평가시, 토지재평가 회계처리가 반영되지 않은 가결산\n재무제표를 사용함으로써 지분법적용투자주식 및 자기자본을 과소계상함\n3. 지적 근거 및 판단 내용\n일반기업회계기준 제8장(지분법) 문단 8.21 및 실 8.25에 따르면 지분법은 투자기업의\n보고기간종료일을 기준으로 작성된 관계기업의 신뢰성 있는 재무제표를 사용하여 적용\n하고, 관계기업의 가결산 재무제표를 이용하여 지분법을 적용할 경우에는 투자기업이\n인지하고 있는 유의적인 거래나 회계적 사건이 가결산 재무제표에 적절히 반영되었는지\n확인하기 위해 필요한 절차(신뢰성 검증)를 취하여 관계기업의 가결산 재무제표에 유의적인\n차이가 발견되는 경우 투자기업은 반드시 그 차이를 가결산 재무제표에 반영한 후\n이를 기준으로 지분법을 적용하도록 규정하고 있음\n한국공인회계사회는 상기 회계기준 등을 고려하여, 회사가 인지하고 있는 유의적인 회계적\n사건인 관계기업의 토지 재평가가 적절히 반영된 재무제표를 기준으로 지분법을 적용\n하지 아니하여 지분법적용투자주식 및 자기자본이 과소계상되었다고 판단함\n4. 감사절차 미흡사항\n동 지적사례는 재무제표에 대한 심사로 종결되어 감사보고서 감리는 실시하지 아니함\n5. 시사점\n회사는 지분법 관련 회계처리 기준서를 숙지하고, 관계기업의 가결산 재무제표를 이용\n하여 지분법을 적용할 경우 유의적인 거래나 회계적 사건이 가결산 재무제표에 적절히\n반영되었는지 확인하는 절차를 취하여야 하며, 유의적인 차이가 발견되는 경우 반드시\n그 차이를 가결산 재무제표에 반영한 후 이를 기준으로 지분법을 적용할 수 있도록\n주의를 기울여야 함\n- 30 -",
        "issue_fields": [
          "지분법적용투자주식"
        ],
        "related_standards": [
          "일반기업회계기준 제8장(지분법)"
        ],
        "case_type": "회계감리지적사례",
        "source": "KICPA 심사·감리 지적사례"
      },
      "content": {
        "section_1_company_accounting": {
          "section_title": "회사의 회계처리",
          "content": "회사는 국내 소재 관계기업 투자주식(지분율 30.1%)에 대해 지분법을 적용하고 있으며,\n관계기업이 부채비율 완화를 목적으로 ‘23년 결산시 토지 재평가를 실시하여 거액의\n재평가잉여금을 인식하였음. 한편, 회사는 결산 일정 등을 사유로 관계기업의 토지 재평가가\n반영되지 않은 가결산 재무제표를 기준으로 지분법을 적용함\n- 29 -"
        },
        "section_2_violation_details": {
          "section_title": "회계기준 위반 지적 내용",
          "content": "관계기업 투자주식에 대한 지분법 평가시, 토지재평가 회계처리가 반영되지 않은 가결산\n재무제표를 사용함으로써 지분법적용투자주식 및 자기자본을 과소계상함"
        },
        "section_3_basis_judgment": {
          "section_title": "지적 근거 및 판단 내용",
          "content": "일반기업회계기준 제8장(지분법) 문단 8.21 및 실 8.25에 따르면 지분법은 투자기업의\n보고기간종료일을 기준으로 작성된 관계기업의 신뢰성 있는 재무제표를 사용하여 적용\n하고, 관계기업의 가결산 재무제표를 이용하여 지분법을 적용할 경우에는 투자기업이\n인지하고 있는 유의적인 거래나 회계적 사건이 가결산 재무제표에 적절히 반영되었는지\n확인하기 위해 필요한 절차(신뢰성 검증)를 취하여 관계기업의 가결산 재무제표에 유의적인\n차이가 발견되는 경우 투자기업은 반드시 그 차이를 가결산 재무제표에 반영한 후\n이를 기준으로 지분법을 적용하도록 규정하고 있음\n한국공인회계사회는 상기 회계기준 등을 고려하여, 회사가 인지하고 있는 유의적인 회계적\n사건인 관계기업의 토지 재평가가 적절히 반영된 재무제표를 기준으로 지분법을 적용\n하지 아니하여 지분법적용투자주식 및 자기자본이 과소계상되었다고 판단함"
        },
        "section_4_audit_procedure": {
          "section_title": "감사절차 미흡사항",
          "content": "동 지적사례는 재무제표에 대한 심사로 종결되어 감사보고서 감리는 실시하지 아니함"
        },
        "section_5_implications": {
          "section_title": "시사점",
          "content": "회사는 지분법 관련 회계처리 기준서를 숙지하고, 관계기업의 가결산 재무제표를 이용\n하여 지분법을 적용할 경우 유의적인 거래나 회계적 사건이 가결산 재무제표에 적절히\n반영되었는지 확인하는 절차를 취하여야 하며, 유의적인 차이가 발견되는 경우 반드시\n그 차이를 가결산 재무제표에 반영한 후 이를 기준으로 지분법을 적용할 수 있도록\n주의를 기울여야 함\n- 30 -"
        }
      },
      "indexed_content": "케이스 ID: KICPA-2025-18\n제목: 지분법 적용 오류(지분법 계산)\n결정연도: 2025년\n회계결산일: ’23.1.1.∼’23.12.31.\n1. 회사의 회계처리\n회사는 국내 소재 관계기업 투자주식(지분율 30.1%)에 대해 지분법을 적용하고 있으며,\n관계기업이 부채비율 완화를 목적으로 ‘23년 결산시 토지 재평가를 실시하여 거액의\n재평가잉여금을 인식하였음. 한편, 회사는 결산 일정 등을 사유로 관계기업의 토지 재평가가\n반영되지 않은 가결산 재무제표를 기준으로 지분법을 적용함\n- 29 -\n2. 회계기준 위반 지적 내용\n관계기업 투자주식에 대한 지분법 평가시, 토지재평가 회계처리가 반영되지 않은 가결산\n재무제표를 사용함으로써 지분법적용투자주식 및 자기자본을 과소계상함\n3. 지적 근거 및 판단 내용\n일반기업회계기준 제8장(지분법) 문단 8.21 및 실 8.25에 따르면 지분법은 투자기업의\n보고기간종료일을 기준으로 작성된 관계기업의 신뢰성 있는 재무제표를 사용하여 적용\n하고, 관계기업의 가결산 재무제표를 이용하여 지분법을 적용할 경우에는 투자기업이\n인지하고 있는 유의적인 거래나 회계적 사건이 가결산 재무제표에 적절히 반영되었는지\n확인하기 위해 필요한 절차(신뢰성 검증)를 취하여 관계기업의 가결산 재무제표에 유의적인\n차이가 발견되는 경우 투자기업은 반드시 그 차이를 가결산 재무제표에 반영한 후\n이를 기준으로 지분법을 적용하도록 규정하고 있음\n한국공인회계사회는 상기 회계기준 등을 고려하여, 회사가 인지하고 있는 유의적인 회계적\n사건인 관계기업의 토지 재평가가 적절히 반영된 재무제표를 기준으로 지분법을 적용\n하지 아니하여 지분법적용투자주식 및 자기자본이 과소계상되었다고 판단함\n4. 감사절차 미흡사항\n동 지적사례는 재무제표에 대한 심사로 종결되어 감사보고서 감리는 실시하지 아니함\n5. 시사점\n회사는 지분법 관련 회계처리 기준서를 숙지하고, 관계기업의 가결산 재무제표를 이용\n하여 지분법을 적용할 경우 유의적인 거래나 회계적 사건이 가결산 재무제표에 적절히\n반영되었는지 확인하는 절차를 취하여야 하며, 유의적인 차이가 발견되는 경우 반드시\n그 차이를 가결산 재무제표에 반영한 후 이를 기준으로 지분법을 적용할 수 있도록\n주의를 기울여야 함\n- 30 -\n쟁점분야: 지분법적용투자주식\n관련기준: 일반기업회계기준 제8장(지분법)\n\n회사의 회계처리:\n회사는 국내 소재 관계기업 투자주식(지분율 30.1%)에 대해 지분법을 적용하고 있으며,\n관계기업이 부채비율 완화를 목적으로 ‘23년 결산시 토지 재평가를 실시하여 거액의\n재평가잉여금을 인식하였음. 한편, 회사는 결산 일정 등을 사유로 관계기업의 토지 재평가가\n반영되지 않은 가결산 재무제표를 기준으로 지분법을 적용함\n- 29 -\n\n회계기준 위반 지적 내용:\n관계기업 투자주식에 대한 지분법 평가시, 토지재평가 회계처리가 반영되지 않은 가결산\n재무제표를 사용함으로써 지분법적용투자주식 및 자기자본을 과소계상함\n\n지적 근거 및 판단 내용:\n일반기업회계기준 제8장(지분법) 문단 8.21 및 실 8.25에 따르면 지분법은 투자기업의\n보고기간종료일을 기준으로 작성된 관계기업의 신뢰성 있는 재무제표를 사용하여 적용\n하고, 관계기업의 가결산 재무제표를 이용하여 지분법을 적용할 경우에는 투자기업이\n인지하고 있는 유의적인 거래나 회계적 사건이 가결산 재무제표에 적절히 반영되었는지\n확인하기 위해 필요한 절차(신뢰성 검증)를 취하여 관계기업의 가결산 재무제표에 유의적인\n차이가 발견되는 경우 투자기업은 반드시 그 차이를 가결산 재무제표에 반영한 후\n이를 기준으로 지분법을 적용하도록 규정하고 있음\n한국공인회계사회는 상기 회계기준 등을 고려하여, 회사가 인지하고 있는 유의적인 회계적\n사건인 관계기업의 토지 재평가가 적절히 반영된 재무제표를 기준으로 지분법을 적용\n하지 아니하여 지분법적용투자주식 및 자기자본이 과소계상되었다고 판단함\n\n감사절차 미흡사항:\n동 지적사례는 재무제표에 대한 심사로 종결되어 감사보고서 감리는 실시하지 아니함\n\n시사점:\n회사는 지분법 관련 회계처리 기준서를 숙지하고, 관계기업의 가결산 재무제표를 이용\n하여 지분법을 적용할 경우 유의적인 거래나 회계적 사건이 가결산 재무제표에 적절히\n반영되었는지 확인하는 절차를 취하여야 하며, 유의적인 차이가 발견되는 경우 반드시\n그 차이를 가결산 재무제표에 반영한 후 이를 기준으로 지분법을 적용할 수 있도록\n주의를 기울여야 함\n- 30 -"
    },
    {
      "paragraph_id": "KICPA-2025-19",
      "case_id": "KICPA-2025-19",
      "case_title": "지분법 적용 오류(지분법 미적용, 연결재무제표 미작성)",
      "metadata": {
        "decision_year": "2025",
        "accounting_period": "’22.1.1.∼’23.12.31.\n1. 회사의 회계처리\n회사는 중국, 미국 및 베트남에 종속기업을 설립하면서 투자지분을 매도가능증권으로\n계상하고 원가법으로 평가함\n2. 회계기준 위반 지적 내용\n회사는 연결재무제표 작성대상 범위에 해당하는 베트남 소재 중속기업을 연결한 연결재무\n제표를 작성·공시하지 아니하였고, 개별재무제표에서는 지분법을 적용하지 아니하여 매도\n가능증권과 지분법투자주식과의 계정분류 오류가 발생하고 자기자본을 과대계상함\n3. 지적 근거 및 판단 내용\n일반기업회계기준 시행일 및 경과규정(2022.12.2.) 문단 3과 제4장(연결재무제표) 문단\n4.2 및 제8장(지분법) 문단 8.34에 따르면 자산, 부채, 또는 매출액 등이 일정기준에\n해당*하는 국내 및 해외종속기업을 연결재무제표 작성대상 종속기업으로 규정하고\n있고, 종속기업의 정의를 충족하는 경우에는 지분법을 적용하여 회계처리하도록 규정하고\n있음\n* 직전 사업연도 말의 자산총액 120억원 이상, 부채총액 70억원 이상, 종업원 100명 이상 및 직전 사업\n연도의 매출액 100억원 이상 중 2개 이상에 해당하는 회사\n한국공인회계사회는 상기 회계기준 등을 고려하여, 회사의 베트남 소재 종속기업이\n일정기준을 충족하여 연결재무제표 작성대상이 되는 2020년부터 해당 종속기업의 투자\n지분에 대해 지분법을 적용하고, 연결재무제표를 작성하여야 한다고 판단함\n4. 감사절차 미흡사항\n동 지적사례는 재무제표에 대한 심사로 종결되어 감사보고서 감리는 실시하지 아니함\n- 31 -\n5. 시사점\n회사는 해외종속기업 지분 보유시 연결재무제표 작성대상에 해당하는지 여부를 면밀히\n검토하여 연결재무제표 작성 대상에 해당할 경우 개별재무제표에서는 지분법을 적용\n하고, 연결재무제표를 작성·공시하여야 함",
        "issue_fields": [
          "지분법적용투자주식, 연결재무제표"
        ],
        "related_standards": [
          "일반기업회계기준 시행일 및 경과규정(2022.12.2.)",
          "제4장 (연결재무제표)\n및 제8장(지분법)"
        ],
        "case_type": "회계감리지적사례",
        "source": "KICPA 심사·감리 지적사례"
      },
      "content": {
        "section_1_company_accounting": {
          "section_title": "회사의 회계처리",
          "content": "회사는 중국, 미국 및 베트남에 종속기업을 설립하면서 투자지분을 매도가능증권으로\n계상하고 원가법으로 평가함"
        },
        "section_2_violation_details": {
          "section_title": "회계기준 위반 지적 내용",
          "content": "회사는 연결재무제표 작성대상 범위에 해당하는 베트남 소재 중속기업을 연결한 연결재무\n제표를 작성·공시하지 아니하였고, 개별재무제표에서는 지분법을 적용하지 아니하여 매도\n가능증권과 지분법투자주식과의 계정분류 오류가 발생하고 자기자본을 과대계상함"
        },
        "section_3_basis_judgment": {
          "section_title": "지적 근거 및 판단 내용",
          "content": "일반기업회계기준 시행일 및 경과규정(2022.12.2.) 문단 3과 제4장(연결재무제표) 문단"
        },
        "section_4_audit_procedure": {
          "section_title": "감사절차 미흡사항",
          "content": "동 지적사례는 재무제표에 대한 심사로 종결되어 감사보고서 감리는 실시하지 아니함\n- 31 -"
        },
        "section_5_implications": {
          "section_title": "시사점",
          "content": "회사는 해외종속기업 지분 보유시 연결재무제표 작성대상에 해당하는지 여부를 면밀히\n검토하여 연결재무제표 작성 대상에 해당할 경우 개별재무제표에서는 지분법을 적용\n하고, 연결재무제표를 작성·공시하여야 함"
        }
      },
      "indexed_content": "케이스 ID: KICPA-2025-19\n제목: 지분법 적용 오류(지분법 미적용, 연결재무제표 미작성)\n결정연도: 2025년\n회계결산일: ’22.1.1.∼’23.12.31.\n1. 회사의 회계처리\n회사는 중국, 미국 및 베트남에 종속기업을 설립하면서 투자지분을 매도가능증권으로\n계상하고 원가법으로 평가함\n2. 회계기준 위반 지적 내용\n회사는 연결재무제표 작성대상 범위에 해당하는 베트남 소재 중속기업을 연결한 연결재무\n제표를 작성·공시하지 아니하였고, 개별재무제표에서는 지분법을 적용하지 아니하여 매도\n가능증권과 지분법투자주식과의 계정분류 오류가 발생하고 자기자본을 과대계상함\n3. 지적 근거 및 판단 내용\n일반기업회계기준 시행일 및 경과규정(2022.12.2.) 문단 3과 제4장(연결재무제표) 문단\n4.2 및 제8장(지분법) 문단 8.34에 따르면 자산, 부채, 또는 매출액 등이 일정기준에\n해당*하는 국내 및 해외종속기업을 연결재무제표 작성대상 종속기업으로 규정하고\n있고, 종속기업의 정의를 충족하는 경우에는 지분법을 적용하여 회계처리하도록 규정하고\n있음\n* 직전 사업연도 말의 자산총액 120억원 이상, 부채총액 70억원 이상, 종업원 100명 이상 및 직전 사업\n연도의 매출액 100억원 이상 중 2개 이상에 해당하는 회사\n한국공인회계사회는 상기 회계기준 등을 고려하여, 회사의 베트남 소재 종속기업이\n일정기준을 충족하여 연결재무제표 작성대상이 되는 2020년부터 해당 종속기업의 투자\n지분에 대해 지분법을 적용하고, 연결재무제표를 작성하여야 한다고 판단함\n4. 감사절차 미흡사항\n동 지적사례는 재무제표에 대한 심사로 종결되어 감사보고서 감리는 실시하지 아니함\n- 31 -\n5. 시사점\n회사는 해외종속기업 지분 보유시 연결재무제표 작성대상에 해당하는지 여부를 면밀히\n검토하여 연결재무제표 작성 대상에 해당할 경우 개별재무제표에서는 지분법을 적용\n하고, 연결재무제표를 작성·공시하여야 함\n쟁점분야: 지분법적용투자주식, 연결재무제표\n관련기준: 일반기업회계기준 시행일 및 경과규정(2022.12.2.), 제4장 (연결재무제표)\n및 제8장(지분법)\n\n회사의 회계처리:\n회사는 중국, 미국 및 베트남에 종속기업을 설립하면서 투자지분을 매도가능증권으로\n계상하고 원가법으로 평가함\n\n회계기준 위반 지적 내용:\n회사는 연결재무제표 작성대상 범위에 해당하는 베트남 소재 중속기업을 연결한 연결재무\n제표를 작성·공시하지 아니하였고, 개별재무제표에서는 지분법을 적용하지 아니하여 매도\n가능증권과 지분법투자주식과의 계정분류 오류가 발생하고 자기자본을 과대계상함\n\n지적 근거 및 판단 내용:\n일반기업회계기준 시행일 및 경과규정(2022.12.2.) 문단 3과 제4장(연결재무제표) 문단\n\n감사절차 미흡사항:\n동 지적사례는 재무제표에 대한 심사로 종결되어 감사보고서 감리는 실시하지 아니함\n- 31 -\n\n시사점:\n회사는 해외종속기업 지분 보유시 연결재무제표 작성대상에 해당하는지 여부를 면밀히\n검토하여 연결재무제표 작성 대상에 해당할 경우 개별재무제표에서는 지분법을 적용\n하고, 연결재무제표를 작성·공시하여야 함"
    },
    {
      "paragraph_id": "KICPA-2025-20",
      "case_id": "KICPA-2025-20",
      "case_title": "지분법 적용 오류(지분법 미적용)",
      "metadata": {
        "decision_year": "2025",
        "accounting_period": "’23.1.1.∼’23.12.31.\n1. 회사의 회계처리\n회사는 건축 배관 및 소방용품 등의 제조·판매가 주업이며, 미국, 베트남 등 해외에 현지\n자회사를 보유하고 있음. 회사는 ‘22년부터 외부감사법에 따른 외부감사 규모 이상이 된\n해외자회사를 연결대상 종속기업으로 보아 연결재무제표를 작성·공시하였으나, 개별\n재무제표 작성시에는 종속기업투자주식에 대해 중소기업 회계처리 특례 적용이 가능\n하다고 판단하여, 지분법 회계처리를 하지 아니하고 매도가능증권으로 분류하였음\n2. 회계기준 위반 지적 내용\n회사는 종속기업이 외부감사 대상 규모 이상이 되어 연결대상으로 편입되는 경우, 개별\n재무제표상 종속기업투자주식을 지분법적용투자주식으로 분류하고 지분법을 적용하였\n어야 함에도, 이를 매도가능증권으로 잘못 회계처리하여 자기자본 등을 과대계상함\n3. 지적 근거 및 판단 내용\n일반기업회계기준 제4장(연결재무제표) 문단 4.18에 따르면 지배기업이 개별재무제표를\n작성할 때, 종속기업에 대한 투자자산은 지분법에 따라 회계처리하도록 규정하고 있고,\n일반기업회계기준 제8장(지분법) 문단 8.35에 따르면, 종속기업에 속하지 아니하던 피투자\n기업(관계기업 포함)이 투자기업의 지분 추가취득 등으로 인해 종속기업으로 되는 경우\n제12장 ‘사업결합’에 따라 투자차액을 산정하여 지분법을 적용하고, 지분법피투자기업이\n종속기업인 경우 당해 지분법적용투자주식에 대하여 투자계정의 잔액이 영(0)이 되어 지분법\n- 32 -\n적용을 중지하게 되는 경우를 제외하고는 지배기업 개별재무제표와 연결재무제표의 당기\n순손익 및 순자산에 대한 지배기업의 지분과 일치되도록 회계처리한다고 규정하고 있음\n한국공인회계사회는 상기 회계기준 등을 고려하여 종속기업이 외감규모 이상이 되어\n연결대상으로 편입되는 경우, 중소기업 회계처리 특례(관계기업이나 공동지배기업에\n대하여 지분법을 적용하지 아니할 수 있음)를 적용하여서는 아니 되고, 사업결합 회계\n처리에 따라 투자차액을 산정하여 지분법을 적용하여야 한다고 판단함\n4. 감사절차 미흡사항\n동 지적사례는 재무제표에 대한 심사로 종결되어 감사보고서 감리는 실시하지 아니함\n5. 시사점\n회사는 지분법 및 연결재무제표 관련 기준서를 숙지하고, 매 결산시 피투자회사의\n지분율 변동 및 자산·부채 규모 등을 종합적으로 검토하여 해당 기업이 연결범위에 포함\n되는 경우, 사업결합 및 지분법 회계처리가 적절히 이루어질 수 있도록 주의를 기울일\n필요가 있음",
        "issue_fields": [
          "지분법적용투자주식"
        ],
        "related_standards": [
          "일반기업회계기준 제4장(연결재무제표)",
          "제8장(지분법)"
        ],
        "case_type": "회계감리지적사례",
        "source": "KICPA 심사·감리 지적사례"
      },
      "content": {
        "section_1_company_accounting": {
          "section_title": "회사의 회계처리",
          "content": "회사는 건축 배관 및 소방용품 등의 제조·판매가 주업이며, 미국, 베트남 등 해외에 현지\n자회사를 보유하고 있음. 회사는 ‘22년부터 외부감사법에 따른 외부감사 규모 이상이 된\n해외자회사를 연결대상 종속기업으로 보아 연결재무제표를 작성·공시하였으나, 개별\n재무제표 작성시에는 종속기업투자주식에 대해 중소기업 회계처리 특례 적용이 가능\n하다고 판단하여, 지분법 회계처리를 하지 아니하고 매도가능증권으로 분류하였음"
        },
        "section_2_violation_details": {
          "section_title": "회계기준 위반 지적 내용",
          "content": "회사는 종속기업이 외부감사 대상 규모 이상이 되어 연결대상으로 편입되는 경우, 개별\n재무제표상 종속기업투자주식을 지분법적용투자주식으로 분류하고 지분법을 적용하였\n어야 함에도, 이를 매도가능증권으로 잘못 회계처리하여 자기자본 등을 과대계상함"
        },
        "section_3_basis_judgment": {
          "section_title": "지적 근거 및 판단 내용",
          "content": "일반기업회계기준 제4장(연결재무제표) 문단 4.18에 따르면 지배기업이 개별재무제표를\n작성할 때, 종속기업에 대한 투자자산은 지분법에 따라 회계처리하도록 규정하고 있고,\n일반기업회계기준 제8장(지분법) 문단 8.35에 따르면, 종속기업에 속하지 아니하던 피투자\n기업(관계기업 포함)이 투자기업의 지분 추가취득 등으로 인해 종속기업으로 되는 경우\n제12장 ‘사업결합’에 따라 투자차액을 산정하여 지분법을 적용하고, 지분법피투자기업이\n종속기업인 경우 당해 지분법적용투자주식에 대하여 투자계정의 잔액이 영(0)이 되어 지분법\n- 32 -\n적용을 중지하게 되는 경우를 제외하고는 지배기업 개별재무제표와 연결재무제표의 당기\n순손익 및 순자산에 대한 지배기업의 지분과 일치되도록 회계처리한다고 규정하고 있음\n한국공인회계사회는 상기 회계기준 등을 고려하여 종속기업이 외감규모 이상이 되어\n연결대상으로 편입되는 경우, 중소기업 회계처리 특례(관계기업이나 공동지배기업에\n대하여 지분법을 적용하지 아니할 수 있음)를 적용하여서는 아니 되고, 사업결합 회계\n처리에 따라 투자차액을 산정하여 지분법을 적용하여야 한다고 판단함"
        },
        "section_4_audit_procedure": {
          "section_title": "감사절차 미흡사항",
          "content": "동 지적사례는 재무제표에 대한 심사로 종결되어 감사보고서 감리는 실시하지 아니함"
        },
        "section_5_implications": {
          "section_title": "시사점",
          "content": "회사는 지분법 및 연결재무제표 관련 기준서를 숙지하고, 매 결산시 피투자회사의\n지분율 변동 및 자산·부채 규모 등을 종합적으로 검토하여 해당 기업이 연결범위에 포함\n되는 경우, 사업결합 및 지분법 회계처리가 적절히 이루어질 수 있도록 주의를 기울일\n필요가 있음"
        }
      },
      "indexed_content": "케이스 ID: KICPA-2025-20\n제목: 지분법 적용 오류(지분법 미적용)\n결정연도: 2025년\n회계결산일: ’23.1.1.∼’23.12.31.\n1. 회사의 회계처리\n회사는 건축 배관 및 소방용품 등의 제조·판매가 주업이며, 미국, 베트남 등 해외에 현지\n자회사를 보유하고 있음. 회사는 ‘22년부터 외부감사법에 따른 외부감사 규모 이상이 된\n해외자회사를 연결대상 종속기업으로 보아 연결재무제표를 작성·공시하였으나, 개별\n재무제표 작성시에는 종속기업투자주식에 대해 중소기업 회계처리 특례 적용이 가능\n하다고 판단하여, 지분법 회계처리를 하지 아니하고 매도가능증권으로 분류하였음\n2. 회계기준 위반 지적 내용\n회사는 종속기업이 외부감사 대상 규모 이상이 되어 연결대상으로 편입되는 경우, 개별\n재무제표상 종속기업투자주식을 지분법적용투자주식으로 분류하고 지분법을 적용하였\n어야 함에도, 이를 매도가능증권으로 잘못 회계처리하여 자기자본 등을 과대계상함\n3. 지적 근거 및 판단 내용\n일반기업회계기준 제4장(연결재무제표) 문단 4.18에 따르면 지배기업이 개별재무제표를\n작성할 때, 종속기업에 대한 투자자산은 지분법에 따라 회계처리하도록 규정하고 있고,\n일반기업회계기준 제8장(지분법) 문단 8.35에 따르면, 종속기업에 속하지 아니하던 피투자\n기업(관계기업 포함)이 투자기업의 지분 추가취득 등으로 인해 종속기업으로 되는 경우\n제12장 ‘사업결합’에 따라 투자차액을 산정하여 지분법을 적용하고, 지분법피투자기업이\n종속기업인 경우 당해 지분법적용투자주식에 대하여 투자계정의 잔액이 영(0)이 되어 지분법\n- 32 -\n적용을 중지하게 되는 경우를 제외하고는 지배기업 개별재무제표와 연결재무제표의 당기\n순손익 및 순자산에 대한 지배기업의 지분과 일치되도록 회계처리한다고 규정하고 있음\n한국공인회계사회는 상기 회계기준 등을 고려하여 종속기업이 외감규모 이상이 되어\n연결대상으로 편입되는 경우, 중소기업 회계처리 특례(관계기업이나 공동지배기업에\n대하여 지분법을 적용하지 아니할 수 있음)를 적용하여서는 아니 되고, 사업결합 회계\n처리에 따라 투자차액을 산정하여 지분법을 적용하여야 한다고 판단함\n4. 감사절차 미흡사항\n동 지적사례는 재무제표에 대한 심사로 종결되어 감사보고서 감리는 실시하지 아니함\n5. 시사점\n회사는 지분법 및 연결재무제표 관련 기준서를 숙지하고, 매 결산시 피투자회사의\n지분율 변동 및 자산·부채 규모 등을 종합적으로 검토하여 해당 기업이 연결범위에 포함\n되는 경우, 사업결합 및 지분법 회계처리가 적절히 이루어질 수 있도록 주의를 기울일\n필요가 있음\n쟁점분야: 지분법적용투자주식\n관련기준: 일반기업회계기준 제4장(연결재무제표), 제8장(지분법)\n\n회사의 회계처리:\n회사는 건축 배관 및 소방용품 등의 제조·판매가 주업이며, 미국, 베트남 등 해외에 현지\n자회사를 보유하고 있음. 회사는 ‘22년부터 외부감사법에 따른 외부감사 규모 이상이 된\n해외자회사를 연결대상 종속기업으로 보아 연결재무제표를 작성·공시하였으나, 개별\n재무제표 작성시에는 종속기업투자주식에 대해 중소기업 회계처리 특례 적용이 가능\n하다고 판단하여, 지분법 회계처리를 하지 아니하고 매도가능증권으로 분류하였음\n\n회계기준 위반 지적 내용:\n회사는 종속기업이 외부감사 대상 규모 이상이 되어 연결대상으로 편입되는 경우, 개별\n재무제표상 종속기업투자주식을 지분법적용투자주식으로 분류하고 지분법을 적용하였\n어야 함에도, 이를 매도가능증권으로 잘못 회계처리하여 자기자본 등을 과대계상함\n\n지적 근거 및 판단 내용:\n일반기업회계기준 제4장(연결재무제표) 문단 4.18에 따르면 지배기업이 개별재무제표를\n작성할 때, 종속기업에 대한 투자자산은 지분법에 따라 회계처리하도록 규정하고 있고,\n일반기업회계기준 제8장(지분법) 문단 8.35에 따르면, 종속기업에 속하지 아니하던 피투자\n기업(관계기업 포함)이 투자기업의 지분 추가취득 등으로 인해 종속기업으로 되는 경우\n제12장 ‘사업결합’에 따라 투자차액을 산정하여 지분법을 적용하고, 지분법피투자기업이\n종속기업인 경우 당해 지분법적용투자주식에 대하여 투자계정의 잔액이 영(0)이 되어 지분법\n- 32 -\n적용을 중지하게 되는 경우를 제외하고는 지배기업 개별재무제표와 연결재무제표의 당기\n순손익 및 순자산에 대한 지배기업의 지분과 일치되도록 회계처리한다고 규정하고 있음\n한국공인회계사회는 상기 회계기준 등을 고려하여 종속기업이 외감규모 이상이 되어\n연결대상으로 편입되는 경우, 중소기업 회계처리 특례(관계기업이나 공동지배기업에\n대하여 지분법을 적용하지 아니할 수 있음)를 적용하여서는 아니 되고, 사업결합 회계\n처리에 따라 투자차액을 산정하여 지분법을 적용하여야 한다고 판단함\n\n감사절차 미흡사항:\n동 지적사례는 재무제표에 대한 심사로 종결되어 감사보고서 감리는 실시하지 아니함\n\n시사점:\n회사는 지분법 및 연결재무제표 관련 기준서를 숙지하고, 매 결산시 피투자회사의\n지분율 변동 및 자산·부채 규모 등을 종합적으로 검토하여 해당 기업이 연결범위에 포함\n되는 경우, 사업결합 및 지분법 회계처리가 적절히 이루어질 수 있도록 주의를 기울일\n필요가 있음"
    },
    {
      "paragraph_id": "KICPA-2025-21",
      "case_id": "KICPA-2025-21",
      "case_title": "연결 회계처리 오류",
      "metadata": {
        "decision_year": "2025",
        "accounting_period": "’22.1.1.∼’23.12.31.\n1. 회사의 회계처리\n회사는 전자부품 제조 및 판매를 주요 영업으로 하고 있으며, 베트남 등 해외에 여러\n생산 공장을 설립하여 운영하고 있음. 회사는 개별재무제표상 중소기업 회계처리 특례를\n적용하여 종속기업투자주식을 매도가능증권으로 분류하고 취득원가로 평가하고, ‘21년\n까지 연결재무제표를 작성·공시하지 아니하였다가, ’22년 결산시부터 모든 종속기업을\n예외없이 연결하는 것으로 결정하고 개별재무제표상 종속기업투자주식에 대해 지분법을\n적용한 후 연결재무제표를 작성·공시함\n- 33 -\n한편, 회사는 ‘22년과 ‘23년 연결재무제표 작성 과정에서, 일부 종속기업의 각 보고기간\n종료일 기준 재무제표를 입수하기가 어렵다는 이유로 해당 종속기업의 ‘15년 재무제표를\n조정 없이 사용하거나, ‘22년 연결재무제표 작성 시 또 다른 종속기업에 대해 착오로 ‘21년\n재무제표를 사용하였고, ‘22년 개별재무제표상 모든 종속기업투자주식에 대해 지분법 회계\n처리를 최초 적용하면서 이전에 보유하고 있던 투자지분을 취득일의 공정가치로 재측정\n하지 아니한 채 매도가능증권 장부금액(취득원가)을 지분법적용투자주식으로 대체한\n오류가 연결 재무제표 작성시에도 동일하게 발생함. 또한, 연결재무제표 작성을 위해\n해외 종속기업 재무제표를 원화로 환산하는 과정에서 환율 적용 및 계정 분류·내부거래\n제거 등 연결조정 회계처리에서도 다수의 오류가 발생하였음\n2. 회계기준 위반 지적 내용\n① [종속기업 재무제표 오류] (‘22년과 ’23년) 회사는 일부 종속기업의 ’15년 재무제표를\n사용하여 연결재무제표를 작성하였고, (‘22년) 또 다른 종속기업의 경우에도 ‘22년 재무\n제표가 아닌 ‘21년 재무제표를 사용하여 연결재무제표를 작성하였으며, ② [취득법\n미적용 오류] (‘22년과 ‘23년) ’22년 결산시 모든 종속기업을 연결하면서, 이전에 보유\n하고 있던 투자지분을 취득일의 공정가치로 재측정하고 관련 차손익을 당기손익으로\n인식하지 아니하였고, ③ [외화환산 등 기타 오류] (‘22년과 ’23년) 해외 종속기업 재무\n제표 환산시 환율을 잘못 적용하는 등 연결 회계처리를 잘못하여 결과적으로 연결재무\n제표상 자산·부채 및 자기자본과 수익·비용을 과소계상함\n3. 지적 근거 및 판단 내용\n일반기업회계기준 제4장(연결재무제표) 문단 4.10과 4.11에 따르면, 동일한 보고기간\n종료일에 작성된 지배기업의 재무제표와 종속기업의 재무제표를 사용하여 연결재무\n제표를 작성하고, 어떠한 경우라도 종속기업의 보고기간종료일과 지배기업의 보고기간\n종료일의 차이는 3개월을 초과해서는 아니된다고 규정하고 있으며,\n일반기업회계기준 제12장(사업결합) 문단 12.30에 따르면 피취득자에 대한 지배력을\n획득하는 경우 취득자는 이전에 보유하고 있던 피취득자에 대한 지분을 취득일의 공정\n가치로 재측정하고 그 결과 차손익이 있다면 당기손익으로 인식하도록 규정하고 있고,\n일반기업회계기준 제23장(환율변동효과) 문단 23.14 및 23.15에 따르면 해외사업을 연결\n또는 지분법을 적용하여 보고기업의 재무제표에 포함되도록 하기 위하여 해외사업장의\n경영성과와 재무상태를 표시통화로 환산하는 경우에는 (1) (자산과 부채) 보고기간말의\n마감환율이나 (2) (수익과 비용) 거래일의 환율 또는 평균환율로 환산하고, (1)과 (2)의\n환산에서 생기는 외환차이는 기타포괄손익으로 인식하도록 규정하고 있음\n한국공인회계사회는 상기 회계기준 등을 고려하여, 회사가 연결재무제표 작성 시 지배\n- 34 -\n기업 보고기간종료일과의 차이가 3개월을 초과하는 종속기업의 재무제표를 사용하는\n등 오류가 발생하였고, 종속기업에 속하지 아니하던 피투자기업이 종속기업이 되는 경우\n사업결합에 따른 회계처리를 최초로 수행하여야 함에도 주식의 최초 취득원가를 지분법\n적용투자주식으로 대체한 개별재무제표의 오류가 연결재무제표에도 동일하게 발생하였으며,\n종속기업 재무제표 환산 및 연결조정분개 과정에서도 다수의 오류가 발생하여 연결재무\n제표상 자산·부채 및 자기자본과 수익·비용을 과소계상되었다고 판단함\n4. 감사절차 미흡사항\n동 지적사례는 재무제표에 대한 심사로 종결되어 감사보고서 감리는 실시하지 아니함\n5. 시사점\n회사는 연결재무제표 관련 기준서를 숙지하고, 연결재무제표 작성을 위한 종속기업 재무\n제표의 보고기간종료일 및 회계정책 등을 확인할 필요가 있고, 해외사업장이나 외화기능\n통화를 사용하는 종속기업의 재무정보를 반영할 때는 관련 기준서 등에서 정한 적정\n환율을 적용하여 환산하고, 세부 연결회계처리도 적절히 이루어질 수 있도록 주의를 기울일\n필요가 있음",
        "issue_fields": [
          "연결재무제표"
        ],
        "related_standards": [
          "일반기업회계기준 제4장(연결재무제표)",
          "제12장(사업결합)",
          "제23장(환율\n변동효과)"
        ],
        "case_type": "회계감리지적사례",
        "source": "KICPA 심사·감리 지적사례"
      },
      "content": {
        "section_1_company_accounting": {
          "section_title": "회사의 회계처리",
          "content": "회사는 전자부품 제조 및 판매를 주요 영업으로 하고 있으며, 베트남 등 해외에 여러\n생산 공장을 설립하여 운영하고 있음. 회사는 개별재무제표상 중소기업 회계처리 특례를\n적용하여 종속기업투자주식을 매도가능증권으로 분류하고 취득원가로 평가하고, ‘21년\n까지 연결재무제표를 작성·공시하지 아니하였다가, ’22년 결산시부터 모든 종속기업을\n예외없이 연결하는 것으로 결정하고 개별재무제표상 종속기업투자주식에 대해 지분법을\n적용한 후 연결재무제표를 작성·공시함\n- 33 -\n한편, 회사는 ‘22년과 ‘23년 연결재무제표 작성 과정에서, 일부 종속기업의 각 보고기간\n종료일 기준 재무제표를 입수하기가 어렵다는 이유로 해당 종속기업의 ‘15년 재무제표를\n조정 없이 사용하거나, ‘22년 연결재무제표 작성 시 또 다른 종속기업에 대해 착오로 ‘21년\n재무제표를 사용하였고, ‘22년 개별재무제표상 모든 종속기업투자주식에 대해 지분법 회계\n처리를 최초 적용하면서 이전에 보유하고 있던 투자지분을 취득일의 공정가치로 재측정\n하지 아니한 채 매도가능증권 장부금액(취득원가)을 지분법적용투자주식으로 대체한\n오류가 연결 재무제표 작성시에도 동일하게 발생함. 또한, 연결재무제표 작성을 위해\n해외 종속기업 재무제표를 원화로 환산하는 과정에서 환율 적용 및 계정 분류·내부거래\n제거 등 연결조정 회계처리에서도 다수의 오류가 발생하였음"
        },
        "section_2_violation_details": {
          "section_title": "회계기준 위반 지적 내용",
          "content": "① [종속기업 재무제표 오류] (‘22년과 ’23년) 회사는 일부 종속기업의 ’15년 재무제표를\n사용하여 연결재무제표를 작성하였고, (‘22년) 또 다른 종속기업의 경우에도 ‘22년 재무\n제표가 아닌 ‘21년 재무제표를 사용하여 연결재무제표를 작성하였으며, ② [취득법\n미적용 오류] (‘22년과 ‘23년) ’22년 결산시 모든 종속기업을 연결하면서, 이전에 보유\n하고 있던 투자지분을 취득일의 공정가치로 재측정하고 관련 차손익을 당기손익으로\n인식하지 아니하였고, ③ [외화환산 등 기타 오류] (‘22년과 ’23년) 해외 종속기업 재무\n제표 환산시 환율을 잘못 적용하는 등 연결 회계처리를 잘못하여 결과적으로 연결재무\n제표상 자산·부채 및 자기자본과 수익·비용을 과소계상함"
        },
        "section_3_basis_judgment": {
          "section_title": "지적 근거 및 판단 내용",
          "content": "일반기업회계기준 제4장(연결재무제표) 문단 4.10과 4.11에 따르면, 동일한 보고기간\n종료일에 작성된 지배기업의 재무제표와 종속기업의 재무제표를 사용하여 연결재무\n제표를 작성하고, 어떠한 경우라도 종속기업의 보고기간종료일과 지배기업의 보고기간\n종료일의 차이는 3개월을 초과해서는 아니된다고 규정하고 있으며,\n일반기업회계기준 제12장(사업결합) 문단 12.30에 따르면 피취득자에 대한 지배력을\n획득하는 경우 취득자는 이전에 보유하고 있던 피취득자에 대한 지분을 취득일의 공정\n가치로 재측정하고 그 결과 차손익이 있다면 당기손익으로 인식하도록 규정하고 있고,\n일반기업회계기준 제23장(환율변동효과) 문단 23.14 및 23.15에 따르면 해외사업을 연결\n또는 지분법을 적용하여 보고기업의 재무제표에 포함되도록 하기 위하여 해외사업장의\n경영성과와 재무상태를 표시통화로 환산하는 경우에는 (1) (자산과 부채) 보고기간말의\n마감환율이나 (2) (수익과 비용) 거래일의 환율 또는 평균환율로 환산하고, (1)과 (2)의\n환산에서 생기는 외환차이는 기타포괄손익으로 인식하도록 규정하고 있음\n한국공인회계사회는 상기 회계기준 등을 고려하여, 회사가 연결재무제표 작성 시 지배\n- 34 -\n기업 보고기간종료일과의 차이가 3개월을 초과하는 종속기업의 재무제표를 사용하는\n등 오류가 발생하였고, 종속기업에 속하지 아니하던 피투자기업이 종속기업이 되는 경우\n사업결합에 따른 회계처리를 최초로 수행하여야 함에도 주식의 최초 취득원가를 지분법\n적용투자주식으로 대체한 개별재무제표의 오류가 연결재무제표에도 동일하게 발생하였으며,\n종속기업 재무제표 환산 및 연결조정분개 과정에서도 다수의 오류가 발생하여 연결재무\n제표상 자산·부채 및 자기자본과 수익·비용을 과소계상되었다고 판단함"
        },
        "section_4_audit_procedure": {
          "section_title": "감사절차 미흡사항",
          "content": "동 지적사례는 재무제표에 대한 심사로 종결되어 감사보고서 감리는 실시하지 아니함"
        },
        "section_5_implications": {
          "section_title": "시사점",
          "content": "회사는 연결재무제표 관련 기준서를 숙지하고, 연결재무제표 작성을 위한 종속기업 재무\n제표의 보고기간종료일 및 회계정책 등을 확인할 필요가 있고, 해외사업장이나 외화기능\n통화를 사용하는 종속기업의 재무정보를 반영할 때는 관련 기준서 등에서 정한 적정\n환율을 적용하여 환산하고, 세부 연결회계처리도 적절히 이루어질 수 있도록 주의를 기울일\n필요가 있음"
        }
      },
      "indexed_content": "케이스 ID: KICPA-2025-21\n제목: 연결 회계처리 오류\n결정연도: 2025년\n회계결산일: ’22.1.1.∼’23.12.31.\n1. 회사의 회계처리\n회사는 전자부품 제조 및 판매를 주요 영업으로 하고 있으며, 베트남 등 해외에 여러\n생산 공장을 설립하여 운영하고 있음. 회사는 개별재무제표상 중소기업 회계처리 특례를\n적용하여 종속기업투자주식을 매도가능증권으로 분류하고 취득원가로 평가하고, ‘21년\n까지 연결재무제표를 작성·공시하지 아니하였다가, ’22년 결산시부터 모든 종속기업을\n예외없이 연결하는 것으로 결정하고 개별재무제표상 종속기업투자주식에 대해 지분법을\n적용한 후 연결재무제표를 작성·공시함\n- 33 -\n한편, 회사는 ‘22년과 ‘23년 연결재무제표 작성 과정에서, 일부 종속기업의 각 보고기간\n종료일 기준 재무제표를 입수하기가 어렵다는 이유로 해당 종속기업의 ‘15년 재무제표를\n조정 없이 사용하거나, ‘22년 연결재무제표 작성 시 또 다른 종속기업에 대해 착오로 ‘21년\n재무제표를 사용하였고, ‘22년 개별재무제표상 모든 종속기업투자주식에 대해 지분법 회계\n처리를 최초 적용하면서 이전에 보유하고 있던 투자지분을 취득일의 공정가치로 재측정\n하지 아니한 채 매도가능증권 장부금액(취득원가)을 지분법적용투자주식으로 대체한\n오류가 연결 재무제표 작성시에도 동일하게 발생함. 또한, 연결재무제표 작성을 위해\n해외 종속기업 재무제표를 원화로 환산하는 과정에서 환율 적용 및 계정 분류·내부거래\n제거 등 연결조정 회계처리에서도 다수의 오류가 발생하였음\n2. 회계기준 위반 지적 내용\n① [종속기업 재무제표 오류] (‘22년과 ’23년) 회사는 일부 종속기업의 ’15년 재무제표를\n사용하여 연결재무제표를 작성하였고, (‘22년) 또 다른 종속기업의 경우에도 ‘22년 재무\n제표가 아닌 ‘21년 재무제표를 사용하여 연결재무제표를 작성하였으며, ② [취득법\n미적용 오류] (‘22년과 ‘23년) ’22년 결산시 모든 종속기업을 연결하면서, 이전에 보유\n하고 있던 투자지분을 취득일의 공정가치로 재측정하고 관련 차손익을 당기손익으로\n인식하지 아니하였고, ③ [외화환산 등 기타 오류] (‘22년과 ’23년) 해외 종속기업 재무\n제표 환산시 환율을 잘못 적용하는 등 연결 회계처리를 잘못하여 결과적으로 연결재무\n제표상 자산·부채 및 자기자본과 수익·비용을 과소계상함\n3. 지적 근거 및 판단 내용\n일반기업회계기준 제4장(연결재무제표) 문단 4.10과 4.11에 따르면, 동일한 보고기간\n종료일에 작성된 지배기업의 재무제표와 종속기업의 재무제표를 사용하여 연결재무\n제표를 작성하고, 어떠한 경우라도 종속기업의 보고기간종료일과 지배기업의 보고기간\n종료일의 차이는 3개월을 초과해서는 아니된다고 규정하고 있으며,\n일반기업회계기준 제12장(사업결합) 문단 12.30에 따르면 피취득자에 대한 지배력을\n획득하는 경우 취득자는 이전에 보유하고 있던 피취득자에 대한 지분을 취득일의 공정\n가치로 재측정하고 그 결과 차손익이 있다면 당기손익으로 인식하도록 규정하고 있고,\n일반기업회계기준 제23장(환율변동효과) 문단 23.14 및 23.15에 따르면 해외사업을 연결\n또는 지분법을 적용하여 보고기업의 재무제표에 포함되도록 하기 위하여 해외사업장의\n경영성과와 재무상태를 표시통화로 환산하는 경우에는 (1) (자산과 부채) 보고기간말의\n마감환율이나 (2) (수익과 비용) 거래일의 환율 또는 평균환율로 환산하고, (1)과 (2)의\n환산에서 생기는 외환차이는 기타포괄손익으로 인식하도록 규정하고 있음\n한국공인회계사회는 상기 회계기준 등을 고려하여, 회사가 연결재무제표 작성 시 지배\n- 34 -\n기업 보고기간종료일과의 차이가 3개월을 초과하는 종속기업의 재무제표를 사용하는\n등 오류가 발생하였고, 종속기업에 속하지 아니하던 피투자기업이 종속기업이 되는 경우\n사업결합에 따른 회계처리를 최초로 수행하여야 함에도 주식의 최초 취득원가를 지분법\n적용투자주식으로 대체한 개별재무제표의 오류가 연결재무제표에도 동일하게 발생하였으며,\n종속기업 재무제표 환산 및 연결조정분개 과정에서도 다수의 오류가 발생하여 연결재무\n제표상 자산·부채 및 자기자본과 수익·비용을 과소계상되었다고 판단함\n4. 감사절차 미흡사항\n동 지적사례는 재무제표에 대한 심사로 종결되어 감사보고서 감리는 실시하지 아니함\n5. 시사점\n회사는 연결재무제표 관련 기준서를 숙지하고, 연결재무제표 작성을 위한 종속기업 재무\n제표의 보고기간종료일 및 회계정책 등을 확인할 필요가 있고, 해외사업장이나 외화기능\n통화를 사용하는 종속기업의 재무정보를 반영할 때는 관련 기준서 등에서 정한 적정\n환율을 적용하여 환산하고, 세부 연결회계처리도 적절히 이루어질 수 있도록 주의를 기울일\n필요가 있음\n쟁점분야: 연결재무제표\n관련기준: 일반기업회계기준 제4장(연결재무제표), 제12장(사업결합), 제23장(환율\n변동효과)\n\n회사의 회계처리:\n회사는 전자부품 제조 및 판매를 주요 영업으로 하고 있으며, 베트남 등 해외에 여러\n생산 공장을 설립하여 운영하고 있음. 회사는 개별재무제표상 중소기업 회계처리 특례를\n적용하여 종속기업투자주식을 매도가능증권으로 분류하고 취득원가로 평가하고, ‘21년\n까지 연결재무제표를 작성·공시하지 아니하였다가, ’22년 결산시부터 모든 종속기업을\n예외없이 연결하는 것으로 결정하고 개별재무제표상 종속기업투자주식에 대해 지분법을\n적용한 후 연결재무제표를 작성·공시함\n- 33 -\n한편, 회사는 ‘22년과 ‘23년 연결재무제표 작성 과정에서, 일부 종속기업의 각 보고기간\n종료일 기준 재무제표를 입수하기가 어렵다는 이유로 해당 종속기업의 ‘15년 재무제표를\n조정 없이 사용하거나, ‘22년 연결재무제표 작성 시 또 다른 종속기업에 대해 착오로 ‘21년\n재무제표를 사용하였고, ‘22년 개별재무제표상 모든 종속기업투자주식에 대해 지분법 회계\n처리를 최초 적용하면서 이전에 보유하고 있던 투자지분을 취득일의 공정가치로 재측정\n하지 아니한 채 매도가능증권 장부금액(취득원가)을 지분법적용투자주식으로 대체한\n오류가 연결 재무제표 작성시에도 동일하게 발생함. 또한, 연결재무제표 작성을 위해\n해외 종속기업 재무제표를 원화로 환산하는 과정에서 환율 적용 및 계정 분류·내부거래\n제거 등 연결조정 회계처리에서도 다수의 오류가 발생하였음\n\n회계기준 위반 지적 내용:\n① [종속기업 재무제표 오류] (‘22년과 ’23년) 회사는 일부 종속기업의 ’15년 재무제표를\n사용하여 연결재무제표를 작성하였고, (‘22년) 또 다른 종속기업의 경우에도 ‘22년 재무\n제표가 아닌 ‘21년 재무제표를 사용하여 연결재무제표를 작성하였으며, ② [취득법\n미적용 오류] (‘22년과 ‘23년) ’22년 결산시 모든 종속기업을 연결하면서, 이전에 보유\n하고 있던 투자지분을 취득일의 공정가치로 재측정하고 관련 차손익을 당기손익으로\n인식하지 아니하였고, ③ [외화환산 등 기타 오류] (‘22년과 ’23년) 해외 종속기업 재무\n제표 환산시 환율을 잘못 적용하는 등 연결 회계처리를 잘못하여 결과적으로 연결재무\n제표상 자산·부채 및 자기자본과 수익·비용을 과소계상함\n\n지적 근거 및 판단 내용:\n일반기업회계기준 제4장(연결재무제표) 문단 4.10과 4.11에 따르면, 동일한 보고기간\n종료일에 작성된 지배기업의 재무제표와 종속기업의 재무제표를 사용하여 연결재무\n제표를 작성하고, 어떠한 경우라도 종속기업의 보고기간종료일과 지배기업의 보고기간\n종료일의 차이는 3개월을 초과해서는 아니된다고 규정하고 있으며,\n일반기업회계기준 제12장(사업결합) 문단 12.30에 따르면 피취득자에 대한 지배력을\n획득하는 경우 취득자는 이전에 보유하고 있던 피취득자에 대한 지분을 취득일의 공정\n가치로 재측정하고 그 결과 차손익이 있다면 당기손익으로 인식하도록 규정하고 있고,\n일반기업회계기준 제23장(환율변동효과) 문단 23.14 및 23.15에 따르면 해외사업을 연결\n또는 지분법을 적용하여 보고기업의 재무제표에 포함되도록 하기 위하여 해외사업장의\n경영성과와 재무상태를 표시통화로 환산하는 경우에는 (1) (자산과 부채) 보고기간말의\n마감환율이나 (2) (수익과 비용) 거래일의 환율 또는 평균환율로 환산하고, (1)과 (2)의\n환산에서 생기는 외환차이는 기타포괄손익으로 인식하도록 규정하고 있음\n한국공인회계사회는 상기 회계기준 등을 고려하여, 회사가 연결재무제표 작성 시 지배\n- 34 -\n기업 보고기간종료일과의 차이가 3개월을 초과하는 종속기업의 재무제표를 사용하는\n등 오류가 발생하였고, 종속기업에 속하지 아니하던 피투자기업이 종속기업이 되는 경우\n사업결합에 따른 회계처리를 최초로 수행하여야 함에도 주식의 최초 취득원가를 지분법\n적용투자주식으로 대체한 개별재무제표의 오류가 연결재무제표에도 동일하게 발생하였으며,\n종속기업 재무제표 환산 및 연결조정분개 과정에서도 다수의 오류가 발생하여 연결재무\n제표상 자산·부채 및 자기자본과 수익·비용을 과소계상되었다고 판단함\n\n감사절차 미흡사항:\n동 지적사례는 재무제표에 대한 심사로 종결되어 감사보고서 감리는 실시하지 아니함\n\n시사점:\n회사는 연결재무제표 관련 기준서를 숙지하고, 연결재무제표 작성을 위한 종속기업 재무\n제표의 보고기간종료일 및 회계정책 등을 확인할 필요가 있고, 해외사업장이나 외화기능\n통화를 사용하는 종속기업의 재무정보를 반영할 때는 관련 기준서 등에서 정한 적정\n환율을 적용하여 환산하고, 세부 연결회계처리도 적절히 이루어질 수 있도록 주의를 기울일\n필요가 있음"
    },
    {
      "paragraph_id": "KICPA-2025-22",
      "case_id": "KICPA-2025-22",
      "case_title": "개발비 손상차손 미인식",
      "metadata": {
        "decision_year": "2025",
        "accounting_period": "’21.1.1.∼’23.12.31.\n1. 회사의 회계처리\n회사는 산하 연구소를 통해 개발 프로젝트를 진행하고 있으며, 개발단계에서 발생한\n비용을 자산화하고 상각하고 있음. 일부 개발 프로젝트의 경우 관련 매출이 거의 발생\n하지 않거나 정부사업 중단 등으로 손상이 발생했음에도 프로젝트별 품목의 사업 전망을\n낙관적으로 전망하고 개발비에 대한 손상차손을 인식하지 않음\n- 35 -\n2. 회계기준 위반 지적 내용\n회사는 매출 부진 등으로 손상이 발생한 개발비에 대해 손상차손을 인식하지 아니하여\n개발비를 과대계상함\n3. 지적 근거 및 판단 내용\n일반기업회계기준 제20장(자산손상) 문단 20.8에 따르면 자산의 진부화 및 시장가치의\n급격한 하락 등으로 인하여 자산의 회수가능액이 장부금액에 중요하게 미달하게 되는\n경우에는 장부금액을 회수가능액으로 조정하고 그 차액을 손상차손으로 처리하도록\n규정되어 있음\n한국공인회계사회는 상기 회계기준 등을 고려하여, 자산의 진부화 및 시장가치의 급격한\n하락 등으로 인하여 회사의 개발비 회수가능액이 장부금액에 중요하게 미달하게 되는\n경우에 해당하였음에도 손상차손을 인식하지 아니하여 회계처리 오류가 발생한 것으로\n판단하였음\n4. 감사절차 미흡사항\n동 지적사례는 재무제표에 대한 심사로 종결되어 감사보고서 감리는 실시하지 아니함\n5. 시사점\n회사는 개발비와 관련하여 자산의 진부화 및 시장가치의 급격한 하락 여부 등을 종합적\n으로 검토하는 내부통제를 구축하여야 하며 자산의 회수가능액이 장부금액에 중요하게\n미달하게 되는 경우에는 장부금액을 회수가능액으로 조정하고 그 차액을 손상차손으로\n인식하여야 함\n- 36 -",
        "issue_fields": [
          "개발비 손상"
        ],
        "related_standards": [
          "일반기업회계기준 제20장(자산손상)"
        ],
        "case_type": "회계감리지적사례",
        "source": "KICPA 심사·감리 지적사례"
      },
      "content": {
        "section_1_company_accounting": {
          "section_title": "회사의 회계처리",
          "content": "회사는 산하 연구소를 통해 개발 프로젝트를 진행하고 있으며, 개발단계에서 발생한\n비용을 자산화하고 상각하고 있음. 일부 개발 프로젝트의 경우 관련 매출이 거의 발생\n하지 않거나 정부사업 중단 등으로 손상이 발생했음에도 프로젝트별 품목의 사업 전망을\n낙관적으로 전망하고 개발비에 대한 손상차손을 인식하지 않음\n- 35 -"
        },
        "section_2_violation_details": {
          "section_title": "회계기준 위반 지적 내용",
          "content": "회사는 매출 부진 등으로 손상이 발생한 개발비에 대해 손상차손을 인식하지 아니하여\n개발비를 과대계상함"
        },
        "section_3_basis_judgment": {
          "section_title": "지적 근거 및 판단 내용",
          "content": "일반기업회계기준 제20장(자산손상) 문단 20.8에 따르면 자산의 진부화 및 시장가치의\n급격한 하락 등으로 인하여 자산의 회수가능액이 장부금액에 중요하게 미달하게 되는\n경우에는 장부금액을 회수가능액으로 조정하고 그 차액을 손상차손으로 처리하도록\n규정되어 있음\n한국공인회계사회는 상기 회계기준 등을 고려하여, 자산의 진부화 및 시장가치의 급격한\n하락 등으로 인하여 회사의 개발비 회수가능액이 장부금액에 중요하게 미달하게 되는\n경우에 해당하였음에도 손상차손을 인식하지 아니하여 회계처리 오류가 발생한 것으로\n판단하였음"
        },
        "section_4_audit_procedure": {
          "section_title": "감사절차 미흡사항",
          "content": "동 지적사례는 재무제표에 대한 심사로 종결되어 감사보고서 감리는 실시하지 아니함"
        },
        "section_5_implications": {
          "section_title": "시사점",
          "content": "회사는 개발비와 관련하여 자산의 진부화 및 시장가치의 급격한 하락 여부 등을 종합적\n으로 검토하는 내부통제를 구축하여야 하며 자산의 회수가능액이 장부금액에 중요하게\n미달하게 되는 경우에는 장부금액을 회수가능액으로 조정하고 그 차액을 손상차손으로\n인식하여야 함\n- 36 -"
        }
      },
      "indexed_content": "케이스 ID: KICPA-2025-22\n제목: 개발비 손상차손 미인식\n결정연도: 2025년\n회계결산일: ’21.1.1.∼’23.12.31.\n1. 회사의 회계처리\n회사는 산하 연구소를 통해 개발 프로젝트를 진행하고 있으며, 개발단계에서 발생한\n비용을 자산화하고 상각하고 있음. 일부 개발 프로젝트의 경우 관련 매출이 거의 발생\n하지 않거나 정부사업 중단 등으로 손상이 발생했음에도 프로젝트별 품목의 사업 전망을\n낙관적으로 전망하고 개발비에 대한 손상차손을 인식하지 않음\n- 35 -\n2. 회계기준 위반 지적 내용\n회사는 매출 부진 등으로 손상이 발생한 개발비에 대해 손상차손을 인식하지 아니하여\n개발비를 과대계상함\n3. 지적 근거 및 판단 내용\n일반기업회계기준 제20장(자산손상) 문단 20.8에 따르면 자산의 진부화 및 시장가치의\n급격한 하락 등으로 인하여 자산의 회수가능액이 장부금액에 중요하게 미달하게 되는\n경우에는 장부금액을 회수가능액으로 조정하고 그 차액을 손상차손으로 처리하도록\n규정되어 있음\n한국공인회계사회는 상기 회계기준 등을 고려하여, 자산의 진부화 및 시장가치의 급격한\n하락 등으로 인하여 회사의 개발비 회수가능액이 장부금액에 중요하게 미달하게 되는\n경우에 해당하였음에도 손상차손을 인식하지 아니하여 회계처리 오류가 발생한 것으로\n판단하였음\n4. 감사절차 미흡사항\n동 지적사례는 재무제표에 대한 심사로 종결되어 감사보고서 감리는 실시하지 아니함\n5. 시사점\n회사는 개발비와 관련하여 자산의 진부화 및 시장가치의 급격한 하락 여부 등을 종합적\n으로 검토하는 내부통제를 구축하여야 하며 자산의 회수가능액이 장부금액에 중요하게\n미달하게 되는 경우에는 장부금액을 회수가능액으로 조정하고 그 차액을 손상차손으로\n인식하여야 함\n- 36 -\n쟁점분야: 개발비 손상\n관련기준: 일반기업회계기준 제20장(자산손상)\n\n회사의 회계처리:\n회사는 산하 연구소를 통해 개발 프로젝트를 진행하고 있으며, 개발단계에서 발생한\n비용을 자산화하고 상각하고 있음. 일부 개발 프로젝트의 경우 관련 매출이 거의 발생\n하지 않거나 정부사업 중단 등으로 손상이 발생했음에도 프로젝트별 품목의 사업 전망을\n낙관적으로 전망하고 개발비에 대한 손상차손을 인식하지 않음\n- 35 -\n\n회계기준 위반 지적 내용:\n회사는 매출 부진 등으로 손상이 발생한 개발비에 대해 손상차손을 인식하지 아니하여\n개발비를 과대계상함\n\n지적 근거 및 판단 내용:\n일반기업회계기준 제20장(자산손상) 문단 20.8에 따르면 자산의 진부화 및 시장가치의\n급격한 하락 등으로 인하여 자산의 회수가능액이 장부금액에 중요하게 미달하게 되는\n경우에는 장부금액을 회수가능액으로 조정하고 그 차액을 손상차손으로 처리하도록\n규정되어 있음\n한국공인회계사회는 상기 회계기준 등을 고려하여, 자산의 진부화 및 시장가치의 급격한\n하락 등으로 인하여 회사의 개발비 회수가능액이 장부금액에 중요하게 미달하게 되는\n경우에 해당하였음에도 손상차손을 인식하지 아니하여 회계처리 오류가 발생한 것으로\n판단하였음\n\n감사절차 미흡사항:\n동 지적사례는 재무제표에 대한 심사로 종결되어 감사보고서 감리는 실시하지 아니함\n\n시사점:\n회사는 개발비와 관련하여 자산의 진부화 및 시장가치의 급격한 하락 여부 등을 종합적\n으로 검토하는 내부통제를 구축하여야 하며 자산의 회수가능액이 장부금액에 중요하게\n미달하게 되는 경우에는 장부금액을 회수가능액으로 조정하고 그 차액을 손상차손으로\n인식하여야 함\n- 36 -"
    },
    {
      "paragraph_id": "KICPA-2025-23",
      "case_id": "KICPA-2025-23",
      "case_title": "유형자산 과대계상(감가상각 오류)",
      "metadata": {
        "decision_year": "2025",
        "accounting_period": "’21.1.1.∼’22.12.31.\n1. 회사의 회계처리\n회사는 자동차 부품의 제조·판매를 주업으로 하며, 개별재무제표 기준 총자산에서 유형\n자산이 50% 이상을 차지하고 있음. 회사는 ‘13년 결산 과정에서 보유 기계장치의 경제적\n특성을 반영하여 감가상각방법 및 내용연수를 변경(정률법(8년)→정액법(10년))함.\n이때 ‘13년 이전에 취득한 기계장치의 경과 사용기간을 고려하지 아니하고, ‘13년 기초\n장부금액에 정액법 상각률(10%)을 일괄 적용하여 감가상각비를 계상한 오류가 발생함.\n이로 인해 일부 자산은 내용연수(10년)가 경과한 이후에도 감가상각이 완료되지 않는\n상황이 발생하였고, 회사는 ‘22년 결산 당시 오류를 인지하였으나, 수정 과정에서 오류\n금액 전액을 ‘22년 당기손익(감가상각비)으로 일괄 반영함\n2. 회계기준 위반 지적 내용\n(‘21년 이전) ‘13년 결산시 기계장치의 감가상각방법 및 내용연수를 변경하면서, 기계\n장치별 취득 시점을 반영한 잔존내용연수에 따라 감가상각을 해야 함에도 불구하고,\n일괄적으로 정액률(10%)로 상각함으로써 회계처리 오류가 발생하였고, (‘22년) 동 오류를\n자진수정하는 과정에서 전기 이전 기간에 발생한 중대한 오류임에도 이를 관련 자산\n및 자본의 기초금액이 아닌 당기손익으로 잘못 반영하여 유형자산 및 재고자산, 자기\n자본을 과대계상함\n3. 지적 근거 및 판단 내용\n일반기업회계기준 제10장(유형자산) 문단 10.36에 따르면 유형자산의 내용연수는 자산\n으로부터 기대되는 효용에 따라 결정하도록 규정하고 있고, 제5장(회계정책, 회계추정의\n변경 및 오류) 문단 5.19에 따르면 전기 이전기간에 발생한 중대한 오류의 수정은 자산,\n부채 및 자본의 기초금액에 반영하고, 비교재무제표를 작성하는 경우 중대한 오류의\n영향을 받는 회계기간의 재무제표항목은 재작성하도록 규정하고 있음\n- 37 -\n한국공인회계사회는 상기 회계기준 등을 고려하여, 유형자산의 내용연수를 변경할 때\n자산으로부터 기대되는 효용을 고려하여 잔존내용연수를 재산정하고, 이를 기준으로\n감가상각하여야 하고, 전기 이전에 발생한 중대한 오류의 수정은 소급하여 수정하여야\n함에도 이를 오류를 인지한 연도의 당기손익으로 일괄 인식하여 연도별 유형자산 등이\n과대계상 되었다고 판단함\n4. 감사절차 미흡사항\n동 지적사례는 재무제표에 대한 심사로 종결되어 감사보고서 감리는 실시하지 아니함\n5. 시사점\n감가상각은 유형자산의 취득원가를 내용연수에 걸쳐 합리적이고 체계적인 방법으로\n배분하는 과정이므로 자산의 경제적 효익이 소멸되는 기간 및 형태를 적절히 반영할 수\n있도록 회계정책을 마련하여야 함.\n또한 감가상각방법이나 잔존가치·내용연수에 대한 추정이 변경되는 경우에는, 그 효과가\n재무제표에 적절히 반영될 수 있도록 면밀히 검토해야 하고, 당기에 발견한 전기 또는\n그 이전기간에 발생한 오류가 중대한 경우, 이를 자산, 부채 및 자본의 기초금액에 반영\n하고 비교재무제표를 재작성하여야 하므로, 중대한 오류 여부 판단 및 수정 회계처리에\n주의를 기울일 필요가 있음",
        "issue_fields": [
          "감가상각, 오류수정"
        ],
        "related_standards": [
          "일반기업회계기준 제5장(회계정책",
          "회계추정의 변경 및 오류)",
          "제10장\n(유형자산)"
        ],
        "case_type": "회계감리지적사례",
        "source": "KICPA 심사·감리 지적사례"
      },
      "content": {
        "section_1_company_accounting": {
          "section_title": "회사의 회계처리",
          "content": "회사는 자동차 부품의 제조·판매를 주업으로 하며, 개별재무제표 기준 총자산에서 유형\n자산이 50% 이상을 차지하고 있음. 회사는 ‘13년 결산 과정에서 보유 기계장치의 경제적\n특성을 반영하여 감가상각방법 및 내용연수를 변경(정률법(8년)→정액법(10년))함.\n이때 ‘13년 이전에 취득한 기계장치의 경과 사용기간을 고려하지 아니하고, ‘13년 기초\n장부금액에 정액법 상각률(10%)을 일괄 적용하여 감가상각비를 계상한 오류가 발생함.\n이로 인해 일부 자산은 내용연수(10년)가 경과한 이후에도 감가상각이 완료되지 않는\n상황이 발생하였고, 회사는 ‘22년 결산 당시 오류를 인지하였으나, 수정 과정에서 오류\n금액 전액을 ‘22년 당기손익(감가상각비)으로 일괄 반영함"
        },
        "section_2_violation_details": {
          "section_title": "회계기준 위반 지적 내용",
          "content": "(‘21년 이전) ‘13년 결산시 기계장치의 감가상각방법 및 내용연수를 변경하면서, 기계\n장치별 취득 시점을 반영한 잔존내용연수에 따라 감가상각을 해야 함에도 불구하고,\n일괄적으로 정액률(10%)로 상각함으로써 회계처리 오류가 발생하였고, (‘22년) 동 오류를\n자진수정하는 과정에서 전기 이전 기간에 발생한 중대한 오류임에도 이를 관련 자산\n및 자본의 기초금액이 아닌 당기손익으로 잘못 반영하여 유형자산 및 재고자산, 자기\n자본을 과대계상함"
        },
        "section_3_basis_judgment": {
          "section_title": "지적 근거 및 판단 내용",
          "content": "일반기업회계기준 제10장(유형자산) 문단 10.36에 따르면 유형자산의 내용연수는 자산\n으로부터 기대되는 효용에 따라 결정하도록 규정하고 있고, 제5장(회계정책, 회계추정의\n변경 및 오류) 문단 5.19에 따르면 전기 이전기간에 발생한 중대한 오류의 수정은 자산,\n부채 및 자본의 기초금액에 반영하고, 비교재무제표를 작성하는 경우 중대한 오류의\n영향을 받는 회계기간의 재무제표항목은 재작성하도록 규정하고 있음\n- 37 -\n한국공인회계사회는 상기 회계기준 등을 고려하여, 유형자산의 내용연수를 변경할 때\n자산으로부터 기대되는 효용을 고려하여 잔존내용연수를 재산정하고, 이를 기준으로\n감가상각하여야 하고, 전기 이전에 발생한 중대한 오류의 수정은 소급하여 수정하여야\n함에도 이를 오류를 인지한 연도의 당기손익으로 일괄 인식하여 연도별 유형자산 등이\n과대계상 되었다고 판단함"
        },
        "section_4_audit_procedure": {
          "section_title": "감사절차 미흡사항",
          "content": "동 지적사례는 재무제표에 대한 심사로 종결되어 감사보고서 감리는 실시하지 아니함"
        },
        "section_5_implications": {
          "section_title": "시사점",
          "content": "감가상각은 유형자산의 취득원가를 내용연수에 걸쳐 합리적이고 체계적인 방법으로\n배분하는 과정이므로 자산의 경제적 효익이 소멸되는 기간 및 형태를 적절히 반영할 수\n있도록 회계정책을 마련하여야 함.\n또한 감가상각방법이나 잔존가치·내용연수에 대한 추정이 변경되는 경우에는, 그 효과가\n재무제표에 적절히 반영될 수 있도록 면밀히 검토해야 하고, 당기에 발견한 전기 또는\n그 이전기간에 발생한 오류가 중대한 경우, 이를 자산, 부채 및 자본의 기초금액에 반영\n하고 비교재무제표를 재작성하여야 하므로, 중대한 오류 여부 판단 및 수정 회계처리에\n주의를 기울일 필요가 있음"
        }
      },
      "indexed_content": "케이스 ID: KICPA-2025-23\n제목: 유형자산 과대계상(감가상각 오류)\n결정연도: 2025년\n회계결산일: ’21.1.1.∼’22.12.31.\n1. 회사의 회계처리\n회사는 자동차 부품의 제조·판매를 주업으로 하며, 개별재무제표 기준 총자산에서 유형\n자산이 50% 이상을 차지하고 있음. 회사는 ‘13년 결산 과정에서 보유 기계장치의 경제적\n특성을 반영하여 감가상각방법 및 내용연수를 변경(정률법(8년)→정액법(10년))함.\n이때 ‘13년 이전에 취득한 기계장치의 경과 사용기간을 고려하지 아니하고, ‘13년 기초\n장부금액에 정액법 상각률(10%)을 일괄 적용하여 감가상각비를 계상한 오류가 발생함.\n이로 인해 일부 자산은 내용연수(10년)가 경과한 이후에도 감가상각이 완료되지 않는\n상황이 발생하였고, 회사는 ‘22년 결산 당시 오류를 인지하였으나, 수정 과정에서 오류\n금액 전액을 ‘22년 당기손익(감가상각비)으로 일괄 반영함\n2. 회계기준 위반 지적 내용\n(‘21년 이전) ‘13년 결산시 기계장치의 감가상각방법 및 내용연수를 변경하면서, 기계\n장치별 취득 시점을 반영한 잔존내용연수에 따라 감가상각을 해야 함에도 불구하고,\n일괄적으로 정액률(10%)로 상각함으로써 회계처리 오류가 발생하였고, (‘22년) 동 오류를\n자진수정하는 과정에서 전기 이전 기간에 발생한 중대한 오류임에도 이를 관련 자산\n및 자본의 기초금액이 아닌 당기손익으로 잘못 반영하여 유형자산 및 재고자산, 자기\n자본을 과대계상함\n3. 지적 근거 및 판단 내용\n일반기업회계기준 제10장(유형자산) 문단 10.36에 따르면 유형자산의 내용연수는 자산\n으로부터 기대되는 효용에 따라 결정하도록 규정하고 있고, 제5장(회계정책, 회계추정의\n변경 및 오류) 문단 5.19에 따르면 전기 이전기간에 발생한 중대한 오류의 수정은 자산,\n부채 및 자본의 기초금액에 반영하고, 비교재무제표를 작성하는 경우 중대한 오류의\n영향을 받는 회계기간의 재무제표항목은 재작성하도록 규정하고 있음\n- 37 -\n한국공인회계사회는 상기 회계기준 등을 고려하여, 유형자산의 내용연수를 변경할 때\n자산으로부터 기대되는 효용을 고려하여 잔존내용연수를 재산정하고, 이를 기준으로\n감가상각하여야 하고, 전기 이전에 발생한 중대한 오류의 수정은 소급하여 수정하여야\n함에도 이를 오류를 인지한 연도의 당기손익으로 일괄 인식하여 연도별 유형자산 등이\n과대계상 되었다고 판단함\n4. 감사절차 미흡사항\n동 지적사례는 재무제표에 대한 심사로 종결되어 감사보고서 감리는 실시하지 아니함\n5. 시사점\n감가상각은 유형자산의 취득원가를 내용연수에 걸쳐 합리적이고 체계적인 방법으로\n배분하는 과정이므로 자산의 경제적 효익이 소멸되는 기간 및 형태를 적절히 반영할 수\n있도록 회계정책을 마련하여야 함.\n또한 감가상각방법이나 잔존가치·내용연수에 대한 추정이 변경되는 경우에는, 그 효과가\n재무제표에 적절히 반영될 수 있도록 면밀히 검토해야 하고, 당기에 발견한 전기 또는\n그 이전기간에 발생한 오류가 중대한 경우, 이를 자산, 부채 및 자본의 기초금액에 반영\n하고 비교재무제표를 재작성하여야 하므로, 중대한 오류 여부 판단 및 수정 회계처리에\n주의를 기울일 필요가 있음\n쟁점분야: 감가상각, 오류수정\n관련기준: 일반기업회계기준 제5장(회계정책, 회계추정의 변경 및 오류), 제10장\n(유형자산)\n\n회사의 회계처리:\n회사는 자동차 부품의 제조·판매를 주업으로 하며, 개별재무제표 기준 총자산에서 유형\n자산이 50% 이상을 차지하고 있음. 회사는 ‘13년 결산 과정에서 보유 기계장치의 경제적\n특성을 반영하여 감가상각방법 및 내용연수를 변경(정률법(8년)→정액법(10년))함.\n이때 ‘13년 이전에 취득한 기계장치의 경과 사용기간을 고려하지 아니하고, ‘13년 기초\n장부금액에 정액법 상각률(10%)을 일괄 적용하여 감가상각비를 계상한 오류가 발생함.\n이로 인해 일부 자산은 내용연수(10년)가 경과한 이후에도 감가상각이 완료되지 않는\n상황이 발생하였고, 회사는 ‘22년 결산 당시 오류를 인지하였으나, 수정 과정에서 오류\n금액 전액을 ‘22년 당기손익(감가상각비)으로 일괄 반영함\n\n회계기준 위반 지적 내용:\n(‘21년 이전) ‘13년 결산시 기계장치의 감가상각방법 및 내용연수를 변경하면서, 기계\n장치별 취득 시점을 반영한 잔존내용연수에 따라 감가상각을 해야 함에도 불구하고,\n일괄적으로 정액률(10%)로 상각함으로써 회계처리 오류가 발생하였고, (‘22년) 동 오류를\n자진수정하는 과정에서 전기 이전 기간에 발생한 중대한 오류임에도 이를 관련 자산\n및 자본의 기초금액이 아닌 당기손익으로 잘못 반영하여 유형자산 및 재고자산, 자기\n자본을 과대계상함\n\n지적 근거 및 판단 내용:\n일반기업회계기준 제10장(유형자산) 문단 10.36에 따르면 유형자산의 내용연수는 자산\n으로부터 기대되는 효용에 따라 결정하도록 규정하고 있고, 제5장(회계정책, 회계추정의\n변경 및 오류) 문단 5.19에 따르면 전기 이전기간에 발생한 중대한 오류의 수정은 자산,\n부채 및 자본의 기초금액에 반영하고, 비교재무제표를 작성하는 경우 중대한 오류의\n영향을 받는 회계기간의 재무제표항목은 재작성하도록 규정하고 있음\n- 37 -\n한국공인회계사회는 상기 회계기준 등을 고려하여, 유형자산의 내용연수를 변경할 때\n자산으로부터 기대되는 효용을 고려하여 잔존내용연수를 재산정하고, 이를 기준으로\n감가상각하여야 하고, 전기 이전에 발생한 중대한 오류의 수정은 소급하여 수정하여야\n함에도 이를 오류를 인지한 연도의 당기손익으로 일괄 인식하여 연도별 유형자산 등이\n과대계상 되었다고 판단함\n\n감사절차 미흡사항:\n동 지적사례는 재무제표에 대한 심사로 종결되어 감사보고서 감리는 실시하지 아니함\n\n시사점:\n감가상각은 유형자산의 취득원가를 내용연수에 걸쳐 합리적이고 체계적인 방법으로\n배분하는 과정이므로 자산의 경제적 효익이 소멸되는 기간 및 형태를 적절히 반영할 수\n있도록 회계정책을 마련하여야 함.\n또한 감가상각방법이나 잔존가치·내용연수에 대한 추정이 변경되는 경우에는, 그 효과가\n재무제표에 적절히 반영될 수 있도록 면밀히 검토해야 하고, 당기에 발견한 전기 또는\n그 이전기간에 발생한 오류가 중대한 경우, 이를 자산, 부채 및 자본의 기초금액에 반영\n하고 비교재무제표를 재작성하여야 하므로, 중대한 오류 여부 판단 및 수정 회계처리에\n주의를 기울일 필요가 있음"
    },
    {
      "paragraph_id": "KICPA-2025-24",
      "case_id": "KICPA-2025-24",
      "case_title": "유형자산 과소계상(차입원가자본화 오류)",
      "metadata": {
        "decision_year": "2025",
        "accounting_period": "’22.1.1.∼’23.12.31.\n1. 회사의 회계처리\n회사는 ’20년 9월 중 A사가 시행하고 회사가 시공사로 참여한 B호텔 신축공사 도급계약을\n해지하고, 향후 호텔을 운영할 목적으로 A사로부터 쟁점 호텔 토지 및 건설 중인 건물을\n매수하여 건설중인자산으로 계상함. 이후 공사 완료시까지 동 자산의 건설을 위해 실행한\n- 38 -\n특정차입금으로부터 발생한 차입원가는 자본화(건설중인자산으로 인식)하였으나, 건설과\n직접적으로 관련 있는 특정차입금 외 일반 목적으로 차입한 자금 중 적격자산의 취득에\n소요되었다고 볼 수 있는 자금(일반차입금)에 대한 차입원가는 전액 기간비용(이자비용)\n으로 인식함\n2. 회계기준 위반 지적 내용\nB호텔 건설을 목적으로 직접 차입한 특정차입금 관련 차입원가는 자본화하였으나, 일반 목적\n으로 차입한 자금(일반차입금) 중 적격자산(B호텔)의 취득에 소요된 차입원가에 대해서는 자본화가\n아닌 기간비용(이자비용)으로 잘못 인식함에 따라 유형자산 및 자기자본을 과소계상함\n3. 지적 근거 및 판단 내용\n일반기업회계기준 제18장(차입원가자본화) 문단 18.6 및 18.9에 따르면 차입원가를 자본화\n하는 경우 적격자산을 취득할 목적으로 차입한 특정차입금에 대한 차입원가와 일반적인\n목적으로 차입한 자금 중 적격자산의 취득에 소요되었다고 볼 수 있는 자금(일반차입금)에\n대한 차입원가로 나누어 자본화하도록 하고 있고,\n일반차입금에 대한 차입원가 중 자본화할 수 있는 차입원가는 회계기간 동안의 적격\n자산에 대한 평균지출액 중 특정차입금을 사용한 평균지출액을 초과하는 부분에 대해\n적절한 이자율을 적용하는 방식으로 산정하도록 규정하고 있음\n한국공인회계사회는 차입원가를 자본화하는 경우, 차입원가 중 일부에 대해서만 자본화\n하거나, 특정차입금 관련 차입원가에 대해서만 자본화할 수 없고, 일반 목적으로 차입한\n자금(일반차입금) 중 적격자산의 취득에 소요된 차입원가에 대해서도 자본화 하여야\n하나, 이를 기간비용(이자비용)으로 잘못 인식하여 유형자산이 과소계상되었다고 판단함\n4. 감사절차 미흡사항\n동 지적사례는 재무제표에 대한 심사로 종결되어 감사보고서 감리는 실시하지 아니함\n5. 시사점\n회사는 차입원가를 자본화하는 경우, 자본화 대상 자산을 명확히 정의하고, 차입금 및 관련\n이자비용을 사용목적별로 구분 관리하여야 하며, 특정차입금 외 일반차입금이 있는 경우,\n자본화대상자산에 대한 평균지출액 중 특정차입금을 초과하는 부분에 대한 자본화가 필요\n하므로, 프로젝트별 전용 계좌 사용, 프로젝트 코드별 전표 생성 등을 통해 현장별 공사비\n지출 금액이 적정하게 집계될 수 있도록 관리하여야 함\n- 39 -",
        "issue_fields": [
          "차입원가 자본화"
        ],
        "related_standards": [
          "일반기업회계기준 제18장(차입원가자본화)"
        ],
        "case_type": "회계감리지적사례",
        "source": "KICPA 심사·감리 지적사례"
      },
      "content": {
        "section_1_company_accounting": {
          "section_title": "회사의 회계처리",
          "content": "회사는 ’20년 9월 중 A사가 시행하고 회사가 시공사로 참여한 B호텔 신축공사 도급계약을\n해지하고, 향후 호텔을 운영할 목적으로 A사로부터 쟁점 호텔 토지 및 건설 중인 건물을\n매수하여 건설중인자산으로 계상함. 이후 공사 완료시까지 동 자산의 건설을 위해 실행한\n- 38 -\n특정차입금으로부터 발생한 차입원가는 자본화(건설중인자산으로 인식)하였으나, 건설과\n직접적으로 관련 있는 특정차입금 외 일반 목적으로 차입한 자금 중 적격자산의 취득에\n소요되었다고 볼 수 있는 자금(일반차입금)에 대한 차입원가는 전액 기간비용(이자비용)\n으로 인식함"
        },
        "section_2_violation_details": {
          "section_title": "회계기준 위반 지적 내용",
          "content": "B호텔 건설을 목적으로 직접 차입한 특정차입금 관련 차입원가는 자본화하였으나, 일반 목적\n으로 차입한 자금(일반차입금) 중 적격자산(B호텔)의 취득에 소요된 차입원가에 대해서는 자본화가\n아닌 기간비용(이자비용)으로 잘못 인식함에 따라 유형자산 및 자기자본을 과소계상함"
        },
        "section_3_basis_judgment": {
          "section_title": "지적 근거 및 판단 내용",
          "content": "일반기업회계기준 제18장(차입원가자본화) 문단 18.6 및 18.9에 따르면 차입원가를 자본화\n하는 경우 적격자산을 취득할 목적으로 차입한 특정차입금에 대한 차입원가와 일반적인\n목적으로 차입한 자금 중 적격자산의 취득에 소요되었다고 볼 수 있는 자금(일반차입금)에\n대한 차입원가로 나누어 자본화하도록 하고 있고,\n일반차입금에 대한 차입원가 중 자본화할 수 있는 차입원가는 회계기간 동안의 적격\n자산에 대한 평균지출액 중 특정차입금을 사용한 평균지출액을 초과하는 부분에 대해\n적절한 이자율을 적용하는 방식으로 산정하도록 규정하고 있음\n한국공인회계사회는 차입원가를 자본화하는 경우, 차입원가 중 일부에 대해서만 자본화\n하거나, 특정차입금 관련 차입원가에 대해서만 자본화할 수 없고, 일반 목적으로 차입한\n자금(일반차입금) 중 적격자산의 취득에 소요된 차입원가에 대해서도 자본화 하여야\n하나, 이를 기간비용(이자비용)으로 잘못 인식하여 유형자산이 과소계상되었다고 판단함"
        },
        "section_4_audit_procedure": {
          "section_title": "감사절차 미흡사항",
          "content": "동 지적사례는 재무제표에 대한 심사로 종결되어 감사보고서 감리는 실시하지 아니함"
        },
        "section_5_implications": {
          "section_title": "시사점",
          "content": "회사는 차입원가를 자본화하는 경우, 자본화 대상 자산을 명확히 정의하고, 차입금 및 관련\n이자비용을 사용목적별로 구분 관리하여야 하며, 특정차입금 외 일반차입금이 있는 경우,\n자본화대상자산에 대한 평균지출액 중 특정차입금을 초과하는 부분에 대한 자본화가 필요\n하므로, 프로젝트별 전용 계좌 사용, 프로젝트 코드별 전표 생성 등을 통해 현장별 공사비\n지출 금액이 적정하게 집계될 수 있도록 관리하여야 함\n- 39 -"
        }
      },
      "indexed_content": "케이스 ID: KICPA-2025-24\n제목: 유형자산 과소계상(차입원가자본화 오류)\n결정연도: 2025년\n회계결산일: ’22.1.1.∼’23.12.31.\n1. 회사의 회계처리\n회사는 ’20년 9월 중 A사가 시행하고 회사가 시공사로 참여한 B호텔 신축공사 도급계약을\n해지하고, 향후 호텔을 운영할 목적으로 A사로부터 쟁점 호텔 토지 및 건설 중인 건물을\n매수하여 건설중인자산으로 계상함. 이후 공사 완료시까지 동 자산의 건설을 위해 실행한\n- 38 -\n특정차입금으로부터 발생한 차입원가는 자본화(건설중인자산으로 인식)하였으나, 건설과\n직접적으로 관련 있는 특정차입금 외 일반 목적으로 차입한 자금 중 적격자산의 취득에\n소요되었다고 볼 수 있는 자금(일반차입금)에 대한 차입원가는 전액 기간비용(이자비용)\n으로 인식함\n2. 회계기준 위반 지적 내용\nB호텔 건설을 목적으로 직접 차입한 특정차입금 관련 차입원가는 자본화하였으나, 일반 목적\n으로 차입한 자금(일반차입금) 중 적격자산(B호텔)의 취득에 소요된 차입원가에 대해서는 자본화가\n아닌 기간비용(이자비용)으로 잘못 인식함에 따라 유형자산 및 자기자본을 과소계상함\n3. 지적 근거 및 판단 내용\n일반기업회계기준 제18장(차입원가자본화) 문단 18.6 및 18.9에 따르면 차입원가를 자본화\n하는 경우 적격자산을 취득할 목적으로 차입한 특정차입금에 대한 차입원가와 일반적인\n목적으로 차입한 자금 중 적격자산의 취득에 소요되었다고 볼 수 있는 자금(일반차입금)에\n대한 차입원가로 나누어 자본화하도록 하고 있고,\n일반차입금에 대한 차입원가 중 자본화할 수 있는 차입원가는 회계기간 동안의 적격\n자산에 대한 평균지출액 중 특정차입금을 사용한 평균지출액을 초과하는 부분에 대해\n적절한 이자율을 적용하는 방식으로 산정하도록 규정하고 있음\n한국공인회계사회는 차입원가를 자본화하는 경우, 차입원가 중 일부에 대해서만 자본화\n하거나, 특정차입금 관련 차입원가에 대해서만 자본화할 수 없고, 일반 목적으로 차입한\n자금(일반차입금) 중 적격자산의 취득에 소요된 차입원가에 대해서도 자본화 하여야\n하나, 이를 기간비용(이자비용)으로 잘못 인식하여 유형자산이 과소계상되었다고 판단함\n4. 감사절차 미흡사항\n동 지적사례는 재무제표에 대한 심사로 종결되어 감사보고서 감리는 실시하지 아니함\n5. 시사점\n회사는 차입원가를 자본화하는 경우, 자본화 대상 자산을 명확히 정의하고, 차입금 및 관련\n이자비용을 사용목적별로 구분 관리하여야 하며, 특정차입금 외 일반차입금이 있는 경우,\n자본화대상자산에 대한 평균지출액 중 특정차입금을 초과하는 부분에 대한 자본화가 필요\n하므로, 프로젝트별 전용 계좌 사용, 프로젝트 코드별 전표 생성 등을 통해 현장별 공사비\n지출 금액이 적정하게 집계될 수 있도록 관리하여야 함\n- 39 -\n쟁점분야: 차입원가 자본화\n관련기준: 일반기업회계기준 제18장(차입원가자본화)\n\n회사의 회계처리:\n회사는 ’20년 9월 중 A사가 시행하고 회사가 시공사로 참여한 B호텔 신축공사 도급계약을\n해지하고, 향후 호텔을 운영할 목적으로 A사로부터 쟁점 호텔 토지 및 건설 중인 건물을\n매수하여 건설중인자산으로 계상함. 이후 공사 완료시까지 동 자산의 건설을 위해 실행한\n- 38 -\n특정차입금으로부터 발생한 차입원가는 자본화(건설중인자산으로 인식)하였으나, 건설과\n직접적으로 관련 있는 특정차입금 외 일반 목적으로 차입한 자금 중 적격자산의 취득에\n소요되었다고 볼 수 있는 자금(일반차입금)에 대한 차입원가는 전액 기간비용(이자비용)\n으로 인식함\n\n회계기준 위반 지적 내용:\nB호텔 건설을 목적으로 직접 차입한 특정차입금 관련 차입원가는 자본화하였으나, 일반 목적\n으로 차입한 자금(일반차입금) 중 적격자산(B호텔)의 취득에 소요된 차입원가에 대해서는 자본화가\n아닌 기간비용(이자비용)으로 잘못 인식함에 따라 유형자산 및 자기자본을 과소계상함\n\n지적 근거 및 판단 내용:\n일반기업회계기준 제18장(차입원가자본화) 문단 18.6 및 18.9에 따르면 차입원가를 자본화\n하는 경우 적격자산을 취득할 목적으로 차입한 특정차입금에 대한 차입원가와 일반적인\n목적으로 차입한 자금 중 적격자산의 취득에 소요되었다고 볼 수 있는 자금(일반차입금)에\n대한 차입원가로 나누어 자본화하도록 하고 있고,\n일반차입금에 대한 차입원가 중 자본화할 수 있는 차입원가는 회계기간 동안의 적격\n자산에 대한 평균지출액 중 특정차입금을 사용한 평균지출액을 초과하는 부분에 대해\n적절한 이자율을 적용하는 방식으로 산정하도록 규정하고 있음\n한국공인회계사회는 차입원가를 자본화하는 경우, 차입원가 중 일부에 대해서만 자본화\n하거나, 특정차입금 관련 차입원가에 대해서만 자본화할 수 없고, 일반 목적으로 차입한\n자금(일반차입금) 중 적격자산의 취득에 소요된 차입원가에 대해서도 자본화 하여야\n하나, 이를 기간비용(이자비용)으로 잘못 인식하여 유형자산이 과소계상되었다고 판단함\n\n감사절차 미흡사항:\n동 지적사례는 재무제표에 대한 심사로 종결되어 감사보고서 감리는 실시하지 아니함\n\n시사점:\n회사는 차입원가를 자본화하는 경우, 자본화 대상 자산을 명확히 정의하고, 차입금 및 관련\n이자비용을 사용목적별로 구분 관리하여야 하며, 특정차입금 외 일반차입금이 있는 경우,\n자본화대상자산에 대한 평균지출액 중 특정차입금을 초과하는 부분에 대한 자본화가 필요\n하므로, 프로젝트별 전용 계좌 사용, 프로젝트 코드별 전표 생성 등을 통해 현장별 공사비\n지출 금액이 적정하게 집계될 수 있도록 관리하여야 함\n- 39 -"
    },
    {
      "paragraph_id": "KICPA-2025-25",
      "case_id": "KICPA-2025-25",
      "case_title": "금융상품 계정분류 오류(환매조건부채권, 파생결합증권)",
      "metadata": {
        "decision_year": "2025",
        "accounting_period": "’22.1.1.∼’23.12.31.\n1. 회사의 회계처리\n회사는 증권 계좌를 통해 유보자금을 다양한 금융상품에 투자하면서, 환매조건부채권\n(RP, 취득 당시 만기가 3개월 이내)과 증권 계좌 예치금을 매도가능증권으로 분류하고\n관련 환율변동(외화환산)효과를 기타포괄손익으로 인식함. 또한 주가연계 파생결합증권\n(ELS, ELB)의 경우에도, 파생결합증권에 포함된 내재파생상품을 주계약과 분리하지 않은 채\n전체를 매도가능증권으로 분류하고, 공정가치 변동을 당기손익이 아닌 기타포괄손익으로\n인식함\n2. 회계기준 위반 지적 내용\n회사는 금융상품의 경제적 특성과 위험은 고려하지 않은 채 보유의도(투자수익 수취)나\n상품 만기 만을 고려하여 보유 중인 금융상품을 모두 매도가능증권으로 잘못 분류하고,\n관련 손익을 당기손익이 아닌 기타포괄손익으로 잘못 인식함\n3. 지적 근거 및 판단 내용\n일반기업회계기준 제2장(재무제표의 작성과 표시Ⅰ) 문단 2.35에 따르면, 현금및현금성\n자산은 통화대용증권과 당좌예금, 보통예금 및 거래비용 없이 현금으로 전환이 용이하고\n이자율 변동에 따른 가치변동의 위험이 경미한 금융상품으로서 취득 당시 만기일(또는\n상환일)이 3개월 이내인 것을 말하며, 기업의 유동성 판단에 중요한 정보이므로 별도\n항목으로 구분하여 표시하도록 규정하고 있고,\n일반기업회계기준 6장(금융자산·금융부채) 문단 6.14, 6.31 및 6.41에 따르면, 내재파생\n상품은 주계약의 경제적 특성 및 위험도와 명확하고 밀접한 관련성이 없는 등 요건을\n충족할 경우 주계약과 분리하여 회계처리하거나, 주계약과 분리하지 않은 경우 당기\n손익인식항목으로 지정하여 공정가치 변동을 당기손익으로 처리하도록 규정하고 있음\n- 40 -\n한국공인회계사회는 상기 회계기준을 고려하여, 회사가 보유 중인 환매조건부채권과\n예치금은 현금및현금성자산의 정의를 충족하며, 주가연계 파생결합증권은 주계약과 내재\n파생상품을 분리하거나, 전체를 당기손익인식지정항목으로 지정하여 관련 평가손익을\n당기손익으로 인식해야 한다고 판단함\n4. 감사절차 미흡사항\n동 지적사례는 재무제표에 대한 심사로 종결되어 감사보고서 감리는 실시하지 아니함\n5. 시사점\n금융상품의 구조가 고도화·다양화되는 환경에서, 회사는 금융상품 계정분류 관련 기준서를\n숙지하고, 개별 금융상품의 투자목적, 구조, 만기, 현금및현금성자산 해당 여부 등을 종합적\n으로 검토한 후 금융상품의 분류를 결정하여야 함",
        "issue_fields": [
          "금융상품 계정분류"
        ],
        "related_standards": [
          "일반기업회계기준 제2장(재무제표의 작성과 표시Ⅰ)",
          "제6장(금융자산·\n금융부채)"
        ],
        "case_type": "회계감리지적사례",
        "source": "KICPA 심사·감리 지적사례"
      },
      "content": {
        "section_1_company_accounting": {
          "section_title": "회사의 회계처리",
          "content": "회사는 증권 계좌를 통해 유보자금을 다양한 금융상품에 투자하면서, 환매조건부채권\n(RP, 취득 당시 만기가 3개월 이내)과 증권 계좌 예치금을 매도가능증권으로 분류하고\n관련 환율변동(외화환산)효과를 기타포괄손익으로 인식함. 또한 주가연계 파생결합증권\n(ELS, ELB)의 경우에도, 파생결합증권에 포함된 내재파생상품을 주계약과 분리하지 않은 채\n전체를 매도가능증권으로 분류하고, 공정가치 변동을 당기손익이 아닌 기타포괄손익으로\n인식함"
        },
        "section_2_violation_details": {
          "section_title": "회계기준 위반 지적 내용",
          "content": "회사는 금융상품의 경제적 특성과 위험은 고려하지 않은 채 보유의도(투자수익 수취)나\n상품 만기 만을 고려하여 보유 중인 금융상품을 모두 매도가능증권으로 잘못 분류하고,\n관련 손익을 당기손익이 아닌 기타포괄손익으로 잘못 인식함"
        },
        "section_3_basis_judgment": {
          "section_title": "지적 근거 및 판단 내용",
          "content": "일반기업회계기준 제2장(재무제표의 작성과 표시Ⅰ) 문단 2.35에 따르면, 현금및현금성\n자산은 통화대용증권과 당좌예금, 보통예금 및 거래비용 없이 현금으로 전환이 용이하고\n이자율 변동에 따른 가치변동의 위험이 경미한 금융상품으로서 취득 당시 만기일(또는\n상환일)이 3개월 이내인 것을 말하며, 기업의 유동성 판단에 중요한 정보이므로 별도\n항목으로 구분하여 표시하도록 규정하고 있고,\n일반기업회계기준 6장(금융자산·금융부채) 문단 6.14, 6.31 및 6.41에 따르면, 내재파생\n상품은 주계약의 경제적 특성 및 위험도와 명확하고 밀접한 관련성이 없는 등 요건을\n충족할 경우 주계약과 분리하여 회계처리하거나, 주계약과 분리하지 않은 경우 당기\n손익인식항목으로 지정하여 공정가치 변동을 당기손익으로 처리하도록 규정하고 있음\n- 40 -\n한국공인회계사회는 상기 회계기준을 고려하여, 회사가 보유 중인 환매조건부채권과\n예치금은 현금및현금성자산의 정의를 충족하며, 주가연계 파생결합증권은 주계약과 내재\n파생상품을 분리하거나, 전체를 당기손익인식지정항목으로 지정하여 관련 평가손익을\n당기손익으로 인식해야 한다고 판단함"
        },
        "section_4_audit_procedure": {
          "section_title": "감사절차 미흡사항",
          "content": "동 지적사례는 재무제표에 대한 심사로 종결되어 감사보고서 감리는 실시하지 아니함"
        },
        "section_5_implications": {
          "section_title": "시사점",
          "content": "금융상품의 구조가 고도화·다양화되는 환경에서, 회사는 금융상품 계정분류 관련 기준서를\n숙지하고, 개별 금융상품의 투자목적, 구조, 만기, 현금및현금성자산 해당 여부 등을 종합적\n으로 검토한 후 금융상품의 분류를 결정하여야 함"
        }
      },
      "indexed_content": "케이스 ID: KICPA-2025-25\n제목: 금융상품 계정분류 오류(환매조건부채권, 파생결합증권)\n결정연도: 2025년\n회계결산일: ’22.1.1.∼’23.12.31.\n1. 회사의 회계처리\n회사는 증권 계좌를 통해 유보자금을 다양한 금융상품에 투자하면서, 환매조건부채권\n(RP, 취득 당시 만기가 3개월 이내)과 증권 계좌 예치금을 매도가능증권으로 분류하고\n관련 환율변동(외화환산)효과를 기타포괄손익으로 인식함. 또한 주가연계 파생결합증권\n(ELS, ELB)의 경우에도, 파생결합증권에 포함된 내재파생상품을 주계약과 분리하지 않은 채\n전체를 매도가능증권으로 분류하고, 공정가치 변동을 당기손익이 아닌 기타포괄손익으로\n인식함\n2. 회계기준 위반 지적 내용\n회사는 금융상품의 경제적 특성과 위험은 고려하지 않은 채 보유의도(투자수익 수취)나\n상품 만기 만을 고려하여 보유 중인 금융상품을 모두 매도가능증권으로 잘못 분류하고,\n관련 손익을 당기손익이 아닌 기타포괄손익으로 잘못 인식함\n3. 지적 근거 및 판단 내용\n일반기업회계기준 제2장(재무제표의 작성과 표시Ⅰ) 문단 2.35에 따르면, 현금및현금성\n자산은 통화대용증권과 당좌예금, 보통예금 및 거래비용 없이 현금으로 전환이 용이하고\n이자율 변동에 따른 가치변동의 위험이 경미한 금융상품으로서 취득 당시 만기일(또는\n상환일)이 3개월 이내인 것을 말하며, 기업의 유동성 판단에 중요한 정보이므로 별도\n항목으로 구분하여 표시하도록 규정하고 있고,\n일반기업회계기준 6장(금융자산·금융부채) 문단 6.14, 6.31 및 6.41에 따르면, 내재파생\n상품은 주계약의 경제적 특성 및 위험도와 명확하고 밀접한 관련성이 없는 등 요건을\n충족할 경우 주계약과 분리하여 회계처리하거나, 주계약과 분리하지 않은 경우 당기\n손익인식항목으로 지정하여 공정가치 변동을 당기손익으로 처리하도록 규정하고 있음\n- 40 -\n한국공인회계사회는 상기 회계기준을 고려하여, 회사가 보유 중인 환매조건부채권과\n예치금은 현금및현금성자산의 정의를 충족하며, 주가연계 파생결합증권은 주계약과 내재\n파생상품을 분리하거나, 전체를 당기손익인식지정항목으로 지정하여 관련 평가손익을\n당기손익으로 인식해야 한다고 판단함\n4. 감사절차 미흡사항\n동 지적사례는 재무제표에 대한 심사로 종결되어 감사보고서 감리는 실시하지 아니함\n5. 시사점\n금융상품의 구조가 고도화·다양화되는 환경에서, 회사는 금융상품 계정분류 관련 기준서를\n숙지하고, 개별 금융상품의 투자목적, 구조, 만기, 현금및현금성자산 해당 여부 등을 종합적\n으로 검토한 후 금융상품의 분류를 결정하여야 함\n쟁점분야: 금융상품 계정분류\n관련기준: 일반기업회계기준 제2장(재무제표의 작성과 표시Ⅰ), 제6장(금융자산·\n금융부채)\n\n회사의 회계처리:\n회사는 증권 계좌를 통해 유보자금을 다양한 금융상품에 투자하면서, 환매조건부채권\n(RP, 취득 당시 만기가 3개월 이내)과 증권 계좌 예치금을 매도가능증권으로 분류하고\n관련 환율변동(외화환산)효과를 기타포괄손익으로 인식함. 또한 주가연계 파생결합증권\n(ELS, ELB)의 경우에도, 파생결합증권에 포함된 내재파생상품을 주계약과 분리하지 않은 채\n전체를 매도가능증권으로 분류하고, 공정가치 변동을 당기손익이 아닌 기타포괄손익으로\n인식함\n\n회계기준 위반 지적 내용:\n회사는 금융상품의 경제적 특성과 위험은 고려하지 않은 채 보유의도(투자수익 수취)나\n상품 만기 만을 고려하여 보유 중인 금융상품을 모두 매도가능증권으로 잘못 분류하고,\n관련 손익을 당기손익이 아닌 기타포괄손익으로 잘못 인식함\n\n지적 근거 및 판단 내용:\n일반기업회계기준 제2장(재무제표의 작성과 표시Ⅰ) 문단 2.35에 따르면, 현금및현금성\n자산은 통화대용증권과 당좌예금, 보통예금 및 거래비용 없이 현금으로 전환이 용이하고\n이자율 변동에 따른 가치변동의 위험이 경미한 금융상품으로서 취득 당시 만기일(또는\n상환일)이 3개월 이내인 것을 말하며, 기업의 유동성 판단에 중요한 정보이므로 별도\n항목으로 구분하여 표시하도록 규정하고 있고,\n일반기업회계기준 6장(금융자산·금융부채) 문단 6.14, 6.31 및 6.41에 따르면, 내재파생\n상품은 주계약의 경제적 특성 및 위험도와 명확하고 밀접한 관련성이 없는 등 요건을\n충족할 경우 주계약과 분리하여 회계처리하거나, 주계약과 분리하지 않은 경우 당기\n손익인식항목으로 지정하여 공정가치 변동을 당기손익으로 처리하도록 규정하고 있음\n- 40 -\n한국공인회계사회는 상기 회계기준을 고려하여, 회사가 보유 중인 환매조건부채권과\n예치금은 현금및현금성자산의 정의를 충족하며, 주가연계 파생결합증권은 주계약과 내재\n파생상품을 분리하거나, 전체를 당기손익인식지정항목으로 지정하여 관련 평가손익을\n당기손익으로 인식해야 한다고 판단함\n\n감사절차 미흡사항:\n동 지적사례는 재무제표에 대한 심사로 종결되어 감사보고서 감리는 실시하지 아니함\n\n시사점:\n금융상품의 구조가 고도화·다양화되는 환경에서, 회사는 금융상품 계정분류 관련 기준서를\n숙지하고, 개별 금융상품의 투자목적, 구조, 만기, 현금및현금성자산 해당 여부 등을 종합적\n으로 검토한 후 금융상품의 분류를 결정하여야 함"
    },
    {
      "paragraph_id": "KICPA-2025-26",
      "case_id": "KICPA-2025-26",
      "case_title": "금융상품 과대계상(파생결합증권)",
      "metadata": {
        "decision_year": "2025",
        "accounting_period": "’22.1.1.∼’23.12.31.\n1. 회사의 회계처리\n회사는 ‘21년 중 HSCEI지수 등을 기초자산으로 하는 외화주가연계 파생결합증권(ELS)을\n매입한 후, 상품의 보유의도 만을 고려하여 이를 만기보유증권으로 분류하고, 매 기말\n공정가치 평가를 하지 않은 채 환율 변동에 따른 외화환산손익만을 인식하였고, ‘23년\n결산 시에는 HSCEI 지수가 지속적으로 하락하는 등 손상 징후가 있다고 판단하여 해약\n환급금 기준으로 손상차손을 일시에 인식함\n2. 회계기준 위반 지적 내용\n회사는 파생결합증권의 경제적 특성과 위험은 고려하지 않은 채 보유의도 만을 고려하여\n이를 만기보유증권으로 분류하고, (’22년) 공정가치 변동을 당기손익으로 인식하지 아니\n하였으며, (‘23년) 해약환급금 기준으로 손상차손을 일시에 인식함으로써 오류가 발생함\n- 41 -\n3. 지적 근거 및 판단 내용\n일반기업회계기준 제6장(금융자산·금융부채) 문단 6.14, 6.31 및 6.41에 따르면, 내재\n파생상품은 주계약의 경제적 특성 및 위험도와 명확하고 밀접한 관련성이 없는 등\n요건을 충족할 경우 주계약과 분리하여 회계처리하거나, 주계약과 분리하지 않는 경우\n당기손익인식항목으로 지정하여 공정가치 변동을 당기손익으로 처리하도록 규정하고\n있음\n한국공인회계사회는 상기 회계기준을 고려하여, 외화주가연계 파생결합증권은 주계약과\n내재파생상품을 분리하거나, 전체를 당기손익인식지정항목으로 지정하고 매 기말 공정\n가치로 평가하여, 관련 평가손익을 당기손익으로 인식해야 한다고 판단함\n4. 감사절차 미흡사항\n동 지적사례는 재무제표에 대한 심사로 종결되어 감사보고서 감리는 실시하지 아니함\n5. 시사점\n금융상품의 구조가 고도화·다양화되는 환경에서, 회사는 금융상품 계정분류 관련 기준서를\n숙지하고, 개별 금융상품의 투자목적, 구조, 만기 등을 종합적으로 검토한 후 금융상품의\n분류를 결정하고, 각 분류에 따라 후속측정하여야 함",
        "issue_fields": [
          "금융상품 평가"
        ],
        "related_standards": [
          "일반기업회계기준 제6장(금융자산·금융부채)"
        ],
        "case_type": "회계감리지적사례",
        "source": "KICPA 심사·감리 지적사례"
      },
      "content": {
        "section_1_company_accounting": {
          "section_title": "회사의 회계처리",
          "content": "회사는 ‘21년 중 HSCEI지수 등을 기초자산으로 하는 외화주가연계 파생결합증권(ELS)을\n매입한 후, 상품의 보유의도 만을 고려하여 이를 만기보유증권으로 분류하고, 매 기말\n공정가치 평가를 하지 않은 채 환율 변동에 따른 외화환산손익만을 인식하였고, ‘23년\n결산 시에는 HSCEI 지수가 지속적으로 하락하는 등 손상 징후가 있다고 판단하여 해약\n환급금 기준으로 손상차손을 일시에 인식함"
        },
        "section_2_violation_details": {
          "section_title": "회계기준 위반 지적 내용",
          "content": "회사는 파생결합증권의 경제적 특성과 위험은 고려하지 않은 채 보유의도 만을 고려하여\n이를 만기보유증권으로 분류하고, (’22년) 공정가치 변동을 당기손익으로 인식하지 아니\n하였으며, (‘23년) 해약환급금 기준으로 손상차손을 일시에 인식함으로써 오류가 발생함\n- 41 -"
        },
        "section_3_basis_judgment": {
          "section_title": "지적 근거 및 판단 내용",
          "content": "일반기업회계기준 제6장(금융자산·금융부채) 문단 6.14, 6.31 및 6.41에 따르면, 내재\n파생상품은 주계약의 경제적 특성 및 위험도와 명확하고 밀접한 관련성이 없는 등\n요건을 충족할 경우 주계약과 분리하여 회계처리하거나, 주계약과 분리하지 않는 경우\n당기손익인식항목으로 지정하여 공정가치 변동을 당기손익으로 처리하도록 규정하고\n있음\n한국공인회계사회는 상기 회계기준을 고려하여, 외화주가연계 파생결합증권은 주계약과\n내재파생상품을 분리하거나, 전체를 당기손익인식지정항목으로 지정하고 매 기말 공정\n가치로 평가하여, 관련 평가손익을 당기손익으로 인식해야 한다고 판단함"
        },
        "section_4_audit_procedure": {
          "section_title": "감사절차 미흡사항",
          "content": "동 지적사례는 재무제표에 대한 심사로 종결되어 감사보고서 감리는 실시하지 아니함"
        },
        "section_5_implications": {
          "section_title": "시사점",
          "content": "금융상품의 구조가 고도화·다양화되는 환경에서, 회사는 금융상품 계정분류 관련 기준서를\n숙지하고, 개별 금융상품의 투자목적, 구조, 만기 등을 종합적으로 검토한 후 금융상품의\n분류를 결정하고, 각 분류에 따라 후속측정하여야 함"
        }
      },
      "indexed_content": "케이스 ID: KICPA-2025-26\n제목: 금융상품 과대계상(파생결합증권)\n결정연도: 2025년\n회계결산일: ’22.1.1.∼’23.12.31.\n1. 회사의 회계처리\n회사는 ‘21년 중 HSCEI지수 등을 기초자산으로 하는 외화주가연계 파생결합증권(ELS)을\n매입한 후, 상품의 보유의도 만을 고려하여 이를 만기보유증권으로 분류하고, 매 기말\n공정가치 평가를 하지 않은 채 환율 변동에 따른 외화환산손익만을 인식하였고, ‘23년\n결산 시에는 HSCEI 지수가 지속적으로 하락하는 등 손상 징후가 있다고 판단하여 해약\n환급금 기준으로 손상차손을 일시에 인식함\n2. 회계기준 위반 지적 내용\n회사는 파생결합증권의 경제적 특성과 위험은 고려하지 않은 채 보유의도 만을 고려하여\n이를 만기보유증권으로 분류하고, (’22년) 공정가치 변동을 당기손익으로 인식하지 아니\n하였으며, (‘23년) 해약환급금 기준으로 손상차손을 일시에 인식함으로써 오류가 발생함\n- 41 -\n3. 지적 근거 및 판단 내용\n일반기업회계기준 제6장(금융자산·금융부채) 문단 6.14, 6.31 및 6.41에 따르면, 내재\n파생상품은 주계약의 경제적 특성 및 위험도와 명확하고 밀접한 관련성이 없는 등\n요건을 충족할 경우 주계약과 분리하여 회계처리하거나, 주계약과 분리하지 않는 경우\n당기손익인식항목으로 지정하여 공정가치 변동을 당기손익으로 처리하도록 규정하고\n있음\n한국공인회계사회는 상기 회계기준을 고려하여, 외화주가연계 파생결합증권은 주계약과\n내재파생상품을 분리하거나, 전체를 당기손익인식지정항목으로 지정하고 매 기말 공정\n가치로 평가하여, 관련 평가손익을 당기손익으로 인식해야 한다고 판단함\n4. 감사절차 미흡사항\n동 지적사례는 재무제표에 대한 심사로 종결되어 감사보고서 감리는 실시하지 아니함\n5. 시사점\n금융상품의 구조가 고도화·다양화되는 환경에서, 회사는 금융상품 계정분류 관련 기준서를\n숙지하고, 개별 금융상품의 투자목적, 구조, 만기 등을 종합적으로 검토한 후 금융상품의\n분류를 결정하고, 각 분류에 따라 후속측정하여야 함\n쟁점분야: 금융상품 평가\n관련기준: 일반기업회계기준 제6장(금융자산·금융부채)\n\n회사의 회계처리:\n회사는 ‘21년 중 HSCEI지수 등을 기초자산으로 하는 외화주가연계 파생결합증권(ELS)을\n매입한 후, 상품의 보유의도 만을 고려하여 이를 만기보유증권으로 분류하고, 매 기말\n공정가치 평가를 하지 않은 채 환율 변동에 따른 외화환산손익만을 인식하였고, ‘23년\n결산 시에는 HSCEI 지수가 지속적으로 하락하는 등 손상 징후가 있다고 판단하여 해약\n환급금 기준으로 손상차손을 일시에 인식함\n\n회계기준 위반 지적 내용:\n회사는 파생결합증권의 경제적 특성과 위험은 고려하지 않은 채 보유의도 만을 고려하여\n이를 만기보유증권으로 분류하고, (’22년) 공정가치 변동을 당기손익으로 인식하지 아니\n하였으며, (‘23년) 해약환급금 기준으로 손상차손을 일시에 인식함으로써 오류가 발생함\n- 41 -\n\n지적 근거 및 판단 내용:\n일반기업회계기준 제6장(금융자산·금융부채) 문단 6.14, 6.31 및 6.41에 따르면, 내재\n파생상품은 주계약의 경제적 특성 및 위험도와 명확하고 밀접한 관련성이 없는 등\n요건을 충족할 경우 주계약과 분리하여 회계처리하거나, 주계약과 분리하지 않는 경우\n당기손익인식항목으로 지정하여 공정가치 변동을 당기손익으로 처리하도록 규정하고\n있음\n한국공인회계사회는 상기 회계기준을 고려하여, 외화주가연계 파생결합증권은 주계약과\n내재파생상품을 분리하거나, 전체를 당기손익인식지정항목으로 지정하고 매 기말 공정\n가치로 평가하여, 관련 평가손익을 당기손익으로 인식해야 한다고 판단함\n\n감사절차 미흡사항:\n동 지적사례는 재무제표에 대한 심사로 종결되어 감사보고서 감리는 실시하지 아니함\n\n시사점:\n금융상품의 구조가 고도화·다양화되는 환경에서, 회사는 금융상품 계정분류 관련 기준서를\n숙지하고, 개별 금융상품의 투자목적, 구조, 만기 등을 종합적으로 검토한 후 금융상품의\n분류를 결정하고, 각 분류에 따라 후속측정하여야 함"
    },
    {
      "paragraph_id": "KICPA-2025-27",
      "case_id": "KICPA-2025-27",
      "case_title": "대여금 과소계상 및 유동성 분류 오류",
      "metadata": {
        "decision_year": "2025",
        "accounting_period": "’22.1.1.∼’23.12.31.\n1. 회사의 회계처리\n회사는 해외 소재 종속기업에 대한 외화(USD) 대여금을 매 보고기간말 마감환율로\n환산하여 평가하지 아니하고, 기중 대여금 회수 시에도 회수일의 환율로 환산한 원화\n금액을 대여금 장부금액에서 직접 차감하였음. 또한 보고기간종료일로부터 1년 이내에\n회수기일이 도래하는 대여금을 비유동자산(장기대여금)으로 분류함\n- 42 -\n2. 회계기준 위반 지적 내용\n종속기업에 대한 외화(USD) 대여금을 매 보고기간말 마감환율로 환산하지 아니하고,\n기중 대여금 회수 시 회수일의 환율로 환산한 원화금액을 대여금 장부금액에서 차감\n하는 방식으로 회계처리하여 외환차손익을 인식하지 않았으며, 보고기간종료일로부터\n1년 이내에 회수기일이 도래하는 대여금은 유동자산(단기대여금)으로 분류하여야 함에도\n이를 비유동자산(장기대여금)으로 잘못 분류하여 각 연도별 장·단기대여금을 과소(과대)\n계상하고, 자기자본을 과소계상함\n3. 지적 근거 및 판단 내용\n일반기업회계기준 제2장(재무제표의 작성과 표시Ⅰ수익) 문단 2.20과 2.21에 따르면 보고\n기간종료일로부터 1년 이내에 현금화 또는 실현될 것으로 예상되는 자산은 유동자산으로\n분류하도록 규정하고 있고,\n일반기업회계기준 제23장(환율변동효과) 문단 23.9와 23.10에 따르면 화폐성 외화항목은\n매 보고기간말 마감환율로 환산하고, 화폐성항목의 결제시점에 발생하는 외환차손익\n또는 화폐성항목의 환산에 사용한 환율이 회계기간 중 최초로 인식한 시점이나 전기의\n재무제표 환산시점의 환율과 다르기 때문에 발생하는 외화환산손익은 그 외환차이가\n발생하는 회계기간의 손익으로 인식하도록 규정하고 있음\n한국공인회계사회는 상기 회계기준 등을 고려하여, 외화대여금은 매 보고기간말 마감\n환율로 환산하여야 하고, 회수시점에 발생하는 외환차손익을 해당 기간의 당기손익으로\n인식하여야 하며, 대여금 중 보고기간종료일로부터 1년 이내에 회수될 것으로 예상되는\n금액은 유동자산으로 분류하여야 한다고 판단함\n4. 감사절차 미흡사항\n동 지적사례는 재무제표에 대한 심사로 종결되어 감사보고서 감리는 실시하지 아니함\n5. 시사점\n회사는 관련 기준서를 숙지하고, 외화거래가 발생한 경우 누락 없이 환산하고 발생한\n외환차이를 당기손익으로 인식할 수 있도록 주의를 기울여야 하며, 자금대여약정 상\n계약조건, 만기일 등 세부조항을 면밀히 파악하여 유동성 분류를 하여야 함\n- 43 -",
        "issue_fields": [
          "외화환산, 유동·비유동 계정분류"
        ],
        "related_standards": [
          "일반기업회계기준 제2장(재무제표의 작성과 표시Ⅰ)",
          "제23장(환율변동\n효과)"
        ],
        "case_type": "회계감리지적사례",
        "source": "KICPA 심사·감리 지적사례"
      },
      "content": {
        "section_1_company_accounting": {
          "section_title": "회사의 회계처리",
          "content": "회사는 해외 소재 종속기업에 대한 외화(USD) 대여금을 매 보고기간말 마감환율로\n환산하여 평가하지 아니하고, 기중 대여금 회수 시에도 회수일의 환율로 환산한 원화\n금액을 대여금 장부금액에서 직접 차감하였음. 또한 보고기간종료일로부터 1년 이내에\n회수기일이 도래하는 대여금을 비유동자산(장기대여금)으로 분류함\n- 42 -"
        },
        "section_2_violation_details": {
          "section_title": "회계기준 위반 지적 내용",
          "content": "종속기업에 대한 외화(USD) 대여금을 매 보고기간말 마감환율로 환산하지 아니하고,\n기중 대여금 회수 시 회수일의 환율로 환산한 원화금액을 대여금 장부금액에서 차감\n하는 방식으로 회계처리하여 외환차손익을 인식하지 않았으며, 보고기간종료일로부터\n1년 이내에 회수기일이 도래하는 대여금은 유동자산(단기대여금)으로 분류하여야 함에도\n이를 비유동자산(장기대여금)으로 잘못 분류하여 각 연도별 장·단기대여금을 과소(과대)\n계상하고, 자기자본을 과소계상함"
        },
        "section_3_basis_judgment": {
          "section_title": "지적 근거 및 판단 내용",
          "content": "일반기업회계기준 제2장(재무제표의 작성과 표시Ⅰ수익) 문단 2.20과 2.21에 따르면 보고\n기간종료일로부터 1년 이내에 현금화 또는 실현될 것으로 예상되는 자산은 유동자산으로\n분류하도록 규정하고 있고,\n일반기업회계기준 제23장(환율변동효과) 문단 23.9와 23.10에 따르면 화폐성 외화항목은\n매 보고기간말 마감환율로 환산하고, 화폐성항목의 결제시점에 발생하는 외환차손익\n또는 화폐성항목의 환산에 사용한 환율이 회계기간 중 최초로 인식한 시점이나 전기의\n재무제표 환산시점의 환율과 다르기 때문에 발생하는 외화환산손익은 그 외환차이가\n발생하는 회계기간의 손익으로 인식하도록 규정하고 있음\n한국공인회계사회는 상기 회계기준 등을 고려하여, 외화대여금은 매 보고기간말 마감\n환율로 환산하여야 하고, 회수시점에 발생하는 외환차손익을 해당 기간의 당기손익으로\n인식하여야 하며, 대여금 중 보고기간종료일로부터 1년 이내에 회수될 것으로 예상되는\n금액은 유동자산으로 분류하여야 한다고 판단함"
        },
        "section_4_audit_procedure": {
          "section_title": "감사절차 미흡사항",
          "content": "동 지적사례는 재무제표에 대한 심사로 종결되어 감사보고서 감리는 실시하지 아니함"
        },
        "section_5_implications": {
          "section_title": "시사점",
          "content": "회사는 관련 기준서를 숙지하고, 외화거래가 발생한 경우 누락 없이 환산하고 발생한\n외환차이를 당기손익으로 인식할 수 있도록 주의를 기울여야 하며, 자금대여약정 상\n계약조건, 만기일 등 세부조항을 면밀히 파악하여 유동성 분류를 하여야 함\n- 43 -"
        }
      },
      "indexed_content": "케이스 ID: KICPA-2025-27\n제목: 대여금 과소계상 및 유동성 분류 오류\n결정연도: 2025년\n회계결산일: ’22.1.1.∼’23.12.31.\n1. 회사의 회계처리\n회사는 해외 소재 종속기업에 대한 외화(USD) 대여금을 매 보고기간말 마감환율로\n환산하여 평가하지 아니하고, 기중 대여금 회수 시에도 회수일의 환율로 환산한 원화\n금액을 대여금 장부금액에서 직접 차감하였음. 또한 보고기간종료일로부터 1년 이내에\n회수기일이 도래하는 대여금을 비유동자산(장기대여금)으로 분류함\n- 42 -\n2. 회계기준 위반 지적 내용\n종속기업에 대한 외화(USD) 대여금을 매 보고기간말 마감환율로 환산하지 아니하고,\n기중 대여금 회수 시 회수일의 환율로 환산한 원화금액을 대여금 장부금액에서 차감\n하는 방식으로 회계처리하여 외환차손익을 인식하지 않았으며, 보고기간종료일로부터\n1년 이내에 회수기일이 도래하는 대여금은 유동자산(단기대여금)으로 분류하여야 함에도\n이를 비유동자산(장기대여금)으로 잘못 분류하여 각 연도별 장·단기대여금을 과소(과대)\n계상하고, 자기자본을 과소계상함\n3. 지적 근거 및 판단 내용\n일반기업회계기준 제2장(재무제표의 작성과 표시Ⅰ수익) 문단 2.20과 2.21에 따르면 보고\n기간종료일로부터 1년 이내에 현금화 또는 실현될 것으로 예상되는 자산은 유동자산으로\n분류하도록 규정하고 있고,\n일반기업회계기준 제23장(환율변동효과) 문단 23.9와 23.10에 따르면 화폐성 외화항목은\n매 보고기간말 마감환율로 환산하고, 화폐성항목의 결제시점에 발생하는 외환차손익\n또는 화폐성항목의 환산에 사용한 환율이 회계기간 중 최초로 인식한 시점이나 전기의\n재무제표 환산시점의 환율과 다르기 때문에 발생하는 외화환산손익은 그 외환차이가\n발생하는 회계기간의 손익으로 인식하도록 규정하고 있음\n한국공인회계사회는 상기 회계기준 등을 고려하여, 외화대여금은 매 보고기간말 마감\n환율로 환산하여야 하고, 회수시점에 발생하는 외환차손익을 해당 기간의 당기손익으로\n인식하여야 하며, 대여금 중 보고기간종료일로부터 1년 이내에 회수될 것으로 예상되는\n금액은 유동자산으로 분류하여야 한다고 판단함\n4. 감사절차 미흡사항\n동 지적사례는 재무제표에 대한 심사로 종결되어 감사보고서 감리는 실시하지 아니함\n5. 시사점\n회사는 관련 기준서를 숙지하고, 외화거래가 발생한 경우 누락 없이 환산하고 발생한\n외환차이를 당기손익으로 인식할 수 있도록 주의를 기울여야 하며, 자금대여약정 상\n계약조건, 만기일 등 세부조항을 면밀히 파악하여 유동성 분류를 하여야 함\n- 43 -\n쟁점분야: 외화환산, 유동·비유동 계정분류\n관련기준: 일반기업회계기준 제2장(재무제표의 작성과 표시Ⅰ), 제23장(환율변동\n효과)\n\n회사의 회계처리:\n회사는 해외 소재 종속기업에 대한 외화(USD) 대여금을 매 보고기간말 마감환율로\n환산하여 평가하지 아니하고, 기중 대여금 회수 시에도 회수일의 환율로 환산한 원화\n금액을 대여금 장부금액에서 직접 차감하였음. 또한 보고기간종료일로부터 1년 이내에\n회수기일이 도래하는 대여금을 비유동자산(장기대여금)으로 분류함\n- 42 -\n\n회계기준 위반 지적 내용:\n종속기업에 대한 외화(USD) 대여금을 매 보고기간말 마감환율로 환산하지 아니하고,\n기중 대여금 회수 시 회수일의 환율로 환산한 원화금액을 대여금 장부금액에서 차감\n하는 방식으로 회계처리하여 외환차손익을 인식하지 않았으며, 보고기간종료일로부터\n1년 이내에 회수기일이 도래하는 대여금은 유동자산(단기대여금)으로 분류하여야 함에도\n이를 비유동자산(장기대여금)으로 잘못 분류하여 각 연도별 장·단기대여금을 과소(과대)\n계상하고, 자기자본을 과소계상함\n\n지적 근거 및 판단 내용:\n일반기업회계기준 제2장(재무제표의 작성과 표시Ⅰ수익) 문단 2.20과 2.21에 따르면 보고\n기간종료일로부터 1년 이내에 현금화 또는 실현될 것으로 예상되는 자산은 유동자산으로\n분류하도록 규정하고 있고,\n일반기업회계기준 제23장(환율변동효과) 문단 23.9와 23.10에 따르면 화폐성 외화항목은\n매 보고기간말 마감환율로 환산하고, 화폐성항목의 결제시점에 발생하는 외환차손익\n또는 화폐성항목의 환산에 사용한 환율이 회계기간 중 최초로 인식한 시점이나 전기의\n재무제표 환산시점의 환율과 다르기 때문에 발생하는 외화환산손익은 그 외환차이가\n발생하는 회계기간의 손익으로 인식하도록 규정하고 있음\n한국공인회계사회는 상기 회계기준 등을 고려하여, 외화대여금은 매 보고기간말 마감\n환율로 환산하여야 하고, 회수시점에 발생하는 외환차손익을 해당 기간의 당기손익으로\n인식하여야 하며, 대여금 중 보고기간종료일로부터 1년 이내에 회수될 것으로 예상되는\n금액은 유동자산으로 분류하여야 한다고 판단함\n\n감사절차 미흡사항:\n동 지적사례는 재무제표에 대한 심사로 종결되어 감사보고서 감리는 실시하지 아니함\n\n시사점:\n회사는 관련 기준서를 숙지하고, 외화거래가 발생한 경우 누락 없이 환산하고 발생한\n외환차이를 당기손익으로 인식할 수 있도록 주의를 기울여야 하며, 자금대여약정 상\n계약조건, 만기일 등 세부조항을 면밀히 파악하여 유동성 분류를 하여야 함\n- 43 -"
    },
    {
      "paragraph_id": "KICPA-2025-28",
      "case_id": "KICPA-2025-28",
      "case_title": "매출채권과 관계사차입금 및 채무면제이익 과대계상",
      "metadata": {
        "decision_year": "2025",
        "accounting_period": "’20.1.1.~’22.12.31.\n1. 회사의 회계처리\n회사는 자동차 부품의 제조·판매업을 영위하는 비상장법인으로, ‘20년 지배주주 변경\n과정에서 회사가 보유한 해외 소재 특수관계자(舊 주주측에서 지분 50% 이상 보유,\n이하 ‘A’사)에 대한 매출채권을 회수하는 특약이 포함된 지분인수계약이 체결되었음\n이후 A사의 자금여력 부족 등으로 인해 특약상 회수 스케쥴에 따라 舊 주주가 지배하는\n회사(이하 ‘B’사)로부터 新 주주가 지배하는 회사(이하 ‘C’사)로 채권 대금이 입금되었고,\nC사는 이를 다시 회사에 입금하는 방식으로 매출채권을 우회 회수하였으나, 회사는\n관련 매출채권을 장부에서 제거하지 않은 채 C사와 공모하여 허위의 차입계약서를\n작성하고 동 채권회수 입금액을 관계사차입금으로 회계처리하였음\n한편 회사는 ’20년 결산 과정에서 환율변동으로 인해 거액의 외화환산손실 및 이에 따른\n당기순손실이 예상되자, 금융기관과의 차입약정(당기순이익 시현 조건 등)을 이행하기\n위한 목적으로 C사로 하여금 旣 계상한 관계사차입금의 일부를 면제한다는 취지의\n공문과 이사회의사록을 작성하도록 하고, 이에 근거하여 허위의 채무면제이익을 인식\n하는 방법으로 이익을 조작함\n또한 회사는 ‘21년 결산시 A사 매출채권이 이미 회수된 사실을 은폐하기 위하여, A사\n와의 매출채권 결제특약에, 쟁점 매출채권을 장기성매출채권으로 정한 것처럼 내용을\n가첨하여 계약서를 변조하고, 이를 장기성매출채권으로 분류 후 현재가치할인차금을\n인식함\n2. 회계기준 위반 지적 내용\n실제로는 관계사를 통해 우회적으로 회수된 해외매출채권임에도 이를 장부에서 제거\n하지 않은 채 회수 대금을 차입금으로 회계처리한 후, 동 차입금 중 일부를 채무면제이익\n- 44 -\n으로 인식하는 방법으로 매출채권과 관계사차입금 및 채무면제이익을 과대계상함\n3. 지적 근거 및 판단 내용\n일반기업회계기준 제2장(재무제표의 작성과 표시Ⅰ) 문단2.7에 따르면, 재무제표는 경제적\n사실과 거래의 실질을 반영하여 기업의 재무상태, 경영성과, 현금흐름 및 자본변동을 공정\n하게 표시하여야 함\n한국공인회계사회는 상기 회계기준 등을 고려하여, 회사가 매출채권 회수사실을 은폐하고\n관계사와 허위계약을 체결하여 가공의 부채(차입금)를 계상하였으며, 이에 기반한 채무\n면제이익은 실질이 없는 것이므로, 회사의 재무제표는 기업의 재무상태, 경영성과를 공정\n하게 표시하지 못하였다고 판단함\n4. 감사절차 미흡사항\n감사인이 수행한 감사절차 등을 고려시, 이는 “다른 감사절차에 의하여도 위법가능성을\n전혀 의심할 수 없었거나, 회사의 진술에 의하지 아니하고는 당해 위법사실을 알 수 없는\n사항이라고 인정되는 때”에 해당한다고 판단되어 감사인에 대하여 지적하지 아니함\n감사인은 ① 쟁점 해외매출채권과 관련하여, 채권 외부조회, 장기성매출채권 분류 적정성\n검토 등 감사절차를 수행하고, ② 관계사차입금 및 채무면제이익과 관련하여, 차용증 및\n입출금 증빙 확인, 채무 외부조회, 회사의 이사회의사록 및 관계사의 채무면제이익 공문과\n관련 이사회의사록 검토 등 감사절차를 수행하였으나,\n회사가 거래의 실질을 파악할 수 있는 주요 계약의 내용을 감사인에게 의도적으로 알리지\n아니하고, 관계사와 공모하여 허위의 증빙을 작성하여 제출하거나 외부조회처로 하여금\n사실과 다른 회신을 하도록 요청하는 등 조직적으로 외부감사를 방해하여 감사인은 회사의\n해당 회계처리에 대해 특이사항을 발견할 수 없었음\n5. 시사점\n주주·채권자 등과의 투자계약에 여러 약정사항이 부가되는 경우가 많으며, 그 내용이 복잡·\n다양해지는 추세인 바, 회사는 주주 등과의 계약 내용을 면밀히 분석하여 경제적 실질에\n맞게 회계처리하고 필요한 경우 주석에 충실히 기재하여야 함\n감사인은 금융기관 차입약정 등으로 인해 당기순이익을 과대계상할 유인이 있는 회사를 감사\n하는 경우 회사가 제출한 감사증거의 경제적 실질 및 신뢰성 여부를 면밀히 검토하여야 함\n- 45 -\n2 자산‧부채, 수익‧비용 과대(소)계상(B유형)",
        "issue_fields": [
          "매출채권 및 관계사차입금"
        ],
        "related_standards": [
          "일반기업회계기준 제2장 (재무제표의 작성과 표시Ⅰ)"
        ],
        "case_type": "회계감리지적사례",
        "source": "KICPA 심사·감리 지적사례"
      },
      "content": {
        "section_1_company_accounting": {
          "section_title": "회사의 회계처리",
          "content": "회사는 자동차 부품의 제조·판매업을 영위하는 비상장법인으로, ‘20년 지배주주 변경\n과정에서 회사가 보유한 해외 소재 특수관계자(舊 주주측에서 지분 50% 이상 보유,\n이하 ‘A’사)에 대한 매출채권을 회수하는 특약이 포함된 지분인수계약이 체결되었음\n이후 A사의 자금여력 부족 등으로 인해 특약상 회수 스케쥴에 따라 舊 주주가 지배하는\n회사(이하 ‘B’사)로부터 新 주주가 지배하는 회사(이하 ‘C’사)로 채권 대금이 입금되었고,\nC사는 이를 다시 회사에 입금하는 방식으로 매출채권을 우회 회수하였으나, 회사는\n관련 매출채권을 장부에서 제거하지 않은 채 C사와 공모하여 허위의 차입계약서를\n작성하고 동 채권회수 입금액을 관계사차입금으로 회계처리하였음\n한편 회사는 ’20년 결산 과정에서 환율변동으로 인해 거액의 외화환산손실 및 이에 따른\n당기순손실이 예상되자, 금융기관과의 차입약정(당기순이익 시현 조건 등)을 이행하기\n위한 목적으로 C사로 하여금 旣 계상한 관계사차입금의 일부를 면제한다는 취지의\n공문과 이사회의사록을 작성하도록 하고, 이에 근거하여 허위의 채무면제이익을 인식\n하는 방법으로 이익을 조작함\n또한 회사는 ‘21년 결산시 A사 매출채권이 이미 회수된 사실을 은폐하기 위하여, A사\n와의 매출채권 결제특약에, 쟁점 매출채권을 장기성매출채권으로 정한 것처럼 내용을\n가첨하여 계약서를 변조하고, 이를 장기성매출채권으로 분류 후 현재가치할인차금을\n인식함"
        },
        "section_2_violation_details": {
          "section_title": "회계기준 위반 지적 내용",
          "content": "실제로는 관계사를 통해 우회적으로 회수된 해외매출채권임에도 이를 장부에서 제거\n하지 않은 채 회수 대금을 차입금으로 회계처리한 후, 동 차입금 중 일부를 채무면제이익\n- 44 -\n으로 인식하는 방법으로 매출채권과 관계사차입금 및 채무면제이익을 과대계상함"
        },
        "section_3_basis_judgment": {
          "section_title": "지적 근거 및 판단 내용",
          "content": "일반기업회계기준 제2장(재무제표의 작성과 표시Ⅰ) 문단2.7에 따르면, 재무제표는 경제적\n사실과 거래의 실질을 반영하여 기업의 재무상태, 경영성과, 현금흐름 및 자본변동을 공정\n하게 표시하여야 함\n한국공인회계사회는 상기 회계기준 등을 고려하여, 회사가 매출채권 회수사실을 은폐하고\n관계사와 허위계약을 체결하여 가공의 부채(차입금)를 계상하였으며, 이에 기반한 채무\n면제이익은 실질이 없는 것이므로, 회사의 재무제표는 기업의 재무상태, 경영성과를 공정\n하게 표시하지 못하였다고 판단함"
        },
        "section_4_audit_procedure": {
          "section_title": "감사절차 미흡사항",
          "content": "감사인이 수행한 감사절차 등을 고려시, 이는 “다른 감사절차에 의하여도 위법가능성을\n전혀 의심할 수 없었거나, 회사의 진술에 의하지 아니하고는 당해 위법사실을 알 수 없는\n사항이라고 인정되는 때”에 해당한다고 판단되어 감사인에 대하여 지적하지 아니함\n감사인은 ① 쟁점 해외매출채권과 관련하여, 채권 외부조회, 장기성매출채권 분류 적정성\n검토 등 감사절차를 수행하고, ② 관계사차입금 및 채무면제이익과 관련하여, 차용증 및\n입출금 증빙 확인, 채무 외부조회, 회사의 이사회의사록 및 관계사의 채무면제이익 공문과\n관련 이사회의사록 검토 등 감사절차를 수행하였으나,\n회사가 거래의 실질을 파악할 수 있는 주요 계약의 내용을 감사인에게 의도적으로 알리지\n아니하고, 관계사와 공모하여 허위의 증빙을 작성하여 제출하거나 외부조회처로 하여금\n사실과 다른 회신을 하도록 요청하는 등 조직적으로 외부감사를 방해하여 감사인은 회사의\n해당 회계처리에 대해 특이사항을 발견할 수 없었음"
        },
        "section_5_implications": {
          "section_title": "시사점",
          "content": "주주·채권자 등과의 투자계약에 여러 약정사항이 부가되는 경우가 많으며, 그 내용이 복잡·\n다양해지는 추세인 바, 회사는 주주 등과의 계약 내용을 면밀히 분석하여 경제적 실질에\n맞게 회계처리하고 필요한 경우 주석에 충실히 기재하여야 함\n감사인은 금융기관 차입약정 등으로 인해 당기순이익을 과대계상할 유인이 있는 회사를 감사\n하는 경우 회사가 제출한 감사증거의 경제적 실질 및 신뢰성 여부를 면밀히 검토하여야 함\n- 45 -\n2 자산‧부채, 수익‧비용 과대(소)계상(B유형)"
        }
      },
      "indexed_content": "케이스 ID: KICPA-2025-28\n제목: 매출채권과 관계사차입금 및 채무면제이익 과대계상\n결정연도: 2025년\n회계결산일: ’20.1.1.~’22.12.31.\n1. 회사의 회계처리\n회사는 자동차 부품의 제조·판매업을 영위하는 비상장법인으로, ‘20년 지배주주 변경\n과정에서 회사가 보유한 해외 소재 특수관계자(舊 주주측에서 지분 50% 이상 보유,\n이하 ‘A’사)에 대한 매출채권을 회수하는 특약이 포함된 지분인수계약이 체결되었음\n이후 A사의 자금여력 부족 등으로 인해 특약상 회수 스케쥴에 따라 舊 주주가 지배하는\n회사(이하 ‘B’사)로부터 新 주주가 지배하는 회사(이하 ‘C’사)로 채권 대금이 입금되었고,\nC사는 이를 다시 회사에 입금하는 방식으로 매출채권을 우회 회수하였으나, 회사는\n관련 매출채권을 장부에서 제거하지 않은 채 C사와 공모하여 허위의 차입계약서를\n작성하고 동 채권회수 입금액을 관계사차입금으로 회계처리하였음\n한편 회사는 ’20년 결산 과정에서 환율변동으로 인해 거액의 외화환산손실 및 이에 따른\n당기순손실이 예상되자, 금융기관과의 차입약정(당기순이익 시현 조건 등)을 이행하기\n위한 목적으로 C사로 하여금 旣 계상한 관계사차입금의 일부를 면제한다는 취지의\n공문과 이사회의사록을 작성하도록 하고, 이에 근거하여 허위의 채무면제이익을 인식\n하는 방법으로 이익을 조작함\n또한 회사는 ‘21년 결산시 A사 매출채권이 이미 회수된 사실을 은폐하기 위하여, A사\n와의 매출채권 결제특약에, 쟁점 매출채권을 장기성매출채권으로 정한 것처럼 내용을\n가첨하여 계약서를 변조하고, 이를 장기성매출채권으로 분류 후 현재가치할인차금을\n인식함\n2. 회계기준 위반 지적 내용\n실제로는 관계사를 통해 우회적으로 회수된 해외매출채권임에도 이를 장부에서 제거\n하지 않은 채 회수 대금을 차입금으로 회계처리한 후, 동 차입금 중 일부를 채무면제이익\n- 44 -\n으로 인식하는 방법으로 매출채권과 관계사차입금 및 채무면제이익을 과대계상함\n3. 지적 근거 및 판단 내용\n일반기업회계기준 제2장(재무제표의 작성과 표시Ⅰ) 문단2.7에 따르면, 재무제표는 경제적\n사실과 거래의 실질을 반영하여 기업의 재무상태, 경영성과, 현금흐름 및 자본변동을 공정\n하게 표시하여야 함\n한국공인회계사회는 상기 회계기준 등을 고려하여, 회사가 매출채권 회수사실을 은폐하고\n관계사와 허위계약을 체결하여 가공의 부채(차입금)를 계상하였으며, 이에 기반한 채무\n면제이익은 실질이 없는 것이므로, 회사의 재무제표는 기업의 재무상태, 경영성과를 공정\n하게 표시하지 못하였다고 판단함\n4. 감사절차 미흡사항\n감사인이 수행한 감사절차 등을 고려시, 이는 “다른 감사절차에 의하여도 위법가능성을\n전혀 의심할 수 없었거나, 회사의 진술에 의하지 아니하고는 당해 위법사실을 알 수 없는\n사항이라고 인정되는 때”에 해당한다고 판단되어 감사인에 대하여 지적하지 아니함\n감사인은 ① 쟁점 해외매출채권과 관련하여, 채권 외부조회, 장기성매출채권 분류 적정성\n검토 등 감사절차를 수행하고, ② 관계사차입금 및 채무면제이익과 관련하여, 차용증 및\n입출금 증빙 확인, 채무 외부조회, 회사의 이사회의사록 및 관계사의 채무면제이익 공문과\n관련 이사회의사록 검토 등 감사절차를 수행하였으나,\n회사가 거래의 실질을 파악할 수 있는 주요 계약의 내용을 감사인에게 의도적으로 알리지\n아니하고, 관계사와 공모하여 허위의 증빙을 작성하여 제출하거나 외부조회처로 하여금\n사실과 다른 회신을 하도록 요청하는 등 조직적으로 외부감사를 방해하여 감사인은 회사의\n해당 회계처리에 대해 특이사항을 발견할 수 없었음\n5. 시사점\n주주·채권자 등과의 투자계약에 여러 약정사항이 부가되는 경우가 많으며, 그 내용이 복잡·\n다양해지는 추세인 바, 회사는 주주 등과의 계약 내용을 면밀히 분석하여 경제적 실질에\n맞게 회계처리하고 필요한 경우 주석에 충실히 기재하여야 함\n감사인은 금융기관 차입약정 등으로 인해 당기순이익을 과대계상할 유인이 있는 회사를 감사\n하는 경우 회사가 제출한 감사증거의 경제적 실질 및 신뢰성 여부를 면밀히 검토하여야 함\n- 45 -\n2 자산‧부채, 수익‧비용 과대(소)계상(B유형)\n쟁점분야: 매출채권 및 관계사차입금\n관련기준: 일반기업회계기준 제2장 (재무제표의 작성과 표시Ⅰ)\n\n회사의 회계처리:\n회사는 자동차 부품의 제조·판매업을 영위하는 비상장법인으로, ‘20년 지배주주 변경\n과정에서 회사가 보유한 해외 소재 특수관계자(舊 주주측에서 지분 50% 이상 보유,\n이하 ‘A’사)에 대한 매출채권을 회수하는 특약이 포함된 지분인수계약이 체결되었음\n이후 A사의 자금여력 부족 등으로 인해 특약상 회수 스케쥴에 따라 舊 주주가 지배하는\n회사(이하 ‘B’사)로부터 新 주주가 지배하는 회사(이하 ‘C’사)로 채권 대금이 입금되었고,\nC사는 이를 다시 회사에 입금하는 방식으로 매출채권을 우회 회수하였으나, 회사는\n관련 매출채권을 장부에서 제거하지 않은 채 C사와 공모하여 허위의 차입계약서를\n작성하고 동 채권회수 입금액을 관계사차입금으로 회계처리하였음\n한편 회사는 ’20년 결산 과정에서 환율변동으로 인해 거액의 외화환산손실 및 이에 따른\n당기순손실이 예상되자, 금융기관과의 차입약정(당기순이익 시현 조건 등)을 이행하기\n위한 목적으로 C사로 하여금 旣 계상한 관계사차입금의 일부를 면제한다는 취지의\n공문과 이사회의사록을 작성하도록 하고, 이에 근거하여 허위의 채무면제이익을 인식\n하는 방법으로 이익을 조작함\n또한 회사는 ‘21년 결산시 A사 매출채권이 이미 회수된 사실을 은폐하기 위하여, A사\n와의 매출채권 결제특약에, 쟁점 매출채권을 장기성매출채권으로 정한 것처럼 내용을\n가첨하여 계약서를 변조하고, 이를 장기성매출채권으로 분류 후 현재가치할인차금을\n인식함\n\n회계기준 위반 지적 내용:\n실제로는 관계사를 통해 우회적으로 회수된 해외매출채권임에도 이를 장부에서 제거\n하지 않은 채 회수 대금을 차입금으로 회계처리한 후, 동 차입금 중 일부를 채무면제이익\n- 44 -\n으로 인식하는 방법으로 매출채권과 관계사차입금 및 채무면제이익을 과대계상함\n\n지적 근거 및 판단 내용:\n일반기업회계기준 제2장(재무제표의 작성과 표시Ⅰ) 문단2.7에 따르면, 재무제표는 경제적\n사실과 거래의 실질을 반영하여 기업의 재무상태, 경영성과, 현금흐름 및 자본변동을 공정\n하게 표시하여야 함\n한국공인회계사회는 상기 회계기준 등을 고려하여, 회사가 매출채권 회수사실을 은폐하고\n관계사와 허위계약을 체결하여 가공의 부채(차입금)를 계상하였으며, 이에 기반한 채무\n면제이익은 실질이 없는 것이므로, 회사의 재무제표는 기업의 재무상태, 경영성과를 공정\n하게 표시하지 못하였다고 판단함\n\n감사절차 미흡사항:\n감사인이 수행한 감사절차 등을 고려시, 이는 “다른 감사절차에 의하여도 위법가능성을\n전혀 의심할 수 없었거나, 회사의 진술에 의하지 아니하고는 당해 위법사실을 알 수 없는\n사항이라고 인정되는 때”에 해당한다고 판단되어 감사인에 대하여 지적하지 아니함\n감사인은 ① 쟁점 해외매출채권과 관련하여, 채권 외부조회, 장기성매출채권 분류 적정성\n검토 등 감사절차를 수행하고, ② 관계사차입금 및 채무면제이익과 관련하여, 차용증 및\n입출금 증빙 확인, 채무 외부조회, 회사의 이사회의사록 및 관계사의 채무면제이익 공문과\n관련 이사회의사록 검토 등 감사절차를 수행하였으나,\n회사가 거래의 실질을 파악할 수 있는 주요 계약의 내용을 감사인에게 의도적으로 알리지\n아니하고, 관계사와 공모하여 허위의 증빙을 작성하여 제출하거나 외부조회처로 하여금\n사실과 다른 회신을 하도록 요청하는 등 조직적으로 외부감사를 방해하여 감사인은 회사의\n해당 회계처리에 대해 특이사항을 발견할 수 없었음\n\n시사점:\n주주·채권자 등과의 투자계약에 여러 약정사항이 부가되는 경우가 많으며, 그 내용이 복잡·\n다양해지는 추세인 바, 회사는 주주 등과의 계약 내용을 면밀히 분석하여 경제적 실질에\n맞게 회계처리하고 필요한 경우 주석에 충실히 기재하여야 함\n감사인은 금융기관 차입약정 등으로 인해 당기순이익을 과대계상할 유인이 있는 회사를 감사\n하는 경우 회사가 제출한 감사증거의 경제적 실질 및 신뢰성 여부를 면밀히 검토하여야 함\n- 45 -\n2 자산‧부채, 수익‧비용 과대(소)계상(B유형)"
    },
    {
      "paragraph_id": "KICPA-2025-29",
      "case_id": "KICPA-2025-29",
      "case_title": "장기대여금 및 장기선수금 허위계상",
      "metadata": {
        "decision_year": "2025",
        "accounting_period": "’20.1.1.~’22.12.31.\n1. 회사의 회계처리\n회사는 자동차 부품의 제조·판매업을 영위하는 비상장법인으로, ‘20년 중 회사의 대표\n이사 및 최대주주가 A사의 지분 100%를 취득하고 대표이사로 취임하여 회사와 A사\n간에 특수관계가 성립함\n회사의 대표이사는 A사 지분 취득 시 A사가 보유한 해외 소재 특수관계자(A사의 舊\n주주측에서 지분 50% 이상 보유, 이하 ‘B사’)에 대한 매출채권 회수를 특약으로 하여\n인수계약을 체결함. 이후 해당 매출채권 대금이 채권 권리자인 A사가 아닌 회사로 입금\n되었고, 회사는 수취한 자금을 다시 A사로 이체함으로써 자금의 도관 역할만을 수행\n하였음에도, 채권 대금 입금액과 A사로 이체한 금액을 각각 장기선수금과 장기대여금\n으로 회계처리하였음\n한편, A사는 ‘20년 중 회사로부터 입금받은 금액을 장기차입금으로 계상한 후 이 중\n일부에 대하여 허위의 채무면제이익을 인식하였고, 회사는 A사에 대한 대여금 잔액은\n감소시키면서도 손실은 인식하지 않기 위하여 당초 인식한 장기선수금과 장기대여금\n인식 전표의 금액을 감소시키는 방법으로 소급 수정하고, 대여금 관련 이자수익도 인식함\n2. 회계기준 위반 지적 내용\n회사가 실질적으로 자금의 도관 역할만을 수행하여 자금 중계 외에 관련된 권리와 의무가\n없음에도 불구하고, 이를 자산(대여금)과 부채(선수금)로 인식하여 장기대여금 및 장기선수금\n등을 허위로 과대계상함\n- 46 -\n3. 지적 근거 및 판단 내용\n일반기업회계기준 제2장(재무제표의 작성과 표시Ⅰ) 문단2.7에 따르면, 재무제표는\n경제적 사실과 거래의 실질을 반영하여 기업의 재무상태, 경영성과, 현금흐름 및 자본\n변동을 공정하게 표시하여야 하며, 일반기업회계기준 제6장(금융자산·금융부채) 문단6.4에\n따르면, 금융자산이나 금융부채는 금융상품 계약당사자가 되는 때에만 재무상태표에 인식\n하여야 함\n한국공인회계사회는 상기 회계기준 등을 고려하여, 회사가 실질적으로 자금의 도관 역할\n만을 수행하여 자금 중계 외에 관련된 권리와 의무가 없음에도 이를 자산과 부채로\n인식한 것으로, 회사의 재무제표는 기업의 재무상태, 경영성과를 공정하게 표시하지\n못하였다고 판단함\n4. 감사절차 미흡사항\n회계감사기준 200(독립된 감사인의 전반목적 및 감사기준에 따른 감사의 수행), 500(감사\n증거)과 700(재무제표에 대한 의견형성과 보고) 등에 따르면 감사인은 재무제표를 중요\n하게 왜곡표시 시킬 수 있는 상황이 존재할 수 있다는 전문가적인 의구심을 가지고\n감사업무를 계획하고 수행하여야 하며, 감사인은 감사의견 형성의 기초가 될 합리적인\n감사결론을 도출할 수 있도록 충분하고 적합한 감사증거를 확보하여야 하고, 재무제표가\n일반적으로 인정된 회계처리기준에 따라 중요성의 관점에서 적정하게 표시되고 있다고\n판단했을 경우에만 적정의견을 표명하도록 규정되어 있음\n감사인은 회사가 제시한 차입약정서 및 입출금내역 확인, 채권(대여금) 외부조회 등을\n수행하였으나, 기업의 정상적인 사업과정을 벗어난 유의적인 특수관계자 관련 거래를\n식별하였음에도, 해당 거래에 대한 경영진의 설명 이외 관련 계약서 검토 및 채무(선수금)\n외부조회를 수행하지 아니하고, 회사가 제시한 대여금 및 선수금 발생 사유와 관련한\n사업계획을 형식적으로 검토하였으며, 실제 자금 흐름과 전표 내용이 다름을 인지\n하였음에도 특수관계자가 작성한 대지급 확인서만을 확인하는 등 감사절차 전반에 걸쳐\n경영자의 설명을 전문가적 의구심 없이 수용하였음\n5. 시사점\n회사는 복잡한 구조의 자금수수 거래나 특수관계자 거래와 관련된 계약 구조 및 권리·의무\n관계를 분석하여 경제적 실질에 맞게 회계처리하고 필요한 경우 주석에 충실히 기재하여야 함\n감사인은 유의적인 특수관계자와의 거래를 식별한 경우 경영진 진술 및 내부증거에만\n- 47 -\n의존하기보다는 외부조회 등 보다 신뢰성이 높은 감사증거를 추가로 검토하여야 하며,\n회사가 제출한 감사증거의 일관성 및 신뢰성 여부를 보다 면밀히 검토할 필요가 있음",
        "issue_fields": [
          "대여금 및 선수금"
        ],
        "related_standards": [
          "일반기업회계기준 제2장 (재무제표의 작성과 표시Ⅰ)",
          "제6장(금융자산·\n금융부채)"
        ],
        "case_type": "회계감리지적사례",
        "source": "KICPA 심사·감리 지적사례"
      },
      "content": {
        "section_1_company_accounting": {
          "section_title": "회사의 회계처리",
          "content": "회사는 자동차 부품의 제조·판매업을 영위하는 비상장법인으로, ‘20년 중 회사의 대표\n이사 및 최대주주가 A사의 지분 100%를 취득하고 대표이사로 취임하여 회사와 A사\n간에 특수관계가 성립함\n회사의 대표이사는 A사 지분 취득 시 A사가 보유한 해외 소재 특수관계자(A사의 舊\n주주측에서 지분 50% 이상 보유, 이하 ‘B사’)에 대한 매출채권 회수를 특약으로 하여\n인수계약을 체결함. 이후 해당 매출채권 대금이 채권 권리자인 A사가 아닌 회사로 입금\n되었고, 회사는 수취한 자금을 다시 A사로 이체함으로써 자금의 도관 역할만을 수행\n하였음에도, 채권 대금 입금액과 A사로 이체한 금액을 각각 장기선수금과 장기대여금\n으로 회계처리하였음\n한편, A사는 ‘20년 중 회사로부터 입금받은 금액을 장기차입금으로 계상한 후 이 중\n일부에 대하여 허위의 채무면제이익을 인식하였고, 회사는 A사에 대한 대여금 잔액은\n감소시키면서도 손실은 인식하지 않기 위하여 당초 인식한 장기선수금과 장기대여금\n인식 전표의 금액을 감소시키는 방법으로 소급 수정하고, 대여금 관련 이자수익도 인식함"
        },
        "section_2_violation_details": {
          "section_title": "회계기준 위반 지적 내용",
          "content": "회사가 실질적으로 자금의 도관 역할만을 수행하여 자금 중계 외에 관련된 권리와 의무가\n없음에도 불구하고, 이를 자산(대여금)과 부채(선수금)로 인식하여 장기대여금 및 장기선수금\n등을 허위로 과대계상함\n- 46 -"
        },
        "section_3_basis_judgment": {
          "section_title": "지적 근거 및 판단 내용",
          "content": "일반기업회계기준 제2장(재무제표의 작성과 표시Ⅰ) 문단2.7에 따르면, 재무제표는\n경제적 사실과 거래의 실질을 반영하여 기업의 재무상태, 경영성과, 현금흐름 및 자본\n변동을 공정하게 표시하여야 하며, 일반기업회계기준 제6장(금융자산·금융부채) 문단6.4에\n따르면, 금융자산이나 금융부채는 금융상품 계약당사자가 되는 때에만 재무상태표에 인식\n하여야 함\n한국공인회계사회는 상기 회계기준 등을 고려하여, 회사가 실질적으로 자금의 도관 역할\n만을 수행하여 자금 중계 외에 관련된 권리와 의무가 없음에도 이를 자산과 부채로\n인식한 것으로, 회사의 재무제표는 기업의 재무상태, 경영성과를 공정하게 표시하지\n못하였다고 판단함"
        },
        "section_4_audit_procedure": {
          "section_title": "감사절차 미흡사항",
          "content": "회계감사기준 200(독립된 감사인의 전반목적 및 감사기준에 따른 감사의 수행), 500(감사\n증거)과 700(재무제표에 대한 의견형성과 보고) 등에 따르면 감사인은 재무제표를 중요\n하게 왜곡표시 시킬 수 있는 상황이 존재할 수 있다는 전문가적인 의구심을 가지고\n감사업무를 계획하고 수행하여야 하며, 감사인은 감사의견 형성의 기초가 될 합리적인\n감사결론을 도출할 수 있도록 충분하고 적합한 감사증거를 확보하여야 하고, 재무제표가\n일반적으로 인정된 회계처리기준에 따라 중요성의 관점에서 적정하게 표시되고 있다고\n판단했을 경우에만 적정의견을 표명하도록 규정되어 있음\n감사인은 회사가 제시한 차입약정서 및 입출금내역 확인, 채권(대여금) 외부조회 등을\n수행하였으나, 기업의 정상적인 사업과정을 벗어난 유의적인 특수관계자 관련 거래를\n식별하였음에도, 해당 거래에 대한 경영진의 설명 이외 관련 계약서 검토 및 채무(선수금)\n외부조회를 수행하지 아니하고, 회사가 제시한 대여금 및 선수금 발생 사유와 관련한\n사업계획을 형식적으로 검토하였으며, 실제 자금 흐름과 전표 내용이 다름을 인지\n하였음에도 특수관계자가 작성한 대지급 확인서만을 확인하는 등 감사절차 전반에 걸쳐\n경영자의 설명을 전문가적 의구심 없이 수용하였음"
        },
        "section_5_implications": {
          "section_title": "시사점",
          "content": "회사는 복잡한 구조의 자금수수 거래나 특수관계자 거래와 관련된 계약 구조 및 권리·의무\n관계를 분석하여 경제적 실질에 맞게 회계처리하고 필요한 경우 주석에 충실히 기재하여야 함\n감사인은 유의적인 특수관계자와의 거래를 식별한 경우 경영진 진술 및 내부증거에만\n- 47 -\n의존하기보다는 외부조회 등 보다 신뢰성이 높은 감사증거를 추가로 검토하여야 하며,\n회사가 제출한 감사증거의 일관성 및 신뢰성 여부를 보다 면밀히 검토할 필요가 있음"
        }
      },
      "indexed_content": "케이스 ID: KICPA-2025-29\n제목: 장기대여금 및 장기선수금 허위계상\n결정연도: 2025년\n회계결산일: ’20.1.1.~’22.12.31.\n1. 회사의 회계처리\n회사는 자동차 부품의 제조·판매업을 영위하는 비상장법인으로, ‘20년 중 회사의 대표\n이사 및 최대주주가 A사의 지분 100%를 취득하고 대표이사로 취임하여 회사와 A사\n간에 특수관계가 성립함\n회사의 대표이사는 A사 지분 취득 시 A사가 보유한 해외 소재 특수관계자(A사의 舊\n주주측에서 지분 50% 이상 보유, 이하 ‘B사’)에 대한 매출채권 회수를 특약으로 하여\n인수계약을 체결함. 이후 해당 매출채권 대금이 채권 권리자인 A사가 아닌 회사로 입금\n되었고, 회사는 수취한 자금을 다시 A사로 이체함으로써 자금의 도관 역할만을 수행\n하였음에도, 채권 대금 입금액과 A사로 이체한 금액을 각각 장기선수금과 장기대여금\n으로 회계처리하였음\n한편, A사는 ‘20년 중 회사로부터 입금받은 금액을 장기차입금으로 계상한 후 이 중\n일부에 대하여 허위의 채무면제이익을 인식하였고, 회사는 A사에 대한 대여금 잔액은\n감소시키면서도 손실은 인식하지 않기 위하여 당초 인식한 장기선수금과 장기대여금\n인식 전표의 금액을 감소시키는 방법으로 소급 수정하고, 대여금 관련 이자수익도 인식함\n2. 회계기준 위반 지적 내용\n회사가 실질적으로 자금의 도관 역할만을 수행하여 자금 중계 외에 관련된 권리와 의무가\n없음에도 불구하고, 이를 자산(대여금)과 부채(선수금)로 인식하여 장기대여금 및 장기선수금\n등을 허위로 과대계상함\n- 46 -\n3. 지적 근거 및 판단 내용\n일반기업회계기준 제2장(재무제표의 작성과 표시Ⅰ) 문단2.7에 따르면, 재무제표는\n경제적 사실과 거래의 실질을 반영하여 기업의 재무상태, 경영성과, 현금흐름 및 자본\n변동을 공정하게 표시하여야 하며, 일반기업회계기준 제6장(금융자산·금융부채) 문단6.4에\n따르면, 금융자산이나 금융부채는 금융상품 계약당사자가 되는 때에만 재무상태표에 인식\n하여야 함\n한국공인회계사회는 상기 회계기준 등을 고려하여, 회사가 실질적으로 자금의 도관 역할\n만을 수행하여 자금 중계 외에 관련된 권리와 의무가 없음에도 이를 자산과 부채로\n인식한 것으로, 회사의 재무제표는 기업의 재무상태, 경영성과를 공정하게 표시하지\n못하였다고 판단함\n4. 감사절차 미흡사항\n회계감사기준 200(독립된 감사인의 전반목적 및 감사기준에 따른 감사의 수행), 500(감사\n증거)과 700(재무제표에 대한 의견형성과 보고) 등에 따르면 감사인은 재무제표를 중요\n하게 왜곡표시 시킬 수 있는 상황이 존재할 수 있다는 전문가적인 의구심을 가지고\n감사업무를 계획하고 수행하여야 하며, 감사인은 감사의견 형성의 기초가 될 합리적인\n감사결론을 도출할 수 있도록 충분하고 적합한 감사증거를 확보하여야 하고, 재무제표가\n일반적으로 인정된 회계처리기준에 따라 중요성의 관점에서 적정하게 표시되고 있다고\n판단했을 경우에만 적정의견을 표명하도록 규정되어 있음\n감사인은 회사가 제시한 차입약정서 및 입출금내역 확인, 채권(대여금) 외부조회 등을\n수행하였으나, 기업의 정상적인 사업과정을 벗어난 유의적인 특수관계자 관련 거래를\n식별하였음에도, 해당 거래에 대한 경영진의 설명 이외 관련 계약서 검토 및 채무(선수금)\n외부조회를 수행하지 아니하고, 회사가 제시한 대여금 및 선수금 발생 사유와 관련한\n사업계획을 형식적으로 검토하였으며, 실제 자금 흐름과 전표 내용이 다름을 인지\n하였음에도 특수관계자가 작성한 대지급 확인서만을 확인하는 등 감사절차 전반에 걸쳐\n경영자의 설명을 전문가적 의구심 없이 수용하였음\n5. 시사점\n회사는 복잡한 구조의 자금수수 거래나 특수관계자 거래와 관련된 계약 구조 및 권리·의무\n관계를 분석하여 경제적 실질에 맞게 회계처리하고 필요한 경우 주석에 충실히 기재하여야 함\n감사인은 유의적인 특수관계자와의 거래를 식별한 경우 경영진 진술 및 내부증거에만\n- 47 -\n의존하기보다는 외부조회 등 보다 신뢰성이 높은 감사증거를 추가로 검토하여야 하며,\n회사가 제출한 감사증거의 일관성 및 신뢰성 여부를 보다 면밀히 검토할 필요가 있음\n쟁점분야: 대여금 및 선수금\n관련기준: 일반기업회계기준 제2장 (재무제표의 작성과 표시Ⅰ), 제6장(금융자산·\n금융부채)\n\n회사의 회계처리:\n회사는 자동차 부품의 제조·판매업을 영위하는 비상장법인으로, ‘20년 중 회사의 대표\n이사 및 최대주주가 A사의 지분 100%를 취득하고 대표이사로 취임하여 회사와 A사\n간에 특수관계가 성립함\n회사의 대표이사는 A사 지분 취득 시 A사가 보유한 해외 소재 특수관계자(A사의 舊\n주주측에서 지분 50% 이상 보유, 이하 ‘B사’)에 대한 매출채권 회수를 특약으로 하여\n인수계약을 체결함. 이후 해당 매출채권 대금이 채권 권리자인 A사가 아닌 회사로 입금\n되었고, 회사는 수취한 자금을 다시 A사로 이체함으로써 자금의 도관 역할만을 수행\n하였음에도, 채권 대금 입금액과 A사로 이체한 금액을 각각 장기선수금과 장기대여금\n으로 회계처리하였음\n한편, A사는 ‘20년 중 회사로부터 입금받은 금액을 장기차입금으로 계상한 후 이 중\n일부에 대하여 허위의 채무면제이익을 인식하였고, 회사는 A사에 대한 대여금 잔액은\n감소시키면서도 손실은 인식하지 않기 위하여 당초 인식한 장기선수금과 장기대여금\n인식 전표의 금액을 감소시키는 방법으로 소급 수정하고, 대여금 관련 이자수익도 인식함\n\n회계기준 위반 지적 내용:\n회사가 실질적으로 자금의 도관 역할만을 수행하여 자금 중계 외에 관련된 권리와 의무가\n없음에도 불구하고, 이를 자산(대여금)과 부채(선수금)로 인식하여 장기대여금 및 장기선수금\n등을 허위로 과대계상함\n- 46 -\n\n지적 근거 및 판단 내용:\n일반기업회계기준 제2장(재무제표의 작성과 표시Ⅰ) 문단2.7에 따르면, 재무제표는\n경제적 사실과 거래의 실질을 반영하여 기업의 재무상태, 경영성과, 현금흐름 및 자본\n변동을 공정하게 표시하여야 하며, 일반기업회계기준 제6장(금융자산·금융부채) 문단6.4에\n따르면, 금융자산이나 금융부채는 금융상품 계약당사자가 되는 때에만 재무상태표에 인식\n하여야 함\n한국공인회계사회는 상기 회계기준 등을 고려하여, 회사가 실질적으로 자금의 도관 역할\n만을 수행하여 자금 중계 외에 관련된 권리와 의무가 없음에도 이를 자산과 부채로\n인식한 것으로, 회사의 재무제표는 기업의 재무상태, 경영성과를 공정하게 표시하지\n못하였다고 판단함\n\n감사절차 미흡사항:\n회계감사기준 200(독립된 감사인의 전반목적 및 감사기준에 따른 감사의 수행), 500(감사\n증거)과 700(재무제표에 대한 의견형성과 보고) 등에 따르면 감사인은 재무제표를 중요\n하게 왜곡표시 시킬 수 있는 상황이 존재할 수 있다는 전문가적인 의구심을 가지고\n감사업무를 계획하고 수행하여야 하며, 감사인은 감사의견 형성의 기초가 될 합리적인\n감사결론을 도출할 수 있도록 충분하고 적합한 감사증거를 확보하여야 하고, 재무제표가\n일반적으로 인정된 회계처리기준에 따라 중요성의 관점에서 적정하게 표시되고 있다고\n판단했을 경우에만 적정의견을 표명하도록 규정되어 있음\n감사인은 회사가 제시한 차입약정서 및 입출금내역 확인, 채권(대여금) 외부조회 등을\n수행하였으나, 기업의 정상적인 사업과정을 벗어난 유의적인 특수관계자 관련 거래를\n식별하였음에도, 해당 거래에 대한 경영진의 설명 이외 관련 계약서 검토 및 채무(선수금)\n외부조회를 수행하지 아니하고, 회사가 제시한 대여금 및 선수금 발생 사유와 관련한\n사업계획을 형식적으로 검토하였으며, 실제 자금 흐름과 전표 내용이 다름을 인지\n하였음에도 특수관계자가 작성한 대지급 확인서만을 확인하는 등 감사절차 전반에 걸쳐\n경영자의 설명을 전문가적 의구심 없이 수용하였음\n\n시사점:\n회사는 복잡한 구조의 자금수수 거래나 특수관계자 거래와 관련된 계약 구조 및 권리·의무\n관계를 분석하여 경제적 실질에 맞게 회계처리하고 필요한 경우 주석에 충실히 기재하여야 함\n감사인은 유의적인 특수관계자와의 거래를 식별한 경우 경영진 진술 및 내부증거에만\n- 47 -\n의존하기보다는 외부조회 등 보다 신뢰성이 높은 감사증거를 추가로 검토하여야 하며,\n회사가 제출한 감사증거의 일관성 및 신뢰성 여부를 보다 면밀히 검토할 필요가 있음"
    },
    {
      "paragraph_id": "KICPA-2025-30",
      "case_id": "KICPA-2025-30",
      "case_title": "매출과 매출원가 과대계상(본인·대리인)",
      "metadata": {
        "decision_year": "2025",
        "accounting_period": "’20.8.1.∼’23.7.31.\n1. 회사의 회계처리\n회사는 컴퓨터 서버와 랙 판매를 주요사업으로 영위하고 있으며 해외에 소재한 특수\n관계자 A로부터 상품을 수입하여 국내 거래처에 판매하고 있음. 국내 매출처에 상품을\n제공하는 형식적(법적) 주체는 회사이지만, 국내 거래처에 공급하는 재화의 판매가격,\n구매가격 및 사양의 결정은 회사가 아닌 A사에 의해 이루어지고, A사가 자기의 책임과\n비용으로 재화를 거래처까지 직접 배송하며 회사는 A사의 수출업무를 대행하는\n역할만 수행하고 있으나, 회사는 경제적 실질이 아닌 법적 형식만을 고려하여 상품\n매출액과 매출원가를 총액으로 회계처리 하였음\n2. 회계기준 위반 지적 내용\n회사는 공급자 선정과 가격결정의 권한을 갖고 있지 아니하며 재고자산에 대한 전반적인\n위험도 부담하지 않아 거래의 당사자가 아닌 대리인 역할만 수행하므로 수수료만을\n매출로 인식해야 함에도 이를 총액으로 잘못 인식함으로써, 매출 및 매출원가를 과대\n계상함\n3. 지적 근거 및 판단 내용\n일반기업회계기준 제16장(수익) 문단 16.8, 16.10 및 실16.19에 따르면 둘 이상의 거래가\n서로 연계되어 있어 그 경제적 효과가 일련의 거래 전체를 통해서만 파악되는 경우에는\n그 거래 전체에 대하여 하나의 수익인식기준을 적용하여야 하고, 회사가 재화의 판매와\n관련된 유의적인 위험과 보상에 노출되지 않으면 본인이 아닌 대리인으로서 활동하는\n것으로 판단하고 재화의 판매로 인한 수익은 재화의 소유에 따른 유의적인 위험과 보상이\n구매자에게 이전되는 등의 요건 충족시 인식하도록 규정하고 있음\n- 48 -\n한국공인회계사회는 상기 회계기준 등을 고려하여, 회사는 공급자의 수출업무를 대행\n하는 역할만 수행함으로써 거래의 당사자로서 재화의 제공에 주된 책임을 부담한다고\n볼 수 없어 본인이 아닌 대리인으로서 활동하는 것으로 판단함\n4. 감사절차 미흡사항\n동 지적사례는 재무제표에 대한 심사로 종결되어 감사보고서 감리는 실시하지 아니함\n5. 시사점\n회사는 거래의 당사자로서 재화의 제공에 주된 책임을 부담하는지 여부 및 본인 또는\n대리인 활동 여부 등을 종합적으로 검토한 후 매출 및 매출원가의 총액·순액 인식\n여부를 결정해야 함",
        "issue_fields": [
          "본인·대리인 총액순액"
        ],
        "related_standards": [
          "일반기업회계기준 제16장(수익)"
        ],
        "case_type": "회계감리지적사례",
        "source": "KICPA 심사·감리 지적사례"
      },
      "content": {
        "section_1_company_accounting": {
          "section_title": "회사의 회계처리",
          "content": "회사는 컴퓨터 서버와 랙 판매를 주요사업으로 영위하고 있으며 해외에 소재한 특수\n관계자 A로부터 상품을 수입하여 국내 거래처에 판매하고 있음. 국내 매출처에 상품을\n제공하는 형식적(법적) 주체는 회사이지만, 국내 거래처에 공급하는 재화의 판매가격,\n구매가격 및 사양의 결정은 회사가 아닌 A사에 의해 이루어지고, A사가 자기의 책임과\n비용으로 재화를 거래처까지 직접 배송하며 회사는 A사의 수출업무를 대행하는\n역할만 수행하고 있으나, 회사는 경제적 실질이 아닌 법적 형식만을 고려하여 상품\n매출액과 매출원가를 총액으로 회계처리 하였음"
        },
        "section_2_violation_details": {
          "section_title": "회계기준 위반 지적 내용",
          "content": "회사는 공급자 선정과 가격결정의 권한을 갖고 있지 아니하며 재고자산에 대한 전반적인\n위험도 부담하지 않아 거래의 당사자가 아닌 대리인 역할만 수행하므로 수수료만을\n매출로 인식해야 함에도 이를 총액으로 잘못 인식함으로써, 매출 및 매출원가를 과대\n계상함"
        },
        "section_3_basis_judgment": {
          "section_title": "지적 근거 및 판단 내용",
          "content": "일반기업회계기준 제16장(수익) 문단 16.8, 16.10 및 실16.19에 따르면 둘 이상의 거래가\n서로 연계되어 있어 그 경제적 효과가 일련의 거래 전체를 통해서만 파악되는 경우에는\n그 거래 전체에 대하여 하나의 수익인식기준을 적용하여야 하고, 회사가 재화의 판매와\n관련된 유의적인 위험과 보상에 노출되지 않으면 본인이 아닌 대리인으로서 활동하는\n것으로 판단하고 재화의 판매로 인한 수익은 재화의 소유에 따른 유의적인 위험과 보상이\n구매자에게 이전되는 등의 요건 충족시 인식하도록 규정하고 있음\n- 48 -\n한국공인회계사회는 상기 회계기준 등을 고려하여, 회사는 공급자의 수출업무를 대행\n하는 역할만 수행함으로써 거래의 당사자로서 재화의 제공에 주된 책임을 부담한다고\n볼 수 없어 본인이 아닌 대리인으로서 활동하는 것으로 판단함"
        },
        "section_4_audit_procedure": {
          "section_title": "감사절차 미흡사항",
          "content": "동 지적사례는 재무제표에 대한 심사로 종결되어 감사보고서 감리는 실시하지 아니함"
        },
        "section_5_implications": {
          "section_title": "시사점",
          "content": "회사는 거래의 당사자로서 재화의 제공에 주된 책임을 부담하는지 여부 및 본인 또는\n대리인 활동 여부 등을 종합적으로 검토한 후 매출 및 매출원가의 총액·순액 인식\n여부를 결정해야 함"
        }
      },
      "indexed_content": "케이스 ID: KICPA-2025-30\n제목: 매출과 매출원가 과대계상(본인·대리인)\n결정연도: 2025년\n회계결산일: ’20.8.1.∼’23.7.31.\n1. 회사의 회계처리\n회사는 컴퓨터 서버와 랙 판매를 주요사업으로 영위하고 있으며 해외에 소재한 특수\n관계자 A로부터 상품을 수입하여 국내 거래처에 판매하고 있음. 국내 매출처에 상품을\n제공하는 형식적(법적) 주체는 회사이지만, 국내 거래처에 공급하는 재화의 판매가격,\n구매가격 및 사양의 결정은 회사가 아닌 A사에 의해 이루어지고, A사가 자기의 책임과\n비용으로 재화를 거래처까지 직접 배송하며 회사는 A사의 수출업무를 대행하는\n역할만 수행하고 있으나, 회사는 경제적 실질이 아닌 법적 형식만을 고려하여 상품\n매출액과 매출원가를 총액으로 회계처리 하였음\n2. 회계기준 위반 지적 내용\n회사는 공급자 선정과 가격결정의 권한을 갖고 있지 아니하며 재고자산에 대한 전반적인\n위험도 부담하지 않아 거래의 당사자가 아닌 대리인 역할만 수행하므로 수수료만을\n매출로 인식해야 함에도 이를 총액으로 잘못 인식함으로써, 매출 및 매출원가를 과대\n계상함\n3. 지적 근거 및 판단 내용\n일반기업회계기준 제16장(수익) 문단 16.8, 16.10 및 실16.19에 따르면 둘 이상의 거래가\n서로 연계되어 있어 그 경제적 효과가 일련의 거래 전체를 통해서만 파악되는 경우에는\n그 거래 전체에 대하여 하나의 수익인식기준을 적용하여야 하고, 회사가 재화의 판매와\n관련된 유의적인 위험과 보상에 노출되지 않으면 본인이 아닌 대리인으로서 활동하는\n것으로 판단하고 재화의 판매로 인한 수익은 재화의 소유에 따른 유의적인 위험과 보상이\n구매자에게 이전되는 등의 요건 충족시 인식하도록 규정하고 있음\n- 48 -\n한국공인회계사회는 상기 회계기준 등을 고려하여, 회사는 공급자의 수출업무를 대행\n하는 역할만 수행함으로써 거래의 당사자로서 재화의 제공에 주된 책임을 부담한다고\n볼 수 없어 본인이 아닌 대리인으로서 활동하는 것으로 판단함\n4. 감사절차 미흡사항\n동 지적사례는 재무제표에 대한 심사로 종결되어 감사보고서 감리는 실시하지 아니함\n5. 시사점\n회사는 거래의 당사자로서 재화의 제공에 주된 책임을 부담하는지 여부 및 본인 또는\n대리인 활동 여부 등을 종합적으로 검토한 후 매출 및 매출원가의 총액·순액 인식\n여부를 결정해야 함\n쟁점분야: 본인·대리인 총액순액\n관련기준: 일반기업회계기준 제16장(수익)\n\n회사의 회계처리:\n회사는 컴퓨터 서버와 랙 판매를 주요사업으로 영위하고 있으며 해외에 소재한 특수\n관계자 A로부터 상품을 수입하여 국내 거래처에 판매하고 있음. 국내 매출처에 상품을\n제공하는 형식적(법적) 주체는 회사이지만, 국내 거래처에 공급하는 재화의 판매가격,\n구매가격 및 사양의 결정은 회사가 아닌 A사에 의해 이루어지고, A사가 자기의 책임과\n비용으로 재화를 거래처까지 직접 배송하며 회사는 A사의 수출업무를 대행하는\n역할만 수행하고 있으나, 회사는 경제적 실질이 아닌 법적 형식만을 고려하여 상품\n매출액과 매출원가를 총액으로 회계처리 하였음\n\n회계기준 위반 지적 내용:\n회사는 공급자 선정과 가격결정의 권한을 갖고 있지 아니하며 재고자산에 대한 전반적인\n위험도 부담하지 않아 거래의 당사자가 아닌 대리인 역할만 수행하므로 수수료만을\n매출로 인식해야 함에도 이를 총액으로 잘못 인식함으로써, 매출 및 매출원가를 과대\n계상함\n\n지적 근거 및 판단 내용:\n일반기업회계기준 제16장(수익) 문단 16.8, 16.10 및 실16.19에 따르면 둘 이상의 거래가\n서로 연계되어 있어 그 경제적 효과가 일련의 거래 전체를 통해서만 파악되는 경우에는\n그 거래 전체에 대하여 하나의 수익인식기준을 적용하여야 하고, 회사가 재화의 판매와\n관련된 유의적인 위험과 보상에 노출되지 않으면 본인이 아닌 대리인으로서 활동하는\n것으로 판단하고 재화의 판매로 인한 수익은 재화의 소유에 따른 유의적인 위험과 보상이\n구매자에게 이전되는 등의 요건 충족시 인식하도록 규정하고 있음\n- 48 -\n한국공인회계사회는 상기 회계기준 등을 고려하여, 회사는 공급자의 수출업무를 대행\n하는 역할만 수행함으로써 거래의 당사자로서 재화의 제공에 주된 책임을 부담한다고\n볼 수 없어 본인이 아닌 대리인으로서 활동하는 것으로 판단함\n\n감사절차 미흡사항:\n동 지적사례는 재무제표에 대한 심사로 종결되어 감사보고서 감리는 실시하지 아니함\n\n시사점:\n회사는 거래의 당사자로서 재화의 제공에 주된 책임을 부담하는지 여부 및 본인 또는\n대리인 활동 여부 등을 종합적으로 검토한 후 매출 및 매출원가의 총액·순액 인식\n여부를 결정해야 함"
    },
    {
      "paragraph_id": "KICPA-2025-31",
      "case_id": "KICPA-2025-31",
      "case_title": "매출과 매출원가 과대계상(유상사급)",
      "metadata": {
        "decision_year": "2025",
        "accounting_period": "’22.1.1.∼’23.12.31.\n1. 회사의 회계처리\n회사는 자동차 부품 제조업체로 발주업체로부터 원재료를 유상으로 공급받아 가공\n후 발주업체로 재판매하는 유상사급거래를 하고 있음. 발주업체와의 계약서에 따르면\n회사는 공급받은 원재료를 발주업체의 동의 없이 다른 용도로 사용하거나, 제3자 양도,\n대여 및 담보제공이 불가능하고, 남은 원재료에 대하여 매입 당시와 동일한 조건으로\n발주업체에 재매입해 줄 것을 요청할 수 있는 권리가 있는 등 발주업체로부터 유상\n사급으로 공급받은 원재료는 소유에 따른 주된 위험과 보상이 실질적으로 회사에 이전\n되지 아니함에도 공급받은 원재료를 포함한 거래 총액을 매입과 매출로 회계처리 하였음\n2. 회계기준 위반 지적 내용\n회사가 발주업체로부터 유상사급 방식으로 공급받은 원재료는 주문자재의 제작 외\n다른 용도로 사용하거나 양도 등 처분이 제한되며, 남은 재고에 대해서는 매입 당시와\n동일한 조건으로 발주업체에게 재매입을 요청할 수 있는 권리가 있는 등 원재료의\n- 49 -\n소유에 따른 위험과 보상이 실질적으로 이전되지 아니하여 임가공수수료(순액)만을\n매출로 계상하여야 함에도, 회사는 매출과 매입을 총액으로 인식함으로써 매출 및\n매출원가를 각각 과대계상함\n3. 지적 근거 및 판단 내용\n일반기업회계기준 제16장(수익) 문단 16.10에 따르면 재화의 판매로 인한 수익은 재화의\n소유에 따른 유의적인 위험과 보상이 구매자에게 이전되는 등의 요건 충족 시 인식\n하도록 규정하고 있음\n한국공인회계사회는 상기 회계기준 및 회사의 계약내용을 고려하여 발주업체와의 거래는\n원재료 및 완성품과 관련한 사급거래 금액을 순액으로 회계처리 하여야 함에도 총액\n으로 잘못 회계처리한 것으로 판단함\n4. 감사절차 미흡사항\n동 지적사례는 재무제표에 대한 심사로 종결되어 감사보고서 감리는 실시하지 아니함\n5. 시사점\n회사는 원재료 및 완성품 거래가 서로 연계되어 있다면, 각각 세금계산서를 주고받은\n거래라 할지라도 법적 형식 및 경제적 실질을 면밀히 검토하여 사급거래와 관련한 매출\n및 매출원가가 과대계상되지 않도록 주의를 기울일 필요가 있음",
        "issue_fields": [
          "유상사급 총액순액"
        ],
        "related_standards": [
          "일반기업회계기준 제16장(수익)"
        ],
        "case_type": "회계감리지적사례",
        "source": "KICPA 심사·감리 지적사례"
      },
      "content": {
        "section_1_company_accounting": {
          "section_title": "회사의 회계처리",
          "content": "회사는 자동차 부품 제조업체로 발주업체로부터 원재료를 유상으로 공급받아 가공\n후 발주업체로 재판매하는 유상사급거래를 하고 있음. 발주업체와의 계약서에 따르면\n회사는 공급받은 원재료를 발주업체의 동의 없이 다른 용도로 사용하거나, 제3자 양도,\n대여 및 담보제공이 불가능하고, 남은 원재료에 대하여 매입 당시와 동일한 조건으로\n발주업체에 재매입해 줄 것을 요청할 수 있는 권리가 있는 등 발주업체로부터 유상\n사급으로 공급받은 원재료는 소유에 따른 주된 위험과 보상이 실질적으로 회사에 이전\n되지 아니함에도 공급받은 원재료를 포함한 거래 총액을 매입과 매출로 회계처리 하였음"
        },
        "section_2_violation_details": {
          "section_title": "회계기준 위반 지적 내용",
          "content": "회사가 발주업체로부터 유상사급 방식으로 공급받은 원재료는 주문자재의 제작 외\n다른 용도로 사용하거나 양도 등 처분이 제한되며, 남은 재고에 대해서는 매입 당시와\n동일한 조건으로 발주업체에게 재매입을 요청할 수 있는 권리가 있는 등 원재료의\n- 49 -\n소유에 따른 위험과 보상이 실질적으로 이전되지 아니하여 임가공수수료(순액)만을\n매출로 계상하여야 함에도, 회사는 매출과 매입을 총액으로 인식함으로써 매출 및\n매출원가를 각각 과대계상함"
        },
        "section_3_basis_judgment": {
          "section_title": "지적 근거 및 판단 내용",
          "content": "일반기업회계기준 제16장(수익) 문단 16.10에 따르면 재화의 판매로 인한 수익은 재화의\n소유에 따른 유의적인 위험과 보상이 구매자에게 이전되는 등의 요건 충족 시 인식\n하도록 규정하고 있음\n한국공인회계사회는 상기 회계기준 및 회사의 계약내용을 고려하여 발주업체와의 거래는\n원재료 및 완성품과 관련한 사급거래 금액을 순액으로 회계처리 하여야 함에도 총액\n으로 잘못 회계처리한 것으로 판단함"
        },
        "section_4_audit_procedure": {
          "section_title": "감사절차 미흡사항",
          "content": "동 지적사례는 재무제표에 대한 심사로 종결되어 감사보고서 감리는 실시하지 아니함"
        },
        "section_5_implications": {
          "section_title": "시사점",
          "content": "회사는 원재료 및 완성품 거래가 서로 연계되어 있다면, 각각 세금계산서를 주고받은\n거래라 할지라도 법적 형식 및 경제적 실질을 면밀히 검토하여 사급거래와 관련한 매출\n및 매출원가가 과대계상되지 않도록 주의를 기울일 필요가 있음"
        }
      },
      "indexed_content": "케이스 ID: KICPA-2025-31\n제목: 매출과 매출원가 과대계상(유상사급)\n결정연도: 2025년\n회계결산일: ’22.1.1.∼’23.12.31.\n1. 회사의 회계처리\n회사는 자동차 부품 제조업체로 발주업체로부터 원재료를 유상으로 공급받아 가공\n후 발주업체로 재판매하는 유상사급거래를 하고 있음. 발주업체와의 계약서에 따르면\n회사는 공급받은 원재료를 발주업체의 동의 없이 다른 용도로 사용하거나, 제3자 양도,\n대여 및 담보제공이 불가능하고, 남은 원재료에 대하여 매입 당시와 동일한 조건으로\n발주업체에 재매입해 줄 것을 요청할 수 있는 권리가 있는 등 발주업체로부터 유상\n사급으로 공급받은 원재료는 소유에 따른 주된 위험과 보상이 실질적으로 회사에 이전\n되지 아니함에도 공급받은 원재료를 포함한 거래 총액을 매입과 매출로 회계처리 하였음\n2. 회계기준 위반 지적 내용\n회사가 발주업체로부터 유상사급 방식으로 공급받은 원재료는 주문자재의 제작 외\n다른 용도로 사용하거나 양도 등 처분이 제한되며, 남은 재고에 대해서는 매입 당시와\n동일한 조건으로 발주업체에게 재매입을 요청할 수 있는 권리가 있는 등 원재료의\n- 49 -\n소유에 따른 위험과 보상이 실질적으로 이전되지 아니하여 임가공수수료(순액)만을\n매출로 계상하여야 함에도, 회사는 매출과 매입을 총액으로 인식함으로써 매출 및\n매출원가를 각각 과대계상함\n3. 지적 근거 및 판단 내용\n일반기업회계기준 제16장(수익) 문단 16.10에 따르면 재화의 판매로 인한 수익은 재화의\n소유에 따른 유의적인 위험과 보상이 구매자에게 이전되는 등의 요건 충족 시 인식\n하도록 규정하고 있음\n한국공인회계사회는 상기 회계기준 및 회사의 계약내용을 고려하여 발주업체와의 거래는\n원재료 및 완성품과 관련한 사급거래 금액을 순액으로 회계처리 하여야 함에도 총액\n으로 잘못 회계처리한 것으로 판단함\n4. 감사절차 미흡사항\n동 지적사례는 재무제표에 대한 심사로 종결되어 감사보고서 감리는 실시하지 아니함\n5. 시사점\n회사는 원재료 및 완성품 거래가 서로 연계되어 있다면, 각각 세금계산서를 주고받은\n거래라 할지라도 법적 형식 및 경제적 실질을 면밀히 검토하여 사급거래와 관련한 매출\n및 매출원가가 과대계상되지 않도록 주의를 기울일 필요가 있음\n쟁점분야: 유상사급 총액순액\n관련기준: 일반기업회계기준 제16장(수익)\n\n회사의 회계처리:\n회사는 자동차 부품 제조업체로 발주업체로부터 원재료를 유상으로 공급받아 가공\n후 발주업체로 재판매하는 유상사급거래를 하고 있음. 발주업체와의 계약서에 따르면\n회사는 공급받은 원재료를 발주업체의 동의 없이 다른 용도로 사용하거나, 제3자 양도,\n대여 및 담보제공이 불가능하고, 남은 원재료에 대하여 매입 당시와 동일한 조건으로\n발주업체에 재매입해 줄 것을 요청할 수 있는 권리가 있는 등 발주업체로부터 유상\n사급으로 공급받은 원재료는 소유에 따른 주된 위험과 보상이 실질적으로 회사에 이전\n되지 아니함에도 공급받은 원재료를 포함한 거래 총액을 매입과 매출로 회계처리 하였음\n\n회계기준 위반 지적 내용:\n회사가 발주업체로부터 유상사급 방식으로 공급받은 원재료는 주문자재의 제작 외\n다른 용도로 사용하거나 양도 등 처분이 제한되며, 남은 재고에 대해서는 매입 당시와\n동일한 조건으로 발주업체에게 재매입을 요청할 수 있는 권리가 있는 등 원재료의\n- 49 -\n소유에 따른 위험과 보상이 실질적으로 이전되지 아니하여 임가공수수료(순액)만을\n매출로 계상하여야 함에도, 회사는 매출과 매입을 총액으로 인식함으로써 매출 및\n매출원가를 각각 과대계상함\n\n지적 근거 및 판단 내용:\n일반기업회계기준 제16장(수익) 문단 16.10에 따르면 재화의 판매로 인한 수익은 재화의\n소유에 따른 유의적인 위험과 보상이 구매자에게 이전되는 등의 요건 충족 시 인식\n하도록 규정하고 있음\n한국공인회계사회는 상기 회계기준 및 회사의 계약내용을 고려하여 발주업체와의 거래는\n원재료 및 완성품과 관련한 사급거래 금액을 순액으로 회계처리 하여야 함에도 총액\n으로 잘못 회계처리한 것으로 판단함\n\n감사절차 미흡사항:\n동 지적사례는 재무제표에 대한 심사로 종결되어 감사보고서 감리는 실시하지 아니함\n\n시사점:\n회사는 원재료 및 완성품 거래가 서로 연계되어 있다면, 각각 세금계산서를 주고받은\n거래라 할지라도 법적 형식 및 경제적 실질을 면밀히 검토하여 사급거래와 관련한 매출\n및 매출원가가 과대계상되지 않도록 주의를 기울일 필요가 있음"
    },
    {
      "paragraph_id": "KICPA-2025-32",
      "case_id": "KICPA-2025-32",
      "case_title": "분양미수금과 분양선수금 과대계상",
      "metadata": {
        "decision_year": "2025",
        "accounting_period": "’23.1.1.∼’23.12.31.\n1. 회사의 회계처리\n회사는 분양계약에 따라 계약금 및 중도금 청구 시 매출과 분양미수금을 인식하고,\n기말시점에 진행기준으로 조정하면서 기인식한 분양미수금을 상계하지 아니하고,\n분양선수금을 계상함\n- 50 -\n2. 회계기준 위반 지적 내용\n‘23년도에 수분양자에게 실행될 예정이였던 3~4차 중도금 대출이 차년도로 연기됨에\n따라, 회사로 입금되지 아니한 분양미수금 잔액이 ’23년도말 크게 증가되어, 수분양자별\n분양미수금과 분양선수금에 대한 상계 회계처리가 중요하게 되었음에도, 회사는 이에\n대한 검토를 누락하여, 분양미수금과 분양선수금을 과대계상함\n3. 지적 근거 및 판단 내용\n일반기업회계기준 제2장(재무제표의 작성과 표시Ⅰ) 문단 2.7에 의하면 재무제표는 경제적\n사실과 거래의 실질을 반영하여 기업의 재무상태와 경영성과 등을 공정하게 표시하도록\n규정하고 있음\n한국공인회계사회는 분양공사 관련하여 동일한 수분양자에 대한 채권(분양미수금)과\n채무(분양선수금)는 실질에 맞게 상계하여 순액으로 표시함이 타당하다고 판단함\n4. 감사절차 미흡사항\n회계감사기준 200(독립된 감사인의 전반목적 및 감사기준에 따른 감사의 수행), 500(감사\n증거)과 700(재무제표에 대한 의견형성과 보고) 등에 따르면 감사인은 재무제표를 중요\n하게 왜곡표시 시킬 수 있는 상황이 존재할 수 있다는 전문가적인 의구심을 가지고 감사\n업무를 계획하고 수행하여야 하며, 감사인은 감사의견 형성의 기초가 될 합리적인 감사\n결론을 도출할 수 있도록 충분하고 적합한 감사증거를 확보하여야 하고, 재무제표가\n일반적으로 인정된 회계처리기준에 따라 중요성의 관점에서 적정하게 표시되고 있다고\n판단했을 경우에만 적정의견을 표명하도록 규정되어 있음\n감사인은 분양계약에 따른 분양미수금 관련 계산 검증, 회수가능성 검토와 보고기간\n이후 회수내역 검토 등 통상적인 절차는 수행하였으나, ‘23년 수분양자가 중도금 대출을\n받지 못하게 되어 회사의 분양미수금 잔액이 급증하는 특이사항이 발생하여 분양\n미수금과 분양선수금 상계 회계처리가 중요하게 되었음에도, 수분양자별 분양미수금과\n분양선수금 잔액 비교 또는 상계 여부 등의 검토절차를 소홀히 하였음\n5. 시사점\n회사는 동일 프로젝트 및 동일 거래상대방(수분양자 등)에 대해 발생하는 채권(미청구\n공사, 분양미수금)이나 채무(초과청구공사, 분양선수금) 등은 계약서 내용 등을 면밀히\n검토하여 상계하여 표시해야 할 필요성이 있는지 검토해야 함\n- 51 -\n감사인은 채권 또는 채무 잔액이 급격히 변동하는 경우, 그 원인을 파악하고 관련 상대\n계정과의 관계를 고려하여 재무제표 표시의 적정성을 확인하는 감사절차를 수행\n할 필요가 있음",
        "issue_fields": [
          "자산‧부채 상계"
        ],
        "related_standards": [
          "일반기업회계기준 제2장(재무제표의 작성과 표시Ⅰ)"
        ],
        "case_type": "회계감리지적사례",
        "source": "KICPA 심사·감리 지적사례"
      },
      "content": {
        "section_1_company_accounting": {
          "section_title": "회사의 회계처리",
          "content": "회사는 분양계약에 따라 계약금 및 중도금 청구 시 매출과 분양미수금을 인식하고,\n기말시점에 진행기준으로 조정하면서 기인식한 분양미수금을 상계하지 아니하고,\n분양선수금을 계상함\n- 50 -"
        },
        "section_2_violation_details": {
          "section_title": "회계기준 위반 지적 내용",
          "content": "‘23년도에 수분양자에게 실행될 예정이였던 3~4차 중도금 대출이 차년도로 연기됨에\n따라, 회사로 입금되지 아니한 분양미수금 잔액이 ’23년도말 크게 증가되어, 수분양자별\n분양미수금과 분양선수금에 대한 상계 회계처리가 중요하게 되었음에도, 회사는 이에\n대한 검토를 누락하여, 분양미수금과 분양선수금을 과대계상함"
        },
        "section_3_basis_judgment": {
          "section_title": "지적 근거 및 판단 내용",
          "content": "일반기업회계기준 제2장(재무제표의 작성과 표시Ⅰ) 문단 2.7에 의하면 재무제표는 경제적\n사실과 거래의 실질을 반영하여 기업의 재무상태와 경영성과 등을 공정하게 표시하도록\n규정하고 있음\n한국공인회계사회는 분양공사 관련하여 동일한 수분양자에 대한 채권(분양미수금)과\n채무(분양선수금)는 실질에 맞게 상계하여 순액으로 표시함이 타당하다고 판단함"
        },
        "section_4_audit_procedure": {
          "section_title": "감사절차 미흡사항",
          "content": "회계감사기준 200(독립된 감사인의 전반목적 및 감사기준에 따른 감사의 수행), 500(감사\n증거)과 700(재무제표에 대한 의견형성과 보고) 등에 따르면 감사인은 재무제표를 중요\n하게 왜곡표시 시킬 수 있는 상황이 존재할 수 있다는 전문가적인 의구심을 가지고 감사\n업무를 계획하고 수행하여야 하며, 감사인은 감사의견 형성의 기초가 될 합리적인 감사\n결론을 도출할 수 있도록 충분하고 적합한 감사증거를 확보하여야 하고, 재무제표가\n일반적으로 인정된 회계처리기준에 따라 중요성의 관점에서 적정하게 표시되고 있다고\n판단했을 경우에만 적정의견을 표명하도록 규정되어 있음\n감사인은 분양계약에 따른 분양미수금 관련 계산 검증, 회수가능성 검토와 보고기간\n이후 회수내역 검토 등 통상적인 절차는 수행하였으나, ‘23년 수분양자가 중도금 대출을\n받지 못하게 되어 회사의 분양미수금 잔액이 급증하는 특이사항이 발생하여 분양\n미수금과 분양선수금 상계 회계처리가 중요하게 되었음에도, 수분양자별 분양미수금과\n분양선수금 잔액 비교 또는 상계 여부 등의 검토절차를 소홀히 하였음"
        },
        "section_5_implications": {
          "section_title": "시사점",
          "content": "회사는 동일 프로젝트 및 동일 거래상대방(수분양자 등)에 대해 발생하는 채권(미청구\n공사, 분양미수금)이나 채무(초과청구공사, 분양선수금) 등은 계약서 내용 등을 면밀히\n검토하여 상계하여 표시해야 할 필요성이 있는지 검토해야 함\n- 51 -\n감사인은 채권 또는 채무 잔액이 급격히 변동하는 경우, 그 원인을 파악하고 관련 상대\n계정과의 관계를 고려하여 재무제표 표시의 적정성을 확인하는 감사절차를 수행\n할 필요가 있음"
        }
      },
      "indexed_content": "케이스 ID: KICPA-2025-32\n제목: 분양미수금과 분양선수금 과대계상\n결정연도: 2025년\n회계결산일: ’23.1.1.∼’23.12.31.\n1. 회사의 회계처리\n회사는 분양계약에 따라 계약금 및 중도금 청구 시 매출과 분양미수금을 인식하고,\n기말시점에 진행기준으로 조정하면서 기인식한 분양미수금을 상계하지 아니하고,\n분양선수금을 계상함\n- 50 -\n2. 회계기준 위반 지적 내용\n‘23년도에 수분양자에게 실행될 예정이였던 3~4차 중도금 대출이 차년도로 연기됨에\n따라, 회사로 입금되지 아니한 분양미수금 잔액이 ’23년도말 크게 증가되어, 수분양자별\n분양미수금과 분양선수금에 대한 상계 회계처리가 중요하게 되었음에도, 회사는 이에\n대한 검토를 누락하여, 분양미수금과 분양선수금을 과대계상함\n3. 지적 근거 및 판단 내용\n일반기업회계기준 제2장(재무제표의 작성과 표시Ⅰ) 문단 2.7에 의하면 재무제표는 경제적\n사실과 거래의 실질을 반영하여 기업의 재무상태와 경영성과 등을 공정하게 표시하도록\n규정하고 있음\n한국공인회계사회는 분양공사 관련하여 동일한 수분양자에 대한 채권(분양미수금)과\n채무(분양선수금)는 실질에 맞게 상계하여 순액으로 표시함이 타당하다고 판단함\n4. 감사절차 미흡사항\n회계감사기준 200(독립된 감사인의 전반목적 및 감사기준에 따른 감사의 수행), 500(감사\n증거)과 700(재무제표에 대한 의견형성과 보고) 등에 따르면 감사인은 재무제표를 중요\n하게 왜곡표시 시킬 수 있는 상황이 존재할 수 있다는 전문가적인 의구심을 가지고 감사\n업무를 계획하고 수행하여야 하며, 감사인은 감사의견 형성의 기초가 될 합리적인 감사\n결론을 도출할 수 있도록 충분하고 적합한 감사증거를 확보하여야 하고, 재무제표가\n일반적으로 인정된 회계처리기준에 따라 중요성의 관점에서 적정하게 표시되고 있다고\n판단했을 경우에만 적정의견을 표명하도록 규정되어 있음\n감사인은 분양계약에 따른 분양미수금 관련 계산 검증, 회수가능성 검토와 보고기간\n이후 회수내역 검토 등 통상적인 절차는 수행하였으나, ‘23년 수분양자가 중도금 대출을\n받지 못하게 되어 회사의 분양미수금 잔액이 급증하는 특이사항이 발생하여 분양\n미수금과 분양선수금 상계 회계처리가 중요하게 되었음에도, 수분양자별 분양미수금과\n분양선수금 잔액 비교 또는 상계 여부 등의 검토절차를 소홀히 하였음\n5. 시사점\n회사는 동일 프로젝트 및 동일 거래상대방(수분양자 등)에 대해 발생하는 채권(미청구\n공사, 분양미수금)이나 채무(초과청구공사, 분양선수금) 등은 계약서 내용 등을 면밀히\n검토하여 상계하여 표시해야 할 필요성이 있는지 검토해야 함\n- 51 -\n감사인은 채권 또는 채무 잔액이 급격히 변동하는 경우, 그 원인을 파악하고 관련 상대\n계정과의 관계를 고려하여 재무제표 표시의 적정성을 확인하는 감사절차를 수행\n할 필요가 있음\n쟁점분야: 자산‧부채 상계\n관련기준: 일반기업회계기준 제2장(재무제표의 작성과 표시Ⅰ)\n\n회사의 회계처리:\n회사는 분양계약에 따라 계약금 및 중도금 청구 시 매출과 분양미수금을 인식하고,\n기말시점에 진행기준으로 조정하면서 기인식한 분양미수금을 상계하지 아니하고,\n분양선수금을 계상함\n- 50 -\n\n회계기준 위반 지적 내용:\n‘23년도에 수분양자에게 실행될 예정이였던 3~4차 중도금 대출이 차년도로 연기됨에\n따라, 회사로 입금되지 아니한 분양미수금 잔액이 ’23년도말 크게 증가되어, 수분양자별\n분양미수금과 분양선수금에 대한 상계 회계처리가 중요하게 되었음에도, 회사는 이에\n대한 검토를 누락하여, 분양미수금과 분양선수금을 과대계상함\n\n지적 근거 및 판단 내용:\n일반기업회계기준 제2장(재무제표의 작성과 표시Ⅰ) 문단 2.7에 의하면 재무제표는 경제적\n사실과 거래의 실질을 반영하여 기업의 재무상태와 경영성과 등을 공정하게 표시하도록\n규정하고 있음\n한국공인회계사회는 분양공사 관련하여 동일한 수분양자에 대한 채권(분양미수금)과\n채무(분양선수금)는 실질에 맞게 상계하여 순액으로 표시함이 타당하다고 판단함\n\n감사절차 미흡사항:\n회계감사기준 200(독립된 감사인의 전반목적 및 감사기준에 따른 감사의 수행), 500(감사\n증거)과 700(재무제표에 대한 의견형성과 보고) 등에 따르면 감사인은 재무제표를 중요\n하게 왜곡표시 시킬 수 있는 상황이 존재할 수 있다는 전문가적인 의구심을 가지고 감사\n업무를 계획하고 수행하여야 하며, 감사인은 감사의견 형성의 기초가 될 합리적인 감사\n결론을 도출할 수 있도록 충분하고 적합한 감사증거를 확보하여야 하고, 재무제표가\n일반적으로 인정된 회계처리기준에 따라 중요성의 관점에서 적정하게 표시되고 있다고\n판단했을 경우에만 적정의견을 표명하도록 규정되어 있음\n감사인은 분양계약에 따른 분양미수금 관련 계산 검증, 회수가능성 검토와 보고기간\n이후 회수내역 검토 등 통상적인 절차는 수행하였으나, ‘23년 수분양자가 중도금 대출을\n받지 못하게 되어 회사의 분양미수금 잔액이 급증하는 특이사항이 발생하여 분양\n미수금과 분양선수금 상계 회계처리가 중요하게 되었음에도, 수분양자별 분양미수금과\n분양선수금 잔액 비교 또는 상계 여부 등의 검토절차를 소홀히 하였음\n\n시사점:\n회사는 동일 프로젝트 및 동일 거래상대방(수분양자 등)에 대해 발생하는 채권(미청구\n공사, 분양미수금)이나 채무(초과청구공사, 분양선수금) 등은 계약서 내용 등을 면밀히\n검토하여 상계하여 표시해야 할 필요성이 있는지 검토해야 함\n- 51 -\n감사인은 채권 또는 채무 잔액이 급격히 변동하는 경우, 그 원인을 파악하고 관련 상대\n계정과의 관계를 고려하여 재무제표 표시의 적정성을 확인하는 감사절차를 수행\n할 필요가 있음"
    },
    {
      "paragraph_id": "KICPA-2025-33",
      "case_id": "KICPA-2025-33",
      "case_title": "매출채권 및 선수금 과대계상",
      "metadata": {
        "decision_year": "2025",
        "accounting_period": "’23.1.1.∼’23.12.31.\n1. 회사의 회계처리\n회사는 방위산업 관련 특수 목적용 기계 제조업을 영위하고 있으며, 고객으로부터 방산\n관련 신제품·장치·시스템 개발 등을 의뢰받아 수행함에 따른 매출을 기간에 걸쳐 인식\n(진행기준 적용)하면서, 발생한 매출채권과 선수금을 상계할 때, 관련된 「방위산업에 관한\n착수금 및 중도금 지급규칙」 등을 잘못 적용하여 청구된 비율에 해당하는 금액만을\n차감함에 따라, 동일한 고객의 동일 프로젝트에 대한 매출채권과 선수금을 각각 과다\n하게 인식하였음\n2. 회계기준 위반 지적 내용\n회사는 개발 용역을 수행함에 따른 수익을 기간에 걸쳐 인식하면서, 발생한 프로젝트별\n매출채권과 선수금을 상계할 때 관련 지급규칙의 규정을 잘못 적용하여 청구된 비율에\n해당하는 금액만을 차감(과소상계)함에 따라, 매출채권과 선수금을 각각 과대계상함\n3. 지적 근거 및 판단 내용\n기업회계기준서 제1115호(고객과의 계약에서 생기는 수익) 문단 105 및 BC317에 의하면\n기업의 수행 정도와 고객의 지급과의 관계에 따라 나머지 권리 및 수행의무는 순액기준\n으로 회계처리하여 계약자산이나 계약부채로 재무상태표에 표시하도록 규정하고 있음\n한국공인회계사회는 상기 회계기준 등을 고려하여, 동일한 고객의 동일 프로젝트에 대한\n매출채권과 선수금을 상계하면서, 계약서 또는 경제적 실질과는 달리, 별도의 규칙을\n적용하여 일부만 상계하는 것은 오류라고 판단함\n- 52 -\n4. 감사절차 미흡사항\n동 지적사례는 재무제표에 대한 심사로 종결되어 감사보고서 감리는 실시하지 아니함\n5. 시사점\n회사는 관련 기준서의 요구사항을 숙지하고, 프로젝트별 계약 조건상 지급 조건과 상계\n기준을 면밀히 검토하여 채권·채무 상계 금액이 적정한지 확인하여야 하며, 지급규칙\n등 외부 규정을 적용해야 하는 경우에도 계약 내용 및 경제적 실질과의 정합성을 고려\n하여 적용 여부를 판단해야 함",
        "issue_fields": [
          "자산‧부채 상계"
        ],
        "related_standards": [
          "기업회계기준서 제1115호(고객과의 계약에서 생기는 수익)"
        ],
        "case_type": "회계감리지적사례",
        "source": "KICPA 심사·감리 지적사례"
      },
      "content": {
        "section_1_company_accounting": {
          "section_title": "회사의 회계처리",
          "content": "회사는 방위산업 관련 특수 목적용 기계 제조업을 영위하고 있으며, 고객으로부터 방산\n관련 신제품·장치·시스템 개발 등을 의뢰받아 수행함에 따른 매출을 기간에 걸쳐 인식\n(진행기준 적용)하면서, 발생한 매출채권과 선수금을 상계할 때, 관련된 「방위산업에 관한\n착수금 및 중도금 지급규칙」 등을 잘못 적용하여 청구된 비율에 해당하는 금액만을\n차감함에 따라, 동일한 고객의 동일 프로젝트에 대한 매출채권과 선수금을 각각 과다\n하게 인식하였음"
        },
        "section_2_violation_details": {
          "section_title": "회계기준 위반 지적 내용",
          "content": "회사는 개발 용역을 수행함에 따른 수익을 기간에 걸쳐 인식하면서, 발생한 프로젝트별\n매출채권과 선수금을 상계할 때 관련 지급규칙의 규정을 잘못 적용하여 청구된 비율에\n해당하는 금액만을 차감(과소상계)함에 따라, 매출채권과 선수금을 각각 과대계상함"
        },
        "section_3_basis_judgment": {
          "section_title": "지적 근거 및 판단 내용",
          "content": "기업회계기준서 제1115호(고객과의 계약에서 생기는 수익) 문단 105 및 BC317에 의하면\n기업의 수행 정도와 고객의 지급과의 관계에 따라 나머지 권리 및 수행의무는 순액기준\n으로 회계처리하여 계약자산이나 계약부채로 재무상태표에 표시하도록 규정하고 있음\n한국공인회계사회는 상기 회계기준 등을 고려하여, 동일한 고객의 동일 프로젝트에 대한\n매출채권과 선수금을 상계하면서, 계약서 또는 경제적 실질과는 달리, 별도의 규칙을\n적용하여 일부만 상계하는 것은 오류라고 판단함\n- 52 -"
        },
        "section_4_audit_procedure": {
          "section_title": "감사절차 미흡사항",
          "content": "동 지적사례는 재무제표에 대한 심사로 종결되어 감사보고서 감리는 실시하지 아니함"
        },
        "section_5_implications": {
          "section_title": "시사점",
          "content": "회사는 관련 기준서의 요구사항을 숙지하고, 프로젝트별 계약 조건상 지급 조건과 상계\n기준을 면밀히 검토하여 채권·채무 상계 금액이 적정한지 확인하여야 하며, 지급규칙\n등 외부 규정을 적용해야 하는 경우에도 계약 내용 및 경제적 실질과의 정합성을 고려\n하여 적용 여부를 판단해야 함"
        }
      },
      "indexed_content": "케이스 ID: KICPA-2025-33\n제목: 매출채권 및 선수금 과대계상\n결정연도: 2025년\n회계결산일: ’23.1.1.∼’23.12.31.\n1. 회사의 회계처리\n회사는 방위산업 관련 특수 목적용 기계 제조업을 영위하고 있으며, 고객으로부터 방산\n관련 신제품·장치·시스템 개발 등을 의뢰받아 수행함에 따른 매출을 기간에 걸쳐 인식\n(진행기준 적용)하면서, 발생한 매출채권과 선수금을 상계할 때, 관련된 「방위산업에 관한\n착수금 및 중도금 지급규칙」 등을 잘못 적용하여 청구된 비율에 해당하는 금액만을\n차감함에 따라, 동일한 고객의 동일 프로젝트에 대한 매출채권과 선수금을 각각 과다\n하게 인식하였음\n2. 회계기준 위반 지적 내용\n회사는 개발 용역을 수행함에 따른 수익을 기간에 걸쳐 인식하면서, 발생한 프로젝트별\n매출채권과 선수금을 상계할 때 관련 지급규칙의 규정을 잘못 적용하여 청구된 비율에\n해당하는 금액만을 차감(과소상계)함에 따라, 매출채권과 선수금을 각각 과대계상함\n3. 지적 근거 및 판단 내용\n기업회계기준서 제1115호(고객과의 계약에서 생기는 수익) 문단 105 및 BC317에 의하면\n기업의 수행 정도와 고객의 지급과의 관계에 따라 나머지 권리 및 수행의무는 순액기준\n으로 회계처리하여 계약자산이나 계약부채로 재무상태표에 표시하도록 규정하고 있음\n한국공인회계사회는 상기 회계기준 등을 고려하여, 동일한 고객의 동일 프로젝트에 대한\n매출채권과 선수금을 상계하면서, 계약서 또는 경제적 실질과는 달리, 별도의 규칙을\n적용하여 일부만 상계하는 것은 오류라고 판단함\n- 52 -\n4. 감사절차 미흡사항\n동 지적사례는 재무제표에 대한 심사로 종결되어 감사보고서 감리는 실시하지 아니함\n5. 시사점\n회사는 관련 기준서의 요구사항을 숙지하고, 프로젝트별 계약 조건상 지급 조건과 상계\n기준을 면밀히 검토하여 채권·채무 상계 금액이 적정한지 확인하여야 하며, 지급규칙\n등 외부 규정을 적용해야 하는 경우에도 계약 내용 및 경제적 실질과의 정합성을 고려\n하여 적용 여부를 판단해야 함\n쟁점분야: 자산‧부채 상계\n관련기준: 기업회계기준서 제1115호(고객과의 계약에서 생기는 수익)\n\n회사의 회계처리:\n회사는 방위산업 관련 특수 목적용 기계 제조업을 영위하고 있으며, 고객으로부터 방산\n관련 신제품·장치·시스템 개발 등을 의뢰받아 수행함에 따른 매출을 기간에 걸쳐 인식\n(진행기준 적용)하면서, 발생한 매출채권과 선수금을 상계할 때, 관련된 「방위산업에 관한\n착수금 및 중도금 지급규칙」 등을 잘못 적용하여 청구된 비율에 해당하는 금액만을\n차감함에 따라, 동일한 고객의 동일 프로젝트에 대한 매출채권과 선수금을 각각 과다\n하게 인식하였음\n\n회계기준 위반 지적 내용:\n회사는 개발 용역을 수행함에 따른 수익을 기간에 걸쳐 인식하면서, 발생한 프로젝트별\n매출채권과 선수금을 상계할 때 관련 지급규칙의 규정을 잘못 적용하여 청구된 비율에\n해당하는 금액만을 차감(과소상계)함에 따라, 매출채권과 선수금을 각각 과대계상함\n\n지적 근거 및 판단 내용:\n기업회계기준서 제1115호(고객과의 계약에서 생기는 수익) 문단 105 및 BC317에 의하면\n기업의 수행 정도와 고객의 지급과의 관계에 따라 나머지 권리 및 수행의무는 순액기준\n으로 회계처리하여 계약자산이나 계약부채로 재무상태표에 표시하도록 규정하고 있음\n한국공인회계사회는 상기 회계기준 등을 고려하여, 동일한 고객의 동일 프로젝트에 대한\n매출채권과 선수금을 상계하면서, 계약서 또는 경제적 실질과는 달리, 별도의 규칙을\n적용하여 일부만 상계하는 것은 오류라고 판단함\n- 52 -\n\n감사절차 미흡사항:\n동 지적사례는 재무제표에 대한 심사로 종결되어 감사보고서 감리는 실시하지 아니함\n\n시사점:\n회사는 관련 기준서의 요구사항을 숙지하고, 프로젝트별 계약 조건상 지급 조건과 상계\n기준을 면밀히 검토하여 채권·채무 상계 금액이 적정한지 확인하여야 하며, 지급규칙\n등 외부 규정을 적용해야 하는 경우에도 계약 내용 및 경제적 실질과의 정합성을 고려\n하여 적용 여부를 판단해야 함"
    },
    {
      "paragraph_id": "KICPA-2025-34",
      "case_id": "KICPA-2025-34",
      "case_title": "장기차입금 유동성 분류 오류",
      "metadata": {
        "decision_year": "2025",
        "accounting_period": "’23.1.1.∼’23.12.31.\n1. 회사의 회계처리\n회사는 약정상 보고기간종료일로부터 1년 이내 상환기일이 도래하는 차입금에 대하여,\n차입금을 상회하는 담보가 제공되어 있고, 기중 공사예상기간이 연장되어 관련 차입금\n만기 또한 연장될 것으로 판단하고 장기차입금으로 분류함\n2. 회계기준 위반 지적 내용\n회사는 보고기간종료일 현재 1년 이상 결제를 연기할 수 있는 무조건의 권리를 가지고\n있지 않은 차입금 등은 유동부채로 분류해야 함에도 이를 비유동부채(장기차입금)로 잘못\n분류함\n3. 지적 근거 및 판단 내용\n일반기업회계기준 제2장(재무제표의 작성과 표시Ⅰ) 문단2.22에 따르면 보고기간종료일로\n부터 1년 이내에 상환되어야 하는 단기차입금 등의 부채 또는 보고기간 후 1년 이상 결제를\n연기할 수 있는 무조건의 권리를 가지고 있지 않은 부채는 유동부채로 분류하여야 함\n한국공인회계사회는 1년 이내에 만기가 도래하는 차입금에 대하여 대주단과의 협의로\n- 53 -\n만기 연장 가능성이 높다고 회사가 판단하였더라도, 계약서상 보고기간말 현재 회사가\n1년 이상 결제를 연기할 수 있는 무조건적인 권리를 가지고 있지 않는다고 판단함\n4. 감사절차 미흡사항\n회계감사기준 200(독립된 감사인의 전반목적 및 감사기준에 따른 감사의 수행), 500(감사\n증거)과 700(재무제표에 대한 의견형성과 보고) 등에 따르면 감사인은 재무제표를 중요\n하게 왜곡표시 시킬 수 있는 상황이 존재할 수 있다는 전문가적인 의구심을 가지고 감사\n업무를 계획하고 수행하여야 하며, 감사인은 감사의견 형성의 기초가 될 합리적인 감사\n결론을 도출할 수 있도록 충분하고 적합한 감사증거를 확보하여야 하고, 재무제표가\n일반적으로 인정된 회계처리기준에 따라 중요성의 관점에서 적정하게 표시되고 있다고\n판단했을 경우에만 적정의견을 표명하도록 규정되어 있음\n감사인은 차입금의 내역 파악, 금융기관 조회서 수행 등의 감사절차는 수행하였으나,\n장기차입금의 계약서를 면밀히 검토하지 않아 보고기간종료일로부터 1년 이내 만기가\n도래하는 점을 파악하지 못하는 등 차입금 관련 감사절차를 소홀히 하였음\n5. 시사점\n계약서상 기업에게 부채의 연장에 대한 재량권이 없다면, 만기 연장 가능성을 고려하지\n않고 유동부채로 분류하여야 하므로, 회사는 차입금 계약서의 계약조건, 만기일 등 세부\n조항을 면밀히 파악하여 유동성 분류를 하여야 함",
        "issue_fields": [
          "유동·비유동 계정분류"
        ],
        "related_standards": [
          "일반기업회계기준 제2장(재무제표의 작성과 표시Ⅰ)"
        ],
        "case_type": "회계감리지적사례",
        "source": "KICPA 심사·감리 지적사례"
      },
      "content": {
        "section_1_company_accounting": {
          "section_title": "회사의 회계처리",
          "content": "회사는 약정상 보고기간종료일로부터 1년 이내 상환기일이 도래하는 차입금에 대하여,\n차입금을 상회하는 담보가 제공되어 있고, 기중 공사예상기간이 연장되어 관련 차입금\n만기 또한 연장될 것으로 판단하고 장기차입금으로 분류함"
        },
        "section_2_violation_details": {
          "section_title": "회계기준 위반 지적 내용",
          "content": "회사는 보고기간종료일 현재 1년 이상 결제를 연기할 수 있는 무조건의 권리를 가지고\n있지 않은 차입금 등은 유동부채로 분류해야 함에도 이를 비유동부채(장기차입금)로 잘못\n분류함"
        },
        "section_3_basis_judgment": {
          "section_title": "지적 근거 및 판단 내용",
          "content": "일반기업회계기준 제2장(재무제표의 작성과 표시Ⅰ) 문단2.22에 따르면 보고기간종료일로\n부터 1년 이내에 상환되어야 하는 단기차입금 등의 부채 또는 보고기간 후 1년 이상 결제를\n연기할 수 있는 무조건의 권리를 가지고 있지 않은 부채는 유동부채로 분류하여야 함\n한국공인회계사회는 1년 이내에 만기가 도래하는 차입금에 대하여 대주단과의 협의로\n- 53 -\n만기 연장 가능성이 높다고 회사가 판단하였더라도, 계약서상 보고기간말 현재 회사가\n1년 이상 결제를 연기할 수 있는 무조건적인 권리를 가지고 있지 않는다고 판단함"
        },
        "section_4_audit_procedure": {
          "section_title": "감사절차 미흡사항",
          "content": "회계감사기준 200(독립된 감사인의 전반목적 및 감사기준에 따른 감사의 수행), 500(감사\n증거)과 700(재무제표에 대한 의견형성과 보고) 등에 따르면 감사인은 재무제표를 중요\n하게 왜곡표시 시킬 수 있는 상황이 존재할 수 있다는 전문가적인 의구심을 가지고 감사\n업무를 계획하고 수행하여야 하며, 감사인은 감사의견 형성의 기초가 될 합리적인 감사\n결론을 도출할 수 있도록 충분하고 적합한 감사증거를 확보하여야 하고, 재무제표가\n일반적으로 인정된 회계처리기준에 따라 중요성의 관점에서 적정하게 표시되고 있다고\n판단했을 경우에만 적정의견을 표명하도록 규정되어 있음\n감사인은 차입금의 내역 파악, 금융기관 조회서 수행 등의 감사절차는 수행하였으나,\n장기차입금의 계약서를 면밀히 검토하지 않아 보고기간종료일로부터 1년 이내 만기가\n도래하는 점을 파악하지 못하는 등 차입금 관련 감사절차를 소홀히 하였음"
        },
        "section_5_implications": {
          "section_title": "시사점",
          "content": "계약서상 기업에게 부채의 연장에 대한 재량권이 없다면, 만기 연장 가능성을 고려하지\n않고 유동부채로 분류하여야 하므로, 회사는 차입금 계약서의 계약조건, 만기일 등 세부\n조항을 면밀히 파악하여 유동성 분류를 하여야 함"
        }
      },
      "indexed_content": "케이스 ID: KICPA-2025-34\n제목: 장기차입금 유동성 분류 오류\n결정연도: 2025년\n회계결산일: ’23.1.1.∼’23.12.31.\n1. 회사의 회계처리\n회사는 약정상 보고기간종료일로부터 1년 이내 상환기일이 도래하는 차입금에 대하여,\n차입금을 상회하는 담보가 제공되어 있고, 기중 공사예상기간이 연장되어 관련 차입금\n만기 또한 연장될 것으로 판단하고 장기차입금으로 분류함\n2. 회계기준 위반 지적 내용\n회사는 보고기간종료일 현재 1년 이상 결제를 연기할 수 있는 무조건의 권리를 가지고\n있지 않은 차입금 등은 유동부채로 분류해야 함에도 이를 비유동부채(장기차입금)로 잘못\n분류함\n3. 지적 근거 및 판단 내용\n일반기업회계기준 제2장(재무제표의 작성과 표시Ⅰ) 문단2.22에 따르면 보고기간종료일로\n부터 1년 이내에 상환되어야 하는 단기차입금 등의 부채 또는 보고기간 후 1년 이상 결제를\n연기할 수 있는 무조건의 권리를 가지고 있지 않은 부채는 유동부채로 분류하여야 함\n한국공인회계사회는 1년 이내에 만기가 도래하는 차입금에 대하여 대주단과의 협의로\n- 53 -\n만기 연장 가능성이 높다고 회사가 판단하였더라도, 계약서상 보고기간말 현재 회사가\n1년 이상 결제를 연기할 수 있는 무조건적인 권리를 가지고 있지 않는다고 판단함\n4. 감사절차 미흡사항\n회계감사기준 200(독립된 감사인의 전반목적 및 감사기준에 따른 감사의 수행), 500(감사\n증거)과 700(재무제표에 대한 의견형성과 보고) 등에 따르면 감사인은 재무제표를 중요\n하게 왜곡표시 시킬 수 있는 상황이 존재할 수 있다는 전문가적인 의구심을 가지고 감사\n업무를 계획하고 수행하여야 하며, 감사인은 감사의견 형성의 기초가 될 합리적인 감사\n결론을 도출할 수 있도록 충분하고 적합한 감사증거를 확보하여야 하고, 재무제표가\n일반적으로 인정된 회계처리기준에 따라 중요성의 관점에서 적정하게 표시되고 있다고\n판단했을 경우에만 적정의견을 표명하도록 규정되어 있음\n감사인은 차입금의 내역 파악, 금융기관 조회서 수행 등의 감사절차는 수행하였으나,\n장기차입금의 계약서를 면밀히 검토하지 않아 보고기간종료일로부터 1년 이내 만기가\n도래하는 점을 파악하지 못하는 등 차입금 관련 감사절차를 소홀히 하였음\n5. 시사점\n계약서상 기업에게 부채의 연장에 대한 재량권이 없다면, 만기 연장 가능성을 고려하지\n않고 유동부채로 분류하여야 하므로, 회사는 차입금 계약서의 계약조건, 만기일 등 세부\n조항을 면밀히 파악하여 유동성 분류를 하여야 함\n쟁점분야: 유동·비유동 계정분류\n관련기준: 일반기업회계기준 제2장(재무제표의 작성과 표시Ⅰ)\n\n회사의 회계처리:\n회사는 약정상 보고기간종료일로부터 1년 이내 상환기일이 도래하는 차입금에 대하여,\n차입금을 상회하는 담보가 제공되어 있고, 기중 공사예상기간이 연장되어 관련 차입금\n만기 또한 연장될 것으로 판단하고 장기차입금으로 분류함\n\n회계기준 위반 지적 내용:\n회사는 보고기간종료일 현재 1년 이상 결제를 연기할 수 있는 무조건의 권리를 가지고\n있지 않은 차입금 등은 유동부채로 분류해야 함에도 이를 비유동부채(장기차입금)로 잘못\n분류함\n\n지적 근거 및 판단 내용:\n일반기업회계기준 제2장(재무제표의 작성과 표시Ⅰ) 문단2.22에 따르면 보고기간종료일로\n부터 1년 이내에 상환되어야 하는 단기차입금 등의 부채 또는 보고기간 후 1년 이상 결제를\n연기할 수 있는 무조건의 권리를 가지고 있지 않은 부채는 유동부채로 분류하여야 함\n한국공인회계사회는 1년 이내에 만기가 도래하는 차입금에 대하여 대주단과의 협의로\n- 53 -\n만기 연장 가능성이 높다고 회사가 판단하였더라도, 계약서상 보고기간말 현재 회사가\n1년 이상 결제를 연기할 수 있는 무조건적인 권리를 가지고 있지 않는다고 판단함\n\n감사절차 미흡사항:\n회계감사기준 200(독립된 감사인의 전반목적 및 감사기준에 따른 감사의 수행), 500(감사\n증거)과 700(재무제표에 대한 의견형성과 보고) 등에 따르면 감사인은 재무제표를 중요\n하게 왜곡표시 시킬 수 있는 상황이 존재할 수 있다는 전문가적인 의구심을 가지고 감사\n업무를 계획하고 수행하여야 하며, 감사인은 감사의견 형성의 기초가 될 합리적인 감사\n결론을 도출할 수 있도록 충분하고 적합한 감사증거를 확보하여야 하고, 재무제표가\n일반적으로 인정된 회계처리기준에 따라 중요성의 관점에서 적정하게 표시되고 있다고\n판단했을 경우에만 적정의견을 표명하도록 규정되어 있음\n감사인은 차입금의 내역 파악, 금융기관 조회서 수행 등의 감사절차는 수행하였으나,\n장기차입금의 계약서를 면밀히 검토하지 않아 보고기간종료일로부터 1년 이내 만기가\n도래하는 점을 파악하지 못하는 등 차입금 관련 감사절차를 소홀히 하였음\n\n시사점:\n계약서상 기업에게 부채의 연장에 대한 재량권이 없다면, 만기 연장 가능성을 고려하지\n않고 유동부채로 분류하여야 하므로, 회사는 차입금 계약서의 계약조건, 만기일 등 세부\n조항을 면밀히 파악하여 유동성 분류를 하여야 함"
    },
    {
      "paragraph_id": "KICPA-2025-35",
      "case_id": "KICPA-2025-35",
      "case_title": "장기차입금 등 유동성 분류 오류",
      "metadata": {
        "decision_year": "2025",
        "accounting_period": "’22.1.1.∼’23.12.31.\n1. 회사의 회계처리\n회사는 보고기간종료일로부터 1년 이상 결제를 연기할 수 있는 무조건의 권리를\n가지고 있지 않은 차입금(보고기간종료일로부터 1년 이내에 만기도래)에 대해 건물이 담보로\n제공되어 있고, 약정에 따른 이자비용 지급을 연체한 사실이 없는 점 등을 고려 시\n- 54 -\n대출 연장이 가능할 것으로 판단하고 장기차입금으로 분류하였으며,\n보고기간종료일로부터 1년 이내에 계약기간이 종료하는 임대보증금에 대해 보고기간\n종료일과 재무제표가 사실상 확정된 날 사이에 임대계약이 갱신되었거나, 임대계약이\n연장되지 않더라도 공실없이 지속적으로 임대가 이루어지고 있어 차환가능성을 고려\n하여 장기부채로 분류하였음\n2. 회계기준 위반 지적 내용\n회사는 보고기간종료일로부터 1년 이내에 만기가 도래하는 차입금이나 임대보증금에\n대하여 상환 요구를 거부하거나 계약을 연기할 수 있는 권리가 없다면 유동부채로\n분류해야 함에도 이를 비유동부채(장기차입금 및 장기임대보증금)로 잘못 분류함\n3. 지적 근거 및 판단 내용\n일반기업회계기준 제2장(재무제표의 작성과 표시Ⅰ) 문단 2.22에 의하면 보고기간종료일\n로부터 1년 이내에 상환되어야 하는 단기차입금 등의 부채 또는 보고기간 후 1년 이상\n결제를 연기할 수 있는 무조건의 권리를 가지고 있지 않은 부채는 유동부채로 분류하고,\n그 밖의 모든 부채는 비유동부채로 분류하도록 규정하고 있음\n한국공인회계사회는 상기 회계기준 등을 고려하여, 1년 이내에 만기가 도래하는 차입금\n이나 계약기간이 종료하는 임대보증금에 대하여 만기연장가능성이나 차환가능성이 높은\n사실은 회사가 보고기간 후 1년 이상 결제를 연기할 수 있는 무조건적인 권리를\n보유하고 있는 사례에 해당하지 않는다고 판단함\n4. 감사절차 미흡사항\n동 지적사례는 재무제표에 대한 심사로 종결되어 감사보고서 감리는 실시하지 아니함\n5. 시사점\n회사는 차입금 약정서(계약서) 및 임대계약서의 계약조건, 만기일 등 세부조항을\n면밀히 파악하여 회사에 부채의 차환이나 연장에 대한 권리가 없다면 만기연장\n가능성이나 차환가능성을 고려하지 않고 유동부채로 분류하여야 함\n- 55 -",
        "issue_fields": [
          "유동·비유동 계정분류"
        ],
        "related_standards": [
          "일반기업회계기준 제2장(재무제표의 작성과 표시Ⅰ)"
        ],
        "case_type": "회계감리지적사례",
        "source": "KICPA 심사·감리 지적사례"
      },
      "content": {
        "section_1_company_accounting": {
          "section_title": "회사의 회계처리",
          "content": "회사는 보고기간종료일로부터 1년 이상 결제를 연기할 수 있는 무조건의 권리를\n가지고 있지 않은 차입금(보고기간종료일로부터 1년 이내에 만기도래)에 대해 건물이 담보로\n제공되어 있고, 약정에 따른 이자비용 지급을 연체한 사실이 없는 점 등을 고려 시\n- 54 -\n대출 연장이 가능할 것으로 판단하고 장기차입금으로 분류하였으며,\n보고기간종료일로부터 1년 이내에 계약기간이 종료하는 임대보증금에 대해 보고기간\n종료일과 재무제표가 사실상 확정된 날 사이에 임대계약이 갱신되었거나, 임대계약이\n연장되지 않더라도 공실없이 지속적으로 임대가 이루어지고 있어 차환가능성을 고려\n하여 장기부채로 분류하였음"
        },
        "section_2_violation_details": {
          "section_title": "회계기준 위반 지적 내용",
          "content": "회사는 보고기간종료일로부터 1년 이내에 만기가 도래하는 차입금이나 임대보증금에\n대하여 상환 요구를 거부하거나 계약을 연기할 수 있는 권리가 없다면 유동부채로\n분류해야 함에도 이를 비유동부채(장기차입금 및 장기임대보증금)로 잘못 분류함"
        },
        "section_3_basis_judgment": {
          "section_title": "지적 근거 및 판단 내용",
          "content": "일반기업회계기준 제2장(재무제표의 작성과 표시Ⅰ) 문단 2.22에 의하면 보고기간종료일\n로부터 1년 이내에 상환되어야 하는 단기차입금 등의 부채 또는 보고기간 후 1년 이상\n결제를 연기할 수 있는 무조건의 권리를 가지고 있지 않은 부채는 유동부채로 분류하고,\n그 밖의 모든 부채는 비유동부채로 분류하도록 규정하고 있음\n한국공인회계사회는 상기 회계기준 등을 고려하여, 1년 이내에 만기가 도래하는 차입금\n이나 계약기간이 종료하는 임대보증금에 대하여 만기연장가능성이나 차환가능성이 높은\n사실은 회사가 보고기간 후 1년 이상 결제를 연기할 수 있는 무조건적인 권리를\n보유하고 있는 사례에 해당하지 않는다고 판단함"
        },
        "section_4_audit_procedure": {
          "section_title": "감사절차 미흡사항",
          "content": "동 지적사례는 재무제표에 대한 심사로 종결되어 감사보고서 감리는 실시하지 아니함"
        },
        "section_5_implications": {
          "section_title": "시사점",
          "content": "회사는 차입금 약정서(계약서) 및 임대계약서의 계약조건, 만기일 등 세부조항을\n면밀히 파악하여 회사에 부채의 차환이나 연장에 대한 권리가 없다면 만기연장\n가능성이나 차환가능성을 고려하지 않고 유동부채로 분류하여야 함\n- 55 -"
        }
      },
      "indexed_content": "케이스 ID: KICPA-2025-35\n제목: 장기차입금 등 유동성 분류 오류\n결정연도: 2025년\n회계결산일: ’22.1.1.∼’23.12.31.\n1. 회사의 회계처리\n회사는 보고기간종료일로부터 1년 이상 결제를 연기할 수 있는 무조건의 권리를\n가지고 있지 않은 차입금(보고기간종료일로부터 1년 이내에 만기도래)에 대해 건물이 담보로\n제공되어 있고, 약정에 따른 이자비용 지급을 연체한 사실이 없는 점 등을 고려 시\n- 54 -\n대출 연장이 가능할 것으로 판단하고 장기차입금으로 분류하였으며,\n보고기간종료일로부터 1년 이내에 계약기간이 종료하는 임대보증금에 대해 보고기간\n종료일과 재무제표가 사실상 확정된 날 사이에 임대계약이 갱신되었거나, 임대계약이\n연장되지 않더라도 공실없이 지속적으로 임대가 이루어지고 있어 차환가능성을 고려\n하여 장기부채로 분류하였음\n2. 회계기준 위반 지적 내용\n회사는 보고기간종료일로부터 1년 이내에 만기가 도래하는 차입금이나 임대보증금에\n대하여 상환 요구를 거부하거나 계약을 연기할 수 있는 권리가 없다면 유동부채로\n분류해야 함에도 이를 비유동부채(장기차입금 및 장기임대보증금)로 잘못 분류함\n3. 지적 근거 및 판단 내용\n일반기업회계기준 제2장(재무제표의 작성과 표시Ⅰ) 문단 2.22에 의하면 보고기간종료일\n로부터 1년 이내에 상환되어야 하는 단기차입금 등의 부채 또는 보고기간 후 1년 이상\n결제를 연기할 수 있는 무조건의 권리를 가지고 있지 않은 부채는 유동부채로 분류하고,\n그 밖의 모든 부채는 비유동부채로 분류하도록 규정하고 있음\n한국공인회계사회는 상기 회계기준 등을 고려하여, 1년 이내에 만기가 도래하는 차입금\n이나 계약기간이 종료하는 임대보증금에 대하여 만기연장가능성이나 차환가능성이 높은\n사실은 회사가 보고기간 후 1년 이상 결제를 연기할 수 있는 무조건적인 권리를\n보유하고 있는 사례에 해당하지 않는다고 판단함\n4. 감사절차 미흡사항\n동 지적사례는 재무제표에 대한 심사로 종결되어 감사보고서 감리는 실시하지 아니함\n5. 시사점\n회사는 차입금 약정서(계약서) 및 임대계약서의 계약조건, 만기일 등 세부조항을\n면밀히 파악하여 회사에 부채의 차환이나 연장에 대한 권리가 없다면 만기연장\n가능성이나 차환가능성을 고려하지 않고 유동부채로 분류하여야 함\n- 55 -\n쟁점분야: 유동·비유동 계정분류\n관련기준: 일반기업회계기준 제2장(재무제표의 작성과 표시Ⅰ)\n\n회사의 회계처리:\n회사는 보고기간종료일로부터 1년 이상 결제를 연기할 수 있는 무조건의 권리를\n가지고 있지 않은 차입금(보고기간종료일로부터 1년 이내에 만기도래)에 대해 건물이 담보로\n제공되어 있고, 약정에 따른 이자비용 지급을 연체한 사실이 없는 점 등을 고려 시\n- 54 -\n대출 연장이 가능할 것으로 판단하고 장기차입금으로 분류하였으며,\n보고기간종료일로부터 1년 이내에 계약기간이 종료하는 임대보증금에 대해 보고기간\n종료일과 재무제표가 사실상 확정된 날 사이에 임대계약이 갱신되었거나, 임대계약이\n연장되지 않더라도 공실없이 지속적으로 임대가 이루어지고 있어 차환가능성을 고려\n하여 장기부채로 분류하였음\n\n회계기준 위반 지적 내용:\n회사는 보고기간종료일로부터 1년 이내에 만기가 도래하는 차입금이나 임대보증금에\n대하여 상환 요구를 거부하거나 계약을 연기할 수 있는 권리가 없다면 유동부채로\n분류해야 함에도 이를 비유동부채(장기차입금 및 장기임대보증금)로 잘못 분류함\n\n지적 근거 및 판단 내용:\n일반기업회계기준 제2장(재무제표의 작성과 표시Ⅰ) 문단 2.22에 의하면 보고기간종료일\n로부터 1년 이내에 상환되어야 하는 단기차입금 등의 부채 또는 보고기간 후 1년 이상\n결제를 연기할 수 있는 무조건의 권리를 가지고 있지 않은 부채는 유동부채로 분류하고,\n그 밖의 모든 부채는 비유동부채로 분류하도록 규정하고 있음\n한국공인회계사회는 상기 회계기준 등을 고려하여, 1년 이내에 만기가 도래하는 차입금\n이나 계약기간이 종료하는 임대보증금에 대하여 만기연장가능성이나 차환가능성이 높은\n사실은 회사가 보고기간 후 1년 이상 결제를 연기할 수 있는 무조건적인 권리를\n보유하고 있는 사례에 해당하지 않는다고 판단함\n\n감사절차 미흡사항:\n동 지적사례는 재무제표에 대한 심사로 종결되어 감사보고서 감리는 실시하지 아니함\n\n시사점:\n회사는 차입금 약정서(계약서) 및 임대계약서의 계약조건, 만기일 등 세부조항을\n면밀히 파악하여 회사에 부채의 차환이나 연장에 대한 권리가 없다면 만기연장\n가능성이나 차환가능성을 고려하지 않고 유동부채로 분류하여야 함\n- 55 -"
    },
    {
      "paragraph_id": "KICPA-2025-36",
      "case_id": "KICPA-2025-36",
      "case_title": "장기선수금의 유동성 분류 오류",
      "metadata": {
        "decision_year": "2025",
        "accounting_period": "’22.1.1.∼’23.12.31.\n1. 회사의 회계처리\n회사는 거래처와 물품공급계약 체결후 계약금액의 일부를 선수금으로 수령함. 해당\n선수금은 납품시 거래처가 공제율을 통보하고 있어 회사는 소멸 시점을 예측할 수\n없음. 회사는 선수금과 관련된 매출의 잔여 계약기간이 결산일 현재 1년을 초과하고\n선수금의 정확한 소멸 시점을 파악하기 어렵다고 판단하여 이를 전액 비유동부채로\n회계처리 하였음\n2. 회계기준 위반 지적 내용\n회사의 선수금은 보고기간종료일로부터 1년 이상 결제를 연기할 수 있는 무조건의\n권리를 가지고 있지 않음에도 이를 유동부채로 분류하지 않고 비유동부채(장기선수금)\n으로 잘못 분류함\n3. 지적 근거 및 판단 내용\n일반기업회계기준 제2장(재무제표의 작성과 표시I) 문단 2.22와 2.24에 따르면 보고기간\n종료일로부터 1년 이내에 상환되어야 하는 단기차입금 등의 부채 또는 보고기간 후 1년\n이상 결제를 연기할 수 있는 무조건의 권리를 가지고 있지 않은 부채는 유동부채로 분류\n하고, 그 밖의 모든 부채는 비유동부채로 분류하도록 규정하고 있음\n한국공인회계사회는 상기 회계기준 등을 고려하여, 해당 선수금은 회사가 보고기간\n종료일로부터 1년 이상 결제를 연기할 수 있는 무조건의 권리를 가지고 있지 않으므로\n유동부채로 분류하여야 한다고 판단함\n4. 감사절차 미흡사항\n동 지적사례는 재무제표에 대한 심사로 종결되어 감사보고서 감리는 실시하지 아니함\n- 56 -\n5. 시사점\n회사는 부채와 관련하여 관련 계약서 및 경제적 실질 등을 종합적으로 검토한 후\n보고기간 종료일로부터 1년 이상 결제를 연기할 수 있는 무조건의 권리를 가지고 있지\n않는 부채의 경우 유동부채로 분류하여야 함\n3 특수관계자거래, 우발부채 관련 사항 등 주석미기재(C, D유형)",
        "issue_fields": [
          "유동·비유동 계정분류"
        ],
        "related_standards": [
          "일반기업회계기준 제2장(재무제표의 작성과 표시I)"
        ],
        "case_type": "회계감리지적사례",
        "source": "KICPA 심사·감리 지적사례"
      },
      "content": {
        "section_1_company_accounting": {
          "section_title": "회사의 회계처리",
          "content": "회사는 거래처와 물품공급계약 체결후 계약금액의 일부를 선수금으로 수령함. 해당\n선수금은 납품시 거래처가 공제율을 통보하고 있어 회사는 소멸 시점을 예측할 수\n없음. 회사는 선수금과 관련된 매출의 잔여 계약기간이 결산일 현재 1년을 초과하고\n선수금의 정확한 소멸 시점을 파악하기 어렵다고 판단하여 이를 전액 비유동부채로\n회계처리 하였음"
        },
        "section_2_violation_details": {
          "section_title": "회계기준 위반 지적 내용",
          "content": "회사의 선수금은 보고기간종료일로부터 1년 이상 결제를 연기할 수 있는 무조건의\n권리를 가지고 있지 않음에도 이를 유동부채로 분류하지 않고 비유동부채(장기선수금)\n으로 잘못 분류함"
        },
        "section_3_basis_judgment": {
          "section_title": "지적 근거 및 판단 내용",
          "content": "일반기업회계기준 제2장(재무제표의 작성과 표시I) 문단 2.22와 2.24에 따르면 보고기간\n종료일로부터 1년 이내에 상환되어야 하는 단기차입금 등의 부채 또는 보고기간 후 1년\n이상 결제를 연기할 수 있는 무조건의 권리를 가지고 있지 않은 부채는 유동부채로 분류\n하고, 그 밖의 모든 부채는 비유동부채로 분류하도록 규정하고 있음\n한국공인회계사회는 상기 회계기준 등을 고려하여, 해당 선수금은 회사가 보고기간\n종료일로부터 1년 이상 결제를 연기할 수 있는 무조건의 권리를 가지고 있지 않으므로\n유동부채로 분류하여야 한다고 판단함"
        },
        "section_4_audit_procedure": {
          "section_title": "감사절차 미흡사항",
          "content": "동 지적사례는 재무제표에 대한 심사로 종결되어 감사보고서 감리는 실시하지 아니함\n- 56 -"
        },
        "section_5_implications": {
          "section_title": "시사점",
          "content": "회사는 부채와 관련하여 관련 계약서 및 경제적 실질 등을 종합적으로 검토한 후\n보고기간 종료일로부터 1년 이상 결제를 연기할 수 있는 무조건의 권리를 가지고 있지\n않는 부채의 경우 유동부채로 분류하여야 함\n3 특수관계자거래, 우발부채 관련 사항 등 주석미기재(C, D유형)"
        }
      },
      "indexed_content": "케이스 ID: KICPA-2025-36\n제목: 장기선수금의 유동성 분류 오류\n결정연도: 2025년\n회계결산일: ’22.1.1.∼’23.12.31.\n1. 회사의 회계처리\n회사는 거래처와 물품공급계약 체결후 계약금액의 일부를 선수금으로 수령함. 해당\n선수금은 납품시 거래처가 공제율을 통보하고 있어 회사는 소멸 시점을 예측할 수\n없음. 회사는 선수금과 관련된 매출의 잔여 계약기간이 결산일 현재 1년을 초과하고\n선수금의 정확한 소멸 시점을 파악하기 어렵다고 판단하여 이를 전액 비유동부채로\n회계처리 하였음\n2. 회계기준 위반 지적 내용\n회사의 선수금은 보고기간종료일로부터 1년 이상 결제를 연기할 수 있는 무조건의\n권리를 가지고 있지 않음에도 이를 유동부채로 분류하지 않고 비유동부채(장기선수금)\n으로 잘못 분류함\n3. 지적 근거 및 판단 내용\n일반기업회계기준 제2장(재무제표의 작성과 표시I) 문단 2.22와 2.24에 따르면 보고기간\n종료일로부터 1년 이내에 상환되어야 하는 단기차입금 등의 부채 또는 보고기간 후 1년\n이상 결제를 연기할 수 있는 무조건의 권리를 가지고 있지 않은 부채는 유동부채로 분류\n하고, 그 밖의 모든 부채는 비유동부채로 분류하도록 규정하고 있음\n한국공인회계사회는 상기 회계기준 등을 고려하여, 해당 선수금은 회사가 보고기간\n종료일로부터 1년 이상 결제를 연기할 수 있는 무조건의 권리를 가지고 있지 않으므로\n유동부채로 분류하여야 한다고 판단함\n4. 감사절차 미흡사항\n동 지적사례는 재무제표에 대한 심사로 종결되어 감사보고서 감리는 실시하지 아니함\n- 56 -\n5. 시사점\n회사는 부채와 관련하여 관련 계약서 및 경제적 실질 등을 종합적으로 검토한 후\n보고기간 종료일로부터 1년 이상 결제를 연기할 수 있는 무조건의 권리를 가지고 있지\n않는 부채의 경우 유동부채로 분류하여야 함\n3 특수관계자거래, 우발부채 관련 사항 등 주석미기재(C, D유형)\n쟁점분야: 유동·비유동 계정분류\n관련기준: 일반기업회계기준 제2장(재무제표의 작성과 표시I)\n\n회사의 회계처리:\n회사는 거래처와 물품공급계약 체결후 계약금액의 일부를 선수금으로 수령함. 해당\n선수금은 납품시 거래처가 공제율을 통보하고 있어 회사는 소멸 시점을 예측할 수\n없음. 회사는 선수금과 관련된 매출의 잔여 계약기간이 결산일 현재 1년을 초과하고\n선수금의 정확한 소멸 시점을 파악하기 어렵다고 판단하여 이를 전액 비유동부채로\n회계처리 하였음\n\n회계기준 위반 지적 내용:\n회사의 선수금은 보고기간종료일로부터 1년 이상 결제를 연기할 수 있는 무조건의\n권리를 가지고 있지 않음에도 이를 유동부채로 분류하지 않고 비유동부채(장기선수금)\n으로 잘못 분류함\n\n지적 근거 및 판단 내용:\n일반기업회계기준 제2장(재무제표의 작성과 표시I) 문단 2.22와 2.24에 따르면 보고기간\n종료일로부터 1년 이내에 상환되어야 하는 단기차입금 등의 부채 또는 보고기간 후 1년\n이상 결제를 연기할 수 있는 무조건의 권리를 가지고 있지 않은 부채는 유동부채로 분류\n하고, 그 밖의 모든 부채는 비유동부채로 분류하도록 규정하고 있음\n한국공인회계사회는 상기 회계기준 등을 고려하여, 해당 선수금은 회사가 보고기간\n종료일로부터 1년 이상 결제를 연기할 수 있는 무조건의 권리를 가지고 있지 않으므로\n유동부채로 분류하여야 한다고 판단함\n\n감사절차 미흡사항:\n동 지적사례는 재무제표에 대한 심사로 종결되어 감사보고서 감리는 실시하지 아니함\n- 56 -\n\n시사점:\n회사는 부채와 관련하여 관련 계약서 및 경제적 실질 등을 종합적으로 검토한 후\n보고기간 종료일로부터 1년 이상 결제를 연기할 수 있는 무조건의 권리를 가지고 있지\n않는 부채의 경우 유동부채로 분류하여야 함\n3 특수관계자거래, 우발부채 관련 사항 등 주석미기재(C, D유형)"
    },
    {
      "paragraph_id": "KICPA-2025-37",
      "case_id": "KICPA-2025-37",
      "case_title": "특수관계자 거래 주석 미기재(기중 자금거래)",
      "metadata": {
        "decision_year": "2025",
        "accounting_period": "’22.1.1.∼’22.12.31.\n1. 회사의 회계처리\n회사는 회사와 최대주주가 동일한 특수관계자*와 기중 자금의 차입 및 상환 거래가\n빈번하게 발생하였고, 최대주주인 대표이사에 대한 자금 대여 및 회수거래가 존재\n함에도 주석에 차입금 및 대여금의 잔액은 기재하였으나, 기중 거래금액을 주석에\n기재하지 않음\n* 회사를 지배하는 개인(대표이사)이 유의적인 영향력을 행사할 수 있는 회사에 해당\n2. 회계기준 위반 지적 내용\n회사는 특수관계자와의 기중 거래금액을 주석에 기재하지 아니함\n3. 지적 근거 및 판단 내용\n일반기업회계기준 제25장(특수관계자 공시) 문단 25.6에 따르면 특수관계자 거래가 있는\n경우, 재무제표에 미치는 특수관계의 잠재적 영향을 파악하는 데 필요한 특수관계자와의\n거래금액에 대한 정보를 주석으로 기재하도록 규정하고 있음\n한국공인회계사회는 상기 회계기준 등을 고려하여, 특수관계자와의 기중 자금거래금액은\n특수관계자거래로 주석에 공시하여야 함에도 이를 누락하였다고 판단함\n- 57 -\n4. 감사절차 미흡사항\n동 지적사례는 재무제표에 대한 심사로 종결되어 감사보고서 감리는 실시하지 아니함\n5. 시사점\n회사는 특수관계자 공시 관련 회계처리 기준서를 숙지하고. 특수관계자와의 거래 정보가\n정보이용자에게 적절하게 제공될 수 있도록 재무제표 주석 점검 절차를 강화할 필요가\n있으며, 특수관계자와의 거래를 주석으로 기재 시 기초 및 기말 잔액만이 아니라\n기중거래 금액도 기재하여야 함을 유의하여야 함",
        "issue_fields": [
          "특수관계자 거래 주석"
        ],
        "related_standards": [
          "일반기업회계기준 제25장(특수관계자 공시)"
        ],
        "case_type": "회계감리지적사례",
        "source": "KICPA 심사·감리 지적사례"
      },
      "content": {
        "section_1_company_accounting": {
          "section_title": "회사의 회계처리",
          "content": "회사는 회사와 최대주주가 동일한 특수관계자*와 기중 자금의 차입 및 상환 거래가\n빈번하게 발생하였고, 최대주주인 대표이사에 대한 자금 대여 및 회수거래가 존재\n함에도 주석에 차입금 및 대여금의 잔액은 기재하였으나, 기중 거래금액을 주석에\n기재하지 않음\n* 회사를 지배하는 개인(대표이사)이 유의적인 영향력을 행사할 수 있는 회사에 해당"
        },
        "section_2_violation_details": {
          "section_title": "회계기준 위반 지적 내용",
          "content": "회사는 특수관계자와의 기중 거래금액을 주석에 기재하지 아니함"
        },
        "section_3_basis_judgment": {
          "section_title": "지적 근거 및 판단 내용",
          "content": "일반기업회계기준 제25장(특수관계자 공시) 문단 25.6에 따르면 특수관계자 거래가 있는\n경우, 재무제표에 미치는 특수관계의 잠재적 영향을 파악하는 데 필요한 특수관계자와의\n거래금액에 대한 정보를 주석으로 기재하도록 규정하고 있음\n한국공인회계사회는 상기 회계기준 등을 고려하여, 특수관계자와의 기중 자금거래금액은\n특수관계자거래로 주석에 공시하여야 함에도 이를 누락하였다고 판단함\n- 57 -"
        },
        "section_4_audit_procedure": {
          "section_title": "감사절차 미흡사항",
          "content": "동 지적사례는 재무제표에 대한 심사로 종결되어 감사보고서 감리는 실시하지 아니함"
        },
        "section_5_implications": {
          "section_title": "시사점",
          "content": "회사는 특수관계자 공시 관련 회계처리 기준서를 숙지하고. 특수관계자와의 거래 정보가\n정보이용자에게 적절하게 제공될 수 있도록 재무제표 주석 점검 절차를 강화할 필요가\n있으며, 특수관계자와의 거래를 주석으로 기재 시 기초 및 기말 잔액만이 아니라\n기중거래 금액도 기재하여야 함을 유의하여야 함"
        }
      },
      "indexed_content": "케이스 ID: KICPA-2025-37\n제목: 특수관계자 거래 주석 미기재(기중 자금거래)\n결정연도: 2025년\n회계결산일: ’22.1.1.∼’22.12.31.\n1. 회사의 회계처리\n회사는 회사와 최대주주가 동일한 특수관계자*와 기중 자금의 차입 및 상환 거래가\n빈번하게 발생하였고, 최대주주인 대표이사에 대한 자금 대여 및 회수거래가 존재\n함에도 주석에 차입금 및 대여금의 잔액은 기재하였으나, 기중 거래금액을 주석에\n기재하지 않음\n* 회사를 지배하는 개인(대표이사)이 유의적인 영향력을 행사할 수 있는 회사에 해당\n2. 회계기준 위반 지적 내용\n회사는 특수관계자와의 기중 거래금액을 주석에 기재하지 아니함\n3. 지적 근거 및 판단 내용\n일반기업회계기준 제25장(특수관계자 공시) 문단 25.6에 따르면 특수관계자 거래가 있는\n경우, 재무제표에 미치는 특수관계의 잠재적 영향을 파악하는 데 필요한 특수관계자와의\n거래금액에 대한 정보를 주석으로 기재하도록 규정하고 있음\n한국공인회계사회는 상기 회계기준 등을 고려하여, 특수관계자와의 기중 자금거래금액은\n특수관계자거래로 주석에 공시하여야 함에도 이를 누락하였다고 판단함\n- 57 -\n4. 감사절차 미흡사항\n동 지적사례는 재무제표에 대한 심사로 종결되어 감사보고서 감리는 실시하지 아니함\n5. 시사점\n회사는 특수관계자 공시 관련 회계처리 기준서를 숙지하고. 특수관계자와의 거래 정보가\n정보이용자에게 적절하게 제공될 수 있도록 재무제표 주석 점검 절차를 강화할 필요가\n있으며, 특수관계자와의 거래를 주석으로 기재 시 기초 및 기말 잔액만이 아니라\n기중거래 금액도 기재하여야 함을 유의하여야 함\n쟁점분야: 특수관계자 거래 주석\n관련기준: 일반기업회계기준 제25장(특수관계자 공시)\n\n회사의 회계처리:\n회사는 회사와 최대주주가 동일한 특수관계자*와 기중 자금의 차입 및 상환 거래가\n빈번하게 발생하였고, 최대주주인 대표이사에 대한 자금 대여 및 회수거래가 존재\n함에도 주석에 차입금 및 대여금의 잔액은 기재하였으나, 기중 거래금액을 주석에\n기재하지 않음\n* 회사를 지배하는 개인(대표이사)이 유의적인 영향력을 행사할 수 있는 회사에 해당\n\n회계기준 위반 지적 내용:\n회사는 특수관계자와의 기중 거래금액을 주석에 기재하지 아니함\n\n지적 근거 및 판단 내용:\n일반기업회계기준 제25장(특수관계자 공시) 문단 25.6에 따르면 특수관계자 거래가 있는\n경우, 재무제표에 미치는 특수관계의 잠재적 영향을 파악하는 데 필요한 특수관계자와의\n거래금액에 대한 정보를 주석으로 기재하도록 규정하고 있음\n한국공인회계사회는 상기 회계기준 등을 고려하여, 특수관계자와의 기중 자금거래금액은\n특수관계자거래로 주석에 공시하여야 함에도 이를 누락하였다고 판단함\n- 57 -\n\n감사절차 미흡사항:\n동 지적사례는 재무제표에 대한 심사로 종결되어 감사보고서 감리는 실시하지 아니함\n\n시사점:\n회사는 특수관계자 공시 관련 회계처리 기준서를 숙지하고. 특수관계자와의 거래 정보가\n정보이용자에게 적절하게 제공될 수 있도록 재무제표 주석 점검 절차를 강화할 필요가\n있으며, 특수관계자와의 거래를 주석으로 기재 시 기초 및 기말 잔액만이 아니라\n기중거래 금액도 기재하여야 함을 유의하여야 함"
    },
    {
      "paragraph_id": "KICPA-2025-38",
      "case_id": "KICPA-2025-38",
      "case_title": "특수관계자 거래 주석 미기재(기중 자금거래)",
      "metadata": {
        "decision_year": "2025",
        "accounting_period": "’22.1.1.∼’23.12.31.\n1. 회사의 회계처리\n회사는 회사를 지배하는 개인(지분율 100%)의 가까운 가족(父)이 지배하는 특수관계자와의\n자금거래에 따른 차입금 기말 잔액은 주석에 공시하였으나, 기중 자금거래(자금의 차입·상환)\n내역을 주석에 기재하지 아니함\n2. 회계기준 위반 지적 내용\n회사는 특수관계자와의 매출·매입 거래와 채권·채무 기초 및 기말 잔액은 적절히 주석에\n기재하였으나, 특수관계자와의 기중 자금 거래 내역을 주석에 기재하지 아니함\n3. 지적 근거 및 판단 내용\n일반기업회계기준 제25장(특수관계자 공시) 문단 25.6에 의하면 특수관계자 거래가 있는 경우\n특수관계의 잠재적 영향을 파악하는데 필요한 거래에 대한 정보를 주석으로 기재하도록 규정\n하고 있음\n한국공인회계사회는 상기 회계기준 등을 고려하여, 기중 발생한 특수관계자와의 자금거래\n내역을 주석에 공시하여야 함에도 이를 누락하였다고 판단함\n- 58 -\n4. 감사절차 미흡사항\n동 지적사례는 재무제표에 대한 심사로 종결되어 감사보고서 감리는 실시하지 아니함\n5. 시사점\n회사는 특수관계자 공시 관련 회계처리 기준서를 숙지하고. 특수관계자와의 거래에\n따른 채권·채무 기초 및 기말 잔액 뿐만 아니라 기중 거래도 기재하여 특수관계자와의\n거래 정보가 정보이용자에게 적절하게 제공될 수 있도록 재무제표 주석 점검 절차를\n강화할 필요가 있음",
        "issue_fields": [
          "특수관계자 거래 주석"
        ],
        "related_standards": [
          "일반기업회계기준 제25장(특수관계자 공시)"
        ],
        "case_type": "회계감리지적사례",
        "source": "KICPA 심사·감리 지적사례"
      },
      "content": {
        "section_1_company_accounting": {
          "section_title": "회사의 회계처리",
          "content": "회사는 회사를 지배하는 개인(지분율 100%)의 가까운 가족(父)이 지배하는 특수관계자와의\n자금거래에 따른 차입금 기말 잔액은 주석에 공시하였으나, 기중 자금거래(자금의 차입·상환)\n내역을 주석에 기재하지 아니함"
        },
        "section_2_violation_details": {
          "section_title": "회계기준 위반 지적 내용",
          "content": "회사는 특수관계자와의 매출·매입 거래와 채권·채무 기초 및 기말 잔액은 적절히 주석에\n기재하였으나, 특수관계자와의 기중 자금 거래 내역을 주석에 기재하지 아니함"
        },
        "section_3_basis_judgment": {
          "section_title": "지적 근거 및 판단 내용",
          "content": "일반기업회계기준 제25장(특수관계자 공시) 문단 25.6에 의하면 특수관계자 거래가 있는 경우\n특수관계의 잠재적 영향을 파악하는데 필요한 거래에 대한 정보를 주석으로 기재하도록 규정\n하고 있음\n한국공인회계사회는 상기 회계기준 등을 고려하여, 기중 발생한 특수관계자와의 자금거래\n내역을 주석에 공시하여야 함에도 이를 누락하였다고 판단함\n- 58 -"
        },
        "section_4_audit_procedure": {
          "section_title": "감사절차 미흡사항",
          "content": "동 지적사례는 재무제표에 대한 심사로 종결되어 감사보고서 감리는 실시하지 아니함"
        },
        "section_5_implications": {
          "section_title": "시사점",
          "content": "회사는 특수관계자 공시 관련 회계처리 기준서를 숙지하고. 특수관계자와의 거래에\n따른 채권·채무 기초 및 기말 잔액 뿐만 아니라 기중 거래도 기재하여 특수관계자와의\n거래 정보가 정보이용자에게 적절하게 제공될 수 있도록 재무제표 주석 점검 절차를\n강화할 필요가 있음"
        }
      },
      "indexed_content": "케이스 ID: KICPA-2025-38\n제목: 특수관계자 거래 주석 미기재(기중 자금거래)\n결정연도: 2025년\n회계결산일: ’22.1.1.∼’23.12.31.\n1. 회사의 회계처리\n회사는 회사를 지배하는 개인(지분율 100%)의 가까운 가족(父)이 지배하는 특수관계자와의\n자금거래에 따른 차입금 기말 잔액은 주석에 공시하였으나, 기중 자금거래(자금의 차입·상환)\n내역을 주석에 기재하지 아니함\n2. 회계기준 위반 지적 내용\n회사는 특수관계자와의 매출·매입 거래와 채권·채무 기초 및 기말 잔액은 적절히 주석에\n기재하였으나, 특수관계자와의 기중 자금 거래 내역을 주석에 기재하지 아니함\n3. 지적 근거 및 판단 내용\n일반기업회계기준 제25장(특수관계자 공시) 문단 25.6에 의하면 특수관계자 거래가 있는 경우\n특수관계의 잠재적 영향을 파악하는데 필요한 거래에 대한 정보를 주석으로 기재하도록 규정\n하고 있음\n한국공인회계사회는 상기 회계기준 등을 고려하여, 기중 발생한 특수관계자와의 자금거래\n내역을 주석에 공시하여야 함에도 이를 누락하였다고 판단함\n- 58 -\n4. 감사절차 미흡사항\n동 지적사례는 재무제표에 대한 심사로 종결되어 감사보고서 감리는 실시하지 아니함\n5. 시사점\n회사는 특수관계자 공시 관련 회계처리 기준서를 숙지하고. 특수관계자와의 거래에\n따른 채권·채무 기초 및 기말 잔액 뿐만 아니라 기중 거래도 기재하여 특수관계자와의\n거래 정보가 정보이용자에게 적절하게 제공될 수 있도록 재무제표 주석 점검 절차를\n강화할 필요가 있음\n쟁점분야: 특수관계자 거래 주석\n관련기준: 일반기업회계기준 제25장(특수관계자 공시)\n\n회사의 회계처리:\n회사는 회사를 지배하는 개인(지분율 100%)의 가까운 가족(父)이 지배하는 특수관계자와의\n자금거래에 따른 차입금 기말 잔액은 주석에 공시하였으나, 기중 자금거래(자금의 차입·상환)\n내역을 주석에 기재하지 아니함\n\n회계기준 위반 지적 내용:\n회사는 특수관계자와의 매출·매입 거래와 채권·채무 기초 및 기말 잔액은 적절히 주석에\n기재하였으나, 특수관계자와의 기중 자금 거래 내역을 주석에 기재하지 아니함\n\n지적 근거 및 판단 내용:\n일반기업회계기준 제25장(특수관계자 공시) 문단 25.6에 의하면 특수관계자 거래가 있는 경우\n특수관계의 잠재적 영향을 파악하는데 필요한 거래에 대한 정보를 주석으로 기재하도록 규정\n하고 있음\n한국공인회계사회는 상기 회계기준 등을 고려하여, 기중 발생한 특수관계자와의 자금거래\n내역을 주석에 공시하여야 함에도 이를 누락하였다고 판단함\n- 58 -\n\n감사절차 미흡사항:\n동 지적사례는 재무제표에 대한 심사로 종결되어 감사보고서 감리는 실시하지 아니함\n\n시사점:\n회사는 특수관계자 공시 관련 회계처리 기준서를 숙지하고. 특수관계자와의 거래에\n따른 채권·채무 기초 및 기말 잔액 뿐만 아니라 기중 거래도 기재하여 특수관계자와의\n거래 정보가 정보이용자에게 적절하게 제공될 수 있도록 재무제표 주석 점검 절차를\n강화할 필요가 있음"
    },
    {
      "paragraph_id": "KICPA-2025-39",
      "case_id": "KICPA-2025-39",
      "case_title": "특수관계자 거래 주석 미기재(특수관계자 누락)",
      "metadata": {
        "decision_year": "2025",
        "accounting_period": "’22.1.1.∼’23.12.31.\n1. 회사의 회계처리\n회사는 내항 화물운송업을 주요 사업으로 영위하고 있으며 A사는 회사의 의결권 있는\n주식 25%를 취득하여 회사에 유의적인 영향력을 행사하는 기업으로 특수관계자에\n해당함. 다만, 회사는 A사가 작성한 회사의 경영에 관한 의사결정에 의결권을 행사할\n의사가 없다는 내용의 확인서를 근거로 A사를 특수관계자가 아닌 것으로 판단하고\nA사와의 거래내역 및 관련 채권·채무를 주석에 기재하지 아니함. 해당 확인서는 회사의\n‘20년 결산보고를 위해 개최되는 ’21년 3월 정기주주총회에 참석할 의사가 없다는 내용에\n한정될 뿐 의결권 행사와는 무관한 것으로 확인됨\n2. 회계기준 위반 지적 내용\n회사는 A사가 의결권 있는 주식의 25%를 보유한 주주로서 회사에 유의적인 영향력을\n행사하는 기업으로 특수관계자에 해당함에도, 확인서에 대한 해석을 착오하여 A사와의\n거래내역 및 관련 채권·채무를 주석에 기재하지 아니함\n3. 지적 근거 및 판단 내용\n일반기업회계기준 제8장(지분법) 문단 8.4 및 용어의 정의에 따르면 투자기업이 피투자\n기업의 의결권 있는 주식의 20% 이상을 보유하고 있다면 명백한 반증이 있는 경우를\n- 59 -\n제외하고는 유의적인 영향력이 있는 경우로 보아 관계기업으로 규정하고 있고, 제25장\n(특수관계자 공시) 문단 25.2 및 25.6에 따르면 기업이 다른 기업의 관계기업에 해당\n하는 경우 그 기업은 당해기업과 특수관계에 있는 것으로 정의하며, 특수관계자거래가\n있는 경우 재무제표에 미치는 특수관계의 잠재적 영향을 파악하는데 필요한 거래,\n채권ž채무 잔액에 대한 정보를 공시하도록 규정하고 있음\n한국공인회계사회는 상기 회계기준을 고려하여, 회사의 ’22년과 ‘23년 결산 당시에는\nA사는 회사에 유의적인 영향력을 행사하는 기업으로 특수관계자에 해당한다고 판단함\n4. 감사절차 미흡사항\n동 지적사례는 재무제표에 대한 심사로 종결되어 감사보고서 감리는 실시하지 아니함\n5. 시사점\n회사는 주주 등과의 의결권 관련 확인서에 대한 내용과 범위를 면밀히 검토하여 특수\n관계자에 해당하는지 여부를 결정하여야 함",
        "issue_fields": [
          "특수관계자 거래 주석 기재"
        ],
        "related_standards": [
          "일반기업회계기준 제25장(특수관계자 공시)"
        ],
        "case_type": "회계감리지적사례",
        "source": "KICPA 심사·감리 지적사례"
      },
      "content": {
        "section_1_company_accounting": {
          "section_title": "회사의 회계처리",
          "content": "회사는 내항 화물운송업을 주요 사업으로 영위하고 있으며 A사는 회사의 의결권 있는\n주식 25%를 취득하여 회사에 유의적인 영향력을 행사하는 기업으로 특수관계자에\n해당함. 다만, 회사는 A사가 작성한 회사의 경영에 관한 의사결정에 의결권을 행사할\n의사가 없다는 내용의 확인서를 근거로 A사를 특수관계자가 아닌 것으로 판단하고\nA사와의 거래내역 및 관련 채권·채무를 주석에 기재하지 아니함. 해당 확인서는 회사의\n‘20년 결산보고를 위해 개최되는 ’21년 3월 정기주주총회에 참석할 의사가 없다는 내용에\n한정될 뿐 의결권 행사와는 무관한 것으로 확인됨"
        },
        "section_2_violation_details": {
          "section_title": "회계기준 위반 지적 내용",
          "content": "회사는 A사가 의결권 있는 주식의 25%를 보유한 주주로서 회사에 유의적인 영향력을\n행사하는 기업으로 특수관계자에 해당함에도, 확인서에 대한 해석을 착오하여 A사와의\n거래내역 및 관련 채권·채무를 주석에 기재하지 아니함"
        },
        "section_3_basis_judgment": {
          "section_title": "지적 근거 및 판단 내용",
          "content": "일반기업회계기준 제8장(지분법) 문단 8.4 및 용어의 정의에 따르면 투자기업이 피투자\n기업의 의결권 있는 주식의 20% 이상을 보유하고 있다면 명백한 반증이 있는 경우를\n- 59 -\n제외하고는 유의적인 영향력이 있는 경우로 보아 관계기업으로 규정하고 있고, 제25장\n(특수관계자 공시) 문단 25.2 및 25.6에 따르면 기업이 다른 기업의 관계기업에 해당\n하는 경우 그 기업은 당해기업과 특수관계에 있는 것으로 정의하며, 특수관계자거래가\n있는 경우 재무제표에 미치는 특수관계의 잠재적 영향을 파악하는데 필요한 거래,\n채권ž채무 잔액에 대한 정보를 공시하도록 규정하고 있음\n한국공인회계사회는 상기 회계기준을 고려하여, 회사의 ’22년과 ‘23년 결산 당시에는\nA사는 회사에 유의적인 영향력을 행사하는 기업으로 특수관계자에 해당한다고 판단함"
        },
        "section_4_audit_procedure": {
          "section_title": "감사절차 미흡사항",
          "content": "동 지적사례는 재무제표에 대한 심사로 종결되어 감사보고서 감리는 실시하지 아니함"
        },
        "section_5_implications": {
          "section_title": "시사점",
          "content": "회사는 주주 등과의 의결권 관련 확인서에 대한 내용과 범위를 면밀히 검토하여 특수\n관계자에 해당하는지 여부를 결정하여야 함"
        }
      },
      "indexed_content": "케이스 ID: KICPA-2025-39\n제목: 특수관계자 거래 주석 미기재(특수관계자 누락)\n결정연도: 2025년\n회계결산일: ’22.1.1.∼’23.12.31.\n1. 회사의 회계처리\n회사는 내항 화물운송업을 주요 사업으로 영위하고 있으며 A사는 회사의 의결권 있는\n주식 25%를 취득하여 회사에 유의적인 영향력을 행사하는 기업으로 특수관계자에\n해당함. 다만, 회사는 A사가 작성한 회사의 경영에 관한 의사결정에 의결권을 행사할\n의사가 없다는 내용의 확인서를 근거로 A사를 특수관계자가 아닌 것으로 판단하고\nA사와의 거래내역 및 관련 채권·채무를 주석에 기재하지 아니함. 해당 확인서는 회사의\n‘20년 결산보고를 위해 개최되는 ’21년 3월 정기주주총회에 참석할 의사가 없다는 내용에\n한정될 뿐 의결권 행사와는 무관한 것으로 확인됨\n2. 회계기준 위반 지적 내용\n회사는 A사가 의결권 있는 주식의 25%를 보유한 주주로서 회사에 유의적인 영향력을\n행사하는 기업으로 특수관계자에 해당함에도, 확인서에 대한 해석을 착오하여 A사와의\n거래내역 및 관련 채권·채무를 주석에 기재하지 아니함\n3. 지적 근거 및 판단 내용\n일반기업회계기준 제8장(지분법) 문단 8.4 및 용어의 정의에 따르면 투자기업이 피투자\n기업의 의결권 있는 주식의 20% 이상을 보유하고 있다면 명백한 반증이 있는 경우를\n- 59 -\n제외하고는 유의적인 영향력이 있는 경우로 보아 관계기업으로 규정하고 있고, 제25장\n(특수관계자 공시) 문단 25.2 및 25.6에 따르면 기업이 다른 기업의 관계기업에 해당\n하는 경우 그 기업은 당해기업과 특수관계에 있는 것으로 정의하며, 특수관계자거래가\n있는 경우 재무제표에 미치는 특수관계의 잠재적 영향을 파악하는데 필요한 거래,\n채권ž채무 잔액에 대한 정보를 공시하도록 규정하고 있음\n한국공인회계사회는 상기 회계기준을 고려하여, 회사의 ’22년과 ‘23년 결산 당시에는\nA사는 회사에 유의적인 영향력을 행사하는 기업으로 특수관계자에 해당한다고 판단함\n4. 감사절차 미흡사항\n동 지적사례는 재무제표에 대한 심사로 종결되어 감사보고서 감리는 실시하지 아니함\n5. 시사점\n회사는 주주 등과의 의결권 관련 확인서에 대한 내용과 범위를 면밀히 검토하여 특수\n관계자에 해당하는지 여부를 결정하여야 함\n쟁점분야: 특수관계자 거래 주석 기재\n관련기준: 일반기업회계기준 제25장(특수관계자 공시)\n\n회사의 회계처리:\n회사는 내항 화물운송업을 주요 사업으로 영위하고 있으며 A사는 회사의 의결권 있는\n주식 25%를 취득하여 회사에 유의적인 영향력을 행사하는 기업으로 특수관계자에\n해당함. 다만, 회사는 A사가 작성한 회사의 경영에 관한 의사결정에 의결권을 행사할\n의사가 없다는 내용의 확인서를 근거로 A사를 특수관계자가 아닌 것으로 판단하고\nA사와의 거래내역 및 관련 채권·채무를 주석에 기재하지 아니함. 해당 확인서는 회사의\n‘20년 결산보고를 위해 개최되는 ’21년 3월 정기주주총회에 참석할 의사가 없다는 내용에\n한정될 뿐 의결권 행사와는 무관한 것으로 확인됨\n\n회계기준 위반 지적 내용:\n회사는 A사가 의결권 있는 주식의 25%를 보유한 주주로서 회사에 유의적인 영향력을\n행사하는 기업으로 특수관계자에 해당함에도, 확인서에 대한 해석을 착오하여 A사와의\n거래내역 및 관련 채권·채무를 주석에 기재하지 아니함\n\n지적 근거 및 판단 내용:\n일반기업회계기준 제8장(지분법) 문단 8.4 및 용어의 정의에 따르면 투자기업이 피투자\n기업의 의결권 있는 주식의 20% 이상을 보유하고 있다면 명백한 반증이 있는 경우를\n- 59 -\n제외하고는 유의적인 영향력이 있는 경우로 보아 관계기업으로 규정하고 있고, 제25장\n(특수관계자 공시) 문단 25.2 및 25.6에 따르면 기업이 다른 기업의 관계기업에 해당\n하는 경우 그 기업은 당해기업과 특수관계에 있는 것으로 정의하며, 특수관계자거래가\n있는 경우 재무제표에 미치는 특수관계의 잠재적 영향을 파악하는데 필요한 거래,\n채권ž채무 잔액에 대한 정보를 공시하도록 규정하고 있음\n한국공인회계사회는 상기 회계기준을 고려하여, 회사의 ’22년과 ‘23년 결산 당시에는\nA사는 회사에 유의적인 영향력을 행사하는 기업으로 특수관계자에 해당한다고 판단함\n\n감사절차 미흡사항:\n동 지적사례는 재무제표에 대한 심사로 종결되어 감사보고서 감리는 실시하지 아니함\n\n시사점:\n회사는 주주 등과의 의결권 관련 확인서에 대한 내용과 범위를 면밀히 검토하여 특수\n관계자에 해당하는지 여부를 결정하여야 함"
    },
    {
      "paragraph_id": "KICPA-2025-40",
      "case_id": "KICPA-2025-40",
      "case_title": "특수관계자 거래 주석 미기재(특수관계자 누락)",
      "metadata": {
        "decision_year": "2025",
        "accounting_period": "’23.1.1.∼’23.12.31.\n1. 회사의 회계처리\n회사는 회사의 대주주(78%)인 개인이 설립하고 본인(가족 포함) 등을 주주로 등록한\n비외감회사에 대하여, 특수관계자 범위 판단 시 기준서에 대한 이해 부족으로 특수관계자\n범위에서 누락하고 관련 거래를 주석에 기재하지 아니함\n2. 회계기준 위반 지적 내용\n회사는 특수관계자에 대한 정의 및 범위 등에 대한 검토를 소홀히 하여 특수관계자\n와의 거래내역을 주석에 기재하지 아니함\n- 60 -\n3. 지적 근거 및 판단 내용\n일반기업회계기준 제25장(특수관계자 공시) 문단 25.6에 따르면 특수관계자 거래가\n있는 경우, 재무제표에 미치는 특수관계의 잠재적 영향을 파악하는 데 필요한 특수\n관계자와의 거래금액과 채권․채무 잔액에 대한 정보를 주석으로 기재하도록 규정하고\n있음\n4. 감사절차 미흡사항\n동 지적사례는 재무제표에 대한 심사로 종결되어 감사보고서 감리는 실시하지 아니함\n5. 시사점\n회사는 특수관계자 공시 관련 회계처리 기준서를 숙지하여 특수관계자 여부를 면밀히\n검토하여야 하고 특수관계자와의 거래 정보가 정보이용자에게 적절하게 제공될 수\n있도록 재무제표 주석 점검 절차를 강화할 필요가 있음",
        "issue_fields": [
          "특수관계자 거래 주석"
        ],
        "related_standards": [
          "일반기업회계기준 제25장(특수관계자 공시)"
        ],
        "case_type": "회계감리지적사례",
        "source": "KICPA 심사·감리 지적사례"
      },
      "content": {
        "section_1_company_accounting": {
          "section_title": "회사의 회계처리",
          "content": "회사는 회사의 대주주(78%)인 개인이 설립하고 본인(가족 포함) 등을 주주로 등록한\n비외감회사에 대하여, 특수관계자 범위 판단 시 기준서에 대한 이해 부족으로 특수관계자\n범위에서 누락하고 관련 거래를 주석에 기재하지 아니함"
        },
        "section_2_violation_details": {
          "section_title": "회계기준 위반 지적 내용",
          "content": "회사는 특수관계자에 대한 정의 및 범위 등에 대한 검토를 소홀히 하여 특수관계자\n와의 거래내역을 주석에 기재하지 아니함\n- 60 -"
        },
        "section_3_basis_judgment": {
          "section_title": "지적 근거 및 판단 내용",
          "content": "일반기업회계기준 제25장(특수관계자 공시) 문단 25.6에 따르면 특수관계자 거래가\n있는 경우, 재무제표에 미치는 특수관계의 잠재적 영향을 파악하는 데 필요한 특수\n관계자와의 거래금액과 채권․채무 잔액에 대한 정보를 주석으로 기재하도록 규정하고\n있음"
        },
        "section_4_audit_procedure": {
          "section_title": "감사절차 미흡사항",
          "content": "동 지적사례는 재무제표에 대한 심사로 종결되어 감사보고서 감리는 실시하지 아니함"
        },
        "section_5_implications": {
          "section_title": "시사점",
          "content": "회사는 특수관계자 공시 관련 회계처리 기준서를 숙지하여 특수관계자 여부를 면밀히\n검토하여야 하고 특수관계자와의 거래 정보가 정보이용자에게 적절하게 제공될 수\n있도록 재무제표 주석 점검 절차를 강화할 필요가 있음"
        }
      },
      "indexed_content": "케이스 ID: KICPA-2025-40\n제목: 특수관계자 거래 주석 미기재(특수관계자 누락)\n결정연도: 2025년\n회계결산일: ’23.1.1.∼’23.12.31.\n1. 회사의 회계처리\n회사는 회사의 대주주(78%)인 개인이 설립하고 본인(가족 포함) 등을 주주로 등록한\n비외감회사에 대하여, 특수관계자 범위 판단 시 기준서에 대한 이해 부족으로 특수관계자\n범위에서 누락하고 관련 거래를 주석에 기재하지 아니함\n2. 회계기준 위반 지적 내용\n회사는 특수관계자에 대한 정의 및 범위 등에 대한 검토를 소홀히 하여 특수관계자\n와의 거래내역을 주석에 기재하지 아니함\n- 60 -\n3. 지적 근거 및 판단 내용\n일반기업회계기준 제25장(특수관계자 공시) 문단 25.6에 따르면 특수관계자 거래가\n있는 경우, 재무제표에 미치는 특수관계의 잠재적 영향을 파악하는 데 필요한 특수\n관계자와의 거래금액과 채권․채무 잔액에 대한 정보를 주석으로 기재하도록 규정하고\n있음\n4. 감사절차 미흡사항\n동 지적사례는 재무제표에 대한 심사로 종결되어 감사보고서 감리는 실시하지 아니함\n5. 시사점\n회사는 특수관계자 공시 관련 회계처리 기준서를 숙지하여 특수관계자 여부를 면밀히\n검토하여야 하고 특수관계자와의 거래 정보가 정보이용자에게 적절하게 제공될 수\n있도록 재무제표 주석 점검 절차를 강화할 필요가 있음\n쟁점분야: 특수관계자 거래 주석\n관련기준: 일반기업회계기준 제25장(특수관계자 공시)\n\n회사의 회계처리:\n회사는 회사의 대주주(78%)인 개인이 설립하고 본인(가족 포함) 등을 주주로 등록한\n비외감회사에 대하여, 특수관계자 범위 판단 시 기준서에 대한 이해 부족으로 특수관계자\n범위에서 누락하고 관련 거래를 주석에 기재하지 아니함\n\n회계기준 위반 지적 내용:\n회사는 특수관계자에 대한 정의 및 범위 등에 대한 검토를 소홀히 하여 특수관계자\n와의 거래내역을 주석에 기재하지 아니함\n- 60 -\n\n지적 근거 및 판단 내용:\n일반기업회계기준 제25장(특수관계자 공시) 문단 25.6에 따르면 특수관계자 거래가\n있는 경우, 재무제표에 미치는 특수관계의 잠재적 영향을 파악하는 데 필요한 특수\n관계자와의 거래금액과 채권․채무 잔액에 대한 정보를 주석으로 기재하도록 규정하고\n있음\n\n감사절차 미흡사항:\n동 지적사례는 재무제표에 대한 심사로 종결되어 감사보고서 감리는 실시하지 아니함\n\n시사점:\n회사는 특수관계자 공시 관련 회계처리 기준서를 숙지하여 특수관계자 여부를 면밀히\n검토하여야 하고 특수관계자와의 거래 정보가 정보이용자에게 적절하게 제공될 수\n있도록 재무제표 주석 점검 절차를 강화할 필요가 있음"
    },
    {
      "paragraph_id": "KICPA-2025-41",
      "case_id": "KICPA-2025-41",
      "case_title": "특수관계자 거래 주석 미기재(주식매도)",
      "metadata": {
        "decision_year": "2025",
        "accounting_period": "’23.1.1.~ ‘23.12.31.\n1. 회사의 회계처리\n회사는 ‘23년 중 종속기업 주식을 타 특수관계자*에게 전량 매도하였음에도, 관련 기중거래\n및 채권 잔액 등을 주석에 기재하지 아니함\n* 회사를 지배하는 개인의 가까운 가족(자녀)이 지배하는 기업\n2. 회계기준 위반 지적 내용\n회사는 특수관계자와의 매출·매입·자금거래 등은 적정하게 공시하였으나, 주식 매도\n거래에 대하여는 주석에 기재하지 아니함\n3. 지적 근거 및 판단 내용\n일반기업회계기준 제25장(특수관계자 공시) 문단 25.6에 따르면 특수관계자 거래가 있는\n경우 재무제표에 미치는 특수관계의 잠재적 영향을 파악하는 데 필요한 특수관계자와의\n- 61 -\n거래와 채권·채무 잔액에 대한 정보 등을 주석으로 기재하도록 규정하고 있음\n한국공인회계사회는 상기 회계기준 등을 고려하여, 기중 발생한 종속기업 주식 매각 거래\n내역은 특수관계자 거래로 주석에 공시하여야 함에도, 관련 기준서에 대한 충분한\n검토와 이해 부족 등으로 당해연도에 처음으로 발생한 비경상적인 거래(주식 매도 거래)를\n주석에 누락하였다고 판단함\n4. 감사절차 미흡사항\n동 지적사례는 재무제표에 대한 심사로 종결되어 감사보고서 감리는 실시하지 아니함\n5. 시사점\n회사는 특수관계자 공시 관련 회계처리 기준서를 숙지하고. 매년 발생하는 경상적인 거래뿐만\n아니라, 비경상적으로 발생한 거래 정보도 정보이용자에게 적절히 제공될 수 있도록 재무제표\n주석 점검 절차를 강화할 필요가 있음",
        "issue_fields": [
          "특수관계자 거래 주석 기재"
        ],
        "related_standards": [
          "일반기업회계기준 제25장(특수관계자 공시)"
        ],
        "case_type": "회계감리지적사례",
        "source": "KICPA 심사·감리 지적사례"
      },
      "content": {
        "section_1_company_accounting": {
          "section_title": "회사의 회계처리",
          "content": "회사는 ‘23년 중 종속기업 주식을 타 특수관계자*에게 전량 매도하였음에도, 관련 기중거래\n및 채권 잔액 등을 주석에 기재하지 아니함\n* 회사를 지배하는 개인의 가까운 가족(자녀)이 지배하는 기업"
        },
        "section_2_violation_details": {
          "section_title": "회계기준 위반 지적 내용",
          "content": "회사는 특수관계자와의 매출·매입·자금거래 등은 적정하게 공시하였으나, 주식 매도\n거래에 대하여는 주석에 기재하지 아니함"
        },
        "section_3_basis_judgment": {
          "section_title": "지적 근거 및 판단 내용",
          "content": "일반기업회계기준 제25장(특수관계자 공시) 문단 25.6에 따르면 특수관계자 거래가 있는\n경우 재무제표에 미치는 특수관계의 잠재적 영향을 파악하는 데 필요한 특수관계자와의\n- 61 -\n거래와 채권·채무 잔액에 대한 정보 등을 주석으로 기재하도록 규정하고 있음\n한국공인회계사회는 상기 회계기준 등을 고려하여, 기중 발생한 종속기업 주식 매각 거래\n내역은 특수관계자 거래로 주석에 공시하여야 함에도, 관련 기준서에 대한 충분한\n검토와 이해 부족 등으로 당해연도에 처음으로 발생한 비경상적인 거래(주식 매도 거래)를\n주석에 누락하였다고 판단함"
        },
        "section_4_audit_procedure": {
          "section_title": "감사절차 미흡사항",
          "content": "동 지적사례는 재무제표에 대한 심사로 종결되어 감사보고서 감리는 실시하지 아니함"
        },
        "section_5_implications": {
          "section_title": "시사점",
          "content": "회사는 특수관계자 공시 관련 회계처리 기준서를 숙지하고. 매년 발생하는 경상적인 거래뿐만\n아니라, 비경상적으로 발생한 거래 정보도 정보이용자에게 적절히 제공될 수 있도록 재무제표\n주석 점검 절차를 강화할 필요가 있음"
        }
      },
      "indexed_content": "케이스 ID: KICPA-2025-41\n제목: 특수관계자 거래 주석 미기재(주식매도)\n결정연도: 2025년\n회계결산일: ’23.1.1.~ ‘23.12.31.\n1. 회사의 회계처리\n회사는 ‘23년 중 종속기업 주식을 타 특수관계자*에게 전량 매도하였음에도, 관련 기중거래\n및 채권 잔액 등을 주석에 기재하지 아니함\n* 회사를 지배하는 개인의 가까운 가족(자녀)이 지배하는 기업\n2. 회계기준 위반 지적 내용\n회사는 특수관계자와의 매출·매입·자금거래 등은 적정하게 공시하였으나, 주식 매도\n거래에 대하여는 주석에 기재하지 아니함\n3. 지적 근거 및 판단 내용\n일반기업회계기준 제25장(특수관계자 공시) 문단 25.6에 따르면 특수관계자 거래가 있는\n경우 재무제표에 미치는 특수관계의 잠재적 영향을 파악하는 데 필요한 특수관계자와의\n- 61 -\n거래와 채권·채무 잔액에 대한 정보 등을 주석으로 기재하도록 규정하고 있음\n한국공인회계사회는 상기 회계기준 등을 고려하여, 기중 발생한 종속기업 주식 매각 거래\n내역은 특수관계자 거래로 주석에 공시하여야 함에도, 관련 기준서에 대한 충분한\n검토와 이해 부족 등으로 당해연도에 처음으로 발생한 비경상적인 거래(주식 매도 거래)를\n주석에 누락하였다고 판단함\n4. 감사절차 미흡사항\n동 지적사례는 재무제표에 대한 심사로 종결되어 감사보고서 감리는 실시하지 아니함\n5. 시사점\n회사는 특수관계자 공시 관련 회계처리 기준서를 숙지하고. 매년 발생하는 경상적인 거래뿐만\n아니라, 비경상적으로 발생한 거래 정보도 정보이용자에게 적절히 제공될 수 있도록 재무제표\n주석 점검 절차를 강화할 필요가 있음\n쟁점분야: 특수관계자 거래 주석 기재\n관련기준: 일반기업회계기준 제25장(특수관계자 공시)\n\n회사의 회계처리:\n회사는 ‘23년 중 종속기업 주식을 타 특수관계자*에게 전량 매도하였음에도, 관련 기중거래\n및 채권 잔액 등을 주석에 기재하지 아니함\n* 회사를 지배하는 개인의 가까운 가족(자녀)이 지배하는 기업\n\n회계기준 위반 지적 내용:\n회사는 특수관계자와의 매출·매입·자금거래 등은 적정하게 공시하였으나, 주식 매도\n거래에 대하여는 주석에 기재하지 아니함\n\n지적 근거 및 판단 내용:\n일반기업회계기준 제25장(특수관계자 공시) 문단 25.6에 따르면 특수관계자 거래가 있는\n경우 재무제표에 미치는 특수관계의 잠재적 영향을 파악하는 데 필요한 특수관계자와의\n- 61 -\n거래와 채권·채무 잔액에 대한 정보 등을 주석으로 기재하도록 규정하고 있음\n한국공인회계사회는 상기 회계기준 등을 고려하여, 기중 발생한 종속기업 주식 매각 거래\n내역은 특수관계자 거래로 주석에 공시하여야 함에도, 관련 기준서에 대한 충분한\n검토와 이해 부족 등으로 당해연도에 처음으로 발생한 비경상적인 거래(주식 매도 거래)를\n주석에 누락하였다고 판단함\n\n감사절차 미흡사항:\n동 지적사례는 재무제표에 대한 심사로 종결되어 감사보고서 감리는 실시하지 아니함\n\n시사점:\n회사는 특수관계자 공시 관련 회계처리 기준서를 숙지하고. 매년 발생하는 경상적인 거래뿐만\n아니라, 비경상적으로 발생한 거래 정보도 정보이용자에게 적절히 제공될 수 있도록 재무제표\n주석 점검 절차를 강화할 필요가 있음"
    },
    {
      "paragraph_id": "KICPA-2025-42",
      "case_id": "KICPA-2025-42",
      "case_title": "담보제공자산 주석 과소기재",
      "metadata": {
        "decision_year": "2025",
        "accounting_period": "’22.1.1.∼’23.12.31.\n1. 회사의 회계처리\n회사는 건설공제조합, 수협 등의 차입금과 관련하여 회사 소유의 건물을 담보로 제공하였고 임대\n보증금과 관련하여 건물 일부에 전세권이 설정되었음에도 해당 내용을 주석에 기재하지 아니함\n2. 회계기준 위반 지적 내용\n회사는 차입금 및 임대보증금과 관련하여 담보로 제공되었거나 전세권이 설정된 자산의\n내용과 금액을 주석에 기재하지 아니함\n3. 지적 근거 및 판단 내용\n일반기업회계기준 제10장(유형자산) 문단 10.48에 의하면 유형자산의 소유권이 제한되거나\n- 62 -\n담보로 제공된 유형자산의 내용과 금액은 주석으로 기재하도록 규정하고 있음\n한국공인회계사회는 차입금과 관련하여 담보로 제공되었거나 전세권이 설정되어 자산의 소유권이\n제한되는 내용을 주석으로 공시하여야 함에도, 회사가 담보제공 내역 관리 등 내부통제절차가\n미흡한 상황에서 이를 누락한 것으로 판단함\n4. 감사절차 미흡사항\n동 지적사례는 재무제표에 대한 심사로 종결되어 감사보고서 감리는 실시하지 아니함\n5. 시사점\n회사는 차입금 약정서(계약서) 및 임대계약서상 담보 제공내역이나 전세권 설정 등 세부조항을\n면밀히 파악하고 소유권이 제한되거나 담보로 제공된 유형자산의 내용과 금액을 주석으로\n기재하여 관련 정보가 정보이용자에게 적절하게 제공될 수 있도록 재무제표 주석 점검 절차를\n강화할 필요가 있음",
        "issue_fields": [
          "담보제공자산"
        ],
        "related_standards": [
          "일반기업회계기준 제10장(유형자산)"
        ],
        "case_type": "회계감리지적사례",
        "source": "KICPA 심사·감리 지적사례"
      },
      "content": {
        "section_1_company_accounting": {
          "section_title": "회사의 회계처리",
          "content": "회사는 건설공제조합, 수협 등의 차입금과 관련하여 회사 소유의 건물을 담보로 제공하였고 임대\n보증금과 관련하여 건물 일부에 전세권이 설정되었음에도 해당 내용을 주석에 기재하지 아니함"
        },
        "section_2_violation_details": {
          "section_title": "회계기준 위반 지적 내용",
          "content": "회사는 차입금 및 임대보증금과 관련하여 담보로 제공되었거나 전세권이 설정된 자산의\n내용과 금액을 주석에 기재하지 아니함"
        },
        "section_3_basis_judgment": {
          "section_title": "지적 근거 및 판단 내용",
          "content": "일반기업회계기준 제10장(유형자산) 문단 10.48에 의하면 유형자산의 소유권이 제한되거나\n- 62 -\n담보로 제공된 유형자산의 내용과 금액은 주석으로 기재하도록 규정하고 있음\n한국공인회계사회는 차입금과 관련하여 담보로 제공되었거나 전세권이 설정되어 자산의 소유권이\n제한되는 내용을 주석으로 공시하여야 함에도, 회사가 담보제공 내역 관리 등 내부통제절차가\n미흡한 상황에서 이를 누락한 것으로 판단함"
        },
        "section_4_audit_procedure": {
          "section_title": "감사절차 미흡사항",
          "content": "동 지적사례는 재무제표에 대한 심사로 종결되어 감사보고서 감리는 실시하지 아니함"
        },
        "section_5_implications": {
          "section_title": "시사점",
          "content": "회사는 차입금 약정서(계약서) 및 임대계약서상 담보 제공내역이나 전세권 설정 등 세부조항을\n면밀히 파악하고 소유권이 제한되거나 담보로 제공된 유형자산의 내용과 금액을 주석으로\n기재하여 관련 정보가 정보이용자에게 적절하게 제공될 수 있도록 재무제표 주석 점검 절차를\n강화할 필요가 있음"
        }
      },
      "indexed_content": "케이스 ID: KICPA-2025-42\n제목: 담보제공자산 주석 과소기재\n결정연도: 2025년\n회계결산일: ’22.1.1.∼’23.12.31.\n1. 회사의 회계처리\n회사는 건설공제조합, 수협 등의 차입금과 관련하여 회사 소유의 건물을 담보로 제공하였고 임대\n보증금과 관련하여 건물 일부에 전세권이 설정되었음에도 해당 내용을 주석에 기재하지 아니함\n2. 회계기준 위반 지적 내용\n회사는 차입금 및 임대보증금과 관련하여 담보로 제공되었거나 전세권이 설정된 자산의\n내용과 금액을 주석에 기재하지 아니함\n3. 지적 근거 및 판단 내용\n일반기업회계기준 제10장(유형자산) 문단 10.48에 의하면 유형자산의 소유권이 제한되거나\n- 62 -\n담보로 제공된 유형자산의 내용과 금액은 주석으로 기재하도록 규정하고 있음\n한국공인회계사회는 차입금과 관련하여 담보로 제공되었거나 전세권이 설정되어 자산의 소유권이\n제한되는 내용을 주석으로 공시하여야 함에도, 회사가 담보제공 내역 관리 등 내부통제절차가\n미흡한 상황에서 이를 누락한 것으로 판단함\n4. 감사절차 미흡사항\n동 지적사례는 재무제표에 대한 심사로 종결되어 감사보고서 감리는 실시하지 아니함\n5. 시사점\n회사는 차입금 약정서(계약서) 및 임대계약서상 담보 제공내역이나 전세권 설정 등 세부조항을\n면밀히 파악하고 소유권이 제한되거나 담보로 제공된 유형자산의 내용과 금액을 주석으로\n기재하여 관련 정보가 정보이용자에게 적절하게 제공될 수 있도록 재무제표 주석 점검 절차를\n강화할 필요가 있음\n쟁점분야: 담보제공자산\n관련기준: 일반기업회계기준 제10장(유형자산)\n\n회사의 회계처리:\n회사는 건설공제조합, 수협 등의 차입금과 관련하여 회사 소유의 건물을 담보로 제공하였고 임대\n보증금과 관련하여 건물 일부에 전세권이 설정되었음에도 해당 내용을 주석에 기재하지 아니함\n\n회계기준 위반 지적 내용:\n회사는 차입금 및 임대보증금과 관련하여 담보로 제공되었거나 전세권이 설정된 자산의\n내용과 금액을 주석에 기재하지 아니함\n\n지적 근거 및 판단 내용:\n일반기업회계기준 제10장(유형자산) 문단 10.48에 의하면 유형자산의 소유권이 제한되거나\n- 62 -\n담보로 제공된 유형자산의 내용과 금액은 주석으로 기재하도록 규정하고 있음\n한국공인회계사회는 차입금과 관련하여 담보로 제공되었거나 전세권이 설정되어 자산의 소유권이\n제한되는 내용을 주석으로 공시하여야 함에도, 회사가 담보제공 내역 관리 등 내부통제절차가\n미흡한 상황에서 이를 누락한 것으로 판단함\n\n감사절차 미흡사항:\n동 지적사례는 재무제표에 대한 심사로 종결되어 감사보고서 감리는 실시하지 아니함\n\n시사점:\n회사는 차입금 약정서(계약서) 및 임대계약서상 담보 제공내역이나 전세권 설정 등 세부조항을\n면밀히 파악하고 소유권이 제한되거나 담보로 제공된 유형자산의 내용과 금액을 주석으로\n기재하여 관련 정보가 정보이용자에게 적절하게 제공될 수 있도록 재무제표 주석 점검 절차를\n강화할 필요가 있음"
    },
    {
      "paragraph_id": "KICPA-2025-43",
      "case_id": "KICPA-2025-43",
      "case_title": "담보제공자산 주석 공시 오류",
      "metadata": {
        "decision_year": "2025",
        "accounting_period": "’17.1.1.∼’17.12.31.\n1. 회사의 회계처리\n회사는 부동산임대업을 주요 사업으로 영위하고 있으며 본인과 타인의 금융기관\n차입금 및 임대보증금에 대하여 토지와 건물을 담보로 제공하고 이를 주석에 기재하였음.\n다만, 주석 작성과정에서 ’17년 감사보고서 발행전인 ’18년 1월중 발생한 담보제공\n내역을 ’17년 감사보고서에 주석으로 공시하거나, ‘17년중 전세권이 해제되었음에도\n주석에 전세권 설정내역을 공시하는 등 담보제공내역을 과다하게 기재하였으며, 일부\n유형자산에 대한 담보설정내역을 누락함\n2. 회계기준 위반 지적 내용\n회사는 본인과 타인의 금융기관 차입금 및 임대보증금에 대하여 토지와 건물을 담보로\n- 63 -\n제공하고 이를 주석에 기재하였으나 담보설정금액을 과다하게 기재하거나 주석에 기재\n하지 아니함\n3. 지적 근거 및 판단 내용\n일반기업회계기준」제10장(유형자산) 문단 10.48에 따르면 유형자산의 소유권이 제한\n되거나 담보로 제공된 경우, 해당 유형자산의 내용과 금액을 주석으로 공시하도록\n규정하고 있음\n4. 감사절차 미흡사항\n동 지적사례는 재무제표에 대한 심사로 종결되어 감사보고서 감리는 실시하지 아니함\n5. 시사점\n회사는 담보제공사실이 주석에 누락되거나 과다 공시되지 않도록 담보제공시 작성한\n이사회의사록, 계약서 등을 체계적으로 관리하는 등의 내부통제절차를 마련하고, 재무\n제표 주석 점검절차를 강화할 필요가 있음",
        "issue_fields": [
          "담보제공자산"
        ],
        "related_standards": [
          "일반기업회계기준 제10장(유형자산)"
        ],
        "case_type": "회계감리지적사례",
        "source": "KICPA 심사·감리 지적사례"
      },
      "content": {
        "section_1_company_accounting": {
          "section_title": "회사의 회계처리",
          "content": "회사는 부동산임대업을 주요 사업으로 영위하고 있으며 본인과 타인의 금융기관\n차입금 및 임대보증금에 대하여 토지와 건물을 담보로 제공하고 이를 주석에 기재하였음.\n다만, 주석 작성과정에서 ’17년 감사보고서 발행전인 ’18년 1월중 발생한 담보제공\n내역을 ’17년 감사보고서에 주석으로 공시하거나, ‘17년중 전세권이 해제되었음에도\n주석에 전세권 설정내역을 공시하는 등 담보제공내역을 과다하게 기재하였으며, 일부\n유형자산에 대한 담보설정내역을 누락함"
        },
        "section_2_violation_details": {
          "section_title": "회계기준 위반 지적 내용",
          "content": "회사는 본인과 타인의 금융기관 차입금 및 임대보증금에 대하여 토지와 건물을 담보로\n- 63 -\n제공하고 이를 주석에 기재하였으나 담보설정금액을 과다하게 기재하거나 주석에 기재\n하지 아니함"
        },
        "section_3_basis_judgment": {
          "section_title": "지적 근거 및 판단 내용",
          "content": "일반기업회계기준」제10장(유형자산) 문단 10.48에 따르면 유형자산의 소유권이 제한\n되거나 담보로 제공된 경우, 해당 유형자산의 내용과 금액을 주석으로 공시하도록\n규정하고 있음"
        },
        "section_4_audit_procedure": {
          "section_title": "감사절차 미흡사항",
          "content": "동 지적사례는 재무제표에 대한 심사로 종결되어 감사보고서 감리는 실시하지 아니함"
        },
        "section_5_implications": {
          "section_title": "시사점",
          "content": "회사는 담보제공사실이 주석에 누락되거나 과다 공시되지 않도록 담보제공시 작성한\n이사회의사록, 계약서 등을 체계적으로 관리하는 등의 내부통제절차를 마련하고, 재무\n제표 주석 점검절차를 강화할 필요가 있음"
        }
      },
      "indexed_content": "케이스 ID: KICPA-2025-43\n제목: 담보제공자산 주석 공시 오류\n결정연도: 2025년\n회계결산일: ’17.1.1.∼’17.12.31.\n1. 회사의 회계처리\n회사는 부동산임대업을 주요 사업으로 영위하고 있으며 본인과 타인의 금융기관\n차입금 및 임대보증금에 대하여 토지와 건물을 담보로 제공하고 이를 주석에 기재하였음.\n다만, 주석 작성과정에서 ’17년 감사보고서 발행전인 ’18년 1월중 발생한 담보제공\n내역을 ’17년 감사보고서에 주석으로 공시하거나, ‘17년중 전세권이 해제되었음에도\n주석에 전세권 설정내역을 공시하는 등 담보제공내역을 과다하게 기재하였으며, 일부\n유형자산에 대한 담보설정내역을 누락함\n2. 회계기준 위반 지적 내용\n회사는 본인과 타인의 금융기관 차입금 및 임대보증금에 대하여 토지와 건물을 담보로\n- 63 -\n제공하고 이를 주석에 기재하였으나 담보설정금액을 과다하게 기재하거나 주석에 기재\n하지 아니함\n3. 지적 근거 및 판단 내용\n일반기업회계기준」제10장(유형자산) 문단 10.48에 따르면 유형자산의 소유권이 제한\n되거나 담보로 제공된 경우, 해당 유형자산의 내용과 금액을 주석으로 공시하도록\n규정하고 있음\n4. 감사절차 미흡사항\n동 지적사례는 재무제표에 대한 심사로 종결되어 감사보고서 감리는 실시하지 아니함\n5. 시사점\n회사는 담보제공사실이 주석에 누락되거나 과다 공시되지 않도록 담보제공시 작성한\n이사회의사록, 계약서 등을 체계적으로 관리하는 등의 내부통제절차를 마련하고, 재무\n제표 주석 점검절차를 강화할 필요가 있음\n쟁점분야: 담보제공자산\n관련기준: 일반기업회계기준 제10장(유형자산)\n\n회사의 회계처리:\n회사는 부동산임대업을 주요 사업으로 영위하고 있으며 본인과 타인의 금융기관\n차입금 및 임대보증금에 대하여 토지와 건물을 담보로 제공하고 이를 주석에 기재하였음.\n다만, 주석 작성과정에서 ’17년 감사보고서 발행전인 ’18년 1월중 발생한 담보제공\n내역을 ’17년 감사보고서에 주석으로 공시하거나, ‘17년중 전세권이 해제되었음에도\n주석에 전세권 설정내역을 공시하는 등 담보제공내역을 과다하게 기재하였으며, 일부\n유형자산에 대한 담보설정내역을 누락함\n\n회계기준 위반 지적 내용:\n회사는 본인과 타인의 금융기관 차입금 및 임대보증금에 대하여 토지와 건물을 담보로\n- 63 -\n제공하고 이를 주석에 기재하였으나 담보설정금액을 과다하게 기재하거나 주석에 기재\n하지 아니함\n\n지적 근거 및 판단 내용:\n일반기업회계기준」제10장(유형자산) 문단 10.48에 따르면 유형자산의 소유권이 제한\n되거나 담보로 제공된 경우, 해당 유형자산의 내용과 금액을 주석으로 공시하도록\n규정하고 있음\n\n감사절차 미흡사항:\n동 지적사례는 재무제표에 대한 심사로 종결되어 감사보고서 감리는 실시하지 아니함\n\n시사점:\n회사는 담보제공사실이 주석에 누락되거나 과다 공시되지 않도록 담보제공시 작성한\n이사회의사록, 계약서 등을 체계적으로 관리하는 등의 내부통제절차를 마련하고, 재무\n제표 주석 점검절차를 강화할 필요가 있음"
    },
    {
      "paragraph_id": "KICPA-2025-44",
      "case_id": "KICPA-2025-44",
      "case_title": "타인에게 제공한 지급보증 등 주석 미기재(책임준공확약)",
      "metadata": {
        "decision_year": "2025",
        "accounting_period": "’23.1.1.∼’24.12.31.\n1. 회사의 회계처리\n회사는 건설 사업에 시공사로 참여하면서 시행사의 대출약정 관련하여 책임준공 의무\n미이행시 대주들에 대한 시행사의 차입원리금 등을 인수·변제하는 약정을 제공하고(책임\n준공 확약), 시행사의 신용보강을 위해 PF차입금에 대한 법인연대보증을 제공하였음에도,\n이를 적절히 주석에 기재하지 아니함\n2. 회계기준 위반 지적 내용\n회사는 건설 사업에 시공사로 참여하면서 제공한 책임준공 확약 및 PF차입금에 대한\n법인연대보증을 적절히 주석에 기재하지 아니함\n- 64 -\n3. 지적 근거 및 판단 내용\n일반기업회계기준 제14장(충당부채, 우발부채, 우발자산) 문단 14.21에 따르면 회사는\n의무를 이행하기 위한 자원의 유출 가능성이 거의 없더라도 타인에게 제공한 지급보증\n또는 이와 유사한 보증의 내용을 주석에 기재하도록 규정하고 있음\n한국공인회계사회는 상기 회계기준 등을 고려하여, 책임준공 불이행시 차주의 채무를\n인수하기로 하는 약정은 변형된 형태의 지급보증으로 책임준공이 불이행되는 경우\n자원의 유출가능성이 존재하므로 해당 우발부채에 대하여 주석에 공시하여야 한다고\n판단함\n4. 감사절차 미흡사항\n동 지적사례는 재무제표에 대한 심사로 종결되어 감사보고서 감리는 실시하지 아니함\n5. 시사점\n지급보증 제공 등의 경우 주석 공시의 완전성을 위해 지급보증 제공시 작성한 이사회\n의사록, 계약서 등을 체계적으로 관리하는 내부통제절차를 강화할 필요가 있음\n- 65 -\n4 회계처리기준 위반이 없는 중요한 감사절차 위반사항",
        "issue_fields": [
          "지급보증 등"
        ],
        "related_standards": [
          "일반기업회계기준 제14장(충당부채",
          "우발부채",
          "우발자산)"
        ],
        "case_type": "회계감리지적사례",
        "source": "KICPA 심사·감리 지적사례"
      },
      "content": {
        "section_1_company_accounting": {
          "section_title": "회사의 회계처리",
          "content": "회사는 건설 사업에 시공사로 참여하면서 시행사의 대출약정 관련하여 책임준공 의무\n미이행시 대주들에 대한 시행사의 차입원리금 등을 인수·변제하는 약정을 제공하고(책임\n준공 확약), 시행사의 신용보강을 위해 PF차입금에 대한 법인연대보증을 제공하였음에도,\n이를 적절히 주석에 기재하지 아니함"
        },
        "section_2_violation_details": {
          "section_title": "회계기준 위반 지적 내용",
          "content": "회사는 건설 사업에 시공사로 참여하면서 제공한 책임준공 확약 및 PF차입금에 대한\n법인연대보증을 적절히 주석에 기재하지 아니함\n- 64 -"
        },
        "section_3_basis_judgment": {
          "section_title": "지적 근거 및 판단 내용",
          "content": "일반기업회계기준 제14장(충당부채, 우발부채, 우발자산) 문단 14.21에 따르면 회사는\n의무를 이행하기 위한 자원의 유출 가능성이 거의 없더라도 타인에게 제공한 지급보증\n또는 이와 유사한 보증의 내용을 주석에 기재하도록 규정하고 있음\n한국공인회계사회는 상기 회계기준 등을 고려하여, 책임준공 불이행시 차주의 채무를\n인수하기로 하는 약정은 변형된 형태의 지급보증으로 책임준공이 불이행되는 경우\n자원의 유출가능성이 존재하므로 해당 우발부채에 대하여 주석에 공시하여야 한다고\n판단함"
        },
        "section_4_audit_procedure": {
          "section_title": "감사절차 미흡사항",
          "content": "동 지적사례는 재무제표에 대한 심사로 종결되어 감사보고서 감리는 실시하지 아니함"
        },
        "section_5_implications": {
          "section_title": "시사점",
          "content": "지급보증 제공 등의 경우 주석 공시의 완전성을 위해 지급보증 제공시 작성한 이사회\n의사록, 계약서 등을 체계적으로 관리하는 내부통제절차를 강화할 필요가 있음\n- 65 -\n4 회계처리기준 위반이 없는 중요한 감사절차 위반사항"
        }
      },
      "indexed_content": "케이스 ID: KICPA-2025-44\n제목: 타인에게 제공한 지급보증 등 주석 미기재(책임준공확약)\n결정연도: 2025년\n회계결산일: ’23.1.1.∼’24.12.31.\n1. 회사의 회계처리\n회사는 건설 사업에 시공사로 참여하면서 시행사의 대출약정 관련하여 책임준공 의무\n미이행시 대주들에 대한 시행사의 차입원리금 등을 인수·변제하는 약정을 제공하고(책임\n준공 확약), 시행사의 신용보강을 위해 PF차입금에 대한 법인연대보증을 제공하였음에도,\n이를 적절히 주석에 기재하지 아니함\n2. 회계기준 위반 지적 내용\n회사는 건설 사업에 시공사로 참여하면서 제공한 책임준공 확약 및 PF차입금에 대한\n법인연대보증을 적절히 주석에 기재하지 아니함\n- 64 -\n3. 지적 근거 및 판단 내용\n일반기업회계기준 제14장(충당부채, 우발부채, 우발자산) 문단 14.21에 따르면 회사는\n의무를 이행하기 위한 자원의 유출 가능성이 거의 없더라도 타인에게 제공한 지급보증\n또는 이와 유사한 보증의 내용을 주석에 기재하도록 규정하고 있음\n한국공인회계사회는 상기 회계기준 등을 고려하여, 책임준공 불이행시 차주의 채무를\n인수하기로 하는 약정은 변형된 형태의 지급보증으로 책임준공이 불이행되는 경우\n자원의 유출가능성이 존재하므로 해당 우발부채에 대하여 주석에 공시하여야 한다고\n판단함\n4. 감사절차 미흡사항\n동 지적사례는 재무제표에 대한 심사로 종결되어 감사보고서 감리는 실시하지 아니함\n5. 시사점\n지급보증 제공 등의 경우 주석 공시의 완전성을 위해 지급보증 제공시 작성한 이사회\n의사록, 계약서 등을 체계적으로 관리하는 내부통제절차를 강화할 필요가 있음\n- 65 -\n4 회계처리기준 위반이 없는 중요한 감사절차 위반사항\n쟁점분야: 지급보증 등\n관련기준: 일반기업회계기준 제14장(충당부채, 우발부채, 우발자산)\n\n회사의 회계처리:\n회사는 건설 사업에 시공사로 참여하면서 시행사의 대출약정 관련하여 책임준공 의무\n미이행시 대주들에 대한 시행사의 차입원리금 등을 인수·변제하는 약정을 제공하고(책임\n준공 확약), 시행사의 신용보강을 위해 PF차입금에 대한 법인연대보증을 제공하였음에도,\n이를 적절히 주석에 기재하지 아니함\n\n회계기준 위반 지적 내용:\n회사는 건설 사업에 시공사로 참여하면서 제공한 책임준공 확약 및 PF차입금에 대한\n법인연대보증을 적절히 주석에 기재하지 아니함\n- 64 -\n\n지적 근거 및 판단 내용:\n일반기업회계기준 제14장(충당부채, 우발부채, 우발자산) 문단 14.21에 따르면 회사는\n의무를 이행하기 위한 자원의 유출 가능성이 거의 없더라도 타인에게 제공한 지급보증\n또는 이와 유사한 보증의 내용을 주석에 기재하도록 규정하고 있음\n한국공인회계사회는 상기 회계기준 등을 고려하여, 책임준공 불이행시 차주의 채무를\n인수하기로 하는 약정은 변형된 형태의 지급보증으로 책임준공이 불이행되는 경우\n자원의 유출가능성이 존재하므로 해당 우발부채에 대하여 주석에 공시하여야 한다고\n판단함\n\n감사절차 미흡사항:\n동 지적사례는 재무제표에 대한 심사로 종결되어 감사보고서 감리는 실시하지 아니함\n\n시사점:\n지급보증 제공 등의 경우 주석 공시의 완전성을 위해 지급보증 제공시 작성한 이사회\n의사록, 계약서 등을 체계적으로 관리하는 내부통제절차를 강화할 필요가 있음\n- 65 -\n4 회계처리기준 위반이 없는 중요한 감사절차 위반사항"
    },
    {
      "paragraph_id": "KICPA-2025-45",
      "case_id": "KICPA-2025-45",
      "case_title": "매출채권에 대한 감사절차 소홀 [회계처리기준 위반과 관련이 없는 감사",
      "metadata": {
        "decision_year": "2025",
        "accounting_period": "",
        "issue_fields": [
          "매출채권에 대한 감사절차 소홀"
        ],
        "related_standards": [
          "회계감사기준서 505 및 540"
        ],
        "case_type": "회계감리지적사례",
        "source": "KICPA 심사·감리 지적사례"
      },
      "content": {
        "section_1_company_accounting": {
          "section_title": "회사의 회계처리",
          "content": ""
        },
        "section_2_violation_details": {
          "section_title": "회계기준 위반 지적 내용",
          "content": ""
        },
        "section_3_basis_judgment": {
          "section_title": "지적 근거 및 판단 내용",
          "content": ""
        },
        "section_4_audit_procedure": {
          "section_title": "감사절차 미흡사항",
          "content": ""
        },
        "section_5_implications": {
          "section_title": "시사점",
          "content": ""
        }
      },
      "indexed_content": "케이스 ID: KICPA-2025-45\n제목: 매출채권에 대한 감사절차 소홀 [회계처리기준 위반과 관련이 없는 감사\n결정연도: 2025년\n회계결산일: \n쟁점분야: 매출채권에 대한 감사절차 소홀\n관련기준: 회계감사기준서 505 및 540\n\n회사의 회계처리:\n\n\n회계기준 위반 지적 내용:\n\n\n지적 근거 및 판단 내용:\n\n\n감사절차 미흡사항:\n\n\n시사점:\n"
    },
    {
      "paragraph_id": "KICPA-2025-46",
      "case_id": "KICPA-2025-46",
      "case_title": "매출에 대한 감사절차 소홀 [회계처리기준 위반과 관련이 없는 감사",
      "metadata": {
        "decision_year": "2025",
        "accounting_period": "",
        "issue_fields": [
          "매출에 대한 감사절차 소홀"
        ],
        "related_standards": [
          "회계감사기준서 240 및 330"
        ],
        "case_type": "회계감리지적사례",
        "source": "KICPA 심사·감리 지적사례"
      },
      "content": {
        "section_1_company_accounting": {
          "section_title": "회사의 회계처리",
          "content": ""
        },
        "section_2_violation_details": {
          "section_title": "회계기준 위반 지적 내용",
          "content": ""
        },
        "section_3_basis_judgment": {
          "section_title": "지적 근거 및 판단 내용",
          "content": ""
        },
        "section_4_audit_procedure": {
          "section_title": "감사절차 미흡사항",
          "content": ""
        },
        "section_5_implications": {
          "section_title": "시사점",
          "content": ""
        }
      },
      "indexed_content": "케이스 ID: KICPA-2025-46\n제목: 매출에 대한 감사절차 소홀 [회계처리기준 위반과 관련이 없는 감사\n결정연도: 2025년\n회계결산일: \n쟁점분야: 매출에 대한 감사절차 소홀\n관련기준: 회계감사기준서 240 및 330\n\n회사의 회계처리:\n\n\n회계기준 위반 지적 내용:\n\n\n지적 근거 및 판단 내용:\n\n\n감사절차 미흡사항:\n\n\n시사점:\n"
    },
    {
      "paragraph_id": "KICPA-2025-47",
      "case_id": "KICPA-2025-47",
      "case_title": "구성원이 아닌자의 감사업무 참여 [구성원 3인참여 위반]",
      "metadata": {
        "decision_year": "2025",
        "accounting_period": "",
        "issue_fields": [
          "외부감사법(감사인 3인참여)위반"
        ],
        "related_standards": [
          "외부감사법"
        ],
        "case_type": "회계감리지적사례",
        "source": "KICPA 심사·감리 지적사례"
      },
      "content": {
        "section_1_company_accounting": {
          "section_title": "회사의 회계처리",
          "content": ""
        },
        "section_2_violation_details": {
          "section_title": "회계기준 위반 지적 내용",
          "content": ""
        },
        "section_3_basis_judgment": {
          "section_title": "지적 근거 및 판단 내용",
          "content": "외부감사법 제2조제7호나목 및 동법 시행규칙 제2조제4항제4호에 따르면, 감사반이 외부\n감사법 제4조의 적용대상 회사에 대한 회계감사를 하는 경우에는 구성원 중 3명 이상이\n- 69 -\n참여하여야 하며, 감사보고서를 작성하는 경우에 해당 회계감사에 참여한 모든 구성원이\n서명하거나 기명날인하도록 규정하고 있음\n한국공인회계사회는 감사반이 탈퇴한 자를 감사업무에서 제외하였어야 함에도, 등록\n이후 구성원 탈퇴가 처음 발생하였고 업무집중도가 높은 기말감사가 임박한 시기에 탈퇴\n(‘23년 1월말)가 이루어짐에 따라 감사참여자 자격요건 검토와 법규준수 절차를 적절히\n수행하지 못하는 등 감사반 운영 미숙으로 외부감사법을 위반하였다고 판단함"
        },
        "section_4_audit_procedure": {
          "section_title": "감사절차 미흡사항",
          "content": ""
        },
        "section_5_implications": {
          "section_title": "시사점",
          "content": ""
        }
      },
      "indexed_content": "케이스 ID: KICPA-2025-47\n제목: 구성원이 아닌자의 감사업무 참여 [구성원 3인참여 위반]\n결정연도: 2025년\n회계결산일: \n쟁점분야: 외부감사법(감사인 3인참여)위반\n관련기준: 외부감사법\n\n회사의 회계처리:\n\n\n회계기준 위반 지적 내용:\n\n\n지적 근거 및 판단 내용:\n외부감사법 제2조제7호나목 및 동법 시행규칙 제2조제4항제4호에 따르면, 감사반이 외부\n감사법 제4조의 적용대상 회사에 대한 회계감사를 하는 경우에는 구성원 중 3명 이상이\n- 69 -\n참여하여야 하며, 감사보고서를 작성하는 경우에 해당 회계감사에 참여한 모든 구성원이\n서명하거나 기명날인하도록 규정하고 있음\n한국공인회계사회는 감사반이 탈퇴한 자를 감사업무에서 제외하였어야 함에도, 등록\n이후 구성원 탈퇴가 처음 발생하였고 업무집중도가 높은 기말감사가 임박한 시기에 탈퇴\n(‘23년 1월말)가 이루어짐에 따라 감사참여자 자격요건 검토와 법규준수 절차를 적절히\n수행하지 못하는 등 감사반 운영 미숙으로 외부감사법을 위반하였다고 판단함\n\n감사절차 미흡사항:\n\n\n시사점:\n"
    },
    {
      "paragraph_id": "KICPA-2025-48",
      "case_id": "KICPA-2025-48",
      "case_title": "독립성의무 위반 [동일이사 연속감사제한 규정 위반]",
      "metadata": {
        "decision_year": "2025",
        "accounting_period": "",
        "issue_fields": [
          "외부감사법(독립성의무)위반"
        ],
        "related_standards": [
          "외부감사법"
        ],
        "case_type": "회계감리지적사례",
        "source": "KICPA 심사·감리 지적사례"
      },
      "content": {
        "section_1_company_accounting": {
          "section_title": "회사의 회계처리",
          "content": ""
        },
        "section_2_violation_details": {
          "section_title": "회계기준 위반 지적 내용",
          "content": ""
        },
        "section_3_basis_judgment": {
          "section_title": "지적 근거 및 판단 내용",
          "content": "외부감사법 제9조제5항에 따르면 회계법인인 감사인은 동일한 이사(「공인회계사법」\n제26조제1항에 따른 이사를 말한다)에게 회사의 연속하는 6개 사업연도(주권상장법인․\n대형비상장회사․금융회사의 경우에는 4개 사업연도)에 대한 감사업무를 하게 할 수\n없도록 규정하고 있음\n한국공인회계사회는 감사인이 업무수행이사가 자율적으로 연속감사제한 관련 규정을\n준수하고 있다고 판단하여 장기감사 현황관리 및 점검절차를 소홀히 하였고, 업무수행\n이사는 ‘동일이사 연속감사업무제한’ 규정은 인지하고 있었으나, 연속감사 경과연수를\n계산 착오하거나 위반 사업연도 재무제표에 대해 범위제한 의견거절 감사보고서를 발행\n하는 경우, ‘동일이사 연속감사업무제한’ 규정을 위반하지 않는 것으로 판단 착오하여\n외부감사법을 위반하게 된 것으로 판단함"
        },
        "section_4_audit_procedure": {
          "section_title": "감사절차 미흡사항",
          "content": ""
        },
        "section_5_implications": {
          "section_title": "시사점",
          "content": ""
        }
      },
      "indexed_content": "케이스 ID: KICPA-2025-48\n제목: 독립성의무 위반 [동일이사 연속감사제한 규정 위반]\n결정연도: 2025년\n회계결산일: \n쟁점분야: 외부감사법(독립성의무)위반\n관련기준: 외부감사법\n\n회사의 회계처리:\n\n\n회계기준 위반 지적 내용:\n\n\n지적 근거 및 판단 내용:\n외부감사법 제9조제5항에 따르면 회계법인인 감사인은 동일한 이사(「공인회계사법」\n제26조제1항에 따른 이사를 말한다)에게 회사의 연속하는 6개 사업연도(주권상장법인․\n대형비상장회사․금융회사의 경우에는 4개 사업연도)에 대한 감사업무를 하게 할 수\n없도록 규정하고 있음\n한국공인회계사회는 감사인이 업무수행이사가 자율적으로 연속감사제한 관련 규정을\n준수하고 있다고 판단하여 장기감사 현황관리 및 점검절차를 소홀히 하였고, 업무수행\n이사는 ‘동일이사 연속감사업무제한’ 규정은 인지하고 있었으나, 연속감사 경과연수를\n계산 착오하거나 위반 사업연도 재무제표에 대해 범위제한 의견거절 감사보고서를 발행\n하는 경우, ‘동일이사 연속감사업무제한’ 규정을 위반하지 않는 것으로 판단 착오하여\n외부감사법을 위반하게 된 것으로 판단함\n\n감사절차 미흡사항:\n\n\n시사점:\n"
    }
  ],
  "statistics": {
    "2020": {
      "total": 32,
      "fields": {
        "수익인식(본인 또는 대리인)": 1,
        "채권의 회수가능성 평가": 4,
        "재고자산 평가": 1,
        "매출원가 과소계상": 1,
        "유형자산 등 과대계상": 1,
        "유형자산 손상차손환입": 1,
        "무형자산 과대계상": 2,
        "합병 회계처리": 1,
        "지분법 회계처리와 중소기업특례 적용": 1,
        "지분법 회계처리와 연결재무제표 작성": 1,
        "지분법 회계처리": 1,
        "기타자산 등 과소(과대)계상": 1,
        "반품충당부채": 1,
        "경상연구개발비 인식시기": 1,
        "연결재무제표 작성": 3,
        "임대중인 미분양 건물의 계정분류": 2,
        "특수관계자 거래 주석공시": 1,
        "지급보증 주석공시": 2,
        "자기차입금 담보제공 등 주석공시": 1,
        "외부감사법(독립성의무)위반": 5
      }
    },
    "2025": {
      "total": 48,
      "fields": {
        "공사진행률": 3,
        "수익의 기간귀속": 3,
        "수익·비용 기간귀속": 2,
        "대손충당금": 2,
        "이연법인세, 지분법적용투자주식": 1,
        "이연법인세": 1,
        "파생상품부채": 1,
        "종업원급여": 1,
        "지분법적용투자주식, 자산손상": 1,
        "지분법적용투자주식, 동일지배거래": 1,
        "지분법적용투자주식": 3,
        "지분법적용투자주식, 연결재무제표": 1,
        "연결재무제표": 1,
        "개발비 손상": 1,
        "감가상각, 오류수정": 1,
        "차입원가 자본화": 1,
        "금융상품 계정분류": 1,
        "금융상품 평가": 1,
        "외화환산, 유동·비유동 계정분류": 1,
        "매출채권 및 관계사차입금": 1,
        "대여금 및 선수금": 1,
        "본인·대리인 총액순액": 1,
        "유상사급 총액순액": 1,
        "자산‧부채 상계": 2,
        "유동·비유동 계정분류": 3,
        "특수관계자 거래 주석": 3,
        "특수관계자 거래 주석 기재": 2,
        "담보제공자산": 2,
        "지급보증 등": 1,
        "매출채권에 대한 감사절차 소홀": 1,
        "매출에 대한 감사절차 소홀": 1,
        "외부감사법(감사인 3인참여)위반": 1,
        "외부감사법(독립성의무)위반": 1
      }
    }
  }
}